,screen_name,text,timestamp,tweet_id,cluster_pred
776,asianzing07,Holy Crap!!!  #debates,1474940253754,780582116539019264,3
777,JRaesMom,#debates IF Trump didn't pay FED taxes it is because he is a good business man!  Let him bring the jobs back!,1474940253560,780582115725438976,2
778,FewerHorsesNBay,"When she releases her emails, I'll release tax returns. True story. @realDonaldTrump @HillaryClinton PS I'm poor af… https://t.co/gYrQ9ufsdt",1474940253543,780582115654168576,3
779,ryaningr,Not paying federal taxes makes you smart? #freeloader #debates,1474940253803,780582116744499200,2
780,JonathanRD30,"#Debates
@realDonaldTrump LA MEJOR OPCIÓN PARA USA.",1474940253838,780582116891308032,3
781,jasonylee_,I respect when people are able to admit a mistake. #debates,1474940253797,780582116719407104,0
782,angeelica_f,eu to assistindo esse debate e to agoniada como Trump é ridículo!!! #Debates,1474940253836,780582116883070977,3
783,johnasbury,"Clinton ""I made a mistake using a private email server and I take responsibility for that."" Trump: that's disgraceful #debates",1474940253815,780582116795056128,0
784,colorful_n0mi,Same. https://t.co/Jzq9NvTknz,1474940253845,780582116920745985,3
785,SoyPuri,Trump es un cero. Lindo momento de Ma'am Secretary. #Debates,1474940253693,780582116283322368,3
786,xMattos_,QUE HOMEM (hétero) https://t.co/Rc0j7zDfJm,1474940253813,780582116786573314,3
787,HaleyPassion,Not paying federal income tax is smart? #Debates,1474940254674,780582120397807616,2
788,ThatAliBurke,DISGRACEFUL! BELIEVE ME!  DRINK! #debates,1474940254559,780582119915618304,3
789,YayRobynsHere,"No, T, not paying taxes as a top 1%er makes you a selfish, greedy, lying douchebag #debates",1474940254663,780582120351633410,2
790,Boug_Dinero,This nigga owe a nigga $640 million. A nigga can even buy a pack of gum if he owe me $17.  #Debates,1474940254471,780582119546490880,3
791,Kaydeethree,Good thing I'm not playing a drinking game for the #debates,1474940254576,780582119986884608,3
792,L3ftprincess,Donald Trump definitely reads conspiracy theories #debates,1474940254758,780582120750100481,1
793,45E68,@LesterHoltNBC https://t.co/AyyPll4srn,1474940254536,780582119819075584,3
794,MardiFuller,purposely?? #Debates,1474940254680,780582120422944768,3
795,hannaj35,"This is torture, pure torture. Thanks @nik2847 for making us watch it for hw 🙄 #debates",1474940254611,780582120133693440,3
796,_cawalton,"TAX RETURNS BABY!!
#debatenight #WhereAreYourTaxReturnsDonaldTrump #NEVERTRUMP
#AnswerAQuestionDonaldDuck https://t.co/jbgAsOeD8P",1474940254700,780582120506871808,3
797,Dat_DAM_Dude,😂😂💀💀 https://t.co/7u2PwWPmzT,1474940254518,780582119743614977,3
798,JamesMSama,"""Broad-based, inclusive growth is what we need in America."" - @HillaryClinton #debatenight #debates #Debates2016",1474940254747,780582120704139265,1
799,TheMarilynator,Best line of the night so far! 😂💯 https://t.co/htcQdzXwjB,1474940254676,780582120406159360,3
800,haroldwarner98,I can't help but notice all these little negative footnotes about Trump and it just happens to be aired on Fox. #Debates,1474940254688,780582120456593413,1
801,GusCandle,#Hillary is lecturing us on hiding things #debates,1474940254840,780582121094078464,3
802,HillarySupport,"""It was a mistake and i take responsibility for that"" @HillaryClinton on her emails yet again #debatenight #debates #imwithher",1474940254811,780582120972488705,0
803,MagicFish1990,your email issue  #debates #debatenight #Debates2016  lol,1474940255673,780582124587880448,1
804,zubs40,Who knew Hillary was the funny one of the two  #Debates,1474940255629,780582124403429376,0
805,ashleymaemartin,Watching the #debates is a lot like reading the comments written on a gas station bathroom stall,1474940255571,780582124160217088,3
806,triciafosterr,it would be great if the presidential candidates could respect each other enough to have a real debate. #debates,1474940255662,780582124541861892,3
807,for_hillary,That Trumped up trickle down got him! #unstable #debates,1474940255730,780582124826923008,3
808,jvagle,"Christ, Trump's such an asshole. #debates",1474940255681,780582124621598720,3
809,group_angry,Taking the 5th! Disgraceful! #Debates,1474940255674,780582124592259072,3
810,Kira4141,(Oh please !) Make the good choice USA ! - amen #Debates,1474940255648,780582124483215360,3
811,JLAYFevah,"That makes me smart I don't pay my fair share to the military, teachers, police -- Jaysus #Debates",1474940255767,780582124982108160,2
812,nivxk,RIGHT https://t.co/XsI6hrWcva,1474940255652,780582124499927040,3
813,MrsFrancisWA,Trump says he's smart for not paying taxes? I think I just figured out his tax plans. #debates,1474940255725,780582124806033408,2
814,arlosanders,I'm pretty sure Trump owes money to shirtless Vladimir Putin. #debates,1474940255751,780582124915044352,3
815,mhagamecock,Now he really sounds stupid. Well done @HillaryClinton.  #debates,1474940255639,780582124445429760,3
816,KeishaMonae5921,This debate is like a Rocky movie! Tons of jabs and uppercuts! Waiting for the knockout tonight! #debates #debatenight #Debates2016,1474940255667,780582124562878464,1
817,ZABERX13,"""That makes me smart"" oh that's rich #Debates",1474940255747,780582124898222081,2
818,katherinekiyoko,"This country thinks you're disgraceful, Trump. #debates",1474940255870,780582125414166529,1
819,DonnaYoungDC,".@HillaryClinton: Who does he owe money to? He owes you answers. 
#debates  #debatenight",1474940255807,780582125150019584,1
820,profcstark,"Yeah, he's hiding something. Check out his non-verbals over her claims. He's burning up #Debates",1474940256559,780582128304041986,3
821,imbripolar,.@HillaryClinton's eyeballs must hurt so bad from holding back all the rolls they are holding back. #debatenight #debates #Debates2016,1474940256740,780582129063243777,1
822,urbanmommyinc,Bam!! #whatsHeHiding #donaldtrump #taxes #debates #debatenight #Debates2016 https://t.co/41jXazam7t,1474940256559,780582128304082944,1
823,jtricomi,"@HuffingtonPost you people are ridiculous. Trump said they were ""playing politics"" Also why did you fire David Seaman? #debates",1474940256582,780582128400687106,3
824,Shrek1234567890,#debatenight #debates https://t.co/Cv3tTLmTfQ,1474940256392,780582127603679232,1
825,jebgavin,This man hasn't had a coherent thought in over five minutes of verbal diarrhea. #debates #debatenight,1474940256600,780582128476123136,1
826,BrennaMarie2003,#debates help me what is this country you are all roasting each other that's all this is.,1474940256694,780582128870457344,3
827,oatmealfan,"Eh, I don't really care about the emails, @realDonaldTrump #debates",1474940256682,780582128819933184,3
828,TawneeKendall,"Did Trump just admit to tax fraud?! ""That makes me smart."" #debatenight #debates #drafthousedebates",1474940256750,780582129105113088,2
829,jamesblair1988,"@HillaryClinton you don't take responsibility for a damn thing, ever! #debates",1474940256749,780582129100959744,3
830,JesBWeisenfels,Interjections=muppet heckler. #Debates,1474940256757,780582129134555136,3
831,danteorland,Yep RT @KytheRHOgue: Did he just admit to not paying fed taxes? 👀 #debates,1474940256776,780582129214238720,2
832,CbusPhotog,Precisely my thoughts when I heard this!  #debatenight #debate #politics https://t.co/73tjp2tFIs,1474940256541,780582128228728832,1
833,tanney9,"Ok, on zingers it's 1-1. That was good. https://t.co/zUGSeOOsdc",1474940256637,780582128631345153,3
834,TrumpVsHilary,ILL RELEASE MY TAX RETURNS WHEN CLINTON RELEASES HER 33000 DELETED EMAILS. SAVAGE #trump2016 #debates #debatenight,1474940256779,780582129226903552,3
835,kcsplinter,"Donald Trump is worth more than #HRC ethically, morally and is a truer American than #HRC who lied to Americans #Debates",1474940256657,780582128715173889,3
836,imdaniellebrown,Why is Lester Holt not admonishing Trump for interrupting Hillary Clinton? #debatenight #debates #Debates2016,1474940256853,780582129537196032,1
837,mixdup,I think the biggest thing we need to investigate is Trump's claim Hillary can travel through time https://t.co/lZpuf59DH5,1474940256635,780582128622956544,3
838,wealthofpoverty,"Hey Trump - pipe the hell down, ok there 2 bit?! #debatenight #Debates2016 #debates",1474940257676,780582132989108224,1
839,MontemaranoA,GoTrumpGo!!!!!!! #Debates,1474940257634,780582132812951552,3
840,OurFuture,Biz experience of @realDonaldTrump would leave small business and workers burned #debates https://t.co/XLqhSV8mMj,1474940257566,780582132527734784,3
841,buggsforschools,"An adult takes responsibility for a mess up.

A fool redirects. 

#Debates",1474940257633,780582132808871936,3
842,angiedahurica,Omg https://t.co/1XV2dSYSiY,1474940257530,780582132376829952,3
843,BarrsMatthew,What about those emails?¿That wasn't a mistake and you take responsibility for your lies...#Debates,1474940257580,780582132586573824,0
844,fedingram,Nice run DN on the tax returns @HillaryClinton dude is boiling I love it #debates @AFTunion @NEAToday @BetterschoolsFL @joannefea @laflynt,1474940257711,780582133135974400,3
845,DavidRobert923,She'd do it differently because she got caught  #Debates,1474940257725,780582133194567682,3
846,jake_valencia,I just told @nbcwashington who I think is winning. Cast your vote now! #Debates #NBC4DC https://t.co/f4QrqtkdOH,1474940257645,780582132859146240,3
847,El_Gato__Grande,#debates.....good call https://t.co/xYXEkXSjz7,1474940257474,780582132141916160,3
848,JazminALong,"True leader: acknowledge that you made a mistake, ask for apology, and then move on. Hillary is ready #debates",1474940257462,780582132091682816,0
849,Romesick,"A man who just said not paying taxes makes him ""smart"" just said he thinks emails are disgraceful. Huh. #debates",1474940257234,780582131135283200,2
850,dolansrhythm,GO BERNIE xD #Debates,1474940257791,780582133471514625,3
851,astudentnow,So Trump hates the constitution now? #debates,1474940257864,780582133777653760,3
852,dildo3496,Hillary so full of shit her eyes are brown #Debates,1474940258661,780582137120468996,0
853,norsebastard,What can clinton possibly say about trump owing the people his taxes that can't be said about her emails? #debates,1474940258527,780582136558542850,2
854,melodichandz1,Trump a funny dude😂😂 #Debates,1474940258616,780582136931880960,3
855,EricEDurnan,I'm only watching the #debates to see if Hillary Clinton makes it without coughing or collapsing. Maybe all that rest helped her?,1474940258333,780582135744892928,3
856,MissChloe18,"She takes professional responsibility for her email scandal, but Trump cannot take responsibility for money he owes to businesses #debates",1474940258609,780582136902475777,3
857,Bexarflagger,"Trump, release your tax!  #debates",1474940258689,780582137237950465,3
858,hughburgess,Clinton slays. Shits fired on his personal accounts. Trump be like #Debates #debatenight https://t.co/fiu1ANgYuq,1474940258475,780582136340475909,1
859,melissasib,You have no proof Trump that she did it on purpose you idiot  #debates,1474940258607,780582136894132224,3
860,OnlyHumanAgain,"Trump, the IRS has said repeatedly that there's Nothing stopping you from telling your tax returns while being audited. Just do it! #debates",1474940258610,780582136906645505,2
861,NO_EUSSR_THX,"#DonaldTrump is a real patriot, with every fibre 🇺🇸 #debates",1474940258625,780582136969568257,3
862,KelliJeanSLP,"Trump on paying no federal income tax - ""That makes me smart."" Hmm... I think that seems crooked. #debates",1474940258592,780582136831209474,2
863,EmilyBange,"I don't invest in our country's future, education, or our national security and ""That makes me smart"" #Debates",1474940258658,780582137108062208,2
864,SophieManheimer,"I feel like I’m watching SNL and am waiting for one of them to yell “And live from New York, it’s Saturday Night!”... #Debates",1474940258673,780582137170890752,3
865,wolvzor,Purposely. #WordsWithTrump #debates,1474940258709,780582137321840640,3
866,twat_glitter,Do you want someone with this much emotion near the nuke button?  #debates,1474940258735,780582137430962180,3
867,RavenAlbrecht,"He is so full of bull, he will never release his taxes
 #Debates",1474940258838,780582137862819840,3
868,sagevalentine,He is out of breath and tripping over his words. Smh  #debates #debatenight,1474940258717,780582137355436033,1
869,itz_g_lover,You owe us the answers #Debates,1474940258786,780582137644933121,3
870,heatherdhunter,"@HillaryClinton said (@realDonaldTrump) ""he owes you answers."" Um....tread lightly there ma'am... #debates",1474940258817,780582137774891008,3
871,josetav92,Let's make history and vote for her  #Debates,1474940258795,780582137682472960,3
872,BarbMurphyLeary,#hidingdonald #taxdodger  #debates,1474940259670,780582141352562688,3
873,HockeyFan1972,Lester Holt can't control the people on stage but he admoshes the audience for making noise...classic! #debates,1474940259593,780582141029519360,3
874,cokey318,"Where are IRS audits on #Hilary taxes &amp; audit of #ClintonFoundation ?
Why did Hillary lie about emails - deleted &amp; used bleach-bit. #Debates",1474940259601,780582141063106560,3
875,PW4SP,#VoteTrump2016 #debates https://t.co/j9mzxuzAhx,1474940259529,780582140761157633,3
876,mdrosenow,"On emails, @realDonaldTrump: ""That was more than a mistake. That was done purposely."" #debates",1474940259564,780582140908019712,0
877,tama_knight,Clinton just took responsibility. A concept Trump is obviously ignorant of. #debate #Debates #NeverTrump,1474940259455,780582140450856961,1
878,heiditorralba,"Wanted to watch the #Debates but it sounded more like bickering than an actual debate. With no caffeine in me yet, my system isn't ready.",1474940259702,780582141486694400,1
879,Alexcoulterr,#Debates Hillary be taking those L's,1474940259759,780582141725843456,0
880,a_nichelle,"Relish this moment where Trump is not yelling, instead *sigh* *pursed lips* *side eye* *talk under your breath*. #debatenight #debates",1474940259706,780582141503516672,1
881,sd20dfl,@realDonaldTrump Why won't you release your tax returns? What are you hiding? #debatenight #debates #Debates2016,1474940259658,780582141302153218,3
882,LSKhair,Trump didn't expect her to do that. He's fishing. #debates,1474940259706,780582141503549440,3
883,JessicaClackum,And he's PROUD of not paying federal taxes. What is this asshattery? #debates,1474940259766,780582141755174912,2
884,JackDrees,"Trump is fifth like this: ""fitth."" #debates",1474940259601,780582141063204866,3
885,llowman,Sick of hearing about emails.  #debates,1474940259549,780582140845002752,3
886,theszczzznit,This is not a debate. @HillaryClinton is taking the other candidate to school. #debatenight #debates,1474940259228,780582139498749952,1
887,86Dunford,".realDonaldTrump: ""Why did she delete 33,000 emails?"" #debatenight #debates #Debates2016 https://t.co/0qEagnVyU3",1474940259518,780582140715073536,1
888,TrentSomes,IS THIS THE FIRST TIME SHE HAS APOLOGIZED #debates,1474940259642,780582141235195904,3
889,Payjii,Sick and fucking tired about hearing about emails. There are bigger fucking issues we need to hear about from both sides #Debates,1474940259635,780582141205753856,3
890,AnonymousKnow1,Fif  #Debates,1474940259777,780582141801304065,3
891,Detroitthought,Did Trump just admit to not paying taxes.I'm a small business owner struggling to create jobs and paying my fair share. Is he not?  #Debates,1474940259615,780582141121929216,2
892,jonnporter8661,#Debates https://t.co/3AxMAFPleF,1474940259329,780582139922440192,3
893,AllaineF4F,Maybe I should have tweeted this to Donald too #debates https://t.co/Kovu4S9aeP,1474940260471,780582144712192000,3
894,bonkinator321,This country thinks you're disgraceful @realDonaldTrump #Debates,1474940260704,780582145689432064,1
895,DiarioQro,#debates Voy a dar a conocer mi declaración de impuestos cuando ella de a conocer sus 33 mil emails: #Trump →… https://t.co/nJ6WM1A5OB,1474940260434,780582144557064192,3
896,JoeProwler,I've never heard anyone talk so much and not say anything.  #debates,1474940260666,780582145530167296,3
897,robertdavis5,I'm talking the fif#Debates,1474940260647,780582145450504192,3
898,iitszelix,Trumps a straight savage🔥🔥#Debates,1474940260747,780582145869832196,3
899,VegasSparky357,#debatenight #debates #Debates2016 #Trump #GOP #UnlikelyDebateGuests #PresidentialDebate #AmericaDivided https://t.co/hDRPT7lbW0,1474940260295,780582143974047745,1
900,annsaxtonmurphy,Is Trump hiding something in his tax returns?  Hillary slamming him on that point #OAPolitics #debates,1474940260645,780582145442009089,3
901,BlackTonyDanza,Trump is about to go in... #Debates,1474940260785,780582146029129729,1
902,JoeAnello,Hilary just Scorpion-pulled him into a uppercut on the tax returns. #debates,1474940260771,780582145970483200,3
903,BrendanBeitler,Stop. Fucking. Interrupting. Her. #debates,1474940260708,780582145706385408,1
904,_mateeeooo,Trump is an asshole but at least he real #Debates,1474940260775,780582145987194881,3
905,GeoffTrenchard,"""that makes me smart"" - thing never said by smart people. #debates",1474940260768,780582145958051841,2
906,mamierubottom,Why don't they talk about policy? #Debates,1474940260451,780582144628449282,3
907,MagsNews,Using private emails was a mistake says Hillary.. Trump says disgraceful. He says you don't learn much from tax returns.  #debates,1474940260776,780582145991569408,0
908,HarambeVP,"Second Amendment: Good! Fifth, Bad! #debates #TrumpHarambe2016",1474940260784,780582146025123840,3
909,robbiesdead,She takes responsibility at least. #Debates,1474940260732,780582145806864384,3
910,aaron_beaty,I plead the fifth #debates,1474940260833,780582146230616064,3
911,TheLyricalNerd,He's hiding the $40000 a year he spends on that thing sitting on his head #Debates,1474940260808,780582146125733888,3
912,just_know_that_,Seems to me Lester is one sided.  #debates,1474940260522,780582144926253056,3
913,bimilkkum,Back with dem hands lol #Debates,1474940260755,780582145903304705,3
914,HistoRoundtable,Hey! Snarky comments are my job Donald! #Debates,1474940260826,780582146201092096,3
915,BunBrida,I wish they would just brawl #debates,1474940260788,780582146041720833,3
916,thomasesmith,"Hillary: ""...those show that he didn't pay any federal taxes–""
Donald: ""–THAT MAKES ME SMART!""

UGGGGGGGHHHH #debates #Debates2016",1474940261676,780582149766254592,2
917,sinewyraces,Conspiracy theory: someone back stage is pressing the buzzer on Trump's shock collar to keep him quiet right now. #debates,1474940261693,780582149837598722,1
918,Schwitters_News,#debates Hilly pretty good on the emails. Donny now putting on tinfoil cap.,1474940261640,780582149615394816,3
919,DaringDiego,Who are you for?  #debatenight #debates,1474940261712,780582149917249540,1
920,genophilialove4,You make to many mistakes to be our next president @HillaryClinton #Debates,1474940261601,780582149451837441,1
921,hassan_k82,Trump will shift debate from Tax to emails #Debates,1474940261688,780582149816713217,3
922,matcatastrophe,"""I would do it differently"", she says. Yea, she'd make damn sure no one ever knew about the damn thing. #debates",1474940261704,780582149883691008,3
923,ncrainbowgrrl,Nice. Taking responsibility.  Presidential  #Debates,1474940261692,780582149833560064,3
924,LadyTerralia,I'm hiding under my table until we know whether its America or Donald Trump that's about to blow itself up #kthxbye #debates,1474940261657,780582149686788096,3
925,L_Babenberg,"#Hillary after debating #Trump.

#debatenight #debates https://t.co/LKgyQNHwv9",1474940260687,780582145618313217,1
926,wangenoch1,Hilary is admitting a mistake?!??! #Debates,1474940261725,780582149971779584,0
927,antmay,Are we watching the same debate? https://t.co/kmT3jS7YAk,1474940261595,780582149426597888,3
928,WhatsWrongPeeps,#debates Trump's prior tax returns prove the benefits the wealthy get.  He is not unique.  This is why the rich keep getting richer.,1474940261811,780582150332555265,3
929,HeidiHarrisShow,Wow. Trump has come prepared. #debatenight #debates,1474940261750,780582150076637185,1
930,krashnorris,"Amazed at how much she can recite about his tax returns in previous years...but doesn't know what that small ""c"" means? #debates",1474940261723,780582149963542528,3
931,lilman560,Hillary be like. What emails 🤔🤔 😂😂😂 #debates  #Debates2016 #debatenight https://t.co/ULANupEnb1,1474940261441,780582148780589056,1
932,sneaker_head_3,@kareemmm02 @ToniGriffith112 #Debates,1474940261792,780582150253010944,3
933,MC_Cash75,I'd give anything for a RKO from outta nowhere right now. #Debates,1474940261765,780582150139703300,3
934,joseluisFORAPT,HILLARY É DILMA SIM...TANTO QUE JA ESTÁ ENGANANDO OS BABACAS BRASILEIROS!! #debates,1474940261703,780582149879656448,0
935,TheChevEder,I'm about to turn this off actually #debates,1474940261876,780582150605156352,3
936,SuperVillainMe,And now with the emails. I don't care about taxes and emails. Which of these dummies is going to get rid of daylight savings!  #Debates,1474940261761,780582150122967040,3
937,brandnewflava1,"Clinton sounds programed, she isn't using that womanly instinct to check a man 😂😂😂#DebateNight #debates #Debates2016",1474940261826,780582150395551744,1
938,ngamer87,#Debates  you go Hillary,1474940261835,780582150433189888,0
939,punkjoanofarc,Oh shit! https://t.co/pmfGZNsGlV,1474940261680,780582149783162880,3
940,RightyMarky,WHY WON'T YOU RELEASE YOUR EMAILS?  NATIONAL SECURITY IS NOT EQUAL TO A PRIVATE CITIZEN'S TAXES. #Debates,1474940261856,780582150521417728,3
941,Princepes0015,When do they both get assassinated #Debates,1474940261775,780582150181687297,3
942,dt_joyce,"For the record, I don't care about Mrs. Clinton's emails, and I don't really care about Mr. Trump's tax returns.
#debates",1474940262646,780582153834954752,3
943,Riverboys,Trump calls out Hillary's criminals on taking the 5th on her lying. #debates,1474940262584,780582153574879233,1
944,4FrQ,"Hillary is doing really fantastic job in this debate. She is confident, trustworthy &amp; honest.

#debatenight #debates #USDebate",1474940262588,780582153591595008,1
945,TheRightsWriter,Is Hillary Clinton really slamming Donald Trump for having conflicts of interests with foreign powers?? #debates,1474940262718,780582154136723457,0
946,Fool_4_Music,Trump is SO PISSED off right now. #Debates,1474940262717,780582154132742144,3
947,Michael89Joseph,whaaaaaat? https://t.co/snMBxhyr3c,1474940262670,780582153935552512,3
948,MikeEconomics,"#Debates
Mistake Mistake Bull Shit !!!
#HillaryLies",1474940262747,780582154258509824,0
949,infosubmarine,Clinton disegna un Trump imprenditore criminale. “Non paga tasse federali.” #Debates #SkyConfrontoUSA,1474940262762,780582154321457152,1
950,rockenbacon,sério que tem gente que quer votar nessa cara? #Debates https://t.co/hWxhH97cEw,1474940262541,780582153394479104,3
951,Uber_Huebert,@femfreq Are you watching/did you watch the Presidential debates? #debatenight #debates,1474940262547,780582153419681792,1
952,boissuq,This... https://t.co/r5tlQA0zFq,1474940262684,780582153994108928,3
953,Vote4JillStein1,"Jill:""Full employment through a #GreenNewDeal is the best way to create millions of secure, living-wage jobs. #OccupyTheDebates #debates""- …",1474940262808,780582154514337792,1
954,binkydoormat,"I know loopholes so I won't have to pay taxes. ""That makes me smart."" Vote for me. -- #Trump2016 #Debates",1474940262767,780582154342391808,2
955,RKlepfer,Wow!!!!   Lester.  Please stop the Donald to stop cutting her off.   It's all nonsense.   #Debates,1474940262917,780582154971459585,3
956,MrAlexAlves,🙃 #Debates,1474940262760,780582154313105409,3
957,MC013,HRC take responsibility for emails and trump confused  #Debates,1474940263692,780582158221979648,3
958,NickYoussef,"Literally the rest of the debate should be the question ""Mr. Trump, will you release your taxes?"" until he answers. #Debates",1474940263657,780582158075203584,2
959,madisonjobsx,"Only an idiot would compare Tax Returns to E-mails..
@realDonaldTrump proves he's lost the #debates @HillaryClinton",1474940263596,780582157819387905,3
960,tramine09,Thanks Hilary for at keast addressing the issue. &amp; again here comes the child.  #debates,1474940263723,780582158352064513,3
961,caffiene450,#debatenight #Debates,1474940263683,780582158184382465,1
962,ItsADarcyThing,@jonsteingard I'm one of those people who would vote neither!  #debatenight #debates,1474940263682,780582158180155393,3
963,james_gohagan,#debatenight #debates wtf is she on? https://t.co/Pv8XBB48zY,1474940263221,780582156246462465,1
964,madi_garton,"""I made a mistake using private emails.."" ""That's for sure."" #DebateWithFFL #MakeAmericaGreatAgain #Debates",1474940263817,780582158746345472,0
965,cobaltlion1,Typical liar!! She talks and no action!!!!! #Debates https://t.co/7KjvHu1d4Q,1474940263583,780582157764988928,3
966,ginthegin,"I'll release my tax returns when Hillary releases
 her 33,000 deleted emails! ~ Trump  #Debates2016 https://t.co/JmesdkQIB6",1474940263533,780582157555212289,3
967,debo_oyinda,She handled that well. #Debates,1474940263868,780582158960254976,3
968,PaladinCornelia,"I'm so ashamed of the GOP.
#debatenight  #debates  #Debates2016 https://t.co/p04GX3Rwup",1474940263562,780582157676781569,1
969,stefanie_arroyo,"""You don't learn that much from tax returns, let me tell you"" wait, waaat? #Debates",1474940263840,780582158842925056,3
970,Uncanny390,That is the best Clinton can do with the email issue. There is no explaining it away #debates,1474940263799,780582158670897152,1
971,SoryApodaca,😂😂😂 https://t.co/JZ4McxAXdd,1474940263752,780582158473670656,3
972,MrFantastic8000,Trump seems so unpolished and ignorant. He can't seem 2 stay on topic and formulate rebuttals w/o becoming furious 😂 #debates #debatenight,1474940264529,780582161732759557,1
