,screen_name,text,timestamp,tweet_id,cluster_pred
198,godof2ndchance,waiting for hillary and donald to just start swinging fists. #debates,1474939642615,780579553236385793,3
199,SimiHaseeb,Hillary clobber trump! Orange gibberish-ranting orange bafoon! #debates,1474939642264,780579551764213764,3
200,jakedaddio13,"#Debates ""check the fact checkers""- Hillary.",1474939642714,780579553651617792,3
201,KarlintheMornin,Go #America #debates #debatenight,1474939642341,780579552087146496,1
202,Aaliyah31560559,Dude is he on coke !?!?! #Debates,1474939642702,780579553601261568,3
203,hgray1995,How is this man not on stage tonight???????? #LetGaryDebate #endthetwopartysystem #NeverHillaryOrTrump https://t.co/8HrQWBMtii,1474939642551,780579552967860224,3
204,Matthewburt_,Jesus. #debates #ImWithHer I'm too logical. Hope there is millions more who are logical but I doubt it. #electionarmageddon,1474939642725,780579553697681408,3
205,CannedAnimation,this will be the end of us #debates,1474939642721,780579553680977920,3
206,BlackManTrump,"WayneDupreeShow: Trump is cleaning Hillary's clock on NAFTA and just called her out on TPP

#Debates2016 #debates #debateNight #TrumpIsBlac…",1474939642600,780579553173438464,3
207,Rantaramic,Did Gen. Douglas MacArthur didn't have a website? #debatenight #debates,1474939642771,780579553890611201,2
208,marilock,This split screen tho...#Debates2016 #debatenight #Debates https://t.co/of4fLvcZ6M,1474939641918,780579550312869888,1
209,imdelmonaco,ok wasn't macarthur in ww2 or am i tripping #debates,1474939642697,780579553580294144,1
210,glitzyhive,"this goddamn manbaby 💀 but women are too emotional to be president, right? #debates",1474939642777,780579553915920384,3
211,j4hawg,Lester's already lost control. smh #Debates,1474939642852,780579554230280192,2
212,EBentzel,The debate Is getting heated #debates,1474939642809,780579554050072578,1
213,DeitschFactor,"#Debates Look, @realDonaldTrump, taxes are more complicated than that. You don't care to pay them, maybe. But there are brackets and reason.",1474939643679,780579557698998273,1
214,moner970,ترمب جلد للعبره #Debates,1474939643679,780579557699182592,3
215,QueenOfRats,Trump just said that HRC has been fighting ISIS for her entire adult life. ISIS was founded in 1999. #debates,1474939643689,780579557740912640,0
216,cprang32,This is very entertaining #debates,1474939643661,780579557623664641,1
217,kennedyshayna,"""fighting ISIS your entire adult life"" WOW um WTF #debates",1474939643747,780579557984219136,0
218,l_hallman,"Listen, Lester. I love to watch all 48 Hours repeats. But you gotta take control. Where's Anderson at? #Debates2016 #debates #ordavidmuir",1474939643600,780579557367775232,2
219,ChrisDillion,.@realDonaldTrump is pro-tremendous jobs. #debates #jobs,1474939643577,780579557271281666,1
220,whosiewhatsi,Can the moderator please step in #debates,1474939643516,780579557015482368,2
221,PlowPlot,#debates #debatenight @HillaryClinton says her opponent is claiming she is lying. Her defense is go to my web page where I can lie to you?,1474939643777,780579558110093312,3
222,iLikeBeinAlone,Did he just send people to her website?  #debates,1474939643682,780579557711634432,2
223,ElizaIsTaken,"""No wonder you've been fighting ISIS your entire adult life."" 
-Trump.

SAVAGE.  #Debates",1474939643661,780579557623664640,0
224,Waynetronics,He speaks fluent Merican https://t.co/zm5sZPDcPr,1474939643737,780579557942304768,3
225,MeganRoemmele,"More wine, please #Debates",1474939643532,780579557082411008,3
226,JesssieWoo,All I see when he speaks #Debates https://t.co/4jAnZ6rTC4,1474939643697,780579557774614530,3
227,enda_isfj,Clinton uses facts and Trump uses...adjectives.  #debates,1474939643675,780579557682270208,3
228,Heminator,Oof. https://t.co/u4c90LLR3L,1474939643489,780579556902207489,1
229,Manish_05Singh,"#debatenight #debates #Debates2016 
and a pink pony for everyone",1474939643768,780579558072389634,1
230,AllaineF4F,"Ironically Trump complains about American jobs fleeing to Mexico on the one hand, and Mexicans fleeing to America on the other #debates",1474939643743,780579557967400960,1
231,nikiverse,Trump drank water first! #debates,1474939643762,780579558047096832,3
232,ebivyelah,"Even better drinking game, take a shot every time you see a tweet with the tags #debates #Debates2016 #debatenight",1474939643810,780579558248415232,1
233,oliviaboorom,"Well, you lost it Lester. #debates",1474939643788,780579558156230656,2
234,SecretaryStreep,HAHAHAHAHA  #Debates,1474939643861,780579558462337024,3
235,diamonddeposits,#debates is it the ghost of Steve Jobs?,1474939644661,780579561817858050,2
236,TripBreaker,I would have had a fuckin' air horn. #debates #debatenight,1474939644680,780579561897472000,1
237,askmattchun,"When she said ""gaze"" she really meant ""gays"" 😉 #Debates2016 #debates #ImWithHer",1474939644716,780579562048454656,3
238,cpmorris1001,#debates you go girl   Fact check. Score Hillary,1474939644617,780579561633226752,3
239,mycocoabubbles,Where is the fact checking... #Debates,1474939644728,780579562098786304,1
240,StrtSmrtBonnie,Lester? #DEBATES #debatenight #cbsnreax #PresidentialDebate,1474939644671,780579561859866624,2
241,ajaquadmom,Oh man. This is going to be good #debates,1474939644628,780579561679486976,2
242,Jackk_Attack,.....is this an episode of SNL?? Seriously. This CANNOT be a presidential debate!! #Debates,1474939644645,780579561750814721,3
243,theoriginalacw,Do people really think Donald Trump looks strong and prepared? #debatenight #debates,1474939644617,780579561633374212,2
244,itsAmeAnthony,I think Lester can go home now. #debates,1474939644677,780579561885040642,2
245,AylaRanzz,I feel like I'm watching a @nbcsnl skit #Debates,1474939644664,780579561830506496,3
246,AwakeDeborah,#Debates2016 #debates #debatenight * https://t.co/tXuvi87gD9,1474939644630,780579561687900161,1
247,MickiMaynard,We don't need training. #debates https://t.co/Jjx5KWYZuz,1474939644436,780579560874278912,1
248,lyleedwards,"#debates Trump: Hillary, you have been fighting ISIS your entire adult life!",1474939644419,780579560802967552,0
249,liammmunro,"trump: ""I will create jobs. Here looks at this graph proving I'm right"" #debates https://t.co/Z4IGn0FF42",1474939644115,780579559527763968,1
250,TheBenznDEN,@BretBaier @HillaryClinton @realDonaldTrump Lester is losing control #Debates,1474939644811,780579562446913536,2
251,86Dunford,".realDonaldTrump: ""No wonder you've been fighting ISIS your entire adult life."" #debatenight #debates https://t.co/9uzLkN8FX8",1474939644723,780579562077978626,0
252,kahuku,Dude! ISIS is only a 2 maybe 3 years old.  #debatenight #PresidentialDebate #Debates,1474939644760,780579562233077760,3
253,cyberkingtm,Hillary Clinton has reprogrammed herself to smile instead of scream in rage. #debates,1474939644666,780579561838899202,1
254,MusicallyDeVine,What does that even mean 😂😂😂 https://t.co/SNHTEsiMfQ,1474939644552,780579561360809989,3
255,bradleyboy,Lester Holt rn  #Debates https://t.co/oraXfBHFip,1474939644524,780579561243287552,2
256,Antiunnegative,Did Hilary just advertise her website for fact checking #debates #debatenight #Debates2016  #debate?,1474939644609,780579561599803392,1
257,klmccauliff,"absolutely love the website fact checking because then it removes the need for HRC to be ""angry"" and ""shrill."" #teamrhetoric #debates",1474939644671,780579561859870720,3
258,arcarboni,They took our jobs #debatenight #Debates2016 #debates  https://t.co/AMsk39b6Na,1474939645674,780579566066675712,1
259,awkwardstickman,"I'm checking Donald Trump's website, but it appears to be down. #Debates",1474939645735,780579566322458624,3
260,MollyEngels,If I ever say working with K-2 kids is hard I stand corrected because I would never want to be this moderator #Debates,1474939645550,780579565546733572,3
261,WTFitsJ,Oh watching on Twitter is pretty cool #Debates,1474939645721,780579566263803904,3
262,SweetMissMomo,Did Trump take debating from Real Housewives shows? #debates #Debates2016,1474939645745,780579566364393472,3
263,AllwineAlison,"OMG, amazing. #debatenight #debates #ImWithHer https://t.co/ywLvyK8gy1",1474939645410,780579564959375361,1
264,cyberkingtm,"However this election pans out, it'll be a win for blondes. #debates",1474939645626,780579565865426944,3
265,ypena023,"#BloombergPolitics is fact checking #debates  #hofdebate16 
Still no discussion on #SocialSecurity #TakeAStand",1474939645627,780579565869543424,1
266,mslovejones,I need #lesterholt to man up. #Debates,1474939645705,780579566196842496,3
267,debiecrutcher,The wealthy pay more than their fair share #Debates,1474939645771,780579566473531392,1
268,Ezekielion_,This is a juicy debate  #Debates,1474939645814,780579566653845505,3
269,jettwalker,#goodjob #bravo #womancard #yougogirl @maddow @MSNBC  https://t.co/mkZdoOwza9,1474939645473,780579565223550978,1
270,DreeZiegs,The web person in me is just praying her website doesn't crash right now. https://t.co/DnocMUvhMX #debates,1474939645627,780579565869694976,3
271,TravisClyde,I'm just waiting for donald to call her a c**t #debates,1474939645695,780579566154842112,3
272,rachelshairplus,"""Fact check: Trumps website is not currently a website"" #debatenight #debates",1474939645713,780579566230265856,3
273,played_straight,"Douglas MacArthur would ask what the hell a website is, Donald. #debates",1474939645662,780579566016458752,3
274,gypsygirl91,Oh Yes Please go to the fact checkers! #debates,1474939645617,780579565827723265,2
275,JediMindTrik,Drumf claims Hillary has been been fighting ISIS her whole adult life.  I though ISIS was like 3 years old. #Debates,1474939645812,780579566645424128,0
276,vikrosen,Where is the fact checking? I’m watching it on Bloomberg TV because they said they’d be fact-checking live.  @bpolitics? #debates,1474939645644,780579565940903938,1
277,jessiebowers911,".realDonaldTrump to HillaryClinton: ""Secretary, you have no plan!"" #debatenight #debates #Debates2016 https://t.co/vaoCkLF2OT",1474939645780,780579566511415296,1
278,blobert,"If the wealthy are going to ""create all the really terrific jobs"" why aren't they doing it now?
#debates",1474939645789,780579566548951041,1
279,_eveeelyynn,This is hilarious  #Debates,1474939646697,780579570357456896,3
280,ScottNover,"Well, no. #MFDebates https://t.co/XJ9oE3c3eP",1474939646491,780579569493508096,1
281,Echegaray,All she needs to do is stay pleasant and smart and not stoop to his level PLEASE OH PLEASE #debates,1474939646602,780579569958912000,2
282,missfruitfly,We're all going to need a hug after this #Debates,1474939646702,780579570378350592,1
283,MarloFlanagan,"@realDonaldTrump  is showing his ass, as usual.  #debates",1474939646706,780579570395193345,3
284,galliee13,I'm getting second hand embarrassment from the shade they're trying to throw at each other #Debates,1474939646707,780579570399543297,3
285,BeBeZoey,"#debatenight #debates  #Lester !!  Only 25 min in , those fact checker guys get veryyyy busy!!",1474939646661,780579570206375936,2
286,KiansQuiff_,"Please someone make a count on how much ""Fact Checker"" is said in this live debate.  #Debates",1474939646588,780579569900421122,3
287,damani,Americans are really considering voting for a 8 year old bully. This is farcical. I'm done tweeting. #debates,1474939646550,780579569740943360,3
288,TrumpGirl92,Has Hillary been drinking?! Omg. 😳 #Debates #DebateNight,1474939646733,780579570508443648,3
289,aaronloeb,"""No wonder you've been fighting ISIS your entire adult life."" Watergate was about ISIS. You heard it here first! #Debates",1474939646660,780579570202316802,0
290,fancymethis,"Trump talking about trickle down, w/out the taboo of saying ""trickle down."" #debates",1474939646715,780579570432872449,3
291,_YasminFarah,gotta give that self promo on your book 😂#debates,1474939646662,780579570210770944,3
292,pcyarp,"Metro_TV: Clinton: AS akan menjadi negara yg mampu memberi penghasilan lebih utk rakyatnya lewat investasi, bukan pemotongan pajak #Debates…",1474939646771,780579570667827200,1
293,ry83,This is like that first bite of cookie dough ice cream #debatenight #debates,1474939646191,780579568235192321,3
294,Kuqezi14,If we can bail out wall street we can bail out students https://t.co/ofdwKalWDh,1474939646791,780579570751713280,3
295,1life2livetalk,Hillary's been fighting ISIS her entire life? #debates,1474939646743,780579570550472704,0
296,The_Hot_End,LOL Hillary is getting owned by @realDonaldTrump in the #debates She is such a freakin slimebag,1474939646843,780579570969812992,3
297,HideChewer,#RapistBill https://t.co/PtblFFhk7M,1474939646700,780579570369961984,3
298,aliyatlecky,"Fam, where are you at tonight. HRC is kicking DJT as$!!! #debates #debatenight",1474939647587,780579574090346496,0
299,LeScriz,The wealthy create jobs. Because automation isn't real. #debates,1474939647693,780579574535061504,1
300,ScottMcCarty,@HillaryClinton looks like a President. Donald is drowning. Rude and disrespectful #debates,1474939647625,780579574249914368,3
301,Maebaby1211,Cut his Mike off when he goes on a tangent. Big bully #debatenight #debates2016 #debates,1474939647704,780579574581035008,3
302,_h0ffm4nn_,"Lester, please pause the debate so you can find your balls and stop letting Trump railroad you. #Debates #2016debates",1474939647716,780579574631559169,2
303,eric_mccorkle,"Hillary's adult life goes back 40 years (maybe more), ISIS was formed in 2005 (or thereabouts) #Debates",1474939647338,780579573046149122,0
304,uptownandout,"If anyone has a pic of teenage Hillary fighting ISIS, I wanna see it. #debates",1474939647499,780579573721423874,0
305,kristieLowe_,"I swear if Donald Trump can't do nothing else, one thing he can do is make me laugh my ass off. #debates #debatenight",1474939647787,780579574929162241,3
306,ErikBurton,Trump is talking about the middle class....I bet he thinks the middle class has 5 houses and not 10. #RealityCheck #debates,1474939647671,780579574442786816,1
307,pagandancer,And there we go.. Trump starts in with his bully boy tactics.  #debates #TrumpedUpTrickledown,1474939647589,780579574098780160,3
308,AlexjJensen,C'mon @LesterHoltNBC ! Drop the hammer! I'm gonna have an aneurysm if the bickering persists #debates,1474939647702,780579574572654593,3
309,mslissap,@GovGaryJohnson @HillaryClinton @realDonaldTrump Gary will balance the budget! #WhereIsGary #DebateNight #debates #LetGaryDebate,1474939647704,780579574581166081,3
310,FigurinOutLife,Presidential #debates ➡➡ complete shitshow #youbothsuck,1474939647698,780579574556061696,3
311,TheMentaLife,Donald Trump is a comedian bro. This dude is not a president. He just uses mad adjectives and power in tone. Are you serious? #Debates,1474939647753,780579574786711553,3
312,cgibson61,Oh my God. Hillary is amazing! #ImWithHer  #Debates,1474939647832,780579575118041088,2
313,damnitdanny__,TRUMP SHUT THE FUCK UP READ A BOOK. TRICKLE DOWN FUCKERY DOES NOT WORK!!!!!!!!! IT IS NOT GOOD FOR MIDDLE CLASS PEOPLE OMFG #Debates,1474939648663,780579578603372544,3
314,sethbringman,"""The wealthy are going to create tremendous jobs."" --Trump. Kind of like Trump created jobs in Vietnam and Mexico. #debates",1474939648726,780579578867691520,1
315,MrRichardPaul,"#Debates @HillaryClinton website is chalk full of 8 years of Obama ""policy papers"".",1474939648660,780579578590863360,1
316,thekidriss,Lmaooooooooooooo #Debates,1474939648686,780579578700062721,3
317,kinoptika,"""End of story"" Then Donald Trump launches nuclear attack. That's how Trump deal with crisis
#debatenight #debates #Debates2016
#TrumpReality",1474939648679,780579578670526464,3
318,rightvoicenow,"Watch #Debates2016
LIVE HERE IN HD:
https://t.co/9wfz1qvQBF  
THIS IS AMAZING!!!!!
@realDonaldTrump Is SAVAGING @HillaryClinton 
#debates",1474939648503,780579577932414980,1
319,dufus,"If the wealthy created jobs, everyone would have one jackass. #debates #debatenight GREED KILLS DONNY",1474939648742,780579578934796289,1
320,jessiebowers911,".realDonaldTrump: ""No wonder you've been fighting ISIS your entire adult life."" #debatenight #debates https://t.co/vSZX8zVT1g",1474939648523,780579578016333824,0
321,LilyMeade,"""You've been fighting ISIS your entire adult life?"" LOL, wth? #Debates",1474939648706,780579578783735808,0
322,thecspot,Can the moderator actually moderate for a change good god bunch of sissies #debates,1474939648757,780579578997714945,2
323,ashantesanders,Guys ISIS has been around since before I was born according to Trump 😳#whoknew #debates,1474939648508,780579577953411072,1
324,WillDynamiteLee,We've been fighting ISIS for 50 years? #debates #TrumpFiction 😂😂😂,1474939648732,780579578892865538,0
325,trendoid,Trump is bringing out his inner Perot. #CanIFinish #debates,1474939648780,780579579094118400,3
326,NolandTreva,".HillaryClinton: ""We can build a new modern electric grid. That's a lot of jobs."" #debatenight #debates… https://t.co/5lqXCTikFh",1474939648726,780579578867773444,1
327,jfvella,Is this debate airing on @ComedyCentral #debates,1474939648864,780579579446517761,2
328,KatieLobrot,"Trump - ""you don't have a plan!""
Clinton - ""I do. I wrote a book about it. "" #debates https://t.co/KxyxL2ySye",1474939648716,780579578825756673,3
329,meaganmariee,How are the majority of Americans suppose to make heads or tails of this debate? I want them to speak in terms I can understand #debates  󾌽,1474939648719,780579578838253568,3
330,Draco_79,#Debates2016 #Debates https://t.co/EmHYmGi5mj,1474939648595,780579578318352384,1
331,Dmony4u,Hillary Clinton's Website: https://t.co/1olX3qYRVQ #debates,1474939649675,780579582848094209,3
332,JustHillbilly,Bernie- what r u doing catting her suitcases now ? Because u dropped your people. https://t.co/4UJGr06C0c,1474939649588,780579582483107840,3
333,infosubmarine,“Major jobs” (salutes) #SkyConfrontoUSA #Debates,1474939649595,780579582512656385,2
334,mtbDJC,"Must see TV. Lots of thunder, very little substance #Debates",1474939649498,780579582105755648,2
335,kellyrfeller,I can't even access https://t.co/H6Djsqal3j his tech infrastructure is so crappy.  #debates,1474939649708,780579582986498049,1
336,a_malensek,"Niemand mehr kann Hillary vorwerfen, dass sie nicht genug lächelt.  #Debates #debatenight",1474939649611,780579582579732481,3
337,Bdrama_1,Trump is so use to talking he doesn't know how to listen #Debates,1474939649426,780579581803819008,3
338,sandyowoo13,TRUMP BODY SLAMING THE BEAST #Trump2016 #Debates #lovingTrump,1474939649582,780579582458093568,3
339,mdnorris1962,Trump is acting like a drunk at a bar.  The one who speaks the loudest doesn't automatically win.   #Debates,1474939649663,780579582797766657,3
340,NicholasPell,"He's saying ""big league"" you fucking half wit. https://t.co/Hkg1GM1TGN",1474939649677,780579582856486914,3
341,kate_kansascity,@mikewickett #debates https://t.co/AeL0r5dmJA,1474939649511,780579582160146432,1
342,catsntigers1,Anus- mouth is loosing it #Debates,1474939649640,780579582701436929,2
343,TWill876,Fact Checkers!!!! Roll out!!! #Debates https://t.co/kqy0nXys8n,1474939649527,780579582227259392,1
344,WarpdElfAtYrSvc,"""@KeithOlbermann: Drinking game: one, every time he sniffs take a.... (UNCONSCIOUS)""
#debates  #Debates2016",1474939649678,780579582860636160,1
345,lisacthomson,"""No wonder you’ve been fighting ISIS your entire adult life"" -@realDonaldTrump - not possible #CUNYJvote16 #debates",1474939649621,780579582621716480,0
346,SDSunchaser,"Can someone whisper in Trumps ear that ""BIGLY"" is not a word. #Debates",1474939649751,780579583166849024,2
347,XyZerda,A PRESIDENTIAL LEVEL SHIT STORM #Debates,1474939649718,780579583028563968,3
348,marinecathedral,Hillary looks like the store was supposed to close twenty minutes ago and there's somebody Just Looking for the last half hour #Debates,1474939649778,780579583280029697,3
349,BigHeadCedd,What is the point of the moderator? #Debates,1474939649711,780579582999162881,3
350,CosetteGirardot,"""We're unpacking a lot here"" aka ""no. Really. Kids. Please settle down. For the love of God.""  #Debates",1474939649723,780579583049379840,2
351,Chesterhyde,Dividends?   So you can tax that also? https://t.co/tKGG2lMdhZ,1474939650530,780579586434142208,1
352,AriaaJaeger,@realDonaldTrump  is converting to infantile speech. He has such a #bigly command of the English language #Debates2016 #debates,1474939650695,780579587126284289,2
353,Ferdinand_Kira,La mejor estrategia de un debate en sí no es exponer las ideas....nunca dejes exponer la ideas de tu contrincante-.  #debates,1474939650655,780579586958499840,3
354,unknownbait,ITS GETTING HYPE #debates https://t.co/Kfwuaw5Agr,1474939650358,780579585712726016,1
355,callmechris415,"LESTER! YOU ARE THE MODERATOR! STOP GETTING WALKED OVER! 

#debates",1474939650764,780579587415650304,2
356,fitnessbethyost,Unhinged trump seems so presidential... #debates,1474939650698,780579587138916353,3
357,brittney051888,I think the ONLY thing anyone is going to be able to agree on tonight is how Lester drew the short straw to get this gig. #poorguy #debates,1474939650667,780579587008913409,2
358,ACBome,Carried interest as a middle class benefit? #Debates,1474939650624,780579586828558336,1
359,nlovin,The moderator should have mic-cutting privileges. #debates #debatenight,1474939650446,780579586081951745,3
360,JanieGra1,"Dear presidential candidates, stop repeated the same thing over and over again and get a better argument #Debates",1474939650730,780579587273191424,3
361,KeyshaMaree_,I need a damn drink. This is stressing me out. #Debates,1474939650772,780579587449237504,2
362,CarolDawn04,What a bully!!! #debates how can the polls be a dead heat????,1474939650776,780579587465949184,3
363,yalginia,American presidential #debates. What a circus.,1474939650737,780579587302404096,1
364,bell_taj,Then his ass up there sniffing.. https://t.co/livoOJCDoo,1474939650685,780579587084267520,1
365,I_am_Bethany,"Did that idiot say ""bigly""? #debates",1474939650791,780579587528859648,2
366,alecr66,tump is a huge bully and is looking like nothing more #Debates,1474939650786,780579587508015104,3
367,Nancy22197,Go Trump we want jobs! https://t.co/RR0v4uxLbP,1474939650809,780579587604422656,3
368,JoeyBeansSan,#ShowMeTheTrumpFax2016 #debates,1474939650696,780579587130593280,3
369,Steph_Atlanta,So true...30 years of failures... https://t.co/9CQoxZ6WzQ,1474939650689,780579587101224961,1
370,Sweetdee273,"Is this a debate or an argument? Lester Holt, shut it down! #debates",1474939651670,780579591215652864,2
371,MikeDollaway,#debates hey @BeauWillimon was @HouseofCards based on the Clinton's? https://t.co/cuTs5XT9Pj,1474939651560,780579590754402304,1
372,HeberLinares,"Waiting for the crowd to start yelling ""Jerry! Jerry! Jerry!""   
#DebateNight #Debates",1474939651685,780579591278559232,1
373,UAintWorkin,Whats on the History channel?  #Debates,1474939651662,780579591182245888,1
374,pastors_child,@PolitiFact is great when it comes to checking the facts for the #debates check it out and check the facts. For both candidates.,1474939651329,780579589785616385,1
375,laurenhtexas,Told y'all Trump was gonna act like this. You cannot change a 70 year old man's personality/behavior. That's who he is. #debates,1474939651704,780579591358287872,3
376,BeerGagMe,Hillary Clinton has reprogrammed herself to smile instead of scream in rage. #debates (via… https://t.co/hcyRsn1LQ3) https://t.co/YHaf7wKKku,1474939651328,780579589781327872,1
377,JaimieKincheloe,".HillaryClinton: ""We can build a new modern electric grid. That's a lot of jobs."" #debatenight #debates… https://t.co/PFhNptfjGu",1474939651670,780579591215800320,1
378,kachristo,"Come on, @LesterHoltNBC, don't let Mr. Inarticulate steamroll you with this blathering.  Hillary shines! #debates #HillaryClinton #CNN",1474939650634,780579586870353920,1
379,pjcapello,Trump's reality is not REALITY. Know that. #ImWithHer #Debates,1474939651573,780579590808928256,3
380,manaltweets,#Debates https://t.co/2SURcDZ3VL,1474939651369,780579589953359873,1
381,mkfers,I'm scared.  These 2 candidates are jokers #Debates,1474939651645,780579591110791168,1
382,TeeChip_USA,".HillaryClinton: ""We can build a new modern electric grid. That's a lot of jobs."" #debatenight #debates… https://t.co/RMDbSvFRvF",1474939651653,780579591144534016,1
383,DinkyShop,Drumpf is already a yelling maniac. He sounds like he's 12yo. #debates #debatenight #debates2016 DT says the wealthy will save nation,1474939651729,780579591463194626,1
384,DiamondElease,Trump thinks as business man who always works for interest of HIS business. Not as a political leader who has to think of everyone #debates,1474939651769,780579591630880768,3
385,relientkenny,Obama like that senior who's about to graduate in a month #debates #debatenight https://t.co/dUdLVkGkKt,1474939651503,780579590515359744,1
386,MindOfLuvzee,This is the funniest thing ever #debates,1474939652636,780579595267502081,3
387,NolandTreva,".realDonaldTrump: ""No wonder you've been fighting ISIS your entire adult life."" #debatenight #debates https://t.co/hzG1FtuJly",1474939652573,780579595003301892,0
388,PabloPistachio2,Trump's going to have to go toidy if he keeps drinking that water.  Men his age need to pee every 10 minutes. #debates,1474939652631,780579595246379009,1
389,BeingLiam,Props to @LesterHoltNBC for not laughing or yelling yet #SyrRelPol #debates,1474939652518,780579594772570112,3
390,bbelding,Mark Richt lost control of the debate already. #GoDawgs /cc @Ludakit @sminster10 @brretterr @MatthewDibling https://t.co/o1tSNwvNWx,1474939652686,780579595477131264,1
391,js31_,I just told @nbcwashington who I think is winning. Cast your vote now! #Debates #NBC4DC https://t.co/IqNnJuQ2kg,1474939652581,780579595036790784,3
392,mnnthn,Jeez. This is off the rails TV. #debates,1474939652753,780579595758084101,1
393,aniyaamone,All he talks about are the wealthy  #Debates,1474939652678,780579595443662848,1
