,screen_name,text,timestamp,tweet_id,cluster_pred
0,bennettinsure,Lester are you still there? #Debates,1474939871663,780580513933250560,1
1,ChrissysBlog,@LoriSums Trump outsources all his companies to China. This fool needs a mirror Hypocrite! Trump  your companies left dummy #debates   💸💡,1474939871623,780580513765584897,1
2,KNOWMELUVEME,This is embarrassing. We're only 30 minutes in. #debates,1474939871718,780580514164043778,1
3,debroopsengupta,"Watch live! ""U.S. Presidential Debates"" #Debates https://t.co/s0rBLLaCtg",1474939871722,780580514180792320,1
4,christheseltine,Presidential debate 2016 classified under comedy #Debates,1474939871639,780580513832665088,1
5,RevPokemon,"@sfliberty trickledown is whatever @TheDemocrats do not like regardless!!!
#debatenight #debates",1474939871672,780580513970925568,1
6,rosygIow,"is he talking about himself lol
""all talk""
""never gonna happen"" 
#debates",1474939871756,780580514323464192,1
7,Hawk_Hopper,"#debates Increase taxes on politicians, bureaucrats, prosecutors, judges, etc.",1474939871815,780580514570772480,1
8,jburne20,"Hillary the truest American, began fighting ISIS fresh at 18 #debates https://t.co/sfsTJUtUwl",1474939871621,780580513757143041,1
9,LitsaDremousis,"To the degree he had any shit left, he's totally losing it. #debates #debatenight #Debates2016 #ImWithHer",1474939871828,780580514625298432,1
10,phillydanh,'Big fat ugly bubble' #debates,1474939871875,780580514822393857,0
11,iambryanmckenna,its weird but ive never gotten out of the recession. #debatenight #debates,1474939871593,780580513639723008,1
12,adamhsamuel,I hope they snap and just start making out on stage. #debatenight #debates #Debates2016,1474939871811,780580514554150912,1
13,zimbatsu,"Really though. Mics should only be live for the allotted time. You don't even need tech, have #Harambe in a booth with switches. #debates",1474939872658,780580518106726401,1
14,ocwavesnet,Yawn. Big waste o' time. Two people saying nothing loudly &amp; pandering to their voters. Would've been great to see 2 more on stage. #debates,1474939872495,780580517423026177,1
15,_mvson,"👏🏾""Making college debt free"" #Debates",1474939872769,780580518572072960,1
16,micastark,Hello? Lester? You there? #debates,1474939872732,780580518416875520,1
17,Vanasdalan,Thank goodness for the Watch @ESPN app. Making the #debates tolerable. We got a good game going. #ATLvsNO,1474939872710,780580518324604929,1
18,VidesCh,I don't see a smart presidential candidate here  #Debates,1474939872791,780580518664376320,1
19,WendyWarren,My Twitter feed is literally nothing but #debates and really awkward sponsored brand posts.,1474939872625,780580517968224256,1
20,PerezRdz550,Si gana trum .usa se va para abajo #Debates,1474939872793,780580518672773120,1
21,PatrickHolmanUT,"Seemingly absent from the debate, @LesterHoltNBC isn't doing a good job of reeling in rebuttal and conversation. Disappointing. #debates",1474939872733,780580518421204992,1
22,aiirhead_,"""Broad-based inclusive growth."" Thank you Hillary.   #Debates",1474939872732,780580518417096704,1
23,emilyr0es,You're a fat ugly bubble #debates,1474939872759,780580518530351104,0
24,ysogano,l #Debates,1474939872905,780580519142490112,1
25,woodybepierced,Enjoying what #GaryJohnson is saying. #Debates https://t.co/alWEYhFHt6,1474939872235,780580516332445696,1
26,cwilson3124,Being defensive in a debate is a losing strategy.  #debates,1474939872926,780580519230644225,1
27,dougd517,"@HillaryClinton is dead wrong with taxing the rich more, who's gonna pay 4 free tuition @HillaryClinton ? #debatenight #debates",1474939873670,780580522351206400,1
28,JovannyDA127,Go Trump  #Debates,1474939873729,780580522598670336,0
29,ValMapAck,Pandering Clinton. No smart person believes she means it. #debates #VoteGreen #SteinBaraka,1474939873643,780580522238025732,1
30,itsyuribro,Trump just described himself #Debates,1474939873735,780580522623918080,1
31,pfunklightz,#LetGaryDebate  this is tough to watch #debates,1474939873641,780580522229633024,1
32,DMCrab,Here's your sign: Clinton opens with equality and Trump opens by blaming Mexico. #debates,1474939873694,780580522451951616,1
33,EzraWilli,She's coming off so practiced!!! I just want her to say some real shit 1x https://t.co/pvTRC8OpxJ,1474939873683,780580522405818372,1
34,Rahkyt,"#debates Neither Clinton nor Trump is game to talk abou tthe biggest active ""trade... https://t.co/V6078xBZLe by @wikileaks via @c0nvey",1474939872934,780580519264260096,1
35,Jpendle2,#debates. I AM the middle class and this debate is just Pissing me off.,1474939873798,780580522888011776,1
36,LisasLexicon,"I gotta say, @HillaryClinton must have debate prepped standing in front of a pitching machine at the batting cages #Debates2016 #debates",1474939873812,780580522946801664,1
37,davrone86,"Jobs grow for six years, but we're in trouble? #Debates",1474939873840,780580523064238080,1
38,taitovakavula,What happened to the sliding bar on the #debates ?,1474939873775,780580522791694340,1
39,CoolChopy,Trump enjoys interrupting people #Debates,1474939873873,780580523202621442,1
40,GinaLeeMuller2,Clinton trying to distract media from her wealth and foundation #Debates,1474939873821,780580522984607746,1
41,_3CommandStart,Keep your cool madam Clinton #Debates,1474939873801,780580522900725760,1
42,strormin_norman,This debate should be settled with 2 flintlock pistols and 10 paces #debates #PresidentialDebate,1474939873850,780580523106111488,1
43,MNToure,"TRUMP! TRUMP!! TRUMP!!! 
Yap.         Yap.        Yap. 
No substance...
Whining whimsical fuss!
Good night 😴 #Debates",1474939873728,780580522594533376,1
44,MyNiggaPolo,"Hilary sounds good, if only she was believable #Debates",1474939873886,780580523257266177,1
45,mrkennedy79,Trump killing himself in his own ass #debates,1474939874525,780580525937463296,1
46,qqnosh,"Okay, that's nice and all but when are you going to reveal the NX? #debates",1474939874624,780580526352699392,1
47,fabianmera_,take a shot every time Hillary shape-shifts #debatenight #debates,1474939874466,780580525689991168,1
48,pdxpen,"The ""strife of the inner-cities"" @realDonaldTrump? Don't think disco or Ford are around anymore. #debatenight #debates",1474939874622,780580526344200194,1
49,LateTweeter,Who else is feeling bad for Lester Holt right now? #Debates2016 #Debates https://t.co/i4PttxJ9SS,1474939874571,780580526130245632,1
50,C_M_Hanley,"Broad based, inclusive growth IS what we need. #ImWithHer #debatenight #debates #Debates2016",1474939874703,780580526683987969,1
51,billionairebrod,I can't listen to the debate because my children (15 &amp; 8) can't stop laughing at Trump. #ForShame #debatenight #debates #Debates2016,1474939874652,780580526470131713,1
52,cafeoleuno,Hillary - you are getting killed! Just ask him about his taxes! #debates,1474939874575,780580526147133441,1
53,KirkUltima,"@KyleKulinski To be fair, Clinton's plan is to keep giving them weapons.#SteinBaraka #debates",1474939874755,780580526901997568,1
54,fejimanz,al talk no action? This is what a election is about... people talk and then we choose who should do the action. #Debates,1474939874706,780580526696476672,1
55,AlexJKirby,"""These aren't even real debates, it's all rehearsed and fake!""

""I can't believe how rude they're being to each other!"" 

#Debates",1474939874812,780580527141031938,1
56,BernieClinton3,Trump is out of control.  PRESIDENTIAL????? https://t.co/M6YZOvu3tp,1474939874712,780580526721634305,1
57,painefultruth76,@politico @HillaryClinton @realDonaldTrump at least she got one thing accurate tonight https://t.co/54SSW7NNFR #debatenight #debates,1474939874759,780580526918815744,1
58,RealBaxterBlack,Why are they arguing when they could just lie to U.S. together? #Debates,1474939874677,780580526574804992,1
59,nancymcmyers,Not good for your health to drink every time he interrupts. https://t.co/i6TKCVLTRY,1474939874659,780580526499311616,1
60,MomLAVISH,Trump - bunch of nothing to say #Debates,1474939874774,780580526981652481,1
61,pedro_mbrito,"#Debates sem zoa ta mt sem educaçao se fosse eu subia no palco, dava um tapa na cara e falava FALA DIREITO PORRA",1474939874799,780580527086641153,1
62,kim,Bam! https://t.co/iPmPEe77Cw #OccupyTheDebates #debatenight,1474939874830,780580527216599040,1
63,ambrosiality,"hilldawg: *talks about policy*
trump: WAIT WHO WAS TALKING ABOUT ME WHAT DID THEY SAY

jesus christ you paranoid orangutan #debates",1474939874823,780580527187255296,1
64,MeredithChild74,@HillaryClinton stop laughing and smirking like a hiena #debates,1474939875629,780580530567974913,1
65,ambitieux_danni,The real question is...How does Trump's wife sleep with him at night 😩#debates,1474939875668,780580530731544576,1
66,BrokeHipster87,Trump: Big Fat Ugly Bubble #debatenight #debates,1474939875762,780580531125624832,0
67,search4swag,HRC kinda resembling Margaret Thatcher #Debates,1474939875676,780580530764984323,1
68,cedmundsjazz,"Trump is killing it with the wife-beater demographic right now. 
#debates",1474939875734,780580531008249856,1
69,Rhapsodist,"The #debates:
C: Hhrrgahanansllf T: Bblashgrhrrhhalslh",1474939875572,780580530328711168,1
70,JimWilly12,"@HillaryClinton @realDonaldTrump maybe you should talk about what you're going to do, not what's wrong with your oponent  #debates",1474939875684,780580530798546944,1
71,brandon_fields,This country is doomed. #Debates,1474939875733,780580531004026882,1
72,astudentnow,"Trump just called Clinton a ""typical politician"". He wants to be president! The most political of politicians! #debates",1474939875774,780580531176022016,1
73,dgafterdark,"Is it just me, or is he getting slaughtered by any reasonable means? #debates",1474939875781,780580531205398530,1
74,bigmandrew19,@realDonaldTrump  please stop talking  #Debates,1474939875435,780580529754300416,1
75,GoldenOlivier,"We #UniteBlue because #HillaryQualified &amp; will make us proud while #DonaldDeplorable 
#debatenight #debates… https://t.co/sZl2vUzjry",1474939875676,780580530764910593,1
76,Kbdooley,Has somebody tried turning off Trump and turning him back on to see if it fixes him? #debates,1474939875708,780580530899353600,1
77,miechagalbraith,@TheFix So does the Trump snuff. #Debates,1474939875723,780580530962268160,1
78,ElasticoChopp,"Since websites are being plugged tonight, go check out https://t.co/kGsahnSO42 #debates",1474939875812,780580531335409664,1
79,noctambula_5,"Hillary &amp; Trump arguing, Lester tries to pipe in and it's like ""STFU LESTER!"" Let 'em go. #debatenight #debates #Debates2016",1474939875798,780580531276689408,1
80,RodWade,trump - the only thing that looks good is the stock market - we are in a big fat bubble #debates,1474939876614,780580534699163648,0
81,NathanDThorp,"Yeah #hilary, I know plenty of weathly people who are crying that they are not doing their fair share. LOL. #debates #debatenight",1474939876628,780580534757896192,1
82,kelemetry,"Stop trying to make ""Trumped Up Trickle Down"" happen. It's not gonna happen. #debatenight #debates @HillaryClinton",1474939876668,780580534925733888,1
83,madlibbeats,"Hate to break it to you @realDonaldTrump but you're running for President, YOU ARE A POLITICIAN. #debates",1474939876475,780580534116384768,1
84,Sarah_Brennan,Lester Hold needs a mute button. #debates,1474939876573,780580534527287296,1
85,rlindnerdesign,Trump be like  #debates https://t.co/4drhphv6NQ,1474939876375,780580533696888832,1
86,MotherMystic,Like two angry #parrots fighting in my head.  Goodbye #debates #debatenight #veritas,1474939876668,780580534925668353,1
87,Creative1Ja,@realDonaldTrump gives us more reason why we should go #greenparty #debates,1474939876634,780580534783062016,1
88,kstarvideo,"Uh, Trump, the stock market didn't look so hot this week.  #debates",1474939876680,780580534976208896,1
89,JackieBlue4u,He has ZERO self-control. It's pathetic. Believe me #debates,1474939876722,780580535152340996,1
90,guitardawn,Anybody else feel like he wants to punch her in the face? Go get that women's vote Don. #debatenight #debates,1474939876278,780580533290078209,1
91,orwellian_babe,All she can do is recite her script. No specifics. #debatenight #Debates2016 #debates,1474939876590,780580534598721538,1
92,KatieHildreth,"Newsflash, Donald... ""trickle down doesn't work."" #whyamiwatchingthis https://t.co/jZjlYxCCpq",1474939876637,780580534795763716,1
93,Politics_Matter,So tired of Hillary lying about supply-side economics.. which works. See Reagan v. Carter's economies.  #debates,1474939876691,780580535022129154,1
94,brownac,Fear. FEAR. FEEEEAR. #debates,1474939876764,780580535328317440,1
95,janntod,What about all of the successful people who have managed to pay for their education.  No More Handouts @HillaryClinton #Debates,1474939876766,780580535336710144,1
96,martininman,In terms of creating jobs? My money is on the billionaire #debates #Debates2016,1474939876906,780580535923990528,1
97,ashleysteed13,Hellz yeah to rebuilding the middle class #debates #ImWithHer,1474939877680,780580539170299904,1
98,wheelsee,#TrumlSniffle #Debates https://t.co/9Z0nur1b1F,1474939877505,780580538436481024,1
99,chirowedc,Wealth creators create taxes for the government end story #Debates,1474939877671,780580539132555264,1
100,whipthemthighdj,YES HILLARY TELL HIM THE TRURTH #debates,1474939877583,780580538763575296,1
101,SD_Zach,"""Trumped Up, Trickle Down"" is not going to be a thing #Debates",1474939877665,780580539107385344,1
102,DJMikeymania,Ok I lost l count of the interruptions. I'm drunk af. The drinking game has backfired. #Debates,1474939877565,780580538688139264,1
103,davidgideon76,I don't believe anything Hillary says #debates #sameoldpolitics,1474939877575,780580538729967616,1
104,lesliejmoon,People there's an option besides #TrumpVsClinton https://t.co/u5lWYE8Nax,1474939877620,780580538918633472,1
105,iwasnamedchris,"did trump just use ""adult life""?  #Debates",1474939877724,780580539354877952,1
106,PenelopeNykl,Chump Trump. #yuck #Debates,1474939877483,780580538344173570,1
107,icassassin,Holy sweet Jesus Trump is an awful fucking human.  #Debates,1474939877713,780580539308711936,1
108,CHlSTOSA,can't believe I've waited 19 years to end up having to vote for one of these candidates (never trump) #debates,1474939877690,780580539212435457,1
109,c_trueleader,Looking at the posture and body language of Trump #Debates,1474939877676,780580539153678336,1
110,CreeLuv314,Trump just explained himself. #debatenight #debates,1474939877766,780580539531014145,1
111,meganromer,Bless her heart. Mom always thinks the best of us. https://t.co/ahGtasC9A2,1474939877713,780580539308740609,1
112,allard_postma,"@realDonaldTrump is being himself, @HillaryClinton is being herself. So Trump will be the winner. #debatenight #debates",1474939877594,780580538809774083,1
113,Clawrence22,When @HillaryClinton said she's gonna get blamed for everything tonight #debates https://t.co/eleW7Gbkty,1474939877589,780580538788646914,1
114,KeithMont,"""the only thing that looks good is the stock market"" you know, the thing that tells you how like, the whole economy is doing? #debates",1474939877727,780580539367510019,1
115,astoldby_kc,Trump stringing together buzzwords #debates #debatenight #chinamexicosmallloan,1474939877726,780580539363389440,1
116,pffoto88,Could the USA really have Trump as a president ??  #Debates,1474939877704,780580539271176192,1
117,wadlington,"Saw some pro Trump accounts retweet this exchange as a ""positive""... https://t.co/4fldgUuB4v",1474939877518,780580538490970112,1
118,aimee0719,Look at his face! Is that the face you want the rest of the world to see as the leader of the free world? #Debates,1474939877774,780580539564785664,1
119,1D_NewYork,My laptop had a brief meltdown. Even it can't deal with the BS going on in this debate. 😑 #debates,1474939877726,780580539363385344,1
120,DoGoodforOthers,You are a low IQ fool https://t.co/spgCV3Wwlo,1474939878479,780580542521630720,1
121,brownkid_12,@DonaldTrump blame everything on @HillaryClinton says why not? Why not?! Are u serious?! #debates #trumobehavesbadly,1474939878670,780580543322730496,1
122,Ratherr_dashing,This is fantastic television. #Debates,1474939878728,780580543565926400,1
123,Rico_LPS,Trump got Hillary off track just a bit by going back n forth but she gotta channel that class Obama had against McCain #debates,1474939878330,780580541896753153,1
124,WilliamDPhelps,Is this the best we have? 68 y/o Woman and 70 y/o man?? Is this the best we have in American politics? #debates #dems #GOP,1474939878814,780580543926669312,1
125,anglikasanz,El beneficio de los impuestos solo implica el bienestar de estados unidos #Debates,1474939878675,780580543343628289,1
126,stephsanola,@realDonaldTrump BELIEVE ME x 2 #Debates #Debates2016 #DebateNight,1474939878644,780580543213637634,1
127,jliz05120521,#ClintonCash  #Debates,1474939878766,780580543725318145,1
128,The_Siestian,Fought Isis your whole adult life...so if that's the case (which it's not) why weren't you fighting them Donald? #debates,1474939878731,780580543578513409,1
129,abbynetti,Cmon Lester!! #debates 🎣,1474939878703,780580543461068800,1
130,marshawright,"""Typical politician, all talk nothing happens...""#trump
#clinton

#debatenight #Debates2016 #debates #debate",1474939878804,780580543884693504,1
131,brisaydahherna1,You Look Like A Big Fat Ugly Bubble Foh #debates,1474939878838,780580544027332608,0
132,mikeVcella,So funny watching those tiny little hands pick up that giant glass of water #debates,1474939878801,780580543872118788,1
133,leahgregg,Fact check #FTW. #debatenight #debates https://t.co/HOQfHBVRUw,1474939878743,780580543628840960,1
134,MaryJoLA,Fact checking. #debates #debatenight  https://t.co/SPpUSMuzBv,1474939868740,780580501673377792,1
135,FelipeLH,Big fail on Hillary's make up artist. #Lipstickgate #Debates,1474939878819,780580543947608065,1
136,RipTargett,This nigga trump ugly as hell #Debates,1474939879709,780580547680534528,1
137,jjauthor,Who in the hell creates the jobs? Who in the hell risks their money to create products? NOT DEMOCRATS! Entrepreneurs! #debatenight #debates,1474939879742,780580547819032576,1
138,jymobley,Broad based inclusive action. #debates,1474939879597,780580547211001858,1
139,champalo,Could you imagine Trump if he had to deal for foreign diplomats? Would he bully and talk over them too? #debates,1474939878669,780580543318650880,1
140,sikemakayla,He does not know how to wait until its his turn to speak #Debates,1474939871998,780580515338420225,1
141,beijobabe,#Debates @LesterHoltNBC  You sir suck as a moderator.,1474939879626,780580547332407296,1
142,DaeGambino,He deadass keep cutting her off like a lil hoe #debates,1474939879760,780580547894534144,1
143,Uhhh_lyssa,Holy shit this is so painful to watch. #Debates,1474939879705,780580547663892480,1
144,jaimejhanson,@Rising @coreykindberg BEST TWEET! #debates #debatenight,1474939879357,780580546204278786,1
145,Tian_El,"#debates Donald Trump is only going to crash the country even more, no policies and only benefiting the wealthy.",1474939879857,780580548301492225,1
146,brockwhitney,😂💀 https://t.co/IG84ErkkiW,1474939878882,780580544212008960,1
147,thegingersoul99,all talk not action never gonna work why is trump describing himself? #debates,1474939879639,780580547387068421,1
148,RedBSierra,TYPICAL POLITICIAN ALL TALK NO ACTION SOUNDS GOOD BUT NEVER GOING TO HAPPEN #debates,1474939878805,780580543889047553,1
149,rsg30253,#Debates - give America free stuff - LOL - u gave it to them 4 -8 years trickle cell economics,1474939879707,780580547672346624,1
150,crhoycom,#Debates: Economía enfrenta a Clinton y Trump - https://t.co/MXbU0ATNeX,1474939878025,780580540617527297,1
151,Mr_Lucas29,How different do you think the debate would be with Jill Stein &amp; Gary Johnson? Maybe 4 people trying to talk over e… https://t.co/CAohDvlMM2,1474939879610,780580547265462272,1
152,JasonLasiter,The Presidential debate is better than the WWE. #debates,1474939879572,780580547106074624,1
153,TheSkonz,"Big, fat, ugly bubble? It's just weird now. #debates",1474939878668,780580543314456576,0
154,DejoMasters,DONNY STOP IT'S NOT YOUR TURN! #debates #debatenight,1474939878453,780580542412718088,1
155,Students4LifeHQ,Correction Donald: Clinton wants more regulations everywhere except abortion facilities. #debates #debatenight #bigly,1474939880614,780580551476535296,1
156,cgianotas,#TrumpMasleChauvinist https://t.co/6sKvR2UCCU,1474939880549,780580551203786755,1
157,Sara_Steele_Art,#Interrupting.Good strategy.Jane Goodall explained primate dominance.#debates,1474939880563,780580551262605312,1
158,jimfrizzle,#debates dump the moderator RIGHT NOW!!!!,1474939880580,780580551333928960,1
159,itsleopoldo,Raising taxes did not work either https://t.co/LMlz9GpewD,1474939880696,780580551820357633,1
160,uuunit_,#debates https://t.co/E2gAf50Jfu,1474939878294,780580541745733632,1
161,hexgrrIfriend,she's not trump https://t.co/Bhx9yYb4Q6,1474939879734,780580547785437184,0
162,seechels,"props to hillary clinton for not mouthing, ""wtf?"" as trump is talking.. takes a lot of self-control #debates",1474939880687,780580551782649856,1
163,EarlLipphardtJr,"Hillary annoys the sh!t out of me, but Trump is just awful. 60 more minutes of this nonsense.  #debates",1474939880707,780580551866613761,1
164,GovGaryJohnson,All the #tax increases in the world are not going to balance the budget. Spending MUST be addressed. #debates,1474939880621,780580551505879041,1
165,comicalwagner,"@GovBillWeld gov't creates jobs with our money. It's not moral/good growth, but it does, for government's friends.… https://t.co/EqXuoXFO5C",1474939880568,780580551283642368,1
166,AlexLancast3r,"All talk, no action. Trump describes himself #Debates",1474939880821,780580552344801281,1
167,FireDaJoe,@realDonaldTrump @HillaryClinton  He is cutting in just so she can't make a good point #debatenight #debates #Debates2016,1474939881645,780580555800784897,1
168,DontCallMePat,Let me show you my broad-based growth #debates,1474939881671,780580555909758976,1
169,frankemilio,"""Broad based, inclusive growth is what we need"" @HillaryClinton #debates",1474939881527,780580555306000384,1
170,DrSchwark,#TrumpedUpTrickleDown #Debates,1474939881672,780580555914174465,1
171,SonOfTheShipwri,Trickle down means P#ssing on the poor and tell them it's rain. #Debates,1474939881617,780580555683430400,1
172,ergulon,My fingers are crossed. https://t.co/tDsSU7d53c,1474939881466,780580555049963520,1
173,ElSmoocho,Lester Holt needs to man up. #debates,1474939881750,780580556241182720,1
174,Kevinchriste,"Not ""You think it doesn't""...It doesn't AT ALL. Fuck Reganomics. #Debates",1474939881409,780580554810986497,1
175,alexpauline77,#debates?  nah... I'll #NetflixMonday! any suggestions?,1474939881442,780580554949267460,1
176,VerKerry,Like her layers of lies. https://t.co/Si9Ik0PcE3,1474939881683,780580555960291328,1
177,cindygarrett14,"@chelseahandler , she is getting her ass spanked! https://t.co/KtWKBvn9UI",1474939881629,780580555733635073,1
178,EiFsoccer,Donald Trump looking like Jose Mourinho trying to defend his 2nd season in charge of Chelsea... Foolish. #soccerdebate #debatenight #debates,1474939881291,780580554316079104,1
179,mmccdenier,What BS Hillary..Ireland cut corp taxes big time and they're booming #Debates,1474939881629,780580555733602304,1
180,ohhjohnn1,Yasssss! https://t.co/2eVIh0aPSE,1474939881773,780580556337577985,1
181,mzsagittarius85,The rich gets richer as the poor gets poorer #Debates,1474939881726,780580556140666880,1
182,AustinSimard,Trump is right about something. Hillary is pretty bad. She won't do anything. #debates,1474939881776,780580556350173184,1
183,AerisFang,"No matter who wins, we all lose #debates",1474939881771,780580556329324544,1
184,Bobaruski3,Ok jokes over give me a real president #Debates,1474939882606,780580559831625728,1
185,tsen66,#Debates @HillaryClinton  your husbands economy was the effect of Reagan Policy,1474939882341,780580558720073728,1
186,Lilsmitdawg13,"If this were a boxing match, you would probably say, ""Clinton having a hard time landing jabs"" #Debates",1474939882733,780580560364113920,1
187,TheCheshireSpy,Lester is going to smack trump in about .05 seconds.  #Debates,1474939882663,780580560070545410,1
188,TheOriginalDM,This is all such bullshit. USA is screwed.  #Debates,1474939882692,780580560192335873,1
189,yanver,"""U.S. Presidential Debates"" #Debates https://t.co/cXCsWewuCb",1474939882666,780580560083091458,1
190,CarlaBrownLucas,New tag line for #TrumpPence16: We're bringin' money back (to Justin Timberlake's hit tune). #debates,1474939882628,780580559923900416,1
191,anthonyhirsch2,"#debates  #debatenight

So... Hillary has been fighting ISIS for her entire adult life, though ISIS has only been o… https://t.co/MZNx3PwaM3",1474939882464,780580559236005888,1
192,aliasvaughn,Is Trump drunk? Genuine question. He clearly doesn't know what he's talking about and he is incoherent. #ImWithHer #debates,1474939882678,780580560133582848,1
193,Xquisiteeventz1,Can anyone imagine Donald being at a table with world leaders?#debates #debatenight #,1474939882676,780580560125255680,1
194,EricMBurgess,@HillaryClinton shameless self promotion on the #Debates2016 #debates,1474939882789,780580560599027713,1
195,Ralfoo7,l #HFA #HillaryQualified #Hillary #UniteBlue #Debates2016 #Debates #debatenight #shewon #TrumpLies #TrumpUnfit https://t.co/VQFPH4kt6e,1474939882803,780580560657797121,1
196,FallingAngelxx,#Debates this debate is a mess,1474939882612,780580559856828416,1
197,bhodili73,"""The only thing that looks good is the stock market"" and people's IRA's #debates",1474939882856,780580560880017408,1
198,donnycavazos,@ananavarro Chaos rules if Trump is involved. #debatenight #debates #Debates2016,1474939882791,780580560607469570,1
199,troycorley,.@BernieSanders https://t.co/ZXGZZtN8q1,1474939882756,780580560460652544,1
