,screen_name,text,timestamp,tweet_id,cluster_pred
0,hernandi_wisnu,"The Presidential Debate - LIVE Monday, September 26, 2016 9PM EST https://t.co/bNByEf5Wob via @YouTube #debates",1474940043857,780581236167237634,0
1,ImOreos,trump is a DUMB FUCK! #Debates,1474940043777,780581235831693312,0
2,AritelisL,"She is pissed
#debates",1474940043671,780581235387170816,0
3,cecilialisboa98,falou dos emails pegou no ponto fraco #debates,1474940043680,780581235424886785,1
4,Cmilairk,"""You're perfectly free to release taxes during an audit"" - Lester Holt #debates",1474940043843,780581236108505088,1
5,bitty_boop,He gets an audit every year? That should tell us something. #debates https://t.co/xvp3Aowq4z,1474940043067,780581232853807104,0
6,Amadxus,Id rather have a president that took a loan of 1 million and turned it into Billions. Most of you cant get a job. Only Welfare. #Debates,1474940043937,780581236502695936,0
7,CDestructor12,Bue.. quien creen q va a ganar? #Debates,1474940043905,780581236368560128,1
8,eduardosuarez,El público se salta las normas: aplauden cuando Trump dice que desvelará sus impuestos cuando Clinton desvele sus emails #debates,1474940043893,780581236318334978,2
9,MorganShow1,Fair dinkum Donny. #debates #TrumpClinton,1474940044690,780581239661088769,0
10,dwsNY,"Trump says he's been under audit for 15 years... hey, so guess you were lying about it being a partisan witch hunt! #Debates #debatenight",1474940044641,780581239455637504,2
11,Ramcccc,Lmfaooo Trump is jokes  #Debates,1474940044662,780581239543693313,0
12,Concerned002,#Debates  Go Trump!!,1474940044669,780581239572926465,0
13,NielsWolfe,HE DID IT YOOOOO AUDIT IS BULLSHIT #debates,1474940044556,780581239099195392,0
14,hollarity,@realDonaldTrump is dropping #humblebrags every time he opens his mouth #debatenight #Debates2016 #debates,1474940044365,780581238298017792,2
15,LibertyHacking,YES! 33K deleted emails... YES! #debates,1474940044721,780581239791038464,1
16,mclaneh,Fifteen years of audits? WTF! #Debates #debatenight,1474940044712,780581239753441281,2
17,TURNUPROMO,#Trump #debates  He lie and the moderator find him in a lie,1474940044302,780581238033776640,0
18,Supatweek13,OMG why am I watching this train wreck #debates #Debates2016 #LetGaryDebate,1474940044694,780581239677980672,2
19,feeonline,#DonaldTrump makes the Oldest Fallacy in Economics  https://t.co/ZCybh68sPm #debates #debatenight #HillaryClinton,1474940044692,780581239669469184,2
20,Satisfyme34,You get audited EVERY year because you are shady sir. #debates,1474940044711,780581239749091328,0
21,MrsBressi,#debates Trump STILL hasn't presented a plan for tax reform.  *yawn*,1474940044697,780581239690407936,0
22,mauriciohdzmtz,"""the question is....""

@realDonaldTrump do u know what are u talking about? #Debates",1474940044775,780581240017604608,1
23,DrsSmith57,$690 million. Who do I think he gonna represent? #Debates,1474940044732,780581239837249536,0
24,bran_sanders,Reading #debates tweets. Hilarious.,1474940044801,780581240126607361,0
25,sonaliluthar,I just told @nbcwashington who I think is winning. Cast your vote now! #Debates #NBC4DC https://t.co/Ld88oyyD61,1474940044557,780581239103320064,0
26,RonnyBarbozaTwt,"DJT is the ""BUBBLE BOY""!  ""Pop his Bubble!""🚫🚽 #Debates",1474940044837,780581240277610496,0
27,remuspjr,"A Hillary é muito fraca.
É uma Dilma piorada!
#debatenight #debates",1474940044768,780581239988322304,2
28,jayjcov,"You know what @HillaryClinton, him talking is not a bad thing. Let him keep going. #debates",1474940044809,780581240160210944,0
29,Kimberley1222,Email smemail you dick. #Debates,1474940044754,780581239929573380,1
30,iafischer,You get audited because you are criminal. #ImWithHer #debates @realDonaldTrump,1474940044705,780581239724052480,2
31,SweetTayPie0104,"We've gone over the emails already, dude. Stop. #debates",1474940045535,780581243205382144,1
32,burban_street,You will learn more about Donald Trump. . .by listening to Donald Trump. #debates #diatribe,1474940045680,780581243813367808,0
33,CulturalCombat,"A federal tax return doesn't tell you what you owe to whom, Lester. Not a good picture of financial status.

#debates #debatenight",1474940045689,780581243851112448,2
34,od88,It took him 30 minor being up emails  #Debates,1474940045714,780581243956056064,1
35,TerriCruce,Trump is showing his bully side big time. I guess he think whoever shouts the loudest wins.  #Debates,1474940045697,780581243884703746,0
36,KennyGacki,Shut the fuck up about her god damn emails! #debates,1474940045648,780581243679285249,1
37,miike_gonzalez,hes been under audit for almost 15yrs. that means itll be another 15yrs before he does #debates,1474940045640,780581243645669376,0
38,YouTerrifyUs,Maybe there is a reason he is always being audited #debates,1474940045636,780581243629006848,2
39,tokingblackgirl,And Trump hasn't mentioned his businesses in China and hiring undocumented workers too. #Debates #ImWithHer,1474940045547,780581243255685120,0
40,Ralfoo7,l #HFA #HillaryQualified #Hillary #UniteBlue #Debates2016 #Debates #debatenight #shewon #TrumpTaxEvasion… https://t.co/sifX8zgF8x,1474940045364,780581242488049666,2
41,letloosemoose,@realDonaldTrump your complaining a lot for someone who is not complaining #debates,1474940045387,780581242584571904,0
42,LFraserAC,Time of death....6:39 #debates,1474940045597,780581243465273344,0
43,ConPavlou,Yeah it's not America thats fucked the American economy. It's everyone else. #debates,1474940045624,780581243578646529,1
44,jennyyangtv,HOW CAN YOU BE UNDER AUDIT FOR 15 YEARS IF SO THAT IS REALLY REALLY BAD HOMIE #debates #debatenight,1474940045744,780581244081889280,2
45,GraceAvalon,She's incredibly qualified and committed to becoming a progressive. https://t.co/YN8tcmAiVP,1474940045731,780581244027273216,0
46,davidwarpaint,LESTER IN THE FUCKING HOUSE #debates,1474940045669,780581243767361536,1
47,robson_scalioni,Ok Trump. Can you answer a question? Ever? #Debates,1474940045578,780581243385708544,0
48,kevinisrael_nj,Is being audited the cool thing to do? Is being audited a goal? #Debates #DebateNight,1474940045757,780581244136333312,2
49,armywife100,Exactly! https://t.co/c7kIeddIt3,1474940045735,780581244044054528,0
50,gabplotkin,https://t.co/cBhEXl5C61 #yosender #debates #Debates2016,1474940045563,780581243322851328,0
51,kevmen,Holt exposed the IRS' statement that DJT is free to release his taxes--his audit excuse is a farce. #debates,1474940045856,780581244551634945,1
52,Formisonic,Watching the #debates .  My hope hurts.,1474940045773,780581244203507712,2
53,awkwardkris,He's allowed to release his taxes whenever he wants. The IRS doesn't have a problem with it. #debatenight #debates #Debates2016,1474940045739,780581244060905472,0
54,cfb324,Trump showing no mercy!  He is fighting...hard!! #Debates https://t.co/pyfpKKwwvN,1474940045594,780581243452661760,0
55,tbrazil98,#Debates oh no he didn't. Taxes vs emails.,1474940045721,780581243985465345,1
56,NoRedButton,"If @realDonaldTrump wants to seriously discuss the US's finances, he needs to discuss the price of nuclear weapons.… https://t.co/IiEvbCMGjd",1474940045674,780581243788333056,0
57,PensadorAzul_09,Trump didn't answer the question and rambles about something else (takes shot) #Debates,1474940046708,780581248125112321,1
58,idefkffr,Hilary is bouta laugh at this man 😂😂😂 #Debates,1474940046623,780581247768670208,0
59,doddy9224,I love how they are on first name basis with Lester #Debates2016 #debates #debatenight,1474940046763,780581248355807233,2
60,sjc850,Lester Holy for President  #debates #DebateNight,1474940046756,780581248326438912,2
61,wallywilliams,Like it or not Trump is scoring points. #Debates,1474940046583,780581247600979968,0
62,TheZuriAli,Hillary is full of it too. #debates,1474940046662,780581247932334080,2
63,NoAngryChicken,Thumbs up...holding his own pretty well considering a career politician AND news anchor who know the system in and… https://t.co/vi1MOZYpys,1474940046443,780581247013748736,0
64,thesarinator,Does that mean we'll all make $694 million next year under President Trump? #Debates2016 #debates https://t.co/fJUYJJoPQh,1474940046429,780581246955032576,0
65,BobEvansFarms,Links reach across the plate to support syrupy stacks of hotcakes and sunny side up eggs. #debates #Links4Liberty… https://t.co/W378U63pXr,1474940046445,780581247022141440,0
66,AmbassadorWigle,@GovGaryJohnson has vowed spending cuts and balanced budgets!  #debates #WhereIsGary #taxistheft #LetGaryDebate https://t.co/mnVbjubqOP,1474940046666,780581247948951553,0
67,where_is_blair,AND LESTER FIRES! #debates,1474940046774,780581248401977344,1
68,niyaaayin,I wish Bernie was still in the race☹️ #Debates,1474940046717,780581248163020800,0
69,drocthaboss,He just said you can release the taxes but he's avoiding the question. #debates #debatenight,1474940046620,780581247756054528,1
70,goBEYgo,Your taxes Donald... Um... the trade deal... Lester... The IRS SAID... 😂😩😂 #debates,1474940046558,780581247496163328,1
71,BASlCBEAN,Why does trump keep interrupting let Hillary talk #Debates,1474940046774,780581248402153477,2
72,3m3h3n,Trump mentioned the emails #Drink #Debates,1474940046757,780581248330706944,1
73,nycmarcopolo,"Donald supporters, ask yourself honestly: who is answering the questions in this debate? #debates #Debates2016",1474940046822,780581248603267072,0
74,Perhaps_Then_We,"#debates ""under audit for almost 15 years"" so what I'm hearing is we're NEVER gonna get it.",1474940046802,780581248519503872,0
75,Axlthehunter_ii,#debates https://t.co/EtKROmhGFv,1474940046396,780581246816559108,0
76,P_I_Nottingham,@realDonaldTrump loves to talk loudly over her without making facts. #debatenight #Debates2016 #debates,1474940046641,780581247844253696,2
77,angeldnav,"Trump knew not to call anyone fat or ugly but he just had to get those words in anyway re:bubble, must be at the front of his mind  #Debates",1474940046793,780581248481636352,0
78,AnkaDede,#Debates Hit on the Taxes now.,1474940046691,780581248053809153,1
79,lwest04,Audit the Clinton Foundation https://t.co/1rrVOMIHGN,1474940047624,780581251967164416,0
80,kohler_kristy79,@chelseahandler Is Trump going to answer a single question tonight? #debates,1474940047761,780581252541718529,0
81,LizziSlivinski,Getting audited is a way of life #Debates,1474940047676,780581252185354240,2
82,MarlaSaret,"Must find a way to use ""Trumped up, trickle down"" at the office tomorrow. #debatenight #debates",1474940047598,780581251858083840,2
83,englandash,Why won't @realDonaldTrump smile more?! #debates #debatenight,1474940047631,780581251996643333,2
84,AnneKDavey,"Party aside I cant believe out of the 310+ million people in this great country, these are the 2 people deemed best fit to run it? #Debates",1474940047692,780581252252307459,2
85,wallfodder,"Holy crap, the moderator calling him out.  Amazing. #debates",1474940047573,780581251753226241,0
86,RaulRDAC,#debates I just noticed he is wearing a blue tie.,1474940047538,780581251606392833,0
87,AbbyOTR,Wait. He's bragging about being audited every year?? 🤔 #debates,1474940047576,780581251765956612,2
88,DaddyDusto,#Debates that niggas hairline is so far back,1474940047780,780581252621492224,1
89,somegoodideas,When it's not your turn during #debates https://t.co/WruzD1AkDa,1474940047640,780581252034289664,0
90,SeabreezeCheryl,#Debates2016  #debates #debatenight https://t.co/ZlJg4Xp8s1,1474940047661,780581252122411008,2
91,curlsntel,Draggg him Hilary !! #debatenight #debates,1474940047751,780581252499988482,2
92,Jaffaisgame,Sooooo Trump is losing is my opinion no hate towards anyone  i just want peace 🖖🏽#Debates,1474940047791,780581252667674624,0
93,evie121462,BOOOOOOOOM DONALD TRUMP BOOOOOOOOM YEAH BABY #Debates2016 #debatenight #debates,1474940047787,780581252650770432,2
94,jennisweat,"You probably get audited so often because you engage in some ""questionable"" business practices, Donald. #debates",1474940047789,780581252659310592,0
95,BOILING_SKIES,Watching the #debates,1474940047696,780581252269215744,2
96,cheyennebeaches,"Earlier this year, my bf wasn't going to vote.. hated both candidates. Now he is voting for @HillaryClinton! @HFA #HillaryClinton #Debates",1474940047820,780581252789329920,1
97,Lady_Berde,Well can we see the ones from last year or the year before  #Debates,1474940047798,780581252697038848,0
98,bjmay,Trump deflects again about tax returns. Changed subject to trade deals. #Debates,1474940048606,780581256085970944,1
99,delsina363,Tax returns do not equal emails  #debates,1474940048671,780581256358658048,1
100,britt_burchett,RETURN BURN x 2!!!! Nice job Lester!! #debate2016 #debatenight #debates,1474940048495,780581255620493312,1
101,shutupbrendance,"""I'm being audited""
""The IRS says you can release them while being audited""
""But I'm being audited""
#debates",1474940048581,780581255981232128,2
102,markh110,"YEAH, FUCK TRUMP'S LAWYERS #debatenight #debates #Debates2016",1474940048761,780581256736059393,2
103,AcaJordon,OH BABYYYYYYYT #Debates,1474940048754,780581256706744320,1
104,NettieNet313,My lawyers said don't do it 😭😭😭 #debates,1474940048791,780581256861851649,1
105,DSchmidtRogers,Can I meet your friend???? https://t.co/yrQ6Ewcy1B,1474940048686,780581256421601280,0
106,rozakush,Donald just shut up!! #Debates,1474940048757,780581256719314944,0
107,MartinCothran,Trump gets first applause line. #debates #debates2016 #PresidentialDebate,1474940048767,780581256761270272,2
108,TheFamedClock,"Look, I'm trying to hide my tax returns OK lester. I'm having a really tough right now Lester. Ok? @Kinggod23 #Debates",1474940048832,780581257033818112,1
109,Higgins_J,"""I get audited every year."" THAT IS NOT A GOOD THING. #debates",1474940048780,780581256815898625,2
110,AsinineSloth,Trump isn't the best but he's better then an idiot who has sold government secrets multiple times/doesn't know how economy works. #debates,1474940048799,780581256895533057,0
111,wbkrebs,"""I get audited almost every year"" I believe it and it's telling #Debates",1474940048808,780581256933158916,2
112,BridgetMarie,Oh man Trump is SUPER lying about his tax returns. Like anyone who has ever dated a liar knows what's up  #debatenight #debates,1474940048788,780581256849420288,1
113,toddpetersen,This debate is like Reddit that has come off the rails. #debates,1474940048830,780581257025499136,0
114,ALGarnerBooks,"""Everyone is picking on us and @HillaryClinton is a poop head!"" -Donald ""Crybaby"" Trump #debates #PresidentialDebate",1474940048892,780581257285480448,0
115,WannaCyber,So glad/shocked this has 0 likes/retweets after a full 3 min of every politically inclined lefty staring at Twitter https://t.co/CWxL0TfcnY,1474940048820,780581256983515136,0
116,LNQ515,Boom! 🔥#nevertrump #trumpairhead https://t.co/aPdbeBeCX3,1474940048763,780581256744566784,0
117,ugliel,No se como la sra @HillaryClinton puede aguantarse la risa ante ese sr tan comico #debates,1474940049021,780581257826607104,0
118,dannydombrowsky,Are you guys serious with this guy?  #debates,1474940049671,780581260552835072,2
119,seanrobertgill,"""I get audited almost every year"" does not imply you have sound fiscal management. #debates",1474940049673,780581260561293312,2
120,RuizJorgeA,Hillary is life #Debates,1474940049664,780581260523548674,2
121,RabeiKhamees,YEAASHEWKSKD #Debates,1474940049542,780581260011995142,0
122,covika,Trump is screaming that other countries are ripping off America while he's made a living of ripping off Americans. #Debates,1474940049721,780581260762636288,0
123,H8aid,"""I'll release my tax returns after my third term"" #Debates",1474940049632,780581260389474305,1
124,TheMasonReport,"Moderator: Do Americans deserve to know potential conflicts of interest from candidates?
Trump: I’m under a routine audit #debates",1474940049743,780581260854857728,0
125,ErikZarins,Oh don't play the fucking email deletion card #debatenight #debates #Debates2016,1474940049645,780581260443971584,2
126,FP_BradCowger,@AntonioBrown Here's the update on debates you asked for.... https://t.co/amwHNu3S8T,1474940049560,780581260087341056,0
127,CreativeSage,#LesterHolt needs to stop this so-called #debate and start over again. This is not a debate. #Debates,1474940049523,780581259932209152,1
128,bivvvvvv,woahhhhh loud cheer from audience who was told to be quiet on email comment #debates,1474940049791,780581261056147456,1
129,6JustBeChillin,"Trump is sounding stupid, my dear Lord!!!!!!! #Debates",1474940049690,780581260632752128,0
130,MKomyanek,China sounds amazing! #Debates,1474940049616,780581260322279425,1
131,drewble88,You are not under an audit! #debates,1474940049634,780581260397780992,1
132,lumoscolleen,SHE KEEPS LAUGHING AT HIM I CANT STOP LAUGHING #debates,1474940049733,780581260813070336,0
133,LifesizeJasz,B/c your ads look like promo for a kooky Will Ferrell movie. https://t.co/G5zoNCMlsq,1474940049463,780581259680636928,0
134,cwru03,So grade school! #debates,1474940049691,780581260636938240,1
135,Kreggo_Eats,How do you release something that has been deleted? #Debates,1474940049769,780581260964036608,1
136,dennisb407,Breaking news: Donald Trump vs Brock Lesnar at Wrestlemania 33 #debatenight #debates #Debates2016,1474940049631,780581260385214464,0
137,Johnny5024,"AUDIENCE APPLAUDED AGAINST ORDERS! #Trump mentioned the 33,000 emails! #Debates #Debates2016 #DebateNight",1474940049656,780581260490051588,2
138,PawPrintAndrew,Cheers against the Commission's rules #debates,1474940049774,780581260985008128,0
139,portentint,Donald casts blur. Hillary starts to look a little dizzy. #debates,1474940049755,780581260905230336,2
140,cmillercowan,So Trump has figured out the ultimate tax return excuse.  #debates,1474940049701,780581260678799361,0
141,redwingwoody,And there we go with the emails. #debates,1474940049788,780581261043572736,1
142,KnowlesMarianne,Release the taxes NOW. This is independent of anyone else. #debates,1474940049801,780581261098250240,1
143,thatmikereed,Strongest crowd reaction all night is to a “release the emails!” quip?  #debates,1474940049604,780581260271890432,1
144,Jyldo,That's a bullshit trade #ReleaseTheReturns #debates,1474940049617,780581260326539264,0
145,iROC68,Can I get an Amen?! https://t.co/yTKETUe8HD,1474940050619,780581264529108992,0
146,UniverseHeard,"Tonight, I will go to bed dreaming of all the #Hillary gifs we'll all have tomorrow. #DebateNight #Debates2016 #Debates",1474940050526,780581264139120640,2
147,RoryAlbanese,Is Hillary still there? #debatenight #debates,1474940050702,780581264877297665,2
148,dontsayaword101,So do criminals clown. #audit #Debates,1474940050688,780581264818573312,1
149,MellyHatchet,Can't believe I'm watching the #Presidential  #Debates #VoteTrump2016 #Trump &amp; ENJOYING it 😁 #GoDaddy #POTUS #VoteTrump,1474940050689,780581264822824963,0
150,FigglywuffJones,@realDonaldTrump fighting the IRS for 15 years 😂😂😂 #debatenight #Debates2016 #debates,1474940050572,780581264332062720,2
151,johnnymercerfan,"Trying to interrupt the moderator is bad form, DJT. #debates",1474940050658,780581264692748289,0
152,jonreyes,"My man, stop talking to Holt. Talk to the people that love you so much. #debates",1474940050659,780581264696963072,0
153,CharlotteFare,I should complain BUT I DON'T #yourewelcome #debates,1474940050597,780581264436764672,1
154,PlNKM0TEL,i keep forgetting that this is a political debate 😂 so petty n childish IM ALIVE  #Debates,1474940050699,780581264864710658,0
155,N3ssci,YESSSSSSSS E-MAILS #Debates,1474940050792,780581265254731776,0
156,dreadhistorian,"$694,000,000 Trump knows what Americans need.#Debates",1474940050698,780581264860610560,2
157,NiceTaSeeYa,"Instead of yelling, why don't you get a better arguement? #debates",1474940050672,780581264751403008,0
158,mrsmariacole,Did he just imply that he's been discriminated against? #PresidentialDebate #debates,1474940050875,780581265602850817,0
159,LindaKWS1,"#Hillarysplan: Keep guns out of the hands of domestic abusers, other violent criminals,&amp; the severely mentally ill… https://t.co/w5dYyxXlhC",1474940050767,780581265149861888,0
160,PhillVazquez,"#debates

This is Donald Trump not complaining",1474940050787,780581265233813504,0
161,BertLoch,Who's winning? #debatenight #debates,1474940050827,780581265401581568,2
162,TheS_Squared,According to the #IRS you can release your taxes while you're under audit. #Debates https://t.co/vO1HM0OY2L,1474940050703,780581264881352704,0
163,Dr_Scrubbington,good setup #debatenight #debates @Monstercat https://t.co/oqT2SNskaU,1474940050359,780581263438704640,2
164,__IjaneeMarie,The lies #Debates,1474940050773,780581265175113728,0
165,Tykeez,LET THE FUCKING EMAILS GO @realDonaldTrump  #debates  #debatenight  #Debates2016,1474940050856,780581265523273733,2
166,TxLaura210,"694 million dollars last year?!? ""I should complain about being audited!""
@&amp;$"" YOU TRUMP! #debates #emails #really",1474940050815,780581265351151616,0
167,thatfoxmim,$694 million?  Show me the money and your tax returns. #debatenight #debates #ImWithHer,1474940050832,780581265422503936,2
168,khoroWITZ42,"#debates Trump: I've been audited for 15 years. 
Yeah, that's not a good thing...",1474940050845,780581265477107713,2
169,Makori_Oyagi,Emails are coming up.... #debates,1474940050591,780581264411754497,1
170,alexishoormann,Wait so we're bragging now about getting audited every year? That's a thing?? #ImWithHer #debates,1474940050865,780581265560920064,2
171,michaelarria,LOL https://t.co/osjo3k7iXq,1474940050950,780581265917501440,0
172,chtemplin,Or the people from Trump University #ImWithHer  #Debates,1474940051020,780581266211020803,0
173,ladyofthehour2,Political hacks negotiating trade deals...?%&amp;$#debates,1474940051545,780581268413095936,0
174,karin_cather,#Debates Lester: The IRS says you can release your taxes even though you're being audited. I've been audited for 15 years.,1474940051712,780581269113405440,2
175,MaileLevinsky,There must be a reason you've been audited so many times 🤔 #debates,1474940051716,780581269130272768,2
176,TheBishopTuTu,What did I say? I said he was gonna bring up the emails cause he doesn't want to release those returns. #Debates #DebateNight #MSNBC,1474940051569,780581268513779712,1
177,AstridCZ1995,It would be amazing to go to college for free but that's not going to be good for the country's economy #debates     #debatenight,1474940051700,780581269063147520,2
178,RenaInnocenti,Don't brag about a 15 year audit because that's so bad. #debates,1474940051694,780581269037920256,0
179,singxlovex,Dodging these questions like... #debatenight #debates https://t.co/bKkhr3k9s4,1474940051352,780581267603611648,0
180,BeGinn19,"People for trump believe he's winning this, people for Hillary  believe she is. #Debates",1474940051592,780581268610224128,2
181,marcellaveee,OMGOMGOMG THE EMAILLLSSSSS #Debates,1474940051680,780581268979224576,0
182,WhitneyChitwood,"You get audited for 15 years when you file bankruptcy as many times as you do, @realDonaldTrump.
#debatenight #debates #Debates2016",1474940051572,780581268526366720,2
183,SamAErickson,"Maybe you get audited because you exploit loopholes and they know it, Donald #debatenight #debates https://t.co/Z0cJL0GA8a",1474940051431,780581267935006720,0
184,JohnnyEC4,https://t.co/QLkAmAVkDi - Subscribe!!! LMAO #debates,1474940051627,780581268757028865,0
185,shaggy84329,Trump changed on when he will release his tax returns #debatenight #debates,1474940051545,780581268412964869,1
186,DeeDee223,"You get audited so much because you run these scammy Tom Vu Universities and shit.

#debatenight #debates #Debates2016",1474940051694,780581269038129157,2
187,claudia29rb,Data about NAFTA? Sure not #Trumpstatistics #debatenight https://t.co/RbfbhrznHv,1474940051519,780581268303990784,0
188,bri_thomass,HE CALLED HER OUT #debates,1474940051835,780581269629349888,1
189,kjwinston11,“I will release my tax returns against my lawyer’s wishes” when HC releases emails. Audience erupts — against rules #debatenight #debates,1474940051771,780581269360947204,1
190,KristopherSeals,Does anyone remember ECW? @HeymanHustle should send 911 out to chokeslam Lester Holt. #debatenight #debates,1474940051759,780581269310672897,1
191,wino0129,We're doomed #debates,1474940051791,780581269444890624,1
192,drew_martel,I just told @nbcwashington who I think is winning. Cast your vote now! #Debates #NBC4DC https://t.co/FD3RsmnhEh,1474940051592,780581268610093056,0
193,ashl3yk3tchum,This is so cringey #debates,1474940051689,780581269017075712,0
194,yeguaknobbs,Emails - it's all they've got.  #Debates,1474940051851,780581269696503809,1
195,MichelleDeRossi,Who the fuck are these 23% https://t.co/uBSbcgL1LK,1474940051664,780581268912308225,0
196,thereallisaliu,#debatenight #Lester #debates #PresidentialDebate #trump #Hillary #vote #politics #Campaign #Clinton #art… https://t.co/oQHXPPixZk,1474940051611,780581268689858560,2
197,codsow,Wow crowd. Emails get you riled up?  #debates,1474940052675,780581273152675840,1
198,dsoukaroun,THE SHADE #debates,1474940052724,780581273358118912,1
199,asj519,"The IRS continually audits those who will defraud the govt, Donald. #Debates",1474940052703,780581273269968896,0
200,easeptx,this debate is such a joke right now #Debates,1474940052746,780581273450360832,1
201,zach_cw,Those emails were leaked.... #debates,1474940052717,780581273328881664,1
202,Dabiraxo,Hilary Clintons face 😂😂  #Debates,1474940052683,780581273186275330,2
203,bb47ishere,"Killary  is a Liar, Liar, Liar, Liar #Debates",1474940052675,780581273152610304,0
204,KatiePavlich,"Trump issues challenge to Clinton: I'll release my taxes when Clinton released her 30,000 deleted emails (while pointing at her) #debates",1474940052730,780581273383399424,1
205,GastonTweeting,And I will release CRAZY OLD MAURICE! #debatenight #debates #Debates2016,1474940052735,780581273404182529,2
