,geo,screen_name,text,timestamp,tweet_id,cluster_pred
0,,jchiggins_,GARY JOHNSON FOR PRESIDENT #Debates,1474940686601,780583932031107072,0
1,,VinceBernard,"Uh oh, they on race...Let me hear this shit!!

#debatenight #debates",1474940686755,780583932676939776,1
2,,Seattle_liberty,#debates @debates #LetGaryDebate,1474940686917,780583933356367872,1
3,,dqllonweekes,OH SHIT NOW WE'RE TALKING ABOUT POLICE BRUTALITY #Debates,1474940687665,780583936493694976,1
4,,madissonloves,"""How Do You Heal the Divide?"" #debates",1474940687682,780583936564928512,0
5,,josephsreed,Holy hell. Remember Gore 2000? Hillary is doing it to Trump. I honestly can't believe it. #debates,1474940687584,780583936154034176,0
6,,Filipe_The_Best,@tbh_diva Bring Bernie Back! #DebateWithBernie #debates,1474940687372,780583935264907264,0
7,,Blog_do_Doido,Vamos ver como o topetudo se sai com relação à questão racial #debates,1474940687516,780583935868821504,0
8,,DailyDoseOfNish,I thought there were no commercial breaks in this debate? How did they sneak in the Trump on Pennsylvania Ave? #debates #debatenight,1474940687590,780583936179048448,0
9,,mattheckman,Yeah Lester. Let's do this. #Debates,1474940687649,780583936426598401,0
10,,BKTNVA,@realDonaldTrump Not paying taxes doesn't make you smart. It makes you a criminal. #alcapone #debatenight #Debates2016 #debates,1474940687518,780583935877185536,0
11,,PhantomLion,"Trump, you're out of you're element.... #Debates",1474940687645,780583936409923584,0
12,,jennaaaaaa,Trump keeps mentioning Reagan...but how does he feel about Reagan National Airport? #debates,1474940687671,780583936518819840,0
13,,armyStRoNgone,"I'm still waiting for trump to tell us, what is he going to do for us?Does he only knows how to cry? #Debates2016 #debates @realDonaldTrump",1474940687681,780583936560918528,0
14,,AriannaHColon,Riéndome con estos dos #DebateNight #Debates #PresidentialDebate #TrumpVsClinton,1474940687771,780583936938291200,0
15,,lawtestr,"Oh lord, this is about to get ugly.... #Debates",1474940687794,780583937034772481,1
16,,venado246verde,Hold on to the wing. Tape it up. https://t.co/NSuYjwVAlY,1474940687751,780583936854327296,0
17,,pwgotimer,"""People have no idea how to buy and what to do."" Wouldn't that suggest that we should educate them??? #Debates #debatenight",1474940687796,780583937043107840,0
18,,hendley_clark,"It's not just trump going down, it's the GOP.  #debates",1474940687776,780583936959270912,0
19,,timpanoo,#Debates https://t.co/ui4Bvkyhif,1474940687444,780583935566876672,0
20,,TheGinaMiller,"Lester Holt segue for the win! ""We're way behind schedule""....as he moves to the next Q. The art of the segue is way underrated. #debates",1474940687809,780583937097670657,0
21,,sssuzy,"Notice he's slowing down? High is wearing off, no commercials. FUCK! Also is anyone grossed out by how sticky his mouth sounds? #Debates",1474940687549,780583936007217152,0
22,,SalimElBey,Bet he won't build any business on Pennsylvania ave over in southeast DC. Oooooo wait hell used his unpaid taxes to gentrified it  #Debates,1474940688607,780583940444790784,0
23,,reboredough,"UH OH, racial divide is being brought up #BLM #debates",1474940688560,780583940247658497,0
24,,DrekTheBat,"OOOOOOOOH BOOOOY
#debatenight #debates #Debates2016",1474940688612,780583940465627136,0
25,,splats62,#Debates He's right about construction projects. Replacing Amtrak station in Rochester. 2 yr project. WTF!?!,1474940688644,780583940599980032,0
26,,har4mbe,Race remains to be a significant challenge in this country? That's because the liberals make it that way. #debates,1474940688662,780583940675473408,0
27,,Comiccrow,Oh shit!! Here come the race questions #debates #debatenight @debate2016,1474940688678,780583940742533120,1
28,,teasp00n16,It doesn't matter if it's squandered if he didn't pay 😂 https://t.co/zNa9XebQ7T,1474940688625,780583940520341504,0
29,,illeominate,Woo omg #Debates,1474940688628,780583940532961281,0
30,,LAUS_ESTRADA,"¡Míralo en directo! ""U.S. Presidential Debates"" #Debates https://t.co/nQjOQCC1Sg / aquí plan tranquilo* https://t.co/Q2p02L5XNg",1474940688544,780583940180418560,0
31,,DustinHaltom,Please Dwayne we need The People's Moderator to take over for the rest of this debate. https://t.co/jr54syCPK4,1474940688749,780583941040250881,0
32,,alexlips21,Trump continues to proudly claim he takes advantage of laws of the country - why would it be in his interests to change those laws? #Debates,1474940688765,780583941107396609,0
33,,ScottNover,"Batter up, @HillaryClinton. We've come to #race. #MFdebates #debates",1474940688626,780583940524564481,1
34,,markace98,Can't  take it anymore going to #mnf #debates,1474940688552,780583940214128640,0
35,,NorrisMoorman,"At this point Donald Trump, just tell everyone you will file Chapter 11when in office, I can believe it #debatenight #debates #Debates2016",1474940688679,780583940746801152,0
36,,mizunapologetic,Oh snap let us hear this #debates,1474940688575,780583940310626304,1
37,,mhbucklin,Trump and Clinton haven't talked about anything substantive or consequential to the American people for the last half hour...  #debates,1474940688736,780583940985856000,0
38,,citizenstewart,Tremendous. I'm awesome. My income is amazing. You suck. I don't. #DonaldDucks #debates,1474940688832,780583941388378113,0
39,,tweetsbycaro,So he can build a hotel near the Whitehouse #samething  #debates,1474940688738,780583940994297861,0
40,,DxpeVssJvs,Debate drinking game: Take a shot everytime Donald sniffs #debates,1474940689705,780583945050042368,0
41,,GregoryKoskela,Dude grow up #Debates,1474940689524,780583944290988032,0
42,,muhammadahad97,"Shits gonna get real, race! #debates",1474940689679,780583944941137920,1
43,,jeremymeek,Ugh Pinot Grigio get me through this #debates,1474940689536,780583944341389312,0
44,,emmyparry,I actually endorse this. But will never endorse you. #debates https://t.co/Co2VJ6UOoA,1474940689685,780583944966184960,0
45,,hey__jayy,Ya he's underbudget because he stiffs his workers for no damn reason. #debates,1474940689635,780583944756625408,0
46,,KenziCopter,My cat just farted and it's better than anything trump has said #debates,1474940689584,780583944542617601,0
47,,PattyBlount,I wouldn't trust  @realDonaldTrump  with a piggy bank.  University - failed. Steaks - failed. Shuttle -failed. Ice-failed. #debates,1474940689521,780583944278466560,0
48,,Nata_Laureano,#Debates,1474940689655,780583944840482816,1
49,,Taylomade85,Both talk about each others shortcomings &amp; story telling. Smdh #Debates,1474940689695,780583945008218112,0
50,,KatMoorefield,@philgoodstory @natalie_allison Also funny she claimed he has so much to hide. What did she hide in all  those vanished emails?... #debates,1474940689698,780583945020674048,0
51,,NewsMoeda2,https://t.co/njzo2FsMvY ETHEREUM FREE #Decision2016 #AskDemi #JuntosComMafiaSdv #debates #blockchain #bitcoin https://t.co/nOW4DQIsVb,1474940689581,780583944530067456,0
52,,bzsmith,"Yes! Unemployment numbers are down! Thank you, President @BarackObama &amp; all who worked together! #strongertogether https://t.co/C81z2WCgcD",1474940689469,780583944060178432,0
53,,Sciwhat,Ohhhh sic 'em Newsweek! https://t.co/yZ3nEWKiTz,1474940689703,780583945041645569,0
54,,docshaw,Trumps going to be in the white house or the annoying neighbor on Pennsylvania Ave #Debates,1474940689921,780583945956052992,0
55,,solcelo,Maybe we should just skip race as a topic. I'm holding my breath through this. #debates,1474940690661,780583949059825664,1
56,,klhrpr,countries are so different to businesses #debates,1474940690692,780583949189787648,0
57,,MaryL1964,#ReleaseTheReturns #debates #debatenight #Debates2016 https://t.co/ZQ1v4FvaBP,1474940690621,780583948892139520,0
58,,_captainmorgs,Here we go y'all .... #Debates,1474940690643,780583948984385537,1
59,,lesliekelly,"""Tens of thousands of people love me"" #narcissist #debates",1474940690684,780583949156265984,0
60,,dome_underthe,Trump laments paying too much for roads. Why aren't all those GOP governors doing better? #debates,1474940690553,780583948606959616,0
61,,cxdesss,"yeah let's talk about race now 
#Debates",1474940690714,780583949282127872,1
62,,Sloopydrew,"Tonight's #Debates was subtitled: ""Two Only A Mother Could Love"" until it was discovered even their mothers didn't love these two. #tytlive",1474940690514,780583948443324416,0
63,,chelseaharfoush,"Oh yes, Dad. Let's talk about race. I have no reason to think this will go poorly. #debates #drafthousedebates",1474940690649,780583949009432581,1
64,,kenzie__macc,I just told @nbcwashington who I think is winning. Cast your vote now! #Debates #NBC4DC https://t.co/lBTACO4rOh,1474940690440,780583948132966404,1
65,,davidpowellme,"""We're well behind schedule"" — moderator speak for ""Shut up, Donald"" #debates",1474940690828,780583949760204800,0
66,,rachelrhetoric,"Shortchanging people, circumventing the system, and taking advantage of loopholes is not an working business model for a country #Debates",1474940690703,780583949236043776,0
67,,TheAuraMaster1,Deciding on who to vote for the #debates https://t.co/QeDNiBp2qY,1474940690671,780583949101834242,0
68,,Rujabes,"Lester: ""Let's talk about race"" #debates https://t.co/Fy3u5YTSxf",1474940690220,780583947210149892,1
69,,AnneDeTraglia,Dayum https://t.co/d1vXGC3NmA,1474940690820,780583949726724096,0
70,,Moosejago,Ion get how people don't find politics interesting #debates,1474940691565,780583952851566594,0
71,,metricula,Oh god here comes race #debates,1474940691661,780583953254060032,1
72,,dbaaryj,"""Have you tried Trump steaks? Or had a Trump vodka."" - Donald Trump at the debate. 

#debatenight #debates… https://t.co/bGw2yRn5vw",1474940691655,780583953228963840,0
73,,GladysWalters1,#Debates open what of head of schedule wtf does that have anything to do with the debate! Idiot Pay the people you owe!,1474940691563,780583952843153409,0
74,,DjayAce007,Nuff said #debates https://t.co/yPbSdYSVU5,1474940691440,780583952327122944,0
75,,rolledeep,These #debates are just ridiculous. These are most likely the worst people to have as our president for our country,1474940691734,780583953560285184,0
76,,CafeandRose,#debates,1474940691685,780583953354874880,1
77,,saramarietweets,B/c he’d be able to buy property at a lower price and make more $ - it’s called having a #business! https://t.co/2mGg09t0nH #debates,1474940691508,780583952612466689,0
78,,alisonlucci,Seriously forgot he was even there for awhile. #debates https://t.co/o40DPewVli,1474940691638,780583953157672960,0
79,,Trish_Dishes,@HillaryClinton brought the architect?! SHE CAME WITH RECEIPTS 👏🏻👏🏻👏🏻  #debates #debatenight https://t.co/tAsRcNEXfm,1474940691632,780583953132457984,0
80,,NaomiHaight,How does anyone take this guy seriously #debates,1474940691689,780583953371660288,0
81,,elianamuk,We need to talk about Trump's health problems. #debates,1474940691642,780583953174585344,0
82,,SapanaV,Even the Times of India is trolling Trump https://t.co/LJBi5F27u5,1474940691485,780583952516014080,0
83,,kenkuzma1,Trump says I'm rich and I'm going to make the rich richer I have a plan don't know what it is but I have a plan #Debates,1474940691706,780583953442885633,0
84,,suruhzow,WOW I WISH I WAS STILL IN AP GOV.  #Debates #mpapgopo,1474940691681,780583953338077185,0
85,,einsteinmedi,"""It's all words... all sound bites."" #debates https://t.co/hcv3vsF9KM",1474940691594,780583952973041664,0
86,,oneandonlydrake,This #Debates https://t.co/qPTd71jKRQ,1474940691485,780583952515870720,0
87,,baileyatheriot,Inspiring me to vote for you. #LetGaryDebate #WhereIsGary #WeWantGary @debates #debates https://t.co/cre9K4cF2u,1474940691694,780583953392689152,0
88,,scottrodriguez1,#ilovelamp #debates https://t.co/y1s4AF49WW,1474940691663,780583953262583808,0
89,,Conver_Start,@nytimes She's a late bloomer. #debates,1474940691708,780583953451278336,0
90,,keerthikau,Oh shit here we go #Debates,1474940691590,780583952956424192,1
91,,RICOLANI,YES let's talk about this!  #Debates,1474940691790,780583953795342336,1
92,,CrystalAndCurls,Here we go with the race portion. #debates,1474940691816,780583953904185345,1
93,,TheConciergePro,SHHHHH they talking bout US now.  #Debates,1474940691869,780583954126479360,0
94,,xJuuuu_,"""Race"" this shall be interesting #debates",1474940691795,780583953816256512,1
95,,MagicCarpRide,A presidential candidate just said he is smart for not paying federal income taxes.  How... what?  #debates #Debates2016,1474940691758,780583953661038594,0
96,,The_Premise,Take the poll on my page #debatenight #debates #PresidentialDebate #cnn,1474940691784,780583953769967616,0
97,,THE_REAL_CORY,Here we go...now the debate really start. Race?? #debates,1474940692659,780583957439971328,1
98,,auritech,Talking about race now.  #debates #debatenight,1474940692628,780583957309992960,1
99,,tayfan2,"Is Hillary going to use her ""black"" voice now?  #Debates2016 #debatenight #debates",1474940692548,780583956974534656,0
100,,itmightvebeen,Donald plz don't treat our country like your hotel business. They are a bit different??? #Debates,1474940692638,780583957352120320,0
101,,SarahLLapham,@HillaryClinton lives for the catch phrase and sound bites. https://t.co/61gyuNWBwF,1474940692532,780583956907495424,0
102,,roseeebud,Topic of race. This should be fun. #debates,1474940692620,780583957276393472,1
103,,octavemind,Oh I can't wait to hear what he has to say about this. #Debates,1474940692674,780583957503078401,1
104,,SDGabor,@RichardHaass hmm disagree. Maybe Americans in the 1% category? Absolutely. #debatenight #Debates2016 #USElections2016 #debates,1474940692720,780583957695901696,0
105,,lankinomusic,"He really is a psychopath isn't he? ""I'm gonna get there one way or the other""?! lol  #debates",1474940692799,780583958027210753,0
106,,LorettaEttinger,Is Trump sick? Drinking water like a man he made fun of.  #Debates,1474940692718,780583957687566336,0
107,,ellenflegal,"""It's all sound bites."" - @realDonaldTrump (whose sound bites are racist, sexist, homophobic, xenophobic.....etc.....) #debates",1474940692707,780583957641310208,0
108,,stephsvec,"""We have people who have no idea...""Stop right there Drumpf...we understand. #debates",1474940692597,780583957179928576,0
109,,atf1216,Somebody give @realDonaldTrump some Mucinex or something. I'm over this sniffle. #TrumpSniffle #Debates,1474940692298,780583955925991425,0
110,,itschiddy,Trump: DELETED EMAILS !! https://t.co/3q0Zr0acWm,1474940692697,780583957599432705,0
111,,OFALaux,Donald on race!  This should be good. #Debates #Debates2016,1474940692656,780583957427523585,1
112,,itweetyutwatch,Yes ready to hear about this segment  #Debates,1474940692761,780583957868011521,0
113,,A_Gonzaleez,I can't wait for two racists to talk about race issues in a racist country #debates,1474940692803,780583958044151809,1
114,,pooopeepie,"Watching Hillary And Trump fight is just like watching your dad and mom fight 

#debatenight #debates",1474940692831,780583958161436672,0
115,,JamierStL,"He ""takes advantage"" of the laws. He really did say that right?? #debates",1474940693664,780583961655259136,0
116,,JetOverboard,"What about ISIS , terror #Debates",1474940693522,780583961059811328,0
117,,Chazboski,"""Let's talk about race.  Also, you're about to find out which of your facebook friends are secretly racist.  Buckle up"" 

#debates",1474940693595,780583961365929985,1
118,,BrendaSexton,"Here we go on Race, lets see what racist comments Trump will say #debates",1474940693578,780583961294622720,0
119,,TheBishopTuTu,Trump is visibly annoyed w/the race question. #weseeyou #Debates #DebateNight #MSNBC,1474940693551,780583961181511680,1
120,,EvangelicalNorm,"Hey @realDonaldTrump most Americans relate audits to tax criminals, you're not winning the battle by appealing to audits #debates",1474940693599,780583961382752256,0
121,,asphaltandbrie,"Cant wait to see #SNL take on debate. #Trump is gonna get the All Gore treatment, especially with those sniffles and interruptions. #debates",1474940693514,780583961026236417,0
122,,NoVa_Swage01,"Ah, the racism part. This should be good #debates",1474940693761,780583962062102528,0
123,,stephylove0314,How do you heal the divide? #Debates,1474940693632,780583961521250304,0
124,,jcbivins,What could possibly go wrong… #debates #Debates2016 https://t.co/3AaiSaqZXd,1474940693588,780583961336680450,0
125,,Biracial_Chick,Trump get back on track. Her failed record. #debates #Debates2016 #debatenight #MAGA,1474940693635,780583961533812737,0
126,,Mindofmarko,Bruh if Hilary doesn't start answering questions this will not go well 😪 #Debates,1474940693619,780583961466634240,0
127,,pardekooper,Trump is pretty out of breath tonight. Sounds sick or really winded. #Debates,1474940693847,780583962422808578,0
128,,ismarie_,You don't need to be too smart to realize that @realDonaldTrump will be a disaster to this country. It's common sense. #debates,1474940693809,780583962263506945,0
129,,dp_adeola,Trump sounds as if his talking abt Nigeria  #Debates,1474940693690,780583961764454402,0
130,,JulieGong,How many people is @realDonaldTrump going to offend in this segment. #debates,1474940694450,780583964952199168,0
131,,jbeachley18,"If this isn't inspiring America to demand new voices in the #debates, I don't know what will @GovGaryJohnson https://t.co/uAoBRoofaE",1474940694517,780583965233180672,0
132,,aaronshoeby,#trumpwins #Debates,1474940694659,780583965828734976,0
133,,bbspinach,"of course you're well behind schedule, trump hasn't shut tf up #debates",1474940694730,780583966126460929,0
134,,sophievodka,#factcheck #debatenight #debates https://t.co/NCb11LmPpH,1474940694695,780583965979578372,0
135,,keranews,"The #debates reach the next segment: ""America's Direction."" https://t.co/rJ6c4OmBi9",1474940694543,780583965342117890,0
136,,John_Castelli,LOL #LetGaryDebate if only for some decorum https://t.co/NthGiCxiLL,1474940694550,780583965371404288,0
137,,OfficialOHI,Oh shit race convo #debates,1474940694685,780583965937721344,1
138,,ritapang,#TrumpVsClinton - Dear @realDonaldTrump....you've just out-trumped yourself in terms of stupidity. Cheers. https://t.co/zYh6BYBSYp,1474940694742,780583966176780289,0
139,,99KRB,"Lester Holt should have a ""mute the mic"" button to keep the candidates on point and on schedule  #Debates",1474940694801,780583966424215552,0
140,,ginah89121,4 times for business purpose these laws put in place so business men will take risk https://t.co/3bVPEIY53v,1474940694680,780583965916749824,0
141,,540zCIG,Finally race issues #Debates,1474940694771,780583966298542080,1
142,,bridger_swick,Didn't know I'd be spending my night watching clowns #Debates,1474940694774,780583966310961152,0
143,,Shannon_Nolan10,We've learned quite a bit about Trump's new business ventures. But still no sight of US ventures. #Debates,1474940695684,780583970127831040,0
144,,realjaynoble,Its easy to be ahead of schedule when you cheat @realDonaldTrump #debates,1474940695711,780583970240995328,0
145,,trecinomics,"A race question?! What? Donald Trump didn't have these in the primaries!!

#debates",1474940695721,780583970283008000,0
146,,MrDaMention,Here we go #racerelations #Debates,1474940695732,780583970329153537,0
147,,Nixonsloungechr,#Trump absutely correct on this country's failing infrastructure. #debatenight #debates,1474940695745,780583970383597572,0
148,,wehaveorders,I forgot there was a moderator for a moment. #debatenight #debates,1474940695215,780583968160768000,1
149,,mktgchic,October surprise? https://t.co/R69IGT7HZt,1474940695665,780583970048122880,0
150,,Conservativeind,Race relations have become FAR WORSE thanks to Obama's intentional division of the country #NHPolitics #debates #debatenight,1474940695615,780583969838563328,1
151,,EbonyNzimiro,Pennsylvania avenue?? Is Trump for real? #Debates,1474940695734,780583970337595392,0
152,,3ninjasmom,Trump: #USA shouldn't pay our debts like he doesn't when he doesn't want to + 6 business bankruptcies is ok. #notmoneysmart #debates,1474940695696,780583970178265088,0
153,,alyssawags31,Imma let you finish #debates https://t.co/QsXSvR6eIX,1474940695360,780583968769015808,0
154,,DaVelSign,"#Hillary ""Quello che succede nelle imprese non è trasferibile nel governo""🤔 se società è corrotta e non equa.In Italia lo sappiamo #debates",1474940695572,780583969658142720,0
155,,cjd528,"Nice segue, Lester. #debates",1474940695745,780583970383724544,0
156,,Nukem_Nick,Waiting for one of the candidates to slip talking about race #debates https://t.co/06Zv2ng2hc,1474940695577,780583969678954496,1
157,,Lopu37,Thank you Hilary #Debates,1474940695696,780583970178301954,0
158,,jmiller_justin,Clinton acts like a President. Trump acts like a three year old. #debatenight #debates,1474940695683,780583970123677696,0
159,,infectioustroye,#debates trying not to choke whilst watching trump talk https://t.co/tGdEQCCO75,1474940695312,780583968567463936,0
160,,LaytonEWilliams,"Honestly, any time 2 white people stand up and try to talk about race like they're the solution, I get terrified. #debates",1474940695551,780583969570062336,1
161,,CDestructor12,Ahora a hablar del racismo... #Debates,1474940695927,780583971146969089,0
162,,honhonbaguettes,Oh shit now we gettin to race oh dear #debates #debatenight,1474940695872,780583970916470784,1
163,,harleyquinnx4,never trust trump. https://t.co/bBXMXSZTra,1474940695892,780583971000156160,0
164,,MussumAlive,Eu só queria ter a voz desse moderador #Debates,1474940696743,780583974569644032,0
165,,OGuerrero01,Ahorita los más pendientes del #Debates son los estudiantes #Godinez de las escuelas de inglés @MundoGodinez,1474940696758,780583974632509441,0
166,,ShanaGohd,"""It's all sound bites.""-an argument by a man who created his entire life and persona with a catch phrase #debates",1474940696746,780583974582091776,0
167,,melbottjer,this is what I want to hear  #Debates,1474940696791,780583974770913280,0
168,,OrangeParkBuzz,#Debates  Is Hofstra University in Colorado?  Hillary looks stoned.,1474940696367,780583972992614401,0
169,,kgarcia_sa,Race...let's see what they say...#debates #debatenight #Debates2016 https://t.co/LVi1TrEOwp,1474940696533,780583973688840193,1
170,,Melisauce_,I want to see what trump says about race rn  #Debates,1474940696812,780583974858993664,1
171,,normando324,I made a mistake is the same thing I said when I was in grade school. #debatenight #Debates #Debates2016,1474940696806,780583974833836032,0
172,,weriley23,"""Race... remains..."" She wasn't ready to go first, hahaha #debates",1474940696730,780583974515212288,1
173,,RishabhAgarwal_,A republican wearing 'Blue' tie and a democrat wearing Red dress?  #Debates https://t.co/51bJG2rL4s,1474940696573,780583973856489473,0
174,,TieraaMariee,Here comes the race talk.. #debates,1474940696717,780583974460465152,1
175,,mycafelatte,"Ahh, the race question. Looking forward to what two rich white folk have to say #debates",1474940696774,780583974699696128,0
176,,SmartAssEditor,Trump International hotel in DC: furnished almost totally by Chinese goods. #debates,1474940696716,780583974456274944,0
177,,sherellezworld,It's more than one way to skin a cat??? *kanye shrugs* https://t.co/FCWXAHQZEB,1474940696712,780583974439677952,0
178,,aloleemusic,Why is it that whenever I hear Trump speak all I can think of is this #debates https://t.co/4r7QIsnUfd,1474940696577,780583973873344512,0
179,,skull_digger,I just told @nbcwashington who I think is winning. Cast your vote now! #Debates #NBC4DC https://t.co/8FWRGqyD4X,1474940696720,780583974473203712,1
180,,obcpippa,bring up #blacklivesmatter #debates,1474940696862,780583975068635137,0
181,,JPTawok,lets talk about race YAY #debatenight #debates,1474940696802,780583974817009665,1
182,,Mr_Weddig,"sorry, my wife tells me you can, in fact, squeegee drapes. You cannot, however, squeegee grapes.
#debates",1474940696829,780583974930227202,0
183,,colinsteinke,Holy balls. #debates https://t.co/Sp9tKsAOaM,1474940696791,780583974770909184,0
184,,an_amria,Lets see how the candidates handle the RACE issue. #blacklivesmatter      #debates,1474940696829,780583974930378752,1
185,,Faekofall1,#Debates racism ohhhhh boyyyy,1474940696897,780583975215435776,0
186,,DBaugh31,#Debates getting to the good part... Heal the divide!!,1474940696977,780583975550976000,0
187,,ryanissobomb,well this section should be tons o' fun #Debates,1474940697719,780583978663235585,0
188,,mollyringle,"This is making the 2000 Gore v. Bush debates look downright friendly and civilized. I can't take much more.
 #debates",1474940697770,780583978877136896,0
189,,Will_Cofield18,Oh shit there's a moderator #debatenight #Debates,1474940697701,780583978587725824,1
190,,unique_r_us,I either need to start stress eating or stop watching. #Debates2016 #debates #debates #America  🍩🍩🍩🍪🍻🍻🍻🍻🍻🍻🍻🍻🍻🍷🍷🍷🍷🍷😰😵,1474940697808,780583979036450816,0
191,,alyssabrenner26,I'm adding the word braggadocious to my vocabulary #braggadocious #debates,1474940697789,780583978956881921,0
192,,JheanelleW,"So far, we know she didn't come to play. #debates",1474940697727,780583978696925185,0
193,,mfest19,@RealAmeet don't forget Newark. https://t.co/4YfBgazVTm,1474940697834,780583979145568256,0
194,,Kipptacular,Trump is sniffling again and I can't get past it. It's just plain irritating. #debates2016 #debates,1474940697792,780583978969333760,0
195,,DKerrFamily,"Uh oh, Lester just 'played the race card' this could get ugly #Debates",1474940697842,780583979179094017,1
196,,MozzleStead,#Debates That Hotel in Pennsylvania Ave  is as Ugly as Newark Airport. I've seen Hotels in Dubai who look much better than that.,1474940697862,780583979263094785,0
197,,captianvenom2,Great now we at Race ughhhh #debates @xaDroid,1474940697830,780583979128877056,1
