,geo,screen_name,text,timestamp,tweet_id,cluster_pred
198,,HeatherD13,"THE BUDGET IS BAD BECAUSE ""SUCCESSFUL"" BUSINESS MEN DON'T PAY TAXES AND BRAG ABOUT IT. #Debates2016 #debatenight #debates",1474940698670,780583982652022784,0
199,,JoeC1776,"Yes, race relations have gone to shit under Obama who began trashing police and playing the race card from day one! #RaceHustler #debates",1474940698614,780583982417055744,1
200,,esneet4113,@Micsterator OH SNAP! #HRC just told #Trump what the #debates would be like! She drew a line in sand...,1474940698642,780583982534684672,1
201,,LaurieSpoon,@realDonaldTrump How do you justify not paying working men and women??? Donald is going to be chief procurement officer? #debates,1474940698757,780583983016873984,0
202,,djvjdjvj,Oh this should be good. #race #debates,1474940698701,780583982782177280,1
203,,pxrxsyte,oh shit. lemme get serious real quick. #Debates,1474940698782,780583983121784832,1
204,,Zekesgirl1959,I just told @nbcwashington who I think is winning. Cast your vote now! #Debates #NBC4DC https://t.co/u7on5Bgnog,1474940698646,780583982551306242,1
205,,torrisays,"""Let's start talking about race."" #debates https://t.co/lz8nSh90vt",1474940698549,780583982144561153,1
206,,PingPongPlayaa,"If you thought UK politics was in the gutter, this one is just trash on a different proportion #Debates",1474940698747,780583982975115264,0
207,,AlaskanRadical,These debates are historic for all the wrong reasons #debatenight #debates,1474940698731,780583982907789312,0
208,,Gilligantwit,Hilary has never produced a job. Trump has produced thousands  #Debates,1474940698738,780583982937153536,0
209,,meandmyunicorn,and now we hit the race segment. this is about to get real #Debates,1474940698607,780583982387855360,1
210,,badman_ac,Oh hear we go *rubs hands* #Debates,1474940698786,780583983138664448,1
211,,missmelsays,How are either of these candidates going to bridge the gap in our race relations. #debates #debatenight,1474940698672,780583982660476930,1
212,,taraepowers,This. So. much. this. #Debates https://t.co/fZDV25bMLJ,1474940698747,780583982975029248,0
213,,FE_LIFE,"IDK what the candidates pay in taxes but personal taxes are up 68% since 2000, that's loss for everyone  #Debates2016 #debatenight #debates",1474940698778,780583983105077248,0
214,,nbcwashington,"Trump on Pennsylvania Ave hotel: “If I don’t get there one way, I’ll get there another.”  https://t.co/EwGf3KNYgW #debates #debatenight",1474940698826,780583983306375168,0
215,,studentshillary,"@realDonaldTrump , Trump Tower means nothing to children in Flint that do not have access to clean water. #DebateNight #Debates",1474940698814,780583983256141824,0
216,,ChaseMit,"When Lester Holt said ""race,"" Donald Trump's asshole dropped out of his pant leg. #debates",1474940699595,780583986531893248,0
217,,crosswind67,Democratic-run areas still in Decline is nothing to do with race #Debates,1474940699561,780583986389094400,1
218,,SubBeck,"$2OT does not have to be ""paid back."" https://t.co/7CXgqsw0x8",1474940699523,780583986229866496,0
219,,GOPAmericanMom,*Jaw drop* Trump just admitted he cheated ppl to benefit his family??? Did I hear that correctly??? #debates,1474940699628,780583986670305280,0
220,,GloireAmani,Most people do not listen with the intent to understand; they listen with the intent to reply. #USPresidentialDebate #debates #DebateNight,1474940699678,780583986879930368,0
221,,okayrutchell,I wanna see how they handle the race issue 👀👀 #Debates,1474940699682,780583986896699392,1
222,,SunnyLenarduzzi,Is it just me or does it sound like Trump is struggling to breathe? #debates,1474940699743,780583987152424960,0
223,,onehelluvapilot,I'm watching the Bee Movie #debates https://t.co/8P0uG8LcKp,1474940699211,780583984921137153,0
224,,YpsiForBernie,#OccupyTheDebates #DebateNight #Debates #SteinBaraka #HeyJill https://t.co/xR5cESZpb8,1474940699676,780583986871406593,0
225,,graisinbrand,Seriously!? What is Trump even saying tight now? #Debates,1474940699763,780583987236392964,0
226,,josetav92,This should be good #Debates,1474940699808,780583987425058816,0
227,,CantGuardKevin,Finally an important topic #BLM #Debates,1474940699708,780583987005784069,0
228,,acb2410,"ALSO, Hilary hasn't coughed or passed out yet so.... everyone can hush about her health. The woman is literally fine. #Debates",1474940699814,780583987450253312,0
229,,matthewpcharles,RIP EACH OTHER'S DICKS OFF #debatenight #debates #Debates2016,1474940699780,780583987307802625,0
230,,rtcruzscandal,Blown the absolute fuck out!!!! https://t.co/geb6RZGwDN,1474940699735,780583987118940161,0
231,,TheGatorGamer,YOU CAN TELL WHEN TRUMP IS KICKING ASS BECAUSE HOLT MOVES TO THE NEXT SEGMENT #Debates #DebateNight,1474940699790,780583987349708801,0
232,,LornaCrowexXx,"Admitting to taking advantage of the law so he can not pay contractors, and people want to vote him in #debates",1474940699775,780583987286798338,0
233,,RarelyDoesCrack,Oh god Trump is losing his voice and it's only enhancing the Oompa-Loompa aesthetic. #debates,1474940699885,780583987748085760,1
234,,donmoyn,"Watching the #debates w @julianhupka, visiting from Denmark. Tells me that Trump is viewed as the reincarnation of a Norse God there.",1474940700693,780583991137095681,0
235,,heykim,#DebateNight #debates https://t.co/pdcoV8MLD6,1474940700607,780583990776373248,0
236,,TheKosherHog,#debates. Please retweet this if you voluntarily paid the IRS more $ than you rightfully owed.,1474940700693,780583991137017856,0
237,,deedee3003,Hillary is the biggest liar. Why is #Lester letting #debates Hillary able to talk for all this time? Lester is afraid of the Dem backlash?,1474940700659,780583990994489345,0
238,,lilcourtside,"He said we dont have people who dont know what they are doing... 

This is coming from Donald Trump #debatenight #debates",1474940700719,780583991246254086,0
239,,WChrisdaily,"""It's all words. It's all soundbites."" - Donald Trump // Actually @realDonaldTrump, it's FACT. Con Man. #debatenight #debates #Debates2016",1474940700628,780583990864580610,0
240,,John_Scott_G,Sometimes it's hard SNIFF to follow what SNIFF the Trump guy is saying SNIFF in the #debates,1474940700665,780583991019581440,0
241,,AlekChamberlin,*law and order theme #debates,1474940700683,780583991095287808,0
242,,TGIFridays,"Beer, Wine, or Long Island Tea on the first date? #Debates #DebateNight #AskingHardQuestions",1474940700672,780583991049093120,0
243,,elinaspelund,"#debates 
•I'm Icelandic
•it's 2am
•I hate both
Why am I watching this...? https://t.co/MpBGPSzpR6",1474940700207,780583989098770432,0
244,,christina_char,Hey dumb dumbs. Building a hotel is the same as running the country. Obviously. #Debates2016 #Debates,1474940700595,780583990726123520,0
245,,Krealzzz,Trump looks like he's out of breath #Debates,1474940700742,780583991342759937,0
246,,JackYeary,SHE HAS NONE https://t.co/CdXthRoxbr,1474940700663,780583991011188737,0
247,,MrCatStubble,#Debates Hillary Clinton looks like a real arrogant cold b*tch,1474940700855,780583991816560641,0
248,,ADRENOX,Race Debate tiem. #herewego #debates,1474940700872,780583991887876096,1
249,,gameplayerangel,"""If i dont get to pennsylvania Ave. One way ill get there another""  wow #Debates",1474940700778,780583991493746688,0
250,,behcun,And now we'll move to the bigotry section of our dance. #debates,1474940700794,780583991560671232,0
251,,yagtong,We need answers on what they plan to do about SIVA! #debates,1474940700749,780583991371898881,0
252,,_HeyWheresPerry,Alcohol poisoning https://t.co/u4fRQTZayp,1474940700610,780583990789042176,0
253,,poliscipunk,Who? https://t.co/dqh3JWkX0E,1474940700800,780583991585878021,0
254,,BmpBoo,What is Donald trumps affective tax rate?? #Debates,1474940701701,780583995364954113,0
255,,FrontRowKenny,Oh...here...we..go #debates,1474940701605,780583994962436096,1
256,,Regulatetheman,REGULATE! The Manual! Racism! It is written https://t.co/TMooM2I2Cs. #Debates You are in here!,1474940701746,780583995553701889,0
257,,WillaimShat,"No, race does not determine where people live. 

#debatenight 
#Debates2016 
#debates",1474940701605,780583994962345984,1
258,,TheOfficialMLC,I'm going to cry myself to sleep. This man is one night away from the presidency. #NeverTrump #ImWithHer #debates,1474940701653,780583995163627522,0
259,,stevetdickinson,45 minutes to go 🙂 #debates,1474940701687,780583995306377217,0
260,,apaudette,"I asked students today how many thought Trump would win, Clinton would win, and American democracy would win. Results for dem: 0. #debates",1474940701742,780583995536834561,0
261,,melissaged,Thrilled little girls see @HillaryClinton on screen right now. Disgusted they see this as a man qualified to run for this position #debates,1474940701610,780583994983321601,0
262,,TreeHuggerRob,Republican Strategist... https://t.co/PiJi4f1AJV,1474940701660,780583995193102337,0
263,,pattiffin,"Trump enough with the Hand movements, do everybody a favor Donald and put the finger gun to your head and pull the trigger. #Debates",1474940701743,780583995541164032,0
264,,JoeBrettell,Does brioni make handkerchiefs? Can someone hand one to #Trump please? #sniff #debates,1474940701864,780583996048625664,0
265,,CTZNWELL,"""Mindfulness isn’t just taking care of ourselves, it’s taking care of each other"" -@KateWerning #debates #MindfulDebate #VOTEWELL",1474940701778,780583995687989248,0
266,,daddy_matt_dogg,I'm surprised Hillary hasn't started coughing her lungs out yet #Debates,1474940702672,780583999437574144,0
267,,KellyyMarley,Why do they both look like their wearing Halloween masks of themselves? #debates,1474940702484,780583998649139200,0
268,,TechTheShark,I tapped out after Trump said paying no federal tax ever was a smart move. Goodnight. #debates,1474940702580,780583999051825152,0
269,,looinrims,"#Debates here we go, race",1474940702687,780583999500652548,1
270,,MarthaTillmon,Tax returns and emails and money and bull sh*t. #JoffreyOrRamsay #Debates https://t.co/5vqTlgQftR,1474940702574,780583999026495488,0
271,,JErickson85,I just told @nbcwashington who I think is winning. Cast your vote now! #Debates #NBC4DC https://t.co/Gh4stktFsH,1474940702612,780583999185956864,1
272,,LaYaque_Zmbrn,Conchaleee los traductores de CNN me tiene desesperada... #debates,1474940702631,780583999265710080,0
273,,elevenstars,Tiny hands greedy hands https://t.co/kIZDk35lpr,1474940702514,780583998774996996,0
274,,TheLibraryRadio,Ooh shit bitch it's about to get good #debates,1474940702739,780583999718748160,0
275,,Talodin,I wonder how many Trump words are going to be added to the English dictionary after tonight's #debates,1474940702691,780583999517274113,0
276,,HannahRaybon,"YEAH, YOU TELL HIM HILLARY! #Debates",1474940702427,780583998410153985,0
277,,lcole_7,"Way to throw out ur middle class life, dead father &amp; the blue collar guy to make u look humble Hils.  Big banks still got ur back. #Debates",1474940702442,780583998473003008,0
278,,people,#Debates: What really matters to you in this election? Take PEOPLE's election survey https://t.co/pqwt7nfmHx… https://t.co/JRwnJC5pYM,1474940702475,780583998611415044,0
279,,Maggie_Alongi15,I just told @nbcwashington who I think is winning. Cast your vote now! #Debates #NBC4DC https://t.co/npuo0rldEp,1474940702604,780583999152484352,1
280,,AprilTara,PLEASE mention Trump's history of housing discrimination #debates,1474940702583,780583999064383488,0
281,,panther_dragon,"I think I speak for the majority of Americans, when I say....""Mulligan"". #election2016  #debatenight #debates",1474940702781,780583999894724608,0
282,,Luxurious_hunee,! RT @Ambitious_Fab: I'm ready for Donald to answer THIS question #Debates,1474940702785,780583999911624704,0
283,,ivanjr,Lester is in room?!? #Debates,1474940702800,780583999974608896,0
284,,syracuseshows,"Hillary's talking about progress and change, Trump's talking about opening a business in DC. yeah...he's a GREAT leader. #debates",1474940703578,780584003237707776,0
285,,KTVL,Trump says releasing financial disclosures is better than tax returns. What do you think? #Debates https://t.co/GpHY7ikjiN,1474940703560,780584003162214400,0
286,,CityofLostGods,This is about to be interesting. Talking about race now. #Debates,1474940703699,780584003745280000,1
287,,shenanigans4u,can't connect w/Hillary;  comes across as removed from real feelings &amp; seems to have no grasp on life for middle &amp; lower classes #debates,1474940703739,780584003912994816,0
288,,burritosandguac,"""We're well behind schedule""
AND WHOSE FAULT IS THAT, LESTER!?
#Debates2016 #debatenight #debates #dontprayforlester",1474940703671,780584003627876352,0
289,,amykishek,Neither of these people are equipped to discuss race. #debates,1474940703824,780584004269420544,1
290,,BoneSharkKid,"Trump actually looks concerned with the questions posed, Hillary just looks like she's getting a kick outta it. #Debates",1474940703566,780584003187404800,0
291,,may01222,I just told @nbcwashington who I think is winning. Cast your vote now! #Debates #NBC4DC https://t.co/1O78nppH5h,1474940703752,780584003967471616,1
292,,TheTygryss,He takes advantage of wh@ evry American can't afford 2 furthr separating him frm the ppl who follow him so loyally. #Debates,1474940703613,780584003384541184,0
293,,misterjette,"Half of the U.S. population: ""Might as well Trump, TRUMP!"" #debates https://t.co/3bx0BmWUP6",1474940703324,780584002172358656,0
294,,A__MIR_acle,The one topic I really want to hear about from them.  #Debates,1474940703914,780584004646875136,0
295,,toxikbubblegum,That moment when the moderator has had enough of your bullshit! #debates #debatenight,1474940704667,780584007805173760,0
296,,umarodrigu_ez,Hillary just made him salty  #Debates,1474940704591,780584007486607360,0
297,,gabsters1017,#SAVAGE #debates https://t.co/WMq3a65bBI,1474940704585,780584007461433344,0
298,,J_Emanual,Police violence! Let’s go! #Debates,1474940704716,780584008010698752,1
299,,BABlankfeld,RIGHT?! https://t.co/aYoekx3Imp,1474940704389,780584006639247360,0
300,,Bigsisterchacha,Yesss.....the juicy stuff. RACE.  #debates,1474940704673,780584007830568960,1
301,,ExecPostFacto,"Just look at Atlantic City, NJ now, I am King of Business, my kingdom - I plunder #Debates",1474940704754,780584008170156032,0
302,,kristenwarner,YOUR SWING STATE?! THE ENTIRE EFF IS GOING ON. HE WILL PUT YOU IN JAIL IF YOU STEAL FROM HIM BUT HE HAS NOT PAID A DIME IN TAXES. #debates,1474940704688,780584007893483520,0
303,,shampto,"#debates. #trump, shut up..put it back on #Hillary and the emails, lying, health etc.  don't let her dictate the agenda. Don't take bait",1474940704762,780584008203636736,0
304,,A_Franny,#debates https://t.co/Yj29kecg3X,1474940704244,780584006031175684,0
305,,JesseLadoue,"If there are no commercials tonight, when am I supposed to pee? #debates #debatenight",1474940704766,780584008220631040,0
306,,SandraHartle,"🔥#WakeUpAmerica #TeamTrump #CCOT  #2A #MAGA🔥#millenials #MinorityPolitics #tcot #blacklivesmatter
💥race💥#debates… https://t.co/XKXJBtvKhZ",1474940703796,780584004152008704,0
307,,MillieSansoye,Trump is racist so this race question isn't going to be good for him #debates,1474940704763,780584008207986688,0
308,,Birdie_Bott,#Debates https://t.co/h488UuZsJx,1474940704563,780584007369121792,0
309,,wowunoriginal,And you'd wonder why they're behind schedule #debates,1474940705667,780584011999608833,0
310,,yarncrafty,#BlueLivesMatter  #Debates,1474940705663,780584011982708736,0
311,,K6vinEKL,Hillary smiling is an aberration. #Debates,1474940705668,780584012003762176,0
312,,msitver,Never realized that Trump wears his tie outside of his jacket. Weird. #debates #Debates2016 #debatenight,1474940705686,780584012079333376,0
313,,Firefly1Jlc,This is so ugly! I'm worried! @NBCNewYork #Debates,1474940705596,780584011701837824,0
314,,TheMontclarion,The first segment of the debate is over and now both candidates will tackle race relations in the United States. #debates,1474940705527,780584011412504577,1
315,,ChaosHappenZPR,"@realdonaldtrump said what? More @politicalChaos0 https://t.co/7um4NlLsRW
https://t.co/L7aMSrOHmT
#debates #PresidentialDebate",1474940705688,780584012087603201,0
316,,CarlosD585,"""Let's start talking about race""

Goodnight my dude #Debates",1474940705739,780584012301557761,1
317,,JenniferBarnett,Totally agree. What is @realDonaldTrump hiding? #debates https://t.co/wstqWagtXm,1474940705600,780584011718660097,0
318,,FlatlineJM,Lester Holt Right now #debates https://t.co/8Oqpk4FxCz,1474940705664,780584011986972674,0
319,,n2sgal,"Clinton says Trump pays no federal tax
Trump replies that makes me smart #debates #WTH https://t.co/MnN2zQRyNI",1474940705715,780584012200890368,0
320,,klmindenver,And he's damn proud of it! https://t.co/lBztzkkt6e,1474940705657,780584011957538816,0
321,,jakedurbin2,I just told @nbcwashington who I think is winning. Cast your vote now! #Debates #NBC4DC https://t.co/dsoGtFytn7,1474940705902,780584012985151489,1
322,,neciadallas,My grandmother could do a better job moderating this and she died 13 years ago. #debates,1474940705930,780584013102579712,0
323,,JonParr3,"If Clinton sniffled this much, FOX would already be talking about her coke addiction... #Debates2016 #debates #debatenight",1474940705714,780584012196765696,0
324,,texanperry,I wouldn't call it inspiring at all... 🙄 https://t.co/vOP8coxDck,1474940706553,780584015715635200,0
325,,JuliaJenae7,Race is up. @LesterHoltNBC asks both: How do you heal the divide? #debates #DebateNight,1474940706678,780584016239964161,1
326,,waleed2go,Lester mentions racism and now all the POC waiting for Trump to respond like this  #debates #trumpvsallofus https://t.co/mMiwNR6PQ6,1474940706412,780584015124320256,0
327,,tedvelasquez,#Debates Stop hunting humans!,1474940706620,780584015996694528,0
328,,data4all,#debates Look at that miserable jerk: can you imagine him meeting with another head of state?,1474940706768,780584016617414657,0
329,,MSW518,"#debates please ppl STOP him @realDonaldTrump ""if I don't get there by one way or another' VOTE",1474940706587,780584015858401280,0
330,,ashortblonde,Is @realDonaldTrump falling asleep? #debates,1474940706750,780584016542048259,0
331,,WagnerToCutch,You both suck so bad #Debates,1474940706817,780584016823013377,0
332,,katecannova,#Drumpf says paying $0 in federal taxes makes him smart. And he has the nerve to call her crooked. What a schmuck.… https://t.co/ICWj5ae61I,1474940706468,780584015359270912,0
333,,shipmeant2b,if a woman or man has a great ASS then #assets belong to #Trump  ~end of ass-etts!~  start talkin about greatness for all already  #debates,1474940706523,780584015589888000,0
334,,MonicaEug,"La historia de los correos electrónicos de Hillary no tiene fin...Trump desaprovechó el momento
https://t.co/CTDQnPV2Zg 
#DebateCNN
#debates",1474940706692,780584016298774528,0
335,,elewis917,What's with all the sniffing? Does the Donald have a cold? #Debates,1474940706842,780584016927977477,0
336,,tenishaidowu,Didn't Trump make fun of Rubio for drinking so much water?!? #debates,1474940707657,780584020346228736,0
337,,KVeldman13,#debates #powersuit https://t.co/US36Ez0uUb,1474940707506,780584019712847872,0
338,,Megg13,You probably are under budget from not paying people for their work #Debates #PresidentialDebate #DonaldTrump,1474940707730,780584020652331008,0
339,,2KllMckngBrd,"arguing bankruptcy 4 rich people is smart biz

but thousands can't declare bankruptcy on student loans

or b kosers

#debatenight #debates",1474940707759,780584020773974016,0
340,,MagicalMrE_tour,"@emmettrensin I've had to bow out, I can't take anymore... I'm half expecting the crowd to start screaming, 'he's behind you!' #debates",1474940707665,780584020379774977,0
341,,Irvquake,Oh God race relations is a subject? Gonna have to grab a beer for this #debates,1474940707692,780584020493074432,1
342,,SemanaAmericana,"Hoy, en ""cosas que habrían matado a Mitt Romney"" https://t.co/4DD9eEgrFD",1474940707611,780584020153425920,0
343,,SonnyWhy,#Debates @LesterHoltNBC is almost non existent,1474940707643,780584020287614977,0
344,,NAimprov,#Race is up now. Hoping the Gamma-#Racism powered Orange Hulk just speaks his mind. #debates #debatenight #Debates2016,1474940707657,780584020346155008,1
345,,cathandwa,"RESTORE TRUST?????? 

HONEY POC DONT TRUST WHITE PEOPLE OR POLICE SORRY #debates",1474940707771,780584020824305666,0
346,,notaflaca,I can't take this #debatenight maybe some one should monitor the microphones #letherspeak #factsareonherside #debates,1474940707696,780584020509732865,0
347,,alicia4887,🙆🏻🙅🏻😩#Debates,1474940707616,780584020174184448,1
348,,Summer_702,I can't... #DumpTrump https://t.co/RYI2elEr1T,1474940707752,780584020744609792,0
349,,LegendaryWriter,The devil always wears red. #debates,1474940707707,780584020556058624,0
350,,jennurban,"#JohnsonWeld2016 
#Debates",1474940707775,780584020841291776,0
351,,sparmetuic,Research shows violence spikes in neighborhoods where @CureViolence funding cut #PublicHealthStopsViolence #Debates https://t.co/yXfr8JmXte,1474940707651,780584020321136640,0
352,,broncomaniac7,Waiting for Hillary to pass out again so she doesn't have to answer anymore questions #debates,1474940707860,780584021197672448,0
353,,TaggartTyson,"""I take advantage of the law!"" -Donald J. Trump
Yeah that's kinda what your best at Donald. #debatenight #Debates2016 #debates #CNNdebates",1474940707939,780584021528973312,0
354,,csainz,#Debates trump diciendo que eeuu se convierte en tercer mundo jajaja que alfred sauvy le explique...,1474940708673,780584024607641600,0
355,,RufusA11,"""Let's talk about race""
Oh shit here we go#debates",1474940708697,780584024708218880,1
356,,MarkArtiles3,😂😂😂😂I wanna have lunch with this guy https://t.co/qk0sJqIKlC,1474940708687,780584024666361857,0
357,,Edenza,"Is he smirking while she's talking about #BLM?
#debates",1474940708519,780584023961853953,0
358,,ArtbyAWOHS,Hillary turned on the crocodile tears on a dime. That was awkward. #debates #Debates2016 #debatenight #MAGA,1474940708668,780584024586805248,0
359,,thomasdmelvin,"His voice is getting higher, and when it does he sniffs more. She's getting under his skin. #debates",1474940708502,780584023890530305,0
360,,BenK_TRB,Race... this gonna go interesting #Debates,1474940708594,780584024276398080,1
361,,limeputa,hold on. Isnt LAX the la airport?.... is she comparing an airport to a third world country https://t.co/pzXE8EPJs5,1474940708706,780584024745971712,0
362,,JimmyGeekPA,American Friends: Lets just... let's just all move to New Zealand.  #debates,1474940708748,780584024922140672,0
363,,toxicwildfire,Omg did Trump really just say that... #debates #debatenight https://t.co/fOVyvlOBPl,1474940708291,780584023005462528,0
364,,colehab,"""How do you heal the divide?"" 🍿 #debates",1474940708734,780584024863608833,0
365,,bucksbarne,donald boutta break out his kkk uniform when you bring up race bruh hes triggered  #Debates,1474940708417,780584023533977600,1
366,,DuxBoaOnda,Racismo? Tá ganho Trump #debates,1474940708416,780584023529848832,0
367,,TomRomero2,Every time there's a cat meme I'm taking a shot #Debates,1474940708731,780584024851025920,0
368,,abeltrev,"Uhmm, Trump's dc hotel was built with illegal and well below minimum wage immigrant labor. #debates",1474940708421,780584023550812161,0
369,,animemiz,Race is not going to help if Donald Trump gets elected.. #Debates,1474940709493,780584028047106048,0
370,,blckpnk_twt,oooh race talk i cant wait to hear Bullshit #debates,1474940709570,780584028370067460,1
371,,SharonMichnay,We need to restore trust between communities and police.  #ImWithHer #debates,1474940709665,780584028768468992,0
372,,prof_taxi,"All interns for all news organization's, we need #debates tweets with #Trump sniff counts.",1474940709616,780584028563013633,0
373,,BruceTalk,"#DonaldTrump - ""We need a businessman running things."" We had another one. His name was GW Bush. He gave us The Great Recession. #debates",1474940709614,780584028554403841,0
374,,Anna_Egghead,word of the night: braggadocious (-Trump) #Debates,1474940709366,780584027514429440,0
375,,Kidd_Allay,"#Debates race still determines too much ,",1474940709704,780584028932038657,1
376,,JoWelde,He's so hard to listen to... all over the place. #Debates,1474940709767,780584029196210177,0
377,,The_Harading,"Race relations, here's the real topic that actually effects lives day to day #debates",1474940709712,780584028965474304,1
378,,theben_gilbert,😐😐😐😐😐😐😐😐😐😐😐😐😐😐😐😐😐😐😐😐😐😐😐😐😐😐😐😐😐😐😐😐😐😐😐😐😐😐😐😐😐😐😐😐😐😐😐😐😐😐😐😐😐😐😐😐😐😐😐😐😐😐😐😐😐😐😐😐😐😐😐😐😐😐😐😐😐😐😐😐😐😐😐😐😐😐😐😐😐😐😐😐😐😐😐😐😐😐😐😐😐😐😐😐😐#debates #debatenight,1474940709718,780584028990758913,1
379,,gavgreco,Time for cider #3 #debates,1474940710678,780584033017225216,0
380,,ahbeef,racist #Debates,1474940710406,780584031876329472,0
381,,Ibonzii,#Debates https://t.co/u01PZFK19M,1474940710484,780584032203517953,0
382,,juansequitur,"Oh jeez, here it comes. #Blacklivesmatter #BLM  #Debates #Debates2016",1474940710482,780584032195211264,1
383,,ChelseaCain,Trump is sniffling a lot. I'm worried about his health. #Debates,1474940710722,780584033201770496,0
384,,brainybrunette,"Only two minutes to answer the question: ""How will you bridge the divide caused by racism?"" Can anyone do that? #debates #HRVotes",1474940710736,780584033260634121,0
385,,babypundit,Fact check https://t.co/2NZoQ8omOC  #debatenight #debates,1474940710546,780584032463716352,0
386,,Gale_Martin,"Trump cares most about business and money, not people. #debates",1474940710790,780584033486942208,0
