,screen_name,text,timestamp,tweet_id,cluster_pred
0,hugov89,#Twitter you're fucking up the stream #Debates,1474938971872,780576739936174081,1
1,BLanaGuggenheim,"""How do you bring back jobs?""
""Well, don't let them leave.""
Well done, Trump. Good job. #debates",1474938971789,780576739588186112,0
2,shawnsumma,"Watch live! ""U.S. Presidential Debates"" #Debates https://t.co/AYy6WAw5C1",1474938971931,780576740183724032,1
3,bleedamerican76,Tax policies written in your husband's administration. #debates,1474938971945,780576740242432000,1
4,marystanforddc,"Lester, time to be a moderator!  #Debates",1474938972662,780576743249674240,2
5,momerca,China or Mexico wages #Debates,1474938972662,780576743249874946,2
6,_bellee_1,Trump's comb over is on point tonight. #debates #debatenight #PresidentialDebate,1474938972658,780576743233052672,2
7,TheRachelFisher,Please bring your cookies into our country I don't care how they got here #Debates,1474938972625,780576743094562816,1
8,mrm,"""How will you bring back jobs?""
&lt;words that do not even get close to answering the question&gt;
 #Debates",1474938972646,780576743182655488,1
9,MizsI77,Wats wrong w Donald Trump nose 😂😂😆👃🏻👃🏻 #Debates,1474938972719,780576743488888833,2
10,Mo_Holder,#Trump is making a little bit of sense.....#debates,1474938972601,780576742993866753,1
11,comprameunapiza,He has a 6th grade vocabulary #debates,1474938972796,780576743811788800,1
12,JoshWarrun,@JaneyGodley - I'm surprised... I keep hearing Trump sniffing... I thought it would be more of a snort or an oink? #debatenight #debates,1474938972661,780576743245709312,0
13,Jon_Berkemeyer,If you think you're going to make your air conditioners or your cars or your ties overseas...  #debatenight #debates #Debates2016,1474938972734,780576743551885312,0
14,MollyWkuk,ANSWER THE FUCKING QUESTION #dumbassdonald #Debates,1474938972813,780576743883051008,0
15,Consililv,Real-time #debates update: look up at your TV.,1474938972637,780576743144902656,1
16,lindsaystidham,Keep cookies in America. We're good at those. #debates,1474938972827,780576743941808132,1
17,weisser_stephen,"""Job creation will be created by job creating."" -probably Donald Trump. #debates",1474938972712,780576743459590144,1
18,ritanimal,small loan 🙄  #Debates,1474938972780,780576743744831488,1
19,Dillfam5,Ummmm.....BOOM https://t.co/lEuNm7Kj3V,1474938972731,780576743539273728,1
20,SuniDey,Someone hand this man a tissue #debatenight #Debates,1474938972811,780576743874711552,0
21,submarinostruck,Wall Street is still cooked how do we fix that #business #debates,1474938972825,780576743933382656,1
22,jackie_reads,What's with Trump's constant sniffing? A little pre-debate snorting? #Debates,1474938972872,780576744130609157,2
23,CedilloJennifer,Gunty made me do it .. #debates,1474938972946,780576744440946688,2
24,business,"Trump calls Clinton ""Secretary Clinton,"" and asks her if that's okay https://t.co/GqPl7CL7xz #debates https://t.co/Ilhfxb835D",1474938972369,780576742020943874,2
25,Katchin05,@Gris_LeLoup Just use pretty much any hashtag with debate in it #Debates2016 #debates #debatenight,1474938972930,780576744373755904,0
26,TheOrionHunter,Drink everyone the moderator has to bring Trump back on topic. #Debates,1474938972958,780576744491274241,0
27,pammyers310,Now who's sick?? Omg if he doesn't stop sniffling.... #debates,1474938972849,780576744034148352,0
28,evie121462,NO HILLARY the Great Recession started with your HUSBAND Fair Housing Bill and NAFTA  #Debates2016 #debatenight #debates,1474938973679,780576747515355136,0
29,TWill876,Is the Donald sick.... keeps sniffling... my word I thought he was always sniffling #Debates,1474938973660,780576747435601921,0
30,StevenTinel,"Hillary looks like she's about to cry. ""Stop mansplaining to me!"" https://t.co/xN51FE6ltI  #Debates",1474938973594,780576747158777857,1
31,rondia,"Hillary in red, Trumpster in blue. #FreakyFriday #debates",1474938973647,780576747381227520,1
32,captdope,Already thirsty??  #debates,1474938973723,780576747699830784,1
33,latinmermaid,nem sei qual deles é o melhor mas vou por as minhas mãos na Hillary  #debatenight #debates,1474938973643,780576747364487168,1
34,monarchist_usa,"#debates  #factcheck #Trump VAT tax is actually hotly debated, not ignored.",1474938973785,780576747959889920,2
35,dironablu2u,@redhed67 @FluffySays #TrickleDownEconomics doesn't work. #debatenight #debates #debate2016 #NeverOligarchy… https://t.co/rr6LIZlLe8,1474938973457,780576746584338432,1
36,JohnnyFoxRox,"#PAY2PLAY ONCE TRUMP WINS HILLARY WILL GO #FREE2PLAY

#debates #debatenight #Debates2016 #trumpedup",1474938973728,780576747720966144,0
37,HIjabbee,"He needs to practice what he preaches. You are one of those companies that ""left"" #trump #election #debates #debatenight",1474938973804,780576748039655424,0
38,PuzzleAtWork79,Kind of early for a water break. Good sign. #debates #debatenight,1474938973783,780576747951562753,2
39,Serena_HamOnt,"#DonaldTrump ""Is that okay? i want you to be very very happy...."" #LOL #debatenight #debates #Debates2016 https://t.co/6ImNmuYlBG",1474938973117,780576745158246400,2
40,Kiara_gotSWAGG,They pump you with a lot of words with no actual value lol. #debates #trump #clinton,1474938973726,780576747712421888,2
41,VWPickard,More Trumped-up trickle-down economics #Debates2016 #debates,1474938973685,780576747540586496,0
42,Christoph4Jared,"I'm all for feminism, but I'm NOT going to have a criminal for a president, or someone that third world countries will try to kill. #Debates",1474938973836,780576748173824000,1
43,WattsTeddy,#Debates Trump still not answered how he`d bring jobs BACK,1474938973791,780576747985088512,0
44,ShwahWahWah,"Hillary is spinning folksy tales and Trump is singing ""Mexico, China"" again. #debates",1474938973863,780576748287107073,2
45,jonplee,trump sick? why the sniffling? #debates,1474938973527,780576746877976577,0
46,NUGC411,#Debates Why is he doing that? Sounds like he's snorting.,1474938973879,780576748354215936,2
47,OliviaBurley1,I think my definition of a small loan is a little different than Trump's. #debates #debates2016 #ImWithHer,1474938973848,780576748224155648,1
48,ThePro3938,"Find Out More and watch the debate on
https://t.co/n1phcdpxY3
@KEEMSTAR #debatenight #debates #Debates2016 https://t.co/YervWBazb2",1474938973926,780576748551282689,0
49,globalnews,Hillary Clinton blasts Trump's plan to lower taxes for the wealthy as 'Trumped Up Trickle Down' economics #debates https://t.co/h0Vj9HEum0,1474938974702,780576751806091264,1
50,livinit,Uh oh...he's ramping up..he's gonna blow! #debates,1474938974679,780576751709741056,2
51,JTDabbagian,"About as many times as he's said ""China"" and ""Mexico."" https://t.co/czF8S633xk",1474938974666,780576751655104512,2
52,AurelisConTwtt,AJA YA HILLARY EMPEZÓ A SACAR TRAPOS  #debates,1474938974731,780576751927853057,1
53,brianGRRRR,Lester Holt better hold Trump's feet to the fire.  Need specifics!  #debatenight #debates #Debates2016,1474938974766,780576752074489856,0
54,EmilyReesBitch,"&gt;Hillary deflecting to the 'bailouts saved us =&lt;' crutch this early

#debates",1474938974713,780576751852265472,1
55,michelle4p,Immigrants are not stealing jobs. Businesses are greedy and underpay workers abroad instead of investing in American workers. #debates,1474938974341,780576750291988480,1
56,masood_619,#HillarysAmerica #debatenight https://t.co/ZtoOelYnnC,1474938974640,780576751546236930,1
57,ivansegarra4,Is constant deep breathes can It stop  #Debates,1474938974711,780576751843942401,2
58,mhrobson,"#Debates #DebateNight Falcons up 14-7 over NO, debate watchers. I'd say #Tremendous , but I'm a @Broncos fan.",1474938974626,780576751487295488,1
59,nncgibson,Hillary is so relaxed.  #debates,1474938974664,780576751646760960,1
60,Rmhenry1Henry,"Hillary: It was Bush's fault!
 #debates",1474938974674,780576751688699904,1
61,nabgowack,TRUMP HAS THE SWINE FLU #Debates #Trumpisdying #Spreadtherumor #Notfitforpresident,1474938974813,780576752271634433,0
62,IofficialseanI,"""Secretary Clinton"" IS WHAT DONALD TRUMP REFERS TO HILLARY AS... HE WANTS HER TO BE ""HAPPY."" #DebateNight #cbsnreax #DonaldTrump #Debates",1474938974766,780576752074625024,2
63,Original_Fuzz,Take a break from the #debates &amp; check out some BEAUTIFUL guitar straps at https://t.co/DLWCEgHb7o,1474938974673,780576751684423680,1
64,vNemus,Stop sniffing #Debates,1474938974777,780576752120766464,0
65,viznix,Why doesn't @lesterholt have the ability to cut mics if he needs to get control? #Debates,1474938974887,780576752582012928,1
66,THE_Smoot,We had a financial crisis and Obama bailed out the banks in spite of a full Democratic gov't #LetJillDebate #OccupyTheDebates #debates,1474938974843,780576752397643776,1
67,BaileySam,"#DonaldDeplorable  NO Plan to bring comapnies back
#Debates",1474938974838,780576752376487937,0
68,jencke,"Trump’s life in public discourse is a constant bullshit session.
https://t.co/hbOc1hRmNY  #debates #debatenight",1474938974745,780576751986454528,2
69,JNCinMpls,Why is Trump sniffing so much #debates,1474938974688,780576751747469313,2
70,BBCWorld,"""We have to stop our jobs from being stolen from us"" - @realDonaldTrump https://t.co/m3KgD2q1hd #debates https://t.co/jSvvINXOxc",1474938974931,780576752766623746,1
71,hollylabuono,And now she's kissing Obama's ass. Took her longer than I thought it would #NeverHillary #debates,1474938974874,780576752527609857,1
72,EzilGaloth,@chelseahandler That's what I was thinking. Probably a cold. Icky green boogers. #Debates,1474938974954,780576752863109120,1
73,JMandryk,Does Trump have the sniffles? #debates,1474938974922,780576752729001984,2
74,norajean88,Umm...is @realDonaldTrump coked out right now? #sniffles  #debates,1474938975734,780576756134612992,2
75,Gatorgirl4vr,no @HillaryClinton recession was because your husband repealed Glass Steagall #debates,1474938975678,780576755899834368,1
76,ConservBabes,"Hillary pretends to grow up poor and Trump pretends the loan from his dad was ""very small"". #debates",1474938975673,780576755878952960,1
77,mjsheartofgold,"my thoughts exactly, jedi mind trick https://t.co/zUeyEyDccM",1474938975563,780576755417395200,1
78,ShannonRaeArt,"""Back to the question"" haha thanks @LesterHoltNBC #Debates",1474938975696,780576755975266304,2
79,lukedg97,Donald Trump started off contained. He is off his leash now #debates,1474938975729,780576756113743876,2
80,ScottOnestak,"I don't agree with him, but Trump is on his message. #Debates",1474938975710,780576756034076674,1
81,senally,"Watch live! ""U.S. Presidential Debates"" #Debates https://t.co/9UCbid6bSr",1474938975593,780576755543191553,1
82,adicloud,DRAG HIM! #debates,1474938975733,780576756130537476,1
83,mVespa1,Trump pulling a Rubio there ...  #water #debatenight #debates,1474938975789,780576756365484036,2
84,pacoromane,Dat sniff doh. Si Patron.  @realDonaldTrump is looking for a bump in polls.  #coke #sniff #Debates2016 #debates #lines #bump,1474938975805,780576756432416769,0
85,googolplexking,trump has a cold #Debates,1474938975695,780576755971153924,2
86,ScottRouse3,@truthplane I agree.  It's a bit odd.  #Debates2016 #ReadPeople #BodyLanguage #debates #debatenight,1474938975660,780576755824328704,0
87,SchleppoMarx,"LH: How are you going to stop them from leaving, Mr.Trump?
DT: I'm gonna stop them from leaving, that I can tell you.  #Debates",1474938975627,780576755685920768,0
88,Apple_biz,We're live-blogging the debate! Follow all the action https://t.co/1bD2VUwGya #debates https://t.co/5EXvG5zzVQ,1474938975772,780576756294123522,1
89,missjuliebrown,Donald Trump is sniffing a lot.  Did he do blow before debate?? #debates,1474938975717,780576756063309824,2
90,Zonozi,No foreign cookies in my country @realDonaldTrump! #debates,1474938975852,780576756629639168,2
91,_fraserl_,*sniff* #Debates,1474938975844,780576756596113408,0
92,offi_kaseyr,this presidential debate is lit af #Debates,1474938975938,780576756990251008,1
93,DemocalypseNow,Did he just say we should devalue our currency? #debates,1474938975917,780576756902170624,1
94,A1000Truths,Donald's hands are shaking. #Debates,1474938975883,780576756759748608,2
95,fotofig,#Trump right now.  #debates https://t.co/CHPseJnCra,1474938975725,780576756096835585,1
96,GillGorman,SNIFF. SNIFF. SNIFF #debates https://t.co/DlR3M7UDoJ,1474938975639,780576755736272896,0
97,LiveWiresWA,He's having trouble breathing.   Pneumonia? #Debates,1474938975678,780576755899781120,1
98,PennyDreadful81,".@HillaryClinton NO, the recession was in large part to the neutering of Glass-Steigal, which YOUR HUSBAND did. #debates",1474938975957,780576757070069761,1
99,tmckernan,#debates https://t.co/4vL6pRlWBL,1474938975786,780576756352753664,1
100,PRlNCESSOFPOP,can he shut the fuck up thank you #Debates,1474938976667,780576760047951873,2
101,AriCaceres,Hillary con la diez!!!!  #Debates,1474938976660,780576760018505728,1
102,SemanticLad,"The #debates are not a thing I WANT to know about, but I feel like I should. 

Adulting is rough.",1474938976580,780576759683186688,2
103,NicoleAbbett,It's much more fun to watch the debate with #MSQRD! #debates #debatenight https://t.co/FToJpMlHMm,1474938976069,780576757539889152,1
104,suestroud,"Hey Donald the companies left under REAGAN, you act like it's a new thing, naw it's a republican thing #Debates",1474938976612,780576759817261056,1
105,BarefootTalk,The only way to survive these #debates!  Thankfully I found https://t.co/uEHr7yZU4k https://t.co/Ozj0EEaN6S,1474938976374,780576758818967552,1
106,tmpowellCW44,Sniff Trump tweet. #Debates,1474938976665,780576760039665664,0
107,aDeliciousMess,Yesssss @realDonaldTrump  please drink some water. Gesh #Debates,1474938976679,780576760098205697,2
108,mialeahcim,"Why is @realDonaldTrump sniffling so much. Maybe before he criticizes someone else health, he should look at himself. #debates",1474938976746,780576760379297792,0
109,chillinkristen,Holy shit William https://t.co/P0eaFNAI1M,1474938976643,780576759947358208,1
110,MJalreadytaken,Please for the love of all that is holy. Trump has to stop the deep sniffing! #debates. commercial break I hope his people address that.,1474938976666,780576760043831296,2
111,PhillyPartTwo,Hillary talks truth. #debatenight #debates #Debates2016 https://t.co/HSCsZShtz8,1474938976579,780576759678836736,0
112,ColemanMaloney,If I hear this moron sniffle again I might explode #Debates,1474938976685,780576760123559938,1
113,actaeon32094,Did they PLUG TRUMP'S mouth??? Wtf is he nose breathing?? #debatenight #debates #Presidentialdebate,1474938976715,780576760249352193,2
114,starbucksgirl51,Trump drank water.  WHAT'S WRONG WITH HIM???? Is he unhealthy?!?! #debates #Debates2016,1474938976740,780576760354177025,0
115,AJRendere,I can't wait for Trump to sneeze and get snot all over himself right in the middle of a big point. #debates,1474938976396,780576758911369216,2
116,Apple_biz,Trump and Clinton shake hands as the debate begins https://t.co/VrFko7jxm6 #debates https://t.co/of7P42Q64j,1474938976775,780576760501039105,1
117,aliciousnesss1,"Debate Moderator: how will you help bring back businesses to America. 
Trump: my dad gave me a loan. 
Clinton: trump sucks. 
#debates",1474938976742,780576760362446848,1
118,nopittie,#ANSWERTHEQUESTIONDON.  #Debates,1474938976841,780576760777707520,1
119,PulleyDakota,"i love donald
#debates",1474938976851,780576760819773440,1
120,TimSullivan11,Trump is sniffing quite a bit. I think he's coked up. #debates,1474938976788,780576760555372546,2
121,BenFreemanDC,Define hypocrisy: @realDonaldTrump lecturing about jobs leaving America after his companies sent thousands of jobs overseas. #debates,1474938976733,780576760324849664,0
122,St3vER_4548,Shaky hands Trump #debatenight #debates #Debates2016,1474938976938,780576761184563201,0
123,fraowe,"Holt asks 'how do you bring jobs back to USA' - Trump says 'don't let them leave'  Yowza! 
 #Debates",1474938976981,780576761364959232,0
124,KameronKindschi,Bush definitely did put us in a bad financial situation. #debates,1474938977678,780576764288348160,1
125,Mr_Scorpio,"#debates Wait, wait, is Trump talking about tariffs? He's setting up America to get sued in trade courts.",1474938977691,780576764342915073,2
126,LLMW_722,Donald trump on taxing companies makes sense #Debates,1474938977677,780576764284186624,0
127,jooooooo_mar,Shits gonna get real here in a bit.. #Debates,1474938977661,780576764217044992,1
128,yuripmin,"Love seeing the contrast between the two candidates, standing side-by-side for everyone to see. #Debates",1474938977639,780576764124917761,1
129,dylansabean,Answer the damn question! #Debates,1474938977575,780576763856490496,0
130,queen_of_bri,😂😂😂😂😂 https://t.co/ET8ZcpXxga,1474938977686,780576764322086912,1
131,kttk234567,#Debates2016 #debatenight #HillarysHealth #PresidentialDebate #tcot #p2 #OmittedHillaryQuestions #Trump #debates https://t.co/3EZajNkxU3,1474938977538,780576763701190657,0
132,DirtySouthTV,In all seriousness--is Donald Trump on coke right now? #Debates,1474938977679,780576764292689920,2
133,redinla_,Is Donald sick or did he rail a huge line of blow backstage? #sniffles #Debates,1474938977684,780576764313505792,1
134,_Andrea_D,"Ele tem uma paixão pelo México e pela China. Ofereçam-lhe umas férias, pá! #Debates",1474938977713,780576764435296260,1
135,SkyshockGG_Ego,"""Small loan"" se esta poniendo caliente esto #LUL https://t.co/os1xqQbJGl",1474938977758,780576764623855616,1
136,Dini_Muater,#debates #Trump having a flue? His nose running?,1474938977709,780576764418486274,2
137,Apple_biz,"Trump calls Clinton ""Secretary Clinton,"" and asks her if that's okay https://t.co/JpRz4XJFxT #debates https://t.co/AvjJ3ZhieT",1474938977717,780576764452081669,1
138,iainkidd,"Donald Trump claims he can stop companies from leaving the USA. You're going to need a much bigger wall for that one, orange man. #debates",1474938977825,780576764905066496,0
139,karlyvorm,What the FUCK is trump talking about #debatenight #Debates,1474938977882,780576765143977984,0
140,Xalbagarcia,"#México va ganando en el
 #debates",1474938977861,780576765056053248,1
141,ChroLikeTheBird,Ok ya but answer the question... @realDonaldTrump #debates,1474938977879,780576765131579392,0
142,hoosierclinger,She has nothing. Its glaring.  All she knows is lefty word vomit. #debates,1474938977904,780576765236215808,1
143,MattyA510,Why is Donnie T sniffling so much? #Debates,1474938977914,780576765278158850,0
144,staycee705,"Give Trump some oxygen, he's literally sucking the air out of the room#debates",1474938977859,780576765047635968,0
145,lgcover,How are you going to stop them from leaving Donald how create some plan that makes them pay a big fine for trying to leave  #Debates,1474938978037,780576765794066432,0
146,StergilNoir,"#debates 
Obama did fuck-all to help us.",1474938978020,780576765722918913,1
147,LeslieAlanMusic,Hillary macht 'ne gute Figur bisher. Nice. #Debates,1474938978612,780576768205938688,1
148,jayyykuhhh,@realDonaldTrump if you tax imported goods the price on everything will go up like CRAZY wtf #debates,1474938978738,780576768734310404,2
149,TRI_MY_LYFE,#Debates2016 #Debates trump is already taking head shots and body blows from @HillaryClinton .,1474938978699,780576768570777601,0
150,lys_daya,I hear Donald's voice and I get annoyed #debates,1474938978673,780576768461680640,0
151,mikepowell2,Someone bring that man a tissue!  SNL will have a ball with this...😜😜😜😈 https://t.co/fnK2a3lcw9,1474938978602,780576768163876864,1
152,dewanamaker,did he do a couple of lines before this started? https://t.co/QCvXx0JLZP,1474938978555,780576767966781442,1
153,ZoltanCOMEDY,I like how Donald Trump emphasized the fact that we owe 20 trillion dollars like we ever plan on paying that back #Debates,1474938978302,780576766905634816,2
154,GOPbaldspot,"Oh, Donald takes a drink of water... see his little hand shaking? #Debates",1474938978723,780576768671363076,2
155,IFearBrooklyn,"""I could name ... there are thousands of companies ..."" #debates #debatenight",1474938978713,780576768629563392,0
156,starsclaire,what is he even talking about #Debates,1474938978783,780576768923230208,1
157,SandyBabandy,#debates Jill Stein 8ft BANNER Sign #ItsInOurHands #3rdParty  #obama #optrump https://t.co/3TZrxwCjMF,1474938978612,780576768206004225,1
158,JacobPucci,Live look at Trump. #debates https://t.co/mJ2d3ygnke,1474938978634,780576768298213379,1
159,hayleybermel,"okay, but...how are you gonna get those jobs, trump? like, what are specifics? #debates",1474938978806,780576769019699201,2
160,eldamil_,they'retakingourjobs *sniff* chinaandmexico *sniff* #debates,1474938978819,780576769074094084,0
161,SpencerSchilly,he's a maniac  #Debates,1474938978904,780576769430564864,0
162,Charmedgal70,Agreed! #debatenight https://t.co/MVziNtfCcO,1474938978738,780576768734420992,1
163,WorldOfMelissaB,Yes! https://t.co/PWLM2yDfOO,1474938978871,780576769292181505,1
164,eldeanburrito,Keep it above the belt hillary. #debates,1474938978902,780576769422217217,1
165,stonedRobot9000,Why is Trump sniffing? Is that going to be his Gore sigh and eyeroll. #Debates,1474938978933,780576769552191488,0
166,QBuy_biz,#debates Trumps hand was trembling when he took a sip of water,1474938978851,780576769208385537,1
167,shork_kyle,Trumps got the sniffles #debates,1474938978943,780576769594183680,1
168,JLBelt,"Hillary as a stand up comic, Trumped up trickle down #fail #Debates2016 #debates #debatenight",1474938978975,780576769728393216,0
169,SNeverything,Trump trying to catch up with Hillary's coughing with a stuffed nose. #debatenight #debates,1474938978966,780576769690611712,1
170,jerneu,Trumps deep inhales sound weird. #debates,1474938978936,780576769564823552,1
171,Crinklepouch,#TurdSandwich #Debates,1474938978711,780576768621211649,1
172,JeremyWPorter,Trump seems to really love the smell of hot shit coming out of his mouth #Debates,1474938979033,780576769971662848,2
173,1_DapperDan,SIT... Stay... good #ford! #Debates,1474938978911,780576769460109312,1
174,ThatDamnLyrik,#Trump and these lil pinch fingers are killing me #Debates,1474938979689,780576772723138560,2
175,VincentWalker,Donald have no plans! #debates #DebateNight,1474938979719,780576772848877568,0
176,intnewsday,"ABC: .realDonaldTrump: ""We have to stop our jobs from being stolen from us...we cannot let it happen."" #Debates https://t.co/tUOreXIY0F",1474938979691,780576772731568128,1
177,jacksonrichman,"Here comes the mudslinging, folks. #debatenight #debates #Debates2016",1474938979728,780576772886638592,0
178,BridgetRCameron,"Someone forgot to use their nasal spray, or used something before the debate??? #Debates",1474938979775,780576773083803648,1
179,jenmuranetz,Seven minutes into #debates and Donald is already trying to belittle Hillary for being a woman. I want to puke on his toupee.#Debates2016,1474938979667,780576772630863872,0
180,IsabelLimaVIP,So you're talking about yourself right? #specialintrests #Debates,1474938979700,780576772769263618,1
181,iAmNotDiddyNBA,"Trump likes to say ""ever"" a lot...that's one of the many signs of a liar.  #debatenight #debates",1474938979771,780576773066985472,0
182,TheScream666,"FoxNews: .HillaryClinton: ""I call it Trumped-up trickle down."" #debatenight #debates https://t.co/gLMI5lnblp",1474938979709,780576772807098372,1
183,ashfree,If you think you're going to make your air conditioners or your cookies in Mexico... #Debates,1474938979579,780576772261838854,2
184,fotonuvo,https://t.co/1SZYdy1btH https://t.co/zPRO4zYedu,1474938979722,780576772861546496,1
185,lmhuntimer,".@realDonaldTrump says ""China"" *drink* #debates #drinkinggames #debatenight",1474938979686,780576772710555649,2
186,_notorious_ben_,#debates that was a weird story about drapery,1474938979807,780576773218140160,1
187,b_neigh,Just answer the QUESTION @realDonaldTrump! HOW are you going to bring jobs back? You already told us they were leaving 10x's over! #Debates,1474938979747,780576772966457345,0
188,ThatFishhh,TRUMP IS SNAPPING AYEEEE #Debates,1474938979784,780576773121552384,2
189,Lawcomic,"Hillary never took her eyes off Wall Street, amiright? #debates",1474938979744,780576772953743363,1
190,sfali789,WHO GAVE DONALD TRUMP PNEUMONIA #debates #debatenight #Debates2016,1474938979832,780576773322969088,0
191,Barb_Romano,Trump needs to blow his nose.. 👃🏻 #debates #debatenight,1474938979803,780576773201391616,2
192,FriedrichsMatt,Donald dodging the first real question. How unexpected #Debates #debates,1474938979805,780576773209673729,0
193,Lovebug419219,If he don't stop moving those little hands..that's not going to make us believe you #debates,1474938979885,780576773545361408,1
194,BuddyPrinceton,EINSTEIN said doing the same thing again &amp; expecting a different results is INSANITY!  WHO is smarter Einstein or T… https://t.co/onjGDMzQQB,1474938979667,780576772630777857,1
195,Martinez0Andres,Trump the drama queen #Debates,1474938979832,780576773322842112,2
196,hcap89,#debates I can't believe I actually look forward to @kanyewest running for presidency in 2020. #debatenight,1474938979792,780576773155291136,0
197,FatNinjaJim,#debates what does my wife pick up on Trump? His spray tan looks better tonight. Touche. How's his hair?,1474938979829,780576773310382081,2
198,nata_valladares,Y Trump cuando va a responder lo que se le pregunta? #Debates,1474938979882,780576773532704768,1
199,DStevems,#Debates lol!!!!!!,1474938980693,780576776934133760,2
200,DanishaCarter4,TAX THEM FOR COMING IN AFTER THEY LEAVE!!! YESSSSSSSSS NAILED IT!!!! #debatenight #debates #Debates2016,1474938980715,780576777026408448,0
201,keywee83,Oooops the Trumps hand was shaking while drinking water #debates,1474938980645,780576776733032448,2
202,brook108,A small loan???? #Debates,1474938980691,780576776925872128,1
203,danjhicks,#debates #debates2016,1474938980588,780576776493867008,0
