,screen_name,text,timestamp,tweet_id,cluster_pred
0,forevereIIen,yeah okay https://t.co/MOs5EOx1OI,1474940608799,780583605705650181,4
1,BriannaEvansss,"Ok now he's sounding like a stalker 😳 #debates ""I'll get there somehow."" Hide ya kids",1474940608795,780583605689016320,1
2,riotwomennn,"Here is an example. Trump is very good at financial matters? No, Trump cheats. Not just words. Watch  #debates 
https://t.co/CusWCYcmNr",1474940608850,780583605919547393,0
3,_ItWasntMe_,Literally dumb and dumber arguing. #Debates,1474940609645,780583609254150146,1
4,cynthiaboaz,Clinton should have brought visual aids. Let's see the faces of the bajillions of people screwed over by Trump. #debates #debatenight,1474940609725,780583609589600256,1
5,ProgressVA,"Its sounds like an UNBELIEVABLY bad idea. ""Certain Laws"" #debates #EndStudentDebt https://t.co/AXKzhRawk0",1474940609382,780583608151056384,4
6,Dakamargeo,"""Taking advantage"" so, doing dickish things because they're legal. That's...totally presidential, actually. #debatenight #debates",1474940609718,780583609560424449,0
7,naijaman,Is this a serious comment? https://t.co/Wa23OU9xug,1474940609564,780583608914444289,4
8,liberalvixen,"...ok, the sniffing is back. A tell? #debatenight #debates #Debates2016",1474940609709,780583609522532352,1
9,KelsiSickmann,SNIFF #debates,1474940610696,780583613662310400,2
10,sweetsallysue,#debates2016 #debates take advantage of the laws of the land...he forgot to say to screw whoever he can,1474940610569,780583613129641984,0
11,phoenixka,Trump complains about jobs leaving the US and then brags about his assets outside of the nation. #debates,1474940610681,780583613599318016,1
12,Darron_England,I just told @nbcwashington who I think is winning. Cast your vote now! #Debates #NBC4DC https://t.co/jXjOpFMDCb,1474940610547,780583613037436928,3
13,Vini_vlp,"The borders are already overflowing with fleeing People, @ReisengRath ?
They should.
#debates",1474940610587,780583613205254144,1
14,kentuckywoman_2,Sounds like Trump thinks he's above the law. #Debates,1474940610628,780583613377159170,0
15,ChadBlanchard1,"Soo, when are they going to let @GovGaryJohnson speak? #debates",1474940610629,780583613381369856,1
16,Claire_Bray,I don't think Trump understands what Hillary's job has been in the white house over the years #debates,1474940610816,780583614165635073,1
17,Laremixtv,I just told @nbcwashington who I think is winning. Cast your vote now! #Debates #NBC4DC https://t.co/B3uRsHtZGx,1474940610613,780583613314191364,3
18,trcfwtt,She is handing his ass.!!!!!!!!!!!!!!!!!!!! Go @HillaryClinton #debates,1474940610523,780583612936810496,1
19,RuthieRuthie2,"Benghazi Hillary, was sleeping during that phone call, now they are dead #Debates",1474940610737,780583613834244096,1
20,MollyJongFast,#Debates #DonaldTrump amazing business savvy!  #Maga #imwithher #DonTheCon #Debates2016 https://t.co/gCfBWFV2Pm,1474940610246,780583611774955520,4
21,mitchasfck,#debates so trump uses the laws to stiff the little guy. Straight from the horse's mouth,1474940610989,780583614891241472,1
22,valsthewoman,@HillaryClinton you lost lives in Benghazi but what difference does it make. @realDonaldTrump is a highly successful entrepreneur #debates,1474940611690,780583617831378944,1
23,JasonFebery,"Whoever had ""braggadocious"" in their #debates bingo wins the night!",1474940611234,780583615918903296,1
24,banjelerp,"You talk about how unbelievable a company it is, and you're right, Donnie: It's unbelievable that you've had so many go bankrupt. #Debates",1474940611716,780583617940496384,1
25,DanMeersand,"#debates You all heard the part where he basically admitted to not paying taxes, right?",1474940611643,780583617634316289,1
26,NoahRJA,I'm pretty sure @twitter exists solely for #debates like these.,1474940611547,780583617231585285,1
27,JoeMydoG,@realDonaldTrump it's okay too screw people over⁉️ #Debates,1474940611506,780583617059753984,1
28,ronkelawal,The ones he'll need to use when he has to leave after losing. #debates 🙏🏾 https://t.co/rB3JRwdpoj,1474940611647,780583617651015680,4
29,TWill876,I wonder how many times America will file for Chapter  11 under him... heaven forbid #Debates,1474940611745,780583618062065664,1
30,MaryCateOMalley,#debates Trump just lost! Promoting his effin hotel. NOT A GOOD MOVE.,1474940611744,780583618057863168,2
31,AmyBehrklar,Trump treats this political race as a long commercial for himself and his brand #debates,1474940611676,780583617772687360,1
32,HulkSmashEvil,Business man versus Career Politician. #HillaryForPrison2016 #ClintonCash #debates,1474940611646,780583617646960641,1
33,wolfofthefall,Im gonna die of alcohol poisoning https://t.co/GcCvhI1woM,1474940611702,780583617881714688,4
34,TheGnawvice,"""People Love Me"" - Trump 2016

#debatenight #debates #Debates2016",1474940611793,780583618263429120,0
35,Kevinzelman,Wasn't this the moment for Donald Trump to start acting more presidential? When is that happening? I'd like to know.. #debates #Debates2016,1474940611775,780583618187976704,0
36,seolhyunq,"＠null - gracehelbig Congrats on your 500❤️ tweet! https://t.co/yOqrfZq6Om

https://t.co/sF8gxxgrAe",1474940611696,780583617856573441,4
37,NatTowsen,"Trump's not lying, he has built an ""unbelievable"" company. #debatenight #debates #Debates2016",1474940611631,780583617584062464,0
38,CarlyLe209,"It's not just words, Trump. They are facts #debates",1474940611674,780583617764347904,0
39,taticavante,A Hillary parece eu na vida que tá toda cagada mas tá ali tentando parecer estar bem #debatenight  #debates,1474940611773,780583618179719170,1
40,Scgator1414,"I've built an UNBELIEVABLE company! HOW TRUE, won't release 1040's so how DO we know? #debates https://t.co/dKTH5IPb6e",1474940611542,780583617210748930,1
41,JaceyJune,I just told @nbcwashington who I think is winning. Cast your vote now! #Debates #NBC4DC https://t.co/LxHjKEvci6,1474940611840,780583618460520448,3
42,RealEdwinPos,Trump is an honest joke. #Debates,1474940612523,780583621325426688,0
43,wyattbelmonte,I like the set of Twitter for the US #Debates,1474940612706,780583622092820480,1
44,jnicely,What's the sniffle count? Anyone tracking? #debates,1474940612586,780583621589504001,1
45,ArcanePixels,"Okay Trump, we get it you have a billion dollar company get on with your point #debates",1474940612690,780583622025834497,0
46,JamesMCusickJr,Clinton is trying hard to force these sound bytes. Asking about small transactions that @realDonaldTrump probably wasn't involved #debates,1474940612650,780583621857902592,1
47,cuddlefist,OH at this undisclosed #debates  viewing: IT'S JUST MOUTH SOUNDS.,1474940612688,780583622017417216,2
48,siremastermind,Twww #Debates,1474940612651,780583621862236162,1
49,CaptainCold13,Oh my god. HAHAHAHAHAHA #Debates,1474940612782,780583622411595776,2
50,aiirhead_,"She's dragging him so hard, I can't imagine what it's like to argue with Hillary. #Debates",1474940612768,780583622352842752,1
51,MatthewFacciani,I can't believe one of our major presidential nominees just bragged about not paying taxes #debatenight #debates,1474940612483,780583621157617664,1
52,The_BlasGarcia,"""These ""illegals"" gotta go, they're criminals and don't pay taxes"" #ironic https://t.co/PmT5lT9t8b",1474940612728,780583622185062400,4
53,alexismallen,I want to thank you all for your support during this difficult time. #debates,1474940612793,780583622457761792,1
54,campyWHY,"dude, she's KILLIN him #debates",1474940613658,780583626085896192,1
55,SketchLords,"I think you can stick a fork in Mr. Trump... he's most certainly done.

#debates #debatenight #trump #hillary",1474940613679,780583626173849600,0
56,uesfunnygrl,#debates How can we have a president run our country when he can't even run his businesses?!  He's been bankrupt SIX TIMES!,1474940613738,780583626421506048,1
57,Comments4Today,"The fact is, all other presidents gave in to peer pressure. That's why they released theirs #Debates",1474940613814,780583626740072449,1
58,jesskry,He's opening a post office?! #Debates,1474940613774,780583626572435456,1
59,LoganJames,"Yes, @realDonaldTrump, it's all words. That's kinda how a debate works. #debatenight #debates",1474940613787,780583626627047425,1
60,smichaelwilson,"Trump: ""It wasn't wrong when I swindled people because it wasn't against the law."" #Debates",1474940613719,780583626341806081,1
61,ThoseThingsILov,is his sniffling his tell? #debates #debatenight,1474940613904,780583627117645824,1
62,Beleifer05,"2 minute rule out the window. Lester, where you at man? #debates",1474940613789,780583626635415552,1
63,finchfrii,"Fundamental political truth.
#debatenight #debates https://t.co/OWg0cXsCf1",1474940613856,780583626916319232,4
64,7_Veils,I just told @nbcwashington who I think is winning. Cast your vote now! #Debates #NBC4DC https://t.co/tfpvewokLc,1474940613788,780583626631176192,3
65,LA_Debra,"WTH is he talking about? 
 #Debates",1474940613796,780583626664706053,1
66,danielchg,Does nobody else see it? #debates https://t.co/jZo0c8Ld62,1474940612572,780583621530824704,4
67,jessicamwicks,"You're supposed to screen people before you hire them, not stiff them on the bill because you don't like their work #Debates",1474940614657,780583630275907586,1
68,shleighlarae,Drumpf is using words like a high schooler who just came from SAT prep #debatenight #debates,1474940614705,780583630477209601,1
69,VaderVonDoom,He's accusing her of speaking in sound bites?!?!?! #Debates,1474940614246,780583628552171520,1
70,RainRbx,He played the Email card..... #Debates,1474940614723,780583630552702976,1
71,moon_is_sharp,Is sniffing Donald's new tell? #Debates,1474940614676,780583630355566593,1
72,crissifuentes,Ojalá el día de las elecciones los gringos le digan a Donaldcito #yourefired!!! #debates,1474940614509,780583629655306240,1
73,Michiganborn58,"#Trump says his job is to do well for himself
#Trump finally tells the truth
#debatenight #debates",1474940614684,780583630389129218,0
74,madoislilo,I need a drink and it's only 10:43AM... #debates,1474940614779,780583630787649540,1
75,andreaking962,".realDonaldTrump: ""Why did she delete 33,000 emails?"" #debatenight #debates #Debates2016 https://t.co/OQlyAIGcAP",1474940614720,780583630540341248,4
76,karin4000,I have to agree. https://t.co/bM6PMj3KeP,1474940614704,780583630473134080,4
77,LoveeDiannaa,I'd do this but I ain't tryna die 😂 https://t.co/aqXFHBTGoN,1474940614718,780583630531801088,4
78,ofarther,@RogerJStoneJr @billclinton @ClintonFdn @ChelseaClinton  @realkingrobbo @timkaine @SenatorReid #TRUMPTRAIN… https://t.co/MHhiCynpHL,1474940614597,780583630024298497,4
79,socflyny,Why isn't anyone questioning the state of Trump's health with that horrendous nasal drip? #debatenight #debates #Debates2016,1474940614670,780583630330617856,1
80,kagnyama,say something  about the mystic messenger bans #debates,1474940614726,780583630565416961,1
81,JanKimbrough,It makes him smart to stuff our country in taxes? Disgusting #debates,1474940614757,780583630695374848,1
82,katherinekiyoko,"If we need a gold plated toilet built, we'll let you know, Trump. But we have a real leader to run our country, Hillary Clinton. #debates",1474940615691,780583634612789249,1
83,NewsMoeda2,https://t.co/njzo2FsMvY ETHEREUM FREE #Decision2016 #AskDemi #JuntosComMafiaSdv #debates #blockchain #bitcoin https://t.co/hZnYySOfDl,1474940615456,780583633627312128,4
84,kindeticsandman,Both candidates are completely out of touch with the general populace. #Debates #DebateNight,1474940615709,780583634688356353,1
85,VerumCor,Trump just said he takes advantage of the laws of the country. What will he do as a president then? #Debates2016 #debates,1474940615649,780583634436849664,0
86,HollyLarry,iConcur! https://t.co/QkuhPiWflG,1474940615733,780583634788954112,4
87,BryanVanNorden,Trust a poker player to identify a tell. https://t.co/cMGDfGqH3N,1474940615651,780583634445230081,4
88,LogicLens,"My god, these #debates are a slug-fest! Emails, tax-fraud and stiffing-workers. No. Holds. Barred. WOO!",1474940615724,780583634751279104,1
89,Hanzi83,Like it really matters the whole world is going to shit https://t.co/x9lu8f0t0j,1474940615609,780583634269048832,4
90,kvainbergg,can he speak about the actual topic?? #debates,1474940615762,780583634910769152,1
91,LoveeKaay___,I just told @nbcwashington who I think is winning. Cast your vote now! #Debates #NBC4DC https://t.co/LkfH1OGcgo,1474940615701,780583634654879744,3
92,aeroangel3321,"I don't get why Hillary keeps using these phrases like ""drapery"" to reference back to her dad. I mean, make the point once #debates",1474940615768,780583634935934976,1
93,thibodeau,Starts sniffing again... #Debates,1474940615639,780583634394808320,1
94,WestWingAddict,watch as @realDonaldTrump brag about taking advantage of bankruptcy law #PresidentialDebate #debatenight #debates,1474940616662,780583638685462528,0
95,alicesrq,Tonight  #debates we have learned making history isn't necessarily a grand moment.,1474940616501,780583638010368000,1
96,mhess4,🙏🙏🙏 https://t.co/bm4ZDVBuPo,1474940616502,780583638014554113,4
97,MainStVoice,Hillary is reading from the same old script. Tired talking points with some prepared zingers. #debatenight #Debates2016 #Debates,1474940616637,780583638580752389,1
98,TrumpTainWreck,Trump plugging his hotel... Unbelievable  #debates,1474940616655,780583638656098304,2
99,ronnie59th,"What a time to be alive A corporate charicature vs an actual cartoon character, US and the UK currently need to pull our socks up!  #Debates",1474940616636,780583638576558081,1
100,straalpaal,"Trump: ""Look: it's all words. It's all sound bites.""
*proceeds with sound bites about own company*
#debates #debatenight",1474940616692,780583638811418624,1
101,idleacts,Donald had the sniffles.  Sad!  #ImWithHer #Hillary. #debates #debatenight,1474940616612,780583638475927553,1
102,MasonRaburn,Gotta fact check if I live in a 3rd world country right quick. #debates,1474940616622,780583638517817345,1
103,1_DapperDan,#Debates https://t.co/XNLcRPBaNP,1474940616619,780583638505324544,4
104,kyle_oharrow,Just because it's legal doesn't mean it's right #Debates,1474940616814,780583639323058176,1
105,laurackramer,"Trump, you're yelling + interrupting. Good behavior for bullies. Bad behavior for presidents. #ImWithHer #debatenight #debates #Debates2016",1474940616702,780583638853414912,1
106,RoyleRedlegs,And we left this man out. Good job America. Good game. Good effort. https://t.co/qfQdOFm40H,1474940616652,780583638643638272,4
107,EvanMZimmerman,I can't stand Trump but I feel bad for him. Totally outclassed right now. #debates,1474940616764,780583639113428992,1
108,dot_notfeather8,"hillary suggesting apology from trump to ""stiffed"" workers? and where are the apologies to the benghazi families she lied to? #debates",1474940616711,780583638891016193,1
109,broncomaniac7,Pennsylvania Ave. Is that close to Park Place? We playing monopoly?? Lol #debates,1474940616574,780583638316429316,1
110,beyoncadonk,This fool is unreal. Nothing makes sense #Debates,1474940616750,780583639054741505,1
111,MLHunterWriting,#debates or Trump infomercial?,1474940617496,780583642183634944,0
112,FallenArcAngel,Donald trump admitted to not paying the little guy by taking advantage of the law.  #debates,1474940617716,780583643106250752,0
113,eladsinned,"""Is he an honest man? Well, he swims in the same waters we all do"" #Debates",1474940617549,780583642405834752,1
114,VMcVoterface,"Geez, she opened the door for the loony anecdotes....  #debates",1474940617748,780583643240468480,1
115,hpc3,Yup. https://t.co/z5xDXPBtyt,1474940617632,780583642753970176,4
116,ProudlyLiberal,"Trump: ""I built an unbelievable company"".  ""Unbelievable"" is a good word for it.  #debates",1474940617635,780583642766729220,1
117,autism_torific,He has to pass go to get to Pennsylvania ave #Debates,1474940617714,780583643097862144,1
118,james_powditch,If Goebbels was running Trumps campaign would Trump pay him? #debatenight #debates,1474940617695,780583643018174464,1
119,VirtualNight,"H - ""You did not pay him"" D -""Maybe he did a bad job"" #Debates",1474940617811,780583643504750592,1
120,nathenmcvittie,WE DO NOT GIVE A FUCK ABOUT YOUR BUSINESS @realDonaldTrump #Debates,1474940617629,780583642741534720,1
121,Gazellebusiness,Im certainly glad my father never did business with you. @HillaryClinton #debates,1474940617778,780583643366330368,1
122,JessicaRothbart,She deserves a metal. And a presidency. #debatenight #Debates2016 #debates,1474940618669,780583647103504384,4
123,jchasbeck,"Yup, that lady is FIERCE. #Debates2016 https://t.co/7pqpV1o3ii",1474940618507,780583646423945217,4
124,EvelDick,"So Trump thinks he is smart not paying taxes? So that makes the rest of us who do PAY TAXES, stupid? 
#debates",1474940618560,780583646646374400,1
125,zooomlenz,Hillary playing on the small business small-guy pathos #debates,1474940618692,780583647199973377,1
126,DonnaDror,Trump said that not paying taxes makes him smart #debatenight #Debates,1474940618649,780583647019687937,1
127,ThatJeff_Dude,I'm convinced @realDonaldTrump doesn't know how the U.S. Government operates. Probably couldn't name the 3 branches. #Debates,1474940618714,780583647292248064,1
128,jupitaur,"More sniffling, what's up with his sinuses? #debatenight  #debates",1474940618642,780583646990311425,1
129,JasonPickens,All the fact checkers right now #debates https://t.co/iRdwtZEOwv,1474940617805,780583643479674880,4
130,charlesnlam,"Half way through the debate, we’re on question two https://t.co/Dm6lrRb0wF",1474940618499,780583646390521857,4
131,shogunofsin,"#debates 

""We used certain laws that are there...""

Oh really? You take advantage?

Fuck you, mother fucker.",1474940618675,780583647128584192,0
132,aiyanapoe22,he's determined  #Debates,1474940618647,780583647011282944,1
133,LeeHoward57,"release the transcripts, release the tax returns, release the emails, RELEASE @DrJillStein !!!! #Debates",1474940618729,780583647355269121,1
134,rosegoldenptx,so done #debates https://t.co/NekrsIk2Cc,1474940618412,780583646025494529,4
135,LivingOnChi,"Jill:""We have an amazing sketchnoter, MorSpicer, on set drawing me + my Press Director! #debates #OccupyTheDebates …",1474940618343,780583645736296448,1
136,H8aid,Take advantage!  #Debates,1474940618681,780583647153913857,0
137,AmberKiara2,"""It's all words. Who needs words? When im president we'll just glare and grunt suggestively"" #debates",1474940618729,780583647355236352,1
138,McCullough_PJ,He has literally talked more about his Goddamn hotels than he has his fucking policy plans... #debates,1474940618718,780583647308939265,1
139,aaroncynic,"""I take advantage of the laws of the nation"" is at least a good descriptor of how corrupt the system really is #debatenight #debates",1474940618816,780583647720202242,0
140,kairisyeols,omg he's basically admitting to taking advantage of corporate loopholes in a presidential debate... #debates,1474940618802,780583647661461504,0
141,708Antonio,He's advertising!!!!#Debates,1474940619582,780583650932903936,1
142,nicepearson64,I just told @nbcwashington who I think is winning. Cast your vote now! #Debates #NBC4DC https://t.co/WDxRap3t8G,1474940619587,780583650953953280,3
143,Emanncook,Is Trump going to pass out on live television? Please pass out on live television. I will love debates forever and ever. #debates,1474940619677,780583651331280896,1
144,CelestineBeet,"#debatenight #Debates2016 #debates I guess if Trump doesn't like finished product, he doesn't pay. Gov't pays no matter the outcome. Easy $",1474940619588,780583650958176257,1
145,CormacCor,"Hillary just pwned Trump with that ""King of Debt"" comment
#debates #debatenight",1474940619659,780583651255939072,1
146,foxville_art,"""Maybe he didn't do a good job"" IM SCREAMING ofc trump is one of those shitty clients who wouldn't pay an artist after a commission #debates",1474940619705,780583651448856576,1
147,patrick_kirk__,I just told @nbcwashington who I think is winning. Cast your vote now! #Debates #NBC4DC https://t.co/JQGFGMZ28N,1474940619582,780583650932817920,3
148,Complex_News,".@RealDonaldTrump on @HillaryClinton: ""Typical politician: all talk, no action. Sounds good, doesn't work. Never go… https://t.co/jopkXd6Fko",1474940619253,780583649553092609,4
149,jbutler70,Yep. But weak comeback from Trump. https://t.co/dNbwl9MPVF,1474940619579,780583650920464384,4
150,haleypj,I just told @nbcwashington who I think is winning. Cast your vote now! #Debates #NBC4DC https://t.co/FM5YxwuAKF,1474940619654,780583651234963456,3
151,BethShaum,Braggadocious. Figures the only twenty dollar word Trump knows has to do with his ego. #debates,1474940619760,780583651679539200,1
152,offbeatorbit,She just needs to keep going after his business. It renders him incoherent  #debates,1474940619681,780583651348283392,1
153,wholesomeslut,This very much describes Drumpf https://t.co/hK2Dq1GSL4,1474940619719,780583651507601408,4
154,lilbigfoot3,Wow he's promoting he's own crap #Debates,1474940619814,780583651905933312,1
155,BonezSuave,🤔🤔🤔🤔 https://t.co/lmRkwt99yg,1474940619647,780583651205603333,4
156,aaronsalomong,#debates Clinton saca la artillería y le increpa a Trump por deuda millonaria. El magnate se defiende con denuncia de los emails.,1474940620472,780583654665904128,1
157,realTimThompson,Hillary doesn't understand business. She takes money from countries that oppress women and still have slavery.  #Debates,1474940620666,780583655479521282,1
158,eggycrunchybob,"Mr. Trump, when will you pay your workers the money you owe?
#debates #debatenight #Debates2016 https://t.co/dNO9BaTa8v",1474940620457,780583654602907648,4
159,emily_rhoads,"Does anyone have a running tally on how many times Trump has said ""tremendous""? #brokenrecord #debates #Trump",1474940620721,780583655710351360,0
160,VaVoomBurgoon,Tens of thousands of people love me ... #Debates # PartyofLincoln,1474940620598,780583655194431488,1
161,cocoashaybutter,He can shut up about that gaudy af trash hotel he built here #Debates,1474940620702,780583655630602242,1
162,TravisACarr,@TravisACarr Bernie would've answered this. #debates,1474940620671,780583655500550145,1
163,SeanyWony,"Or, how he's like, Bragging, about dodging paying Federal Income Taxes?  #Debates #debatenight",1474940620596,780583655185981440,1
164,dee_sparks,I would bet on the other way. #debates,1474940620765,780583655894691840,4
165,EstherNMNLim,"2/ Trump Entertainment Resorts ('09) #debates I had to list @realDonaldTrump bankrupt biz in 2 tweets. Ummm no, you suck at $ #debates",1474940620713,780583655676575744,0
166,DevenMisra,"Gary, the you're supposed to get drunk AFTER the debates. https://t.co/DmCO2aWDnE",1474940620635,780583655349555200,4
167,naklh68,Did Trump just admit he is taking advantage of the laws of the nation? #debates,1474940620584,780583655135641601,0
168,mjohns16,"Cause she's never stiffed anybody, I'm sure. #factcheck https://t.co/1LzT2S7w6L",1474940620678,780583655529775104,4
169,rorogadget,"""If i dont get there one way, i'll get to Pennsylvania Ave another""
- Donald Trump

#debates #debatenight",1474940620708,780583655655608320,0
170,nhtanesa,captain's reaction to this debate #debates #CaptainKuma #goodboy #instadog #instapyr… https://t.co/mEIDgq0L8K,1474940620695,780583655601082368,0
171,AASmith25,Can we please talk about issues that are relevant our COUNTRY and not to either of your pretentious person lives?! #debates #debatenight,1474940620756,780583655857065984,1
172,Shaun_Kels,Go TRUMP #Debates,1474940620672,780583655504801793,0
173,Keledry,I don't understand a word out of @realDonaldTrump's mouth. #Debates,1474940620713,780583655676776448,1
174,Ninsiima250,But riyaleeeeeee https://t.co/j8kHZV2laN,1474940620814,780583656100360192,4
175,amandarin,"Fact: A country does not, and *should* not, run like a business. Two entirely separate systems. #debates",1474940621572,780583659279560708,1
176,dkemper,@leahmesaid #debates,1474940621729,780583659938062336,1
177,VMacGregor,"#Debates  ""It's all words""  He didn't pay. Now he's sniffing over and over.",1474940621660,780583659648659456,1
178,Kpop1677,"Trump: ""We are a third world country."" 

Me: Ummmmm did I learn what third world countries are incorrectly in school? 

#debates",1474940621731,780583659946385408,1
179,Resxuh,"Trump is doing an excellent job backing up his statements, Iove it #DebateNight #Debates",1474940621690,780583659774541824,1
180,MaureenShaw,I would LOVE to know what's going through Hillary's head every time Trump opens his mouth. #debates #debatenight,1474940621731,780583659946598401,1
181,JPManring,"#Trump ""I've built an *unbelievable* company, it's unbelievable."" He's right, I DON'T BELIEVE IT. #Debates2016 #Debates",1474940621698,780583659808124928,1
182,QueenLushtifa,All you Trump haters... open your eyes and ears Hillary will be the death of our country. Look at her record She should be in jail! #Debates,1474940621597,780583659384475649,1
183,catitcomb,"Please change the subject, Lester! #debates",1474940621751,780583660030455808,1
184,NicooRisso,"""Our airports are like a third world country"".  A Aeropuertos Argentina 2000 no le ha gustado esto #debates",1474940621781,780583660156284928,1
185,OBXPatriot,#MAGA #debates  https://t.co/CkIpMDNBJZ,1474940621557,780583659216703488,4
186,Demers_Jim,"#debates #Debates2016 #ImWithHer #IAmWithHer @HillaryforNH I was so wrong, he really didn't prep for the debate. More plugs for his hotels",1474940621741,780583659988480000,1
187,hyperhobbit,#debates someone gets him some flonase please!!!!,1474940621623,780583659493556224,1
188,allie_brady,Trump seems like that one uncle who hugs you too long and then tells you how pretty you are while squeezing your wrist. Right? #debates,1474940621842,780583660412104705,0
