,screen_name,text,timestamp,tweet_id,cluster_pred
377,ContraGodarria,Extraño a Bernie Sanders #debates,1474940497857,780583140381392896,1
378,StevenTinel,Hillary's drowning. #Debates,1474940497887,780583140507066368,1
379,acacias_mom,If you use the products people give you you can't say you're unsatisfied with their work #asshat #debates,1474940498685,780583143854137345,1
380,DCWillbanks,"She has kept her temper much, much longer then I ever could #debates",1474940498670,780583143791177729,1
381,TheTygryss,"He KEEPS saying he didn't pay taxes! WTF! If he becomes prez, IRS BETTER cancel ALL my shit!! #Debates",1474940498516,780583143145345024,1
382,mharris621,"""If your best claim is your business, then we need to talk about it.""-@HillaryClinton YEPPERS. #debates #debates2016",1474940498575,780583143392837632,1
383,PressTMC,Back in #Cork and insomnia leads me to #debatenight. An unexpected candidate awaits her turn... #votelucy… https://t.co/BUKwLctTzm,1474940498294,780583142214209536,0
384,poohcatmeow,Clinton insert knife and twist. Show no mercy. #debates,1474940498678,780583143824732160,1
385,erinmfuller,"We have business, lots of employees. I pay them too much money, but that's okay. Who cares?"" Trump Rally, Winston-Salem NC, 7/25/16 #debates",1474940498564,780583143346700288,1
386,mzneisha0005,"He completely disrespects both Hillary and Lester.  Not surprising, but so blatant. #debatenight #debates #Debates2016",1474940498562,780583143338303488,1
387,aliyaleigh,Trump just destroyed the Republican Party #Debates #debatenight,1474940498672,780583143799595008,1
388,CarlaBillups,Notice his body language when she discusses @realDonaldTrump  stiffing people who did work or him..shaking his head yes. #debates,1474940498563,780583143342497792,1
389,caryannesimpson,Did he just admit that he would stiff other countries?  #debates,1474940498645,780583143686406144,1
390,D_Pthree,Politics drifts us further apart #bullshit #Debates,1474940498677,780583143820627968,1
391,harval,She didn't fight them that night in Benghazi so well. Four brave men died! She could have done better! https://t.co/fz3IJ2CQh9,1474940498636,780583143648657408,0
392,altbritannia,It's coming back now Donald #Debates,1474940498712,780583143967485952,1
393,dzifah,Did @realDonaldTrump just say bragadacious? hahaha he is #bragadacious compared to @HillaryClinton #debatenight #debates,1474940498717,780583143988428801,1
394,mjlaforge,@HillaryClinton and @realDonaldTrump should both read this. #LetGaryDebate #debates https://t.co/Px8HB8OQtD,1474940498736,780583144067964929,0
395,SteveJiwanmall,Is it wrong that I'm watching the #Debates through my friends' snap stories -- where they put filters on the candidates' faces?,1474940498724,780583144017854464,1
396,Ryan_Monast,#Debates Hillary dropping bombs on Trump rn,1474940499661,780583147947888641,1
397,gladstone2016,World Bank Logistics Performance Index for US Infrastructure - https://t.co/afpUNCEKOj (though infrastructure does need help) #debates,1474940499704,780583148128051200,1
398,_KINGMORNEE,Dawg this man is a clown and rude as fuck .  #Debates,1474940499730,780583148237180932,1
399,scottsands,Hillary mentioning her father's job almost as much as Kasich. #Debates https://t.co/hdIsoM3BMn,1474940499681,780583148031729664,0
400,fdsinclair,#bragidocious he's self obsessed which is not good for democracy #DumpTrump #debates #HillaryClinton,1474940499816,780583148597895168,1
401,KingCretot,@realDonaldTrump is a paranoid lunatic. Go @HillaryClinton wipe your shoe with him #Debates2016 #Debates,1474940499679,780583148023193602,1
402,BarbDuckett,Attention attention...Lester Holt has been found!! #Debates https://t.co/72dPdVSYUe,1474940499712,780583148161634304,0
403,143lehualove,"@cfhorgan hold Trump accountable for tax returns &amp; business history and Clinton accountable for emails, and elect Stein instead. #debates",1474940499659,780583147939430400,1
404,dball1126,What a word #braggadocios #debates,1474940499743,780583148291756032,1
405,m_rath,She never met any of those people. #Debates,1474940499719,780583148191186944,1
406,mone_96,Here comes more shade! Was the question about Trumps businesses? #Debates #vcusmclass,1474940499836,780583148681703424,1
407,PHOTO_COMMANDER,https://t.co/M4xhXIyJSY,1474940499731,780583148241428480,0
408,virenemann,Not a mistake you put our country at risk. https://t.co/NuokxEjexF,1474940499827,780583148644020227,0
409,chevella777,How about taking care of our Veterans #debates hmm,1474940499797,780583148518244353,1
410,RekLeCounte,"You've been in politics a long time, &amp; the country is so much the worse for it. #debatenight #debates https://t.co/PEM6kAxCi1",1474940499784,780583148463788033,0
411,milkkbub,#Debates  TAKING THE GOODS,1474940499879,780583148862238720,1
412,avatans,#Debates  Good comeback by Clinton on Trump business issues.,1474940500675,780583152200871936,1
413,AmyAlbright,King of Debt #debates,1474940500629,780583152007778305,1
414,Sundayriver81,Che bella la mia home piena di gente incazzata con quel minchione #debates seguo le persone giuste 😌,1474940500649,780583152091860994,1
415,revol_ution_ary,Donald could just turn everything Hillary's saying around on her -- she's guilty of some of the same things she's accusing him of #Debates,1474940500689,780583152259592193,1
416,varun032,#Debates I just started watching it and now m bored!,1474940500713,780583152360132608,1
417,Cheesesteakwid,"you don't agree ? Poor healthcare, weak education, corrupt politicians, biased media- recipe for 3rd world https://t.co/e04rP1MJDI",1474940500570,780583151760396288,0
418,ElleWoodsMD,"Come on Lester, get control of this debate! You're getting ""Kayne Wested"" out there! #Debates2016 #debates https://t.co/gru5Bhu5uq",1474940500487,780583151412269057,0
419,DRE3K,Hil is unbothered and passionate. #debates,1474940500662,780583152146345984,1
420,jdot_jdot,mention his bankruptcies? his manufacturing of products abroad? trump university? #debates,1474940500699,780583152301596673,1
421,ellerich17,Is Hillary talking about her business in Haiti?  #debates,1474940500643,780583152066654209,1
422,steve_deturck,#debatenight #debates #Debates2016 https://t.co/zSrK0n9vba,1474940500549,780583151672369152,0
423,honhonbaguettes,Our country should not be a business #debatenight #debates,1474940500776,780583152624500738,1
424,MAcatholicmom,So tired of politicians.  she is so boring boring boring....talks and talks and does nothing #Debates,1474940500613,780583151940804610,1
425,chrisdemon29,"I agree, even though he's probably still looking for Aleppo #debatenight #Debates2016 https://t.co/E5eAze5Byk",1474940500829,780583152846647296,0
426,callingyouout44,Donald about to be KO'd #debatenight #debates,1474940500745,780583152494452736,1
427,desireasap,Where those emails at Hilary #debates,1474940500800,780583152725159936,1
428,seanieboyy6,"SMART MOVE, HILLARY'S TEAM!!! They brought receipts! #debates",1474940501580,780583155996721152,1
429,_serenityjay,I just told @nbcwashington who I think is winning. Cast your vote now! #Debates #NBC4DC https://t.co/LFuM3vozXz,1474940501632,780583156214751233,0
430,MyInNerds,I hate to fucking say this...but I think Donald Trump is making some good points. (I hate them both.) #debates,1474940501648,780583156281860096,1
431,cassandrarupia,STIFFED ARCHITECT IN THE AUDIENCE THAT IS A POWER MOVE WELL DONE HILL SLAY #debates,1474940501709,780583156537630720,0
432,mdelvrod,#debates este #Trump esta delirando. no responde preguntas sino habla de lo que quiere y su numero el 30. jajajajaja,1474940501613,780583156135129088,1
433,Yvonne_2016_,Wikileaks strikes again! https://t.co/9Cb5xVuJXC,1474940501634,780583156223188992,0
434,MerleTalk,Ha! The architect is in the audience #DumpTrump #Debates #Debate2016 https://t.co/EoT1120Y2e,1474940501462,780583155501793281,0
435,vTcLeary,You don't just not pay somebody for the work they did #debates,1474940501748,780583156701245440,1
436,librariananaya,You can't just not pay because you decide later you dont like it.  #debates,1474940501371,780583155120025600,1
437,anniemorning,What was the question again? #debates,1474940501704,780583156516786176,1
438,365REBEL365,aSK HER WHY R PEOPLE OF HAITI CALLING FOR CLINTOS BE THROWN IN JAIL #Debates,1474940501499,780583155656826880,1
439,DeAnnSmithkc,Repeating myself but who did and didn't prepare for this is showing #debates,1474940501747,780583156697169920,1
440,taylorcrumpton,please do not align yourself with the struggles of small business owners to seem like you are on the side of the middle class #debates,1474940501752,780583156717989888,1
441,marcdaalder,What does any of this have to do with America??? #debates #Debates2016 #debatenight,1474940501838,780583157078847488,1
442,jsnyjsny,the airports are plusher in china and dubai? what is he talking about? #Debates,1474940501907,780583157368315909,1
443,rakkasan1187,HRC is good at talking bad about her but she's not talking about what she offers. Apparently she doesn't have anything to offer #Debates,1474940501849,780583157124988930,1
444,coletty892,did Trump just say that if you don't like something then it's okay to cheat people out of money?? #debates,1474940501973,780583157644955648,1
445,rogers_stark,"Trump, our airports are perfectly fine... an airport isn't a casino! #Debates",1474940501879,780583157250789376,1
446,MarkusT81,When you realize one of these two people will be the next President of the United States #debates https://t.co/oUhfu0koKB,1474940502415,780583159498993664,0
447,jayisnotsexy,she just fn nailed it #Debates,1474940502640,780583160442679296,1
448,Rujabes,"Trump stiffed architects? Because apparently, ""Maybe he didn't do a good job."" Seriously though, f*ck him. #debates",1474940502746,780583160887128064,1
449,SWAGGF2DB,WTF!?! Str8 Not Paying Ppl Mr.Trump?!? Str8 Dick move. #Debates,1474940502268,780583158882369538,1
450,kix1979,@LesterHoltNBC How about we get back to REAL debate and discuss policy vs. a street fight? #Debates,1474940502748,780583160895549440,1
451,yoyitaa_,Eating pozole while watching this debate. I pled the 5th Donald  #Debates,1474940502749,780583160899743744,1
452,MichaelNiewidok,Donald Trump's favourite emoji: 👌🏻 #debatenight #Debates2016 #Debates,1474940502640,780583160442519552,1
453,troymccoy69,#PresidentialDebate @HillaryClinton scores https://t.co/V3rvpXivW6,1474940502490,780583159813533696,0
454,Msboldylox,"Obviously he ain't never been to O'hare
 #debates",1474940502770,780583160987942912,1
455,BTrustOriginal,Yo...he's literally admitting to doing shitty things...how the fuck... #Debates,1474940502750,780583160903897089,1
456,CTCarolKeny,Lester has got to get better control of this debate.  He is allowing Donald Trump to talk out of turn. #Debates,1474940502817,780583161185071109,1
457,Leovanni_Losada,Who's winning? #Debates,1474940503615,780583164532129792,0
458,RevDebra,God bless her for staying calm. I can hardly breathe. #debates,1474940503562,780583164309831682,1
459,KellyJeong_DC,How is it even possible? @realDonaldTrump just bragged about how much he made last year....😡#debatenight #debates https://t.co/fDsEizxxFV,1474940503655,780583164699742208,0
460,JorgeEGoyanes,"#debates Hillary taking the big stick out, no pay for work done on Trump jobs thousands of people he's stiffed, bankrupcy",1474940503637,780583164624396288,1
461,JoshuaNoonan,@HillaryClinton ha! @realDonaldTrump's taxes might be better spent on #infrastructure #debatenight #debates #Debates2016,1474940503614,780583164527927300,1
462,SuellenMarjorry,Said the woman who paid people to smash blackberries #Debates,1474940503628,780583164586647553,1
463,thewad1971,"When are they going to talk about Hillary's ""charitable"" organization #debates",1474940503772,780583165190664192,1
464,ShibaFromShire,Looks like Trump is holding back from getting into a punching match! #constipatedlook  #debates,1474940503749,780583165094010880,1
465,yungdanward,What the hell? Pay your architect!! @realDonaldTrump #Debates,1474940503715,780583164951617536,1
466,wivesgonenuts,#SnifflingDonald https://t.co/XoDfqDjaBl,1474940503689,780583164842344449,0
467,JaniceMontalto,Was doesn't #LesterHolt keep them on topic ?? And get appropriate responses He's doing a horrible job !!  #Debates2016 #debatenight #debates,1474940503731,780583165018636292,0
468,destebella,#DebateNight #ImWithHer https://t.co/3pQAp3orEt,1474940503748,780583165089898496,0
469,TheChloeDawn,Current debate reactions. #debates https://t.co/WihP5ZQw7E,1474940503090,780583162330177537,0
470,missfoxyroxy5,Which Trump stated he doesn't pay because he's smart!!!! https://t.co/EzKdBmCjPk,1474940503677,780583164792016896,1
471,cwegan,Had @realDonaldTrump ever heard of the 5th Amendment? #debatenight #debates #Debates2016,1474940503699,780583164884443136,1
472,EzilGaloth,Hillary has just launched the nukes. #Debates #debate2016,1474940503812,780583165358252032,1
473,RuiHCruz,Trump diz que é esperto por não pagar impostos. Ter votos mesmo assim é já uma vitória. Da estupidez humana. #debates,1474940503651,780583164683161600,1
474,basemmohammed77,#debates donald trump please keep silent boooo shhheeeet 😷😷😷😷 https://t.co/Wt1Qn7xob6,1474940502960,780583161784827906,1
475,loisaltermark,"STOP INTERRUPTING you sexist bully. And pay your bills. You cheat everyone, King of Debt. #debatenight #debates #ImWithHer #TrumpLies",1474940503785,780583165245087744,1
476,sophievodka,#debatenight #debates https://t.co/srdOqxAdaU,1474940503807,780583165337350144,0
477,ebonykenna3,"""It was a mistake and I take responsibility for that,"" Clinton says on her emails. ""That was a more than a mistake,"" Trump says. #debates",1474940503738,780583165048029184,1
478,MrDevvysAccount,"and so the debate is technically over, congratulations @HillaryClinton! #debates",1474940503799,780583165303910401,1
479,MasonDontTweet,Speaking on the debt our country has and Trump is complaining about how US airports look like 3rd World airports? 😂 😂  foh man #Debates,1474940504671,780583168961150977,1
480,KTGAPGov,@realDonaldTrump we're in debt because you don't pay taxes #draghimhillary #laneapgopo #debates,1474940504347,780583167602270208,1
481,RachelDena,"So true! RT @shay4mo: The sad thing is, the people that really should be watching the #debates are ... https://t.co/MjDp7tO0wr",1474940504681,780583169003286528,1
482,faithspeaks,"Sec. Clinton paints the image of architects, dishwashers and repair people who were not paid by Trump, says they were ""stiffed."" #debates",1474940504724,780583169183485952,1
483,DionneObeso,*hand up* https://t.co/DcuDeMJiUO,1474940504659,780583168910893056,0
484,Hextanium,"""The nation is getting deader"" -Donald Trump   great choice of worse....#Debates",1474940504675,780583168978128896,1
485,lauriemaldonado,"brag·ga·do·cious
adjective
boastful or arrogant.
""it sounds braggadocious, but I don't think I ever dropped a pass in a game"" #debates",1474940504606,780583168688685057,1
486,Nanegra,Yes he did... https://t.co/UVibUbH84M,1474940504595,780583168642613248,0
487,TheCornerStoehr,Johnson should be on that stage #Debates,1474940504593,780583168634068995,1
488,CorazondeGuinda,"Me importa una piedra del patio el #Debates , me preocupa más que pasó todo agosto sin llover...eso debería preocuparnos a todos",1474940504684,780583169015840768,1
489,HeyRatty,"I Stand w/ Trump on Newark Airport

#debatenight #debate #debates",1474940504602,780583168671875072,1
490,DavidKazzie,"The candidates for president of the United States are arguing about a specific construction project 

#debates
#Debates2016",1474940504656,780583168898400256,1
491,happybluej,"""That would have been squandered too."" He's basically admitting he doesn't pay taxes. #DebateNight #Debates2016 #debates #staywoke",1474940504711,780583169129062400,1
492,SidePitch,#debates #debatenight She's checking Trump's ass all over the place. lmao,1474940504694,780583169057705984,1
493,cat_davis,"When accused of not paying taxes (#hisfairshare), Donald: ""It would be squandered too."" That's not a denial. #deplorable #debates",1474940504727,780583169196040193,1
494,CO2_unFiltered,BOOM! https://t.co/8L9lJ8r0Dt,1474940504714,780583169141579778,0
495,OnlyPlayWizards,.@realdonaldtrump your retort for Chief Guh's stance on dragons? #rpg #dnd #dungeonsanddragons @DungeonsDonald #debates #debatenight,1474940504804,780583169519067136,1
496,WritersFengShui,"@CaptStobie @billmaher I'm about to start counting.
#debates",1474940504819,780583169582063616,1
497,Shane106320,"#debatenight
#Debates2016 
#debates https://t.co/ecq627CuYc",1474940504648,780583168864845824,0
498,falentames,Will the same loophole-mastery that legitimized Trump not paying federal taxes fix the economic issues in America? #debatenight #debates,1474940504782,780583169426722818,1
499,Saxist4Ever,This debate isn't even a debate. #debates,1474940505694,780583173252001793,1
500,MattASmitty,Loving the twitter experience here! #Debates,1474940505689,780583173230956545,1
501,Gracie_Finch,"Oh, Donald, honey, don't they say we shouldn't take these kinds of things personally? #debates",1474940505573,780583172744552448,1
502,Gr33d_SC,Damn Trump just started killing it out of nowhere #Debates,1474940505672,780583173159809024,1
503,lisasalvary,#OccupyTheDebates #Debates #Jill2016 https://t.co/rAEqSUCPsQ,1474940504967,780583170202755073,0
504,SaylesTeam,I think you mean dissatisfied**** #DebateNight #debates,1474940505740,780583173444935680,1
505,sanchezloza,😂 https://t.co/372qmXCvNE,1474940505590,780583172815872002,0
506,BklynsMelody,Lmfaooo!!! #MyFace https://t.co/3Qomo7XEzV,1474940505547,780583172635500544,0
507,jackomato,debating if Trump has ever seen a third world country if he compares America to one 🤔 #Debates,1474940505767,780583173558145025,1
508,ObsidianFtw,Isnt the hillary brand of politics a cliche now? #debates,1474940505757,780583173516296192,1
509,GeoffThorne,i'm close. it's disgusting he's there at all. https://t.co/ejcHa7ENtO,1474940505636,780583173008728064,0
510,britney_spheres,#Debates thought the euros were finally over bloomberg,1474940505775,780583173591863300,1
511,CelestialSonata,"Well, guess I'll be moving out of the country. #debates",1474940505743,780583173457645568,0
512,JacquiHeinrich,Among the words I did not expect to hear tonight: squeegee. #debates,1474940505817,780583173767962625,1
513,EnigmaticBecca,Don't take the interruption Clinton. Boss bitch move #Debates,1474940505827,780583173809840128,1
514,J_Maynes,I don't want to be braggadocios but I might be weird.  #Debates,1474940505941,780583174287994880,1
515,gringochulo1,#debates Shut up @HillaryClinton  Who cares about @realDonaldTrump  ??? Don't be sucked into his trap!! Tell us what YOUR plan is for US!!!!,1474940506696,780583177454620672,1
516,cultofdusty,#Debates Trump is getting slaughtered. Bragging about yourself more than a gangster rapper is not a terrific debate tactic.,1474940506707,780583177500827648,1
517,TweeterMoe,And now @realDonaldTrump suggests the US not pay its debts? #EconomicSuicide #Unhinged #debates,1474940506746,780583177664421892,1
518,MimMgmgmg,#debates wow she got the nerve ? BITCH WHERE IS #HAITI MONEY,1474940506728,780583177588924416,1
519,latay7292,"how many times is he going yo repeat the same rhetoric, and not answer the questions #Debates",1474940506709,780583177509371904,1
520,Leaderkilla,hillary is kinda destroying omg #Debates,1474940506722,780583177563746304,1
521,wilflare,Did Trump just inadvertently mention he does not pay federal taxes? #Debates,1474940506660,780583177303711744,1
522,RDinNY,Hillary fact-checked me. Six bankruptcies #debates,1474940506715,780583177534500864,1
523,laura_enright,My dad owned a business. Stiffing the subcontractors is not how you do business. #Debates,1474940506771,780583177769234433,1
524,veens24,"""we've become a third world country"" ihu donald #Debates",1474940506829,780583178012549121,1
525,brandirichard,How can you say @HillaryClinton alone is responsible for the lack of infrastructure improvements in the entire country? #debates,1474940506823,780583177987301376,1
526,Old_School_Barb,"Lester Holt only interrupts Trump, only admonishes audience when they applaud Trump. #TrumpAlreadyWon #debates",1474940506762,780583177731670017,1
527,mizunapologetic,Did he just blame the small guy for him ripping theM off #debates #debatenight #Debates2016,1474940506721,780583177559703552,1
528,MontemaranoA,SheHasStiffedEveryAmerican! #Debates,1474940506860,780583178142556160,1
529,khoroWITZ42,#debates 40 minutes into the debate and we've touched on one policy issue,1474940506832,780583178025201669,1
530,Shrympp,Hilary only hit hard with her premade speeches.  I wanna hear something from the heart #debates,1474940507658,780583181489537024,1
531,Barbara69550161,Hilary #factd #Debates,1474940507575,780583181141540869,1
532,Peasberry,"@GovGaryJohnson built a small business, never went bankrupt, and kept his business dealings honest.  #WhereIsGary? #debates",1474940507673,780583181552463872,1
533,StarhopperGames,"I never thought I'd be saying this, but Trump is being surprisingly lucid... #Debates",1474940507692,780583181632180224,1
534,JetsLag1,#debates I shouldn't pay someone for not perfect work -Donald Trump,1474940507646,780583181439344645,1
535,Lizinka2001,Bragidotious? Is that even a word? #Debates,1474940507568,780583181112086528,1
536,skinnytalls,All these debates are is a dick measuring contest. It's just too bad that neither of these candidates have one #debates,1474940507726,780583181774761984,1
537,armani_salado,"I wish you would explain your tweets, rather than using popular public opinion. Moron? How ?  https://t.co/pUBS10B6xq",1474940507415,780583180470452224,1
538,VPain1,6 Bankruptcies? #debates,1474940507713,780583181720260608,1
539,NoelleHedgcock,"@SamanthaJ011, Bonsai II has dropped two leaves since the start of the #debates. I think he's stressed.",1474940507591,780583181208739841,1
540,WeezyAndMJ,""" DISHWASHERS "" #debates",1474940507699,780583181661663232,1
541,queenziesss,This is better reality tv than any Keeping Up With The Kardashians episode. #debatenight #Debates2016 #debates,1474940507721,780583181753917440,1
542,figandoliveblog,@deray He's right though. #debates,1474940506935,780583178457190402,1
543,pechilvr,#Debates Trump you looper.... I think you're sad! Nail him Clinton!,1474940507813,780583182139666432,1
544,thefakerebecca,Inside and out. #debates https://t.co/kDvQ7iCNyG,1474940507303,780583180000595969,0
545,DCXn24Fan,Using his own words! #boom #Debates,1474940507739,780583181829349376,1
546,keerkeer,Hillary's doing great. Trump's lookin' like a 🍆. #debates,1474940507828,780583182202568706,1
547,BRueckwald,"Maybe he didn't do a good job, so I stiffed him. #Debates",1474940507685,780583181602922497,1
548,EGreen627,So how can she fix that mistake? How can we move on? #HofstraJournalism #HofDebate16 https://t.co/r5uNAQOgAZ,1474940507790,780583182043189248,0
549,CelestineBeet,#Debates2016 #debates #debatenight Hillary says Trump doesn't pay his bills. He stiffs workers. First I've heard of this. Trump's a meanie!,1474940508564,780583185289805824,1
550,Donkey_Feed,"#Hillary: #Trump should apologize to the thousands he stiffed in his businesses.
#TrumpUniversity #TrumpTaxCheat #Debates2016 #debates",1474940508581,780583185360965632,1
551,EmHorowitz,"Yup, that happened. #Debates https://t.co/x1zPbi4331",1474940508601,780583185444921344,0
552,firexstydia,tô assistindo mas não tô entendendo nada #Debates,1474940508681,780583185780465667,1
553,MARSHALLCOMIC,Did Trump say debtornation? Is that like hateration or holleration and most importantly; has it ever been in the dancery? #debates,1474940508688,780583185809829888,1
554,simonkowski,Let's forget the overwhelming poverty and focus on the length of time spent at check in. https://t.co/XdG4SKatgL,1474940508649,780583185646321664,0
555,drizzy0414,These interruptions by Trump are hilarious #trumperuptions #Debates,1474940508738,780583186019606528,1
556,SideOfGinger,"Third world airports? I had waffle fries and a glass of wine at LAX, Mr. Trump. How dare you. #debates",1474940508674,780583185751027712,1
557,RomanBarna,"#Debates
Nice, Trump is being crushed on his business-crap.",1474940508850,780583186489278465,1
558,RebelBrown,And Lester doesn't seem to care... RT @HuffingtonPost: 🔥🔥🔥 https://t.co/D3dmJzgFEy #Debates,1474940508647,780583185637896194,1
559,gesn10,Clinton questioning his business practices is pissing Trump off. #debates #debatenight #thinskin,1474940509688,780583190003974144,1
560,loopecalte,#Debates2016 #debatenight #debates https://t.co/qqHsiuHgOU,1474940509517,780583189286785026,0
561,Arletta0301,"What about the people that she's had killed?
  #Debates",1474940509697,780583190041731072,1
562,BonnieL73841656,"#NeverHillary
#GoTrumpGo https://t.co/II8bJ0mfV4",1474940509590,780583189592940546,0
563,rjeskow,Effective line of attack on Trump's business -- but we're not talking about improving people's lives. #debates #debatenight @ourfuture,1474940509573,780583189521768450,1
564,SmartGal4Trump,"#debates #debatenight #MAGA #CrookedHillary #SickHillary 

Watch #ClintonCash before you vote!… https://t.co/UjN25B5jNH",1474940509407,780583188825378816,0
565,alextron24,Donald Trump sounds good right now #DonaldTrump #debatenight #debates #Debates2016,1474940509589,780583189588811780,1
566,rymickyd,"trump doing that thing you do when ya on 2,000 words in your essay and you need 3,000 so you use random phrases to make the count #Debates",1474940509725,780583190159175680,0
567,Leon802Lilibeth,Watching the presidential election #debatenight #debates #Debates2016 #HillaryClinton #DonaldTrump https://t.co/efyVzVqNiU,1474940509485,780583189152731137,0
568,GladdenSheila,They did a bad job! It happens everyday! https://t.co/CyOZfebcV2,1474940509564,780583189483925504,0
