,screen_name,text,timestamp,tweet_id,cluster_pred
0,AlyceBarry,"Maybe not faking, he's hilarious https://t.co/uWP0XIiMIc",1474940476698,780583051634024448,0
1,ellacjfic,"he's literally just yelling and name-calling who in their right mind wants this third grader to run our country
#debates",1474940476821,780583052149919745,1
2,Maria_ARfan,"Yes people, braggadocious is a real word. Was it necessary or impressive, no? What would be impressive is if he answered questions #Debates",1474940476364,780583050233180160,1
3,jerrieadidas,Trump is such a hypocrite I wanna die #StopTheTrumpTrain #debates,1474940476840,780583052229521409,1
4,ggssgg2011,#debates ترامب حرامي,1474940476785,780583051998982144,1
5,wendyr13,Admits he breaks contracts with architects and others #debates,1474940476834,780583052204441600,1
6,jenilynn1001,Governments that stone rape victims and throw Gays off buildings have donated MILLIONS to the Clinton Foundation!… https://t.co/YeYOCQ8Pv3,1474940476568,780583051088633856,0
7,kaiaheffernan,If you're unsatisfied then apparently you don't have to pay for anything #debates,1474940476848,780583052263075840,1
8,JellyDonutDNP,Drive it home Hillary #debates,1474940476879,780583052393066496,1
9,josealonsotv,Ya ves que no nos ganan en todo? https://t.co/oJbfDWZXwT,1474940476769,780583051931684865,0
10,StephenCorren,Throwing it out there. @Snapchat you da real MVP #debates https://t.co/baRFzcCp0z,1474940476284,780583049897598976,0
11,michaeldutcher,Now @realDonaldTrump is in trouble - he brought up the biz - @HillaryClinton is beating with his own words #debates,1474940476841,780583052233830400,1
12,Grahamfmorris,"Well, she ain't wrong about that. Gotta pay the people who do the work.... #Debates",1474940477684,780583055769546752,1
13,FireEyedGrl,Trump just basically admits to paying no federal income taxes. #wtf #whatisthislife #debates,1474940477550,780583055207596032,1
14,da1iaa,I'm only watching this BC my social studies teacher said she would give me hella extra credit on it https://t.co/553G9r0lPf,1474940477604,780583055433961473,0
15,555charlie555,Wait. Is braggadocious a word? I'm serious. #debatenight #debates #Debates2016,1474940477714,780583055895306241,1
16,gabrielaotz,Really? How can someone take this clown seriously!! OMG he's a JOKE #TrumpVsClinton https://t.co/LSIec9zdhM,1474940477660,780583055668891648,0
17,WTDurham,Emails vs Tax Returns.  The new Rebel Alliance and Empire.  Or is it Empire and Empire. #debates #debatenight #StarWars,1474940477728,780583055954026496,1
18,baponte,This is like a primary debate. No civility or tradition. God help us. #debates,1474940477625,780583055522095104,1
19,_thebriny,".... ""it would be squandered, too""? Did Trump just admit not paying federal income tax? Yikes. #debates",1474940477615,780583055480291328,1
20,BridgBranni,"#debates #DebateNight ""WE LIVE IN A DEBTOR NATION""
""What about that architect you literally never paid?"" https://t.co/Xh8i5Jja2R",1474940477390,780583054536347649,0
21,nathanziarek,Should be part of the on-screen graphics. https://t.co/2jVuBGtNG5,1474940477623,780583055513837569,0
22,Advice1Sports,I cannot believe how much Trump is beating her. This is shocking. #debatenight #debates,1474940477730,780583055962537984,1
23,racingladydi,"Taxes for the both of them and tax returns is not the issue. Let's talk policy. Foreign policy. Not nit picking.  Not slander 

 #Debates",1474940477739,780583056000376834,1
24,Mr_Venlet,"Bro, I live for this!!!!!!!!!!! #chsgapchat https://t.co/tEV5X8nrM1",1474940477674,780583055727718400,0
25,britpop86,So anyone is watching the #debates?,1474940477686,780583055777861632,1
26,LauraSakerUT,On purpose* https://t.co/EwNDmx1oWi,1474940477773,780583056142848000,0
27,SethGoodtime,"Guys, I just learned I'm flying out of a 3rd World Airport in 2 weeks! P.S. I live in the USA #debatenight #debates",1474940477786,780583056197332992,1
28,LinkinMedo,I hope I'll have some IQ left by the end of this #debatenight #debates,1474940477662,780583055677333506,1
29,KentJHughes,"@HillaryClinton we don't care that your dad worked with drapery. Just saying.
#Debates",1474940477722,780583055928991745,1
30,jjsam14,Why didn't you pay for services rendered Donald?  #Debates,1474940477663,780583055681527808,1
31,beddychew,"@realDonaldTrump clearly you haven't been to a '3rd world country' airport if you think LAX, JFK, Newark are comparable #outoftouch #debates",1474940477697,780583055824134145,1
32,Sciwhat,Wow. Just wow. It's like a call for a political version of the game of doctor. #debatenight #PresidentialDebate  https://t.co/azrUCkhrku,1474940477706,780583055861747712,1
33,CK_Rivers,"Clinton: we have an architect in the audience who did your clubhouse add you didn't pay"" trump: ""maybe he didn't do a good job"" #debates",1474940477865,780583056528637952,1
34,skernan,HRC going after Trump's record of stiffing his service providers. #debates,1474940477391,780583054540668928,1
35,na3eemn,هى وشها قلب كده ليه و الضحكه راحت من ساعه ما جبلها سيره الايميلات .. #debates,1474940477780,780583056172343296,1
36,Chaucerjr,CLAP BACK HILLARY!!!! #Debates,1474940477874,780583056566587392,1
37,FouadElyaagoubi,"ThingsWork: RT TaylorNikolai: Trump turns into Voldemort when you do a Snapchat face swap

#debates #debatenight https://t.co/eRmXuHRxsg",1474940477844,780583056440778752,1
38,jimfromchapter6,You still pay people when they don't do a good job. #debatenight #debates,1474940478684,780583059963809797,1
39,DefineAmerican,"If you want to know the millions of Americans who have more than politics at stake during the #debates, follow the hashtag #HereToStay.",1474940478510,780583059234123776,1
40,Dani_Burch,"Trump's just making up his own words. ""Brag-a-docious""? #Debates",1474940478703,780583060043464704,1
41,matiasjarah,"Trump dice que quiere (re)construir EEUU (carretereas, aeropuertos etc), pero con qué plata, si quiere reducir el ingreso fiscal? #Debates",1474940478677,780583059934552065,1
42,virginianpilot,"HC says Trump has ""stiffed"" thousands of people through his businesses. #debates https://t.co/uXDugfHio9",1474940478388,780583058722394112,0
43,dPixVitamiN,Can we try again with Bernie? #debates,1474940478589,780583059565473793,1
44,templewolf,You don't owe anyone an apology #Debates,1474940478503,780583059204681728,1
45,Alice_Emm,I need a new drinking game to get through this... #debates,1474940478566,780583059469074432,1
46,STFUfilm,"""Drapery installers"" Jesus, let's not go there @HillaryClinton #Debates",1474940478653,780583059833839617,1
47,DonovanKasp,But Hillary would squander that as well. Hahaha #debates https://t.co/YK5EGiPsCp,1474940478622,780583059703885825,0
48,Anita_Sarah,"""If your main claim to be POTUS is your business, we should talk about it.""~Clinton Yep-&amp; also how that's not sufficient qual. #debates",1474940478620,780583059695349760,1
49,rejected_stone,That dude from Hofstra rockbottomed all those people who clapped. #fact #debates #debatenight,1474940478744,780583060215508992,1
50,IAteCreamquake,#Debates  HILLARY IS OWNING HIM GO TEAM HILLARY,1474940478754,780583060257505280,1
51,JeffreyOrlowsk1,"Reading all these comments is a waste of time, you've all made up your minds long ago #Debates",1474940478748,780583060232372224,1
52,Epiphany237,I just told @nbcwashington who I think is winning. Cast your vote now! #Debates #NBC4DC https://t.co/O9MWTXvaAx,1474940478707,780583060060381184,0
53,Cerentha,One way to look at it. #debates https://t.co/t171smi7EP,1474940478599,780583059607293952,0
54,cheaddc,"If you pay some damn taxes, maybe we can fix America's highways, Donald Trump.  
#debates  #showyourtaxes",1474940478755,780583060261703681,1
55,CNNisDISGUSTING,you sure stiffed the Haitian people .. you have no right talking! nut bag Hillary #debates,1474940478800,780583060450447360,1
56,toorriiee,I'm hoping one of them spills it on themselves😂👌🏻 https://t.co/j7BAaVaO8g,1474940478796,780583060433539072,0
57,grlong85,Il Douche is making an appearance #debatenight #debates,1474940479686,780583064166477824,1
58,RobertOryx754,#debates This is what you get when a sixth grader debates a seasoned neoliberal.,1474940479566,780583063663288321,1
59,jillbillpill,"""If your main claim to this office is your business, we should talk about it."" #DebateNight #Debates #Debates2016",1474940479702,780583064233611264,1
60,freeverse2032,let me make sure i've got this right...our biggest problem is our airports? just checking. #B4Hillary #debatenight #debates #Debates2016,1474940479658,780583064049033216,1
61,mitzilu33,#Debates,1474940479748,780583064426643456,1
62,MagsNews,Hillary says if he paid his tax more roads etc etc would be possible. He says 'that would be squandered too' (Has he not paid??)  #debates,1474940479732,780583064359538689,1
63,ellenm53,@cbetancourtPR Does that rhyme with SUPERCALLIFRAGILISTICEXPEALIDOTIOUS? #Debates,1474940479708,780583064258818049,1
64,TheCarCzarsPage,Only in spirit... https://t.co/XeLM0dmw6u,1474940479595,780583063784861696,0
65,jared_goede,"Hillary: ""We wouldn't have wasted SIX TRILLION DOLLARS if Trump had paid income taxes"" #debates",1474940479668,780583064090980353,1
66,hoppingbean1,"Hillary just can't talk privacy, it just doesn't work because of her scandalous history #debatenight #debates",1474940479761,780583064481230848,1
67,ImAllanWinters,#debates #GeneWilder custom BLACK #Wonka #LAPTOP DECAL White  #DEMS #TopProg #sgp https://t.co/rH08sYpHX1,1474940479602,780583063814344705,1
68,DCHomos,"I'm not satisfied with @comcast - does that mean I don't have to pay them lol 
#debates #debatenight #debates2016",1474940479687,780583064170852352,1
69,LaFemmeNikkita8,Did he just say I'm dumb because I pay taxes? #debates #ClintonVsTrump,1474940479825,780583064749559809,1
70,RodneyRuark,The @realDonaldTrump  just wiped the smile off of @HillaryClinton face. #debates,1474940479725,780583064330117120,1
71,westiesrule13,so he pretty much admitted there he didnt pay any federal tax Wth DJT did u just fall for oldest trick in book #Debates,1474940479848,780583064846020610,1
72,cutechick8668,#debatenight #debates Architect in the audience.  You were not happy with the facility but you're using it though!,1474940479791,780583064607027200,0
73,skyyysofly,#Debates https://t.co/08QVuKRbH3,1474940479515,780583063449329665,0
74,j__eng,@marieewagner https://t.co/BLNSXXu1kS,1474940479549,780583063592038401,0
75,xCrazyGreen,Never heard any of the debates Donald has been in but my god he always finds a way to cram Mexico into his argument #debates #debatenight,1474940479803,780583064657354753,1
76,LovaiiNavlakhi,"#Debates debtor means you have to recover money not pay debt. Trump, you didn't know that?",1474940480633,780583068138516482,1
77,Trump_Sniffs,"Nope, just Hillary! #sniff #debates https://t.co/fE5Id3WZSz",1474940480687,780583068364967936,1
78,travelsbybubble,"He's literally using every topic to which he needs to supply actual answers, and using it to circle back to his narcissistic self. #debates",1474940480351,780583066955685888,1
79,muyjota,#debates muy determinantes para el futuro del país los temas de los que están hablando. es por ahí.,1474940480627,780583068113498112,1
80,HillaryLostMe,".HillaryClinton got BernieSanders' tax returns but didn't release transcripts!
Emails for realDonaldTrump's taxes?
#debates #debatenight",1474940480671,780583068298055684,1
81,GinkaTarnowski,#debates @realDonaldTrump you never pay anyone,1474940480625,780583068105007104,1
82,carlosandoval_7,Can't believe I'm saying this but... C'mon Hillary get your shit together #Debates,1474940480706,780583068444741632,1
83,iamdefstef,Listen. Just had to take a walk around my building last week due to this. https://t.co/JoVyvrdIjk,1474940480510,780583067622662145,1
84,Habituallylame,Nobody ever wants to pay for infrastructure ever. https://t.co/3q0tlzpUsM,1474940480656,780583068235018240,0
85,MsGlea,Clinton talking about how Donald doesn't like to pay his bills is mighty strong tea...  #Debates https://t.co/PThFeGecF6,1474940480576,780583067899404288,1
86,jus_jerr,YESSSSS DRAG HIM ABOUT HIS BUSINESSES!!!!! #Debates,1474940480687,780583068365193216,1
87,PoolMyths,Finish him....fatality #debatenight #Debates2016 #debates,1474940480789,780583068792827908,0
88,Xethyl,"#Debates ""Like my dad was"" before I married a president and becme a money hungry whore.",1474940480604,780583068016975872,1
89,James_Sloat,Donald Duck is common punk thief con artist! #Debates,1474940480791,780583068801245184,1
90,toddeherman,".@HillaryClinton is 100% more effective vs. Trump than any Republican was at any time. 

So sad. 

We had great candidates #debates",1474940480857,780583069078007809,1
91,baekebyan,"They are both evil yes, I like how they throw rocks on each other. #debates",1474940481668,780583072479621120,1
92,NickTaranto,"Hit him hard on shorting small biz owners, not what an honest biz owner does #Debates",1474940481621,780583072282574848,1
93,trooperMoo,"#debates when I made faces like Trump is making my parents used to say ""watch out or else your face will freeze like that""",1474940481646,780583072387432449,1
94,davrone86,"Quality like Trump Steaks, Trump U, Trump Vodka... #debates",1474940481769,780583072903200770,1
95,JessicaHuseman,Trump suggests he does not pay his workers because they didn't do a good enough job. #Debates,1474940481555,780583072005750784,1
96,someregretaz,.@realDonaldTrump leaving the debate tonight #debates #lilhands #shortarms https://t.co/BhnMSRhsy7,1474940481642,780583072370610176,0
97,GryffynHobsynII,"Trump's response will be ""No I didn't, but EMAILS."" Calling it. #Debates",1474940481703,780583072626540544,1
98,FatChickinLA,"#debates
Trump I am great at business.
Clinton: yeah you don't pay anyone. I met them all. Here is one in the audience
Trump: Awkward.",1474940481512,780583071825342465,1
99,muchmoresalt,"WayneDupreeShow: YES!!!!

Trump: Your email wasn't a mistake, it was purposely. Staffers took the 5th to protect you

#Debates2016 #debates…",1474940481771,780583072911720449,1
100,popsugarnews,".@hillaryclinton: ""I'm certainly relieved my late father never did business with you."" #debates",1474940481289,780583070890135552,1
101,CabbageTV,"Which candidate do you trust the most, @HillaryClinton or @realDonaldTrump?  Take our poll. #Debates #Decision2016 https://t.co/SdQC9Mxc3L",1474940481696,780583072597245953,0
102,erininvisible,I'm glad Donald's crazy or else all talk about taxes and emails would be boring af. I barely pay attention to my own. #debates,1474940481696,780583072597176320,1
103,yoonjechloe,"I'm just waiting for them to start rapping like in Hamilton  #debates #Hamilton
#cabinetbattle",1474940481706,780583072639119360,1
104,JettMunroe,Hmm. Maybe not paying federal taxes is the reason Trump has been audited for the last 15 yrs? &amp; he thinks he's smart for not paying #debates,1474940481801,780583073037422592,1
105,mesodontcare,Yuge difference in airports. Really #Debates,1474940481718,780583072689446912,1
106,TheLifeofBilby,It's really weird how Trump's responses are just long extended fart noises and sassy hand gestures instead of English #Debates,1474940481734,780583072756404224,1
107,crown___x,#debates - Hillary knows good and well trump ain't shit.,1474940481646,780583072387461120,1
108,theairdemon,"""Looks like it's 5 or 6, probably 6 trillion dollars... we could build our country over"" like what #debates",1474940481668,780583072479707137,1
109,MichaelBruner,"""Our airports need to be better."" What % of America would agree? #Debates",1474940482679,780583076720021504,1
110,SullyWisdom,"#Red dress ...
#Blue tie ...

TOTAL FUCKING PROGRAMMING!

#debatenight 
#debates 
#Debates2016",1474940482685,780583076745273345,1
111,RevEricAtcheson,I've walked in shacks in Angola while oil tankers sit on their shores harvesting money. Trump has no idea what global poverty is. #debates,1474940482714,780583076866863106,1
112,WVChristi,He plays by the rules they set up. Government officials get wealthy from us. Income tax is illegal.  #Debates,1474940482443,780583075730391041,1
113,LacyCHope,@realDonaldTrump sorry you have to share an airport with us poor folks when your private terminal isn't available. #debates #Debates2016,1474940482753,780583077030486016,1
114,emmagschumacher,debate is a shit show no matter who you're voting for #debates #PresidentialElection2016,1474940482606,780583076414025728,1
115,kiewtga,"""maybe it's cuz you didn't pay any income tax""
""well, you would've wasted that too""

lkajsdgl'kajk'g #debates",1474940482763,780583077072375808,1
116,originalsmoky,@HillaryClinton HOW ARE YOU KEEPING YOUR COOL RIGHT NOW!? #Debates2016 #Debates,1474940482640,780583076556570625,1
117,imleftcoast,Kellyanne Conway did say Trump built a business on the back of little guys  before she was on the Trump payroll #Debates,1474940482782,780583077152038914,1
118,Jacukina,Hilary spilling the tea #TrumpExposingParty #Debates2016 #debatenight #debates https://t.co/fHVbTXqmAS,1474940482228,780583074828525568,0
119,LuMsmithwick,"Stiffed by your business, Trump 1,000 people Trump stiffed #Debates",1474940482740,780583076975878144,1
120,ChocolateMalo,Aeropuertos del tercer mundo #Debates,1474940482704,780583076825104388,1
121,betortitamota,Mmmm lo de la declaración y los correos lo mejor para salirse de los temas centrales #debates #debatenight,1474940483664,780583080851443712,1
122,treyprather,That orange pancake isn't covering up how #trump is starting to match #Hillary's outfit.  #debates,1474940483675,780583080897630212,1
123,surferguy_1,The Bernie vs Hillary debate was more exciting than this. #debates,1474940483668,780583080868343808,1
124,TomRomero2,Damnit! I am stupid. I'm never paying taxes again. #Debates,1474940483574,780583080474083328,1
125,MariaNYC,"Hillary: ""I’ve met a lot of the people who you have stiffed, Donald.” 

Donald: “Maybe he didn’t do a good job.”

#debatenight #debates",1474940483708,780583081036029952,1
126,Maakohh,I just told @nbcwashington who I think is winning. Cast your vote now! #Debates #NBC4DC https://t.co/zdlpRbTwFt,1474940483526,780583080272732160,0
127,Zouis_SlayMe,He is already annoying me  #debates,1474940483241,780583079077355520,1
128,Capt_USA76,#Debates2016 #debates #millennials #taxes https://t.co/kCh35HQ4SG,1474940483549,780583080369225728,0
129,TheCornerStoehr,Hey let's talk about policy. Forget personal quarrels. #Debates,1474940483792,780583081388363776,1
130,GTO_OGsaintP,#debates #Debates2016 #debatenight Our President RN https://t.co/KM2uOpv9Z2,1474940483342,780583079501004800,0
131,boesens,"HRC really reaching on who Trump ""stiffed"". Nation is suffering through worst depression since 1929 and she focuses on this? #debates",1474940483810,780583081463783424,1
132,Frank_Ded,If Trump wins... it just proves Intelligence has become a minority #debates,1474940483726,780583081111588868,1
133,Vondatsme79,"He just said it..paying $0 Fed tax makes him smart.Problem is this is Y poor/middle class can't progress!
#Debates",1474940483754,780583081229086720,1
134,Conscious,Third mention of father. #debates,1474940483779,780583081333882880,1
135,loyd_97,".HillaryClinton: ""There's something [realDonaldTrump's] hiding."" #debatenight #debates #Debates2016 https://t.co/WoN2wZE0hJ",1474940483713,780583081057091584,0
136,LBThetford,Our country should refused to pay it's debts?  #debates,1474940483808,780583081455423488,1
137,biffloganjohn,Go make bill a sandwich and zip it. @HillaryClinton #Debates,1474940483845,780583081610575872,1
138,monop996,#Debates trump fueraaaaa!!!,1474940484694,780583085171576835,1
139,gabsters1017,LMFAO. MY HEROINE https://t.co/KmtBFf6Eys,1474940484561,780583084613898241,0
140,Victoria_a_a_,Yo trump is dumb 😂 #debates,1474940484659,780583085024968706,1
141,AudreyHannahB,Hi. It's a bad idea to vote for Trump. You either see it or you don't. #Debates,1474940484680,780583085112909824,1
142,kennysandytoes,Did Trump just call America a Third World Country??? #debates,1474940484683,780583085125447680,1
143,KeelinMadden,@HillaryClinton is a criminal and disgraceful #debates #Debates2016,1474940484587,780583084722757633,1
144,GloriaMontalvo,Really?? https://t.co/YhJ9X8DkN8,1474940484575,780583084672557056,0
145,BrettS_44,Trump claims to be good with money but... #debates https://t.co/8Bq3G9Sf4O,1474940484015,780583082323800064,1
146,PrincessKong,So... What I'm hearing is Trump would use U.S. money to make nicer airports? No thanks. #debatenight #debates #firstworldproblems,1474940484530,780583084483760128,1
147,MrJOphotography,But that's not how contracts work. #debates,1474940484707,780583085226070016,1
148,Gateskp,"$650 million = 1000x my annual college tuition
#debatenight #debates #Debates2016",1474940484708,780583085230399488,1
149,notjimmysmall,Can you imagine that Hillary released her e-mails and all she's hiding is a massive QVC ordering problem like my Aunt Helen. #debates,1474940484608,780583084811051008,1
150,qdbaker,These superpups are probably not watching the #debates https://t.co/GCY1IdZJ7x,1474940484500,780583084357857281,0
151,chalk_ninja,Pretty sure Trump just admitted to NOT paying taxes. What a boob. #Debates,1474940484729,780583085318561792,1
152,NerdHeather,"""Or maybe it's because you aren't paying federal taxes"" BURN #debates https://t.co/lLQd694Oc4",1474940484354,780583083745488897,1
153,GoonSquadJavi,"HE JUST ADMITTED THAT HE DIDN'T PAY ANY FEDERAL TAXES WHEN HE SAID ""IT WOULD HAVE BEEN SQUANDERED TOO""

LOL BOI YOU SO STUPID
 #Debates",1474940484675,780583085092012032,1
154,mg_jacobs,"Hey Hillary, apologize to Bills rape victims you bullied!!!! https://t.co/FqqDxpvDKs",1474940484669,780583085066883072,0
155,Maddie_Kae33,Can we get Cruz back..? #Debates,1474940484731,780583085326819328,1
156,Oumzie,He does have a valid point though https://t.co/lSuv7nMhV4,1474940485651,780583089185718272,0
157,AmazingDoug,"""Not in a braggadocios way"" Wow! Trump consulted his thesaurus before the #debates",1474940485677,780583089294553088,1
158,ben_____shaw,"Clinton: ""you didn't pay him"" Trump: ""maybe he did a bad job"" holy shit #debates",1474940485700,780583089391173632,1
159,peytondelaneym,#DebateNight #Debates2016 #RAW #RAWTonight #debates #WWE https://t.co/fp0huXHaLx,1474940485109,780583086912266246,0
160,GRAYPASTELS,"i cannot stand hillary for much longer, but that's just my opinion. #debates",1474940485728,780583089508679681,1
161,JustRyThings,Stop interrupting  orange man  #Debates,1474940485689,780583089344946176,1
162,letmebeurart,This how he wants to win https://t.co/FG3sho97Tk,1474940485738,780583089550438400,0
163,HeatherEBD,Trump is trying so hard to keep the lid on #Debates2016 #debatenight #debates,1474940485444,780583088317423616,1
164,hiorheycastaway,HILARY YES #debates,1474940485809,780583089848274948,1
165,mocha_latte08,I'm calling into work tomorrow.. I can do that because I live in a 3rd world country...oh wait.. #Debates,1474940485870,780583090104115205,1
166,elpanfletope,"#MechaDelSiglo #debates Hillary: Has hecho perro muerto a un culo de gente
Trump: No lo hicieron bien pe'. ¿Qué chucha va a pasar?",1474940485779,780583089722580993,1
167,MattCrossin,Hillary Clinton is debating a guy leading a proto-fascist movement like he's a normal dude. #Debates,1474940485820,780583089894363137,1
168,owlbearhawk,He's just a bully #debates,1474940485827,780583089923776513,1
169,bradleebartlett,#Trump is so obsessed with having the last word that he will confirm what #Clinton accuses after just arguing that she's wrong. #debates,1474940486686,780583093526679552,1
170,Zoomshyne,Get back on the issues!  #Debates,1474940486587,780583093111431168,1
171,Joshua_Breland,"HRC: ""I've met a lot of the little people Trump has stiffed.""

How about the women beheaded by Saudi government, your big donor? #debates",1474940486674,780583093476352000,1
172,beyondbroadcast,Climate change Chinese hoax? Fact check https://t.co/1t889YwnwV See #debates moment here: https://t.co/0X3l1qZmam,1474940486667,780583093447041024,0
173,CorKinkz_,So this election is asking if I'd rather have a lying racist or a lying schemer #Debates,1474940486576,780583093065449472,1
174,gale_adam,😂😂😂😂 #Trump #Hillary #debatenight #debates https://t.co/bIwwGxcHAA,1474940486565,780583093019275264,0
175,TamaraPyke,Y'all should learn yer kids the @realDonaldTrump way #Braggadocious #bigly #smartliketruck #debates,1474940486512,780583092796796928,1
176,nisharose,Trump need some sinus medicine all this damn sniffling. #debatenight #debates #PresidentialDebate,1474940486660,780583093417697285,1
177,crusadir,#debates #debatenight #Debates2016 @crusadir #snarkydebate Ad hominem Hillary V.s Fearmonger Trump... Yawn.,1474940486740,780583093753159680,1
178,mmonique65,He right about that. Ive been to a lot of airports in other countries and ours are pretty crappy #debates,1474940486728,780583093702946816,1
179,ColeERichardson,There's not enough beer in the world for this one #debates,1474940486619,780583093245652994,1
180,vickiwho,3rd world.... airports.... wtf? #debates,1474940486689,780583093539368964,1
181,_ASiASHERROD_,So he admitted not paying the architect 😮🤔 #debatenight #debates #Debates2016,1474940486703,780583093598027776,0
182,Shazia_Meyn,Trump criticizing Hil for being a politician has me like 😑😩 #debates,1474940486860,780583094256447488,1
183,vj13,I'm already halfway through the first bottle of wine #debates,1474940486899,780583094419988481,1
184,CeciliaNY,Yes he did. Trump must think the millions of us who pay federal taxes are stupid. https://t.co/0SbKI81UFg,1474940486461,780583092583034882,1
185,LaughsTVShow,"Sick beats, yo. https://t.co/3F1qni4Y83",1474940486442,780583092503343104,0
186,SidSreeram,"I, too, go to restaurants and only pay for half my meal because there was too much salt #Debates",1474940486816,780583094071984129,1
