,geo,screen_name,text,timestamp,tweet_id,cluster_pred
0,,Fauxdai,I just told @nbcwashington who I think is winning. Cast your vote now! #Debates #NBC4DC https://t.co/42ESh5xdKY,1474940682539,780583914993745920,0
1,,itsMrTaiwo,Presidential candidates say the darndiest things. #Debates,1474940682736,780583915820023808,1
2,,Alydaemi,"Oh no, here comes pandora's box for both candidates. #debates",1474940682671,780583915547348993,1
3,,ZackReiser,"@realDonaldTrump """"We are in a big, fat, ugly bubble."" #Debates #YoSender",1474940682428,780583914528210944,1
4,,becauseHolly,"Oh fuck, now the race talk with these two honkies god help us all #Debates",1474940682753,780583915891281920,1
5,,BryanVanNorden,"I think so, but I'm biased.  Is that how it ""plays in Peoria""? https://t.co/q5qIZQpbD3",1474940682609,780583915287445506,1
6,,oiunicorn,Trump: my my my my #Debates,1474940682752,780583915887140868,0
7,,smallchittaphon,"Theyre bringing up blacklivesmatter, here we go #Debates",1474940682761,780583915924889600,0
8,,jbirkner3600,It is clear who is losing the #debates the American people.,1474940682826,780583916197466112,0
9,,dschun,US is becoming a 3rd world country! #Trump #debates #infrastructure #airports,1474940682668,780583915534766081,0
10,,eatatmilliways,Lester Holt nothin' but net on that schedule zinger #debates,1474940682784,780583916021297152,0
11,,dt_joyce,"Maybe this is splitting hairs, but … as a former D.C. resident, this is true.
#debates https://t.co/8p5MPC20Ob",1474940682767,780583915950116864,1
12,,Scott_at_Home,Lester Holt looks like he's broadcasting from The Phantom Zone. #DEBATES,1474940683511,780583919070617602,0
13,,SparkzOut,🙃 https://t.co/7ogPsc6aV8,1474940683581,780583919364079616,1
14,,the_pherk,Can someone remove @realDonaldTrump ability to use the word #tremendous? #debates,1474940683591,780583919406059521,0
15,,DavidIFlorian,Dam so conflicted. I don't want to like Trump but he's pushing my buttons so well. Hillary please win my vote! #debates,1474940683591,780583919406022657,0
16,,gpetsche,@realDonaldTrump There's a big difference between what's morally right and what's within the law. #debates,1474940683442,780583918781206528,0
17,,Aaroncratico,"Hagamos América grande sin meter a México, el reto de la campaña de @realDonaldTrump #debates",1474940683687,780583919808765954,1
18,,Logo_Daedalus,Oh boy is she gonna talk about pepe for this race question? #debates,1474940683707,780583919892701184,1
19,,21stCenturyCeo,I seriously think #Trump might be having an asthma attack.... Can we take a break to get him checked out? #Debates,1474940683730,780583919989043201,1
20,,swalker06,"""We don't have people that know what they're doing."" -@realDonaldTrump on US military experts. #America  #debates",1474940683574,780583919334850560,1
21,,LEESYA,"we don't have people that know what they're doing!,Ass #debates",1474940683672,780583919745896448,1
22,,InfiniteAbyss,"""I will get Pennsylvania Ave."" - Trump #debates https://t.co/hVjUHuvwW9",1474940682552,780583915048370176,0
23,,Juver_san,Pero por qué la gente es así? xD https://t.co/hK2RzTTmmh,1474940683474,780583918915424256,1
24,,ElectedMob,#debatenight #debates #Debates2016 #HillaryClinton #factcheck #factcheck2016 #FactCheckTheDebate https://t.co/GLesNofTJK,1474940683527,780583919137599488,1
25,,ilkestw,"Hoo boy, race #Debates",1474940683726,780583919972474881,1
26,,SirKkoolX3,Now let's talk #Debates,1474940683720,780583919947223040,1
27,,MinnesotaDFL,.@HillaryClinton's commitment to racial justice is not new: https://t.co/NRWXsKmDYL #Debates #debatenight,1474940683736,780583920014336000,1
28,,Dame_Kelz,"Coke sniffles RT @Uverneous: Wait, does Donald Trump sniff before he embelishes the truth? #debates",1474940683703,780583919875940353,1
29,,oliverames,"Sniffling trump clearly allergic to facts, income tax and paying contractors #debates",1474940683804,780583920299573248,0
30,,Mofolorunsho_T,#TrumpVsClinton It's right now ☺ #Debates2016 #debatenight #debates,1474940684591,780583923600527364,0
31,,BernieDoesIt,Coming under budget and ahead of schedule is easy when you pad all your estimates. #debates,1474940684697,780583924044931074,0
32,,llsipple,He knows how to make $$ for himself but at the expense of others he jips. #Debates,1474940684697,780583924044922881,1
33,,sfpelosi,"Hillary Clinton: ""I'm relieved my late father never did business with you."" #debates #Debates2016  #ImWithHer",1474940684597,780583923625648128,0
34,,1realblossom,Trump will worry about his business rather than about America. I do not trust him.  #Debates,1474940684479,780583923130765313,0
35,,SplintersMind,Race! #debates https://t.co/54a42wPHPd,1474940684388,780583922748928003,1
36,,emmyyyjoe,They both got my vote if they're gonna put my kiddo to sleep every night! #PresidentialDebate #debatenight… https://t.co/ktWJGvjj60,1474940684188,780583921910222848,1
37,,aspire4women,"#Debates Who care about all your crass, classless hotels Drumpf?",1474940684618,780583923713765376,1
38,,JohnParksBrown,@realDonaldTrump is being utterly exposed and obliterated by @HillaryClinton #Debates2016 #debates #debatenight,1474940684587,780583923583627264,0
39,,ChrissieJaySA,The race card. Scared. #debates,1474940684772,780583924359573504,1
40,,joingles,Moving on to the subject of race relations. #debates,1474940684616,780583923705348096,1
41,,joeysmithrocks,"I just want the #debates to end with Smash Mouth's ""All Star""",1474940684747,780583924254674945,0
42,,WillowHTufts,HERE WE GOOOOOOO #RACE #Debates,1474940684816,780583924544204803,1
43,,wdStrickler,@MSNBC @CNN #debates it appears Trump's advising economists have no knowledge of balance of payments accounting,1474940684766,780583924334403585,0
44,,korrenphillips,And Hilary turns into Quasimodo¿ https://t.co/9gMlDMpM4L,1474940684426,780583922908270592,1
45,,dianamescorcia,@assenavrene  #Debates,1474940684781,780583924397256706,0
46,,arielleazimuth,We on the nigga topics !!! #Debates,1474940684846,780583924670066688,0
47,,idefkffr,Oh yeah this race segment better be good #Debates,1474940685716,780583928318922752,1
48,,iAm_IsaiahBurns,This Is Where It Gets Good #Debates,1474940685664,780583928100970496,1
49,,writerjjennison,Someone give him a damn tissue! #Trumpsniffle #debates,1474940685389,780583926947545089,0
50,,ShoniWhatsGood,I WANNA SEE WHAT TRUMP IS GOIN SAY BOUT BLM #Debates,1474940685809,780583928709001216,1
51,,captdaf,"@eiragwen ""Unbelievable"" is pretty much how I describe every word coming out of Trump's mouth. #debates",1474940685614,780583927891185664,0
52,,_who_meeee,Next segment about race.... This segment will be interesting #Debates,1474940685830,780583928797155328,1
53,,jessicamopp,To recap: Trump is bragging about the wonderful things he's done overseas while complaining about how shitty things are in the US. #debates,1474940685817,780583928742543360,0
54,,mericangirlz,I'm sure she's got all sorts of drugs in her to keep her standing and talking #debates #hillaryshealth https://t.co/FOc7sYmSFJ,1474940685411,780583927039733760,0
55,,Slynderellas,#debatenight #Debates2016 #debates #debate https://t.co/sksSUxiPzt,1474940685822,780583928763604992,0
56,,articxly,Here we go... #debates,1474940685810,780583928713256960,0
57,,pebblsd,#debates So this campaigning is all about getting on to Pennsylvania Avenue?,1474940686660,780583932278378497,0
58,,catsanchez13,Hillary's only plan and fact is attacking Trump. No plan #debates,1474940686665,780583932299542530,0
59,,AJMattis,phewww here we go #race #Debates,1474940686661,780583932282757120,1
60,,CASobieski,"Oh cool, lets hear this circus talk about race issues. #iliterallycanteven #debates",1474940686725,780583932550983680,1
61,,PeterrLFC,need to be up in four hours but this is fun #Debates,1474940686699,780583932442050561,1
62,,KaineKerr,Here we go.... #Debates,1474940686560,780583931859075073,0
63,,madpat69,Trump looks stoned af #debatenight #debates,1474940686665,780583932299468800,0
64,,Mckeyman,Oh shit what is @LesterHoltNBC doing there? #debates,1474940686576,780583931926020096,1
65,,TheNowhereMan99,oh god #debates,1474940686717,780583932517502976,0
66,,rfbeasley1,I would prefer being underpaid by Trump for a disagreement than being made to disappear for a disagreement with Clinton.#Debates,1474940686710,780583932488065025,0
67,,RugbyBarrister,"""I take advantage of the laws of the nation"" - this ladies&amp;gentlemen of the USA could be your next #president #trump #debates #godhelpus",1474940686618,780583932102340609,0
68,,themaskeddemon1,THIS IS GONNA BE THE DEFINING MOMENT. #Debates,1474940686643,780583932207177728,1
69,,CrematiaDeBitch,"She is getting him good, I hate to admit. Not a fan of either one of them. #debates",1474940686760,780583932697858052,1
70,,darrellgandy,"All I need is for Lester or Hilary to say ""nigga, please"" #debates",1474940686511,780583931653550082,1
71,,PresidentPN,this should be interesting #Debates,1474940686644,780583932211433473,1
72,,trump_googles,Examples of people that love me #Debates,1474940686791,780583932827881472,0
73,,jchiggins_,GARY JOHNSON FOR PRESIDENT #Debates,1474940686601,780583932031107072,1
74,,VinceBernard,"Uh oh, they on race...Let me hear this shit!!

#debatenight #debates",1474940686755,780583932676939776,1
75,,Seattle_liberty,#debates @debates #LetGaryDebate,1474940686917,780583933356367872,0
76,,dqllonweekes,OH SHIT NOW WE'RE TALKING ABOUT POLICE BRUTALITY #Debates,1474940687665,780583936493694976,1
77,,madissonloves,"""How Do You Heal the Divide?"" #debates",1474940687682,780583936564928512,1
78,,josephsreed,Holy hell. Remember Gore 2000? Hillary is doing it to Trump. I honestly can't believe it. #debates,1474940687584,780583936154034176,1
79,,Filipe_The_Best,@tbh_diva Bring Bernie Back! #DebateWithBernie #debates,1474940687372,780583935264907264,0
80,,Blog_do_Doido,Vamos ver como o topetudo se sai com relação à questão racial #debates,1474940687516,780583935868821504,1
81,,DailyDoseOfNish,I thought there were no commercial breaks in this debate? How did they sneak in the Trump on Pennsylvania Ave? #debates #debatenight,1474940687590,780583936179048448,0
82,,mattheckman,Yeah Lester. Let's do this. #Debates,1474940687649,780583936426598401,0
83,,BKTNVA,@realDonaldTrump Not paying taxes doesn't make you smart. It makes you a criminal. #alcapone #debatenight #Debates2016 #debates,1474940687518,780583935877185536,0
84,,PhantomLion,"Trump, you're out of you're element.... #Debates",1474940687645,780583936409923584,0
85,,jennaaaaaa,Trump keeps mentioning Reagan...but how does he feel about Reagan National Airport? #debates,1474940687671,780583936518819840,0
86,,armyStRoNgone,"I'm still waiting for trump to tell us, what is he going to do for us?Does he only knows how to cry? #Debates2016 #debates @realDonaldTrump",1474940687681,780583936560918528,0
87,,AriannaHColon,Riéndome con estos dos #DebateNight #Debates #PresidentialDebate #TrumpVsClinton,1474940687771,780583936938291200,1
88,,lawtestr,"Oh lord, this is about to get ugly.... #Debates",1474940687794,780583937034772481,1
89,,venado246verde,Hold on to the wing. Tape it up. https://t.co/NSuYjwVAlY,1474940687751,780583936854327296,1
90,,pwgotimer,"""People have no idea how to buy and what to do."" Wouldn't that suggest that we should educate them??? #Debates #debatenight",1474940687796,780583937043107840,1
91,,hendley_clark,"It's not just trump going down, it's the GOP.  #debates",1474940687776,780583936959270912,0
92,,timpanoo,#Debates https://t.co/ui4Bvkyhif,1474940687444,780583935566876672,0
93,,TheGinaMiller,"Lester Holt segue for the win! ""We're way behind schedule""....as he moves to the next Q. The art of the segue is way underrated. #debates",1474940687809,780583937097670657,0
94,,sssuzy,"Notice he's slowing down? High is wearing off, no commercials. FUCK! Also is anyone grossed out by how sticky his mouth sounds? #Debates",1474940687549,780583936007217152,1
95,,SalimElBey,Bet he won't build any business on Pennsylvania ave over in southeast DC. Oooooo wait hell used his unpaid taxes to gentrified it  #Debates,1474940688607,780583940444790784,0
96,,reboredough,"UH OH, racial divide is being brought up #BLM #debates",1474940688560,780583940247658497,1
97,,DrekTheBat,"OOOOOOOOH BOOOOY
#debatenight #debates #Debates2016",1474940688612,780583940465627136,0
98,,splats62,#Debates He's right about construction projects. Replacing Amtrak station in Rochester. 2 yr project. WTF!?!,1474940688644,780583940599980032,0
99,,har4mbe,Race remains to be a significant challenge in this country? That's because the liberals make it that way. #debates,1474940688662,780583940675473408,1
100,,Comiccrow,Oh shit!! Here come the race questions #debates #debatenight @debate2016,1474940688678,780583940742533120,1
101,,teasp00n16,It doesn't matter if it's squandered if he didn't pay 😂 https://t.co/zNa9XebQ7T,1474940688625,780583940520341504,0
102,,illeominate,Woo omg #Debates,1474940688628,780583940532961281,1
103,,LAUS_ESTRADA,"¡Míralo en directo! ""U.S. Presidential Debates"" #Debates https://t.co/nQjOQCC1Sg / aquí plan tranquilo* https://t.co/Q2p02L5XNg",1474940688544,780583940180418560,1
104,,DustinHaltom,Please Dwayne we need The People's Moderator to take over for the rest of this debate. https://t.co/jr54syCPK4,1474940688749,780583941040250881,1
105,,alexlips21,Trump continues to proudly claim he takes advantage of laws of the country - why would it be in his interests to change those laws? #Debates,1474940688765,780583941107396609,0
106,,ScottNover,"Batter up, @HillaryClinton. We've come to #race. #MFdebates #debates",1474940688626,780583940524564481,1
107,,markace98,Can't  take it anymore going to #mnf #debates,1474940688552,780583940214128640,1
108,,NorrisMoorman,"At this point Donald Trump, just tell everyone you will file Chapter 11when in office, I can believe it #debatenight #debates #Debates2016",1474940688679,780583940746801152,0
109,,mizunapologetic,Oh snap let us hear this #debates,1474940688575,780583940310626304,1
110,,mhbucklin,Trump and Clinton haven't talked about anything substantive or consequential to the American people for the last half hour...  #debates,1474940688736,780583940985856000,0
111,,citizenstewart,Tremendous. I'm awesome. My income is amazing. You suck. I don't. #DonaldDucks #debates,1474940688832,780583941388378113,0
112,,tweetsbycaro,So he can build a hotel near the Whitehouse #samething  #debates,1474940688738,780583940994297861,1
113,,DxpeVssJvs,Debate drinking game: Take a shot everytime Donald sniffs #debates,1474940689705,780583945050042368,0
114,,GregoryKoskela,Dude grow up #Debates,1474940689524,780583944290988032,0
115,,muhammadahad97,"Shits gonna get real, race! #debates",1474940689679,780583944941137920,1
116,,jeremymeek,Ugh Pinot Grigio get me through this #debates,1474940689536,780583944341389312,1
117,,emmyparry,I actually endorse this. But will never endorse you. #debates https://t.co/Co2VJ6UOoA,1474940689685,780583944966184960,0
118,,hey__jayy,Ya he's underbudget because he stiffs his workers for no damn reason. #debates,1474940689635,780583944756625408,1
119,,KenziCopter,My cat just farted and it's better than anything trump has said #debates,1474940689584,780583944542617601,0
120,,PattyBlount,I wouldn't trust  @realDonaldTrump  with a piggy bank.  University - failed. Steaks - failed. Shuttle -failed. Ice-failed. #debates,1474940689521,780583944278466560,0
121,,Nata_Laureano,#Debates,1474940689655,780583944840482816,0
122,,Taylomade85,Both talk about each others shortcomings &amp; story telling. Smdh #Debates,1474940689695,780583945008218112,1
123,,KatMoorefield,@philgoodstory @natalie_allison Also funny she claimed he has so much to hide. What did she hide in all  those vanished emails?... #debates,1474940689698,780583945020674048,1
124,,NewsMoeda2,https://t.co/njzo2FsMvY ETHEREUM FREE #Decision2016 #AskDemi #JuntosComMafiaSdv #debates #blockchain #bitcoin https://t.co/nOW4DQIsVb,1474940689581,780583944530067456,1
125,,bzsmith,"Yes! Unemployment numbers are down! Thank you, President @BarackObama &amp; all who worked together! #strongertogether https://t.co/C81z2WCgcD",1474940689469,780583944060178432,0
126,,Sciwhat,Ohhhh sic 'em Newsweek! https://t.co/yZ3nEWKiTz,1474940689703,780583945041645569,1
127,,docshaw,Trumps going to be in the white house or the annoying neighbor on Pennsylvania Ave #Debates,1474940689921,780583945956052992,1
128,,solcelo,Maybe we should just skip race as a topic. I'm holding my breath through this. #debates,1474940690661,780583949059825664,1
129,,klhrpr,countries are so different to businesses #debates,1474940690692,780583949189787648,0
130,,MaryL1964,#ReleaseTheReturns #debates #debatenight #Debates2016 https://t.co/ZQ1v4FvaBP,1474940690621,780583948892139520,1
131,,_captainmorgs,Here we go y'all .... #Debates,1474940690643,780583948984385537,0
132,,lesliekelly,"""Tens of thousands of people love me"" #narcissist #debates",1474940690684,780583949156265984,1
133,,dome_underthe,Trump laments paying too much for roads. Why aren't all those GOP governors doing better? #debates,1474940690553,780583948606959616,0
134,,cxdesss,"yeah let's talk about race now 
#Debates",1474940690714,780583949282127872,1
135,,Sloopydrew,"Tonight's #Debates was subtitled: ""Two Only A Mother Could Love"" until it was discovered even their mothers didn't love these two. #tytlive",1474940690514,780583948443324416,0
136,,chelseaharfoush,"Oh yes, Dad. Let's talk about race. I have no reason to think this will go poorly. #debates #drafthousedebates",1474940690649,780583949009432581,1
137,,kenzie__macc,I just told @nbcwashington who I think is winning. Cast your vote now! #Debates #NBC4DC https://t.co/lBTACO4rOh,1474940690440,780583948132966404,0
138,,davidpowellme,"""We're well behind schedule"" — moderator speak for ""Shut up, Donald"" #debates",1474940690828,780583949760204800,0
139,,rachelrhetoric,"Shortchanging people, circumventing the system, and taking advantage of loopholes is not an working business model for a country #Debates",1474940690703,780583949236043776,0
140,,TheAuraMaster1,Deciding on who to vote for the #debates https://t.co/QeDNiBp2qY,1474940690671,780583949101834242,0
141,,Rujabes,"Lester: ""Let's talk about race"" #debates https://t.co/Fy3u5YTSxf",1474940690220,780583947210149892,1
142,,AnneDeTraglia,Dayum https://t.co/d1vXGC3NmA,1474940690820,780583949726724096,1
143,,Moosejago,Ion get how people don't find politics interesting #debates,1474940691565,780583952851566594,1
144,,metricula,Oh god here comes race #debates,1474940691661,780583953254060032,1
145,,dbaaryj,"""Have you tried Trump steaks? Or had a Trump vodka."" - Donald Trump at the debate. 

#debatenight #debates… https://t.co/bGw2yRn5vw",1474940691655,780583953228963840,0
146,,GladysWalters1,#Debates open what of head of schedule wtf does that have anything to do with the debate! Idiot Pay the people you owe!,1474940691563,780583952843153409,0
147,,DjayAce007,Nuff said #debates https://t.co/yPbSdYSVU5,1474940691440,780583952327122944,1
148,,rolledeep,These #debates are just ridiculous. These are most likely the worst people to have as our president for our country,1474940691734,780583953560285184,0
149,,CafeandRose,#debates,1474940691685,780583953354874880,0
150,,saramarietweets,B/c he’d be able to buy property at a lower price and make more $ - it’s called having a #business! https://t.co/2mGg09t0nH #debates,1474940691508,780583952612466689,1
151,,alisonlucci,Seriously forgot he was even there for awhile. #debates https://t.co/o40DPewVli,1474940691638,780583953157672960,0
152,,Trish_Dishes,@HillaryClinton brought the architect?! SHE CAME WITH RECEIPTS 👏🏻👏🏻👏🏻  #debates #debatenight https://t.co/tAsRcNEXfm,1474940691632,780583953132457984,1
153,,NaomiHaight,How does anyone take this guy seriously #debates,1474940691689,780583953371660288,1
154,,elianamuk,We need to talk about Trump's health problems. #debates,1474940691642,780583953174585344,1
155,,SapanaV,Even the Times of India is trolling Trump https://t.co/LJBi5F27u5,1474940691485,780583952516014080,1
156,,kenkuzma1,Trump says I'm rich and I'm going to make the rich richer I have a plan don't know what it is but I have a plan #Debates,1474940691706,780583953442885633,1
157,,suruhzow,WOW I WISH I WAS STILL IN AP GOV.  #Debates #mpapgopo,1474940691681,780583953338077185,1
158,,einsteinmedi,"""It's all words... all sound bites."" #debates https://t.co/hcv3vsF9KM",1474940691594,780583952973041664,1
159,,oneandonlydrake,This #Debates https://t.co/qPTd71jKRQ,1474940691485,780583952515870720,0
160,,baileyatheriot,Inspiring me to vote for you. #LetGaryDebate #WhereIsGary #WeWantGary @debates #debates https://t.co/cre9K4cF2u,1474940691694,780583953392689152,1
161,,scottrodriguez1,#ilovelamp #debates https://t.co/y1s4AF49WW,1474940691663,780583953262583808,0
162,,Conver_Start,@nytimes She's a late bloomer. #debates,1474940691708,780583953451278336,1
163,,keerthikau,Oh shit here we go #Debates,1474940691590,780583952956424192,1
164,,RICOLANI,YES let's talk about this!  #Debates,1474940691790,780583953795342336,1
165,,CrystalAndCurls,Here we go with the race portion. #debates,1474940691816,780583953904185345,1
166,,TheConciergePro,SHHHHH they talking bout US now.  #Debates,1474940691869,780583954126479360,1
167,,xJuuuu_,"""Race"" this shall be interesting #debates",1474940691795,780583953816256512,1
168,,MagicCarpRide,A presidential candidate just said he is smart for not paying federal income taxes.  How... what?  #debates #Debates2016,1474940691758,780583953661038594,1
169,,The_Premise,Take the poll on my page #debatenight #debates #PresidentialDebate #cnn,1474940691784,780583953769967616,1
170,,THE_REAL_CORY,Here we go...now the debate really start. Race?? #debates,1474940692659,780583957439971328,1
171,,auritech,Talking about race now.  #debates #debatenight,1474940692628,780583957309992960,1
172,,tayfan2,"Is Hillary going to use her ""black"" voice now?  #Debates2016 #debatenight #debates",1474940692548,780583956974534656,1
173,,itmightvebeen,Donald plz don't treat our country like your hotel business. They are a bit different??? #Debates,1474940692638,780583957352120320,0
174,,SarahLLapham,@HillaryClinton lives for the catch phrase and sound bites. https://t.co/61gyuNWBwF,1474940692532,780583956907495424,1
175,,roseeebud,Topic of race. This should be fun. #debates,1474940692620,780583957276393472,1
176,,octavemind,Oh I can't wait to hear what he has to say about this. #Debates,1474940692674,780583957503078401,1
177,,SDGabor,@RichardHaass hmm disagree. Maybe Americans in the 1% category? Absolutely. #debatenight #Debates2016 #USElections2016 #debates,1474940692720,780583957695901696,1
178,,lankinomusic,"He really is a psychopath isn't he? ""I'm gonna get there one way or the other""?! lol  #debates",1474940692799,780583958027210753,1
179,,LorettaEttinger,Is Trump sick? Drinking water like a man he made fun of.  #Debates,1474940692718,780583957687566336,0
180,,ellenflegal,"""It's all sound bites."" - @realDonaldTrump (whose sound bites are racist, sexist, homophobic, xenophobic.....etc.....) #debates",1474940692707,780583957641310208,1
181,,stephsvec,"""We have people who have no idea...""Stop right there Drumpf...we understand. #debates",1474940692597,780583957179928576,0
182,,atf1216,Somebody give @realDonaldTrump some Mucinex or something. I'm over this sniffle. #TrumpSniffle #Debates,1474940692298,780583955925991425,1
183,,itschiddy,Trump: DELETED EMAILS !! https://t.co/3q0Zr0acWm,1474940692697,780583957599432705,0
184,,OFALaux,Donald on race!  This should be good. #Debates #Debates2016,1474940692656,780583957427523585,1
185,,itweetyutwatch,Yes ready to hear about this segment  #Debates,1474940692761,780583957868011521,1
186,,A_Gonzaleez,I can't wait for two racists to talk about race issues in a racist country #debates,1474940692803,780583958044151809,1
187,,pooopeepie,"Watching Hillary And Trump fight is just like watching your dad and mom fight 

#debatenight #debates",1474940692831,780583958161436672,0
188,,JamierStL,"He ""takes advantage"" of the laws. He really did say that right?? #debates",1474940693664,780583961655259136,0
189,,JetOverboard,"What about ISIS , terror #Debates",1474940693522,780583961059811328,1
190,,Chazboski,"""Let's talk about race.  Also, you're about to find out which of your facebook friends are secretly racist.  Buckle up"" 

#debates",1474940693595,780583961365929985,1
191,,BrendaSexton,"Here we go on Race, lets see what racist comments Trump will say #debates",1474940693578,780583961294622720,1
192,,TheBishopTuTu,Trump is visibly annoyed w/the race question. #weseeyou #Debates #DebateNight #MSNBC,1474940693551,780583961181511680,1
193,,EvangelicalNorm,"Hey @realDonaldTrump most Americans relate audits to tax criminals, you're not winning the battle by appealing to audits #debates",1474940693599,780583961382752256,0
194,,asphaltandbrie,"Cant wait to see #SNL take on debate. #Trump is gonna get the All Gore treatment, especially with those sniffles and interruptions. #debates",1474940693514,780583961026236417,0
195,,NoVa_Swage01,"Ah, the racism part. This should be good #debates",1474940693761,780583962062102528,1
196,,stephylove0314,How do you heal the divide? #Debates,1474940693632,780583961521250304,1
197,,jcbivins,What could possibly go wrong… #debates #Debates2016 https://t.co/3AaiSaqZXd,1474940693588,780583961336680450,0
198,,Biracial_Chick,Trump get back on track. Her failed record. #debates #Debates2016 #debatenight #MAGA,1474940693635,780583961533812737,0
199,,Mindofmarko,Bruh if Hilary doesn't start answering questions this will not go well 😪 #Debates,1474940693619,780583961466634240,0
200,,pardekooper,Trump is pretty out of breath tonight. Sounds sick or really winded. #Debates,1474940693847,780583962422808578,0
