,screen_name,text,timestamp,tweet_id,cluster_pred
0,strumpets___,I didn't know he could count to 104. #debates,1474939995676,780581034081579008,2
1,ahsimsauce,"like @RafaelCasal said, at least we'll make it through with a good C passing grade compared to failing with trump… https://t.co/bx6lqgjIwY",1474939995828,780581034718928896,1
2,Jeannette_JNE,Mr Trump I thought u were the healthiest presidential 2 even run? Looks like someone's got the sniffles! #karma #mustdrinkmorewater #Debates,1474939995671,780581034060570624,2
3,BernieCrats1,DrJillStein: We have a generation of people who are locked in student debt. Time to bail them out. #debates #occup… https://t.co/GosvEFOlch,1474939995766,780581034459095040,1
4,TisTheQueen,Anyone who thinks @realDonaldTrump actually is making sense needs to lay off drugs #Debates,1474939995936,780581035171950592,2
5,Patriot_Beaver,Sally Kohn is a lying man(?) who has his head up Hillary's ass!! #debates https://t.co/GHnfU8B1FY,1474939995716,780581034249293825,1
6,DecayedLace,I'm pretty sure the only word Trump knows is 'Jobs' because it it stirs his zealots. #debates #debatenight #trump,1474939995967,780581035301937152,2
7,IttzAndrew,Do we really want to put all of our Country's funding into Military? #debates,1474939995914,780581035079790592,2
8,DaliaHashim28,Fact Check: Audits do not stop you from releasing your tax receipts #Debates https://t.co/ffTBswwCph,1474939996244,780581036463906824,1
9,Wickedgabe,Has Trump even answered any questions? #debates,1474939996633,780581038095466496,2
10,conorsego,Routine audits #debatenight #giantdoucheVSturdsandwich #Debates,1474939996654,780581038183493632,2
11,BigBennyFL,So now Trump is saying our economy is doing horribly and then brags about how much money he made this year #debates,1474939996606,780581037982289921,2
12,Aye_Jillian,My niece is 2 and has better debating skills than Donald Trump #debates,1474939996617,780581038028361729,2
13,Rome_at_Home,OMG SOMEONE MAKE THIS HAPPEN PLEASE. Oh and add @cher. Would love to see both of you rip apart the orange idiot.… https://t.co/Lyh6PdxLJl,1474939996644,780581038141472768,1
14,1auran,"Dear America, I don't feel sorry for you. I wouldn't know who to vote for in this Presidential Race. #debatenight #debates #debates2016",1474939996701,780581038380556289,2
15,cpweb13,@paigegawley bahahaha https://t.co/UsFV8qV5fi,1474939996432,780581037252509696,1
16,DionneWLiebl,"I keep thinking someone is going to jump out and yell, ""You've been punk'd!"" #debates #wishfulthinking",1474939996774,780581038686818304,2
17,nidalezouhir,"imagine if donald trump was having dinner w you, telling you his views on politics, and then he went ""btw i made $600m last year"" #debates",1474939996708,780581038410100736,2
18,JuanitoGrana2,Escuchando a @realDonaldTrump en #debates https://t.co/nPe9m3PCDC,1474939996609,780581037994684416,1
19,torresromain,"Eh c'est de la triche ça ! Bande d'enfoirés, on a des traces de tout anyways. #Debates https://t.co/KgHSxpaASP",1474939996455,780581037348909060,1
20,MaryScottHunter,Say that in Ft Payne Alabama. Dare ya @business. #debatenight  #alpolitics  https://t.co/bfCZbNOPZg,1474939996315,780581036761739264,1
21,heydavidhall,"Let the debaters debate. Shut up, Lester! 
#debatenight #debates #Election2016 #PresidentialDebate #PresidentialDebates",1474939996634,780581038099693568,2
22,JoeyCB321,"Does Trump have fake teeth, or does Hillary just need to get some whitening strips? #debates",1474939996674,780581038267432960,2
23,DPilsk,"""Worst revival of an economy since the Great Depression"" -Trump #Debates #Huh",1474939996620,780581038041001985,2
24,APoliticalNerd,@realDonaldTrump Can you show us your Taxes? #ShowUsYourTaxes #debatenight #debates #Debates2016,1474939996815,780581038858706947,0
25,bridoc,"Donald Trump lying again, claiming the IRS audit prevents him from releasing his tax returns. Weak, debunked excuse. #Debates",1474939996789,780581038749876224,0
26,heidiwerber,just release your damn tax returns #debates,1474939996792,780581038762315777,0
27,Katielauren08,Thank you @realDonaldTrump!  #Debates,1474939997657,780581042390380544,2
28,yossarianjumps,Trump is now free-styling his tax returns box-by-box. #debates,1474939997536,780581041882865668,2
29,poooyak,الان چند ماه میگه من مدارک تکسم رو منتشر می کنم هنوز نکرده #debates #ترامپ,1474939997599,780581042147164160,2
30,SusanStroupe,"""You're perfectly free to release your taxes while under audit."" All right Lester. #debates",1474939997720,780581042654580737,0
31,HBrook4k,If George Washington were still alive he'd kill himself after watching tonight's debate. #debatenight #debates,1474939997710,780581042612686848,1
32,lcf42,"big fat ugly bubble

oh this one is too easy #debates",1474939997677,780581042474348545,2
33,MAReyesAUTHOR,"Answer the damn questions, Trump!
  #Debates",1474939997611,780581042197520385,2
34,nimashan,"she has amazing control i love that she is not interupting, letting hi dig his own hole
  #Debates",1474939997705,780581042591715329,2
35,ContraCleon,TIL Secretary Clinton has been an adult for 12 years. https://t.co/BQmDfxhipJ,1474939997682,780581042495168514,1
36,BajihNet,This is how a president should act. You have to keep your cool. https://t.co/6gripcobkf,1474939997598,780581042143002624,1
37,BaoNguyen32,I think D Trump is trapping H Clinton at avery corner.  Very fascinating tactic.  It's Trump offense against Clinto… https://t.co/jVduTzbxsT,1474939997427,780581041425616896,1
38,Wikete,Trump very strong now. Turning negatives into positives. #Debates,1474939997658,780581042394697733,2
39,button0990,Yes. College debt free. Me like #Debates #debatenight #collegegradproblems,1474939997719,780581042650488832,1
40,pheeebbzzz,Expand your vocabulary. It's bad. Very very bad. #debates #dumptrump,1474939997744,780581042755342336,2
41,PookieG,Instead talk about college monopolies. Lower tuition. What about new books every damn yr. u can't resell ur books @ end of semester #Debates,1474939997741,780581042742845444,2
42,THOUGHTS_JD,IRS has said again and again that he can release his taxes #debates,1474939997764,780581042839130112,0
43,minayal,"#USAdecide Hillary deja en claro que tiene experiencia de gobierno, pero Trump hace mella de la política de empleos demócrata #debates",1474939997823,780581043086696448,2
44,KittleKay,Let Lester speak! omf #debates,1474939997798,780581042981736448,2
45,sanjit69,He's well prepared #Debates,1474939997722,780581042662940672,2
46,PR_Johnson,Pace is critical to political rhetoric. The candidates who spoke w/eloquence at consistent pace performed better. #debates showing weakness.,1474939998712,780581046815367168,1
47,basedmattforney,"Trump deflects the ""tax return"" trap. You can't stump the Trump. #Debates2016 #Debates #DebateNight",1474939998649,780581046551244802,2
48,kimberlyasha,"Driving home, listening to the #debates. My head hurts.",1474939998671,780581046643326976,2
49,DBiffster,"Ok Donny, how much of the $694M did you pay in Taxes? #debates",1474939998631,780581046475558912,2
50,CBSACNY_SBC,#debates #Election2016 https://t.co/sGBgzvipS1,1474939998441,780581045678837761,1
51,mrobbinsnyc,#debates #Election2016 https://t.co/ztHzgbvx9Q,1474939998452,780581045724934145,1
52,The_Cantrell,Robert Reich https://t.co/1vT7BgifRr,1474939998575,780581046240903168,1
53,sarah_ithink,tax audits....hm. rELEASE YOUR SHIT #debates,1474939998615,780581046408577024,0
54,nickilouwho,"This is just ridiculous. Let's talk about policy, not how much you make a year (&amp; how you wouldn't have believed it 15yrs ago). #debates",1474939998637,780581046500855808,1
55,TheGiovanniReal,No respect for @LesterHoltNBC at all during this debate they're running over him 😭😭😭 #debates #DebateNight #PresidentialDebate,1474939998523,780581046022709248,2
56,TheOrionHunter,"""Talk about the people and their burden"" ""I HAVE MADE MILLIONS, LET ME TELL YOU""  #Debates",1474939998782,780581047108907012,2
57,bluelyon,No Can Do. #debates https://t.co/xhG8TjJnvp,1474939998727,780581046878298113,1
58,__iii65,😎򓠮 #debates,1474939998711,780581046811238400,2
59,UpsilonMale,"""I'm under an audit and I will reveal my tax record very soon. It's in my other trousers, I forgot them tonight."" #debates",1474939998732,780581046899400704,0
60,CarolynDElias,NO. You can release your taxes. That is a LIE!!! #debates,1474939998749,780581046970494976,0
61,pedroloo,These #Debates are ridiculous. I'm embarrassed at how they're acting. SO UNPROFESSIONAL! #OccupyTheDebates #JillNOTHill,1474939998716,780581046832205828,1
62,ByronFever,It's official: @MattOswaltVA is the premiere voice of the #debates https://t.co/oQL37JsD8R,1474939999578,780581050447638528,1
63,mattDeDiana,"Trump might have some decent arguments except for the exaggeration, lies and lack of specifics. #Debates",1474939999605,780581050560815104,2
64,bikerbatdan,#Debates2016 #Debates #ILikeBubbles 🙎🏻😉 https://t.co/UjOJbqt3qI,1474939999290,780581049239691264,1
65,elisekay,Did he just brag about his income #debates for fucks sake. Yeah get the middle and lower class votes like that.,1474939999645,780581050728738817,2
66,garrickd,Well done Lester! Keep it up.  #debates,1474939999468,780581049986347009,2
67,heyfromtrevor,"why do the same conservatives that say ""anyone can get a job and have money if they work hard enough"" say that there are no jobs? #debates",1474939999699,780581050955235328,2
68,Tzynya,Trump tells you his net worth with the same hubris he spoke of his large hands. #DebateNight #Debates #patriarchy,1474939999683,780581050888036352,2
69,GFTVtalk,Why is he still talking about trade deals?!!! #debatenight #debates,1474939999801,780581051382976512,2
70,DepoRob,"""When he goes off to the golf course, to play golf"" Is that what you do at a golf course? Fuck! I've been doing it wrong for years. #debates",1474939999770,780581051253002240,2
71,chkerstein,"Oh well... As long as a crisis doesn't happen to you, it's business #IAmWithHer https://t.co/jvPZeNs0DK",1474939999685,780581050896490496,1
72,Socialevisible,Trump is correct about the systemic capital bubble in place due to the @federalreserve low interest rates . #debates,1474939999758,780581051202666496,2
73,abbyandleo,He will try....she will continue to take money from saudi for her self serving ass #Debates,1474939999829,780581051500376064,2
74,yoyoel,.@pastrami has the right idea about how to handle the #debates https://t.co/VluA4EpoGq,1474939998394,780581045481582592,1
75,janersm,Political hack = @realDonaldTrump #debates,1474939999717,780581051030654977,2
76,TonyTripoli,This pole woman is getting TMJ from gritting her teeth when this dick speaks. #debates,1474939999612,780581050590240768,2
77,Elz_Beth13,"He would know because he knows how to rip off people .... ""Bigly"" #Debates",1474939999756,780581051194306560,2
78,_keliaa,Hillary just smiling 😂😂 #Debates,1474939999834,780581051521437696,2
79,Elle_Drews,"Oh Trump, shut up. #debates",1474940000639,780581054897721344,2
80,Airo1996,Acurate. https://t.co/0HfhJCrFVp,1474940000609,780581054772051969,1
81,kathygroob,He cannot face the LOL that will occur when he releases his taxes. #debates,1474940000709,780581055191396352,0
82,jfenzlein,Give it up trump. #Debates,1474940000699,780581055149604864,2
83,jessmazina,"Watching Twitter's #debates live stream to see what the candidates have to say. I want live tweets on my own terms, not on the video. :/",1474940000768,780581055438794752,2
84,spiritscall,Hilarious https://t.co/MKC4HTGav3,1474940000602,780581054742532096,1
85,AveryBrown187,@realDonaldTrump PLEASE NERF TAHM KENCH THANKS #debates,1474940000637,780581054889402369,1
86,burriseng,690 meelion dollars? That's what he made last year? #debatenight #debates #FORTHEPEOPLE,1474940000685,780581055090819073,2
87,FosterErin,Tax return! Time to drink! #debates,1474940000532,780581054448934912,2
88,rogerwolff1960,Nobody's seems to care that the dems have increased the debt 11 trillion and you're worried about maybe 5 trillion?   Take a chance #debates,1474940000690,780581055111761920,2
89,taylorafflitto,Trump got mad money why doesn't he fix his hair? #debates,1474940000754,780581055380201474,2
90,Harlem2nyc,"You won't see Trump's tax return, he's been saying I'll release them since Republican debates. #debates",1474940000713,780581055208230912,0
91,incrediblycat,Trump lost his composure in &lt;30 mins. Wasn't he practicing for this? He just needed to not be so outrageous. #BIGLY #debates,1474940000722,780581055245856770,2
92,Mo312Mo,@HSSocialMedia #Training: #Debates. https://t.co/FWNVaJOWqC Trump really did say he didn't believe in global warming. Just saying.,1474940000825,780581055677935616,1
93,bellajanelord,Tax returns: check #Debates,1474940001683,780581059276660736,0
94,ProgramAdrift,Take a bow. You just won the night Steve. https://t.co/YOMsKt4tHo,1474940001319,780581057749983236,1
95,tootal2,Hope she has a seizure tonight #debates,1474940001642,780581059104825344,2
96,suzzetteCam,"Switching topics, avoiding answering REAL questions #Debates",1474940001718,780581059423502336,2
97,winksixsixsix,#Debates$800 Billion is $800 Billion more than he has.,1474940001718,780581059423563776,2
98,blakkksheep,Fact Check: #debates https://t.co/SqNrBYb7t2,1474940001606,780581058953609216,1
99,RyersonNeal,#debatenight @HillaryClinton #Debates2016 #debates  YEAH DONALD...LETS SEE THOSE TAX RETURNS.,1474940001732,780581059482251264,2
100,Mike_McManaman,"How many #Americans are loaded, drunk, or high watching this thing? #debatenight #debates #",1474940001744,780581059532431360,2
101,mellyababe,??????? #Debates,1474940001720,780581059431833600,2
102,andrewrjuhl,"Trump: I'll release my tax return when OBAMA releases his BIRTH CERTIFIC--oh, wait, shit. Dammit, Trump. Dammit, dammit, dammit...
 #debates",1474940001784,780581059700195328,0
103,AndrewRanger1,Looks like some damage control.. #debatenight #debates https://t.co/tNE3bcOhPm,1474940001617,780581058999947264,1
104,NiKkILoVE2020,No when we have a country where y'all rich asses have all the money and families is on the street. Our vets are not taken care off #Debates,1474940001746,780581059540975616,2
105,MollyCoddle15,Worst revival bubble? What? Wordsoup #debates #Debate2016,1474940001911,780581060233035776,2
106,ElleBelleK,So because you're rich automatically means you're qualified to be president? I don't think so. #Debates,1474940002685,780581063479275520,2
107,stoptroyesivan,She's not as much of trash as trump https://t.co/F0EcgiapTQ,1474940002576,780581063022243840,1
108,mrsmocibob,.@realDonaldTrump  reducing tax? what about addressing the tax havens protecting the billions $s from fraud practicing 'mericans?#debates,1474940002500,780581062703325184,2
109,vexii,follow me #Debates,1474940002656,780581063357763584,2
110,TheLizLane,"In other news, @HillaryClinton looks beautiful in red. #debates #debatenight",1474940002688,780581063492046848,2
111,enforcernick,Hillary showing signs of extreme fatigue.  #debates,1474940002688,780581063491981312,2
112,dipesh_khanal,@POTUS #BarakObama goin' golf court after leaving office !! #DonaldTrump #debatenight #debates,1474940002764,780581063810617344,2
113,anwill93,Obama's not playing golf. Trust. #debatenight #debates #Debates2016 https://t.co/3Dmf9LCuRS,1474940002527,780581062816755712,1
114,brainrev,@stefcutter I'm playing the drinking game where he interrupts @HillaryClinton. I'm already fucked up!#Debates #HofDebate2016 #DebateNight,1474940002693,780581063512907776,2
115,ThePoshKid,"I can feel Hillary mentally repeating, ""I am made of infinite patience"" over and over again. You got this, girl. #debates",1474940002739,780581063705985024,1
116,MrSciFly,Cthulhu 2016 #AllLivesAreEdible #debates,1474940003580,780581067233255424,2
117,radioworldsv,"15 minutes in, @realDonaldTrump has 79% of the @facebook discussion. #Debates #DebateNight https://t.co/F4F6VPwfd8",1474940003367,780581066339815424,1
118,diego_ao6,"En cualquier momento #Trump saca una silla y noquear a #Clinton, luego descalifican a Trum y gana Clinton inconciente en el suelo #debates",1474940003708,780581067770171392,2
119,elsajustelsa,You can release your taxes. Stop lying.  #Debates,1474940003705,780581067757608960,0
120,dironablu2u,#ImWithHer #NeverOligarchy #debatenight #debates #Debates2016 #PanamaPapers https://t.co/fgHsWNR6lt,1474940003676,780581067635818497,1
121,MattiaMonster,Also tho why are we pretending that a country should be run like a company in a capitalist hellscape like... ok #Debates,1474940003736,780581067887562758,2
122,betolink,Trump talks about the companies that leave the U.S. destroying middle class jobs... like his clothing line? #debates,1474940003813,780581068210483200,2
123,delayfx,"the best websites, believe me. https://t.co/35AMVF3hWx",1474940003666,780581067594104833,1
124,MaryEllaRegal,Trump's campaign strategies.             1. Blame Obama 2. Blame Hilary.       3. Blame Mexico #debates,1474940003625,780581067422044160,2
125,cwb_in_tn_81,"&gt; Trump just blowed the Biased moderator the fuck out over his tax returns question 
#Debates
#Debates2016 https://t.co/JSJDz6zzdT",1474940003606,780581067342262273,2
126,taracas,"694 million in income, zero charitable donations = SHAMEFUL! #Debates",1474940003865,780581068428546048,2
127,BandDarling,OH MY GOD YOU CAN RELEASE YOUR TAX SHIT WHILE BEING AUDITED. #debates,1474940003486,780581066839093248,0
128,Leland_Seattle,He just complained #Debates,1474940004665,780581071784030209,2
129,americanrules76,Welcome to the Global Elites Y'all it's all about their NWO #debatenight #debates #Debates2016 Both turned their ba… https://t.co/0GzG41MFDT,1474940004490,780581071049994240,1
130,realSamJenkins,Watching #debatenight #debates #Debates2016,1474940004604,780581071528296452,2
131,andrewwhiteau,“people like *staffer zaps trump with remote cattle prod to prevent crooked hillary reference* secretary clinton #debates #TrumpSniffle,1474940004682,780581071855300608,2
132,deborah_kallick,"#debates
Donald making faces reminds me of every sexist jerk I've ever met.",1474940004762,780581072190840832,1
133,JBrofromNSco,"Is anyone doing an ""excuse me""/""beauuuutiful"" count? #debatenight #Debates",1474940004709,780581071968763904,2
134,korybowlin,"Ah, I hate having to file my ""financial statement of sorts."" #debates #areyoukiddingme",1474940004794,780581072325050369,2
135,kbornes96,They've said time and time again that he can still release tax returns while being audited. He's a coward #Debates,1474940004645,780581071700254725,0
136,KoDon4,YES LESTER! #debates #nomoreauditlies,1474940004717,780581072002244608,2
137,AMac727,Has @realDonaldTrump used a quantifiable fact yet? #debates,1474940004549,780581071297536000,2
138,sacmalla,USA is China's piggy bank. I like this by Trump #Debates,1474940004686,780581071872266240,2
139,IslandGalObama,Why the hell is Donald telling his blue collar supporters how many millions he supposedly made? #debatenight #Debates2016 #debates,1474940004730,780581072056770561,2
140,freestylebit,#debates Every country in the world is ripping us off...damn I don't think we have good scammers in the #USA anymore...,1474940004749,780581072136499200,2
141,amxndasantino,"Donald Trump when asked about his tax returns: 
""I am under a routine audit"" 
Also Donald Trump:
*grabs breadsticks and leaves* 
#debates",1474940004701,780581071935135746,2
142,r_crawford70,Blink Blink Blink#debates,1474940004757,780581072169947136,2
143,CaliseHawkins,"Stop smiling Hillary, YOU'RE BLOWING IT #debates",1474940004845,780581072539045888,2
144,BrianaRinaldo,"Yeah, Palau definitely ripping us off real bad, Trump. #debates",1474940004765,780581072203579393,2
145,arandomdog,Gosh he is so orange and a liar too...#debates,1474940004831,780581072480329730,2
146,Nomedialies,30 years of nothing. We need change. #debates https://t.co/hPuIciVzN8,1474940004734,780581072073592832,1
147,NetDep911,Fear? You want fear - true cold skin crawling fear is the thought of #CrookedHillary being #POTUS.......... #debates https://t.co/asp5duz16F,1474940004774,780581072241168384,1
148,heytherekate11,I AM A WIZARD OH WAIT I WATCH THE NEWS  #Debates,1474940004854,780581072576712704,2
149,glasscity08,gosh only 60 minutes to go ... please proceed @realDonaldTrump ... #RoseGarden  #debates,1474940004905,780581072790654976,2
150,GregMav1,"I want to go to sleep to a soundtrack of Trump saying ""billion"" over and over #billyeeun #debates #debatenight",1474940004465,780581070945316864,2
151,AlexisJavierP,"#debates
Tema 1 prosperidad:
-Clinton: populista, proteccionista, estatista
-Trump: habla de bajar impuestos y atraer inversión",1474940004808,780581072383930368,2
152,respectyourcoin,He only pushes fear and says the thing over &amp; over.  #Debates,1474940004949,780581072975388673,2
153,_shinobipam,wow https://t.co/rQ63FSd4gn,1474940004784,780581072283308032,1
154,LindseyKelk,"Auditing has no impact on whether or not you're able to disclose your taxes, Donald, so that's a complete lie #debates",1474940005678,780581076032827392,2
155,Pant_Eater,How does he manage to still brag about how much money he has #Debates,1474940005637,780581075860885504,2
156,jonnythompson_,I weep for America. #debates,1474940005576,780581075605151744,2
157,MattSoleyn,"""I get audited almost every year,"" says @realDonaldTrump. #PresidentialDebate #DebateNight #Debates #Debates2016 #Trump",1474940005382,780581074791460868,2
158,FormerEden,"@BetteMidler Many people are saying it. I'm not, but many are. #debates",1474940005522,780581075378642948,2
159,relationalAteam,"""That's the kind of thinking our country needs bc we have a trade deficit of almost 800 Billion $ a year."" #DonaldTrump #debates",1474940005683,780581076053794816,2
160,johnvervemckenz,I don't care how rich you are. You are an ass! #DonaldTrump #debates,1474940005467,780581075147952129,2
161,Ford_ish,No woman who ever went to grad school/worked/went to high school has escaped this particular unpleasantness. https://t.co/BGYgX4JlMP,1474940005477,780581075189899266,1
162,hellogiantme,What the fuck is Trump talking about? He's all over the place. #Debates2016 #DEBATES #debateNight,1474940005645,780581075894480896,2
163,WHIORadio,"Major @nanwhaley is tweeting during tonight's debate, WHIO listeners.  Listen to the debate here :… https://t.co/JpxLr7JTPt",1474940005529,780581075408003072,1
164,hatfieldhiphop,@GovGaryJohnson Take that Trump! Brass Knuckle Sandwich! #debates #Debates2016 #brassknucklesandwich #garyjohnson https://t.co/TEhvDbAovQ,1474940005544,780581075470979073,1
165,LetsVoteDem,That's what we think here in #Maryland! #debatenight https://t.co/v8I1q4B1s9,1474940005592,780581075672305664,1
166,Joseph_La_Rue,"""Political hacks are negotiating our trade deals."" --#DonaldTrump #debatenight #debates",1474940005718,780581076200660993,2
167,PingPongPlayaa,I just told @nbcwashington who I think is winning. Cast your vote now! #Debates #NBC4DC https://t.co/Jr4f6ZwD1o she won before it began,1474940005107,780581073638096896,1
168,nwjerseyliz,"Donnie, you don't interrupt the moderator. Tsk. Tsk. #Debates",1474940005663,780581075969908736,1
169,reaganisahero,FoxNews: https://t.co/YmyMUSr4jj,1474940005484,780581075219279872,1
170,toxicmalvm,The United States is in trouble I can't believe these are our presidential canidates i #debates https://t.co/v7QPGIRm5M,1474940005477,780581075189796865,1
171,loathyourself,i hope the emails are brought up #debates,1474940005670,780581075999424512,2
172,danita0053,"Routine audit, blah, blah, blah. Is he not going to fact check this statement??? #debates",1474940005615,780581075768586240,2
173,ohheyhayden,I just told @nbcwashington who I think is winning. Cast your vote now! #Debates #NBC4DC https://t.co/1t2upNBydE,1474940005587,780581075651325952,1
174,milrider,Donald is still finger pointing and still avoiding the actual issues.  #debates,1474940005514,780581075344949249,2
175,TheOneTrueShire,Stop dodging this bullshit trump #debates,1474940005838,780581076703903744,2
176,BlitzMambah,Hillary better pull out a mom joke soon #debatenight #debates,1474940005918,780581077039525889,2
177,aliwalllace,Honestly Americas fucked either way so #debates,1474940005803,780581076557107201,2
178,heytodda,NIXON was under an audit when he released his tax returns. #debates,1474940005872,780581076846510080,0
179,Zytabyte,"I love how Trump just can't help but say the same things over and over again, and bragging how much money he has. It's hysterical #Debates",1474940006685,780581080256565248,2
180,mtnmamaste,Who's working his strings tonight? #debatenight #debates #Debates2016 https://t.co/QQ1lrvLEbd,1474940006373,780581078947860482,1
181,bgwalton7,@LesterHoltNBC We got your back!! It's your first time for #debatenight -just pace yourself-you will be fine!! #debates,1474940006665,780581080172756992,2
182,kerchmcc,#debates HILLARY INTERRUPT THE F-;(($ker!!!,1474940006675,780581080214675456,1
183,benmathmedia,I think @HillaryClinton should study the 2008 collapse a little more #debatenight #debates,1474940006700,780581080319524864,2
184,janelynne,#debates Trump sounds like a fool,1474940006645,780581080088936453,2
185,cas_ramos,#debatenight #debates https://t.co/uGS8D9BqgC,1474940006598,780581079891767296,1
186,ostilaxmi,I actually think US economic is in much better position now then when Bush left! #Debates,1474940006724,780581080420188160,2
187,jconnellyBND,Holt now asking about Trump's tax returns. Trump brings up that he's under audit. FTR he's allowed to release returns despite audit #debates,1474940006738,780581080478814209,0
188,gingeyandtonic,"hey, Trump, more interested in your balance sheet than your income. #Debates",1474940006749,780581080524951553,2
