,screen_name,text,timestamp,tweet_id,cluster_pred
189,Bryan_Donatz,"#debatenight #debates #debate2016 @realDonaldTrump Ahead of schedule, under budget.. Unlike 4 more years of thesa me",1474940621817,780583660307177472,1
190,Stewtrill,Me right now #debatenight #debates https://t.co/iuhPtAN7lf,1474940621709,780583659854188544,4
191,GravesMarcia,Changing laws has to go through congress first #debates,1474940622567,780583663453007873,0
192,PhillyNate83,#BREAKING Deplorable Donald uses #debates for a hotel promo. Okay I didn't see that coming.,1474940622576,780583663490727937,1
193,nytesyren,Over 90% of the products in his new Washington hotel he brags about are from other countries. #debates,1474940622747,780583664207794176,2
194,BrainHoliday,#NeverTrump #DumpTrump #debatenight #debates https://t.co/9PA5m32twX,1474940622389,780583662706421760,4
195,carriecummings,Laguardia is a dump tho #debates,1474940622684,780583663943749632,1
196,DevenryUnlocked,I can't help but think about the people playing the drinking game to this. You alright?! #Debates https://t.co/FPlZAoTEAP,1474940622544,780583663356477440,4
197,handsingloves,"""I take advantage of the laws of the nation."" What an alienating comment from Trump.  #debatenight  #debates",1474940622633,780583663729795072,0
198,unforgettable_c,#debates https://t.co/bbMzxToCJA,1474940622269,780583662203076608,4
199,McGillPatterson,#debates Trump giving version 5 of this answer with some additional ad for his hotel. Heat is off Clinton. Now Trump is talking about roads?,1474940622609,780583663629197313,0
200,maggiespost,And Trump's decrease for his all companies will line their pockets a little more🤔🕊 What is with his breathing? https://t.co/i2OBogWZAJ,1474940622654,780583663817883648,4
201,annmariestephen,Oh the hipocracy! #debates,1474940622681,780583663931101188,2
202,oakleyass,and people actually believe he's qualified to be president... https://t.co/RQ5rfSsyB4,1474940622827,780583664543494144,1
203,ZolaZsun,oh now he is doing an ad for his hotel? #Debates,1474940622835,780583664576974848,2
204,RusselIM2803,"What about Hillary ""stiffing"" those that died in Bengazi  #debates",1474940622954,780583665076097024,1
205,Statman_Begins,Really wish Trump would have made a 'How many people has Bill stiffed joke'. Guess he does have a lil class. #debates #Debates2016,1474940623659,780583668033187840,0
206,glamrdiva,"So is he saying if he can cheat the law it's okay for him? Did he just say that? One a cheater, always a cheater. #debates",1474940623717,780583668276338688,1
207,NJIvorygirl,#NeverHillary #Debates https://t.co/RpWWPf6qYQ,1474940623590,780583667743719424,4
208,AlanaSmithWalsh,"Unbelievable, believe me, unbelievable, believe me, unbelievable, believe me, unbelievable, believe me, tremendous, tremendous, #Debates",1474940623539,780583667529809920,1
209,MontyGeer,Did he just say he takes advantage of the laws of the nation to screw workers? #debates #debatenight,1474940623699,780583668200775680,0
210,Troothhurtshuh,@chelseahandler Chelsea Handler had 2 abortions in one year!!  #debates,1474940623624,780583667886280707,1
211,tb3443,"Manipulating man....you're scum, Mr. TRUMP #Debates",1474940623793,780583668595036160,1
212,andekral,Trump: and we don't have the money bc it was squandered on ur bad ideas. Hillary: or bc u haven't been paying ur income tax 💁🏼👋😂 #debates,1474940623793,780583668595261440,1
213,flamingoHeels,#IVoteTrump &amp;just told @nbcwashington who I think is winning. Cast your vote now! #Debates #NBC4DC https://t.co/cGJKRwcPJI,1474940623724,780583668305702912,3
214,AlfieColdron,This sums it up perfectly #merica 😶 https://t.co/sBjxorwk1E,1474940623674,780583668096139266,4
215,Orcalovingbitch,I think Trump needs a dictionary while up there. 😂   #Debates,1474940623726,780583668314169345,0
216,ChadMosher,Whatever happened to Lester Holt not being a potted plant? #debatenight #Debates,1474940623836,780583668775399425,1
217,FHSMurica,Facts versus opinions. Government students know the difference... #debates,1474940623817,780583668695896064,1
218,Yoshiboo360,he keePS INHALING #Debates,1474940623863,780583668888678400,1
219,JenniferDarli20,@realDonaldTrump  bankruptcies but claims he is great business man! Trump takes advantage of laws for HIMSELF! And only HIMSELF!  #Debates,1474940623673,780583668091936768,0
220,Hasxns,"LMFAOOOOOOOOOOOO THIS NIGGA TRUMP 
#Debates",1474940623795,780583668603551744,0
221,JordanRWest,its called taking advantage of someone for a reason. #Debates,1474940623903,780583669056495616,0
222,suestroud,"I take advantage of the laws, but didn't he just repeatedly say that the laws are bad &amp; her fault #Debates",1474940624696,780583672382578689,0
223,reaganisahero,FoxNews: https://t.co/I2dNG8ThEu,1474940624474,780583671451516928,4
224,RobMiller137,@realDonaldTrump should ask @HillaryClinton what legislation she created when in the Senate...and how HillaryCare in went 1993??? #debates,1474940624696,780583672382619649,1
225,aboiola,"O Trump só fala de negócios, empresas, grana...e sobre saúde, educação, direitos civis...fim das tropas na Síria, Iêmen...? #Debates",1474940624659,780583672227438594,1
226,NewsMoeda2,https://t.co/njzo2FsMvY ETHEREUM FREE #Decision2016 #AskDemi #JuntosComMafiaSdv #debates #blockchain #bitcoin https://t.co/UB6pMHlWQi,1474940624487,780583671506018304,4
227,muhua33,Trump is nothing but sound bites and fake persona #debates,1474940624645,780583672168656896,1
228,famoushorse,"""I HAVE THE GREATEST ASSETS IN THE WORLD, BELIEVE ME. HERE'S SOME ANECDOTAL EVIDENCE"" --TRUMP #debates",1474940624635,780583672126836736,1
229,AlphaFoxWarfare,It's really sad. https://t.co/hIbnGnguUH,1474940624642,780583672156225536,4
230,jazzfeyersalo,It's unclear if Trump's bully posture is tactical or compulsive.   #debatenight #debates,1474940624696,780583672382619648,1
231,pennysnax,Probably a real stuffed lion. Courtesy of his sons. https://t.co/CSUu8ezWt7,1474940624682,780583672323846144,4
232,mellenology,I wonder who each one will turn into @SNICKERS #debatenight #Debates2016 #TrumpPence16 #Hillary https://t.co/giz4aDh3xl,1474940624612,780583672030171136,4
233,LRogersMI,"Who said it: ""I take advantage of the laws of the nation"" #debates #debatenight",1474940624778,780583672726507521,0
234,idahobuzzy,#ImWithHer #debatenight #Debates https://t.co/GxM7CxVv8A,1474940624731,780583672529289217,4
235,joseapie,I've already lost count. #trumpswords #adjectives #debates,1474940624779,780583672730771458,1
236,TheAcecapade,Actually... I kinda have a hotel there. He's gotta pay up. #Debates https://t.co/EkKf0txE6H,1474940624678,780583672307191809,4
237,lifewithdeborah,Have you guys learned anything new from the #debates so far?,1474940625672,780583676476166144,1
238,E_Rod826,This #Debates has shown me to believe my mom when she said I could be President #Debates2016,1474940625691,780583676555825152,1
239,aapbatista,Está na hora da gaffe? #debates,1474940625701,780583676597985280,1
240,Christo12548646,Tampons #Debates,1474940625696,780583676577013760,1
241,heyyPJ,"Whenever Donald Trump says ""China,"" I keep picturing Peter Griffin. #debates",1474940625691,780583676555976704,1
242,JimiRon_Xo,Judge a nation by its airports..thats smart smh  #debates,1474940625727,780583676706820096,1
243,KrisyDoll,Why the fuck you lying? Why you always lying? #DonaldTrump  #Debates,1474940625731,780583676723752960,1
244,Rickyrey31,"I have the best deals,the best business,the greatest #LiarTrump #Showyourtaxes #debates",1474940625762,780583676853620736,1
245,molly_ff,“I take advantage of the laws of the nation” and also thousands and millions of working Americans #debates #debates2016,1474940625683,780583676522274817,0
246,delcruz,Isn't there an app for this? Yelp for businesses? Lol https://t.co/mBAzYyQwtM,1474940625651,780583676388188160,4
247,alexflora360,Oh please @realDonaldTrump 6 of your businesses have gone bankrupt you are a horrible man that broke the law!! #debates #business #economy,1474940625791,780583676975325185,1
248,SiWillmore,You can't even escape the toupeed bringer of the apocalypse in an airport in Tokyo #debates https://t.co/cYzyJO0fkA,1474940625070,780583673951170564,1
249,loccdawgg,Lol Ok seriously how did we end up with these two? #Debates,1474940625737,780583676748980225,1
250,AmberCClifton,"""I built an unbelievable company"" ...by not paying all the regular people who worked hard for you that you promised to pay #debates",1474940625843,780583677193519105,1
251,skendell,"He works for his companies, @HillaryClinton works for America #Debates2016 #debates #ImWithHer",1474940625788,780583676962713600,1
252,writerlane,I'll give him LAX. LAX is a damn mess. https://t.co/tWx6PmjnYW,1474940625740,780583676761419776,4
253,Uverneous,"Wait, does Donald Trump sniff before he embelishes the truth? #debates",1474940625924,780583677533138944,0
254,lihanewi,"Money owed is money owed 
Donald!  It doesn't matter to whom. Period.  #debates",1474940625911,780583677478653952,1
255,Steelersnystyle,Making money for his family and companies on the back of middle class workers #debates,1474940626664,780583680637108224,1
256,kristinabittorf,"#Dubai is not a country, it's part of the #UAE. Both UAE and #Qatar are not 3rd world countries .@realDonaldTrump #debatenight #debates",1474940626607,780583680397967361,2
257,stout_87,Look at Hillary looking like @Fameolous ...came to spill the tea #Debates,1474940626427,780583679643021312,1
258,DreKing08,Don't call it a comeback! *in my LL voice* #HRC #debates #debatenight,1474940626647,780583680565768192,1
259,HerrUschi,"Stimmt. Die USA stehen an der Grenze, ein dritte Welt Land zu werden. Wow, wasn Arschloch #debates",1474940626740,780583680955781121,1
260,BrosAtTheBar,"New DJ Trump single ""every day I'm sniffling"" dropping any minute now. #debates",1474940626647,780583680565706752,1
261,DoinWork86,"No policy talk,  just a shit slinging fest.  Political landscape looks great! #debates",1474940626810,780583681249333248,2
262,FirstandGlenn,@realDonaldTrump @HillaryClinton #Debates https://t.co/tGA24HUit9,1474940626498,780583679940788224,4
263,lasesana,Trump's new hotel in DC is EMPTY #debates #debatenight https://t.co/84qs2mO5Bf,1474940626622,780583680460910593,2
264,gomatgo,Trump cares more about his companies than his country. #debates,1474940626850,780583681417093120,0
265,UDbmas,SNow freeloading @realDonaldTrump is using excuse of loopholes for stiffing contractors as it it's a good thing. #CantTrustDonald #debates,1474940626802,780583681215913984,1
266,Leigh_Lewis,"Maybe it's just me, but I don't think our airports are like airports in third world countries... @realDonaldTrump #debates #debatenight",1474940627677,780583684885753856,2
267,docfilmwarrior,He is CAPITALISM at it's worst!!!!  #Debates,1474940627668,780583684848091136,1
268,JDMotts,"""Take advantage of the laws"" is double talk for ""finding a loophole"" @realDonaldTrump #debates",1474940627603,780583684575416320,0
269,altonivel,“Decenas de personas están felices conmigo”: @realDonaldTrump #debates,1474940627685,780583684919336962,1
270,kierobar,#HofDebate16 #green https://t.co/JXmocOxJwp,1474940627484,780583684076281857,4
271,shars_books,"Just gave plan B and a infomercial
#debates",1474940627431,780583683854069760,1
272,KelsiWebsta,WOAH.  https://t.co/yqFWT1sHWe,1474940627557,780583684382584832,4
273,Korede_TA,There's a trade deficit but Trump's being silent about the service surplus #debates,1474940627645,780583684751691776,1
274,alexkaloostian,"Well, he IS right we have sqandered $trillions on wars &amp; conflicts Clinton helped foment #sorrynotsorry #debates",1474940627781,780583685321924608,1
275,KommonsenseKurt,#sad https://t.co/0ah7T6ySc8,1474940627657,780583684801896449,4
276,jamisonwebb,"JESUS CHRIST THAT ""PENNSYLVANIA AVENUE"" QUOTE. THAT'S ALL THIS FUCKING IS TO HIM #debates",1474940627734,780583685124943872,1
277,TheCFTWatchers,We find those who practice bigotry &amp; racism for any reason vile. And this is only when she was caught. Think for yo… https://t.co/jAh88zxxge,1474940627505,780583684164448256,4
278,MarlowNYC,Oh my god. Trump is literally plugging his new DC hotel in a presidential debate. #debates,1474940627769,780583685271777280,2
279,TheOnlyMattBuek,And now it's an add for Trum's shitty hotels. Lovely. #debates,1474940627841,780583685573648384,1
280,ThomasBernpaine,"Don't be fooled, evidence destroyed for a reason
#CORRUPT #factcheck 
#debates 
#StoneTear #FeelTheBern… https://t.co/u7yKCV346G",1474940627467,780583684004982786,1
281,lettergirl2020,Hillary looks like the professor and Trump w/all his yelling and interrupting looks like an apprentice - and a bad one at that. #debates,1474940627804,780583685418475520,0
282,BALDWINicolette,"#Debates #Trump is getting upset over his tax returns.
Why doesn't he pay Federal Taxes?

#WeThePeople pay them to support #US like schools.",1474940627737,780583685137596417,1
283,alexhrojas_,"A man who wont even release his tax returns and has used charity funds for his own personal use thinks he can ""save"" this country #Debates",1474940627910,780583685863059456,1
284,loradler,He takes advantage of...blah blah blah it's an ad for his hotel #Debates,1474940627816,780583685468909569,2
285,MakiyahxJamia,don't vote for Donald Trump.  #Debates,1474940628691,780583689138778112,0
286,GuyKawasaki,"#debates Great, he can build a hotel. That’s about the same as running a country.",1474940628675,780583689071636480,2
287,mydailywalk,Where is Lester Holt?????  Get this back on track #Debates,1474940628667,780583689038262272,1
288,TheeJFish,Did @realDonaldTrump just admit to taking advantage of Americans because he knows how to finagle around laws? #debatenight #debates,1474940628622,780583688849555456,0
289,robtoml_statman,"Does moderator fact check? Meh
Do candidates fact check? Kind of
How do candidates confront past records/claims? LOUD NOISES!!!
#debates",1474940628603,780583688769773573,1
290,ckjackson,"""Manterrupting: Unnecessary interruption of a woman by a man."" https://t.co/qASSekGvbH #Debates",1474940628711,780583689222619136,4
291,Eh_Wick,So when are we gonna stop talking about white middle/upper class economics  #Debates,1474940628687,780583689122111488,1
292,adamtrabold,"""Potential President announces split attention if elected"" #debates",1474940628797,780583689583366144,1
293,MichaelLopriore,"Ok, I would much rather watch the #debates going on at the Branjolina household right now than to watch these monkeys go round for round",1474940628791,780583689558355968,1
294,Harlem2nyc,This guy is self destructing #Debates,1474940628384,780583687851237377,1
295,JonathanWax123,@realDonaldTrump keep playing the victim #debates @MSNBC,1474940628788,780583689545658368,1
296,AaronMNCurry,"""It's all words. It's all soundbytes. I built an unbelievable company."" YOU'RE NOTHING BUT SOUNDBITES. #debates",1474940628796,780583689579220992,1
297,alphabetjoni,Honestly... I'm scundered for @realDonaldTrump #Debates,1474940628765,780583689449275393,1
298,tootseroll,What is #tremendousmoney #debates,1474940628840,780583689763692544,1
299,thewhippleffect,"Donald Trump’s Lies And Distortions on Hillary Clinton’s Emails
 https://t.co/BvWUgaljM8 #debates",1474940628775,780583689491058690,1
300,shameee__,Trump is so childish. Stop interrupting Clinton show respect like she is for you. #Debates,1474940628759,780583689424105475,0
301,infamous074,Sub to my YouTube  #Debates,1474940628846,780583689789014016,1
302,TeeTweetsHere,"😂😂😂😂😂😂Husband just asked me ""Did he go to college?"" Trump is just all words with no substance not smart. #debates #Debates2016",1474940628862,780583689856094208,1
303,TeekTheTweeter,"#Debates ""I screwed the little guy to grow my business and I want to bring that same attitude to the government"" - Donald Trump",1474940629680,780583693286944768,1
304,angieesaldana,I just really wish Bernie was still an option  #Debates,1474940629560,780583692783673344,1
305,acb2410,TRUMP STOP WAGGING YOUR DAMN FINGER AT POOR LESTER #Debates,1474940629659,780583693198831616,1
306,BernFace,Now he's out of breath...talk about lack of stamina #debates,1474940629611,780583692997537793,1
307,deniserwills,@realDonaldTrump Where are your morals? Take the laws to take advantage and cheat people who can't fight you in court for years! #debates,1474940629495,780583692510961664,0
308,Jessica11__,Trump doesn't know how to defend himself #Debates,1474940629723,780583693467262978,0
309,253pnw,Get him hillary. Call him on his lies. Crooked trump. Lies. Call him on slave labor in Dubai hes involed in #Debates,1474940629704,780583693387653121,1
310,CloreenBacNSkin,He's using this debate to shill his new Trump hotel and casino in DC. #debates,1474940629715,780583693433790465,2
311,nathanaelmu,Schrodinger is probably moderating this debate. He's both there and not there #debatenight #debates,1474940629543,780583692712370176,1
312,jukamaze,Keeeeee Jjajaajjajajajajajajaja #debates  Donald Trump esta loco Jajajaja,1474940629583,780583692880191488,0
313,cmclymer,"Fun Fact: the head chef of Trump's DC hotel ""on Pennsylvania Avenue"" quit over Trump's racist comments.

#debates #debatenight",1474940629669,780583693240963072,4
314,MiraMarshalll,There you have it. One way or another... #debatenight #debates,1474940629769,780583693660205060,4
315,humanmichael,#debatewithbernie would be so much better if it was an actual #debatenight w @BernieSanders .  #debates #FeelTheBern,1474940629624,780583693052174336,0
316,nissanadgwick,#Debates  hillary get a life quit trying to make Trump look bad (it wont happen) and actually try to make urself look good,1474940629528,780583692649443328,1
317,LivinMyTruth,".#debates Then he has poor judgement. If he keeps hiring workers that do bad work, what would his Presidential Cabinet look like?",1474940629659,780583693198954496,1
318,ElizabethAllaby,The fact Hilary doesn't chuckle when Trump talks proves she's a better woman than I. Or she's dead inside. Either way #ImWithHer #Debates,1474940629641,780583693123477504,1
319,JAYBLESSED,I really want to throw my shoe at Lester Holt tho! Weak ass moderator! #debatenight #debates #ClintonVsTrump,1474940629710,780583693412929537,2
320,dperry913,#HillaryClinton is getting under some orange skin tonight. #debatenight #debates,1474940629686,780583693312151552,1
321,ArtforYu_,이모지 절구같아 귀엽다 #Debates,1474940629827,780583693903507456,1
322,theeReganKirsch,Re freaking tweet. https://t.co/O3h8vSYHsz,1474940629804,780583693807038464,4
323,HeadlessGal,"What a sheister!!    He sounds like #CalWorthington

#Debates",1474940629832,780583693924470786,0
324,ReenaAulakh,Trump's being bragalicious again  #Debates,1474940629811,780583693836484609,0
325,samuraiyn,"I took advantage of people because I can. 
#Debates",1474940629858,780583694033530885,0
326,onedreamaway,"Trump there's no reason why you can't release your tax records. Your looking like your hiding something, come on be real! #debates",1474940629828,780583693907787776,0
327,kristiwaite,😂 https://t.co/HMy4MlSGuW,1474940629908,780583694243209217,4
328,JamesEFinch,"Jesus Christ, what the fuck is he talking about? #debates",1474940630431,780583696436957184,1
329,LIVinLarge_,I just told @nbcwashington who I think is winning. Cast your vote now! #Debates #NBC4DC https://t.co/evSXTjMOnQ,1474940630683,780583697493860352,3
330,pickettbri,"I'll give you one thing, Drumpf - you've got some hella white veneers. #debates",1474940630644,780583697330294784,1
331,wer4navy,".@HillaryClinton has nothing to say for herself, can only criticize what she knows NOTHING about: making money in b… https://t.co/hSH4f1ofZ5",1474940630658,780583697389015040,4
332,tofrum,She comes off as a slick politician. Perfect.  #debates,1474940630789,780583697938391041,1
333,karatewolfpunk,#LetGaryDebate #MakeAmericaSaneAgain #BroadenTheDebates #Debates #Debates2016 https://t.co/bTYg79epuD,1474940630661,780583697401548800,4
334,BrittanyRowe2,I just told @nbcwashington who I think is winning. Cast your vote now! #Debates #NBC4DC https://t.co/8RvwmLCHKE,1474940630660,780583697397518340,3
335,mrsborn_2reign,@realDonaldTrump keeps sniffling like he just took a line of that BLOW💨 #debates #NYDEBATE,1474940630550,780583696936103936,1
336,mrsalexamars,can hillary bring up him not believing in climate change/global warming again so he can keep denying it #debates,1474940630678,780583697472970752,1
337,adnys,Impressed by how Donald and Hillary are both multitasking and tweeting during the #Debates,1474940630658,780583697389019137,1
338,KanelsAbel,"#debatenight #debates #Debates2016 #PresidentialDebate 

This is so one sided why is this even happening. Worrying.",1474940630687,780583697510723584,1
339,JennSkellington,I would love to hear the debate that Trump is tuned into. #debates,1474940630612,780583697196212224,0
340,magicalmolly,I don't even know how to live tweet this anymore TRUMP IS just saying random false arrogant things and Clinton is being classy af #Debates,1474940630431,780583696436826112,0
341,GFTVtalk,Is he promoting his shit again?!!! #debatenight #debates,1474940630740,780583697732861952,2
342,sarahtaqvi,"Trump: ""We're opening up on Washington Avenue next to the White House, so if I can't get there one way..."" #debates",1474940630723,780583697661558784,1
343,FansofMichelob,how long till #trump brings up #hillary getting sloppy cigar seconds? #debates,1474940630652,780583697363927040,1
344,UpsideUp,I think he might pass out. #debates,1474940630748,780583697766608896,1
345,lanternsbuzz,cue up class warfare and trickle down #debatenight #LanternsBuzz #debates @realDonaldTrump @HillaryClinton #MaoPantSuit,1474940630863,780583698248916993,4
346,suemiller70,"The sniffling, make it stop!! #Debates2016 #debatenight #debates",1474940630780,780583697900826624,1
347,arbedy,Trump doesn't believe he need to pay people for work they completed. He takes advantage of working ppl  #debates,1474940631653,780583701562351617,0
348,EgelSamantha,These two need to talk about real shit and stop clowning around #debatenight #debates,1474940631671,780583701637894144,1
349,YeaItsDevin,Did Trump just admit to fucking people over because the law allows him to? This is who yall want for president?? #debates,1474940631740,780583701927239680,1
350,ProgressivGreen,"Well, I've had my fill of the #debates 

I'm ready to #BringBackBernie.",1474940631766,780583702036262912,1
351,HRC2016VOTEBLUE,@realDonaldTrump says whatever comes to his tiny brain. https://t.co/X5D2wOl5Fj,1474940631472,780583700803252225,4
352,Kekembas_17,He keeps looping the same exact thing.....I have a great company....also hillary deleted emails.#debatenight #Debates2016 #debates,1474940631804,780583702195601408,1
353,ChrissyD233,"""We don't have people that know what they're doing."" Obviously if the Donald is somehow on my tv tonight. #debates",1474940631721,780583701847695361,1
354,julianawriter,"@realDonaldTrump OK he finally said it ""Donald Trump will do well for himself &amp; his family"" he finally said it #debates #stop_Trump",1474940631699,780583701755400192,1
355,sloiaconi,And then Donald Trump promoted his new hotel for literally a full minute. #debates,1474940631740,780583701927178240,0
356,C___PAZ,Hillary le dijo que esta más quebrado que Correa cuando era pobre!  #Debates,1474940631710,780583701801529345,1
357,FunkTion29,Trump just admitted he takes advantage of the Laws of the Land to further himself! How is this good for the Country? selfcentered #Debates,1474940631749,780583701964959745,0
358,sarking,"Jesus fuck, that ""if I don't get there one way"" line is a world of nope. #debates",1474940631700,780583701759553537,1
359,nicolashepherd,I just told @nbcwashington who I think is winning. Cast your vote now! #Debates #NBC4DC https://t.co/RXIX5Y4g20,1474940631681,780583701679837184,3
360,PennsylvaniaZu,@kevinbrennan666 @RiotCast @mlcpodcast thank god this just came out so I don't have to watch #debates. U🇺🇸S🇺🇸A🇺🇸,1474940631446,780583700694175744,1
361,TradesofJacqui,How is she wrong about you saying you'll negotiate our debt down???  https://t.co/ZE6udbc6Fb #Debates2016 #Debates,1474940631769,780583702049021953,4
362,livefornever,so he's gonna be a postman? #Debates,1474940631672,780583701642039298,1
363,GabyGarcia_12,#debates,1474940632668,780583705819680769,0
364,LORI4JC,"Hillary wants to talk about stiffing workers,Trump needs to talk about the way The Clinton Foundation stiffed Haiti! #debatenight #debates",1474940632671,780583705832071168,1
365,adhdproductions,Donald J. Trump #TakingAdvantage of America #debates,1474940632719,780583706033397760,0
366,_CoolStoryCori,Hillary said Laguardia is a sh*t show bc Donald doesn't pay taxes. LMAO  #Debates,1474940632641,780583705706364928,1
367,JoaRoy,@lasoiree https://t.co/X3w1Gw1Dse,1474940632470,780583704989237248,4
368,menanjee,"#debates so @realDonaldTrump will take advantage of low information voters to get to the WH,",1474940632531,780583705244946432,0
369,kristinnguyen10,"The nightly news said the presidential debates are of a higher caliber than the primary debates... More composed, serious, etc. 😐 #debates",1474940632694,780583705928667136,1
370,bintangrafdi,How is this qualify as Presidential #Debates? #DebateNight,1474940632506,780583705140080641,1
371,Peoples_Pundit,"Trump: ""As soon as she releases 33,000 emails, I will release my tax returns."" #Debates",1474940632667,780583705815322624,1
372,basket1544,Under budget because you aren't paying the contractors is not good business. #debates,1474940632589,780583705488138240,1
373,trpiller,#Debates It is NOT about YOU Donald...,1474940632716,780583706020966400,0
374,ccuttriss,Trump has no idea how to deal with a crowd that doesn't cheer him on every four words. #debates,1474940632749,780583706159296513,1
