,screen_name,text,timestamp,tweet_id,cluster_pred
760,ElHombreBDD,You win tweet of the night. I'll mail your award in the morning. https://t.co/BeEN3ceygK,1474940652639,780583789584060416,4
761,nickybail,"Trump: ""I HAVE A COMPANY I HAVE A COMPANY MY COMPANY MY COMPANY MY COMPANY COMPANY COMPANY COMPANYYYYY!"" #debatenight #debates #Debates2016",1474940652681,780583789760159744,1
762,SlayAnimosity,"This debate is as entertaining as a drama movie.
#debatenight #debates #Debates2016 https://t.co/UqujQ6gN5Q",1474940652055,780583787134541830,4
763,KimAcheson,"Donald Trump’s Idea to Cut National Debt: Get Creditors to Accept Less

#debatenight  #debates https://t.co/P2p6AcKRTs",1474940652287,780583788107694080,4
764,RealTrevinShu,Like what Lester Holt is doing... Letting the candidates debate... Let the audience decide who is good... #debates #DebateNight,1474940652701,780583789844045824,1
765,calumbbg,is trump okay he's like panting #debates,1474940652746,780583790032805889,0
766,markuspreiss,"Wenn Ihr Anspruch Präsident zu werden auf Erfahrung als Geschäftsmann beruht,dann zeigen Sie Steuererklärung. #Clinton zu #Trump #debates",1474940652655,780583789651263488,1
767,joyofpathology,"yep!  the ""sin of omission"" https://t.co/HXZ44eSuHr",1474940652623,780583789517008896,4
768,juanluque,what a conman this donald  #Debates,1474940652592,780583789387014144,1
769,Dope_Esen,Donald keeps sniffing. Is he gonna die? #Debates,1474940652751,780583790053818368,1
770,srodingercat,"""Tal vez no me gusto el trabajo que hizo y por eso no le pague"" Frase celebre de Trump #debates",1474940652736,780583789990846464,1
771,grvjlk,@BDUTT @HillaryClinton None of my American friends will ever understand how terrifying it is as an Indian to watch their #Debates.,1474940652760,780583790091448320,1
772,dswinder,Donnie is unhinged. #debates,1474940652772,780583790141923328,1
773,phaxyn,"FoxNews: .HillaryClinton: ""There's something [realDonaldTrump's] hiding."" #debatenight #debates #Debates2016 https://t.co/QSxsi84awl",1474940652660,780583789672206336,4
774,sosodeformed,"Have to pee, someone tell me if they finally mention women or gay people. #debates",1474940652711,780583789886050305,1
775,csnegm,"Perhaps you should lay off the weed and smarten up, bozo. https://t.co/XL9HFsTc5Z",1474940652739,780583790003445764,1
776,RevDJEsq,"Trump: Stiffs can't contractors, sniffs at debates. #debates",1474940652814,780583790317940737,0
777,KirstenS,"In 2016, the most experienced person in US politics is being mansplained to on National TV. And people are eating it up. WUT. #debates",1474940653660,780583793866321920,1
778,KristineAz,Oh shit.  Here we go.  Race.  #debatenight #debates,1474940653667,780583793895714817,2
779,ladybigmac,"Sick, isn't it? https://t.co/PSBDkg0TST",1474940653564,780583793463795713,4
780,AGoodAche,#bigly https://t.co/Xk3YYJ2yo9,1474940653645,780583793803403264,4
781,bellazinca,"""it's all words..."" 

Yeah words strung into sentences that are fact, stay in your fucking lane.

#debates #Debates2016 #debatenight",1474940653590,780583793572864000,1
782,butterfenga,"He says he's obligated to himself and his family. No mention of the country. Very telling, wannabe Prez. #Debates",1474940653565,780583793467895808,1
783,JakeCinkus,Why is Hillary telling trump how to run a business. You literally have no clue what you're talking about. Talk about politics stfu #Debates,1474940653716,780583794101325824,1
784,Icetjfish,Trump makes my ear bleed every time he talks  #Debates,1474940653674,780583793925259266,1
785,hixyarfprod,Meanwhile Bernie is off to the right like tag me in! #debatenight #debates https://t.co/rPswAUPvSe,1474940653343,780583792536850432,4
786,minpanisara,Not sure why I'm watching #debates right now cause I can't stand Donald Trump. Why can't you just shut up? #sniff,1474940653736,780583794185162753,0
787,AudraGayle,So are his taxes paid or not? Can't tell from his answers.  #debates,1474940653771,780583794331922432,1
788,regaLwrencH,wait--someone worked for you and you didn't pay them? no no Mr. Not-President that's how you get slashed tires #Debates #debatenight,1474940653735,780583794181017600,1
789,CStreetlights,Don't want to hear any complaints about Hillary bringing up her book or site (both relevant) when Trump just brought up his HOTEL #debates,1474940653591,780583793576992768,2
790,Ana21Ana211,BINGO unbelievable! Any believers watching?! Where are the Justin groupies?! #debates,1474940653829,780583794575159297,1
791,cgocmav,"Oh Lester, so witty!!!#debates",1474940653835,780583794600312832,2
792,lyricaldanichan,We are fucked... Too bad that @BernieSanders didn't run on his own. gg murica #debates,1474940653816,780583794520698880,1
793,ispkout,I just told @nbcwashington who I think is winning. Cast your vote now! #Debates #NBC4DC https://t.co/dg0kO1I0KK,1474940653762,780583794294206464,3
794,001948jack,#Debates Trump is a total jerk!,1474940653868,780583794738769920,0
795,amoyal,"Tax dollars spent on pointless war is shameful when Americans are going without esssentials, Sec WarHawk! #tytlive #debatenight #debates",1474940653788,780583794403381248,1
796,mateo_gmayorga,when someone asks hillary where the emails she deleted went #debates https://t.co/moDdtxt35P,1474940653899,780583794868752384,4
797,M_Bellers,This guy literally has no idea what he's talking about. #debates #debatenight,1474940653794,780583794428354561,1
798,TheUntrustable1,So what about Unions in this country? #Debates,1474940654639,780583797972533249,1
799,SueMoor65105003,"Are you kidding me?? If I don't get there one way, I'll get there another? #debates",1474940654597,780583797796573189,1
800,JessEmSeal,@TheRock extremely grateful that I'm Canadian. #ifeelsorryforyouguys #debates,1474940654601,780583797813305344,1
801,taisukey,こういう事言えるトランプ(ﾟωﾟ) https://t.co/fBlqExV5nz,1474940654574,780583797699940354,4
802,idletexan,Hillary is repeating the same tripe democrats have been saying for 100 years. Nothing new.  #debates,1474940654706,780583798253637632,1
803,FirebrandCoach,She's got him nervous. He has dry mouth. #debates,1474940654688,780583798178054145,1
804,adejireb,LOL this guy has no class. Using a bipartisian sponsored debate as free airtime to promote your business. DC doesn't want/need you. #debates,1474940654726,780583798337445889,1
805,FatChickinLA,"#debates
Trump: I screwed people legally if you don't like it change the laws, I won't because I am a dick.",1474940654721,780583798316474370,0
806,RJMouse,Oh this part will be fun #debates,1474940654698,780583798220070912,2
807,samihamdan,This man is as republican as they come. #debates https://t.co/1aXJ3mhBmJ,1474940654663,780583798073425921,4
808,canyoucemenow,Here. we. go. This dude @realDonaldTrump is a marketing machine. He really just pimped out his own hotel during a debate :/ #debates,1474940654571,780583797687513089,2
809,BrianMBarwick,TRUMP: I take advantage of the laws of the nation. *Winks at the camera* *Sniffs* *Generic Hotel Plug* #debates,1474940654693,780583798199156736,0
810,Kattyy_babbyy,❗️❗️❗️❗️❗️❗️❗️ https://t.co/HQ5OnAlRn9,1474940654777,780583798551355392,4
811,kinoptika,"Hot headed Trump isn't looking ""presidential"" at all...
Would get fucked at a summit
#debatenight #debates #Debates2016 
#NotPresidential",1474940654740,780583798396235777,1
812,MiltownBucky,"Throw your hat in the ring, you'll get votes 😄 https://t.co/nAUbWjgaCa",1474940654747,780583798425718785,4
813,sweatandlies,Trump blaming Clinton as a politician being responsible for laws he used to stiff people. He doesn't realise he's now a politician #Debates,1474940654753,780583798450774016,0
814,_Tyson97,Obama 2016 #debates,1474940654796,780583798631124992,1
815,sarahwheat92,The real loser of this debate is @LesterHoltNBC lol #debatenight #debates,1474940654762,780583798488518656,1
816,Dan_Mulvihill06,🐐🐐 https://t.co/sv6IJ327vp,1474940654532,780583797523877888,4
817,victorv9,"Trump: ""Chegou a hora de alguém entender que o dinheiro manda nesse país"" #Debates",1474940654766,780583798505410560,1
818,tomi_michelle,I just told @nbcwashington who I think is winning. Cast your vote now! #Debates #NBC4DC https://t.co/4DSqcIPM1p,1474940654800,780583798647951360,3
819,Viccimn,Trump is short of breath and looks dehydrated. I'm worried. And I'm a nurse. #debates,1474940655689,780583802376589313,1
820,Conn_Wayne,Yes... Donald is right. There are (only) tens of thousands of people who love him. #Debates,1474940655663,780583802267508736,1
821,Daniel_Sherman,"""All words all sound bites"".. that's the most accurate thing on both these losers .. so tired of this empty rhetoric #Debates",1474940655655,780583802233958400,1
822,itsanna_14,"""Cincuenta días llenos de incertidumbre. Es posible que EU esté a punto de elegir como presidente a un xénofobo ignorante"" #Debates #FT",1474940655610,780583802045276160,1
823,thornyd327,"Pennsylvania Avenue...if I don't get there one way, I'll get there another! Is this man for real?!  #debates",1474940655664,780583802271854592,4
824,ecmuir52,#Me watch the #debates right now. #LetGaryDebate https://t.co/UNpXxFW31d,1474940655519,780583801663684608,4
825,toohighmar,"Ooooooh they're about to talk Race Relations, this shit is about to be ridiculous lmao #debates",1474940655768,780583802708062209,2
826,Alexiteque,Bragidouchious maximus https://t.co/psv4HE42PN,1474940655674,780583802313674752,4
827,PettyTheFrog,"Trump's team is deleting tweets hmmm
#debates #debatenight",1474940655628,780583802120835072,1
828,Weigard,Hillary rn #debates https://t.co/ZLmMikHeyO,1474940655370,780583801038798848,4
829,TheRealKillaB,Trump ain't tryna answer shit about taxes cause he prolly ain't pay in years....so he deflects/changes subject to #Emailgate smh #Debates,1474940655773,780583802728951809,1
830,Vannasana,Imagine what we could accomplish if we all worked together instead of combating and arguing #LetGaryDebate #wheresgary @debates #debates,1474940655556,780583801818845189,1
831,QTCone,Yes. Let's talk about race. #debates,1474940655856,780583803077079040,2
832,KaleenaRivera,"""...going to talk about race."" Oh shit. #debates",1474940655833,780583802980536320,2
833,GottiZone,"We interrupt this headache to bring you a much needed, non-political laugh https://t.co/HhahlccIDQ #Debates2016 #Debates",1474940655702,780583802431238145,1
834,MetEvaine,Is that not the implication?  I think so.  *nodnod* https://t.co/NecsstFQUF,1474940655645,780583802192224256,4
835,JLiGr,"So, he screws people over, but it's okay because it's legal? Forget character...
#debates #debates2016",1474940655829,780583802963832832,0
836,kimnery,BOOM #debates https://t.co/tD6DlqDoR5,1474940656550,780583805988069376,4
837,MW_Royers,"Trump and Clinton both agree that infrastructure needs to be worked on #debates :

https://t.co/yVyiniuegF",1474940656676,780583806516330497,0
838,jdot_jdot,bragging about the fact that his contracters are good? when he doesn't even pay his contracters right? good one  #debates,1474940656664,780583806466154496,1
839,Juan_Winans,@realDonaldTrump is promoting his newest hotel instead of actual answering questions. #debates,1474940656499,780583805774159872,2
840,WoodcockSierra,Race...and Trump. Can't wait to hear this. #debates #debatenight,1474940656685,780583806554116097,0
841,kwanzer,"Because ""he is smart"" https://t.co/rAGivzx6HB",1474940656643,780583806378057728,4
842,rdcfit,oh here we go  #Debates,1474940656692,780583806583570432,2
843,lea_patriote,"C'est pas la naine haute d 1mètre 30 qui va apprendre l'économie à Trump, on est d'accord 😄 #debates",1474940656709,780583806654935044,1
844,luizguilhermepm,"Trump passou a vida fazendo conchavos com governos, inclusive democratas, para esmagar os direitos de cidadãos comuns. #debates",1474940656495,780583805757390848,1
845,BoisvertIan,"When I flew out of Laguardia several years ago, I ordered a hamburger on an iPad. #ThirdWorldAirports #Debates",1474940656659,780583806445256705,1
846,MShades01,"Trump listing his obligations - none of them include society, country, or his fellow citizen. I doubt that'll change upon election #Debates",1474940656582,780583806122156033,1
847,Chrismoffer,"""NAFTA did not cause the huge job losses feared by the critics or the large economic gains predicted by supporters."" #debates",1474940656593,780583806168395776,1
848,evrydayscholar,"""I take advantage of the laws"" sooo you find ways to cheat real Americans @realDonaldTrump ?#Debates",1474940656821,780583807124705280,0
849,kenekted1,👇👇👇 https://t.co/jlzc9KexZ9,1474940656671,780583806495518721,4
850,TweeterMoses,Uh-oh. Shit just got real #debates,1474940657704,780583810828083201,2
851,JB4LIBERTY,The question of race. This should be good. #debates,1474940657339,780583809297383424,2
852,louhiatar,"I exploited ppl, but I only cuz the GOVERNMENT MADE ME! Im scum cuz they didn't make regulations which I also will not make #debates",1474940657403,780583809565634560,1
853,Runtt1,"If you have been taking a drink every time Trump says ""Believe Me"" congratulations! You're DEAD. #Debates",1474940657570,780583810266230784,1
854,kgurlballin,#BLM #debates,1474940657642,780583810568167424,1
855,_briannaney,Lester needs to up his game and his feistiness. I am not impressed #Debates,1474940657710,780583810853330944,1
856,Sadesweetcoco,Trump sounds like he's about to fallout. #Debates,1474940657692,780583810777874436,0
857,amandaspleas,".@realDonaldTrump Instead of throwing tantrums on Twitter, you could've used the past few weeks to learn how to debate. #debates",1474940657763,780583811075612672,1
858,FinzGreta,He is out of breath. He is ill? #Debates,1474940657659,780583810639495174,1
859,GaylePad,Oh dear. What a fiasco #debates,1474940657680,780583810727632897,2
860,skyler_cutter,She acts as if she knows the middle class even tho she makes millions I thought the middle class didnt make that much ? #Debates,1474940657788,780583811180474368,1
861,MomsThoughts,More criticizing by Trump....  still haven't heard any plans...just criticism.  #debates #Debates2016,1474940657767,780583811092451328,1
862,janifer,@GeorgeTakei It's not surprising.  I think this is a byproduct of his #Affluenza. #Debates #Drumf,1474940657562,780583810232614913,1
863,JrbbNyc,Is the #debates an advertising slot for #Trumps company?,1474940657607,780583810421383169,1
864,AZhummerH2,Why the fuck does she keep laughing what's so funny? #debatenight  #debates  #Debates2016,1474940657863,780583811495006208,4
865,Dooneese_Drumpf,#TrumpisSick #Debates,1474940657775,780583811126063105,1
866,AccioDolans,#debates https://t.co/AVpgjnaG0i,1474940658505,780583814187933697,4
867,esocktheman,"""I'm not trying to be braggadocios"" #debates",1474940658647,780583814783393794,1
868,jessviduya,I forgot Lester was there for 45 minutes. #debates,1474940658702,780583815014064129,1
869,redhawk_123,Hilary's low keys on fire 🔥🔥🔥#Debates,1474940658564,780583814435315712,1
870,Chilitime,Trump looks less orange than usual #debates,1474940658718,780583815081144320,0
871,CNNisDISGUSTING,#debates https://t.co/zwBmlmsVNU,1474940658401,780583813751705600,4
872,DianesOcean,Someone gives him a kleenex for his runny nose.  #Debates,1474940658689,780583814959624193,1
873,DarrenWheels,"Can someone get Trump a tissue please

#SnifferInChief #debates",1474940658628,780583814703648768,0
874,estaoutra,"hahahaha, o cara ta aproveitando o debate para fazer propaganda do novo hotel. #Debates",1474940658711,780583815051968512,1
875,BeWhoYouAre,Trump - taking advantage is normal - inhuman business is bad business  #Debates,1474940658690,780583814963822592,0
876,Stockardguru,Uh-oh. Race is next. #debates,1474940658705,780583815026728961,2
877,InnerDaemons,No one sniffs this much who didn't just spend ten minutes with a bag of charlie in the bathroom. #debates,1474940658301,780583813332267008,1
878,melyssawithay,yes bitch let's talk about RACE. let me see this #debates,1474940658717,780583815077040129,1
879,Evan__Yu,Donald Trump speaking on race. I might not be able to take anymore. #Debates,1474940658762,780583815265808384,0
880,ejprod_ktda,These clowns have yet to even touch on how they will help me as an average citizen sitting below the poverty line #debatenight #debates,1474940658757,780583815244812289,1
881,RobbynAckner,"#KingOfDebt, how many people did u screw out of money building a hotel in DC? He's proud of #Bankruptcy #trumpeduptrickledown #debates",1474940658646,780583814779248640,1
882,TheNickFaulkner,Only reason I'm watching the #debates #snapchatfilters 👻:TheNickFaulkner https://t.co/NhRm20O5bi,1474940658335,780583813474881536,4
883,mrfradkin,Does Trump know that being First Lady does not give you a vote in the legislative branch? #debates,1474940658809,780583815462825985,0
884,RochelleKonja,Omg @candkatie  https://t.co/5whOIxDusA,1474940658417,780583813818703872,4
885,d_u_t,#trump's superhero ability is being able to convince himself his lies are true before he's done telling them  #Debates,1474940658797,780583815412461569,1
886,BrinkLissa,"#debates just make me dislike both candidates even more. I get it you hate each other, you're creating jobs and lowering the debt.",1474940658905,780583815865589760,1
887,ohmygallifrey12,"Well, we're screwed #debates",1474940659658,780583819023835136,1
888,paulcon40,"Newt,  Adequately Competent? Maybe get into the wild card. https://t.co/lqzH7GqXbU",1474940659414,780583818000498688,4
889,OfficiallAmanda,The race issue #Debates,1474940659519,780583818440896513,2
890,All4Trump4All,#debateNight #MAGA https://t.co/GYCt0TkH3d,1474940659595,780583818759589888,4
891,just_leighan,"here we go, this should be good #debates",1474940659675,780583819095269377,1
892,ztawhite,So inspiring. So inspiring I'm crying on the inside. https://t.co/vCpVgP7ut2,1474940659651,780583818994384897,4
893,AnUrbanNomad,It's easy to be under budget when you're not paying people #Debates,1474940659643,780583818960908290,1
894,actprogressive,"ProgressiveArmy: RT DKG3387: Trump hitting Obama for his golfing....really Donald?
#debatenight #debates https://t.co/uOANoJbs2K",1474940659418,780583818017304576,0
895,GeenaJagger,"#BleachBit
#Hammers
#TakeThe5th
#Immunity
#HillaryLies https://t.co/hUxTovaLS5",1474940659261,780583817358761985,4
896,ShaeeeeGotti,Trump rocking with the crips tonight  #Debates,1474940659762,780583819460030464,0
897,rerutled,Trump RN: Admitting he stiffs his vendors. That doesn't help him.  #debates #Debatenight,1474940659802,780583819627810817,0
898,StephenMushal,GUYS I FOUND GARY AND HES JUST AS CONFUSED AS WE ALL ARE #wheresgary #LetGaryDebate #Debates2016 https://t.co/Yv77rayLsl,1474940659689,780583819153969152,1
899,mrchrislowell,What's with @realDonaldTrump's weird nasal inhale? #debates,1474940659580,780583818696790017,1
900,tyhategod,Does Trump have a cold? Could it be AIDS? Did he get it from Magic Johnson? #debates,1474940659773,780583819506290688,1
901,bethbabbles,"In addition to tweeting, I'm also text-suading my conservative dad to vote for Hills. #ImWithHer #debates",1474940659757,780583819439054848,1
902,TraceRucarean,#LetGaryDebate #debates,1474940659848,780583819820675072,1
903,megynslashes,"Unbelievable? Nope, I don't believe his company is as big or successful as he claims it is.  #debates",1474940659796,780583819602718722,1
904,JaimeRinconRD,"""Tienen 30 años hablando y nada de soluciones"" #Trump #Debates2016 #Debates",1474940660670,780583823268388865,1
905,JERIELYS,"""let's talk about race"" YIKES! #debates",1474940660684,780583823327322113,2
906,luvGodncountry,"Hillary's website does not have the information she spoke of at #debatenight 
#factcheck #debates https://t.co/ZumxMmQtLK see for yourself",1474940660549,780583822761000960,4
907,zmorgan77,trade trade trade tax returns emails trade trade trade fair share trade trade #debates,1474940660619,780583823054692353,1
908,kansas4johnson,"#JohnsonWeld2016 #ks4garyjohnson #Debates2016 #LetGaryDebate #WeThePeople #WhereIsGary #YouIn?
#Budget2017… https://t.co/86PhX2z5KY",1474940660682,780583823318712320,4
909,thecaleblin,"Agreed on his comment on overpriced products for the #military seen that first hand.
 #Debates",1474940660736,780583823545212928,1
910,SaignerMC,"Yay! hamrambe is winning! https://t.co/ggkJlL6AyL 
 #Debates",1474940660727,780583823507591169,4
911,gerhadt_kreuz,Fucker is boasting on his so-called 'achievements.' In pouty face mode. #patheticPoofTrump. #Debates,1474940660663,780583823239159808,1
912,Regan_Raleigh,All words. Loud words. That is all.  #debates,1474940660720,780583823478317061,1
913,farmagoo,#debates Race is very un-presidential.,1474940660441,780583822307958784,2
914,danimargaux,#Debates Hillary's strength right now is the stuff of myths #Class &amp; #Knowledge,1474940660768,780583823679496192,1
915,rubyetc,Asked the dog if she fancied watching the loud man interrupt the woman on the tv with me #debates https://t.co/4IO9x7Xx1c,1474940659896,780583820022210560,4
916,CourtCanfield,YESSS! #debatenight #debates #Debates2016 https://t.co/vgKn6L7p0T,1474940660688,780583823344078849,4
917,eleahhhh,10s of thousands of people you're gonna send back to Mexico. No  bye Trump! #Hillary2016  #Debates,1474940660761,780583823650197504,1
918,jayisnotsexy,go Lester #Debates,1474940660826,780583823922847744,2
919,PramasApproved,I'm sorry did trump just list off his priorities and not name the United States as one of them? #debates,1474940660919,780583824312926208,1
920,_tatvamasi,"#Debates Trump, did you parents ever tell you that others should tell how unbelievable your accomplishments are? Stop bragging, ego maniac.",1474940660893,780583824203718656,1
921,Darren32895836,#debatenight #debates #debates2016 https://t.co/gcjM9E7Sxl,1474940661358,780583826154074113,4
922,ay_yo_jenn,#debates oh boy here we go! Race relations,1474940661731,780583827718545408,2
923,KimberleeHiRo,Speaking of your fathers middle class job still doesn't make you relatable. Accidentally deleted 33k emails???  Seriously?!?!#debates,1474940661670,780583827462914048,1
924,Panglossage,#Debates  If only Trump International could have built our F-35s on-time and under-budget with China-based subcontractors.,1474940661745,780583827777478656,1
925,LostheGhost67,One way or a fucking nother #Debates,1474940661735,780583827735470081,4
926,Hartnell54,#LetGaryDebate #GaryJohnson https://t.co/r4uWCXDBhv,1474940661725,780583827693457414,4
927,anneysays,"Trump: look I refuse to live in that white shack, I'm building a gold tower with a moat across the street when I lose #debates",1474940661811,780583828054118400,0
928,ashl3yk3tchum,Yes! Let's see trump try and be sensitive to racial issues #debates,1474940661657,780583827408289796,1
929,YourMajestyLo,BURNED BY THE DICTIONARY https://t.co/uO8wXP2rBP,1474940661687,780583827534209024,4
930,radioevans101,It is not sniffling we hear from Tump it is actually his shit leaking from his pants hitting the floor. https://t.co/TzUHXFUfna,1474940661781,780583827928326144,4
931,SheilaK411,Over 3500 lawsuits against this mendacious cheeto. #Hillary2016  #Debates,1474940661668,780583827454451713,1
932,SammyObeid,Trump: 'We built an unbelievable company.  As in we did it illegally and don't have the tax returns to prove it' #Debates,1474940661847,780583828205150208,1
933,peachyhaz_,why does he keep on sniffing i'm annoyed #Debates,1474940661840,780583828175790081,1
934,FamCat,"I just told @nbcwashington who I think is winning. Cast your vote now! #Debates #NBC4DC
https://t.co/KePZ5OB4x5",1474940662554,780583831170494464,3
935,kowzTV,But is taking advantage of loopholes ethical? #Debates,1474940662612,780583831413764096,0
936,Four4Degrees,BLM is a domestic terrorist group.  #Debates,1474940662711,780583831828959232,1
937,treydoesntcare,Here comes Race. #Debates,1474940662620,780583831447494656,2
938,jake_o_rama,The 🐷's sniffing when he talks is bothering me. Anyone else? I can't stand it. #Debates,1474940662686,780583831724105729,1
939,shannoncont,race wars...shits about to get real  #debatenight #Debates2016 #debates,1474940662666,780583831640248322,1
940,GeminiHeiress,#Trump is up here talking about building and better airports real estate and property  but we have severe global warming.smh #gtfoh #debates,1474940662687,780583831728492544,1
941,ViejaCabronamx,video: RT JackBaran: 2am over here in London but staying awake to watch tonights #Debates... https://t.co/luFOUkooXO,1474940662591,780583831325777920,1
942,MelissaFeld,Is this why he is panting? https://t.co/N5GvrxnJNG,1474940662565,780583831216726020,4
943,tony_kardashian,Saying our airports are like walking into a third world country is one of the most ignorant things and such a rich man thing to say #Debates,1474940662678,780583831690674176,1
944,jakelol90,Can Lester be running? #Debates,1474940662686,780583831724228609,2
945,TeKeHall,OH SHIT ITS GONNNA BE ABOUT RACE OH SHIIT! #debates,1474940662724,780583831883640832,2
946,ulucapital,"Mistake by Trump not to hammer her on this...
https://t.co/6bym3uRZgt",1474940662615,780583831426502657,0
947,essayknight,#Trump is veering dangerously from idiotic to incoherent. Is this seriously a major party candidate for the presidency? WTF #debates,1474940662741,780583831954923520,0
948,Pappiness,I didn't realize we were taking a commercial break for Trump's company... #debates #debatenight,1474940662782,780583832126971904,0
949,OhThatsHayyy,#Debates This whole thing is a joke to him  😐,1474940662660,780583831615045632,1
950,TX_Realtor,👏👏👏👏👏 https://t.co/pBTjCzpLLn,1474940662657,780583831602552832,4
951,PatriaKhaleesi,RACE finally #debates,1474940662765,780583832055648257,2
952,TheJorgyPorgy,"These #Debates!!! Trump is AWESOME at deflecting, and speaking highly of himself.",1474940662720,780583831866789890,1
