,screen_name,text,timestamp,tweet_id,cluster_pred
0,ersanven,"Damn, I keep forgetting Lester Holt is there #debates",1474940649726,780583777366110208,2
1,ChrisWolfley,"@realDonaldTrump ""takes advantage"", well I don't like being taken advantage of so piss off #debates",1474940649767,780583777537888257,2
2,ewolffmann,"""We're well behind schedule"" —Lester  #debates",1474940649361,780583775835197440,2
3,yourmahnster,"Maybe Trump's nose runs when he's scared or has he always sniffled this much?
#debatenight #debates",1474940649690,780583777215143936,0
4,marinarapradoe,Fun drinking game for the debate: Take a shot everything Trump interrupts. #debates,1474940649787,780583777621778434,0
5,mephistolesnc,RACE!!! Here we go! #debates,1474940649751,780583777470939138,1
6,Chimpacholes,I just told @nbcwashington who I think is winning. Cast your vote now! #Debates #NBC4DC https://t.co/Ka7WK33K02,1474940649723,780583777353474049,1
7,redwingwoody,"I know these words are english, but what the fuck is he saying?? #debates",1474940649740,780583777424642048,2
8,DavidDeplume,He missed a huge opportunity https://t.co/54xSlz2wrU,1474940649670,780583777131192321,2
9,TheJamesBJones,Did... did Trump just threaten to build an airport on Pennsylvania Ave.? #Debates,1474940649845,780583777865039873,2
10,Truthconqueror,Seizures seizures please #Debates,1474940649835,780583777823256576,2
11,maxger31,#MaoPantSuit #MaoPantSuit #HillaryForPrison #LyingCrookedHillary https://t.co/RqoSTPUo4H,1474940649797,780583777663713280,2
12,Jackiesmit,A good night to unfollow people! Talk about cleaning house. I have no tolerance for people that can't see the truth. #TrumpTrain #debates,1474940649830,780583777802215424,2
13,sesnobrakes,"#debates the ""loss"" from ""solar"" aka Solyndra was abt $300mil, and the Bldg is full now w/ hi paying https://t.co/DdOghD1scy loss=$105 BIL",1474940650665,780583781304455168,2
14,alexgdodds,Awww-kward https://t.co/vRYSIJ2iDW,1474940650580,780583780947943425,2
15,DwightMiller,Here's another group of #racistthatsupporttrump https://t.co/DZ7uk0cQqd #debates #Debate2016 https://t.co/WnWsvC9rjP,1474940650245,780583779542921219,2
16,KalliyahDejesus,Theres a lot of what we should be doing but nothing about how to do it #Debates,1474940650458,780583780436238342,2
17,Aly_Meyer,We. Are. Doomed. #Debates,1474940650660,780583781283405824,2
18,Jamee_Garvin,"""I take advantage of the laws..."" @realDonaldTrump ,you take advantage of people?Of hard work? what will you do with my country? #debates",1474940650633,780583781170163713,2
19,AndrewCrow,"Donald's tax payments would make La Guardia great again, I bet. #debates",1474940650662,780583781291798528,2
20,son_dayum,"Coughing pants shitter.
#DebateNight
#Debates",1474940650681,780583781371482113,0
21,CrystalBlunt2,He could just use a thesaurus. Some one please give him a thesaurus. #debatenight #debates,1474940650659,780583781279203329,0
22,Alydaemi,Oh okay so since he's fucked over SO many in the private sector he won't do that in government.. cutting taxes for corporations #debates,1474940650680,780583781367361537,2
23,CashMoneyCane,@TheRock Giant Douche vs Turd Sandwich 2016 #debates,1474940650689,780583781405036544,2
24,bagilynd,Boom! https://t.co/a2hSSC09vH,1474940650485,780583780549623808,2
25,Rich9042,#debates booking the flight now https://t.co/rAZen0qAee,1474940650488,780583780561977344,2
26,ObamaStopTPP,"DrJillStein: We have an amazing sketchnoter, MorSpicer, on set drawing me + my Press Director! #debates #OccupyThe… https://t.co/yxOPOWv2OR",1474940650627,780583781145120769,2
27,JNDobel,"Oh, is Lester still here? #debates",1474940650713,780583781505785856,1
28,ShitpostCentra1,@realDonaldTrump literally admits he'll take advantage of the law to his gain #debates,1474940650719,780583781531082754,2
29,Ti_Enjoli,"All my bitches luv me
-Trump
#debates",1474940650632,780583781166096384,1
30,_KDotJR_,@smilecardyloves every sniffle is a 5 second chug #debates,1474940650765,780583781723873280,2
31,Cdozo,"10,000 people like Trump, bit 1,000,000,000 hate him. #debates #Debates2016",1474940650757,780583781690474496,2
32,AlexiaTillman,"Lester: ""we're well behind schedule"" #debatenight #debates #Debates2016",1474940650702,780583781459689474,0
33,colterm2003,These #Debates make me wanna cry it's so bad,1474940650772,780583781753360384,2
34,ssnowcapparelli,"As in, when hell freezes over.... https://t.co/cc6Th3gerH",1474940650814,780583781929394177,2
35,shieldzilla,I'm already bored. #debatenight #debates,1474940650701,780583781455585280,0
36,LaelNikole,"-I didn't pay taxes because ""smart business""-I didn't disclose the emails because ""smart politics"" ... #howaretheydifferent  #debates",1474940651676,780583785544847360,2
37,CaliseHawkins,NOOOOO LESTER JUST SAID WE WAY BEHIND SCHEDULE HE MODERATING THE DEBATE ON CP TIME!  #debates,1474940651716,780583785712619521,2
38,StopNuclearWar,Trump goes off on tangent about his new DC hotel. #debates #ImWithHer,1474940651717,780583785716781057,2
39,Cotsonis,Why are we talking about this? The president doesn't build buildings. #debates,1474940651618,780583785301770245,1
40,JoeBrettell,A slick moment - should have pushed for a response from her as she gained steam talking about his taxes #debates https://t.co/8EF3zX3kLy,1474940651661,780583785481940992,2
41,adominguez37,"PolitiFact is always on top of things, and tonight they definitely have their work cut out for them. #Debates  https://t.co/qYF2rBYkRU",1474940651645,780583785414799360,2
42,MilaniaTrump,@realDonaldTrump should have paid that contractor &amp; not paid whoever was in charge of his eyebrows. Those things are out of control #debates,1474940651661,780583785481908224,2
43,RobAurelius,"@jabostock Love Fanny, would rather vote for her as well! #IdRatherVoteFanny #debates",1474940651602,780583785234436096,1
44,Jasooner1,RACE #Debates,1474940651689,780583785599414273,1
45,deshun_93,"@realDonaldTrump is talking like that paper you wrote that says the same thing over and over again,hoping to still get a good grade #Debates",1474940651489,780583784760635396,2
46,TimeIsMonie,"GovGaryJohnson: This is really inspiring, isn't it #America? #debates",1474940651628,780583785343643649,2
47,EddieFadel,"@HillaryClinton on her email controversy: “I made a mistake using a private email."" 

@realDonaldTrump : “That’s for sure."" 

#debates",1474940651585,780583785163288576,2
48,ShitTitts,"Trump may seem like he's ""ranting"" but he is a great business man and speaking the truth about our country dying #Debates",1474940651779,780583785976836096,2
49,carolinabasille,@BarackObama vc podia ficar pra sempre também ❤️ #debatenight #Debates,1474940651692,780583785612148736,2
50,sammontgomery,THIS IS A DEBATE NOT A COMMERCIAL FOR YOUR FUCKING HOTEL #debates,1474940651761,780583785901330433,2
51,A1GOY,Couldn't sleep so tuned in to the #Debates. Wow. Just... Wow.,1474940651729,780583785767268353,2
52,wayafo,Chinga tu puta madre pendejo @realDonaldTrump #Debates #fuckyou #bitch,1474940651786,780583786006261760,2
53,sabbag,Acho que é o Trump que vai falar dos picumãs #debates,1474940651481,780583784727052289,0
54,str8fromdahorse,stay in the jungle and save yourself https://t.co/goJSnoiQmY,1474940651719,780583785725169664,2
55,DickholeOwl,#Debates I feel like they just nominated these two clowns so more morons would follow politics. Rip a #sickfart #suckafart #trumpfart,1474940651617,780583785297420288,2
56,MissaThomas,Alright Lester! Way dad move this train along #debates,1474940651825,780583786169847808,2
57,kelceybacon,"""Basically, if you make me president I will underpay all our jobs and cheat the middle class."" -Drumpf #Debates",1474940651715,780583785708400640,2
58,chic_cocobelle,#Debates this election is a joke !,1474940651892,780583786450870272,2
59,Chrisiferous,Trump plugging his new hotel. #DebateNight #debates,1474940652688,780583789789605888,0
60,ElHombreBDD,You win tweet of the night. I'll mail your award in the morning. https://t.co/BeEN3ceygK,1474940652639,780583789584060416,2
61,nickybail,"Trump: ""I HAVE A COMPANY I HAVE A COMPANY MY COMPANY MY COMPANY MY COMPANY COMPANY COMPANY COMPANYYYYY!"" #debatenight #debates #Debates2016",1474940652681,780583789760159744,0
62,SlayAnimosity,"This debate is as entertaining as a drama movie.
#debatenight #debates #Debates2016 https://t.co/UqujQ6gN5Q",1474940652055,780583787134541830,0
63,KimAcheson,"Donald Trump’s Idea to Cut National Debt: Get Creditors to Accept Less

#debatenight  #debates https://t.co/P2p6AcKRTs",1474940652287,780583788107694080,0
64,RealTrevinShu,Like what Lester Holt is doing... Letting the candidates debate... Let the audience decide who is good... #debates #DebateNight,1474940652701,780583789844045824,2
65,calumbbg,is trump okay he's like panting #debates,1474940652746,780583790032805889,0
66,markuspreiss,"Wenn Ihr Anspruch Präsident zu werden auf Erfahrung als Geschäftsmann beruht,dann zeigen Sie Steuererklärung. #Clinton zu #Trump #debates",1474940652655,780583789651263488,0
67,joyofpathology,"yep!  the ""sin of omission"" https://t.co/HXZ44eSuHr",1474940652623,780583789517008896,2
68,juanluque,what a conman this donald  #Debates,1474940652592,780583789387014144,2
69,Dope_Esen,Donald keeps sniffing. Is he gonna die? #Debates,1474940652751,780583790053818368,2
70,srodingercat,"""Tal vez no me gusto el trabajo que hizo y por eso no le pague"" Frase celebre de Trump #debates",1474940652736,780583789990846464,0
71,grvjlk,@BDUTT @HillaryClinton None of my American friends will ever understand how terrifying it is as an Indian to watch their #Debates.,1474940652760,780583790091448320,2
72,dswinder,Donnie is unhinged. #debates,1474940652772,780583790141923328,0
73,phaxyn,"FoxNews: .HillaryClinton: ""There's something [realDonaldTrump's] hiding."" #debatenight #debates #Debates2016 https://t.co/QSxsi84awl",1474940652660,780583789672206336,0
74,sosodeformed,"Have to pee, someone tell me if they finally mention women or gay people. #debates",1474940652711,780583789886050305,0
75,csnegm,"Perhaps you should lay off the weed and smarten up, bozo. https://t.co/XL9HFsTc5Z",1474940652739,780583790003445764,2
76,RevDJEsq,"Trump: Stiffs can't contractors, sniffs at debates. #debates",1474940652814,780583790317940737,2
77,KirstenS,"In 2016, the most experienced person in US politics is being mansplained to on National TV. And people are eating it up. WUT. #debates",1474940653660,780583793866321920,2
78,KristineAz,Oh shit.  Here we go.  Race.  #debatenight #debates,1474940653667,780583793895714817,1
79,ladybigmac,"Sick, isn't it? https://t.co/PSBDkg0TST",1474940653564,780583793463795713,2
80,AGoodAche,#bigly https://t.co/Xk3YYJ2yo9,1474940653645,780583793803403264,2
81,bellazinca,"""it's all words..."" 

Yeah words strung into sentences that are fact, stay in your fucking lane.

#debates #Debates2016 #debatenight",1474940653590,780583793572864000,0
82,butterfenga,"He says he's obligated to himself and his family. No mention of the country. Very telling, wannabe Prez. #Debates",1474940653565,780583793467895808,0
83,JakeCinkus,Why is Hillary telling trump how to run a business. You literally have no clue what you're talking about. Talk about politics stfu #Debates,1474940653716,780583794101325824,2
84,Icetjfish,Trump makes my ear bleed every time he talks  #Debates,1474940653674,780583793925259266,0
85,hixyarfprod,Meanwhile Bernie is off to the right like tag me in! #debatenight #debates https://t.co/rPswAUPvSe,1474940653343,780583792536850432,2
86,minpanisara,Not sure why I'm watching #debates right now cause I can't stand Donald Trump. Why can't you just shut up? #sniff,1474940653736,780583794185162753,1
87,AudraGayle,So are his taxes paid or not? Can't tell from his answers.  #debates,1474940653771,780583794331922432,1
88,regaLwrencH,wait--someone worked for you and you didn't pay them? no no Mr. Not-President that's how you get slashed tires #Debates #debatenight,1474940653735,780583794181017600,0
89,CStreetlights,Don't want to hear any complaints about Hillary bringing up her book or site (both relevant) when Trump just brought up his HOTEL #debates,1474940653591,780583793576992768,0
90,Ana21Ana211,BINGO unbelievable! Any believers watching?! Where are the Justin groupies?! #debates,1474940653829,780583794575159297,2
91,cgocmav,"Oh Lester, so witty!!!#debates",1474940653835,780583794600312832,1
92,lyricaldanichan,We are fucked... Too bad that @BernieSanders didn't run on his own. gg murica #debates,1474940653816,780583794520698880,2
93,ispkout,I just told @nbcwashington who I think is winning. Cast your vote now! #Debates #NBC4DC https://t.co/dg0kO1I0KK,1474940653762,780583794294206464,1
94,001948jack,#Debates Trump is a total jerk!,1474940653868,780583794738769920,0
95,amoyal,"Tax dollars spent on pointless war is shameful when Americans are going without esssentials, Sec WarHawk! #tytlive #debatenight #debates",1474940653788,780583794403381248,0
96,mateo_gmayorga,when someone asks hillary where the emails she deleted went #debates https://t.co/moDdtxt35P,1474940653899,780583794868752384,0
97,M_Bellers,This guy literally has no idea what he's talking about. #debates #debatenight,1474940653794,780583794428354561,0
98,TheUntrustable1,So what about Unions in this country? #Debates,1474940654639,780583797972533249,1
99,SueMoor65105003,"Are you kidding me?? If I don't get there one way, I'll get there another? #debates",1474940654597,780583797796573189,2
100,JessEmSeal,@TheRock extremely grateful that I'm Canadian. #ifeelsorryforyouguys #debates,1474940654601,780583797813305344,2
101,taisukey,こういう事言えるトランプ(ﾟωﾟ) https://t.co/fBlqExV5nz,1474940654574,780583797699940354,2
102,idletexan,Hillary is repeating the same tripe democrats have been saying for 100 years. Nothing new.  #debates,1474940654706,780583798253637632,0
103,FirebrandCoach,She's got him nervous. He has dry mouth. #debates,1474940654688,780583798178054145,2
104,adejireb,LOL this guy has no class. Using a bipartisian sponsored debate as free airtime to promote your business. DC doesn't want/need you. #debates,1474940654726,780583798337445889,2
105,FatChickinLA,"#debates
Trump: I screwed people legally if you don't like it change the laws, I won't because I am a dick.",1474940654721,780583798316474370,2
106,RJMouse,Oh this part will be fun #debates,1474940654698,780583798220070912,1
107,samihamdan,This man is as republican as they come. #debates https://t.co/1aXJ3mhBmJ,1474940654663,780583798073425921,2
108,canyoucemenow,Here. we. go. This dude @realDonaldTrump is a marketing machine. He really just pimped out his own hotel during a debate :/ #debates,1474940654571,780583797687513089,2
109,BrianMBarwick,TRUMP: I take advantage of the laws of the nation. *Winks at the camera* *Sniffs* *Generic Hotel Plug* #debates,1474940654693,780583798199156736,2
110,Kattyy_babbyy,❗️❗️❗️❗️❗️❗️❗️ https://t.co/HQ5OnAlRn9,1474940654777,780583798551355392,2
111,kinoptika,"Hot headed Trump isn't looking ""presidential"" at all...
Would get fucked at a summit
#debatenight #debates #Debates2016 
#NotPresidential",1474940654740,780583798396235777,1
112,MiltownBucky,"Throw your hat in the ring, you'll get votes 😄 https://t.co/nAUbWjgaCa",1474940654747,780583798425718785,2
113,sweatandlies,Trump blaming Clinton as a politician being responsible for laws he used to stiff people. He doesn't realise he's now a politician #Debates,1474940654753,780583798450774016,0
114,_Tyson97,Obama 2016 #debates,1474940654796,780583798631124992,2
115,sarahwheat92,The real loser of this debate is @LesterHoltNBC lol #debatenight #debates,1474940654762,780583798488518656,0
116,Dan_Mulvihill06,🐐🐐 https://t.co/sv6IJ327vp,1474940654532,780583797523877888,2
117,victorv9,"Trump: ""Chegou a hora de alguém entender que o dinheiro manda nesse país"" #Debates",1474940654766,780583798505410560,2
118,tomi_michelle,I just told @nbcwashington who I think is winning. Cast your vote now! #Debates #NBC4DC https://t.co/4DSqcIPM1p,1474940654800,780583798647951360,1
119,Viccimn,Trump is short of breath and looks dehydrated. I'm worried. And I'm a nurse. #debates,1474940655689,780583802376589313,0
120,Conn_Wayne,Yes... Donald is right. There are (only) tens of thousands of people who love him. #Debates,1474940655663,780583802267508736,1
121,Daniel_Sherman,"""All words all sound bites"".. that's the most accurate thing on both these losers .. so tired of this empty rhetoric #Debates",1474940655655,780583802233958400,1
122,itsanna_14,"""Cincuenta días llenos de incertidumbre. Es posible que EU esté a punto de elegir como presidente a un xénofobo ignorante"" #Debates #FT",1474940655610,780583802045276160,2
123,thornyd327,"Pennsylvania Avenue...if I don't get there one way, I'll get there another! Is this man for real?!  #debates",1474940655664,780583802271854592,2
124,ecmuir52,#Me watch the #debates right now. #LetGaryDebate https://t.co/UNpXxFW31d,1474940655519,780583801663684608,2
125,toohighmar,"Ooooooh they're about to talk Race Relations, this shit is about to be ridiculous lmao #debates",1474940655768,780583802708062209,1
126,Alexiteque,Bragidouchious maximus https://t.co/psv4HE42PN,1474940655674,780583802313674752,2
127,PettyTheFrog,"Trump's team is deleting tweets hmmm
#debates #debatenight",1474940655628,780583802120835072,0
128,Weigard,Hillary rn #debates https://t.co/ZLmMikHeyO,1474940655370,780583801038798848,0
129,TheRealKillaB,Trump ain't tryna answer shit about taxes cause he prolly ain't pay in years....so he deflects/changes subject to #Emailgate smh #Debates,1474940655773,780583802728951809,2
130,Vannasana,Imagine what we could accomplish if we all worked together instead of combating and arguing #LetGaryDebate #wheresgary @debates #debates,1474940655556,780583801818845189,2
131,QTCone,Yes. Let's talk about race. #debates,1474940655856,780583803077079040,1
132,KaleenaRivera,"""...going to talk about race."" Oh shit. #debates",1474940655833,780583802980536320,1
133,GottiZone,"We interrupt this headache to bring you a much needed, non-political laugh https://t.co/HhahlccIDQ #Debates2016 #Debates",1474940655702,780583802431238145,2
134,MetEvaine,Is that not the implication?  I think so.  *nodnod* https://t.co/NecsstFQUF,1474940655645,780583802192224256,2
135,JLiGr,"So, he screws people over, but it's okay because it's legal? Forget character...
#debates #debates2016",1474940655829,780583802963832832,2
136,kimnery,BOOM #debates https://t.co/tD6DlqDoR5,1474940656550,780583805988069376,2
137,MW_Royers,"Trump and Clinton both agree that infrastructure needs to be worked on #debates :

https://t.co/yVyiniuegF",1474940656676,780583806516330497,2
138,jdot_jdot,bragging about the fact that his contracters are good? when he doesn't even pay his contracters right? good one  #debates,1474940656664,780583806466154496,1
139,Juan_Winans,@realDonaldTrump is promoting his newest hotel instead of actual answering questions. #debates,1474940656499,780583805774159872,2
140,WoodcockSierra,Race...and Trump. Can't wait to hear this. #debates #debatenight,1474940656685,780583806554116097,0
141,kwanzer,"Because ""he is smart"" https://t.co/rAGivzx6HB",1474940656643,780583806378057728,2
142,rdcfit,oh here we go  #Debates,1474940656692,780583806583570432,1
143,lea_patriote,"C'est pas la naine haute d 1mètre 30 qui va apprendre l'économie à Trump, on est d'accord 😄 #debates",1474940656709,780583806654935044,2
144,luizguilhermepm,"Trump passou a vida fazendo conchavos com governos, inclusive democratas, para esmagar os direitos de cidadãos comuns. #debates",1474940656495,780583805757390848,2
145,BoisvertIan,"When I flew out of Laguardia several years ago, I ordered a hamburger on an iPad. #ThirdWorldAirports #Debates",1474940656659,780583806445256705,2
146,MShades01,"Trump listing his obligations - none of them include society, country, or his fellow citizen. I doubt that'll change upon election #Debates",1474940656582,780583806122156033,2
147,Chrismoffer,"""NAFTA did not cause the huge job losses feared by the critics or the large economic gains predicted by supporters."" #debates",1474940656593,780583806168395776,2
148,evrydayscholar,"""I take advantage of the laws"" sooo you find ways to cheat real Americans @realDonaldTrump ?#Debates",1474940656821,780583807124705280,2
149,kenekted1,👇👇👇 https://t.co/jlzc9KexZ9,1474940656671,780583806495518721,2
150,TweeterMoses,Uh-oh. Shit just got real #debates,1474940657704,780583810828083201,1
151,JB4LIBERTY,The question of race. This should be good. #debates,1474940657339,780583809297383424,1
152,louhiatar,"I exploited ppl, but I only cuz the GOVERNMENT MADE ME! Im scum cuz they didn't make regulations which I also will not make #debates",1474940657403,780583809565634560,0
153,Runtt1,"If you have been taking a drink every time Trump says ""Believe Me"" congratulations! You're DEAD. #Debates",1474940657570,780583810266230784,2
154,kgurlballin,#BLM #debates,1474940657642,780583810568167424,2
155,_briannaney,Lester needs to up his game and his feistiness. I am not impressed #Debates,1474940657710,780583810853330944,2
156,Sadesweetcoco,Trump sounds like he's about to fallout. #Debates,1474940657692,780583810777874436,0
157,amandaspleas,".@realDonaldTrump Instead of throwing tantrums on Twitter, you could've used the past few weeks to learn how to debate. #debates",1474940657763,780583811075612672,2
158,FinzGreta,He is out of breath. He is ill? #Debates,1474940657659,780583810639495174,0
159,GaylePad,Oh dear. What a fiasco #debates,1474940657680,780583810727632897,1
160,skyler_cutter,She acts as if she knows the middle class even tho she makes millions I thought the middle class didnt make that much ? #Debates,1474940657788,780583811180474368,2
161,MomsThoughts,More criticizing by Trump....  still haven't heard any plans...just criticism.  #debates #Debates2016,1474940657767,780583811092451328,1
162,janifer,@GeorgeTakei It's not surprising.  I think this is a byproduct of his #Affluenza. #Debates #Drumf,1474940657562,780583810232614913,2
163,JrbbNyc,Is the #debates an advertising slot for #Trumps company?,1474940657607,780583810421383169,0
164,AZhummerH2,Why the fuck does she keep laughing what's so funny? #debatenight  #debates  #Debates2016,1474940657863,780583811495006208,0
165,Dooneese_Drumpf,#TrumpisSick #Debates,1474940657775,780583811126063105,2
166,AccioDolans,#debates https://t.co/AVpgjnaG0i,1474940658505,780583814187933697,2
167,esocktheman,"""I'm not trying to be braggadocios"" #debates",1474940658647,780583814783393794,2
168,jessviduya,I forgot Lester was there for 45 minutes. #debates,1474940658702,780583815014064129,2
169,redhawk_123,Hilary's low keys on fire 🔥🔥🔥#Debates,1474940658564,780583814435315712,2
170,Chilitime,Trump looks less orange than usual #debates,1474940658718,780583815081144320,0
171,CNNisDISGUSTING,#debates https://t.co/zwBmlmsVNU,1474940658401,780583813751705600,2
172,DianesOcean,Someone gives him a kleenex for his runny nose.  #Debates,1474940658689,780583814959624193,0
173,DarrenWheels,"Can someone get Trump a tissue please

#SnifferInChief #debates",1474940658628,780583814703648768,2
174,estaoutra,"hahahaha, o cara ta aproveitando o debate para fazer propaganda do novo hotel. #Debates",1474940658711,780583815051968512,2
175,BeWhoYouAre,Trump - taking advantage is normal - inhuman business is bad business  #Debates,1474940658690,780583814963822592,2
176,Stockardguru,Uh-oh. Race is next. #debates,1474940658705,780583815026728961,1
177,InnerDaemons,No one sniffs this much who didn't just spend ten minutes with a bag of charlie in the bathroom. #debates,1474940658301,780583813332267008,2
178,melyssawithay,yes bitch let's talk about RACE. let me see this #debates,1474940658717,780583815077040129,1
179,Evan__Yu,Donald Trump speaking on race. I might not be able to take anymore. #Debates,1474940658762,780583815265808384,1
180,ejprod_ktda,These clowns have yet to even touch on how they will help me as an average citizen sitting below the poverty line #debatenight #debates,1474940658757,780583815244812289,2
181,RobbynAckner,"#KingOfDebt, how many people did u screw out of money building a hotel in DC? He's proud of #Bankruptcy #trumpeduptrickledown #debates",1474940658646,780583814779248640,2
182,TheNickFaulkner,Only reason I'm watching the #debates #snapchatfilters 👻:TheNickFaulkner https://t.co/NhRm20O5bi,1474940658335,780583813474881536,2
183,mrfradkin,Does Trump know that being First Lady does not give you a vote in the legislative branch? #debates,1474940658809,780583815462825985,2
184,RochelleKonja,Omg @candkatie  https://t.co/5whOIxDusA,1474940658417,780583813818703872,2
185,d_u_t,#trump's superhero ability is being able to convince himself his lies are true before he's done telling them  #Debates,1474940658797,780583815412461569,0
186,BrinkLissa,"#debates just make me dislike both candidates even more. I get it you hate each other, you're creating jobs and lowering the debt.",1474940658905,780583815865589760,2
187,ohmygallifrey12,"Well, we're screwed #debates",1474940659658,780583819023835136,2
188,paulcon40,"Newt,  Adequately Competent? Maybe get into the wild card. https://t.co/lqzH7GqXbU",1474940659414,780583818000498688,2
189,OfficiallAmanda,The race issue #Debates,1474940659519,780583818440896513,1
190,All4Trump4All,#debateNight #MAGA https://t.co/GYCt0TkH3d,1474940659595,780583818759589888,0
191,just_leighan,"here we go, this should be good #debates",1474940659675,780583819095269377,1
192,ztawhite,So inspiring. So inspiring I'm crying on the inside. https://t.co/vCpVgP7ut2,1474940659651,780583818994384897,2
193,AnUrbanNomad,It's easy to be under budget when you're not paying people #Debates,1474940659643,780583818960908290,2
