,screen_name,text,timestamp,tweet_id,cluster_pred
375,FlyDuoATL,"Stop and Frisk has been proven to be problematic. 
Stats have proven it targets primarily LAW ABIDING black &amp; brown people.
#Debates",1474941046686,780585442337062914,1
376,socrates_99,"According to Lying Trump, Stop &amp; Frisk was ruled unconstitutional, because the judge was a ""very against police"" judge. #Lies #debates",1474941046699,780585442391490560,2
377,dbzfreak2,"""An against the police judge""
...oh boy #debates",1474941046597,780585441963704321,2
378,brianfmorrissey,"The Poop Emoji 💩 could do a better job moderating this debate than @LesterHoltNBC. Just sitting there, smiling and stinking. #debates",1474941046535,780585441703624704,1
379,Nerf_Herder22,THESE ARE THEIR STORIES! #debates @drippingtar,1474941046593,780585441946923008,2
380,anjalienjeti,"He only cares about cities where he has property. ""I have investments there!"" ""I have property there!""
#ImWithHer #Debates2016 #debates",1474941046313,780585440772395008,1
381,tessasnation,"""that policy was racist""
trump: ""yeah but lets do again it anyway""
#debates",1474941046698,780585442387243008,1
382,jaystebbins,Donald Trump is going to take the guns away... The 2A people must have just crapped themselves. #Debates,1474941046719,780585442475257856,1
383,VanLyn87,The only way Trump can relate to any issue is how it personally affects him and his investments. President material for sure! #debates,1474941046725,780585442500415488,1
384,ImranGhazaliPK,Hahaha how many times he has said chicago 🙈 #Debates,1474941046708,780585442429300736,2
385,quilty_david,"In all the years of ""they are gonna take your guns"" this is the first time someone has actually said ""we gotta take their guns."" #debates",1474941047568,780585446036348929,1
386,NicholasPreuitt,You can't just get through this with slogans &amp; doubling down on your conspiracy theories  #Trumpsterfire #debates,1474941047682,780585446514372609,2
387,Bennett_Sny,"Trump doesn't give a single fuck about any of the people shot in Chicago. Stop talking about it. ""I have property in Chi"" scumbag #debates",1474941047593,780585446141206528,1
388,jennychung,So @therealdonaldtrump is advocating for racial profiling? Oh good. #debates #ImWithHer,1474941047146,780585444266405894,2
389,jmeelinda,"Nephew is even tuned in, his future matters too #debates https://t.co/dqLCXlcWOl",1474941047454,780585445558194176,3
390,whoaa_nicolee,Where are the facts trump #Debates,1474941047715,780585446652964865,1
391,KrystynaBarnard,"#Debates: Every time Trump mentions ""law and order,"" and I start humming the @nbcsvu theme song. At least that can keep me entertained.",1474941047688,780585446539755521,0
392,lcurry789,"Every time Trump names a location, he promotes a hotel #freeadvertising #debates",1474941047519,780585445830844416,2
393,smashley137,Finally tuning in. Is it just me or does he look less orange tonight? #Debates,1474941047728,780585446707343361,2
394,susanrubinsky,#Debates 80% of guns used in shootings are legally obtained - https://t.co/7mNPH8qktK,1474941047635,780585446317428736,3
395,Artminx,"""A judge who is a very against police type judge""#Debates #OhDonald",1474941047683,780585446518747137,2
396,CherylARoss1,IKR!!!  #debatenight https://t.co/mjuvsfHttK,1474941047325,780585445017124864,3
397,TheAnnieO,For real @BellamyYoung this makes me want to throw up #debates https://t.co/BxZBJfowQ1,1474941047595,780585446149656576,3
398,FuturisticHub,"Fuck ""racial profiling"" its not about race its about protecting EVERYONE. Segregation needs to stop being mentioned. #debates",1474941047809,780585447047122944,2
399,VirtualNight,"Bringing ""stop and frisk"" back is a terrible idea though. #Debates",1474941047757,780585446829010944,1
400,CosmicSlopper,"Don't worry, these issues aren't complex. Just yell ""law &amp; order"" &amp; everything will be fine, provided you are a straight white man #debates",1474941048597,780585450352283649,0
401,BYETR0Y,"""BAD PEOPLE""😂😂😂😂 I'm done with this man  #Debates",1474941048503,780585449958043648,1
402,Praiz8,Hahahaha he just lowkey admitted Hillary's point #Debates #Debates2016,1474941048689,780585450738069504,2
403,sarimsorry,@realDonaldTrump shaming/correcting @LesterHoltNBC?  Wow.   #debates,1474941048647,780585450561871872,2
404,MoonAngelWings,And Bohner and cronies killed it https://t.co/gYiAX247T9,1474941048591,780585450327027712,3
405,K2theWaterBoy,Moderators should not enter debates. #Debates,1474941048690,780585450742382592,2
406,CParsonsL,In case you missed something tonight #debates #debatenight #Debates2016 #CBUS110 https://t.co/yFSk4hebrl,1474941048579,780585450276880384,3
407,szelvenskiy,"Quote by @realDonaldTrump ""A 'very against police' judge"" are in third grade? #debatenight #debates",1474941048517,780585450016612352,2
408,Supermari64,This guy hilarious man. Does america really need a president?  #Debates,1474941048544,780585450130014213,2
409,DietercommaAlex,Stop &amp; Frisk is draconian. End of story. #debates,1474941048698,780585450775937024,1
410,torichavonne,Lester is about to be like me when someone tells me I'm wrong on something I know is right. #debates,1474941048742,780585450960551936,1
411,ElMarcosJosue,Yo cuadrandome al culito https://t.co/Brcf8Fgxwc,1474941047232,780585444627083265,3
412,ReversingASD,@realDonaldTrump Tells realistic solutions &amp; @HillaryClinton attacks with emotional poop! so tire of the manipulation!  #debates,1474941048713,780585450838880256,2
413,Flmilitiapsyops,#debates https://t.co/Y4Phr0QxYL,1474941048238,780585448846622720,3
414,raemelle,I think Trump just endorsed gun control..? #Debates2016 #debates,1474941048731,780585450914324480,1
415,macwatson25,Is this Larry guy running for president because I thought Hillary was debating Trump not him? #debates,1474941048795,780585451182841856,2
416,Waltahr,Is no one going to #FactCheckTheDebate on Trump saying 4k dead from shootings in Chicago to-date? #debates,1474941049667,780585454840057856,2
417,MichelleSpinn,ummm... https://t.co/u6AzEge0BW,1474941049285,780585453238050816,3
418,SarahHorneCook,How is stop and grid going to help community relations? #idiot #debates,1474941049662,780585454819168260,1
419,macin24,"Dude, stop &amp; frisk is illegal, it's racial profiling, you can't re-write facts....... #debates",1474941049494,780585454114603010,1
420,natulie828,Lester getting zero respect when he speaks #theycompletelyignorehim #Debates,1474941049190,780585452839534592,1
421,DeeZatzMan,Is this real life? #debates,1474941049561,780585454395588608,1
422,faliwally,Trump seriously supporting stop and frisk?! #debatenight #debates,1474941049480,780585454055854080,1
423,katherinemwahl,Can't they just turn off Trump's mic when his time is up? #debates,1474941049552,780585454357864448,1
424,Canadian_Minion,(°¿°) https://t.co/JXG8etCyyv,1474941049403,780585453732978688,3
425,kotacatchem,"Wait he just said 3,000 shootings, and then right after said 4,000 deaths by shootings???? MAKE UP YOUR MIND. #Debates",1474941049655,780585454789943297,2
426,DanScheeler,Trump just called Chicago Obama's home town? Guess he really has changed his tune on birtherism #Debates,1474941049638,780585454718648320,2
427,lizziewann,He can't even finish his bullshit sentences #debates,1474941049706,780585455003676672,2
428,MichaelKag1228,"Guess who said this. ""You need better community relations in Chicago. It's terrible. I have property there."" #Debates",1474941049628,780585454676611073,2
429,buppie99,Is Obama running for a third term? You would swear this guy is running against him? #Debates,1474941049682,780585454902976512,2
430,nworcg,Ya why is Trump only talking about Chicago? #debates Really bad things happen in cities everywhere,1474941049630,780585454684942336,2
431,heathera365,@tyllyn #snapchat #debates https://t.co/t1LeKk6oGM,1474941048941,780585451795062784,3
432,markjfarrell,Why is this where @realDonaldTrump goes when asked broadly about race relations? #racist #debates,1474941049658,780585454802350081,2
433,ant_hon_ys,They're talking about cops trump not illegal immigrants #clueless  #Debates,1474941049765,780585455251255299,2
434,Agent_KO,Stop and frisk? Wtf? He just pissed the NRA off. #debates,1474941050678,780585459080503296,1
435,zeedees_mom,"More plan of action less dirt slinging, please.  #Debates",1474941050374,780585457805561856,2
436,donna816,I lived in my whole life Chicago War torn ...Really ..?? #debatenight #Debates2016 https://t.co/WCQ5mlpClF,1474941050228,780585457193103360,3
437,CDMatthewMurphy,Hope someone does a complete analysis of Donald's bizarre garbled syntax. #debates https://t.co/RTtVgPi2gm,1474941050575,780585458648674304,3
438,jstrae,"Both Candidates failed this question miserably...Hillary stumbled &amp; was too nervous, &amp; Trump focused on Chicago and Law &amp; Order #debates",1474941050558,780585458577379328,0
439,JesBWeisenfels,"Tfw your base is super racist, but you're also pandering to people of color. #Debates",1474941050646,780585458946285568,2
440,Joe_Sherman_,Do they just not refer to actual statistics and just go based on what sounds right? #debates,1474941050516,780585458401218560,1
441,Pipesparsons,"Pssst Donald its called""Community Policing"" you're welcome. #debatenight #debates",1474941050732,780585459307118594,2
442,samanthalwarren,I just told @nbcwashington who I think is winning. Cast your vote now! #Debates #NBC4DC https://t.co/i9pWrtn0th,1474941050685,780585459109990400,3
443,j_legs,Trump is totally rambling at this point #debates,1474941050764,780585459441283072,1
444,alexy501,Has he answered one question yet? Or he is there to analyse each statement/question. Mud slinging!!! #debates,1474941050523,780585458430468097,2
445,adamlbarr,"Help me, I'm living in hell, at least according to Donald Trump. Lots of black folks here. #debates #BlackLivesMatter #WIBackHer",1474941050637,780585458908684288,1
446,0x00string,Wow these are all from tonight's debate! You can tell! Mad liekz! Zomg! https://t.co/jgwJKrPD4Q,1474941050707,780585459202166784,2
447,KanelsAbel,"#debatenight #debates #Debates2016 #PresidentialDebate 

Shocking Clinton says get rid of guns point blank

U HAVE ARMED GUARDS, BITCH!",1474941050630,780585458879303681,2
448,EvelinASantos,Can Lester run for president instead 😉 #Debates,1474941050818,780585459667787776,1
449,summerskate,"Wait, is he debating Lester now? #debates",1474941050736,780585459323924481,2
450,lisatatonetti,"Wait. Trump said ""take guns away from bad ppl."" He's coming for your guns, deplorables!  #debates #debatenight",1474941050741,780585459344822272,1
451,johnpesina,Is it me or is @realDonaldTrump vocabulary on par with that of an sub par kindergartener? #debates #debatenight #txwatching2016,1474941050738,780585459332243456,3
452,JMC145,"Things have settled down a bit, @LesterHoltNBC has it almost back on track. Nearly resembles a debate now. #Debates #debatenight",1474941050672,780585459055521796,2
453,rananjerry,Truth is Neither #HillaryClinton or #DonaldTrump has a plan for the Racial Divide #debatenight #debates,1474941050840,780585459760046080,2
454,rapmusiq,#debates https://t.co/a4KGxbKUiU,1474941050633,780585458891759617,3
455,standwithraul,Stop and frisk wasn't rejected by one judge who hates law and order. It was rejected by our entire legal system. #debatenight #debates,1474941050651,780585458967388160,0
456,GreenGoddessVV,Fuck racial profiling we need hot or not profiling #debates,1474941051700,780585463367147522,2
457,TheIvanOfficial,If we have to choose between the lesser of two evils I choose #Satan . #Debates,1474941051616,780585463014752256,2
458,polyov_dev,"""Stop and frisk worked great"" ""Just to clarify, stop and frisk was ruled unconstitutional"" #rekt #debates",1474941051716,780585463434272774,1
459,Shinjobi,https://t.co/HcxsDVfDl1 #Debates,1474941051720,780585463451004930,3
460,litlstitchwitch,did donald trump actually suggest that expanding stop &amp; frisk is the way to improve race relations? I am so confused right now #debates,1474941051698,780585463358771200,1
461,Camakizzle,"Stop and Frisk? Oh no, that's not racial profiling.  #thingsdonaldsays #debates",1474941051742,780585463543320580,1
462,Tasha26,"Trump also failed on race issue. He been watching ""Lol &amp; Order"" too often. 
Stop &amp; frisk? F.OFF
#debates #debatenight",1474941051610,780585462989750272,0
463,RickiSimmonds,What the fuck have police been doing everywhere?! 🙄😒 #Debates,1474941051678,780585463274958849,2
464,MinaLioness,I swear to God I would have leaped in this audience. #debates,1474941051666,780585463224627200,2
465,radioxalaat,Is Obama running for te election  #Debates,1474941051689,780585463320944640,2
466,keeeeehr,"Trump's staff: ""STOP USING NUMBERS"" #debates",1474941051666,780585463224659969,1
467,AntzTowler,Law and Order UK is still going #debates,1474941051801,780585463790702592,0
468,CartierSande_,LMFAO https://t.co/xOYoVcCTDr,1474941051680,780585463283232770,3
469,tyra_finch,No you're wrong. I'm sorry what?? Stop arguing with the proctor #debates,1474941051805,780585463807475712,1
470,joseph_melendez,@realDonaldTrump So are the bad people you want to take the guns from...Only blacks right? #debates,1474941051602,780585462956232704,1
471,HeidiLiFeldman,"THIS. THIS. THIS.
#ImWithHer https://t.co/B3hnp3BCrS",1474941051602,780585462956171264,3
472,ehk009,"Yo! @LesterHoltNBC did you just back down from @realDonaldTrump about ""stop and frisk?"" #debates",1474941052568,780585467007959041,1
473,UprootedTexan99,"Lester: Mr. Tru--
Trump:  Shhhh, Lester, the white guy is talking.
#Debates",1474941052568,780585467007729667,1
474,the_hidebehind,Trump invests in genocide #debatenight #Debates2016 #debates https://t.co/iQOx25svg3,1474941052532,780585466856873985,3
475,lit_lyd,Trumps avoiding how he would bring together the divide because he doesn't know how to bring it together. #debatenight #debates #BLM,1474941052639,780585467305664520,2
476,Blazerona,"Wait, is Trump actually implying that we should have more regulations on guns? I thought he was Mr. anti-regulation ten minutes ago #Debates",1474941052725,780585467666321409,2
477,alvaroamat,"Trump's solution to racial tensions: ""law and order"" ""stop and frisk"" #Debates",1474941052630,780585467267821569,0
478,killthots,do y'all got laptop #Debates,1474941052673,780585467448287233,2
479,GenXers4Hillary,Immigrants shoot people Black people are bad people? How the hell could we allow this man a chance at the presidency? #NeverTrump #Debates,1474941052760,780585467813072898,1
480,theforester000,"That moment the @nra_nusa ignores that trump just said ""take guns away"" #debatenight #debates #Debates2016 #NRA",1474941052767,780585467842469888,1
481,JustRightMeme,How will we know who do/don't deserve guns? A NATION WIDE HOUSE SEARCH?!?! F***ing stupid.. #debates,1474941052791,780585467943063552,2
482,chelseaperetti,"STOP AND FRISK THESE NUTTTTSSSS  -Lester Holt, Moderator #Debates",1474941052767,780585467842482176,1
483,phototherapy318,Donald what do we need??? #debatenight #debates #Debates2016,1474941052597,780585467129593856,1
484,georgette,he's talking in circles. ugh i want to scream at the TV. #debates,1474941052755,780585467792224257,2
485,danirivera08,"Taking away guns from people is... psst ""gun control"" Donald #debates",1474941052568,780585467007729665,1
486,Alex_Flecha16,The amount of racism #debates,1474941052395,780585466282307584,2
487,DanradMa,Y los impuestos @realDonaldTrump ?  #Debates,1474941052778,780585467888537601,2
488,AKilbo,"Fuck this guy @realDonaldTrump seriously. He wants a police state with stop and frisk and ""papers please"" fuck this guy. #debates",1474941052720,780585467645493249,2
489,ProfessorWankly,"""He was a very-against-police-judge!!"" ...My five year old niece speaks better than @realDonaldTrump #debates",1474941052659,780585467389456384,2
490,SandyMagura,#DonaldTrump wearing blue and Secretary Clinton wearing red. Fighting for the other side. #debates,1474941052713,780585467616059392,2
491,tacobasura,I'm just here for Harambe #Debates,1474941052785,780585467917901825,2
492,nvrggivup,#debates  not some one who is above the law CROOKED H,1474941053684,780585471688650752,0
493,nostalgia3076,LISTEN oh my gosh he just stopped lester. Also he is working in minorities already #debates,1474941053705,780585471776661504,2
494,hailkingtrump,I really want to see a sound cloud of this debate when it's all said and done. #debates,1474941053193,780585469629399041,2
495,BabyMonster126,Does @realDonaldTrump only care about the cities he has investments in?  The country is composed of more than just those cities #debates,1474941053643,780585471516614657,1
496,Fathers1787,He has a cold. https://t.co/W2pnn1KP7J,1474941053670,780585471629926400,3
497,Clux_Deluxe,Law and Order is still on TV I watch the re runs almost every day maybe it's too much Law and Order #debates,1474941053570,780585471210561536,0
498,clicktipu24,adage : 'Choose the Next Driver Wisely': See Audi's debate ad #Debates #Debates2016 #Debat… https://t.co/DK55qp6BTw) https://t.co/NAoTJ4BJcw,1474941053335,780585470224982016,3
499,BLanaGuggenheim,"Clinton talks about working with the police and cracking down on guns, and Trump accuses her of not caring about Law and Order #debates",1474941053637,780585471491575808,0
500,LCHINDERLITER,#debatenight #debates https://t.co/1kA0Y3mr8K,1474941053629,780585471457898496,3
501,alyssascheinson,Trump is at a loss for words. Rare form. Dude is stumbling. #debatenight #debates,1474941053599,780585471332220928,2
502,_Danny_Fey,Now Obama's hometown is Chicago? I thought it was Kenya? 🤔 #Debates,1474941053643,780585471516770304,2
503,CaitlinnnMaryy,"Hey - if he said we need to bring back Stabler, that'd be something Trump and I would agree on! #debates https://t.co/lUcxJndZGp",1474941053678,780585471663546369,3
504,MissReadus,His hometown is Honolulu! He's an idiot! #Debates,1474941053665,780585471609036800,2
505,JoeyBubbleSauce,"""a very against police judge"" #Debates",1474941054543,780585475291680768,2
506,spcoggins,It seems like @realDonaldTrump is more concerned with where he has property than our real issues. #typeadebate #debates,1474941054629,780585475652411443,1
507,srnyoung,"How do we heal the racial divide? 
Trump: ""Law and order. Stop and frisk."" 
#debates",1474941054635,780585475677446144,0
508,AdamGladu,All of Trumps experience is with having properties in that city or region... #Debates,1474941054672,780585475832619009,2
509,SRQuigley,Trump says 3000 shootings and 4000 people killed. #debates,1474941054637,780585475685945348,1
510,_tatianap,Wait a second... does anyone hear Trump's breathing? Is he sick? #debates,1474941054613,780585475585273856,2
511,SaraMKnox,Trump's unpaid bills: https://t.co/ShfZqK08kp #debatenight #debates,1474941054678,780585475857801216,3
512,ndante25,IS HE SERIOUS RIGHT NOW IS HE SERIOUSLY ARGUING THAT STOP AND FRISK SHOULD BE BROUGHT BACK DID HE JUST TELL LESTER HE WAS WRONG#debates,1474941054619,780585475610406912,1
513,TennisLover03,Can @realDonaldTrump finish a sentence coherently?? Or even answer a question??? #debates,1474941054502,780585475119513600,2
514,Heyam000,Trump has no idea what he is doing he can't finish a sentence  #Debates,1474941054670,780585475824160772,2
515,Their_Malarkey,Trump is fact checking Lester's fact checking - He is clarifying the facts &amp; keeping the press honest #debatenight  #Debates2016  #debates,1474941054718,780585476025712644,1
516,mzneisha0005,He's insane. #thatisall #debatenight #debates #Debates2016,1474941054563,780585475375521792,2
517,daynickuh,"Yeah, that old ""stop and frisk"" really helped build relationships... #WTF #debatenight #Debates2016 #debates",1474941054583,780585475459256320,1
518,brando8675,Trump is the only one that can new us from being destroyed. At least between the two of them  #Debates,1474941054618,780585475606138880,1
519,nataweejunks,racial violence cannot be solved by racial profiling #debates,1474941054597,780585475518201857,1
520,XxViper_TxX,"What season of ""Law and Order"" do we need? #Debates",1474941054811,780585476415643648,0
521,Vinlockz,"#debates You could ask Trump ""How old are you?"" you'd learn the age of everyone in the world before you still don't get an answer.",1474941054771,780585476247859200,1
522,taticavante,Queria me tornar uma cidadã norte americana só pra votar no Trump #debatenight #debates,1474941054802,780585476377968640,2
523,Toledowholesale,"Retweeted Gov. Gary Johnson (@GovGaryJohnson):

.@realDonaldTrump decoder: ""law and order"" means throwing away the #constitution #debates",1474941054678,780585475857911808,0
524,mawsonjohn,Shit. I can't join a gang now. Im not an illegal immigrant #debates #trumplogic,1474941054772,780585476252049408,2
525,LauraHarrisWFTS,"LESTER : ""The argument is racial profiling.""

TRUMP : ""Nope, just taking guns from bad people.""

#Debates",1474941054769,780585476239532032,1
526,msrbt,AND THEN YOU WANNA BUILD A WALL #debatenight #Trump #Debates,1474941055667,780585480006012928,2
527,_Smythe_,That's honesty right there #racist #debates,1474941055627,780585479838265344,2
528,BlackSantaFTW,"Lester Holt: Stop and Frisk was deemed unconstitutional and discriminatory against blacks. 
Donald Trump: No it was… https://t.co/vZUxXWemw8",1474941055378,780585478793916416,1
529,Tatumspop,"Dammit, someone call timeout and give Donald some Flonase! #debates #sniff",1474941055780,780585480479924225,1
530,mistermocha,"""take the guns from the bad people"" and how do we do that? #Debates",1474941055632,780585479859150848,1
531,Vlaka3210,Why don't we just give the police Nerf guns? #Debates2016 #debates #debatenight #debate #USA #PresidentialDebate,1474941055683,780585480073125888,2
532,stellarghouls,Which one? https://t.co/PNTFl8PVJl,1474941055613,780585479779577856,3
533,julisvoice,"#debates no, stop and frisk is a good thing, says the white rich guy.  Reality check please- unconstitutional",1474941055702,780585480152899584,1
534,MichaelJMIV,"Stop frisk and shoot anything that looks at you the wrong way, right? #debates",1474941055695,780585480123539456,1
535,AlphaFoxWarfare,"Clinton looks like fucking Mort from Madagascar except ugly. 

#Debates #Debates2016 #debatenight #Hillary #HillaryClinton #ImWithHer",1474941055523,780585479402061824,2
536,staceystowe,Lester Holt has to be more assertive #debates,1474941055712,780585480194785280,1
537,MisterMott,The sniffing of @realDonaldTrump is the sound a dementor makes when it steals your soul. #debates #debatenight #sniffofdeath,1474941055598,780585479716626432,2
538,alesiabmartin,"""LawAndOrder"" in Ohio 2 where #heroin epidemic is happening.NewHampshire, Utah. What about those bad places &amp; #drug areas #Donald #debates",1474941055724,780585480245174274,1
539,alexvogel14,Respect is a 2way street #Clinton  between police and the community  #debates,1474941055671,780585480022847488,2
540,CurtisKFOX_CBS,There you are Lester ! 👏🏼👏🏼 #debates,1474941055731,780585480274321409,1
541,dreday1215,No joke man. Trump just doesn't get it. #debates https://t.co/MR3aBjuRwx,1474941055694,780585480119160832,3
542,OhYouMad_Tho,How to gone have good community relation when cops gunning down the community #Debates,1474941055709,780585480182177792,2
543,sweetsallysue,#debates2016 #debates platitudes Trump.  Ya gotta do better than that,1474941055694,780585480119214080,3
544,Sal_Natale,#Debates RIP,1474941055712,780585480194822144,2
545,iAm_IsaiahBurns,Stop &amp; Frisk? Yeah Police Already Do That Based On Racial Profiling #debates,1474941055786,780585480505139201,1
546,reaIDonaldTrup,"""We need law and order"" #debates #debatenight",1474941055771,780585480442277888,0
547,aekaitz,Since when does the president control city legislation in Chicago!!!?? #debates,1474941055718,780585480219951109,2
548,LIVEFORLLC,"It's called BIASED, not ""He was against very police Judge"" #Debates",1474941055818,780585480639291392,2
549,MadVeganChef,Word https://t.co/3FgQrwNnGh,1474941055715,780585480207339520,3
550,mrsdavie80,LESTER WE NEED LAW AND ORDER  #Debates,1474941056616,780585483986317313,0
551,akaWallace,So crazy to look out the window at neighboring apartment buildings and see the same image on every TV screen. #debates #debatenight,1474941056564,780585483768168450,2
552,petevanliere,Watch out for those gangs? #really? #debates Get outta town racist little hand guy.,1474941056681,780585484258938883,2
553,drmom20,These are bad people#You need stop and frisk#chicago#donaldtrump #debates,1474941056509,780585483537645569,1
554,cplouis,Bad things. Bad things. Bad things. Meanwhile ..Lester stays quiet.  #debates,1474941056667,780585484200271872,2
555,ajoyfulnoiz,If only he saw it that way https://t.co/bLy6EC13lF,1474941056625,780585484024213504,3
556,YoungNobler,"The more flustered Donald Trump gets, the more he slips into his Woody Allen impression. #debatenight #debates #Debates2016",1474941056501,780585483504156672,1
557,MagickTheMenace,Glad @realDonaldTrump stupidity is being broadcasted no edits  #Debates,1474941056694,780585484313432065,2
558,ValMapAck,"Stein: we need policing of Wall St., but enforcement ended. Immigrants are statistically less likely to commit crime. #debates #JillStein",1474941056699,780585484334534656,1
559,DPikesWorld,"And of course, the obligatory mention of his investments in Chicago. #debates",1474941056717,780585484409905152,2
560,fishgirl27,"I believe Trump just said he wants to take away our guns!!! That doesn't help your ""stop &amp; frisk"" RACISM! #debates",1474941056617,780585483990659072,1
561,HondoGratten,Just give Donald a shovel those hands are getting scruffed up digging his hole.  #Debates,1474941056659,780585484166627329,2
562,TiffanyTononi,I'm not ready for a loud breathing president. #sorrynotsorry #debates,1474941056817,780585484829405184,2
