,screen_name,text,timestamp,tweet_id,cluster_pred
0,Mprest13,Big Fat Ugly Bubble is the name of my college Ska Band. #debates #Debates2016,1474939905732,780580656828981248,1
1,thegrandaffair_,We really need the good one. #debates,1474939905603,780580656288063488,1
2,KtudaJallday,#debates https://t.co/WZBmX6w9CW,1474939905439,780580655599976448,4
3,xorosenstein,Trump is making Kanye look like a little bitch with how much he's interrupting Clinton 😂😂😂😂 #debatenight  #Debates2016 #debates,1474939905707,780580656724189184,3
4,mizladyjayne,Bigly! https://t.co/kT0ztSe3si,1474939905715,780580656757608448,4
5,AshlynGlass,Trump WILL NOT let Lester Holt talk😂 #Debates,1474939905853,780580657336430592,1
6,JohnMacip,Trump a fool bruh 😂 #Debates,1474939905885,780580657470644224,1
7,kllan71,"#Debates a b chesler, are we watching the same debate?",1474939905803,780580657126739968,3
8,delmoi,@chrislhayes https://t.co/RCs9iaEBCF,1474939905676,780580656594100225,4
9,mggtoscano,"#Trump is now #unhinged and off the his rocker. He forgot to take his meds tonight. ""BELIEVE ME"" #debates #Debates2016  #debatenight",1474939906598,780580660461178880,3
10,Galileo908,"Hoo boy, the tax returns are up next. #debatenight #debates",1474939906602,780580660478107648,2
11,jazzyj022,What is he even talking about? #debates https://t.co/0G4hKd2a0I,1474939906408,780580659664265216,1
12,ssrimal,#Debates typical politician.. So far the quality of debate is poor..,1474939899127,780580629125689344,4
13,LeahRandall,Check it out! https://t.co/z0scjxylBT,1474939906522,780580660142571520,4
14,dylanobrienfave,Trump is showing the passion for fighting for this country that we need. #debates  #debatenight https://t.co/xwFMsWdjAz,1474939906409,780580659668537344,3
15,hhavenwood,yep!! you mean cut off and cut down small business... https://t.co/EjIqI5vore,1474939906656,780580660704456704,4
16,Kuhrageous,#Debates sooo what's the MNF score!,1474939906720,780580660972965888,1
17,ShikhaManchand,Time for the orangutan to spit superlatives! #debatenight #debates #debate #donalddump #Debates2016,1474939906482,780580659974795265,4
18,pulisci,"We're in a big fat ugly something, alright #debates",1474939906786,780580661249703936,1
19,HelenaTacy,"#debates ""Says stuff, sounds good, doesn't work."" Doesn't that sound a lot like Reaganomics?",1474939906699,780580660884938752,3
20,JoseCEO,big fat ugly bubble” was he talking about Chris Christie #debates,1474939906484,780580659983163393,1
21,_jonbellionfan_,"This is all I hear , blah blah blah blah !! #Debates",1474939906671,780580660767449088,4
22,conyjorqueram,"Es mega tarde y debería estar durmiendo, pero debo ver esto 🇺🇸🇺🇸🇺🇸#Debates",1474939906660,780580660721442816,1
23,Mhrinkov,But the graduates today can't find jobs now.  #debates,1474939906449,780580659836387330,0
24,SoyUnPlatano,"#Debates que tanto escribe Clinton? Me imagino que escribe: ""Trump es un pendejo"" y cosas así. 😂😂😂",1474939906858,780580661551783936,1
25,som_Universe,저게 미국 대통령 후보라니. 당선되지 않아도 트럼프가 묘비명에 미국대통령 후보였다고 적으라고 할것같다 #Debates,1474939906689,780580660842930176,4
26,k_style6587,WTF is he talking about?  #Debates,1474939907674,780580664974282752,1
27,2sad2lift,""" YOU'RE a fucking bubble!"" #debates",1474939907244,780580663170830341,1
28,OccupyConcordCa,put  down the toilet lid #debates #debatenight #debatenight right ? @infowars @Cernovich @WebsterGTarpley,1474939907706,780580665108471808,3
29,MarleyThePlug,Trump is showing the type of tolerance he'd have at a world nations conference. I'm pretty sure his rage would drive us to a War #Debates,1474939902887,780580644896276480,3
30,_heyitshoey,Well why are you going to raise interest rates?  #Debates,1474939907720,780580665167269889,3
31,TulaGo,Trump is losing it. He cannot even speak in grammatically correct sentences. #OOF #debates,1474939904161,780580650239787008,1
32,3ptscott,Agree with the #bubble talk  #Debates,1474939907653,780580664886358018,1
33,edf_iii,"WOW.  Hillary is not handling this well.  Trump keeps poking the bear, and she keeps taking the bait. #debates",1474939907709,780580665121083392,1
34,SydDye99,"I wonder if Lester gets tired of getting interrupted.
#debates",1474939902894,780580644925702144,1
35,ringasunn,All talk no action? Wtf have you done for anyone besides yourself you piece of shit? #fucktrump #debates,1474939907617,780580664735301633,0
36,MicSchirtzer,"#HillaryClinton keeps bombing so hard w her trumped up trickle down joke that #HenryKissinger endorsed her again

#debatenight #debates",1474939907626,780580664772956162,4
37,mollie_m2013,"""I have a feeling I'm going to be blamed for everything."" 

""Why not?"" 

😂😂😂 #debates",1474939903022,780580645462536192,0
38,AMFLincoln,Off to the golf course for the rest of his life. Nice one. #debatenight #debates #Debates2016,1474939907752,780580665301409792,0
39,jadoll,"He's not even making sense, now.  #Debates",1474939907649,780580664869519361,3
40,Soulnik,"Me too! If I had the money, I'd donate $100 every time she manages not to bust him in the side of his head. https://t.co/uWFuPvAhX6",1474939907695,780580665062330368,4
41,WalkOutKingTRMD,I will just RT the sassy #debates tweets. Hihi,1474939907665,780580664936636416,4
42,JaileeGabbana,Yazzzz @HillaryClinton is all about the continue of the rebuild of Amerca...... #Debates,1474939907761,780580665339289600,4
43,SwagPoker,Kamau gonna be in a COMA by the end of this @Denzealots! #debatenight #TrumpDrinkingGame https://t.co/KcfKkvhK0b,1474939907617,780580664735207425,4
44,bennymicp1,#whereIsGary and #1million @debates you all some bs artists ... #whereisJohnCena https://t.co/nAcv33JYdn,1474939907590,780580664621998081,4
45,introvertchink,#debates looks like trump may be our upcoming president,1474939908698,780580669269217280,3
46,shanleym26,"I hate it when Mom and Dad fight, when is Trump gonna give up #Debates",1474939908659,780580669105721344,1
47,JPSpartan,"Breaking: #Obama to join PGA Champions Tour after presidency, per #TeamTrump. #Debates",1474939908660,780580669109964800,0
48,R_R_R_Jr,Yes Donald. Piss off the Obama coalition to make sure they come out on election day. Thanks. #debatenight #debates,1474939908668,780580669143388162,4
49,FearlessBellaxx,"When Obama leaves office, he can do as he pleases. He gave us 8 amazing damn years. Don't worry bout his free time, Trump. #debates",1474939908609,780580668895928321,1
50,PaPa_AFriCa,Trump just spoke pure facts about the Feds!!! #debates,1474939908629,780580668980027392,3
51,rejinl,"Drink whenever Trump interrupts Clinton, talks over her, moderator doesn't tell him to put a cork in it. #debates",1474939908683,780580669206462467,1
52,ShwahWahWah,#TrumpedUpTrickleDown sounds like a sick Trap anthem. #Debates,1474939908569,780580668728221696,1
53,sarah_sene,"Se Trump ganhar esse negócio ele vai pegar uma basuca e atirar na cara da Hillary,moço doido da poha #Debates
Vai Hillaryyyy",1474939908720,780580669361618945,3
54,LloydZiel,How to make presidential #debates better without breaking them https://t.co/NSzmnVvweT https://t.co/LjK5zGnF0n,1474939908582,780580668782837764,4
55,sitvisvobis,"HE WENT BANKRUPT LIKE TWENTY TIMES, WHAT THE HELL IS HE TALKING ABOUT #Debates",1474939908762,780580669537804289,1
56,DionRabouin,This Janet Yellen of the Fed... #Debates,1474939908705,780580669298774016,3
57,Dannie_thepooh,J-WIL ON FACEBOOK https://t.co/4CgNNcvXVh,1474939908684,780580669210566656,4
58,Sugarplum0223,"I think Donald can say smart things, I just haven't heard them but Hillary Clinton is very smart #debates @HillaryClinton @realDonaldTrump",1474939908784,780580669630054401,1
59,StopWhiningASAP,Really??? You are dumb....And apparently already had your mind made up? https://t.co/2VpxVqmhiC,1474939908609,780580668896149504,1
60,Max_Shields,"The crazy thing is that I'm not even a Clinton supporter, but this is ridiculous. #Debates",1474939908695,780580669256761345,3
61,jhoffmanwy,#HillaryClinton is brilliant but can't argue reality against someone who makes up statistics on the fly.  #Debates,1474939908789,780580669650894848,4
62,folklore_adam,Dear Donald: there is no better evidence of politicians' bad decisions than your presence on stage. #debates,1474939908667,780580669139419136,1
63,Kmharte,Obama is going to a golf course for the rest of his life..and this is supposed to talk about the burden ok... #debates,1474939908909,780580670154219521,0
64,LeDonnePrime,"Trumptonight is like an old vinyl record skip, *sniff - skip, *sniff - skip. Repeat. Repeat. #debatenight #debates #Debates2016",1474939908797,780580669684649990,1
65,RGC3,Trump is entirely lacking in substance. He is a human bumper sticker. #debates #debatescst,1474939909695,780580673451012096,1
66,HGTomato,"What woman didn't have to, at some point, deal w a screaming bully like #Trump. (I quit a job once due to such a bully.) #debates",1474939909711,780580673518055424,1
67,drhampel1,YOU GET A SUBSIDY! YOU GET A SUBSIDY! EVERYONE GETS A SUBSIDY!!!! #debates,1474939909715,780580673534865408,4
68,Juicerman778,#Debates He's an insider!,1474939909614,780580673111199745,4
69,Morgan_Smiley7,Only way I can get through this #debates https://t.co/0XQFFHpd6R,1474939909228,780580671492268032,4
70,shiraz,"😂😂😂 #debates 
@HillaryClinton on 🔥 https://t.co/onH9RShOVr",1474939909635,780580673199321089,4
71,KittyLionHeart,"High school never ends, indeed. I'm expecting Trump to start snapping his fingers and flipping his god-awful hair. #Debates",1474939909606,780580673077719040,1
72,GeekyGeekyWays,Trump has literally turned into Free Waterfall Jr. from #Futurama. #ShutUpShutUpShutUp #Debates #DebateNight https://t.co/HdLLYWpvnm,1474939909389,780580672167514112,3
73,taylorcrumpton,what about low-income people in America? homeless people in America? disabled people in America? refugees in America? #debates,1474939909628,780580673169993730,1
74,crosbv,#debates get cancer niggas,1474939909819,780580673971027968,3
75,VApoliticalnerd,Wait... this is a bubble? I thought the economy is the worst? It can't be both! A bubble implies it's at a high! #debates #debatenight,1474939909712,780580673522458624,1
76,cutiecolleen_,THEY JUST KEEP INSULTING EACH OTHER THIS IS SO FUNNY #debates,1474939909821,780580673979494400,4
77,samanthagogarty,i want to smack him https://t.co/JT9UWnTF9x,1474939909569,780580672922587136,4
78,oliviapadale,1 rule drink everytime Trump makes this gesture. #debatenight  #Debates2016 #debates https://t.co/L6Guf9DfcF,1474939909363,780580672058589184,4
79,eJx39E3J6QxzAo2,생중계 감사합니다.~~ #Debates,1474939910694,780580677641080833,1
80,SarcasmusVox,#DonaldTrump shut the fuck up!  #debates,1474939910702,780580677674676228,3
81,TheRealJMod,Exactly. Just bickering! https://t.co/xbB6eunY4R,1474939910547,780580677024493571,4
82,Brian_RS,"""You have NO PLAN!""
*Clinton lays out plan*
""Typical politician! All talk!""

Hillary, patron saint of patience
#debates",1474939910682,780580677590712320,3
83,donnaleecbc,Following #debates on Twitter while running on a treadmill is proving to be not as hard as I had expected. #Multitasking,1474939910547,780580677024645120,1
84,JPManring,#Trump keeps drinking he's gonna have to pee like a #RussianRaceHorse #Debates,1474939910681,780580677586677760,3
85,davidchicks,#debates obama on the golf course????? How many slanders can he throw?,1474939910730,780580677792129025,0
86,RaedAlonazi,"ترامب جلد هيلاري بصراحة
تابعت له بعض المقابلات مابينت انه متحدث جيد
بالعكس بينت انه عاهه لكن خبيث
اعتقد أنه مذاكر صح للمناظره
 #Debates",1474939910698,780580677657980929,4
87,Kveldulf5,"#Trump may appear overly aggressive, #Clinton is coming off as snide and condescending. #HofDebate16 #debatenight #debates #Debates2016",1474939910722,780580677758648320,4
88,loveliferob,"Trump is that bf that says ""I only did it cause you made me mad"" always pointing 👇🏾 #debates  No facts or ownership https://t.co/F8H3SRgpDq",1474939910547,780580677024612352,0
89,maura_annette,"#Debates Hillary, tus reglamentaciones son un desastre: Trump https://t.co/gj4qxHogP4",1474939910670,780580677540573184,1
90,g0m,Probably the most shocking moment from the #debates so far tonight: &gt; https://t.co/cETIMXsS99 &lt;click #debatenight #debates,1474939910577,780580677150449667,3
91,myangelsman09,"Imagine if @Berniesanders were the one on that stage right now. #debates Trump has nothing, but Hillary is chasing her tail.",1474939910637,780580677402132480,3
92,truthnsarcasm,Interesting. @realDonaldTrump calls @HillaryClinton Sec Clinton yet she calls him Donald. No respect. #debates #debatenight,1474939910704,780580677683187713,1
93,maryjanay_,"If they aren't trying to make college COMPLETELY FREE, I'm not listening #Debates I'm tired of going broke trying to achieve my goals",1474939910821,780580678173732869,1
94,lilsquishypig,"I'm going to poop every time he says ""Believe me"". Oh, there I go again. #debatenight #debates",1474939910782,780580678010335232,0
95,Emi__Marie,Trump is a big fat ugly bubble #Debates,1474939910783,780580678014476288,1
96,Elenacruz,What are the bad things? Please elaborate. #debatenight #debates,1474939910857,780580678324727808,3
97,andrebarona,Lots of hate being spewed #debates,1474939910767,780580677947359232,3
98,9ecd3eb8397544a,"Donald you have no plan if so tell us your plan 
He's melting right in front of us #Debates",1474939911665,780580681713848321,3
99,Jefferson_Locke,"That's his first two ""Believe Mes of the night.  LIke the conspiranoia regarding the Fed. #debates #Debates2016",1474939911678,780580681768468483,3
100,Dominicano227,Trumpt up trumpt down the billionare blamer #theblamegame #Debates2016 https://t.co/EHTjUXiriu,1474939911599,780580681436966912,4
101,shannoncont,he has no plan... #debatenight #Debates2016 #debates,1474939911760,780580682112258048,3
102,PROstrengthWord,"WTH hell is @LesterHoltNBC doing? HE SUCKS!! He's allowing trump to interupt,lie,and take control of everything! Come on LESTER #Debates",1474939911668,780580681726431233,3
103,hesmarius,"will be watching this later when I get home

so excited for these two just fuck the shit out of each other

#debatenight #debates",1474939911743,780580682040946689,3
104,OhhKayAlright,"Does Trump even know that Hillary was not the president before???
#debates #Debates2016",1474939911751,780580682074513409,3
105,Gatorman126,"Top-down economics cannot work in this current economic climate. 
And where are Trumps tax returns. #debates",1474939911739,780580682024136704,2
106,JeskaD,Bring on the tax returns Lester!! #debates,1474939911678,780580681768251392,2
107,JakesLipbalm,A big fat ugly bubble. Trump saw his own reflection #debates,1474939911667,780580681722294273,1
108,honhonbaguettes,"""Political things"" #debatenight #debates",1474939911810,780580682322026496,3
109,DeniseDBailin,Cookie Monster votes too! #debates https://t.co/PlZ5LDyJEV,1474939911535,780580681168613377,4
110,kevinisrael_nj,Now he's calling bubbles fat and ugly! He's gonna hear some shit from the bubble lobby tomorrow. #Debates #DebateNight,1474939911826,780580682389008384,1
111,LylaRenne,I miss Joan Rivers. #Debates,1474939911852,780580682498121728,3
112,djbattleshipp,Truth https://t.co/ZRBfwmpLoW,1474939911853,780580682502254592,4
113,FTSFH4EVER,That really just happened. https://t.co/3rueuAIPTY,1474939911679,780580681772564480,4
114,SkotOgden,#debates. 'Big fat ugly bubble'?? #trumpsFace #disaster,1474939912523,780580685312581632,1
115,Val_RN,❤️😭 https://t.co/hqLqJnAoka,1474939912501,780580685220282369,4
116,Pumx,#NW #debates #debatenight,1474939912726,780580686163959808,3
117,ArrayFPS,"uh oh, he brought up Janet. #Debates",1474939912699,780580686050627584,1
118,kellycat1,Clintons death grin smile..disgusting  #debates,1474939912694,780580686029787136,0
119,bethrevis,"HRC team is posting facts, DJT team is deleting lies. Not the same thing. Pick your candidate. #debates https://t.co/7nLE53mdP7",1474939912612,780580685685882881,1
120,DesiBoilermaker,Hahahaha.  Trump don't try to change the topic. #Debates,1474939912616,780580685702651904,4
121,SynAlexander,"Retweeted Tyler Gildin (@TylerGildin):

Lester Holt right now... #debates https://t.co/MZ600ldjvm https://t.co/rV1Mh1aePA",1474939912674,780580685945987076,4
122,dana_christine,"If I were this moderator, I would just get up and leave. They don't care about what he says #Debates",1474939912752,780580686273056768,0
123,SamBonney_,"""...hasn't worked."" They just straight up misquoted her lol. https://t.co/tZH3AhFz5o",1474939912734,780580686197514240,4
124,Apvches,"""Awfully careful"" #debates",1474939912796,780580686457544705,4
125,elvis___13,#debates trump you already have your turn come on let Hillary talk,1474939912783,780580686403166209,1
126,AliBranwen,"WTF? #Debates
Can he hear a word other than his own thoughts, and will Lester Holt shut him the f*^# up while HIllary Clinton is speaking?",1474939912801,780580686478454785,3
127,nievesj,"Trump: ""Believe me, with the facts I pull out of my ass"" #Debates",1474939912835,780580686621122560,3
128,catdilly,Rip Lester 2k16 #Debates,1474939913670,780580690123370496,0
129,KristiKay3,"I just told @nbcwashington who I think is winning. Cast your vote now! #Debates #NBC4DC
https://t.co/dPZpYOt1QO",1474939913559,780580689657860096,4
130,BigDaddyLiyeah,Donald Trump makes my Stomach hurt #Debates,1474939912795,780580686453497857,3
131,BossHonan,#debatenight #debates https://t.co/Bbhy1mT7NA,1474939913133,780580687871172610,4
132,jsun187,Get 'em Lester! #debates,1474939913073,780580687619424257,1
133,assbutt_221B,"@realDonaldTrump is just throwing himself a big old tantrum, isn't he? What about your bad decisions? Remember your bankruptcies? 😂 #debates",1474939913556,780580689645273088,1
134,Quakes98,Wondo is better than Pulisic will ever be #Debates,1474939913717,780580690320502784,3
135,blurayjunkies,Continually interrupting the host is extremely rude and unprofessional    #Debates,1474939913744,780580690433748992,3
136,KDapore,Hillary Clinton responding to Trump's attacks in a nutshell #debates https://t.co/3rA8LPSKmf,1474939913253,780580688374431746,3
137,stephen_damm,Times we tried slashing taxes for the wealthy: 1920s. Led to the Great Depression. #debates,1474939913631,780580689959936000,0
138,DWidenor,"Trump: She has her plan on how to beat ISIS on her WEBSITE!!!
Clinton: At least I have a plan.  #Debates https://t.co/2J9MQGGtWh",1474939913389,780580688944697345,3
139,Chats_w_Siri,HOLY SHIT! We need @jerryspringer to moderate. #Debates2016 #debatenight #debates,1474939913664,780580690098282496,4
140,Attacking_Zach,You know what these #Debates  need? A mic switch so that the moderators can mute either candidates mic when they talk over each other,1474939912871,780580686772264960,1
141,KiriCallaghan,"What exactly has been YOUR action for the economy, sir? EVEN YOUR CAMPAIGN HATS ARE MADE IN CHINA! #debates",1474939913657,780580690068774912,1
142,DanielJoseph75,Actually agree with DT on the fed issues 😬 #Debates,1474939913577,780580689733353472,3
143,birdisthewyrd,Oh Lester w/ the tax returns #Debates #debatenight,1474939913723,780580690345668612,2
144,a_tuts,Oooo that little smirk. Queen #debates,1474939913660,780580690081484801,1
145,GrampianHilandr,"Trump the bad parent: He's flaunted his relationship before sons with the ""queen of porn"" Jenna Jameson #debates https://t.co/MEvLkdyjSz",1474939913717,780580690320470017,1
146,SupaScoopa_,#JillNotHill #NeverHillary #NeverTrump #OccupyTheDebates #OpenDebates #DebateNight #Debates https://t.co/DPvyLLzWRf,1474939913736,780580690400190464,4
147,Kapril_Doll,Trump we gone need those returns... #debates,1474939913711,780580690295398400,2
148,vanessacdeaver,can't wait for Obama to sarcastically golf everyday #debates,1474939913714,780580690308001792,0
149,DeadlyRave,Trump talking like he's reading a high school kids rough draft essay #Debates,1474939914688,780580694393171968,1
150,jennifershockey,Did Donald just say I'm a big fat ugly bubble?  #Debates,1474939914594,780580693998915586,1
151,marycornish4961,"WATCH: ""Donald I know you live in your own reality."" HillaryClinton to realDonaldTrump on NAFTA. #Debates  https://t.co/1Po2m8Tonn",1474939914534,780580693747302400,4
152,kLockitt7,Trump the only thing big and fat here tonight is you. #debates https://t.co/JodMKEJaIU,1474939914458,780580693428559872,1
153,AndyOwens85,Mr. Trump: please ever refer to a woman as This [insert name] #Debates,1474939914662,780580694284206084,3
154,mikejohns_,Yep! On both sides. Defense and entitlement. https://t.co/E5eOZ6Akfy,1474939914694,780580694418268161,4
155,Jtalryan,Good line #debates #gapol https://t.co/d6qB73l1s9,1474939914527,780580693717970944,4
156,Nicole80017,"Oh, his tax returns! #debates",1474939914719,780580694523154437,2
157,ZPGIFs,Pass that shit bruh #debatenight #debates #Debates2016 https://t.co/Rv94yxTyly,1474939914343,780580692946251776,4
158,Justin_McGrath1,"Dear Americans, 

To quote my boys @Metallica ""We're so fucked, shit out of luck. Hardwired to self-destruct""

#debates",1474939914697,780580694431006720,3
159,daddy_matt_dogg,Did Donald just call out the Fed?😍 #debates,1474939914784,780580694795747328,3
160,Dani_James22,"Did Donald just describe himself? ""Typical politician. All talk no action."" #debates  #debatenight",1474939914721,780580694531510272,3
161,berkfran,Improving economy with Obama after Bush devastation. #Debates #Debates2016 https://t.co/1ElpsvgNyg,1474939914197,780580692333846529,4
162,spnbarnes,@mishacollins https://t.co/vu27N83GJY,1474939914668,780580694309253120,4
163,MarthaEkdahl,Companies like Trump's benefit less from low taxes and more from regulations that keep competition out. https://t.co/CJ9MPO3smi #debates,1474939914717,780580694514728960,0
164,LebroJenkins,Which one is going to start just holding their breath until they get their way? #Debates,1474939914868,780580695148142592,1
165,Flickrj316,"Watch live! ""U.S. Presidential Debates"" #Debates https://t.co/6it2BOCRgc",1474939914729,780580694565134337,4
166,admorris05662,I hope Lester takes control of this debate.  #debates,1474939914833,780580695001432065,3
167,asj519,"@POTUS Trump tagged you in, I need you to let the chopper of insults fly... #Debates",1474939915684,780580698570665984,1
168,erod72erod,#sniffletrump #Debates,1474939915684,780580698570657792,1
169,JenniferSpaw,"Rude, arrogant asshat. #Debates #Debates2016",1474939915656,780580698453270528,3
170,delane,Trump really needs to stop disrespecting @POTUS. Show some respect. #debates,1474939915616,780580698285637632,1
171,MollyJongFast,#Debates https://t.co/YUK8bH3TPg,1474939915458,780580697622900736,4
172,Zaira_Ro,"@realDonaldTrump  está haciendo las mismas promesas que @EPN así que ""aguas"" #debates",1474939915693,780580698608369665,1
173,Juanpi88,Valiendo verga nivel Trump. @Ro_ChavezT @JosimarLS @Torrado0488 https://t.co/rkmj0uACCN,1474939915468,780580697664655361,3
174,ashleyrebekkah,"So why did you support her in 2008? Not a sheep, know you're in this for money #Debates",1474939915673,780580698524622849,3
175,Darren32895836,#debatenight #debates #debates2016 More political then Crooked Hillary Clinton???? WOAHHHHHH,1474939915740,780580698805538817,3
176,YeseniaSparkles,Did trump really just say the fed is doing political things? Well...yeah...thats what federal government does... #Debates,1474939915709,780580698675707904,3
177,fonziejwells,Somebody want to tell the audience @ the #debates that this isn't a stand up comedy show?  Do they know it's not #AGT ? 🤔,1474939915694,780580698612576256,1
178,TheeGrimR,Oh my god. #Debates,1474939915651,780580698432368640,1
179,drgrrlfriend,"Seriously, the moderators need to have a kill switch for the microphones at these #debates",1474939915711,780580698683998209,1
180,ChrisWHarding,#debates crush her Donald!!!,1474939915719,780580698717429761,4
181,RubelliteFae,.@wikileaks All 4 candidates answer the #debates #Debates2016 #debate #debatenight questions @ https://t.co/wYUy5RrcUp Check it out!,1474939915723,780580698734276608,4
182,the_hidebehind,@HillaryClinton We will need more than the anemic policies put forward under the last administration to confront climate change. #debates,1474939915668,780580698503667713,4
183,RjliiiRuss,"That's what bullies do. The one that is the loudest and rudest, wins. https://t.co/xWF3O6pwlp",1474939915766,780580698914709505,4
184,graceishuman,"Trump: ""We are in a big, fat, ugly bubble…and we have a Fed that's doing political things…this Janet Yellen.""

I can't #debates",1474939915694,780580698612723712,1
185,GastonOlvera,We are in a big fat ugly bubble.  - Trump #Debates,1474939915849,780580699262726144,1
186,nursewanderer,Hilary Clinton is showing her Queen Cersei smize here. #Debates,1474939916583,780580702341431297,3
187,alvarohiguero,#DebateS somebody is already crumbling under pressure @realDonaldTrump,1474939916477,780580701896863749,1
188,RealTimeBenny,"The only big, fat, ugly bubble is that thing on @realDonaldTrump's shoulders he calls a head. #debatenight #debates #Debates2016",1474939916580,780580702328803329,1
189,SheharyarQuadri,TAX RETURN #Debates,1474939916586,780580702354018304,2
190,Animefreak90,"#debates ""Politians, all talk, no action "" So he is describing himself.",1474939916754,780580703058526209,1
191,SuperDook,"""The Fed is doing political."" #debatenight #debates https://t.co/QiSHOD1L2J",1474939916548,780580702194544641,3
192,fireofphoenix90,"Hillary is smiling too hard. Lmao 
#debates",1474939916696,780580702815395840,3
193,megan_sholar,It's #bigly that both candidates support #paidfamilyleave #debatenight #debates #debates2016 https://t.co/3M806XIa1J,1474939916747,780580703029256192,4
