,screen_name,text,timestamp,tweet_id,cluster_pred
398,vobertretter,YES HILLARY DRAG HIM #recession #debates,1474938988803,780576810950008832,1
399,DrMott87,"""I move away from the mic to breathe in"" #Debates",1474938988570,780576809972822016,1
400,RichiUnlimited,I should take a shot every time Trump says Mexico #debates,1474938988747,780576810715275264,2
401,TUSK81,"He's already getting irritated. GET HIM, HILLDOG #Debates",1474938988799,780576810933161984,1
402,vanriessa,Run those receipts Hil!!!!  #Debates,1474938988781,780576810857861120,2
403,PresidentCuffie,"me: I need financial aid
FAFSA: here's a very small loan...
me: !!!!!
FAFSA: ...of $0.01 
me: #thanksTrump 
#debates",1474938988713,780576810572587008,1
404,_tSUEnami,He never do! smh https://t.co/X311BZnSSw,1474938988741,780576810690043905,1
405,NoConscious_,I agree companies wanna leave tax they ass wtf listen people!!!!!!!! #Debates,1474938988712,780576810568331264,0
406,BenBrodyDC,"Holt asks how Trump stops companies from leaving: ""We can stop them from leaving. You have to stop them from leaving."" #debates",1474938988313,780576808894857218,0
407,Anna_Jewell,That's called business by the way #debates,1474938988665,780576810371194881,2
408,jeweul,Hm atleast Hillary is articulate  #Debates,1474938988784,780576810870407169,1
409,j_julius19,Elite @TwitterMoments all night https://t.co/26UaoNvS55,1474938988743,780576810698354688,1
410,Alispock,This debate is just... Too much show non of them has stablished a clear solution to the issue  #Debates https://t.co/sqTWaUlpGE,1474938988599,780576810094456832,1
411,acpisme,"@realDonaldTrump A plan.  Now to Clinton ""remember 8 years ago""..no plan? Nope. #debates",1474938988879,780576811268714496,2
412,BlairInRevolt,"""Is Trump posing time-travel?"" -fiancee #debates",1474938988872,780576811239501824,2
413,EmmadArif,"Trump says China is taking our jobs. True.
#MadeInChina #debatenight #debates #Debates2016 https://t.co/fiBqlfW7lV",1474938988700,780576810518142977,0
414,Nate_Allbomb,I want one of those small loans that Trump was on the receiving end of.  #debates #debatenight,1474938988908,780576811390341121,2
415,fvicentedasilva,Trump is a bigger ass than @KimKardashian's #debates,1474938988810,780576810979454976,2
416,JordanDShort,"Rumble in the Jungle (in this statement ""Jungle"" = ""America"")

#debates https://t.co/GSTNaEC8xO",1474938988097,780576807988916224,1
417,Lordofgotham,Quiero ver el muro #Debates,1474938988798,780576810929008640,1
418,TomTauchert,"If #Hillary was sniffling this much, they'd call an ambulance #debatenight #debates #Debates2016 #Trump #Sniffles #SnifflingDonald",1474938988855,780576811168268288,0
419,theNiaLangley,"Including Trump's businesses. Boop.
#DebateNight #Debates https://t.co/Op6IKeTa87",1474938988901,780576811361013760,0
420,IvyZied,the incoherent cheese puff sure does flap his tiny hands a lot #Debates,1474938989555,780576814104064000,1
421,EricLSchwartz,"""That's called Business"" Oooof. #debatenight #debates #Debates2016",1474938989646,780576814485737472,0
422,jfharris_Comedy,Donald Trump sniffles sounds like he is real up set his girlfriend just broke up with him for China. #debates,1474938989745,780576814900981760,2
423,msherryflax,Trump showing how effective Republicans could be on trade if they weren't shackled to their donor class. Scary. #OAPolitics #debates,1474938989589,780576814246817792,1
424,GoldsteinStreet,#trump appears nervous. Speaking really quick when pushed. #debatenight #Debates2016 #debates,1474938989801,780576815135854592,0
425,J22Jordan,lmaooooooo https://t.co/DEWsc2F0pc,1474938989688,780576814661902336,1
426,sorryity,Wow hillaryyyy wowww someone who's talking about who said what in the past...ok #Debates,1474938989685,780576814649446401,1
427,iiaannrreeeedd,Oh thank God he's being weird and interrupting the moderator. I was so afraid he'd look coherent! #Debates,1474938989765,780576814984945664,1
428,bwmurf2,What the hell is trump doing? Scratching his legs or something? #Debates,1474938989729,780576814834020352,2
429,Concerned002,#Debates  Yeah and your spouse created housing bubble,1474938989790,780576815089721344,1
430,liamjplover,"Aposto que as comidas favoritas do Trump são nachos, tacos e burritos #Debates #debatenight",1474938989750,780576814922141696,0
431,Sourc_Ed,Is it just me or is no one answering the question  #Debates,1474938989718,780576814787952640,2
432,TawneeKendall,Are they intentionally keeping Trump's hands off screen? #debates #debatenight #drafthousedebates,1474938989867,780576815412674560,2
433,loser_domi,Nobody has any idea what that Trump bit was about. #debates,1474938989760,780576814964043778,2
434,gideonstein,What's the deal with the #Trumpsniffle? #debates,1474938989667,780576814573813761,1
435,jacksfilms,"MR. TRUMP YOU WAIT YOUR TURN 
#debates",1474938989917,780576815622463489,2
436,Joeldiaz072175,His on the edge he drank first  #Debates,1474938989917,780576815622397952,1
437,rebelatl2000,#Debates oh oh blame Bush here it comes,1474938989704,780576814729232385,2
438,aldenpeters,First interruption. Drink! #debates,1474938989573,780576814179749888,2
439,zaaaacck,"""that's called business by the way"" i'm #debates",1474938990674,780576818797486081,2
440,Lindsey42530579,"companies are not leaving the us , the US does not want to pay what we should be paying in order for people to work here  #debates",1474938990699,780576818902421504,2
441,Tu_Critico,"#Debates
#Trump is clearly winning this debate. #Clinton has no idea about bussiness.",1474938990655,780576818717876225,2
442,putupjob,#debates #debates2016 trump looks terrific.... clinton looks spaced out... is she on meds?,1474938990690,780576818864726016,0
443,originalpoedog,"are they rapists or are they taking our jobs? I'm confused...
  #Debates",1474938990693,780576818877259777,0
444,SebasVandy,@annmarieklotz clearly treating women with dignity and respect regularly isn't on his agenda #debates #nevertrump,1474938990459,780576817895710720,0
445,Chey758,This should be entertaining  #debates,1474938990804,780576819342737408,2
446,jillian_new,Can they pause and let Trump blow his damn nose or something?? I can't hear anything through his sniffles #debates #debatenight,1474938990796,780576819309268992,2
447,stascurrier,Wow. Talk about mastering the art of evading direct questions. #debates,1474938990678,780576818814455808,1
448,misterbozz,"So, he can't bring the jobs back... #Debates",1474938990775,780576819221180417,0
449,giulianarambo,hmmmmmmmmm vou flr p ela https://t.co/pL3AaoZEhc,1474938990689,780576818860584964,1
450,jmleclerc76,#Debates if I'm part Chinese and part Mexican which country will you deport me to The Don,1474938990840,780576819493769217,2
451,AidanBaker20,"Hillary wears red, Donald wears blue, WHAT IS THIS MADNESS!? #debates",1474938990635,780576818634129408,1
452,marcylauren,Thank you I think so too! https://t.co/0yu6pC37pT,1474938990720,780576818990452736,1
453,JTNFiveCities,Trump rn #debates https://t.co/vV3CAJPK1i,1474938990713,780576818961055744,1
454,giggitygreg,"Wait, did Trump just speak in a complete sentence? Oh fuck #Debates",1474938990774,780576819217108992,2
455,ANWRealtor,@realDonaldTreald we can stop them from leaving... so we stop them from leaving.. how?! #Debates,1474938990865,780576819598729216,0
456,motoraderGP,Ya think! https://t.co/tIA9yzStGZ,1474938990705,780576818927722496,1
457,sparkette57,"#SheWon,
#HillaryClinton #Debates",1474938990294,780576817203687424,1
458,amyreedfiction,"The Donald rooted for the housing crisis. ""That's called business,"" he says. #debates",1474938990648,780576818688565248,2
459,realjennycash,Donald Trump is sniffing. HE IS LYING ABOUT HIS HEALTH. I would know; I took a biology class once. #debates,1474938990946,780576819938332674,2
460,PubliusDB,"The Politicians: The Art of the Deal, Part Deux, by Donald J Trump #debates",1474938990522,780576818160173056,2
461,mymyoomy,A skittle for every time Trump sniffs #debates,1474938990972,780576820047540224,2
462,thatfiresatire,HRC is going in #debates,1474938991686,780576823042150400,0
463,KDonars,Trump  -why is all your campaign promotional material manufactured in China? #Debates,1474938991660,780576822933139460,2
464,Kaykrae,"I don't like either of them, but Hillary is slaying this debate tbh. #debates",1474938991671,780576822979276800,1
465,zeereactor,"Trump is missing the question, but he is making a very good point #Debates",1474938991552,780576822480240640,2
466,freestylebit,I feel like I'm watching the Wolf of Wall Street.  Small loan? #debates,1474938991619,780576822761259008,1
467,__KRISTOFFER__,Love the way you lie @realdonaldtrump &amp;amp; @hillaryclinton. #USDebate #Debates #NoVoteForYou,1474938991476,780576822161444864,1
468,Lauren_Fettah,"Lester Holt: ""Back to the question.""
Trump: ""Mexico. China. Mexico. China.""
Holt: ""But the question..""
Trump: ""Yes, but Mexico...""
#debates",1474938991609,780576822719381504,2
469,MrHollywood77,😂😂😂😂😂😂😂😂......I was thinking the same https://t.co/9lREddpmey,1474938991554,780576822488621057,1
470,desertflyer,Is @realDonaldTrump healthy enough? Sniffing is a sign of some major illnesses. Have we seen his long form health certificate? #debates,1474938991702,780576823109222400,0
471,dandebuf,#democracysausage #imwithher #debates #debates2016 🌭🇺🇸🌭🇺🇸🌭🇺🇸🌭🇺🇸 https://t.co/FXHIbxS8bQ,1474938991620,780576822765445120,0
472,frankingeneral,"First major Trump mistake, interrupting Hillary. Bad look. #debatenight #debates #debate",1474938991659,780576822929059841,1
473,NoMoreTeaForMe,"What the hell? He's not answering w/policy ideas, just selling his doom &amp; gloom. And what's w/that awful CONSTANT sniffing Trump? #debates",1474938991510,780576822303920129,2
474,lostdogs20,Donald sounds like he has a cold or a dope nose.  #debates #MSNBC,1474938991777,780576823423885314,2
475,MaiLinhsTweets,I don't think I've ever been more conscious of another human's breathing than @realDonaldTrump's tonight #debatenight  #debates,1474938991762,780576823360917505,0
476,Valenamory,Trump mucha queja y no responde a la pregunta #debates,1474938991764,780576823369498624,2
477,ctelleen,Did anyone else see Trump's hand shaking when he drank that water. #debates,1474938991717,780576823172366336,2
478,erikheller,Trump is *sniffle* pretty sniffly tonight *sniffle* for the *sniffle* #debates #debatenight,1474938991804,780576823537086464,2
479,omotakway,"Wait, our cookies companies are moving to China? I'm not aware of this #debates",1474938991812,780576823570604032,1
480,SamPasternack,Trump is sniffling so much because he doesn't believe in the legalization of neti pot. #debatenight #debates,1474938991795,780576823499522049,0
481,ErickFernandez,"Holt: ""How do you, specifically, bring the jobs back."" 
Trump: ""Well, first of all, you don't let them leave.""… https://t.co/Hb3Z1o9cUy",1474938991631,780576822811557889,0
482,Activist777mg,Clinton is wrak. Trump kerps talking about China taking jobs yet he does business with China. Why wont she jump on it? Weak ass! #Debates,1474938992658,780576827119136768,2
483,That_Surrealist,Hillary hoped and aided in Lybia collapse #Debates,1474938992646,780576827068837888,1
484,willfelt,How do you stop companies from leaving Donald?He's going to abolish the minimum wage so companies can pay us pennies #debates,1474938992690,780576827253268481,0
485,thebrokenbox,cant stand these stupid ads Clinton is posting during this debate to the live stream #Debates,1474938992681,780576827215667200,0
486,simplymarcoo,@EdGlavin #debates #debatenight I'm with you Ed fall the right reasons NOT to Vote trump strong video  https://t.co/PPyr9vk28W via @INQLIFE,1474938992715,780576827358060548,2
487,kchrystler,"On the split screen, the words behind the candidates are very distracting, IMO. #debates https://t.co/WjUbaCqkax",1474938992573,780576826762469376,1
488,CarolWalden,#MANSPLAIN NUMBER 1  @HillaryClinton @realDonaldTrump #debatenight #debates #Debates2016 #ImWithHer,1474938992708,780576827328778240,0
489,ninoletigre,"Tht was outrageously rude. And genius. The right will never see thru the sugar coating of false niceties ""I want you to be happy"" #debates",1474938992734,780576827437899777,2
490,YorkVol,Congress created the recession when Hillary was a senator #Debates,1474938992748,780576827496542208,1
491,abbylpeel,Donald with the sniffles.... #Debates,1474938992804,780576827731480576,0
492,tejanochica,This thing is getting me back into twitter #Debates,1474938992742,780576827471302656,1
493,Emptydata,#debates will the libs be jumping all over #Trump 's sniffles? #debatenight,1474938992824,780576827815239681,0
494,TweeterMoses,HIllary out the gate pretty aggressive. I'm liking it #debates,1474938992897,780576828121423873,1
495,OhNowWha,..as long as you said it first!! https://t.co/umsuF2xgzV,1474938992694,780576827270172672,1
496,_ItsCrystal143,#Debates #debatenight #Clinton #fucktrump https://t.co/Bm2OQVdG3C,1474938992571,780576826754158592,0
497,DeadFey,"Business is more important than people for trump, clearly. #debates",1474938992905,780576828154978304,2
498,gwanzsz,"Donald Trump is either crying, ate chile, or is terminally ill #Debates #snifflestrump",1474938992931,780576828264112128,2
499,SuneilSMalhotra,"Trump is thirsty he's going to lose it, need h2O #debates",1474938992944,780576828318703616,1
500,someyatoshiyuki,Hillary is wearing a nice dress  #Debates,1474938992943,780576828314484736,1
501,p_moriarty72,"Trump's ""small loan"" from his father on 1975 is more than 4.5 mil today! #debatenight #debates #Hillary #dem https://t.co/q13xVdAowO",1474938993434,780576830373920769,1
502,TVibeWinter,"""If you think you're going to bring your cookies into our country..."" —Donald Trump #debates",1474938993520,780576830734630913,0
503,awkwardstickman,"Yeah! Work the ribs, Hill! #Debates",1474938993782,780576831833387008,1
504,BeLeather,@realDonaldTrump out here looking like a @whitenicious spokesperson #debatenight #Debates2016 #debates,1474938993588,780576831019880448,0
505,JoshDrayer,More I watch the #debates the more I Believe  @HillaryClinton should be in prison #Hillary4Prison,1474938993681,780576831409950720,1
506,NOLAbug38,He's getting nervous #Debates,1474938993755,780576831720206336,1
507,NeuYoRicanSoul,"#Trump beginning to be pressed is going to run out of evasive answers &amp; then comes the meltdown #TrumpHasNoPolicies #FactsHurt
#debates",1474938993618,780576831145668609,1
508,Andrew_Patrick,I wouldn't eat cookies made in China.  FWIW #debates,1474938993848,780576832110391296,1
509,aintitnifty,"honestly why does he keep sniffling, do you need a tissue donnie #debates",1474938993814,780576831967678464,1
510,kbagley1978,"How many times can one person blink , #hillaryclinton blinks more than anyone I have ever seen ! #debates #hillary",1474938993836,780576832060030976,1
511,heyjdey,#debates https://t.co/sPvcJJs7qN,1474938993808,780576831942516736,1
512,myrandaloveee,Trumps sniffles during this debate is pissing me off 🙃 #Debates,1474938993949,780576832533860352,1
513,JaxonLeeRose,"""I got a very small loan..."" 
I could do so much with one million dollars. 
Everyone should get a million dollar loan then. 
#debates",1474938993891,780576832290590720,1
514,FloridaSportz,Trumps gon get ghetto real quick! https://t.co/Uz9l8LtqeK,1474938993717,780576831560974337,1
515,janflora,OK I tried again. I need to play Bingo #Debates,1474938993716,780576831556685825,1
516,RealityRealm,"All Trump wants to talk about is Mexico,China,trade deals,lowering taxes for biz.Besides this,he has no real substance.#debatenight #debates",1474938993898,780576832320135171,2
517,Shirleeah_Pasco,"""My father gave me a small loan"" BAHAHAH BYE #debates #ImWithHer",1474938993957,780576832567537664,1
518,rbccxx,A man without a plan. A fool. #debates,1474938993991,780576832710205440,1
519,ewolffmann,"Hillary says Trump wanted financial crisis for his business success (Trump agrees, calling it ""business"") #debates",1474938994025,780576832852746240,2
520,capnjoy,She's already getting under his skin it seems to me. #debates,1474938994731,780576835813773312,2
521,Sitta_pusilla,"Hillary technically threw the first stone, ""Trump inherited millions"". Trump responds w/ condescending, ""I want you to be happy"" #debates",1474938994377,780576834329141252,2
522,johngalt191,"#HackingHillary wants you to forget about #Benghazi, never forget, vote #TrumpPence16 America needs it!… https://t.co/6PcRxNi767",1474938994512,780576834895302658,1
523,mitchdotcom,Here he goes. I'm sure Kellyanne is already turning red. #debates,1474938994772,780576835985780736,1
524,MistaDark,You gonna jail those guys who helped cause that recession #HilDawg #Debates,1474938994790,780576836061245440,1
525,BringBernieBack,"DrJillStein: We certainly need jobs. But while Clinton supported NAFTA, Trump was busy offshoring jobs. #OccupyTheDebates #debates",1474938994719,780576835763593216,0
526,ClaraKosi,Jesus fix it. #debates,1474938994721,780576835771899904,1
527,RclBD,"business: Trump's immigration views aren't 100% wrong, studies show https://t.co/i1nq8VOxpj #debates https://t.co/OPrXfwWZBM",1474938994742,780576835860099072,1
528,iBenBean,Interesting that Clinton was is wearing red and Trump is wearing blue. Conspiracy? I think yes. #Debates #debates2016 #DebateNight,1474938994742,780576835860037632,0
529,NathanSykes,This is going to be fascinating #debates,1474938994804,780576836119965697,1
530,AmbuLance,What's the #TrumpSniffing all about #debates,1474938994824,780576836203839488,2
531,JustAnotherRich,#CNNDebate #debatenight #debates Hofstra University Brian Williams #UnlikelyDebateGuests #NeverHillary #Stonetear… https://t.co/WSlKszTsbn,1474938994317,780576834077491200,1
532,leirariel450,"business is business and business must grow, despite crummies in tummies, you know #drseuss #donald #idiot #debatenight #debates",1474938994810,780576836145123328,2
533,SwissGirlinUSA,Hillary threw the first passive aggressive insult. You win 🇺🇸🇺🇸🇺🇸 @MrsGapp #debates #HillaryClinton #DonaldTrump,1474938994863,780576836367507456,1
534,KelsODonnell,I'm so happy Saturday Night Live returns this week #debates,1474938994755,780576835914596352,1
535,nsjayaram,Hillary ZING #2 #debates,1474938994883,780576836451389440,1
536,memaz985,Mansplaining. #debates,1474938994782,780576836027834368,2
537,elizabethdean82,She is so eloquent.  #ImWithHer #debates,1474938994762,780576835943952385,1
538,shonda_sowell,#Debates Yes!,1474938994851,780576836317306880,1
539,chatwithsas,Is Donald sniffling? Is he sick?  #debates,1474938994782,780576836027817984,0
540,959TheRat,"Yikes, the first presidential debate is on now &amp; all we can seem to agree on here is moooore beeeer! #debates https://t.co/2TnJsCs4rY",1474938994610,780576835306418176,1
541,AngelinaPhage,"me: ill make a smol loan
trump: a smol loan is millions of dollars hehe
#debates #debatenight",1474938994817,780576836174569474,1
542,DJLETSGO,Trump has practiced his ass off. Kudos to him. #Debates,1474938994816,780576836170506241,2
543,ntiva12,Αυτα ειναι ντιμπειτ #Debates,1474938994984,780576836874964992,1
544,moscato247,Trump has the sniffles. Doubt there will be a death watch on him 😒🤔 #debatenight #debates,1474938994974,780576836833185792,0
545,DavidJStarr,"I'm writing my dog's name on the ballot... If everyone else does the same thing, then my dog can be El Presidente!
#debatenight #debates",1474938995447,780576838817026049,2
546,KenyaMusic,@kurteichenwald BLAH&gt;&gt;&gt;BLAH.....BLAH! #trump #debatenight #debates #Debates2016,1474938995678,780576839785779200,2
547,FriendofXanders,#Debates this got me like https://t.co/LOBU9hEPdY,1474938995525,780576839144058880,1
548,alwysBEEme,""" Small loan"" lmao trump is such a joke. I wish I could get a small loan of a million dollars...  #Debates",1474938995740,780576840045895680,1
549,Elli21486,"Although I am only watching the tweets, it sounds like Trump is starting off better than Clinton in the #debates",1474938995661,780576839714603008,2
550,TheSlurryBaron,. @WarrenBuffett said making your first million is the hardest. Well...maybe not for @realDonaldTrump. #debatenight #debates #Debates2016,1474938995712,780576839928418304,0
551,benzjtweets,The Great Recession happened and Donald Trump wanted to profit off it. Disgusting. #debates #debatenight,1474938995676,780576839777525760,2
552,vnbebita,i can feel the tension cheret https://t.co/SEZ3kFzrl1,1474938995660,780576839710351360,1
553,AMC1123,"Trump isnt ""blowing"" it yet #debatenight #debates",1474938995670,780576839752376321,2
554,johnny_pineiro,"Someone wanna hook me a up with a ""small loan"" of $2 million? #debatenight #TrumpVsClinton #debates",1474938995760,780576840129712128,1
555,Anna_Vic_Maria,"Can we just throw these two chickens in a pen and whoever comes out alive is the winner
#debataenight #debates #trump #hilary",1474938995750,780576840087928833,1
556,steveHNH,"Trump took a drink. Shaking already. He's anxious because he's rambling and not making sense 0_0 

#debates",1474938995694,780576839852929027,2
557,LeScriz,"OH I KNOW THIS ONE also the crash was a result of big banks that all support you, Clinton #debates",1474938995747,780576840075345920,2
558,analicia666,BUT HOOOOOWWWW #debatenight #debates,1474938995742,780576840054403072,0
559,mrballsy,@realDonaldTrump how many times are you going to sniff in between words?? #debates @AshCantley,1474938995813,780576840352137216,0
560,ashleymarievest,Yea...but how??? @realDonaldTrump #debates he doesn't know how. Period #ImWithHer,1474938995618,780576839534346240,0
561,cokey318,"What has #Hillary done in 30 yrs other than let Americans die in #Benghazi ?
#debatenight #debates",1474938995705,780576839899095041,1
562,LiberalArtsDiva,Waiting for Donald Trump to address the issue...and he can't do it without being a xenophobe #Debates,1474938995900,780576840716984320,2
563,mezzomaude,THOUSANDS OF COOKIE COMPANIES ARE LEAVING THE US. #debate #debates #debatenight #jobs #mexico #usa #america #presdebate,1474938995831,780576840427642880,0
564,graisinbrand,"The housing crisis is called ""business""!? Really Trump? #Debates",1474938996728,780576844189868032,2
565,cokeandvodka,Oh come on Trump took the first drink of water .... There goes my Hillary Bingo #Debates,1474938996552,780576843451760640,2
566,DeAnnaCai,No one else is annoyed by the sniffing? #debatenight #debates #Debates2016 #Trump,1474938996362,780576842654900224,0
567,holgerdanske64,Quit blaming Bush! #Debates,1474938996777,780576844395327488,2
568,KGummere,HC is wearing RED (Rep color) and DT is wearing a BLUE (Dem color) tie !  What's with that ? Confusing me ! 😂#Debates,1474938996780,780576844407943169,2
569,Megson310,"#debates Trump economic policies are Trumped Up Trickle Down. He offers no specifics and lies, lies, lies. #TrumpLies",1474938996681,780576843992817664,1
570,P0LITIKZ,#debates Debate drinking game: Drink every time someone breathes,1474938996785,780576844428959746,2
571,KoriDonatsu,Picking someone to vote for this year is like picking a disease to live with for 4 years  (which one can you live  longest with) #debates,1474938996731,780576844202569728,1
572,NPeseski,Some get Donal Trump a tissue #Debates,1474938996670,780576843946663936,2
573,gmabeci14,Please pass Mr. Trump a tissue so he can quit sniffing. #debates,1474938996729,780576844194217986,2
574,superizzyy,This is cringeworthy #Debates,1474938996678,780576843980279808,1
575,Meli_InThe_City,"Yes, Hil...RECEIPTS! #ImWithHer #debates",1474938996621,780576843741224960,1
576,MtnBlossom,"Q: No, really, how do we bring back labor industries?  Trump: We stop them from leaving. #Debates",1474938996804,780576844508565504,0
577,oconnellaboo,"@kurteichenwald I think he almost called her Crooked Hillary, and he was covering. #debates",1474938996565,780576843506262016,2
578,waleed2go,We should definitely keep all the cookies in America. 🍪🍪🍪🍪🍪 #debates  #trumpvsallofus,1474938996752,780576844290588673,1
579,riseupkordei,PULL THEM RECESSION RECEIPTS BITCH #Debates,1474938996664,780576843921588225,1
580,Du_Kathy,Trump won't last he's sniffling because he is holding back #Debates,1474938996695,780576844051574784,2
581,JenKrane,Did Drumpf just do a line if Coke? #debates,1474938996835,780576844638662656,1
582,uxaio,"""Slashed taxes on the wealthy. Please forget how wealthy I was then."" #Debates",1474938996479,780576843145641986,2
583,justindublin,#debates work  bitch! https://t.co/ugpLUdjWe4,1474938996568,780576843518840832,1
584,backinstereo,Donald is shaking he's so nervous. The most human we've seen him. #debates,1474938996853,780576844714311680,2
585,richardmmill,So #trump breathes the same as an overweight pug. #debatenight #debates #2016debates,1474938996890,780576844869406720,2
586,jjauthor,Hillary’s tax the “rich” scheme is not an economic plan; it is a symbol &amp; a warning of the power of government!… https://t.co/heJenx3l5J,1474938996547,780576843430699009,1
587,fareeezy,#debates https://t.co/bnKzr5lwIv,1474938996425,780576842919084032,1
588,Metro_DK,I think Donald and has a case of the sniffles. #Debates,1474938997664,780576848115707905,1
589,kaysaysnay,Someone get that dude a nasal spray. #Debates,1474938997682,780576848191315968,1
590,NarcoReus,This shit clear as hell bruh #Debates https://t.co/4naauqgjoY,1474938997477,780576847331520515,1
591,SheilaHeadspeth,"""She's been doing this for 30 years. Why hasn't she been doing better?"" --@realDonaldTrump ""Don't let the jobs leave"" #debatenight #debates",1474938997707,780576848296091648,2
592,chevd80,"Oh, oh is @LesterHoltNBC losing control of this debate between Donald and Hilary? #Debates",1474938997735,780576848413532165,2
