,screen_name,text,timestamp,tweet_id,cluster_pred
189,edflynn,As motley as Trump is becoming verbally just wait until you read the transcripts of his verbal diarrhoea. #debates #Debates2016,1474940006768,780581080604798976,2
190,MetalHeadAden,@NectarPaola no not really i think it describes you #Debates,1474940006614,780581079958818816,2
191,lauurajh,isn't that all he's capable of https://t.co/p7Ce19IL8G,1474940006769,780581080608845824,1
192,brandon_parenti,"trump has the sentence structure and public speaking of a first grader, possibly even worse #Debates",1474940006830,780581080864661505,2
193,CoolCalmCam,"""EVERY COUNTRY IS RIPPING US OFF, LITERALLY EVERY OTHER COUNTRY, ALL OF THEM, EVEN THE ONES WE HAVEN'T HEARD OF, THE SHITTY ONES"" #debates",1474940006751,780581080533504000,2
194,ashleybolkcom,My bf is currently in a 2-hour conference call talking about tracking Australian legal market. Never been more jealous of his job #debates,1474940006842,780581080915070980,2
195,rickcamsnyder,She should just stand there and let him talk. She wins. #debates #DukeDebateWatch #Trump #,1474940006852,780581080956932098,2
196,jackiedstrause,"Amid the focus on Clinton's health issues, Trump is heard sniffling: ""I'm VERY VERY worried about Trump's health""… https://t.co/XoMPdE99KZ",1474940006844,780581080923385856,2
197,jacquirafiq,"He's an ass hole , how do people support him....wtf #Debates",1474940006810,780581080780996608,2
198,gallerdude,"Watch the #debates for the politics, stay for the great tweets",1474940007440,780581083423268864,2
199,SangHeffa,"Keep on this TAX question!

#ImWithHer #StrongerTogether

#debatenight #debates #Debates2016",1474940007702,780581084522098688,2
200,tkost78,The only thing this debate proves is the 2 party system we have is broken. #debates,1474940007710,780581084555730944,2
201,niko19945,"Also Trump redet von, laut ARD-Übersetzer, fünf Trillionen Dollar. 5000000000000000000? Viel. #debatenight #debates #tvduell",1474940007519,780581083754688512,2
202,Kimberley1222,He is such a liar.  #Debates,1474940007775,780581084828360704,2
203,LandrumAR,Trump on his #taxes #debatenight #debates #Debates2016 @realDonaldTrump https://t.co/n3oMNZby1Z,1474940007688,780581084463529984,1
204,kachristo,"Back peddling BS on why he won't release tax returns - gee, I wonder why - Audit?  Ahahahahahah.  CON. MAN. Lester just busted him! #debates",1474940007759,780581084761161728,0
205,clwriter47,"But he's not saying ""bigly."" He's saying ""big-league."" https://t.co/iV1Aaj8ugX",1474940007596,780581084077535233,1
206,JoshHarman123,Lester Holt calling out the BULLSHIT. #debates,1474940007841,780581085105102849,2
207,vivianwest805,"""Big fat ugly bubble"" says @realDonaldTrump , looking in the mirror. 
#debates https://t.co/yVaGrjYhLl",1474940007623,780581084190814208,1
208,CourtneyLundO,"I'm Republican, but there is no way, in any level of hell, I could ever vote for him. I think he needs some med. And an education. #debates",1474940007947,780581085549764609,2
209,WitchUnicorn425,You had a 'small loan' of 14 million dollars. Please. #Debates,1474940007940,780581085520343044,2
210,Belladela,Let's go Lester. #Debates,1474940007510,780581083717009413,2
211,jnelleiz,"Lester, you gonna need to jump in there and get cutthroat. You lettin this man Cheeto act up. #debates",1474940008027,780581085885272064,2
212,sab_en17,Only took 15 minutes for him to start losing his cool #debates #Debates2016,1474940008668,780581088573870085,2
213,tymadisonmom,"Oh the #Trump tax returns question, who cares about them #Debates2016 #debates #debatenight",1474940008675,780581088603217920,2
214,breebay_,Watching the  #Debates,1474940008685,780581088645091328,2
215,angelcutexD,Just vote for Lester #Debates,1474940008666,780581088565473280,2
216,TonyFoglia2,Go Trump!!!!! never easy to tell the truth.  #debates,1474940008630,780581088414531585,2
217,WLOS_13,".@HillaryClinton: By the end of the debate, ""I'm going to be blamed for everything that's ever happened"" #debates… https://t.co/Dm8PIkSHTk",1474940008472,780581087751901185,1
218,OliviaGrills1,So accurate XD https://t.co/0KWeZnnfY7,1474940008595,780581088267800579,1
219,_bxittany,The first homework I'm actually excited for #DebateNight #debates,1474940008670,780581088582180864,2
220,justXsooXrandom,@realDonaldTrump that is utter bullshit the IRS said you could release your taxes #Debates #debatenight,1474940008434,780581087592472576,0
221,Stevevillano11,"If #Trump made $694million last year, as he claims now, why did he file for the STAR Tax Rebate reserved to lower-income people? #debates",1474940008668,780581088573857794,2
222,ch3rch,Trump esto nones shark tank #Debates,1474940008763,780581088972255232,2
223,arthur_anissa,😂👏👏 https://t.co/86SExnbce8,1474940008615,780581088351649792,1
224,amandajazzmyn,"Lester just woke up 
#debatenight #debates #Debates2016",1474940008783,780581089056129024,2
225,chinaaye,IS HE BRAGGING ABOUT MAKING $694 MILLION DOLLARS IN FRONT AMERICA AS WE DISCUSS DEBT #debates,1474940008846,780581089320370177,1
226,LizLizzerd,THE IRS SAYS YOU'RE FREE TO RELEASE THEM. WHERE THEY AT TRUMP? #debates,1474940008794,780581089102487552,0
227,Sil_Lai,Trump is babbling #Debates,1474940008748,780581088909459456,2
228,lovelywolfrp,694 MILLION ? NO AND LIAR @realDonaldTrump #debatenight #debates,1474940008735,780581088854892544,2
229,BoxTar9215,The Audit is bullshit. He's using it as a cover to keep his taxes hidden. Its pathetic. The FBI themselves debunked it. FFS. #debates,1474940009660,780581092734607360,0
230,ronebear,"Lester, why interrupt Trump and not Killary? #debates",1474940009524,780581092164145157,2
231,ThisDaveHere,Trump is playing the fear card heavily. Will it work? #thisdavehere #Debates,1474940009571,780581092361441281,2
232,TJohanesson,"""You can release them while you're being audited.""
""I'll release them after."" #wtf?????? #debates",1474940009535,780581092210438153,0
233,amandade,"Hillary, dont engage him in the garbage. Donald, it's not your two minutes. Youre an adult they shouldnt have to tell you 3 times. #debates",1474940009524,780581092164263936,2
234,illeominate,I cant believe im watching this.. #Debates,1474940009715,780581092965376001,2
235,AaronsMichaels,"""I don't need to release my forms, I'll just tell you and you can trust my word"" -@realDonaldTrump #debates #debatenight #ImWithHer",1474940009618,780581092558573568,0
236,barsedo58,@LesterHoltNBC you need to get this under control!!! #Debates,1474940009663,780581092747194368,2
237,aliciaabney,"Oh, and Trump needs to understand how terrible his tax plan is for the middle class. #debates",1474940009587,780581092428513282,2
238,BenPowless,Trump trying to impress and distract people by revealing how much money he makes. #debatenight #debates https://t.co/khhpsp3QQQ,1474940009253,780581091027644418,1
239,M7MDWorld,@Nedal_147 😂👇🏼 https://t.co/vvNiAwt2pq,1474940009670,780581092776697858,1
240,ZachsMind,Friendly reminder: #LoserDonald told Dr. Oz he exercises by making hand gestures. #Debates2016 #debatenight #debates,1474940009698,780581092893929472,1
241,markomalley,@CassandraRules Gee I thought  Lester was supposed to be a good guy and neutral? #debates,1474940009688,780581092852105217,2
242,MagnaCarty,You've been under that audit FOREVER #Trump #Debates,1474940009816,780581093388984321,0
243,farmagoo,#debates https://t.co/aCyFEpFeiH,1474940009419,780581091723743232,1
244,dayo1946,Clinton put it in motion. Bush let it sit. https://t.co/7REOmrn3zz,1474940009801,780581093325934593,1
245,MrsMomMarshall,Even @DonaldTrump can't follow what Donald Trump is saying #debates #Debates2016 #ImWithHer #BforHillary,1474940009775,780581093216968704,2
246,WaynesDunn,who cares how many pages your forms are? wasn't everyone complaining how long the ACA was?  #Debates,1474940009867,780581093602840576,2
247,Glioness1,IRS says that should not stop you #Debates,1474940009768,780581093187653632,2
248,emilyyannallenn,😂 #sotrue #debates https://t.co/Mxr3UztC8m,1474940009796,780581093305032704,1
249,totallynotsarah,Should you be proud of being under audit for 15 years? Cuz I feel like that's not a good thing... #debates,1474940009813,780581093376462852,0
250,MaskedRiderLax,@realDonaldTrump @HillaryClinton @HeatherNauert #debatenight #debates...welcome to the circus,1474940009882,780581093665677312,1
251,karencantu28,La neta!! https://t.co/hAXtAcBCKT,1474940010655,780581096907866112,1
252,LivingOnChi,"Jill:""Full employment through a #GreenNewDeal is the best way to create millions of secure, living-wage jobs. #OccupyTheDebates #debates""- …",1474940010636,780581096828338177,2
253,solveigrennan,"""America sucks you should all think more like me"" -Trump #debates",1474940010616,780581096744325120,2
254,COVegMama,"I'm so confused how this man is even still in the running. How is this possible?!? He's such a huge, lying, orange, angry mess. #debates",1474940010682,780581097021149184,2
255,DarrenAndSandy,She's loving it  #Debates,1474940010666,780581096954011648,2
256,RealIzedrep,Tax the daylights out of them so that they flee the country in droves https://t.co/mwoxfT1kBw,1474940010555,780581096488591361,2
257,SuperstarLloyd,Trump to Clinton: “I want you to be happy. It's very important to me.” #debates https://t.co/2ABxrIpyUG https://t.co/pa5tZlwkxt,1474940010540,780581096425742340,1
258,shogunofsin,"#debates 

""I filed a 104 page--- *rambles about things*, here's the money I made. 614 million... uhh""

Fuck you.",1474940010732,780581097230835712,2
259,JenAndersonNYC,Sadly there's a large asshole constituency in the US. https://t.co/VrQbppqnSI,1474940010410,780581095880392704,1
260,IDisposable,"That's a plan that would actually change things for the better, so no way this government would ever do that. https://t.co/Kifyq19mwr",1474940010440,780581096006164480,1
261,snifftrr,I can't watch this shit anymore #Debates,1474940010550,780581096467599360,2
262,blondeYugy_,#debates #bringBernieback,1474940010722,780581097188962304,2
263,MrJoeSacco,"White teeth, yellow teeth.  Who has which?  #debates",1474940010741,780581097268588544,2
264,antonigr,"10 #debates DT demagogo, sitúa el marco de un Obama acomodado (jugando al golf) y se sitúa fuera de la ""profesionalidad política""",1474940010650,780581096887054337,2
265,Reesecup140,I agree #debates https://t.co/pHJNx9DRAn,1474940010649,780581096882900992,1
266,CindyStuart15,"Sorry to be a downer.
Trump's my guy but her experience is showing. So far she's ahead. I'm praying he turns it aro… https://t.co/e4iBgeU0S6",1474940010415,780581095901237248,2
267,King_Yunn,Oh shit Lester!!! #Debates,1474940010763,780581097360887808,2
268,Tierna,"Ooh, we're back to the audit excuse.  And then he starts blathering about something that has nothing to do with the question. #debates",1474940010566,780581096534712320,0
269,tootiebug7,#debatenight #debates #Debates2016 https://t.co/zY3hXFsPJB,1474940010747,780581097293742080,1
270,KeeganKG,@LesterHoltNBC #SHOWUSTHETAXES #debatenight #debates #Debates2016 #dumptrump #ImWithHer #notoriousHRC,1474940010711,780581097142939648,2
271,walshiepompeo,"Basically, the IRS has receipts. #Debates",1474940011669,780581101160902656,2
272,angieeangelaa,😂😂😂😂😂😂😂 https://t.co/F1yn4zwBIo,1474940011539,780581100615716865,1
273,FHSMurica,Word of the night: audit. #debates,1474940011690,780581101249171456,0
274,kaboooozy,"""I'm rich, listen to me"" - Donald Trump #debatenight #debates #Debates2016",1474940011644,780581101056233473,2
275,mikemcren,"#Trump""EXUSE ME(to the mod?)""#LetsKeepItCivil #Debates https://t.co/gNzC6v87cL",1474940011622,780581100963958784,1
276,EmbraceTheBald,If Elected Donald Trump would need to deal w/ powerful women daily...and he hes acting like he needs a diaper change #debates #Debatenight,1474940011608,780581100905267200,2
277,Fancylady75,"This is killing me, hahaha.....Trickle down Trump and Hillary is PO, this is a cow pie throwing session!!!!#Debates",1474940011708,780581101324505088,2
278,downing413,Debate recap thus far: #debatenight #debates https://t.co/hU9lKjBo7w,1474940011570,780581100745728000,1
279,OmgWebsites,When he is losing the argument he goes to condecending comments &amp; distracting comments. HOFSTRA  YOUR SMARTER THEN THIS.  HILLARY  #Debates,1474940011703,780581101303717888,2
280,matttunderscore,its like the teacher called on trump and he wasnt paying attention in class and this is his answer #Debates,1474940011785,780581101647441920,2
281,__conni,weirdly proud of getting audited so much....#debates,1474940011709,780581101328801792,2
282,ontopofit2,#debates The Rip-Off artist talking about the people being ripped-off?,1474940011686,780581101232353280,2
283,ericstahl,#debates How much of the $600 mil came from funnelling campaign money into Trump subsidiaries?,1474940011815,780581101773295616,2
284,JonatKenerson,Can Trump please just finish one thought before just rambling off into another? #debates,1474940011838,780581101869740032,2
285,HANG_A_LOUiE,"""Im under an audit, I'll release my taxes after it's done"", but the IRS said you [DJP] can still release your taxes??? #PCIDeb #debates",1474940011662,780581101131620352,0
286,peterdubbya,Stop bullying Lester Holt! #debatenight #debates #Debates2016,1474940011610,780581100913565696,2
287,mzcareybabyyy,Trump just talks in circles and never flat out answers a question. #Debates,1474940011866,780581101987205120,2
288,ABC7Amarillo,Trump says being audited has become a way of life #debates #debatenight,1474940012663,780581105330167808,0
289,TravRuiz,Trump says being audited has become a way of life #debates #debatenight,1474940012644,780581105250529280,0
290,Sapeosexual_,If only this house had alcohol 😭 https://t.co/XThZPpetQG,1474940012743,780581105665581056,1
291,LindaCrowNEA,"#debates he's all over the place will never see his taxes, answer the question yet all he's done it put everybody down. Liar Trump",1474940012736,780581105636225024,2
292,BastianCaldwell,"With all due respect Madam Secretary, your husband was literally the worst president even
#lied #impeached  #debates",1474940012702,780581105493696512,2
293,misskpaige,AMEN GARY  https://t.co/TIsml2kINV,1474940012755,780581105715908610,1
294,actdottv,"Trump, man of the people, is bragging about his imaginary millions #Debatenight #Debates",1474940012635,780581105212809216,2
295,EyeOfTheKatrina,Hillary trying not to smile while listening- totally showing that she thinks she can win. Comes off either confident or patronizing #Debates,1474940012672,780581105367863296,2
296,JJCordovaK,"Lester: Release your MF taxes, asswipe? Donald: I've been audited for 15 years. Other people don't. WT actual F. #debates",1474940012860,780581106156392448,0
297,Dawson_Tucker3,Don't yell at the moderator @realDonaldTrump #Debates,1474940012730,780581105611247616,2
298,LMelchionne,THIS MODERATOR IS SO BIASED WTF WTF THIS IS AGAINST THE RULES #Debates2016 #debatenight #debates,1474940012853,780581106127036416,2
299,Matt_Waskiewicz,Lester Holt just called out Trump's audit lie on national television and it made zero difference. We're in a post-factual society. #debates,1474940012835,780581106051670017,2
300,sjowoods,Donald Trump needs a muzzle #Debates,1474940012899,780581106319974400,2
301,chrispygraham,"Hard to believe the most racist prez candidate – Hitlary Clinton – has the most racist supporters.
#debatesnight… https://t.co/XPf7Raps42",1474940012348,780581104008982530,1
302,lemuelc,#debates does he ever finish a sentence?,1474940012825,780581106009636864,2
303,Boughttat,Trump is just an ugly annoying ass nigga #debates,1474940012910,780581106366214144,2
304,sfali789,"Drinking game idea: take a shot every time @realDonaldTrump mentions ISIS, Mexico, Muslims, billions #debates #debatenight #Debates2016",1474940012812,780581105955209216,2
305,xavvypls,"LivingOnChi: Jill:""Join us live to #OccupyTheDebates! #debates #debatenight #debates2016 https://t.co/FMAQAAKP30""- DrJillStein",1474940012898,780581106315825152,1
306,Princess4loko,Y'all Trump LITERALLY hasn't provided any solutions to problems. #Debates,1474940013669,780581109549510658,2
307,Belen_GTO,#debatenight #debates,1474940013605,780581109281136640,2
308,HypnagogicFeast,Holt is pulling a Candy Crowly #debates,1474940013687,780581109625004033,2
309,agent9400,Notice how Hillary won't look at trump  #debates,1474940013675,780581109574864896,2
310,tljduff,"He just referred to a tax forms as a ""financial statement of sorts"". What does that mean? 🤔🤔 #debatenight #debates #Debates2016",1474940013692,780581109646127105,2
311,TimAlexanderNYC,"I'm hoping at some point, this whole thing degrades to ""Your Mom!"" #Debates",1474940013652,780581109478350848,1
312,aanderson710,#debates,1474940013691,780581109641965569,2
313,ImOreos,Just because you are adutited don't mean fag Trump can't release his taxes. Dumbass fucker. #Debates,1474940013719,780581109759213568,0
314,Eithan_Itaev,HAHAHAHAHHAHA THIS TWEET HAS ALREADY BEEN USED AGAINST HIM FOR SO LONG. WE ALL SEE U BOO. ALL OF US https://t.co/6pl33XhFsg,1474940013631,780581109390200833,1
315,DemiBadHands,"""Worst revival of the economy since the great depression""
https://t.co/afr8K0X78N

uh...

#debates #debatenight… https://t.co/eOwbiWt0mU",1474940013439,780581108584943618,1
316,manish_vij,Trump flailing like a kid who didn't do his book report. #Debates,1474940013703,780581109692182528,2
317,bandaidknees,I just want to congratulate @HillaryClinton for staying so composed while dealing with this absolute clod #Debates,1474940013758,780581109922992128,2
318,swyoda,Business is better in other countries because of cheaper wages #Debates,1474940013786,780581110040391680,2
319,PinkPolitical,Why is he bragging that he is being audited? because that's what happens to honest people. #debates,1474940013866,780581110375788544,2
320,SkylerCFelix,"Oh good lord, Lester is going after Trump just like the Democrats want #debates",1474940013761,780581109935386624,2
321,thisaintevenme,Tsk tsk. They hate clinton so you know it's true. https://t.co/qLM0X1etZ3,1474940013713,780581109734055936,1
322,Brambleman,#debates https://t.co/LcqYXoO58C,1474940013594,780581109235118081,1
323,JJ_Newberry,"Wtf are you doing to get audited for 15 years, my g? #debates",1474940013855,780581110329651201,0
324,corrineileen24,Trickle down lowered our debt people. Please crack open a history book. #debates,1474940013671,780581109558050818,2
325,JaclynNullman,Watching the 2016 presidential #debates  #debatenight https://t.co/9CbAezTTZG,1474940014585,780581113391673344,1
326,dbaaryj,Lester Holt sounds almost apologetic with question of Trump. He's failing. Hillary VS Trump and cowardly moderator.#debatenight #debates,1474940014503,780581113047592962,2
327,SikhsForTrump,"Scraping the bottom of the barrel. The word ""this"" is now racist, make a note everybody. https://t.co/dPAzAJOsaE",1474940014520,780581113118928896,1
328,neostoics,@realDonaldTrump Why wait until the audit is done? Could it be to stop real examination?  #Debates,1474940014561,780581113290829824,0
329,DrZeuz,El imbecil de @realDonaldTrump sólo esta vociferando e interrumpiendo sin propuestas reales #TrumpezObrador #Debates,1474940014648,780581113655758848,1
330,curiousmustard,Same! https://t.co/amZINXJBfm,1474940014536,780581113186160640,1
331,ZokijaNigeria,"""I get a feeling that by the end of this debate I will be blamed for everything""@HillaryClinton #debates #Debates2016 #zokija",1474940014578,780581113362255873,2
332,vegancunt,Did he...just say...EXCUSE ME...to Lester? #debates #debatenight https://t.co/4pXyh28grw,1474940014506,780581113060290560,1
333,ParentingTweens,Uugghhhh https://t.co/co2vK2fCzT,1474940014588,780581113404071937,1
334,gizmo8283,Hillary and Donald will both benefit $$$ from being President #Debates    THIS IS WRONG!,1474940014676,780581113773391872,2
335,McWheelerson,It's the kind of thinking our country needs #Debates,1474940014743,780581114054184962,2
336,DMWhinnen,Trump talking over everyone at the #debates just like his surrogate. Rude.,1474940014609,780581113492144128,2
337,dcgirlrambles,Why is this ducking debate about Donald's audits #debates,1474940014643,780581113634881536,2
338,wordsbquick,And they're going to do this 3 more times! #debates of #TrumpVsClinton,1474940014620,780581113538473985,2
339,realcrystalswan,You are perfectly free to release your taxes dumbdumb!!!  #Debates,1474940014801,780581114297487360,0
340,CParsonsL,"""Country being ripped off by every country in the world"" @realDonaldTrump #debates #CBUS110",1474940014721,780581113962065920,2
341,wutever4ever,"Donald Trump says million like Dr Evil, coincidence? #debates",1474940014878,780581114620420096,2
342,Hope_Carter,While he tells us how to fight Mexico? Miss me entirely with this. https://t.co/F8hcgswC6L,1474940015618,780581117724233728,1
343,_BeautyShines,OMG he got caught in his lie! LMAO..#debates,1474940015566,780581117506101248,2
344,sexifemme,#trump upset kid at a party cus he didn't get a gift too..it's not your birthday !!! #Debates #ImWithHer #factcheck2016,1474940015701,780581118072324096,2
345,DarhkeAngel,Can we just vote for Frank Underwood? #Debates2016 #debates,1474940015652,780581117866995716,2
346,heyhollyjay,#debates https://t.co/F6AsdlxjIa,1474940015212,780581116021473281,1
347,icetrave,"YOU CAN RELEASE YO TAX RETURNS EVEN IF YOU'RE BEING AUDITED, Donny #Debates",1474940015697,780581118055686145,0
348,Trey_P_G,Trump not even answering the questions lmao #Debates,1474940015797,780581118474981376,2
349,JessEdelblut,"Yeah but they want @GovGaryJohnson, not a wacko Green Party politician. https://t.co/6y4LjKzq7t",1474940015567,780581117510426625,1
350,Samdelous,"15 minutes in, and I'm driven to drink on a Monday night. #debates… https://t.co/To27DlZ4NT",1474940015705,780581118089113601,1
351,brendanmatto_x,tweet me what you're thinking if you're watching this on acid #lsd #debates #debatenight,1474940015778,780581118395416579,2
352,SEIU1107,"@realDonaldTrump reported $694 million in income last year.  #ManofThePeople
#Debates",1474940015727,780581118181466112,2
353,InterruptSpeed,694 million buys a ton of LEGO #Debates,1474940015827,780581118600937472,2
354,solitudeSlicer,Donald: our country is broken and needs my brain. Not my millions. My brain. #debates,1474940015848,780581118688976897,2
355,timmotoh,Trump looks worked enough to have a heart attack. Let's hope. #Debates,1474940016752,780581122480623616,2
356,GoonSquadJavi,Peep my mixtape https://t.co/Ry84SksTFR #Debates,1474940016544,780581121608282112,1
357,suejarchow,#Debates 694 million.,1474940016635,780581121989849088,2
358,mssexybelize,Donald Trump is about to lose it! Can't control his mouth. Turning a whole new shade of orange! #debates,1474940016631,780581121973182464,2
359,artigaTV,"#DonaldTrump ""800 billones de déficit en todos los tratados comerciales con otros países"" #debates @noticierohechos",1474940016656,780581122077970432,2
360,AweReallyDudes,😂 Maaaaaaybe #debatenight #debates #Debates2016 #NeverTrump #BelieveNothing #AWeReallyPodcast https://t.co/iHufVO0U5m,1474940016632,780581121977442305,1
361,ctanderson8885,Hey @realDonaldTrump you can still release your tax returns when you're under audit #TaxEvasion #Debates #debatenight #Debates2016,1474940016815,780581122744778753,0
362,joshgarza28,This debate is on their first topic and it's already starting to sound like The Jersey Shore. #debates,1474940016703,780581122275155968,2
363,djpony639,#Debates https://t.co/kOl6ui0PlN,1474940016793,780581122652577792,1
364,MacheSalinas,I can't imagine even #trump supporters thinking that he is doing good. #debatenight #debates,1474940016839,780581122845454336,2
365,benavidez_matt,694M$$$ #Debates,1474940016919,780581123181076480,2
366,Favstar_Bot,"@therealezway 20 ❤️s!

Your tweet has been liked by 20 people. https://t.co/2guEc63uyT

https://t.co/F8cGk4CVHd",1474940016803,780581122694520833,1
367,CarolineDabbs,I just told @nbcwashington who I think is winning. Cast your vote now! #Debates #NBC4DC https://t.co/bpgTqCA1OV,1474940016763,780581122526838784,1
368,rania_ahmed93,العجوز محلووهه😻 #Debates,1474940017675,780581126352039939,2
369,jfmcphillips,"From an evolutionary game theory perspective, Trump is tuned to fitness rather than objective truth. That's why he's so effective. #debates",1474940017709,780581126494494720,2
370,richiebosco,Sounds like he is complaining  #Debates,1474940017539,780581125781499904,2
371,SamesJoe,"Para mi ya perdieron hace mucho.
Debatir contra Trump solo es la estocada final. 
 #debates",1474940017767,780581126737756160,2
372,Ellerret1,"#Trump #debates live Please define ""Some very bad things,"" ""so badly.""",1474940017748,780581126658072577,2
373,darcykerrigan,"He just referred to himself in the third person. I can't. Also, please stop yelling.
#debates",1474940017668,780581126322659329,2
374,DoCBatman,"""I'm not complaining,"" complains @realDonaldTrump #debates",1474940017514,780581125676609536,2
375,Conservativeind,You can tell @HillaryClinton is pissed she wasn't just handed the crown like the #Democrats gave her #NHPolitics #debates #debatenight,1474940017648,780581126238826497,2
376,AnalogousPants5,Actual pic of Lester as a moderator at tonight's debate. #debatenight #debates #Debates2016 https://t.co/9V8nhvIQzP,1474940016993,780581123491586050,2
377,KDxMenace,U can still release ur taxes even while under audit Donny boy  #debates,1474940017677,780581126360489988,0
378,theislandauthor,"You know when you go abroad and you only know like eight words in the native language, so keep repeating them?

Trump.

#debates",1474940017684,780581126389850120,2
379,piover45,"""Political hacks"" said the man with zero political experience #debatenight #debates #Debates2016",1474940017739,780581126620479488,2
