,screen_name,text,timestamp,tweet_id,cluster_pred
409,Rellyhappening,"#debates TAX RETURNS ARE NOT REQUIRED BY FEC BY CANDIDATES, IF YOU DON'T LIKE IT CHANGE ELECTIONS LAWS! Never release Mr.Trump!",1474940061726,780581311115243521,1
410,_EHM18,And look at both of these lying mfs  everything the sayin lies #Debates,1474940061724,780581311106912256,0
411,RudyReber,"""I'm the only one who gets audited by the IRS"" -- Lyin' Donnie #debates",1474940061685,780581310943277056,0
412,pete0721,"Oh boy, getting that email vote #Debates",1474940061795,780581311404576768,1
413,shieldzilla,Clinton just letting Trump ramble in his meltdown like a pro. #debates,1474940061761,780581311262056448,0
414,zluxosu,Shouldn't be a point of pride #badtrump https://t.co/cLud1JeJ9r,1474940061590,780581310544740352,0
415,director_in_kc,So she's only a few years old? https://t.co/H7So7MEGzF,1474940061565,780581310439886848,0
416,P_D_White,Emails transcripts of wall street speeches #debates,1474940061767,780581311287205888,1
417,MyKidsHavePaws,Again with the audience.  Shut UP!!!! #Debates,1474940061749,780581311211794437,1
418,KoleKlassEvents,A business man is about business. Democracy is best left to those who are concerned with everyone's best interest not just yours.   #Debates,1474940061761,780581311262121984,0
419,thepattymatos,"""I'm so humble I don't even complain about getting audited by the IRS about my dodgy ass business practices"" - Drumpf #debates",1474940061773,780581311312310272,2
420,odissy,토론 논의가 계속 무역협정으로 되돌아가는 느낌. #debates,1474940061905,780581311865954305,0
421,FelipeLH,Algo te sabrán Trump-o. Por algo te investigan. #Debates,1474940061728,780581311123628032,0
422,rbjmanagement,What are you hiding #releaseyourtaxes #debates,1474940061664,780581310855278592,0
423,JohnSpensieri1,Yes on https://t.co/die6siNSku,1474940061713,780581311060725760,0
424,JennyKorn,"Okay, when y'all gonna bring up #race? #EspeciallyThisWeek #BlackLivesMatter #TeamHillary #debates #debates2016… https://t.co/OmkI5DKvP2",1474940062240,780581313271173121,2
425,BenThe175PitBul,Boom EMAILS!!!!! THE CROWD LOVED IT!!!! #debates,1474940062607,780581314810511361,1
426,shelbyprender13,the audience had ONE JOB #debates,1474940062643,780581314961473536,1
427,DavidStSurin,Gooooootttttt heeeeeerrrrr #Debates,1474940062646,780581314974117888,2
428,GangeTyler,Oooooooohhhh #Debates,1474940062710,780581315242438657,2
429,michaelcollado,"Donald, that's a false equivalency. She's released her tax returns. How about you release YOUR business emails? #debates #debatenight",1474940062698,780581315192037377,1
430,kingley,Trump thinks that he can ignore that he can release his tax returns. Disingenuous. #debatenight #debates #Debates2016,1474940062667,780581315062145024,1
431,rebecabouquets,"¡Pobrecito, lo auditan casi cada año! #debates",1474940062748,780581315401744384,0
432,moviemarlene,#TrumpedUpTrickleDown #MyLawyersSayDontDoIt #debates #DebateNight,1474940062666,780581315057815553,2
433,EmilyUecker,Hillary Clinton little smile is the face she's been making her ENTIRE LIFE while men have been talking #debates,1474940062710,780581315242373120,2
434,540zCIG,Email for tax returns #Debates,1474940062522,780581314453962754,1
435,Leaderkilla,lol theres the emails! #Debates,1474940062754,780581315426947073,1
436,iTweetSPANGLISH,I'm afraid trump is winning? #debates,1474940062594,780581314755825664,0
437,sgrant525,IRS stated there's nothing preventing @realDonaldTrump from releasing taxes. He's using audit as an excuse #debates https://t.co/FTLTU0NRQL,1474940062703,780581315213201408,0
438,Neoptolemvs,That has nothing to do with the question bro #debates #fuckyou,1474940062760,780581315452276736,1
439,faris4life,There's that fake clown smile. #debates,1474940062724,780581315301126145,0
440,Mpherg,Donald. What are you talking about??? #Debates,1474940062702,780581315208806404,0
441,Deeeeliah,"""Trumped up Trickle down"" is the soundbite her campaign has desperately needed. #debates",1474940062576,780581314680553474,2
442,uh_lees_nicole,"""I am running for president against my lawyers wishes"" #nevertrump #debates #debates2016",1474940062683,780581315129253888,2
443,TheBookFeminist,How is being audited by the IRS for 15 years a good thing...? #debates,1474940062748,780581315401973762,2
444,marcelwarfield,LOL done https://t.co/cLt9ODnkcP,1474940062638,780581314940461056,0
445,Bossip,Here we go with the f@¢#ing emails again... #debates,1474940062683,780581315129270276,1
446,JVaghyJones,So glad #trump has a super secret awesome plan for ISIS....#DEBATES #FACEPALM,1474940062824,780581315720585216,0
447,2Cool_4DisShit,Trump can buy America with all the money 💰 he got #Debates,1474940062902,780581316047671296,0
448,MySharona_79,The media are the only ones who care about Trump's tax returns or hers for that matter. Regular citizens don't really care. #Debates,1474940062778,780581315527766016,1
449,FOX24Tim,Go Lester! Finally. https://t.co/ueFVJHt0f5,1474940062774,780581315511017477,0
450,ALLRoosterteeth,JordanCwierz: Barack Obama is going to that big golf course in the sky apparently. #debates,1474940063601,780581318979620865,0
451,Memharkins,Loving how Hilary looks like she's going to laugh every time he talks. #debates,1474940063658,780581319218651136,0
452,LordSheltron,Hillary giving Donald that bemused look a mom gives her son as he rants right before she grounds his ass #debates,1474940063639,780581319139098624,2
453,boringplum,Taxes and emails?! Everyone drink two. #debates,1474940063697,780581319382175744,1
454,Lela_Ama,Yes.... https://t.co/Y9OF2ThlXz,1474940063661,780581319231143939,0
455,AyeJay_31,Dang. Threw the emails up .. #debates,1474940063775,780581319709339649,1
456,notbrittt,But you haven't released your taxes🤔🤔🤔 #debates,1474940063677,780581319298473984,1
457,sweetsallysue,#Debates2016 #debates Deflecting Don?,1474940063701,780581319398928384,2
458,cofphoto,Facebook needs to set up one of these tonight.... #debates #debatenight https://t.co/aZlorjk2GX,1474940063646,780581319168274432,0
459,DeAnnSmithkc,Tax return snack time Hillary #debates,1474940063566,780581318832914432,2
460,EAPD,"What is amazing is that there are people who actually support Trump despite hearing him talk, #Unbelievable #Debates",1474940063793,780581319784878080,0
461,Fefi428,@HillaryClinton It's like fishing off back of boat hook line &amp; sinker. #DonaldTrump can't contain himself in worldwide broadcast. #Debates,1474940063729,780581319516446721,0
462,Raelshark,Clearly can't handle the pressure. https://t.co/SIIa0lJrlG,1474940063646,780581319168389131,0
463,knicoles528,AND THERE COMES THE EMAILS!!! #Debates,1474940063537,780581318711087104,1
464,LauraDavis31,Why are you bringing up her emails in relation to your tax returns? Are you serious? #debates,1474940063813,780581319868751873,1
465,TytheWriter,"Headline: ""Trump is Waiting for a Release"" #debatenight #debates",1474940063731,780581319524904960,0
466,keralajane,So... should we be concerned that #Trump gets audited annually? #debatenight #debates #Debates2016,1474940064659,780581323417067520,2
467,mukupamulo,"Trump Taxes have been denied parole 5 times this year's, they still going to breakout before the election. #Debates",1474940064631,780581323299811328,0
468,marksalke,Here we go with the emails. #Debates,1474940064645,780581323358347266,1
469,FRECKELZZ07,All Trump has are these emails.... #Debates,1474940064721,780581323677118464,1
470,rheatsunami,shout out to hillary's emails #Debates,1474940064618,780581323245170688,2
471,natisangulorico,whaaat don't throw chief janet into this mess #debates,1474940064611,780581323215933443,0
472,DanaCortez,Damn. Wikileaks even says Hillary is right https://t.co/HQeSPIRSYg,1474940064645,780581323358416897,2
473,connerbusler,Emails and federal tax returns are totally comparable things! #debates,1474940064725,780581323693883392,1
474,ValleLaula,Where is @andersoncooper when you need him? #debatenight #debates,1474940064483,780581322678935552,2
475,katyfaise,yes bc emails that did absolutely nothing wrong compare to your con artist lying tax returns #debates,1474940064696,780581323572412416,1
476,JennBerney,Loving HRC's eyerolls in response to the tax question. #Debates,1474940064601,780581323173879808,0
477,CodyWandersee,If interest rates get raised the bubble will pop transparency is needed within trade deals and financial regulation is paramount.  #debates,1474940064708,780581323622711296,0
478,AsToldByLANAGAN,"694 million?! Bruh. You could be ""rebuilding America"" in more impactful ways than running for president on the pretenses of hatred. #debates",1474940064696,780581323572379648,0
479,ileanasevenpulu,What's up with this audience?  #debates,1474940064729,780581323710660608,1
480,Owlwriter16,"#debates ""A financial statement of sorts"" #Trump assures us as he insists an audit preventing tax discloosure. Is his nose getting longer?",1474940064744,780581323773706240,0
481,BrenYoung,Oh my gosh...she's on time delay! https://t.co/ZKMyg1tcnZ,1474940064614,780581323228315648,0
482,AmburJayneee,Audits ... Emails. Which is more important? 🤔#debates,1474940064745,780581323777908738,1
483,GaelynneVB,Wait. What was the question again? #debates,1474940064629,780581323291242497,1
484,LibertyIsFTW,"#Debates

Nixon released his tax returns while under audit... now he changed the conditions of releasing his tax returns.",1474940064805,780581324029472768,1
485,mik3alexsdad,As soon as she's releases the harpies I'll release my tax returns #Debates,1474940064784,780581323941478400,1
486,steviexmcfly,"""I get audited almost every year."" Why would that happen that much if there's no problems? #debates",1474940064728,780581323706667009,2
487,LindsayHarrison,I'm waiting for grandma Hillary to offer Donald a lint-covered hard candy from her pocket. 🍬🍬🍬 #debates,1474940065651,780581327577972736,0
488,altbritannia,He put a good spin on that #Debates,1474940065501,780581326948818944,2
489,politinanfran,"#debates Buffett said he would release his taxes if Donald did! And he is under audit, too! @HilaryClinton",1474940065641,780581327536095233,1
490,lovelightme,Emails and tax returns are two totally different things #debates,1474940065632,780581327498207232,1
491,Nixflixpix,"Thank you, Lester. FINALLY! #debatenight #debates #Debates2016 If he gets audited every year, something awful is going on.",1474940065533,780581327082917888,2
492,breeskoo,LITERALLY RIGHT NOW #debates,1474940065724,780581327884029952,1
493,smichaelwilson,This is awesome. #Debates,1474940065468,780581326810411008,1
494,shalyn7,"If democrats plans are bad, give us details @realDonaldTrump. Attacks make good TV but don't earn votes of intelligent Americans. #Debates",1474940065717,780581327854718976,0
495,RALPHREMINGTON,Who the hell is cheering out there?! #debates,1474940065690,780581327741460480,1
496,FlapJackFlippit,Welp there it is #Debates,1474940065657,780581327603113985,0
497,jckp_,"Mi sa che Hillary c'è riuscita: Trump ha già iniziato a blaterare fuffa. Se ora lei appare più rilassata, 1 a 0 e alla prossima. #Debates",1474940065779,780581328114835457,0
498,dcsohl,I only have a third of my bottle of wine left and we're only a half hour in. #debatenight #debates #Debates2016,1474940065753,780581328005718016,2
499,Rwest_3rd,"Check out @HillaryClinton dropping the hashtag lines of the debate, lmao! #debates #TrumpedUpTrickleDown",1474940065728,780581327900925952,0
500,thereeldankmeme,Hillary Clinton is winning. Donald Trump is grasping for straws.  #Debates,1474940065702,780581327791882240,0
501,jordancclark,#debates #debatenight #factchecking https://t.co/ndKZrIZiXJ,1474940065678,780581327691218944,0
502,MissMarissaMae,"I'm gonna release my taxes. 

JUST KIDDING i'll only do it if she releases emails. #Debates",1474940065823,780581328299241472,1
503,Alexea_Hankin,Emails mentioned. BINGO! https://t.co/NjdkQHoMNz,1474940065714,780581327842205698,0
504,VidaSoCali,Oh now it's if she releases deleted emails #Debates,1474940065836,780581328353792000,1
505,ChrissieJaySA,It only took 33 minutes for emails to be mentioned. I'm kinda impressed. #debates,1474940065716,780581327850516480,1
506,chefpamsey,Better than Sharnado!!!!!#debates #debatenight #Debates2016,1474940065815,780581328265682944,2
507,debbie77777777,China is not ripping us off!  Mostly they have done a great service for America making some fine products! #debates,1474940065894,780581328597110784,0
508,ManuelSauceda10,"Trump that kind of blackmail will nor work, release the tax return  #Debates",1474940065685,780581327720501248,0
509,Emmylite,LIVE NOW: Watch US First Presidential Debate 2016 Live Stream #debatenight #debates - https://t.co/6F5FfzieLR . Both nominees firing it out!,1474940065846,780581328395862017,0
510,Thuntsanders,The fool is outrages #debates,1474940065928,780581328739635200,0
511,gbx500,"@JohnBarronUSA 
It's great entertainment 
#debates",1474940066660,780581331809865729,2
512,Jesus_Loverrr,Forget trump #Debates not trump,1474940066571,780581331436703744,0
513,Mehnaz86,Why are tax returns equivelant to emails #debates,1474940066620,780581331642163201,1
514,LeoraFalk,"""I'm not even complaining"" is @realDonaldTrump version of the toddler's ""I'm not whiiiiiniiing."" #debates",1474940066497,780581331126329344,0
515,LukeBryanSucks,"Trump with a Zinger, release those emails and I'll release my taxes #debates",1474940066704,780581331994411010,1
516,mrsswesley,I want to retweet pretty much everything in my twitter feed. #debates,1474940066437,780581330874662912,2
517,bansidog,Thank you Trump! Another nail #Debates,1474940066677,780581331881320448,0
518,callmerafow,a cara da hillary me representa de tantas maneiras nem parece que é o diabo em forma de gente #Debates,1474940066736,780581332128763905,2
519,emilyannecarson,Oh my gosh. The fact that this is even reality right now is making me so scared and sad. #debates #debatenight,1474940066740,780581332145491968,2
520,TrojanAurora,Waiting for one candidate to break  #Debates,1474940066773,780581332283863040,0
521,2chanel4yu,"""If you were to tell me I would make this much money 10 - 15 years ago I wouldn't believe it.""  #Debates",1474940066779,780581332309020672,2
522,PhillyPartTwo,"FALSE
#debatenight #debates #Debates2016 https://t.co/EDj1TmBegm",1474940066762,780581332237692930,2
523,clfender,Not every wealthy person is running for president. .  #Debates,1474940066843,780581332577550336,2
524,doxyrum,AYEE EMAILS #Debates,1474940066682,780581331902291968,1
525,meagxw,Always bout the emails  #Debates,1474940066855,780581332627980288,1
526,PatentPending_,YES TRUMP #ReleasetheEmails #Debates #Debates2016,1474940066880,780581332732829697,0
527,gaddirod,Release the emails.  #Debates,1474940066902,780581332824895489,1
528,TazWZZM,"Trump says we can't see his tax returns but we can see an ""essentially financial statement of sorts."" #debates",1474940066860,780581332648914944,1
529,PanchoAntrax_,"Hillary is like ""look at this fucking idiot"" #Debates",1474940067674,780581336062889984,2
530,aclegg09,"How many times can @realDonaldTrump say the word ""audit"" in a 30 second segment? #debatenight #debates",1474940067624,780581335853309952,2
531,chestmedicine,Now the great Trump unhinging begins #Debates,1474940067674,780581336062898177,0
532,jay_easy87,But why are you always getting audited #Debates,1474940067690,780581336129998849,2
533,SumDimVlogs,"The top 1% own 50% of the total wealth. The only way the Middle Class and Poor gets any of that is if the rich give back!!!
 #debates",1474940067614,780581335811305473,0
534,dball1126,"Shots fired! 33,000 emails!  #debates",1474940067522,780581335425515520,1
535,sophie_jo_666,"tRump: ""Lester"" ""Lester"" ""Lester"" ""Lester"" no homo though #Debates",1474940067750,780581336381726720,1
536,ElectricInfidel,"We will never see his tax returns. Never. He's been saying ""I will if or when..."" for years. #debates",1474940067680,780581336088272896,1
537,mhayward,I'd rather see transcripts of Wall Street speeches.  #debates,1474940067684,780581336104968194,0
538,Nick_Gamarro,Trump does have a point. Bringing up him not showing tax returns but Clinton not asked about Emails #debates,1474940067665,780581336025292800,1
539,TheRealModSquad,"Man, it must be fun thinking of the #Debates while issuing refunds... Oh wait https://t.co/UeBqgiWIds",1474940067612,780581335803002880,0
540,mykdeen,"Wish @realDonaldTrump, @HillaryClinton, @GovGaryJohnson and @DrJillStein were on one stage for #debates? | https://t.co/gHUR6lH8bX",1474940067568,780581335618453504,0
541,vulcsmash,"Trump camp: ""WHOEVER CAN DELETE TWEETS THE FASTEST DOESN'T GET A BEATING LATER TONIGHT"" #debates https://t.co/pWV6DfAo5e",1474940067313,780581334548754432,0
542,diopaninaro,MA CHI CAZZO È CHE STA APPLAUDENDO A STO COGLIONE #Debates,1474940067722,780581336264413184,0
543,aprilmego,"SHE'S ALREADY RELEASED HER EMAILS 
#debatenight #debates 
NOW SHOW US YOUR TAXES",1474940067702,780581336180400128,1
544,walidmrealtor,#Igetaudited New song... #Debates,1474940067751,780581336386011140,0
545,adiazpi,Hillary quiere llorar #Debates,1474940067725,780581336276873216,2
546,monicverse,I thought every candidate gets 2 minutes only. Trump has been talking for forever about his taxes #Debates,1474940067627,780581335865884672,1
547,katherine19will,TRUMP JUST DROPPED THE FUCKING MIC. #debates,1474940067759,780581336419602432,2
548,FlockUrself,waiting for @realDonaldTrump's routine audit to finish #debatenight #debates https://t.co/HVuKnkRi8r,1474940067552,780581335551315969,0
549,sophyavictoria_,JAJAJAJAJAJJAA https://t.co/9i34RNtJ5Q,1474940067733,780581336310362112,0
550,missjuliebrown,"694 million dollars this year?  Donald, buy me a car!!! #debates",1474940067800,780581336591441920,0
551,iseboIa,!!!!! https://t.co/ijNg5w01dV,1474940067462,780581335173705729,0
552,LBeezieforlife,"""I don't mind releasing them"".... Then release them ? #debates",1474940067750,780581336381882368,1
553,lounovak,#ItsInOurHands #WeGreen #SteinBaraka #VoteGreen2016 https://t.co/788dkS7AWg,1474940068694,780581340341149696,0
554,Jon_Star,Clinton may just be better off letting Trump rant like a lunatic. Every minute bat goes by he sounds crazier and crazier. #debates,1474940068663,780581340211130369,0
555,OurTriumph,FACT CHECKED: #debatenight #debates #Debates2016 https://t.co/GLHEynmvJA,1474940068433,780581339246440448,2
556,_violent_SPEED,"ROASTED AGAIN, SHE IS DONE #debates",1474940068690,780581340324311040,1
557,EdWood_BigMary,@realDonaldTrump blaming his lawyers for not releasing his taxes. #debates,1474940068568,780581339812786176,1
558,iamtallandthin,"""when she releases the deleted emails"" how would that work #debates",1474940068430,780581339233972225,1
559,KPMC1108,"If he's being audited that often, there's a reason!  #Debates2016 #Debates",1474940068490,780581339485601792,2
560,carlzonyoung,"omg, how can trump be so rude?????????? he doesn't have any sense of education and politely #Debates",1474940068633,780581340085379072,0
561,flyboyrun,Boom #Debates,1474940068755,780581340596965376,1
562,JaxonLeeRose,"Lets take a shot every time Hillary blinks. 
#DrinkingGame 
#debates",1474940068658,780581340190158848,1
563,Tiauna76,Is Trump seriously throwing an audit trantrum? #debates,1474940068738,780581340525625344,0
564,BandDarling,Update: Trump doesn't like being interrupted but doesn't mind screaming over Hilary #debates,1474940068730,780581340492263424,0
565,juliealderman_,So are those people cheering going to be kicked out or what? #debates,1474940068700,780581340366331906,1
566,whodattweeter,#Debates so in 15 years he will release his tax return,1474940068624,780581340047704066,1
567,jdeutsch8,"#debates Neither Clinton nor Trump is game to talk abou tthe biggest active ""trade... https://t.co/3zqiWesB9P by @wikileaks via @c0nvey",1474940068611,780581339993149442,0
568,ibswish1989,Stand up comedy #Debates,1474940068756,780581340601286658,0
569,ioniabelson,Trump también está monopolizando el tiempo y la atención del debate #debates #debateGSPM,1474940068733,780581340504788992,0
570,ilovedrummin,"Welp, he said emails earlier than I thought... Now what Trump? #debates #Debates2016",1474940068845,780581340974505984,1
571,shel_babyyy,Deflecting at its finest hahaha #debates,1474940068878,780581341112872961,0
572,michandvel,"@realDonaldTrump if the IRS is constantly after you, it must be for a reason #PresidentialDebate #debates",1474940068812,780581340836139010,2
573,EtlingerII,Will Trump release his taxes?  #debates,1474940068834,780581340928352257,1
574,MariePVilla,Boom! #debates,1474940068806,780581340810842112,1
575,livylove90,Get over the emails already.  That's a dead issue. #Debates,1474940068874,780581341096181760,1
576,Attilathehunnny,He cannot stay on track #Debates,1474940068913,780581341259673600,0
577,PledgeCarlee,"33,000 emails!!!! #debates",1474940069667,780581344422219776,1
578,PigGrease,"#debates I will release my tax return if you will release your 33,000 emails.",1474940069673,780581344447430657,1
579,mtranmer7214,Avoiding the tax return topic yet again... Suspicious #deceit  #debates #theycanbereleasedduringaudit #stopavoiding,1474940069703,780581344573173764,1
580,StarBanner7,Trump just gave a great punch to Clinton with the email case #Debates,1474940069731,780581344690577408,1
581,DeepDrumpf,I will create jobs by bringing back horrible labor and living conditions. I can make our country so rich again. @BJCalvillo #debates,1474940069708,780581344594145280,0
582,Tuakachyc,All that mouth release those tax returns then has the gall to mention folks being ripped off?! Hello TrumpUniversity? #Debates2016 #debates,1474940069689,780581344514600962,1
583,axemtitanium,He sounds proud that his tax returns are so questionable that he gets audited every year. #Debates,1474940069673,780581344447463425,1
584,livinit,Now it's a free for all.  Going to bed now......zzzzzz #debates,1474940069711,780581344606818304,2
585,visualsdream,he still taking bout them emails omg i hate #debatenight #debates,1474940069749,780581344766066688,2
586,reflettage,RELEASE THE EMAILS!!!!! #debates,1474940069681,780581344481083396,1
587,thekittchen,"I have deleted 33,000 emails this year. Just saying. #debates",1474940069674,780581344451694592,1
588,thegreatRiggsby,Damn @LesterHoltNBC bringing that moderator fire #debates #debatenight #Debates2016,1474940069636,780581344292147200,2
589,SweetshadeLane,That was the most predictable thing ever. #debates,1474940069803,780581344992571392,0
590,bzherman,Crowd needs to stop cheering #Debates,1474940069793,780581344950702080,1
591,naderalghoul,#debates #debatenight #TrumpPence16 #HillaryClinton #celect16 https://t.co/fz1cKhOmrJ,1474940069629,780581344262762496,0
592,Oakland73rd,Who gives a fuck about emails  #Debates,1474940069814,780581345038708737,1
593,KyleFromOshawa,"Donald, why is your lawyer advising you not to release your tax returns?

#Debates",1474940069825,780581345084846080,1
594,hmakhija,Is it a good thing - being audited every year!? #Debates,1474940069561,780581343977701376,2
595,Joseph_La_Rue,"#DonaldTrump vows to release his tax returns when #HillaryClinton releases the 33,000 emails she deleted. #debates #debatenight",1474940069774,780581344871124993,1
596,rachel_stocker,"""I've been under audit almost for 15 years."" Then you should know it doesn't prevent you from releasing your tax returns. #Debates",1474940069627,780581344254517248,1
597,twwat2016,Why are you negotiating Donald? #debates,1474940069874,780581345290518528,0
598,IkeIsaacson2,#Debates2016 #debatenight #debates #DWTS https://t.co/4KdEuZMhpg,1474940070379,780581347408678916,2
599,D10020643,Why is she so confident  #Debates,1474940070667,780581348616638464,1
600,JP5Energy,"#debates #debatenight #Debates2016 Grab your #Trump shirt

➡ https://t.co/37p5yYJl9b https://t.co/athe3MSGEm",1474940070422,780581347588870145,0
601,michael_stuart,"I thought Halloween was next month, why is there an 8 year old in a #DonaldTrump mask screaming on tv? #Debates2016 #debates #debatenight",1474940070483,780581347844878336,2
602,Upa007,"""as soon as she releases her emails, I will release my tax returns"" -@realDonaldTrump #Debates",1474940070658,780581348578766849,1
603,davethibodeau4,Embarrassing To say the least Glad I'm Canadian  #Debates,1474940070717,780581348826312706,1
604,arnoldtijerina,"Release the emails, I'll release my tax returns @realDonaldTrump haha #boom #Debates",1474940070651,780581348549550080,1
605,suparubo,#Debates https://t.co/1R8SHQxNZr,1474940070454,780581347723214848,0
606,t2moove,My 1st graders have a wider vocabulary https://t.co/QkickYxfNr,1474940070668,780581348620853249,0
607,AdrienneStigura,Donald Trump needs to chill. I got audited last year as well. Just do the right thing #debates,1474940070733,780581348893401089,2
608,cmincey1,Did he say he made 654 million dollars?  #Debates,1474940070747,780581348952141830,0
609,Polkameister,"Trump goes for the jugular and raises 30,000 missing Hillary emails.  Moderator clearly not liking that  #debates",1474940070758,780581348998123520,2
610,gottschlingmara,"""Debt-free college"" makes a college degree worthless. #Debates",1474940070794,780581349149315072,2
611,thegingersoul99,emails #debates,1474940070722,780581348847353856,1
612,mocha_latte08,Bro.. Release your damn tax returns #Debates,1474940070887,780581349539184640,1
613,meisel40165,Hillary needs to just let trump keep talking. Win win #Debates,1474940070838,780581349333798915,2
614,Thecaves551,Clinton for Prison 2016! #debates,1474940070840,780581349342253056,0
615,MohsinROSS,Lol. It's a loss either way you vote.  #Debates,1474940071659,780581352777347072,1
616,southendzone9,#debatenight #debates https://t.co/wTOFJQRImc,1474940071344,780581351456026624,0
