,screen_name,text,timestamp,tweet_id,cluster_pred
380,PrometheusLaw,"DrJillStein: The American people are clamoring for #debates with more than Clinton/Trump, the 2 most unpopular candidates in history. #Occu…",1474940017718,780581126532366337,2
381,MariaGomesps,Trump sounds like an annoying 8 year old  #debates,1474940017755,780581126687555584,2
382,turnbul04,Alright Lester! Way to stick to the IRS-audit question! #debates,1474940017717,780581126528172032,0
383,TanjuYurukoglu,@realDonaldTrump #debates IRS says audit is no reason not to release.,1474940017900,780581127295643648,0
384,BigTWill34,@katyperry A 8 year old would have this Katy! This is making him look so bad! #ILoveIt #Debates,1474940017927,780581127408922624,2
385,jsczykutowicz1,"For a non-politician, Trump sure is avoiding this question as well as any other politician. #Debates2016 #debates",1474940018665,780581130504376321,2
386,gamuzzza,Trumps has confident #Debates,1474940018639,780581130395279360,2
387,JacobRichardsAZ,I'm so tired of hearing Republicans (and Democrats) say moronic things about trade deficits. #debatenight #debates #Debates2016,1474940018697,780581130638495744,2
388,CaptainSkibs,"Stop trying to make ""Trumped up"" happen. It isn't going to happen. #debates https://t.co/9dGlqPPR2p",1474940018392,780581129359335424,1
389,VinLew,We ALL need to make $694m! #debates,1474940018685,780581130588135425,2
390,michellevmoore,"This is #literallytrump. https://t.co/9ysIeoRUhe
#debates #debatenight #ImWithHer #HillaryClinton",1474940018531,780581129942405120,1
391,RoyaleWitQueso,"""LOTS OF YELLING!"" *sniff*
""I'M UNDER AUDIT!!"" *sniff*
""IT WAS A SMALL LOAN...""*sniff* #Debates #Debates2016",1474940018739,780581130814697472,2
392,micfuckabee,FUCKING GLORIOUS https://t.co/25T6m0B0sX,1474940018479,780581129724108800,1
393,anotherstraycat,"""I've been under audit for 15 years. But, I suspect they'll be done just about November 15th."" #debates",1474940018614,780581130290466817,0
394,cheryleric78,Tax returns...the rubber meets the road. #Debates,1474940018602,780581130240163844,1
395,PrometheusLaw,DrJillStein: A Green administration will declare a climate emergency to create the clean energy jobs we need right now. #debates #OccupyThe…,1474940018726,780581130760294400,1
396,jdhmtl,"""The Fed is doing 'political things'"". Direct quote. Fuck me. #debates",1474940018763,780581130915442689,2
397,sgurumur,"Trump's debating algorithm: Randomly pick one generic answer, and keep talking #Debates",1474940018536,780581129963331584,2
398,Archinkunmi,I swear ...i for don blow that guy eye . https://t.co/0Zyg85WCyq,1474940018646,780581130424684544,1
399,EthanPVaughn,Being under audit doesn't matter. He can release his taxes #debates,1474940018695,780581130630234112,0
400,TaraHarlam,ANSWER THE QUESTION DONALD #debates,1474940018619,780581130311434241,2
401,alexqt20,Donald Talks slowly when being attacked than when attacking Hilary... hmmm. #Debates,1474940018799,780581131066363905,2
402,fromjesstoyou,"Retweeted Michelle Collins (@michcoll):

Wish Hillary had an airhorn under her podium. #debates",1474940019658,780581134669230080,2
403,NAimprov,.@realDonaldTrump CANNOT HELP but sneak in a brag about his $$$ That's a level of #narcissism even we can't hit  #debates #debatenight,1474940019593,780581134396555264,2
404,twistedparent,You agent being audited #debates,1474940019652,780581134644154368,2
405,Scout_Finch,Poor Donald Trump is such a tax victim. #debates,1474940019619,780581134505619456,2
406,greatjoy4,#LetGaryDebate #Debates,1474940019553,780581134228975617,2
407,dcolliercagw,Would like to hear how the candidates will reduce regulatory burdens on American businesses to help them succeed and create jobs. #debates,1474940019462,780581133847261184,2
408,amyeritter,The Plight of the Corporation by @realDonaldTrump #debatenight #debate2016 #debates,1474940019632,780581134560292864,2
409,SandraMoreNV,The IRS said being under audit did not stop him from releasing his returns. #debates,1474940019696,780581134828576768,0
410,Sherw00dGirl,Hillary kicking ass!!!!!! #Debates,1474940019655,780581134656741376,2
411,bobbie_miles72,What was that website again #Debates,1474940019652,780581134644178947,2
412,jenstewart77,@samepstein19 Why didn't we think of this?? #debates https://t.co/M984fQm4Rp,1474940019484,780581133939568640,1
413,ArizonaTiana,He really don't even deserve to be president look how he acts lol so childish talking over everyone https://t.co/BQnsmaU4r2,1474940019488,780581133956284418,1
414,w_alexander13,"Trump is under the longest ""routine audit"" in the history of taxes #debatenight #debates #Debates2016",1474940019416,780581133654294528,0
415,tylerswagar,"Oh my god, NBC checked a fact.  I'm off to go buy a lottery ticket.  #debates",1474940019606,780581134451273728,2
416,TJWest3,Trump is not answering the question about his taxes. #debatenight #debates #Debates2016,1474940019660,780581134677766144,0
417,gringochulo1,#debates Give massive incentives for US companies to stay and create jobs here. Max penalty for leaving,1474940019738,780581135004741633,2
418,Romain_Ch,Trump. #Debates https://t.co/2bWmIYPMCi,1474940019556,780581134241595392,1
419,HaidaPrincess,#debates Ask @realDonaldTrump for Audit Tax Letter? Stop #Yelling &amp; Lying #debatenight Where Are Your #Taxes? Fdn Bondi Ask?,1474940019619,780581134505652224,0
420,kohoe,Yelling about everything and interrupting your debate opponent is not the way to win over people #Debates,1474940019768,780581135130636290,2
421,justinebrighten,my fave thing is when Clinton laughs when Trump talks. cuz same. #debates,1474940019743,780581135025700864,2
422,Katrell86,Imagine Trump on the world stage amongst other world leaders..... we would have no more allies #debatenight #Debates2016 #debates,1474940019625,780581134530932736,2
423,BrentBraveman,"@realDonaldTrump showing who he is...uninformed, rude, absent of facts and knowledge #debates",1474940019536,780581134157553664,1
424,adicloud,"""I've been under audit for 15 years."" I wonder why. #debates",1474940019790,780581135223033856,0
425,Javierbustamant,Si sale presidente #trump va a quedar la pura caga #debates,1474940019752,780581135063588864,2
426,jamandell,".@lesterholtnbc, ask this: Over 10% of federal judgeships are vacant; how will you address this judicial vacancy crisis? #debates @acslaw",1474940020681,780581138960048129,2
427,AnikaK213,"Where is your American pride, #Trump? You keep saying ""our country is doing so bad!"" #debates",1474940020548,780581138402308096,2
428,JustinGiraffa,"I'm entirely unsure if Trump has prepared any kind of responses, at all, to any of the questions. It's pure stream of consciousness #debates",1474940020582,780581138544852992,2
429,GahTexYT,Wow winning tonight? #debates,1474940020693,780581139010363393,2
430,nungunkin,I don't want either of you to be president #Debates,1474940020729,780581139161296896,2
431,creek_trash,☝🏻️☝🏻👌🏻 #Debates,1474940020608,780581138653773824,2
432,seeKKandPHInd,15 year audits though. That brings more questions than anything. #debates,1474940020696,780581139022962690,2
433,UTHornsRawk,"Hillary is so crazy, her eyes are going nuts, look at her sweat LOL. 

She is just nasty 

#Debates2016 #Debates Pr… https://t.co/TOWQHhTyKC",1474940020441,780581137953398784,1
434,CyberHalogen,Release taxes and not trade deals what's wrong with @realDonaldTrump #debates,1474940020581,780581138540683264,0
435,TelemundoNews,Donald Trump: “Qhe me haga una auditoría del servicios de impuestos de EEUU no me importa” #debates #yodecido #noticiastelemundo,1474940020730,780581139165609986,2
436,rajashri78,This makes me sad abs angry #Debates,1474940020693,780581139010445312,2
437,ScottBoxer,"Lester Holt firing out those facts, Trump ignoring them, Hillary wondering how the hell her life came to this. Welcome to 2016. #debates",1474940020829,780581139580854272,2
438,JDSRE,"#helies #debates #ImWithHer ""can't release tax returns during audit"" #1millionxperlie (fact: IRS says, not true)",1474940020720,780581139123765253,0
439,TheBigPapaSmurf,This orange ghoul's shitty website doesn';t even work #debatenight #Debates2016 #Debates https://t.co/srZYkg2VY0,1474940020490,780581138158981124,2
440,JustBergIt,There's no law or policy saying you can't release your tax returns while being audited.  #Debates,1474940020894,780581139853434881,0
441,ChancesFavor,Damn I wish #debates had scores like football.,1474940020654,780581138846785536,2
442,SalmanTheSaudi,Gee I wonder why you're audited so often #PTMME #Debates,1474940021662,780581143074570240,0
443,Kraig_Roach,This is my nightmare. #debates,1474940021663,780581143078809600,2
444,Reciprocity4,"Hillary lied ,she was for the #TTP lol #debates",1474940021435,780581142122655744,2
445,AdrianwithaW,You get audited because you’re a fucking crook #debates,1474940021509,780581142432878592,2
446,KalliyahDejesus,You can almost see all bullshit he's spewing #Debates,1474940021700,780581143233957888,2
447,SoLilMuchTweets,RIP Lester Holt #Debates2016 #debatenight #debates,1474940021697,780581143221526530,2
448,Yakira_Cole,This debate annoying already. All I'm hearing a lies being yelled and people getting interrupted. And the crowd. I hear them too. #Debates,1474940021676,780581143133421572,2
449,DavidY1979,"@realDonaldTrump stop with your bull shit. Release your taxes, or GTFO of the race. #debates #debatenight #Debates2016",1474940021606,780581142839844864,0
450,demandingdata,"What the hell did #trump just say? #debates like really, what the hell did he say?",1474940021687,780581143179436032,2
451,Halleywood,would someone please tie Trumps tiny hands #Debates,1474940021456,780581142210707457,2
452,FunkyProfessor,@TayZonday Can you teach Trump that move to not breathe extra hard into the mic after every sentence?#Debates,1474940021577,780581142718140416,2
453,AllSidesNow,"Donald- ""I've been audited by the IRS for over 15 years"" #Debates",1474940021653,780581143036952576,0
454,valrerob,Release your taxes #Debates,1474940021672,780581143116673024,0
455,WeatDogg,Blah blah blah. I'm a giant asshat. And by the way....you suck Hillary. #Debates #WhoTheHellLikesThisDouche,1474940021643,780581142995009538,2
456,say_naja,"wtf... is ""scuse me"" Donald Trump's favorite exclamation?! #debates",1474940021744,780581143418507264,2
457,HighHeelEsquire,Trump been under audit for 15 years cuz THEY KNOW HE'S JOANNE THE SCAMMER #Debates,1474940021761,780581143489945600,0
458,RogueLeader42,You know why they don't? Cuz they don't fucking cheat on their taxes #Debates,1474940021913,780581144127533056,2
459,ItsOldGregg_67,"After Lester says something conflicting with Donald, Donald proceeds to repeat what he said before. Expected. #debates",1474940021794,780581143628410880,2
460,lindsaystidham,I wish we were down with women interrupting. #Debates,1474940022710,780581147470209024,2
461,RAKoROK77,"I for one, think #PresidentObama has more than earned the right to fucking golf for the rest of his life. #debates #Debates2016 #NeverTrump",1474940022463,780581146434244608,2
462,Variety,"“Join the debate by saying more crazy things"" -Hillary Clinton. More updates: https://t.co/ewQ3CHRm1i #debates https://t.co/SSaGQIqXKO",1474940022551,780581146803380225,1
463,2CupzSunny,But a tax cut for the 1% tho? ....... #Debates,1474940022662,780581147269095424,2
464,Calista__Bates,#debates vamos @HillaryClinton no te dejes chicanear por el payaso de Trump! El mundo te necesita!!,1474940022518,780581146665025536,2
465,MoMcNeil25,"""I've been audited for the last 15 years"" I guess we'll see Trump's tax returns in 15 year #debates",1474940022673,780581147315097600,0
466,ewengel,"""Fed is political"" - another Trump LIE - https://t.co/9LK8a3XP4a #debates #Debates2016",1474940022551,780581146803462144,1
467,Calista__Bates,#debates vamos @HillaryClinton no te dejes chicanear por el payaso de Trump!! El mundo te necesita!!!,1474940022723,780581147524947968,2
468,Naughty_Eskimo,That grin is unnerving #debates,1474940022780,780581147763879936,2
469,theBRUSHoff,"""It will be released when the audit is complete"" aka ""when my people finish fixing the books."" @realDonaldTrump #trump #debates",1474940022649,780581147214508032,2
470,DocElincia,"Mon dieu, Trump est tellement mauvais... Mais il fait du Trump, donc pas de raison que ça change quoi que ce soit après ce soir #Debates",1474940022559,780581146837082112,2
471,nidalezouhir,"would you be like ""shit he's the working man's working man!"" or would you be like ""fuck this tacky bougie rich shit"" #debates",1474940022706,780581147453587456,2
472,kriswernowsky,My phone autocorrects #bigly to #bigot and I'm HOWLING! #Debates2016 #debates,1474940022570,780581146883190784,2
473,sumairanausheen,release your taxes @realDonaldTrump #Debates,1474940022834,780581147990380545,0
474,BigDaddyDisney,#debates that smartass smarmy know it all face is driving me crazy!!!,1474940023692,780581151589138432,2
475,teofilog,Pero daoooo!!!! #debates https://t.co/qtengttOLY,1474940023584,780581151136034816,1
476,AntiBunbun,Trump's Taxes doing him in #debates,1474940023664,780581151471656960,0
477,Dani_James22,Donald Trump doesn't exaggerate at all does he? #debates #debatenight https://t.co/6hJzZDd00F,1474940023391,780581150326652928,2
478,JordynJournals,I can relate. I get audited all the time. #debates,1474940023692,780581151589199873,2
479,wildADELE,#debates  #debatenight Si estaría en su Estado votaría a @HillaryClinton Te vamos a extrañar @BarackObama 💕 Goodnight!,1474940023580,780581151119376384,2
480,mighty1_mouse,How long do these tax audits really take? #Debates,1474940023780,780581151958114304,2
481,InsecureDonald,"I don't mind releasing tax returns.

Where are they Donald, where?!

#TrumpBullShit
#debates",1474940023779,780581151953911808,2
482,contrapuntist,"Yes, Donald Trump did call climate change a Chinese hoax | PolitiFact #debates #Debates2016  https://t.co/3PKUM05ocN",1474940023696,780581151605821440,1
483,lindahart1,Best tweet on debate night #1 thus far! https://t.co/CLg3zNQunS,1474940023675,780581151517708288,1
484,5wa,#debates: #TheDonald says the Fed is more political than H. #SMH. That was an off the cuff bad thing to say,1474940023693,780581151593357312,2
485,thebmacattack,got that yung visceral reaction when Trump said how much money he was made last year #debates,1474940023676,780581151522058241,2
486,DarrenJHepburn,We are in a bubble #Debates https://t.co/tEqD8jKzll,1474940023479,780581150695751680,1
487,daniedeakin2000,#Debates https://t.co/owKEDXhnUZ,1474940023650,780581151413047296,1
488,Jefferson_Locke,So Trump is now bragging that he's constantly being watched by the IRS? #debates #Debates2016,1474940023798,780581152033734656,2
489,care_bear89,I don't think I would brag about being audited every year?????? #debates,1474940023825,780581152146894848,2
490,wordsofwerts,Bloop. #Debates,1474940023794,780581152016871424,2
491,KennYouuNot,I have a lot of respect for Hillary for keeping calm. My ass would've hopped over the fucking podium and punched him #Debates,1474940023799,780581152037957632,2
492,DopeDerpTweets,"If you get audited every year, you're probably a crooked POS. #debates",1474940023901,780581152465616900,2
493,TheWilsonWilson,"""People arguing on my facebook is getting to intense. Hope I don't see any more of that tonight."" -me before turning on the #debates",1474940023751,780581151836549123,2
494,fancyspatula,"""I get audited almost every year"" GEE, I WONDER WHY.  #Debates2016 #debates #debatenight",1474940023507,780581150813261824,2
495,tieoptional,"I GET AUDITED ALMOST EVERY YEAR

hmmmmmm…..

trump

#debatenight #debates",1474940023830,780581152168050688,2
496,thegreatkevun,Trump is the Interrupting Cow and the joke #Debates,1474940023921,780581152549515264,2
497,RicaLove05,#debatenight #debates. . #lol #donaldtrump #LIES again about not releasing his #taxes even the #irs said he can release it &amp; is lying..,1474940023923,780581152558047233,0
498,wbkrebs,"Trump's trying to point at enemies, without presenting solutions.  Won't work. #Debates",1474940024621,780581155485519872,2
499,TerryJYoung,"Can you imagine Trump working trade deals with other leaders, all the yelling and over talking. #debates",1474940024475,780581154873348096,2
500,suerameyatkins,Could Trump possibly answer a question #Debates,1474940024667,780581155678527488,2
501,DeeDeeDynamite,God honest truth #debates https://t.co/B2Q0zwQaIT,1474940024434,780581154701258752,1
502,sassmastermk,YES LESTER YOU TELL HIM WHAT'S UP WITH RELEASING TAXES UNDER AUDIT. #debates,1474940024666,780581155674296321,0
503,workisforsuckas,"If he economy is bad, why are there 2 multi millionaires running for president?  #debates #debatenight",1474940024667,780581155678609413,2
504,SethBlairTweets,Actual fact in my house https://t.co/rNTtnEz1hF,1474940024634,780581155540180992,1
505,Bigsteelguy2,#Debates Live Hey America: The Choice is Ours not theirs (2016) Official Full Version https://t.co/jdoi7l0tJr via @YouTube,1474940024733,780581155955314689,1
506,TriumphantlyMad,YOU DONT EXCUSE THE MODERATOR HOLY SHIT I'M FUCKING SICK #Debates,1474940024593,780581155368239104,2
507,thotaday,a REAL gop candidate 🙊 #UnlikelyDebateGuests #Debates2016 #debatenight #debates,1474940024800,780581156236369921,2
508,evolvingworld,Just wish tromp let her talk and stop trying to out talk her by being loud #Debates,1474940024705,780581155837927424,2
509,RedsPaintings,"Umm, sure sounds a little complainy. #TaxReturns #Audits #debates",1474940024688,780581155766546432,2
510,Jazmynsscott,Because he's a crook!#Debates,1474940024735,780581155963756545,2
511,LadyInfidels,#debatenight #Debate #factcheck https://t.co/qoznvQXCfN,1474940024535,780581155124879360,1
512,seunghyunie,why is trump allowed to interrupt but no one else is #debates,1474940024761,780581156072947714,2
513,Colleen_ham1,Trump's been under audit his entire life #debates #debatenight,1474940024581,780581155317899264,0
514,MncVIII,Release you return. Hiding russian debt?  #debates,1474940024748,780581156018270208,1
515,rynthetyn,"Your audit doesn't have anything to do with releasing your returns, Donald. #debates",1474940024669,780581155686973440,0
516,ManimalCrackers,this is more entertaining than intruiging and thought-provoking #debates,1474940024771,780581156114800640,2
517,cpd623,And didn't Bush sign the NAFTA? #debates How basic of a fact is that one? Why isn't @LesterHoltNBC participating in this debate?,1474940024676,780581155716423680,2
518,Hismail786,"#Donald #dRumpf you blame the #politicians You are trying to be ONE @realDonaldTrump @HillaryClinton #debates #CNN 
https://t.co/wvkpOn3tHd",1474940024582,780581155322101760,1
519,trcfwtt,Trump is so fucking immature and clueless. He's already lost this debate.  #debates,1474940024765,780581156089630720,2
520,leighbeedesigns,Under audit for 15 years because you're a f'ing crook #Debates,1474940024717,780581155888398337,0
521,yeppo_cakes,No it won't stop lying #Debates,1474940024767,780581156098043904,2
522,imleftcoast,Trade imbalance is not equal to the terms of the trade deal #Debates,1474940024823,780581156332769281,2
523,MSNLPZ,Trump defenses are fantastic because they are literally just shouting about something else without actually defending himself #Debates,1474940024797,780581156223713285,2
524,MK_XLVII,Please make a honest trailer for this #Debates,1474940025564,780581159440945152,2
525,x_Wyntir_x,All the haters attack Trump. He speaks the truth #Debates,1474940025615,780581159654854656,2
526,JonathanRoxAlot,"Serious question: Are ""routine audits"" a real thing? #debates",1474940025736,780581160162172928,2
527,Dorch23,#Debates https://t.co/81Yv31n0Yq,1474940025470,780581159046479872,1
528,Yulazora,What is the truth @HillaryClinton https://t.co/JCnOszQqZ5,1474940025674,780581159902117888,1
529,D34D1337P00L,Anyone else waiting for the cameo from that black doctor @HillaryClinton has? #debates,1474940025705,780581160032227328,2
530,xmacattack,"Hillary basically doesn't need to do much work. Just sit back and relax, girl. #debates",1474940025661,780581159847792640,2
531,the_real_KYM,"I hate to say it but hes holding his own that, thats what politicans do shit it's getting to me!  #debates",1474940025744,780581160195874816,2
532,Donkey_Feed,"FACT: #IRS said #DonaldTrump could release his tax returns at any time. #DonTheCon is deflecting.
#Debates2016 #debates",1474940025697,780581159998660608,0
533,EhhNotBrad,"""If you would have told me I'd make that much money ten or fifteen years ago I'd have been surprised."" Shut. The. Fuck. Up. #debates",1474940025715,780581160074285056,2
534,dsndante,"Both are corrupt, both lie, neither s actions speak for the people. Jill Stein anyone?
   #Debates",1474940025842,780581160606773251,2
535,DjErikaB,Uh oh ..Taxes LOL #debates skip skip blah blah blah deflect to emails,1474940025731,780581160141348864,2
536,TLTYR25,"https://t.co/q2YQSU49v8
#debatenight #Debates2016 #debates @realDonaldTrump",1474940025762,780581160271380480,1
537,laurie_garden,"@ingridnilsen ""I think Donald Trump shuldn't be President because he's stupid"" #debates",1474940025834,780581160573251585,2
538,Candice_C_Marie,@tarantinhoe13 https://t.co/mz0N5aGjnv,1474940025229,780581158035881984,1
539,TheSam_Factor,You're complaining about your audit in front of 100 million people right now. Ok. #debates,1474940025815,780581160493674496,2
540,OAngelique,Trump: Bragging about rich you are is bullshit. Irrelevant to your abilities as president. #debatenight #debates,1474940025885,780581160787193856,2
541,hrana,Ohhh... https://t.co/MxJ0NLQY1r,1474940026550,780581163576414211,1
542,teenytottams,Being under constant state of audit is not a bragging point??? #debates,1474940026665,780581164058804224,2
543,katedfisher,"""I get audited almost every year."" Great self-endorsement. #debatenight #debates #Debates2016",1474940026686,780581164146913280,2
544,B__creative,나도 투표하고싶엌ㅋㅋㅋㅋ #debates,1474940026713,780581164260089856,2
545,wakeupwaffles,"I just told @nbcwashington who I think is winning. Cast your vote now! #Debates #NBC4DC
https://t.co/6ZPnEMhT1F",1474940026554,780581163593236480,1
546,Golduck,"What is even happening, how did the Republican Party allow this dolt to take the stage. #debates",1474940026618,780581163861741568,2
547,jennesworld,"#debatenight #Debates2016 #debates #BillyMadison 

https://t.co/gcLavG5FiF",1474940026419,780581163027030016,1
548,realfandumbgirl,Dude maybe you get audited so much because you have terrible business practices #debates,1474940026550,780581163576492032,2
549,DesiBoilermaker,Because you are a fraud #Debates,1474940026723,780581164302135297,2
550,keeganleee,"She sure did call him crazy.
#debatenight  https://t.co/aZb05AOuWj",1474940026549,780581163572334593,1
551,michael_j_bravo,#debates #debatenight  Downturn to ensue under Trump trade policies https://t.co/BX2RiQFncS,1474940026677,780581164109234176,1
552,LKuhr7,how many times has Trump mentioned an audit now? #debates,1474940026807,780581164654338051,0
553,Liam_SEO,14 minutes into the debate... I'm boiling.  #Debates,1474940026688,780581164155154432,2
554,__biancat,"""[My taxes] be released as soon as it's done being audited"" -- Trump 

#debates",1474940026786,780581164566274048,0
555,malasadasbooks,Same old repetitions.  He's trying to filibuster the debate. #debatenight #debates https://t.co/O96LIscEgP,1474940026638,780581163945512960,1
556,sara_schechter,#Debates this shit is so messed up honestly. neither of them are great choices.,1474940026830,780581164750770177,2
557,AmyHarber,"if you've been audited for the past 15 years, that should be a red flag right there. #debatenight #debates #Debates2016",1474940026833,780581164763361280,0
558,MoniquejRose,Release your damn taxes!!! #debates,1474940026828,780581164742389760,0
559,Buqhead21,"Yeah, I can relate to $684 gazillion in income #Debates",1474940026808,780581164658458624,2
560,pamwye,#debates you r free to release your taxes per IRS. So why not release them.,1474940026759,780581164453093377,0
561,Favstar_Bot,"@gracehelbig Congrats on your 1000❤️ tweet! https://t.co/39WZhfXfaR

https://t.co/uIarzQUdU3",1474940026629,780581163907682304,1
562,kryspia,"Bless your heart for debating with this cretin, @HillaryClinton. #ImWithHer #debates",1474940026708,780581164239073281,2
563,karatewolfpunk,#BroadenTheDebates #Debates #Debates2016 #economy https://t.co/qg1pI2jt5z,1474940026636,780581163937050624,1
564,Johnsim96763947,Audit trump because you are a thief and crook #Debates,1474940026923,780581165140881408,0
565,DeriseMike,"#Debates DT's companies manufacture in China, Taiwan #partoftheproblem #thatsbusiness",1474940026820,780581164708945921,2
566,SubySalt,"Who's winning 30 minutes in?

#trumpvsclinton 
#Debates2016  #debates
#debatenight",1474940027475,780581167456223232,2
567,loganlarocque,You got audited because you find every tax loophole in the books. #debates,1474940027670,780581168273960960,2
568,Kaimandante,"""We are in a big fat ugly bubble"" - Donald Trump economic analysis
#debates https://t.co/NpJv2q9sqc",1474940027503,780581167573655554,1
569,Hegel_Martinez,"Me parece que Clinton está jugando a descontrolar a Trump, y lo está logrando. #debates",1474940027686,780581168341057536,2
570,natter1983,#debates https://t.co/Vbk7mq2BC6,1474940027650,780581168190066688,1
571,AppleBetasDev,EXCUSE ME #Debates,1474940027689,780581168353804289,2
572,Just1nMKE,@GovGaryJohnson needs to be included in the #debates,1474940027775,780581168714358784,2
573,TheOnlyArcher,Why not? Cartoon by @BobEckstein #debates @nytimes https://t.co/fqqvMTNYEo,1474940027055,780581165694681088,1
574,HillaryIn2016,Being under audit isn't stopping Trump from releasing his taxes. He can still do it while under audit. #Debates #Debates2016 #DebateNight,1474940027760,780581168651513856,0
