,screen_name,text,timestamp,tweet_id,cluster_pred
0,Enchanted_Liz,"War torn, 3rd world country. What America are u living in, Donald? I can show you 3rd world #debates #debatenight #ImWithHer",1474941025678,780585354222981120,2
1,Skibabs,"@HillaryClinton: ""We have to restore trust between communities and the police."" #debatenight #debates #Debates2016",1474941025590,780585353853935616,2
2,Mari07Otero,He just told Lester he was wrong. #Debates #debatenight,1474941025681,780585354235523072,1
3,katelovesgoats,Can I please die #Debates,1474941025645,780585354084487168,3
4,tonajimL,Trump is as dumb as a stump!! #Debates,1474941025612,780585353946230784,1
5,Stefany_Cabral,Trump is literally saying a whole bunch of nothing over and over #debates,1474941025563,780585353740742656,1
6,space_menagerie,"#Debates 'A very against police judge"".  3rd grade English.",1474941025601,780585353900093442,2
7,abbie_b_elliott,"Thank you for moderating here, Lester. I need more talking and less interrupting. #debatenight #debates #PresidentialDebate",1474941025672,780585354197958657,2
8,BerniniWeener,"@HillaryClinton is too smart, and too qualified to share a stage with Trump. #debates  #debatenight #Debates2016",1474941025663,780585354160144384,1
9,d_mirabella,"From an old Snoopy poster:  If you can't dazzle them with brilliance, baffel them with bullshit.#debatenight #Debates",1474941025564,780585353744781312,2
10,Beer_Nye,“Stop and frisk works great.” -the rich white man yelling at me on the tee-vees #Debates,1474941025699,780585354311110656,1
11,PSU_RichCheryl,"So, ""what difference does it make""? https://t.co/AjqDb6gjKJ",1474941025661,780585354151604224,3
12,zerotntsquads,"https://t.co/3mvSxZeve1
#debates
DONT U JUST LOVE SWATTING CANADA GOTS SWAT TEAM 2",1474941025796,780585354717913088,3
13,ShabreiP_Esq,He's got the Chicago stats b/c he's got property there #Debates,1474941025777,780585354638266368,2
14,navii_thefae,Who wants to become an officer when so many people hate them? #debates,1474941026662,780585358350135296,1
15,AmandaPlease_19,I just told @nbcwashington who I think is winning. Cast your vote now! #Debates #NBC4DC https://t.co/1E0WEHDTZu,1474941026455,780585357482024961,3
16,winemedineme,"I don't think I've ever heard of a ""very against police judge"". #debates",1474941026424,780585357352009728,2
17,cracker2tarheel,Donald wants a police state #Debates,1474941026433,780585357389824004,2
18,ColeLovsYou,It'd be fun to watch @GovGaryJohnson and @DrJillStein on that #debates stage. #OccupyTheDebates #debatenight,1474941026526,780585357779709952,3
19,_ASiASHERROD_,Let's talk about how many times he bring up Obama #debatenight #debates #Debates2016,1474941026642,780585358266363904,2
20,mainhoun_Sarah,African Americans and hispanic are living in hell because of people like you #Trump #Debates,1474941026469,780585357540745216,1
21,JoshPhelps02,I think Mrs.Allen taught me how to debate better than these two... #debates,1474941026654,780585358316621828,2
22,pjones_,"Lester, way to go for challenging the falsehoods Trump was advancing about stop and frisk. Do more of this please, Mr. Holt.  #Debates",1474941026462,780585357511458817,1
23,JamesDalgarno_,#Trump says that #America needs more #police to quell gun violence.  #Debates #debates2016 #Clinton #Trump,1474941026699,780585358505414657,2
24,Cole_EJ,"this could NOT be FURTHER from the TRUTH. @realDonaldTrump do you know what ""truth"" means? #debates https://t.co/PUIU3q1Hwk",1474941026571,780585357968568320,3
25,anna_dsm,I think the only thing I agree with Drumpf on is that we should bring @LawandOrderSVU1 back. #Debates,1474941026692,780585358475997184,2
26,ToddisaGoodName,Take guns away from people? There went Trumps NRA endorsement. #debatenight #debates #Debates2016,1474941026550,780585357880492033,1
27,OfficialLNWD,"Hey, @realDonaldTrump,

Fuck you, fuck #RudyGiulliani and fuck stop and frisk. #debatenight #debates #Debates2016",1474941026599,780585358086041601,2
28,a3auntie,Hillary SOLD out America for financial gain #Debate https://t.co/JPV5iy8T4O,1474941026537,780585357825880064,3
29,cokes311,I did not expect Mr. Trump to debate the moderator. #Debates,1474941026595,780585358069202950,2
30,wickednitsch,This is it. This is where @realDonaldTrump  has come totally undone. He is in total denial of reality! #stopandfrisk #debates,1474941026527,780585357784059904,2
31,soarrinn,Stop-and-frisk. #Debates,1474941026693,780585358480252928,1
32,sincerely_steff,Trump keeps rambling. #debates,1474941026510,780585357712629760,1
33,Cardkillah,#Debates Trump supporting Stop &amp; Frisk. Not shocked at all. He wants more force. More Governmental power. More statism.,1474941026698,780585358501285894,1
34,LSATMax,Trump ignoring counter evidence against Stop &amp; Frisk. #lsat #debates2016 #debatenight #debates,1474941026811,780585358975115272,1
35,chancechris69,You have to ha stop and first??!! OMFG #PresidentialDebate #Trump #debates #racist,1474941026554,780585357897261056,1
36,Ja_RoniMo,I'm a Chicago native. Born &amp; raised. Southside proud. I kinda want him to stop sayin the name of my city. Sounds gross on his lips  #debates,1474941027663,780585362548666368,1
37,bchonis13,I just told @nbcwashington who I think is winning. Cast your vote now! #Debates #NBC4DC https://t.co/xY8Xe5s7bW,1474941027587,780585362229907456,3
38,highkayy,Is he even talking about the topic it just sounds like he's rambling #debates,1474941027681,780585362624086016,1
39,Vote4JillStein1,"DrJillStein: I'm the only candidate who doesn't take money from corporations, corporate lobbyists or super PACs. #OccupyTheDebates #debates",1474941027587,780585362229981188,2
40,bradfordneal,Good luck with that. https://t.co/juMZMy1D1X,1474941027604,780585362301128704,3
41,d0raking,WHAT THE HELL DOES OBAMA HAVE TO DO WITH NIGGAS SHOOTIN?!?! #Debates,1474941027621,780585362372583424,2
42,MattyToJo,Donald Trump is despicable #debates #debatenight,1474941027550,780585362074853377,1
43,RichardPct1122,"Donald Donald, I am more afraid of getting my money taken away by bankrupt businesses like yours! #Debates",1474941027691,780585362666074112,1
44,Ariel_akeeL,"Everyone noticed he slipped ""illegal immigrants"" into the conversation. Take a drink. #Debates",1474941027676,780585362603270144,2
45,maaddeelinnee,"""a very against police judge"" WOW. #debates",1474941027710,780585362745765888,2
46,ShowMeYourDisc,Ummm not ok. WTF?!?#debates  #Whitesagainsttrump @wkamaubell https://t.co/253LUvYuzC,1474941027673,780585362590605313,3
47,jamesdavidsaul,#debates https://t.co/0CIOaz9Ui6,1474941027422,780585361537961988,3
48,mikeavila,So his answer to solving the race issue is to do more stop &amp; frisk?? #debates,1474941027697,780585362691334144,1
49,karenm,Trump can't mention a place without talking about his property or investments there. #ImWithHer #debates,1474941027631,780585362414448640,2
50,_KyleGreen,@adamcarolla somebody say family and education! #debates,1474941027602,780585362292928512,2
51,aveiman,"""Ilegal immigrants have guns and they shoot people"" Trump's takes are so profound and groundbreaking. Just say heil hitler and go. #debates",1474941027725,780585362808799232,1
52,longlegzK,Foot in mouth disease. #Debates,1474941027688,780585362653585408,2
53,ShawnaFoster,Trump wants to take away guns from people? Reeeeeeeeaaaly #debates,1474941027722,780585362796056576,1
54,swatsociety,Soooo defensive. #debates,1474941027770,780585362997415936,2
55,jslunchcounter,This is coming from a libertarian.... https://t.co/JngFer2JfY,1474941027584,780585362217431040,3
56,KundaliniLady,How many times has #trump said he agrees with Secretary #clinton tonight? #debates,1474941027580,780585362200690693,2
57,shushwalshe,Our @ABC Debate Fact-Check: How Donald Trump and Hillary Clinton Stack Up:  https://t.co/IfVjs1PWjb via @ABCPolitics #debates,1474941027537,780585362020245504,1
58,toddtaylor22,Now #trump is going to debate Lester Holt?!? #debates,1474941028646,780585366671818753,1
59,mlonnroth,Hmm #debates ja @realDonaldTrump @HillaryClinton -twiitit. Sielujen syvyydessä sattuu kun Clintonin Trump-strategia on jotenkin pöllö.,1474941028460,780585365891641344,2
60,mjsante,Conservative friends: @TruthinessCheck needs fact-check requests from Clinton's #debates statements. Have one? DM or #TCDebate,1474941028642,780585366654885888,1
61,solkuroi,"So trump's answer to African American race tension is ""we need more law and order""......... sir your an idiot..... #debates",1474941028560,780585366311108608,0
62,frangutang,Stop and frisk+law and order+more police. This is frightening rhetoric. #debatenight #debates,1474941028589,780585366432559105,0
63,yj100889,트럼프말 이해할수 있는사람 찾습니다 ㅋㅋㅋㅋㅋ #Debates,1474941028741,780585367070085120,2
64,jjaaazz,How the hell is it obamas fault for the shootings!? #Debates,1474941028672,780585366780727296,1
65,_GoldenGuh,Let's talk about the issues behind the gun violence in Chi and wherever else. Let's talk about the root causes it ain't the guns. #debates,1474941028675,780585366793314304,2
66,SeramonyTweets,Stop blaming @BarackObama #Trump  #Debates,1474941028645,780585366667616257,1
67,TynanDarkLion,blacks and browns are bad people says @realDonaldTrump -smh #debates #debates #Debates2016,1474941028723,780585366994595840,2
68,murpheyaw,"Trump sounds like an ignorant ass, so nothing unusual #debates",1474941028578,780585366386577409,2
69,FabulouslyCOGIC,What does police endorsements have to do with the question??? #Debates2016 #debatenight #debates,1474941028737,780585367053316096,2
70,xXrachelXx4,U just shot yourself in the foot Donald  #Debates,1474941028367,780585365501513728,1
71,abc15,".@realDonaldTrump on the importance of law enforcement should be be elected:
#debatenight #debates https://t.co/bwjkWbvlUV",1474941028434,780585365782556672,3
72,_bellee_1,"Again, Trump only cares about Chicago because he has property there. #debates #debatenight",1474941028716,780585366965420034,1
73,pamrollins_,CHICAGO ARE YOU LISTENING?! I can't believe this guy. Literally just face palmed. #debates,1474941028601,780585366482849792,2
74,iambobbytwix,Trump's authoritarianism is showing #debates,1474941028791,780585367279763459,1
75,elleossello,"""She was an against police judge."" @realDonaldTrump #debates #wtf",1474941028678,780585366805843968,2
76,Sambizzo,Hillary is just danced 💃🏼around the cops and killings around the USA   #Debates,1474941028739,780585367061794816,1
77,hendley_clark,Is Trump sick?  Pneumonia?  #debates,1474941028799,780585367313403904,2
78,suburbanita,...he's an idiot. A self serving idiot. #debates #fucktrump,1474941028861,780585367573409793,2
79,vanessaweisss,Facts are irrelevant #debates #debatenight https://t.co/bJtAIW3mG7,1474941029561,780585370509598720,3
80,NickPulsipher,Give Trump a break for a minute. He needs more cocaine. #debates,1474941029616,780585370740101120,1
81,PerrWill61,"Who's winning the debate?  Me, because I'm watching #MNFootball instead lol #debates",1474941029634,780585370815725569,2
82,DMWhinnen,Holt get control of this debate stop letting Trump talk over you.  #debates,1474941029721,780585371180552196,1
83,_Snape_,"Ever wonder?
#debatenight #debates https://t.co/umdrD5sCX4",1474941029035,780585368303394816,3
84,halithecomet,"Stop-and-frisk worked SO well... At being unconstitutional, subjecting people to racism, and making people of color feel targeted #debates",1474941029264,780585369263890432,1
85,tooradtogetmad,I need a bottle of vodka tbh. https://t.co/qzePkV7kZT,1474941029411,780585369880371200,3
86,TheNowTampaBay,"LESTER HOLT: ""Stop and frisk was ruled unconstitutional.""

TRUMP: ""You're wrong.""

#Debates",1474941029430,780585369960054784,1
87,bryandico,"Parang Roxas-Duterte pala itong #debates 

Him: Accuses past admin, promises, funny guy
Her: Presents 'facts'",1474941029625,780585370777890817,2
88,PeggyProbert,#debates OMG stop and frisk is his answer! And blaming crime on illegal immigrants. Wow he's part of the problem,1474941029623,780585370769436673,1
89,Ston317,Ewww #Debates,1474941029390,780585369792372736,2
90,Nimgbecks_1439,No wonder he lives in his own reality. Well done Trump...Wake up you Trump https://t.co/mMnuwN9UgK,1474941029672,780585370975145984,3
91,jedwinschmalz,"Hillary: I have a vision for the country, here's how we do it. Trump: this person likes me and this group likes me. Please like me. #debates",1474941029760,780585371344207872,2
92,benjean2,WTF is he talking about?  #Debates,1474941029815,780585371574808577,2
93,brentalfloss,"Trump said in defense of ""Stop and Frisk"" that we’ve got to take guns away from people who shouldn’t have them. He'll pay for that.
#debates",1474941029778,780585371419553792,1
94,Read_my_note,"It doesn't matter how well @HillaryClinton speaks, she is a LIAR! My vote for @realDonaldTrump is UNCHANGEABLE! #debates #USA #TrumpPence16",1474941029523,780585370350125057,2
95,JohnBarronUSA,Facts. https://t.co/SrmGUrRyMp,1474941029814,780585371570622465,3
96,FrotusFlower,"Yes let's take the guns away from the bad people..you know the ones who shot up the churches, preschools, and shopping malls #debates",1474941030667,780585375148478464,1
97,kellie_adamiok,Trump telling the moderator he is wrong 🙄🙄🙄🙄 #debates https://t.co/BSahidzmeC,1474941030525,780585374552915969,3
98,chaos_goose,Trump now debating the moderator #Debates,1474941030675,780585375181918208,2
99,rebajesse,"We should take away guns from the bad people
Or just have gun laws... 
I mean trump is like exhibit A. #debates",1474941030564,780585374716456960,1
100,benhuelskamp,"""A city that I love; a city that I have investments in."" And we're back to his businesses. #allaboutthemoney #Debates",1474941030270,780585373483151361,1
101,YourLifeAfter25,"""Yes, without law and order our nation cannot survive. Elect us and we shall restore law and order."" - Hitler #debates #debatenight",1474941030544,780585374632542208,0
102,TriloBine,Stop and frisk Trump for his tax returns.  https://t.co/axaTooILie,1474941030588,780585374817087488,1
103,AmericaFirst16,"Trump is passionate!
Hillary is robotic!
#debatenight #debates",1474941030608,780585374900973568,1
104,GamingFolks,Will Trump do whatever as the president to do what he wants. #Debates,1474941030746,780585375479717888,1
105,LithOrbane,"&gt;States a fact
&gt;Trump: ""You're wrong""
#debatenight #debates #Debates2016",1474941030703,780585375299502080,1
106,ForneusLex,Oh hey the moderator actually called Trump out on something. :p #debates,1474941030343,780585373789462528,2
107,WOMBniverse3,EXACTLY he's not slick https://t.co/pt8444Keug,1474941030708,780585375320289280,3
108,kellyrfeller,"""I have property in Chicago."" Yes, cuz property values are more important than black people's lives. #debates",1474941030752,780585375504793600,1
109,chmarns,Trump should really talk more about how much money he has. #eyeroll #merica #comedyand tragedy #Debates,1474941030481,780585374368182272,1
110,mgs4335,Toda persona que vaya a ejercer un cargo público debe tener declaraciones impuestos al día y declaración del patrim… https://t.co/gEq7ho1F0I,1474941031599,780585379057369089,3
111,needle_eater,"#debates ""NO NO NO I'M RIGHT, YOU'RE WRONG"" -Trump, basically",1474941031626,780585379170701312,1
112,sodburger,OMG NO ONE CURRRS WHERE ALL YOU HAVE PROPERTY ASSHAT #debatenight #debates #Debates2016,1474941031542,780585378818523136,2
113,Jasper1029,哈哈哈阿桑奇神补刀！ https://t.co/QtehlxoEUH,1474941031604,780585379078352896,3
114,CoachBruceFox,My thoughts exactly. https://t.co/PGoHbsu113,1474941031396,780585378206085122,3
115,msjilljones,lester holt bringing the logic/law/constitution into it...trump's not having it. #Debates,1474941031729,780585379602849793,1
116,BethMSH_,"Trump is endorsed by the Fraternal Order of Police. 
 #DebateNight #Debates",1474941031678,780585379388719107,2
117,debsmithhomes,"your debate is NOT a ""beautiful"" thing #Debates",1474941031626,780585379170770944,2
118,Buck_I_Fan2002,Everytime @realDonaldTrump says law and order I can only picture family guy ... #Debates2016 #debates #debate https://t.co/EW7zfPhz98,1474941031281,780585377723740161,0
119,Terjimanian,So much for a moderator huh. https://t.co/LDoKt8dvLz,1474941031539,780585378805940224,3
120,WPIR984Fm,@realDonaldTrump get off Chicago nuts lol #Debates,1474941031679,780585379393114112,2
121,melvindaletrash,My favorite judges are very against police judges #debates,1474941031616,780585379128872961,2
122,CleveCat,Take #guns away from #BadPeople #debates,1474941031602,780585379070083073,1
123,ojlove,No Trump did not tell Lester that he was wrong about stop &amp; frisk being ruled unconstitutional! #debates,1474941031737,780585379636183040,1
124,ashpieface,"who are the ""bad people"" with the guns? he's mention chicago, blacks and hispanics. only. #debates",1474941031779,780585379812380674,2
125,FakePretty,"Oh boy. #debatenight ""stop and frisk was ruled unconstitutional in New York"" go Lester! #debates",1474941031598,780585379053305856,1
126,trellar,WELP TIME FOR MORE BEER #debates,1474941031610,780585379103580160,2
127,lindsalexandra,Trump really likes @nbcsvu #Debates,1474941031844,780585380085051396,1
128,tradoprodidit,Whatever you say #Elections2016  #DonaldTrump #HillaryClinton #debates #debatenight https://t.co/beGpxdb6BE,1474941031610,780585379103727616,2
129,Noah_Caron_,Take a shot Everytime Trump talks about owning property in a problem area #debatenight #debates #Debates2016,1474941031783,780585379829284864,2
130,cskarellis,This must be the most roundabout and tangential answer in this debate so far. In no way focused on the issue at hand #debates,1474941032644,780585383440637952,2
131,R_A_Smith,STOP AND FRISK DIDNT WORK AND UNCONSTITUTIONAL #DebateNight #debates #Debates2016  #ImWithHer #wtf,1474941032535,780585382983311360,1
132,Fake_Dispatch,"Hillary Clinton, ""Lester, I'm OK with Donald having as much time to speak as he wants."" #debatenight #debates",1474941032638,780585383415341056,1
133,Spacegirlsara,I just told @nbcwashington who I think is winning. Cast your vote now! #Debates #NBC4DC https://t.co/BFZFwpy1oV,1474941032610,780585383297888256,3
134,shimhiding,Trump has her on this one no problem #Debates,1474941032642,780585383432032256,1
135,IamHotDogginIt,Cuz everything she says is a Lie! #Trump #TrumpPence16 #Trump2016 #CrookedHillary #MAGA #TrumpTrain #debates… https://t.co/6z1jFI9zgC,1474941032598,780585383247482880,3
136,raemwoods,*Breaking* @realDonaldTrump wants to take away your guns #debates #ImWithHer,1474941032677,780585383578968064,2
137,torilbrown,I just told @nbcwashington who I think is winning. Cast your vote now! #Debates #NBC4DC https://t.co/TwlFtFWEix,1474941032501,780585382840762368,3
138,skummiart,"i love how everything is about where he has property "" bad racial relations in chicago, its terrible, i have property there."" #debates",1474941032704,780585383692148738,2
139,Aries419,She's dozing off https://t.co/pek2SzD2HY,1474941032711,780585383721472000,3
140,tolumoyan,As usual. #debatenight #debates https://t.co/BeyJug1Loc,1474941032210,780585381620248578,3
141,kurweezy_,He not answering the question but he has a point.  #Debates,1474941032734,780585383818035200,2
142,zachydg_,"Obama this, Obama that #Debates",1474941032734,780585383817912320,2
143,RahmiCemen,Barack Obama killed thousands of people? Oh my! #debates,1474941032775,780585383989944320,2
144,Aerozoo,"Trump won't touch racism because he doesn't want to insult his KKK supporters.
#Debates",1474941032775,780585383989956609,1
145,Thogstacker,"#debates

Why stop at ""stop and frisk""? Random house to house searches! If you got nothing to hide, you don't mind....right?",1474941032830,780585384220635136,1
146,howdyglover,"Official term ""very-bad-for-police judge"" #Debates",1474941032614,780585383314726912,2
147,loslimaGR,Sniff #sniff #Debates,1474941033667,780585387731202049,1
148,NYRecessionista,I can't even FUCKING believe what I'm hearing https://t.co/39c4WW0Iw9,1474941033369,780585386481418243,3
149,FaucetGenie,"""Charlotte—the city I love...the city where I have investments."" #totallyontopic #Debates2016 #debatenight #debates",1474941033637,780585387605450753,2
150,ruthstarkman,"""Stop and Frisk"" is Trump's plan ""These are bad people"" #debatenight #debates",1474941033683,780585387798376448,1
151,the_hetz,"@realDonaldTrump keeps saying ""we won't have a country"" because he's fantasizing about using those nukes. if we have them...? #debates",1474941033703,780585387882221568,2
152,jessnghsw,Running a country is like running a major company. That's why we need a businessman and not a politician. @bpolitics #debates,1474941033677,780585387773222912,2
153,jms_x3,Donald Trump is a complete moron. I can't believe this is real life #debates,1474941033709,780585387907354624,1
154,Aaronic88,Can I opt-in having only hot cops stop and frisk me? #debates,1474941033673,780585387756584960,1
155,Mariment,"Trump ""We need to take guns away from THESE PEOPLE"" Dog whistle to racists. He means people of color=no guns; white racists=guns #debates",1474941033583,780585387379060737,1
156,coolkid3365,@docrocktex26 Did THAT JUST HAPPEN... AM I THE ONLY ONE THAT SAW THAT #debates,1474941033579,780585387362222081,2
157,TrekManifest,Exactly how Trump is talking #Debates https://t.co/XnkrXcebaH,1474941033559,780585387278368768,3
158,CapitalNekia,Trump: Facts what's that??? #debates,1474941033568,780585387316146176,1
159,VampyKiss,Laughing my ass off 🚽 #debates https://t.co/pMX9TglDVs,1474941033514,780585387089620992,3
160,Politicscanadia,"BonnieCrombie: RT carolesaab: From now on, whenever I get interrupted I'm going to pause and say: let's restart the clock, Lester. #Debates",1474941033654,780585387676823552,1
161,donna_flores,"#debatenight Helllloooo, wake up people, dirty energy will end, and possibly we will to if we do not do anything. https://t.co/fN5OThR5pS",1474941033668,780585387735420928,3
162,JMjustcomedy,"Wait.  You just said 3,000.  1,000 more people just died while you were searching for words?  #debates #debatenight #Debate2016",1474941033694,780585387844567045,2
163,Hillary_45,#TrumpedUpTrickleDown #debate2016 #debates https://t.co/7QmBwXpSAN,1474941033638,780585387609645056,3
164,IsThereADog,"this debate shows that democrats are worse at messaging. if your answer if 15 disparate thoughts, you've lost the everyman vote #Debates",1474941033729,780585387991375876,2
165,RYNisms,Real talk though: neither of them have answered the question. #debates,1474941033753,780585388092121089,2
166,The_Yng_Sinatra,He straight speaking nonsense!!!! #Debates,1474941033355,780585386422788103,2
167,kathybiele,What does NRA think of this? Have to take guns away from bad people. @realDonaldTrump #debates,1474941033609,780585387487932416,1
168,JennKaine,So now Trump is an expert on law and order? And now he's just making it up. Can't string a sentence together on this. #Debates,1474941033624,780585387550924800,0
169,henryrafael,true!!! Lol https://t.co/8PG3cISdi7,1474941033730,780585387995660288,3
170,phototayloranne,"""I have property there!"" Because that's the most important #Debates",1474941034660,780585391896211456,1
171,NNHoch,"""That was found unconstitutional""
""No""
???????!!!!!!??????!!!!?!?!?!?! https://t.co/A3BJhDsAX6",1474941034577,780585391548207105,3
172,EstherNMNLim,Lester is wrong about stop &amp; frisk? It was used as a form of racial profiling @realDonaldTrump #BlackLivesMatter #debates,1474941034676,780585391963246593,1
173,mysticnox1,#debates trump doesn't know what he's talking about,1474941034502,780585391233593344,1
174,PinkPolitical,Stop and Frisk is not going to help with community relations. #debates,1474941034664,780585391912988672,1
175,cjacuff,"Donald J. Trump, Esquire 

#debates",1474941034708,780585392097472512,1
176,MissSML,"Law &amp; order: Stop &amp; Frisk 
 https://t.co/oz7HW8wgZz",1474941034514,780585391283802113,0
177,bomorchoe,Good job by Trump turning that question into a safety and security issue. That's what people really care about #debates #debate2016,1474941034534,780585391367688192,1
178,giannilabbate,Trump ha praticamente proprietà dappertutto. #debates #debatenight #debates2016,1474941034564,780585391493636096,1
179,JustPaigeMee,But what is the plan!!! #Debates,1474941034667,780585391925633024,2
180,amylmiller12,What the eff does a bad person look like? I CANT TAKE IT! #debates,1474941034665,780585391917236224,2
181,TrueBlueLiberal,"Trump on the 2nd Amendment: It's a good amendment for whites, but stop and frisk people of color to make sure THEY don't have guns.
#debates",1474941034663,780585391908909056,1
182,LindaKWS1,17 Reasons #Republican #DonaldTrump Should NOT Be #President EVER!  #ImWithHer #Hillary2016 #debatenight… https://t.co/S3rpvZYLaJ,1474941034591,780585391606800384,2
183,sandiek,you can't bitch about Hillary's coughing without calling out Trump for his sniffling. #debates,1474941034490,780585391183294464,1
184,SarahJanetHill,"Can't wait for the ""Very Against Police Judge"" Twitter account.  #debates",1474941034679,780585391975989249,2
185,marvinnation,"""no, no... hispanics and blacks are criminals"". That's what @realDonaldTrump is saying 
#debates",1474941034784,780585392416313345,2
186,seabent,Only Trump would tell a black man that he's wrong about discrimination against black men. #debates,1474941034804,780585392500113408,1
187,deca_heda,sniff #Debates,1474941034823,780585392579850241,1
188,MartineMontreal,"The man who comes from a group that never gets stopped nor frisk, wants ""Stop &amp; Frisk"" back. That's rich. #debates",1474941034581,780585391564976128,1
189,lee12177,Donald just showed his cards black lives don't matter #debates,1474941035166,780585394018590724,1
190,SADUCTlVE,ITS NOT OBAMAS FAULT U DINGBAT #debates,1474941035617,780585395910221825,1
