,screen_name,text,timestamp,tweet_id,cluster_pred
0,IwannaBaMermaid,"Haha! https://t.co/wMFMTcksH3 has a fact checker!
  #Debates",1474939550678,780579167624695808,1
1,NickBodanyi,Lester Holt is losing. #debates,1474939550828,780579168253640704,1
2,KhaleesiReads,A CNN alert I just got. Not biased. Nope. Never. #TYTLive #debates #debatenight #Tyt https://t.co/4OaPGbK8xR,1474939550410,780579166500560896,0
3,Showme_theropes,THIS DEBATE IS GOING TO BE IN OUR HISTORY BOOKS... #debates,1474939550689,780579167670824960,0
4,Kimergy,"Repeat, shout, repeat, shout and repeat and shout! Trump(et) #debates",1474939550785,780579168073478145,1
5,_MyLoneliness,Trump abre a boca e eu já fico pronta para vomitar a qualquer momento #Debates,1474939550767,780579167997800448,1
6,diarioelpopular,"""No voy a agregar ni un centavo a la deuda"", asegura @HillaryClinton #debates",1474939551721,780579171999232002,1
7,SHENSATIONAL,"#Trump, talking louder doesn't make it a fact. #debatenight #Debates #Debates2016",1474939551655,780579171722416128,0
8,katherinekiyoko,Why is @LesterHoltNBC even there? USELESS. #debates,1474939551718,780579171986608129,1
9,sarahbruning,"Did he really just say ""bigly""? #debates",1474939551682,780579171835707392,0
10,Mortiguin91,"Did I just hear that right? Did Trump say ""bigly""?
#debatenight #Debates2016 #debates",1474939551628,780579171609247744,0
11,traderpm,I can't confirm this tweet. RT @almightygod: Trump is sniffling because he has typhus. #omniscience #debates,1474939551677,780579171814682625,0
12,_Billups_,Lester don't let Hillary walk over you like that #Debates,1474939551726,780579172020199424,1
13,drm2964,"Your not smart, go back to school https://t.co/Ku6UwU9nxI",1474939551742,780579172087271425,0
14,Newsweek,"We deeply regret not including the phrase ""big leagues"" in our #debates bingo card.",1474939551720,780579171995090944,0
15,fritz_stanley,Did Hillary Clinton really just throw plugs out there for her website and her book... #debates,1474939551694,780579171886047233,0
16,teofilog,"Hillary logró evadir la agresividad de Trump, de hecho Trump es su única arma, crear el caos en el #debates y obviar el tema. @carloswester",1474939551633,780579171630055424,0
17,Learn2choose,Trump will be ridiculous in the White House!  Nasty! #Debates,1474939551726,780579172020285440,0
18,bridgetherrmann,"And then, in the dictionary, next to the word ""Man-splaining"", there was a video of THIS. #debates",1474939551829,780579172452229120,0
19,oihufflepuff,"Ta , mas e o trailer? https://t.co/b79saPPGHl",1474939551763,780579172175450112,0
20,MittRegularGuy,"Is Hillary allowed to interrupt and talk over Trump like he has been doing to her?
 Maybe it's his plan to irritate her.
 
#debates",1474939551728,780579172028649472,0
21,iam_musikulture,Why...#Debates,1474939551763,780579172175360000,1
22,arjayreflects,Someone...please get control of this mess. #Debates,1474939551672,780579171793764353,1
23,ShitImKarina,Dude just wants to move on to the next question  #Debates,1474939551838,780579172489887744,0
24,CarolHTucker,Trump just keeps talking no matter what the moderator says #Debates,1474939551610,780579171533787136,0
25,khalidrahemtull,Hillary Clinton with the shameless plug on her website #Debates  #smh,1474939551917,780579172821372928,0
26,RealMReynolds,"I thought he said ""big league"", which I think is funnier than ""bigly"". #debates",1474939552606,780579175711277058,1
27,duffyink,"Earth to Lester, are you there? #debates",1474939552519,780579175346212869,1
28,annawhim,LESTER. Be strong. #debates,1474939552448,780579175048552448,1
29,ThatAintMarth,"Hillary, shut the fuck up!!! We're supposed to move on but you interrupted Lester and Trump you bitch! #Debates",1474939552657,780579175925112832,0
30,JL_Witt,"The fact checking at my website will not be biased at all. Instead, head over to PBS! #Debates",1474939552705,780579176126386176,1
31,RasJammin,there is no interest in FACTS at this debate! thanks lester #Debates,1474939552688,780579176055050240,1
32,27Dollahs,Hillary doing factchecking? AHAHAHAHAHAHAHAHAAAAAAAAAAAA #Debates,1474939552576,780579175585513478,0
33,ricksedler,"Charges, claims=facts #debates",1474939552616,780579175753195520,0
34,neo,dey terk er jerbs #debates,1474939552494,780579175241490436,1
35,gcucci12,@HillaryClinton will not obey these rules during the debate! #debates,1474939552592,780579175652528128,0
36,nora_ramel,@realDonaldTrump is a stand up comedian posing as a candidate period #ImWithHer #debatenight #ImWithHer #Debates,1474939552528,780579175383994368,0
37,elPuertoWhican,"Actually...NAFTA was signed by Bill Clinton on December 8, 1993...though Bush administration helped negotiate it. G… https://t.co/UrVSbdjkE2",1474939552642,780579175862239232,0
38,stewalaniz,"oh, the best fact checking is done by your own people, Hillary. Really? How dumb does she think we are? WTF?
  #Debates",1474939552709,780579176143265792,0
39,TonikaLong,"""Moderator"" #Debates",1474939552718,780579176181067777,1
40,FindingDrishti,tax cuts to giant corporations? sounds like more money for wealthy. trickle down economics doesn't work. they're hoarding up top. #debates,1474939552730,780579176231292928,0
41,dustingeddis,"Wow, fact checker on homepage, now @CMIContent that's what you can call content marketing #contentmarketing #debates",1474939552698,780579176096997376,0
42,audreynp,Trump is an arrogant fool #Debates,1474939552802,780579176533204993,0
43,erikanb425,Fact checker. #debates,1474939552804,780579176541597697,1
44,natfeelco,"Donald Trump, aka Old Yeller. #debates",1474939552704,780579176122167297,0
45,Doug__Benson,Knock knock.  Who's there?  Interrupting Trump... #Debates,1474939552714,780579176164261888,0
46,rebeccadiserio,WE KNOW THE FACTS HILLDOG---YOU LIE ABOUT EVERYTHING FBI SAID SOOOOOO!!! #debates #TrumpVsClinton,1474939552822,780579176617119745,0
47,kenjirapzilla,#debates #debatenight https://t.co/mm0djYBTdp,1474939552719,780579176185270272,0
48,JimmyAAlford,Nailing it by our stupid new standards and the old ones that utilized critical thinking @HillaryClinton #debates,1474939552674,780579175996518400,0
49,brandi_lei,Website Plugs!  #Debates #debatenight #PresidentialDebate,1474939553675,780579180194828288,0
50,Tunaman4u2,"I'm not a $TWTR long, but lets be honest. Its absolutely blowing up right now. Any buyer has to see this increased action $SPY #Debates",1474939553537,780579179616096257,0
51,delane,Trump comes off child-like with the consistent interruption and yelling back and forth. #debates,1474939553683,780579180228468736,0
52,vivianwest805,Why is @realDonaldTrump sniffing and snorting throughout the #debates,1474939553699,780579180295577600,0
53,seaternity,"please stop while you're at it
you're embarrassing yourselves
#debates",1474939553528,780579179578347520,1
54,TheBookFeminist,"""I turned my website into a fact checker to check these claims"" 😂😂😂 #debates",1474939553620,780579179964366848,0
55,TristanSeyek,Im not a Trump supporter but he's correct on trying to stop TPP https://t.co/na7YyOhezM,1474939553666,780579180157161472,0
56,akilahgreen,The first debate is just like a first date: I'm going to drink too much and become increasingly depressed about my future. #Debates,1474939553499,780579179456700417,0
57,chulo0716,Trump is going to loss BIGLY #debatenight #debates,1474939553701,780579180303966208,0
58,StatDevices,Who is winning in the first round of Debate 2016? #debatenight #Debates2016 #debates,1474939553670,780579180173856768,0
59,tramine09,This guy is talking over the commentator. Please take control. #debates,1474939553736,780579180450721792,1
60,Oneboomer,Mr #Trump does live in his own reality. #debates #PresidentialDebate,1474939553582,780579179804917760,1
61,ItinerantCamel,Clinton needs to keep hitting the taxes on the wealthy issue #debatenight #debates,1474939553687,780579180245229568,0
62,QueenofDCity,Every1 goes @HillaryClinton's website - https://t.co/8Yu58SgkyJ #Debates,1474939553586,780579179821694977,0
63,climatedenier97,So his plan adds $5 trillion to debt @HillaryClinton? What about economic growth? #lies #debates,1474939553660,780579180131954688,0
64,tonimiller24,#debates Hillary is a joke,1474939553770,780579180593287168,0
65,brenden77,Do your job Lester! #debates,1474939553760,780579180551430144,1
66,cucumber1emons,Hillary doesn't know the definition of the word FACTS #debates,1474939553717,780579180371075074,0
67,JoeUFL,I wouldn't recommend that fact-checker if you like either of these two... #Debates,1474939553754,780579180526247936,0
68,ConnieWestpfahl,"Lester Holt, come on dude! No one will watch this uncivilized train wreck #debates",1474939553719,780579180379410432,1
69,Kriegerel,#debates Donald trump is such an idiot https://t.co/Gh3sSd24Be,1474939553184,780579178135584768,0
70,socalmom,@LesterHoltNBC has already lost control. #debates,1474939553658,780579180123607040,1
71,Tonyatk,Lester shut them down #Debates,1474939553704,780579180316598272,1
72,posthuman,FECK! Stop letting him steamroll you! Talk over him and smack him down @HillaryClinton You MUST crush his every tangent #debates on #tytlive,1474939553737,780579180455063553,1
73,TanayaRose,Check out https://t.co/sLCkfoHvJ3 for a fact check on Trump's rantings and lies. #Debates2016 #debates #ImWithHer,1474939553700,780579180299726848,0
74,frazood,"Stop cutting her off, Drumpf. #debates",1474939553853,780579180941418498,0
75,Cybersoulja,The moderator is terrible. I knew he would be. #debates,1474939553599,780579179876065281,1
76,katcystephan,"Yep, Hillary's website is a fact checker for Trump. #debates #debatenight https://t.co/abK2SradfB",1474939553310,780579178663915520,0
77,AnaK2195,"""Facts""  #debates",1474939553788,780579180668936192,0
78,AngDyertwdmom,#debatenight #TrumpTrain #Winning https://t.co/nEooC5THhK,1474939553573,780579179767205888,0
79,bankrolljoel,Holt needs to grow a pair. #debates,1474939554657,780579184313716736,1
80,AjokeDare,Trump passionate but sounding all over the place #debates,1474939554579,780579183986630657,0
81,ughxpaola,Donald lost the election when he didn't answer the first question #debates,1474939554661,780579184330543105,0
82,AmeriTerry,I need @DylanByers @maddow #Debates2016 #Debates,1474939554646,780579184267694084,0
83,HSanchezPerry,Lester Holt has lost control. #debates,1474939554667,780579184355774465,1
84,ItsReyes511,Someone make Donald Trump to shut his mouth!#Debates,1474939554682,780579184418709504,0
85,prism2_caron,Way too much sniffing...does he have a habit we don't know about #debates https://t.co/l1rihiiomp,1474939554637,780579184229945348,0
86,TriniANGEL19,Yessss! #Hillary2016 Let's fact check. #debatenight #debates #Debates2016,1474939554691,780579184456429568,0
87,dbwilldo,"If they would ANSWER A QUESTION AND STOP INTERRUPTING. 

Complete lack of professionalism on both sides. #debates",1474939554768,780579184779235328,0
88,desk_squirrel,Do you think talking to her 2 year old grandchild helped @HillaryClinton prep for this debate? She's up against a child. #debates,1474939554745,780579184682893313,0
89,hannah_nelle,"LESTER, C'MON #debates",1474939554753,780579184716369921,1
90,corgiwarrior,I have never watched a presidential debate and was not expecting such a shit show. #debates,1474939554569,780579183944605696,1
91,TheBlacktastic,I am HOWLING https://t.co/UpdJeufYOT,1474939554645,780579184263389184,0
92,ljb1987,"She is a walking advertisement her book, her website.. Lol #Debates",1474939554730,780579184619823104,0
93,caittjordan,This the most childish thing I've ever watched... #Debates,1474939554627,780579184187936769,0
94,TheRiverWanders,JFC this is already a debate slanted against her.  #Debates2016 #debates #debatenight,1474939554629,780579184196321281,0
95,918StayGold,I seriously should not be laughing this much during a presidential debate...#WeAreFucked2016 #Debates,1474939554804,780579184930201601,0
96,ClaudetteYaz,When HRC uses Trump yelling over her responses to plug her new book. I hope people comment on Trump's voice 2 #debates #strongertogether,1474939554818,780579184989003777,0
97,AnandWrites,Bigly? Big-league? #debates,1474939554828,780579185031077888,0
98,maui2nite,So there goes the first truly low blow. Let's hear what Mark Cuban thinks. Nah....never mind https://t.co/0rwOvdvmbk,1474939554767,780579184775094272,0
99,boredombores,@HillaryClinton checkout my website for live fact checking #knowyouropponent #debates,1474939554686,780579184435425280,1
100,MorganShow1,NO TAXES for the middle class! Please! #debates #TrumpClinton,1474939554956,780579185567813632,0
101,alexisrwolf,"""Facts"" #debates https://t.co/o4AnqRRUE3",1474939554653,780579184297009152,0
102,Koons17112,Lester is already losing control. #debates,1474939554918,780579185408507907,1
103,SomethinNCommon,She's under his skin already........@realDonaldTrump is a loose cannon #DebateNight #Debates #Debates2016,1474939555598,780579188260605952,0
104,KennySkyNews,Trump impassioned and shouty. Clinton smiling through it - and now plugging her website for fact checking. #Debates,1474939555519,780579187929280512,0
105,wtvrnoeli,LMFAO THEY TRYNNA MOVE ON BUT TRUMP WONT STOP TALKIN #debates,1474939555627,780579188382261248,0
106,jhough80,"Wow so many tweets, cannot keep up! #debates",1474939555785,780579189044895744,0
107,planeteryhoe,He legIT JUST INTERUPPTED HIM #debates,1474939555712,780579188738850816,0
108,stuntnjh,FACTS #debates,1474939555753,780579188910780421,0
109,jeffreyjonsmith,OMG - #sniffles is trending. #debatenight  #debates,1474939555674,780579188579323905,0
110,fejimanz,USE THE FUCKING MICS... just turn them off.  #Debates,1474939555704,780579188705071107,0
111,BenPowless,Lester Holt reflecting on the poor life decisions that led him to this point. #debatenight #debates https://t.co/l3KrAptW5l,1474939555472,780579187732152320,1
112,Stee1Pat,#debates  #debatenight this country is fucked is @realDonaldTrump is elected.,1474939555710,780579188730232833,0
113,Fool_4_Music,Trump is already so on edge. HOW is going to last 90 minutes?! #Debates https://t.co/PVjro6klAt,1474939555619,780579188348772353,0
114,Julia__Garrett,Hillary is sipping her tea and throwing her shade. #debatenight #debates,1474939555849,780579189313380352,0
115,DMitch3987,Lester Holt - get in there #debates,1474939555774,780579188998672384,1
116,merli126,I wonder if Donald Trump will apologize for offending every person that's why he's not getting my vote #Debates,1474939555894,780579189502070784,0
117,CarolWalden,Donald agrees.. LOOK at https://t.co/1M0UtCkF7Y  @HillaryClinton @realDonaldTrump #debatenight #debates #Debates2016 #ImWithHer,1474939555813,780579189162332160,0
118,ValentinaNtv,"#debates
""—He pensado mucho en eso.
—Sí, treinta años.""

JAJAJAJAJAJJAJAJA",1474939555824,780579189208518656,0
119,TubaInTreble,"""We're gonna move to--""
Hillary: nope
#debates",1474939555940,780579189695000576,0
120,NicoleZhang,I'm watching the #debates sober because I'm a masochist.,1474939555861,780579189363707905,0
121,countdante67,Holy take control! #debates,1474939556731,780579193012703234,1
122,ToastersForever,Who do you think is winning so far? #Debates,1474939556625,780579192568176640,1
123,KOCOBret,Now it's a comparison of whose website is better #debates,1474939556787,780579193247584256,0
124,TheUnrealNickW,why the fuck they having commercials during a debate when people are heated? #debates,1474939556678,780579192790458368,0
125,GOP_lover69,Madman is losing his temper #Debates,1474939556828,780579193419501568,1
126,pamnonga,Lester needs to take control. #debates,1474939556774,780579193192972288,1
127,Jdflygirl,"HILLARY has a fact checker.....IRONIC don't you think!   HA HA!  Thats funny!
  #Debates",1474939556635,780579192609964032,0
128,Zlatty,#debates &gt; #debatenight,1474939556815,780579193365024768,0
129,Iram_Rivera,The moderate has lost control already #Debates,1474939556788,780579193251782656,1
130,WhiteMentat,#Debates  clinton turned her website into a frog bashing meme https://t.co/zAeeI7KYXD,1474939556603,780579192475746304,0
131,Aphex93,I know I get all my facts from Hillary Clinton. She would never lie. #debates,1474939556734,780579193025277952,0
132,motown382,"Wait, does Drumpf even know what ""facts"" are? #Debates",1474939556813,780579193356742656,0
133,Iaurencox,OMG https://t.co/AXOIi0ScLS is literally https://t.co/SaqdFnny6q right now! #debates,1474939556814,780579193360818176,0
134,SettleJnet,Cut regulations?!?! Like the housing market?  #Debates,1474939556893,780579193692102658,0
135,Marjori10315083,Lester can't control him #Debates,1474939556910,780579193763536896,1
136,mycatiscool,I dont know who's right anymore #debates,1474939556983,780579194069590016,0
137,FBGM_Boppy,So Who My Followers Want To See Win This Election? #Debates,1474939557668,780579196942692352,1
138,aanaibm,"Just go out and vote, humans of the USA. Please just do it. #debates",1474939557680,780579196993048576,0
139,ClaudiaMrqz,https://t.co/2BAiwDOlAk #FACTS #Debates,1474939557664,780579196925947904,0
140,JudeTLasserre,Donald has the money to buy his own Reality.! Here's your Trump Button!!! TM Susan Gibler https://t.co/WjpRK52QpP,1474939557540,780579196405899264,0
141,k_style6587,What has Donald Trump said that sounds like a President of the USA? This is ridiculousness!  #Debates,1474939557671,780579196955262977,0
142,MaureenShaw,"Trump RN: ""Hey Mom, look at me!"" #debatenight #debates",1474939557670,780579196951224320,0
143,ocean_o_emotion,#Debates2016 #debates Lmao you make your own chart of lying schemes?!? 🤔 Get her #Trump!!!!!!! https://t.co/mwKZRK4y7A,1474939557379,780579195730599936,0
144,WStHendricks,"Yes, cut regs, #Donald. I'm in the mood for another recession. My generation wasn't screwed over quite enough by the last one!
#debates",1474939557718,780579197152399360,1
145,meliramirez65,omg trump annoying #Debates,1474939557774,780579197387288577,0
146,katieberlin4,Some #debates fun https://t.co/qh6Dvabjlf,1474939556909,780579193759334400,0
147,CoffeyPatricia,"Donald grow up, you are a bully. #Debates",1474939557679,780579196988862464,0
148,locknload_rod,"Good ideas for solar energy, but what happens after they're in place? All of those jobs will be gone. #debates #debatenight #TrumpVsHillary",1474939557617,780579196728999936,0
149,jenner_87,I DEBATE GOODER THAN YOU HILLARY #Debates,1474939557675,780579196972269568,0
150,mrslpe,I need a fact checker along bottom of screen!! #debates,1474939557731,780579197207121920,1
151,PieForThree,TRUMP IS NOT LETTING HER UP OFF THE MAT #debates #debatenight https://t.co/acv8budGbI,1474939557544,780579196422778881,0
152,Ebydwhyte,"""@FoxNews: .@realDonaldTrump to @HillaryClinton: ""Secretary, you have no plan!"" #debatenight #debates #Debates2016 https://t.co/T9TTQ4K9zQ""",1474939557660,780579196909285376,0
153,TheDrunkBoss,"Great for economy, opposite reaction is reduction of cost to produce in America https://t.co/l9NxrMb5rw",1474939557676,780579196976365568,0
154,marvelle,? #debates,1474939557742,780579197253095424,1
155,MattSoleyn,Lester Holt has already lost control over these two. #PresidentialDebate #DebateNight #Debates #Debates2016 #Trump #HillaryClinton,1474939557660,780579196909355008,1
156,bobsbugsbeagone,I dont understand a word #Debates,1474939557831,780579197626490880,0
157,ALeopold1211,Earth to Lester....#steamrolled #debates,1474939557775,780579197391663104,1
158,laurelfor,Since when is a presidential debate time to push your book sales and website. #debates #disappointing #takeoverlester,1474939557647,780579196854829057,0
159,Immortalizeboy,"You know nothing about email, Hillary Snow. #Debates",1474939558661,780579201107632129,0
160,burritodrea,trump is disrespectful smh interrupting my girl Hillary😤 and he stay mad lmao #Debates,1474939558672,780579201153839108,0
161,TMarkCollins,"""Bigly."" I actually like that word. It rhymes with ""wiggly."" and ""piggly."" #debatenight #debates",1474939558636,780579201002852352,0
162,grantboone,"What does ""bigly"" mean semi-exactly? #debates #Trump",1474939558540,780579200600203264,0
163,D1vaJ,"Watch live! ""U.S. Presidential Debates"" #Debates https://t.co/vAXAGKyudL",1474939558638,780579201011167237,1
164,hslowj,#bigleague so far Clinton has plugged her book and her website. Who's the swarmy business person? #Debates #Debates2016,1474939558639,780579201015570432,0
165,sshabein,Ask him where his products are made. Go on. #Debates,1474939558617,780579200923164672,0
166,PrinceM0n0,"""We've turned the front page of my site into a fact checker."" Well, i have to say well played hillary. #Debates",1474939558672,780579201153961984,0
167,LoRogan,"Oh yes, let's trust the democrats' fact-checker. #Debates",1474939558648,780579201053102080,1
168,JSanderPhoto,Dude... Hilary IS KILLING it out there. This is a straight burn-fest out there! 😂😂 #LoveThis  #Debates,1474939558495,780579200411455488,0
169,adudeinaplace2,"#debates    

FACTS https://t.co/oyh08mWST1",1474939558188,780579199123857408,0
170,patriciayoung,I think RT @ToddWaller: Wait. There's a moderator? #debates #Debate2016,1474939558662,780579201111863296,1
171,sincerely_steff,The whole temperament thing is not a part of Trump's character. He has none. #debates,1474939558744,780579201455841280,0
172,KingGreene14,Hillary with the Mic Drop #Debates https://t.co/vX1dPv4t2b,1474939558519,780579200512163840,0
173,Asherette06,"#Debates can we just discuss the damn issues. Stop advertising yourself Hilary and Trump, move on to the next subject.",1474939558623,780579200948314112,0
174,Liverstealer,@LesterHoltNBC is already getting steamrolled.  #debates,1474939558504,780579200449204224,1
175,mrmikenike1,Twitter is hype over the #debates,1474939558739,780579201434857472,0
176,lornaaa28,hahahahaha😂😂😂😂😂 #debates,1474939558713,780579201325891585,1
177,Chastitellez,"Trump is like, yeah, I have a website too. #debates",1474939558693,780579201242062848,0
178,peggyl308,Trump is RUDE! #debates,1474939558700,780579201271291904,0
179,AlisonDMA,Clinton is a baller #ImWithHer #debatenight #debates #MicDrop,1474939558764,780579201539837952,0
180,DABIrishGirl,Let the nitpicking begin #debates,1474939558584,780579200784818177,0
181,BlueSnoozeBlue,"Hill goes class warfare. Again.

#debatenight #debates",1474939558653,780579201074147328,0
182,TheBookRat,Get 👏 It 👏 Hillary 👏 #Debates,1474939558892,780579202076737536,0
183,autismfriendlyz,Perfect! You are good😎!! https://t.co/ObsrZ43H9u,1474939558789,780579201644630016,0
184,Room4Nuance,"Trump is all assertion:""I am going to cut taxes BigLeague and you are going to raise them BigLeague, period, end of story. #YouWish #Debates",1474939558787,780579201636298752,0
185,MatthewSCoker,"Trump is the ""And by the way"" guy.
Hillary is the ""Well, actually"" woman.
Neither one of them are invited to my birthday party. #debates",1474939558891,780579202072313857,0
186,tonyman296,Clinton panders by using her husband. Trump panders by comparing himself to Reagan. #Debates,1474939558988,780579202479325184,0
187,adryenn,True #debates #Debates2016 #debatenight https://t.co/9yvDokCU6X,1474939558940,780579202277838848,0
188,chelsea_davison,"Interview for being a debate moderator: ""So how much do you enjoy being emasculated???"" #Debates",1474939559669,780579205335572480,1
189,merrygolightly,Hillary is trying to bewitch blink him out of existence #debates,1474939559667,780579205327224832,0
190,chadwyck00,"Facts. I'm not sure that word means what you think it means, Mr. Trump. #Debates",1474939559739,780579205629128704,0
191,sammywhaaaat,he's not a politician. he's a liar. #debates,1474939559684,780579205398536192,1
192,CORNYASSBITCH,Shut him up! #debates,1474939559702,780579205474025472,1
193,BTurnt,Trump is running over Lester.  #debates,1474939559723,780579205562175488,1
194,Mike_Hustava,Snapchat makes everything better. #debates https://t.co/bafS4Nu6ya,1474939559588,780579204995944449,0
195,HaleyMeredithT,Surprised she didn't pass out yet. Still got the rest of the debate though.  #Debates,1474939559787,780579205830410240,0
196,Cody_Hammertime,"I love how @realDonaldTrump keeps talking about saving our economy, but how many of his creations went bankrupt? #debates",1474939559519,780579204706566145,0
197,ThoughtsByMike,Lester Holt right now. #Debates https://t.co/SxwYmEB7vR,1474939559552,780579204844756993,1
198,JettMunroe,how do you shut them up!? #debates,1474939559817,780579205956284417,1
199,JeremyG59,Watching this debate is nerve racking 🙃 #Debates,1474939559746,780579205658578945,0
200,Gerardo8aV,"Poor Trump loses it in front of the cameras #debatenight #debates

#NeverTrump",1474939559701,780579205469790209,0
201,HillaryIn2016,"Trump: ""At least I have a plan to fight ISIS."" #Debates #Debates2016 #DebateNight #ImWithHer",1474939559660,780579205297745920,0
202,richoncode,"Mr Trump let the moderator moderate.  
  #DEBATES",1474939559756,780579205700395009,1
203,hp2285,Poor Lester. #debates,1474939559868,780579206170193920,1
204,AngieinWAState,"@realDonaldTrump You sir, are no Ronald Reagan. He at least recognized the value of #Immigrants 1986 #IRCA #debates",1474939559525,780579204731539458,0
205,kjohns_,"Lol ""Look at her website"" #debatenight #debates",1474939559782,780579205809659908,0
206,_viciwill,Donald Trump has zero etiquette in this debate. literally none. #Debates,1474939559703,780579205478248448,0
207,IanYessimpson,They ain't got the answers! #KANYEFORPRESIDENT2020 #Debates,1474939559862,780579206145175556,1
208,keshannab,Lester needs a buzzer! #Debates,1474939559914,780579206363172868,1
209,wallace1292,The real winner tonight is Snapchat. #Debates #PleaseDontDeportMe https://t.co/kASDOoUtSz,1474939559580,780579204962344960,1
210,BtwArtteacher,Petty #debates,1474939559906,780579206329696258,1
