,screen_name,text,timestamp,tweet_id,cluster_pred
0,MissieMinxie,"@realDonaldTrump money outside the country, just like you! #cbsnreax #debatenight #debates",1474939715727,780579859890335744,2
1,DonSzechuan,"#Debates ""Businesses are leaving the country because taxes are too high"" Trump says shortly after his disposition about raising tariffs",1474939715729,780579859898699776,1
2,benjijk,I hope people are smart enough to see the sense in what Trump is saying. I own a small business and I have to source work outside #Debates,1474939715739,780579859940515842,0
3,pardekooper,"Trump wants no part of ""Tax"" questions.  #Debates",1474939715842,780579860372594690,0
4,FGoria,Where the fact checkers? #Debates,1474939715788,780579860146184192,2
5,brad_howard,"Retweeted Kia Kondori (@KiaKondori):

#Facts . . . she did call it the Gold Standard :P #debates... https://t.co/1XrdyUWkfk",1474939715797,780579860183855106,1
6,iam_jsmithh,You don't win by saying end of story #debates,1474939716663,780579863816048640,2
7,ZacharyFojtasek,"...is he saying ""big league""?
#Debates #cbsnreax",1474939716490,780579863090429953,1
8,RodriguezWriter,@realDonaldTrump can you please make a point??? Please I want to see your brilliance but you make it so hard #Debates,1474939716589,780579863505756160,2
9,TekkZero,"Ah par de gringos payasos, me Cagan de risa... #debates",1474939716547,780579863329644544,2
10,kevgif,When are the fists going to fly? Hmu when it happens or when Hillary dies on stage #debates #debatenight,1474939716663,780579863816052740,1
11,IrvShorman,Gonna be beautiful #Debates,1474939716714,780579864029954048,2
12,nick_ramsey,"... ""why not?"" #debates",1474939716640,780579863719710720,0
13,TrippCathy,Why not!! #Debates,1474939716559,780579863379927040,0
14,chicagomedic,"isis created from iraq war that bush led us into and hillary supported. she then called iraq a ""business opportunit… https://t.co/YNKXJHX9ZS",1474939716509,780579863170342912,0
15,AshleyJauregui_,"""Because some of them have a lot of money outside of this country"" lol like you? #debates",1474939716679,780579863883309056,2
16,sarah_ithink,even clinton is accepting her fate I love her #debates,1474939716679,780579863883382784,0
17,zombzs,#Debates trump is actually working,1474939716701,780579863975587840,0
18,jla_yvonne,Trump is a joke #Debates,1474939716648,780579863753265152,0
19,DermGermJr,Why not #Debates,1474939716759,780579864218787840,0
20,blueinPA,This guy is an embarrassment.  People really vote for this guy #debates,1474939716676,780579863870763008,1
21,kbkndownunder,トランプの言葉はわかりやすいから、飛びつきたくなる有権者が多いんだっろうなあ。結局は何も言ってないんだけどね。。 #Debates,1474939716722,780579864063516674,2
22,Yeaa_itsMONI,Yet again he fails to see the bigger picture  #Debates @realDonaldTrump go to bed 🙄,1474939716692,780579863937835008,2
23,JSammonss,Lester has lost complete control here.. #debates #PresidentialDebate,1474939716844,780579864575213569,2
24,vivalanaja_,Trump let her talk #debates,1474939716766,780579864248250368,0
25,ososensual,Hillary win https://t.co/59e6hMXCJY,1474939716631,780579863681830913,1
26,lnoelcpa,Wow. He just keeps yelling &amp; asking crazy questions.This is nuts.If the opposite were happening &amp; .@HillaryClinton behaved as such #debates,1474939716615,780579863614857217,2
27,itsmad3line,Drinking every time @realDonaldTrump says tremendous #debatenight #debates #debate,1474939716793,780579864361463808,2
28,itsajacobthing2,Trump is so sexist! #debates,1474939716825,780579864495661056,0
29,robinfclark,Trump. Gibberish. Out of his mind.  #debates,1474939717675,780579868060770304,2
30,pepen37,Is the moderator on a bathroom break? #debates,1474939717686,780579868106903552,0
31,AlexDev09,🙌🏻 https://t.co/2c9QqPa7u0,1474939717614,780579867804958720,1
32,pbmcnelis,I guess Lester has gone AFK. #debates,1474939717712,780579868215881728,1
33,thegreatkevun,No cuts needed just close the loopholes #Debates,1474939717722,780579868257824768,2
34,homerfreitag,she got all the opportunity before to help the economy grow but why only now that she has a plan? solar energy? really again? #Debates,1474939717667,780579868027129856,2
35,banishednerd,GET THIS SHIT TOGETHER LESTER! #debates,1474939717705,780579868186673152,2
36,DJMikeymania,"Did Donald say ""unstead?"" #Debates",1474939717612,780579867796598784,2
37,marymclane88,Bullshit trickle down economics hasn't worked yet!! Stop the madness  #Debates,1474939717728,780579868283117572,0
38,macienpenny,She is losing it she is stumbling over her own words and of all things pushing her book. Really. She is a moron. https://t.co/bG1hpblFa1,1474939717641,780579867918073856,2
39,BrianWelfle,"Clinton is calmed, her voice isn't grating and she's got a sly smile. This is the woman I love. #Debates",1474939717729,780579868287184896,0
40,BlazejPapiernik,"Matko kochana. @realDonaldTrump włączył chyba tryb ""rage"" a prowadzący nie potrafi tego opanować #debates",1474939717777,780579868488699913,2
41,leahrosekessler,"Sadly, this is what I've been saying all day. I hate it when the Onion and I agree. https://t.co/ULsb3H8iuA",1474939717708,780579868199321601,1
42,mattosborne,Has Donald Trump actually said anything? #debates,1474939717748,780579868366995456,0
43,HuntGoobz87,Hillary taking notes on how to be a winner #Debates #DebateNight,1474939717575,780579867641442304,0
44,Garthasaurus,Guys they just answered one question for like 25 minutes #Debates,1474939717548,780579867528142849,2
45,therainbowheron,"Hillary ""Oh poor me!"" #Debates",1474939717776,780579868484444160,2
46,cm_sully1,"Bicker, bicker, bicker... I've seen schoolyard arguments more civilized than these two. #Debates",1474939718678,780579872267640832,0
47,_Taradiddle_,I hope Lester is getting hazard pay. #debates,1474939718691,780579872322179073,0
48,randythepastor,"I refuse to believe that these are the best candidates this country has to offer. And yet, here we are.  #Debates",1474939718659,780579872187912192,0
49,ShirazMaher,😂 https://t.co/jj2lW0eURq,1474939718707,780579872389287936,1
50,Panglossage,#Debates Could be 2.5 Billion.  Might be 5 Billion?  Or 4.  Or 3.,1474939718623,780579872037011456,0
51,rosetho,"""AHHHHH"" ""uhh facts tho?"" ""AHHHH"" #debates",1474939718682,780579872284545024,2
52,ShanniRed,Is anyone else hoping she will push him far enough so that he actually spontaneously combusts?#debates #ImWithHer,1474939718668,780579872225816576,2
53,JacLHope,Why not? Because reality? #debates,1474939718708,780579872393482240,2
54,CloudBardLoL,"WHY NOT
#Debates",1474939718812,780579872829693952,0
55,BLACKSTEMUSA,Trump says CEOs will give $$$ to workers if regulations &amp; taxes are reduced. Capitalism hasn't worked that way since its inception. #Debates,1474939718613,780579871995068416,0
56,ipsilva_bh,"Trump: ""Você quer saber como ela vai combater o Estado Islâmico? Vá ao site dela. Ela está mostrando a estratégia para o inimigo"" #debates",1474939718445,780579871290486784,2
57,WolfehEXE,Trump mentioned the small loan again prepare for memes #debates,1474939718720,780579872443887616,0
58,suhlimon,Does Trump's mic not work?  Why he shouting? #debates,1474939718763,780579872624160768,0
59,RogueFather,"#herpesclinton.  #debates life time of ""service"" has lead us to were we are.",1474939718939,780579873362317312,0
60,Vlaka3210,USA should change how we choose leader.  Let's just have them fight in a ring. More civilized than this. #DEBATES… https://t.co/pR12xACeOL,1474939718200,780579870262845441,1
61,yessi_vaz97,"Both candidates are terrible!
 #Debates",1474939718929,780579873320382464,2
62,miketiger0528,"So, it only took 21 mins for Trump to lose his composure. #PresidentialDebate #trumphasnoplan #Debates",1474939718949,780579873404309504,2
63,bfuentes24,Fuck yeah Trump!! Call lying ass Hilary out on her lies. She'll drive the country lower than Obama did! #debates #VoteTrump,1474939719662,780579876394840066,1
64,PixiePoe123,Damn! Hillary just announced her website it running a real time fact check during the #Debates @realDonaldTrump https://t.co/YMUIKtMNjt,1474939719396,780579875279233024,2
65,matt_bart,Hillary's fake laugh creeps me out though. #debates,1474939719557,780579875954589696,2
66,MiaElleBible,"So far, this moderator is trash. Control your floor.  #Debates",1474939719704,780579876570968064,2
67,JoshtheSandwich,She's getting steamrolled by orange jizz. #debates,1474939719718,780579876629721089,1
68,KBDPHD,"Am i the only one who thought of @djkhaled when Trump said ""major jobs""? Major Keysssss #majorkey #QUDW #debatenight #debates #Debates2016",1474939719531,780579875845509120,2
69,fretsward,We have to read what the sycophant Calderon says? #Debates,1474939719659,780579876382269440,0
70,pxrxsyte,i'm surprised he don't look like a pumpkin tonight #Debates,1474939719724,780579876654886912,2
71,luchini424,From China to NAFTA to Dugout Doug MacArthur to ISIS...all in one question. Thanks @LesterHoltNBC - what a time to be alive indeed! #debates,1474939719578,780579876042633216,0
72,michaelmalice,"Still reeling that @HillaryClinton actually said ""WELL AT LEAST I HAVE A PLAN!""
Ivy League educated lawyer. #debates",1474939719709,780579876592025600,1
73,FreshLifeRC,Donald Is talking circles around her man! #Debates,1474939719635,780579876281745408,2
74,rejectedjokes,"He knows he has a microphone, right? #debatenight #debates",1474939719732,780579876688441346,1
75,_Metal_Monster_,#Debates,1474939719685,780579876491239424,0
76,Kings_Secret,#debates Lester is holding it down. I'm proud to be watching him. He's killing it.,1474939719690,780579876512202756,2
77,ptetr_derp,"Yep, it's a pissing contest. #debates",1474939719656,780579876369817600,2
78,CruisingGallows,Trump is straight up raping this bitch. Hillary is the puppet of Wall Street &amp; she's going to be tough on the wealt… https://t.co/N0gpnYRskJ,1474939719259,780579874704588800,1
79,megdaudlin,"""You've been telling the enemy everything you want to do."" -@realDonaldTrump so great. #MakeAmericaGreatAgain #debates",1474939719757,780579876793225217,0
80,OfficialShishio,HILLARY HURTS TRUMPS FEELINGS AND HE LASHES OUT #debates,1474939719868,780579877258866689,2
81,silver_selkie,RIGHT??? https://t.co/PZDf2mGF1a,1474939719760,780579876806004736,1
82,RorroBianconero,#debates 👀,1474939719783,780579876902404099,0
83,michaeltheaney,Trump is coming across as a bully.  Stop yelling at Clinton and cutting her off.  #debates #debatenight #debatenight,1474939719839,780579877137166339,2
84,Likenyo,I'm loving how accessible this debate is! #nocable #cutthecord #Debates,1474939719916,780579877460193281,2
85,elifgunce,Note to myself: check how many jobs Mr. Trump created as a businessman #debatenight #debates,1474939720592,780579880295596033,2
86,Evilbeav,"She needs to stop dignifying his outbursts with a response, it's a case study in how to get trolled by a troll :(  #Debates",1474939720702,780579880756912128,1
87,ElVaquero555,"#debates #debatenight Trust me Donald, we don't want to bring that money back into the country.  Rapidly increasing M2 Money is a bitch.",1474939720701,780579880752652288,2
88,celiomancias,I totally disagree with Trump. I agree with Hilary Clinton.  #Debates,1474939720683,780579880677150720,0
89,KimCayerRoy,Petit coup de pub Hilary? WHY NOT! #debatenight #debates #HilaryClinton https://t.co/KOefvw7SFf,1474939720188,780579878601097217,1
90,TianaHermosa,he really fighting for RICH people to be able to bring their money here with CHEAPER taxes. They will bring it and buy more boats. #debates,1474939720779,780579881079889920,2
91,trump_googles,"can you get pneumonia from toilet seat
#TrumpSniffles  #Debates",1474939720832,780579881302183936,2
92,BHarmon2008,They probably both realize their foreign policies will start WW3 and all die before we go bankrupt. #WhereisGary… https://t.co/KdW9SUITJw,1474939720575,780579880224235521,2
93,lapierre_george,wikileaks: #Debates Our analysis is that Trump is right on #TPP. Clinton will sign it. Timetabling within Democrat… https://t.co/b7ubfK4HE0,1474939720493,780579879880392705,0
94,themediakraken,#whyNot #debates,1474939720749,780579880954109952,2
95,LindaCrowNEA,"Huge, beautiful and same old tired lines.  #debates https://t.co/m5Iw7KmDiA",1474939720698,780579880740147200,2
96,matt_cyprian,"#Debates""I happen to think"" but another lie",1474939720862,780579881428013056,1
97,yoyocanary,#Debates2016 #debates MAJOR JOBS,1474939720734,780579880891191309,2
98,HeyHeyESJ,"Need a gif of Clinton's face when Trump said ""you've been fighting ISIS your entire life."" NEED IT. #Debates",1474939720680,780579880664637441,0
99,JusefConesa,I thought the #debates #Debates was tonight? Why are they showing the campaign with Will Ferrell and @galifianakisz ? Where are the pugs?,1474939720726,780579880857657345,2
100,CryptMatrix,WHY NOT? #debates,1474939720847,780579881365233664,0
101,LA_Debra,fact check this! #Debates,1474939720795,780579881147047936,2
102,nenee100,Please my people go vote...MY HAIR CAN'T TAKE THAT AFRICAN HEAT. #debates,1474939720648,780579880530567168,2
103,LLFlorentino,The inmates are running the asylum! Do your job @LesterHoltNBC #debatenight  #debates,1474939720759,780579880995950592,2
104,charlesflorian,"""Why not."" What an ass. #Debates",1474939720822,780579881260167168,2
105,becca_the_human,Wow. Look at how flustered Donald is getting. So unpresidential. Get a grip on your emotions. #debates,1474939720919,780579881667039232,0
106,AustinJWebster,Because only like 5% of America even remotely knows who you are. #Debates2016 https://t.co/IzZhAmzytt,1474939720912,780579881637654528,1
107,GregGonewild,"I wonder how many ""good"" and ""bad"" adjectives Trump stuffed into his pocket before the debate #debatenight #debates #Debates2016",1474939721661,780579884779261956,2
108,photographique0,@realDonaldTrump just shut up  #debates,1474939721366,780579883542020096,2
109,lehai0609,"Jesus, how did we come from JFK vs Nixon to this trash Trump vs Clinton. It's a high school fight rather than presidential debate #debates",1474939721697,780579884930244610,2
110,mr_rlbanks,What is this?  America should be ashamed that this is our reality #debates,1474939721694,780579884917661697,1
111,mycocoabubbles,He has no respect for anyone! Jesus! #Debates,1474939721736,780579885093822464,0
112,thisissandrat,@bpolitics #trump #climatechange #debates https://t.co/7YjxadbZju,1474939721481,780579884024332288,1
113,dasharp,@WIRED is live fact-checking the US Presidential #debates https://t.co/6rhjxvy9vu,1474939721634,780579884665974784,1
114,ghair_Janibdar,#Debates Trump a rude 🐖,1474939721662,780579884783562752,1
115,maurtosay,@donholley0 @pattonoswalt @AnitaNelson you lucky bastard!!!!!#Debates2016 #Debates #PresidentialDebate,1474939721609,780579884561272832,2
116,MAlBufalah,He is tearing her apart! #CNNDebate #HillaryClinton &amp; (@realDonaldTrump) #PresidentialDebate #DebateNight #Debates,1474939721655,780579884754083842,2
117,TaraBroadway,I thought each Question was only 15 mins long... uuuugghhh #debates,1474939721776,780579885261565952,2
118,itzstockchartz,"Last time I checked, poor people didn't hire...rich people do #debates @realDonaldTrump @HillaryClinton",1474939721589,780579884477345792,2
119,aaronnnn__,#debates still don't understand how you can trust and support somebody with no political background as the leader of the country,1474939721772,780579885244874753,1
120,shanney32,Whose Trumps make-up artist? Anyone one know? Maybe he should pick some up at the MAC #Debates #DebateNight,1474939721680,780579884859027460,2
121,TaliaMarieBabes,This is a joke 😑 #Debates,1474939721700,780579884942909446,0
122,quiinthieu,*sip tea* 🍵 #debatenight #debates #Debates2016 https://t.co/N6oodvykDU,1474939721261,780579883101593600,1
123,AMLG23,"Apparently ""bigly"" is a drinking word. Drink up #Debates",1474939721722,780579885035229185,2
124,Travarozjr,were the fact checkers paid off? god damn #Debates,1474939721817,780579885433495552,2
125,FavoriteAgentRP,He's talking way more than she is.  This is ugly.  Gloves are off.  #debates,1474939721772,780579885244944384,2
126,TrnsplantdToPal,Oliver (6) is getting annoyed at Trump's redundancy. #debates,1474939721892,780579885748146176,0
127,PlutoCoffins,lol no she isn't. Try again. https://t.co/fN38WFbLkh,1474939721771,780579885240709120,2
128,abolstery,They are literally children #Debates,1474939722698,780579889128669184,0
129,prunella,"OMG, that old chestnut? Trickledown economics is PROVEN not to work.  #Debates",1474939722639,780579888881205248,2
130,xtratuffmom,#debates #2016presidentialdebate https://t.co/xvk4rCJJdL,1474939722246,780579887232847872,1
131,JessPaige_420,This is so fucking saddening. #Debates,1474939722745,780579889325805568,0
132,micdurange,His clothes are made in China? #NBC #debates,1474939722721,780579889225273344,2
133,card_player87,Of course Trump would say that the wealthy create jobs and deserve tax breaks. #debates,1474939722509,780579888336138241,2
134,RickXX6,"ITS GETTING TOO SASSY! STOP SHOUTING PLEASE!! ..I am hiding behind the couch peeking at the #debates now. Ugh, there's my stress diarrhea :(",1474939722658,780579888960897025,1
135,Aguss_Mastra,Trump le pego a su propio partido. Es para el otro arco papu. #debates,1474939722661,780579888973611008,2
136,WarlockScott,Important to note that @WalshFreedom prepared for this debate WITHOUT paying his child support #DEBATES,1474939722702,780579889145585665,2
137,missjane08,"""The wealthy"" ""Great thing for the middle class"" #debatenight #debates https://t.co/LejaN92NY7",1474939722587,780579888663191552,2
138,coolbeans18,"Parents all over the world, point to Trump and say to their children,""you see what happens when you don't practice!"" #ImWithHer #debates",1474939722654,780579888944320512,0
139,davidrlockard,"""That's What Called Business, MY DEAR"" - Trump to Hillary, and to all of us dears #SpinTimeTV #debates https://t.co/LWMnscW4mk",1474939722514,780579888357081088,0
140,FrancoBeItran42,poor lester holt lmao #debates,1474939722780,780579889472638978,2
141,SavannaSchall,#debates https://t.co/RJs7kavkxO,1474939722505,780579888319303682,1
142,JamPlusle,"LOL ""WHY NOT"" #debates",1474939722718,780579889212686338,0
143,jvckyc,Donald trump is tryna reach the word count for an essay #Debates,1474939722743,780579889317576704,2
144,mike_nagler,#Debates https://t.co/94OyroH0y0,1474939722660,780579888969330688,0
145,tracee,Fighting ISIS your entire life? He's crazy!! #debates,1474939722727,780579889250312192,0
146,jilm,Starkly different styles. Clinton draws picture of hope and bright future. Trump is gloomy and dramatic. I think he wins so far. #debates,1474939722749,780579889342779392,0
147,TheWisdomDiva,👏🏽BIG👏🏽LY👏🏽IS👏🏽NOT👏🏽A👏🏽WORRRRRDDD. #debates,1474939722700,780579889137213441,2
148,Dreamite,"Hillary can`t rely on her husband`s record. She is running for office, not him. #Debates",1474939722753,780579889359495168,2
149,J_Heddings,"""Just join the debate by saying more crazy things.""
-Hillary #debates",1474939722708,780579889170771968,2
150,YouIFuck,@realDonaldTrump is a big mouth liar asshole #Debates,1474939722895,780579889954955264,1
151,jennyyangtv,How many bumps did The Donald do before this debate you think? #debates #debatenight,1474939723670,780579893205540864,2
152,3whosoever16,Lester has no control #Debates,1474939723740,780579893499138048,2
153,BrianHowell,"@davidswanson Well, he didn't ""say"" it. He just *tweeted* it. #Parsing #FactCheckThisBaby #Debates",1474939723653,780579893134307328,2
154,_eileens,lester is a shit moderator #debates,1474939723635,780579893058732032,2
155,Telvin10,"GIRL, SHUT UP DONALD #Debates https://t.co/6KN7wPS2Xd",1474939723408,780579892106760193,2
156,Kutthroatboxcar,I think @HillaryClinton is confused. She doesn't want to cut taxes. She wants to cut Internet connections. #debates #debatenight,1474939723601,780579892916162560,0
157,templewolf,Balmer clinton and her xanax #Debates,1474939723675,780579893226590209,0
158,jrfire2013,Sad childless interaction #Debates,1474939723559,780579892739973120,2
159,justinecz,.@realDonaldTrump es como ese niño al que su familia no le hace caso y por eso interrumpe todas las clases. #Debates,1474939723753,780579893553737728,2
160,IowaGOPer,Hillary shouldn't do that laugh talk thing.  Awful #debates,1474939723750,780579893541163008,2
161,Tedswayze,Donald is doing what corp owned Hillary puppet media never does bringing up her wall st corp owned past NAFTA #GoingGreen100percent #Debates,1474939723687,780579893276835840,2
162,kj_irene,"#Trump ""I'm gonna cut regulations."" Translation: Make America Polluted Again Big League  #Debates",1474939723706,780579893356756996,1
163,pnutbuttrnipplz,"""Mr. Trump, would you please answer the question?"" is all I want to hear #Debates",1474939723528,780579892610134016,0
164,1m1wIsMarriage,#debatenight #debates Liberty is not toiling for the ideologies of these idiots.,1474939723748,780579893532774400,2
165,tootiebug7,#debatenight #debates #Debates2016 check out TRUMP'S website if you want the truth! Check out his tax plans AMAZING!!!!!! TRUMP,1474939723765,780579893604028417,2
166,rockfort72,Clinton is coming across presidential. Donald appears a little desperate #debates,1474939723694,780579893306232832,0
167,ItsJewellsBitch,https://t.co/zJvCnK0BFk.  #Hilno  #debates,1474939723789,780579893704658946,1
168,_isa_lazo,Trash trash trash trash https://t.co/Bn2MLqnrqF,1474939723584,780579892845023234,2
169,EyeAmBwana,#Debates what does #tremendous_jobs mean?,1474939723780,780579893666914305,2
170,UpsideUp,"She needs to stop responding to him. He doesn't even know what he's saying. If she stays silent, he'll never stop talking. #Debates",1474939723809,780579893788733441,1
171,JagglePussJeany,She's been fighting isil her entire adult life? Seriously? #donaldtrump #debates,1474939723691,780579893293813760,0
172,BPandora94,Hilary has a feeling she's gonna be blamed for everything by end of debate #debatenight #debates,1474939723877,780579894073790464,2
173,raggammuffin,what was the question? this is like watching a slow train wreck. #presidentialdebate #debates,1474939723798,780579893742596096,2
174,Lurizdarooster,"Yay, the #debates are heating up. Welcome to the part of the night where I begin saying ""just answer the fucking question!""",1474939723943,780579894350622720,2
175,SenorDevon,"""Could be used on the inner cities and lots of other things."" #debates #trumpisms",1474939724681,780579897445986304,2
176,AllyKeyoni,"""Why not?"" W O W #Debates",1474939724590,780579897064370176,0
177,Aprilchambers2,Rude #debates,1474939724642,780579897282404354,1
178,ScottDalton23,#Debates what's he talking about? Did he say anything?,1474939724703,780579897538334720,2
179,HEELHUNS,This shit is hilarious 😏💨 #debates,1474939724666,780579897383149569,2
180,charmingdoc,"He's starting to insult the woman@ you've been fighting ISIS the whole of ur adult life
  #Debates",1474939724465,780579896540196864,0
181,DrSkyrme,Feel the burn....! 🔥🔥🔥 #debatenight #debates #debate https://t.co/be6nntEUEE,1474939724451,780579896481505281,2
182,darkxlily13,"So, my first tweet here happens to be about this stupid fucking debate. But I kind of want to livetweet this. #debates #debatenight",1474939724735,780579897672626177,2
183,sciortie,12 mins later this is still relevant https://t.co/aJN2bh7lwD,1474939724693,780579897496498177,1
184,JudeTLasserre,"We thought he was saying Bigly, more of his own reality.. https://t.co/SU4hPJRqvA",1474939724749,780579897731276801,1
185,Harry1T6,Trump hammering the point that foreign profits can't be brought back to USA due to insane tax exposure. Good points. #DebateNight  #debates,1474939724764,780579897794109441,1
186,RudyReber,"I don't know what else Hillary practiced but she sure got her ""You are such a dumb fuck"" look down perfectly. #Debates",1474939724778,780579897852833793,0
187,mkfers,#Debates https://t.co/IuvSSv92Ej,1474939724647,780579897303453696,1
188,jenriosburns,HRC is killin' the debate game right now. She did her homework. #debates #ImWithHer,1474939724835,780579898091986946,2
189,iamhasanansari,"Who is wining? #debatenight #debates 
#YesWeCan #StrongerTogether #ImwithHer",1474939724833,780579898083594240,1
190,TWojtasik,Last I checked Isis has not existed for the entire 50 years of Clinton's adult life. #Debates,1474939724748,780579897727066112,0
191,kingofcbus,Biggly..... #debates,1474939724591,780579897068625920,2
192,hackerouac,"I think Hillary Clintons style can be described as ""dystopian despot chic"" #debates",1474939724751,780579897739735040,1
193,javiersaldivars,#debates @realDonaldTrump @HillaryClinton,1474939724855,780579898175795200,0
194,pikmin1399,I thought that 2 min are up. #debates,1474939724854,780579898171596800,1
195,TrueAmwrican,Hillary stop being a mother an grandmother act like someone who would be a president #Debates,1474939724867,780579898226274304,2
196,PatrickCoffee,You've been fighting this cold for your entire adult life #debates,1474939724856,780579898180112384,0
197,StoneyboBoney,"""I think I am, actually humble. I think I'm much more humble than you would understand."" #ItsAlwaysSunny or #DonaldTrump? #Debates",1474939725671,780579901598408705,1
198,vambamf,"""Why not?"" #bossbitch #debates",1474939725578,780579901208424448,0
199,ChadoftheSlones,Fuck the Debate go check out Chad The Rapper on YouTube #Debates,1474939725649,780579901506072576,2
200,DidgeridooGod,I just told @nbcwashington who I think is winning. Cast your vote now! #Debates #NBC4DC https://t.co/XmH5qsh4fP,1474939725496,780579900864487425,1
201,MirandaAllen4,Hillary is nervous and everyone is laughing at her this is great! #debates,1474939725491,780579900843450369,2
