,screen_name,text,timestamp,tweet_id,cluster_pred
781,emmamatthewss,Wut is he even saying right now about these websites 😩  trying to say that it's giving sensitive info to ISIS #debates #debatenight,1474939676677,780579696102735872,1
782,kimboperkins,Literally #debates https://t.co/b2yE7YowYz,1474939676591,780579695741898752,1
783,mattatarms,Trump is trying to sell me on something that doesn't work.  Seems typical salesman. #debates,1474939676725,780579696304005120,3
784,Andrew_Hi5,"This is the best episode of Maury I've ever seen. 

When do the paternity tests happen? #Debates2016 #debatenight #debates",1474939676705,780579696220082182,3
785,GenevieveBolt0n,@gracehelbig it's a HUGE sign of intelligence bigly voices = bigly ideas #debates,1474939676629,780579695901507584,3
786,intdemon,"COUGHING FIT PANTS OF SHIT
CAN'T STAND UP SHE HAS TO SIT

#debatenight #debates",1474939676713,780579696253755392,1
787,DebbieSchlussel,"I feel like I'm hearing ""Eye of the Tiger"" playing in the background as Trump slugs Hillary. Merciless. KO #tcot #gop #debatenight #debates",1474939676592,780579695746281474,3
788,MisaelFrancoO,Neither have shown a sign of intelligence or leadership. @DrJillStein would be demolishing them! #debatenight  https://t.co/TtuP2nsXPd,1474939676718,780579696274649088,1
789,sasafras0904,@GMA yea you tried to destroy the lives of every woman who claimed he had raped them or had affairs- great job for women's rights#debates,1474939676635,780579695926517761,2
790,cerveza_papi,Hahaha he is a walking contradiction https://t.co/GTfNPcDBXv,1474939676718,780579696274583553,1
791,Candace_Dempsey,Yes Clinton's been fighting ISIS before there was an Isis. Hilarious. https://t.co/fJCvXad08l,1474939676369,780579694810836992,0
792,TheTylerJM,"They should have had @joerogan moderating. This isn't a debate, this is a UFC fight. #debatenight #debates",1474939676589,780579695733665793,1
793,jen4green,"I agree. Condescend back, @HillaryClinton !! https://t.co/O5J1A3mu4G",1474939676543,780579695540568064,3
794,BossmanBailey,I should've stood outside and sold popcorn and nachos for this show. #Debates,1474939676557,780579695599489025,2
795,Stannnard,"Hilary says Trump rooted for housing crisis, Trump says ""That's called buisness btw"" lmao #debates",1474939676590,780579695737929728,3
796,robinsonangel,"#FactCheckTheDebate  #Debates2016 #debatenight #debates 
https://t.co/AgkZO5XUNP",1474939676794,780579696593350656,1
797,Nephilim_Em,"Good luck America, good luck #Debates",1474939676750,780579696409010176,1
798,tthoreson08,I'm gagging!! https://t.co/LEK4ZhcQvW,1474939676675,780579696094216192,3
799,julieleetz,I feel so bad for Lester tonight. #shortstraw #Debates,1474939676687,780579696144703488,2
800,KristinSeltman,Who are all these rich people leaving our country? Take me with youuuuu #debates,1474939677679,780579700305375232,3
801,Mixingbird,When you mom says you can't have a cookie because it's past your bedtime #debatenight #Debates https://t.co/G7fccYxvIF,1474939677327,780579698829066240,3
802,slanzanegger,Money back guarantee #Debates,1474939677696,780579700376608768,2
803,DTWPhotog,"Hillary should be slamming Trump, since he has the offshore accounts #debates",1474939677625,780579700078936064,3
804,CaraJoyDavid,"I love Hillary calling for the fact checkers. She knows we can't live in the Matilda song ""Loud."" We are better. #debates #ImWithHer",1474939677615,780579700037062657,3
805,gbeasley01,Go trump! #Debates,1474939677688,780579700343181312,3
806,_KeaTheElysian,#Debates https://t.co/2Hm2nhRQ9O,1474939677430,780579699260952577,1
807,Aspernator,thanks twitter #Debates https://t.co/gg23OWT4CW,1474939677292,780579698682257408,3
808,bobsbugsbeagone,#MirandaSingForPres #Debates,1474939677656,780579700208959488,2
809,RobDizzle623,Someone get Lester a buzzer or something! #Debates,1474939677677,780579700296945664,2
810,RealGirlProject,.@BrianLehrer asked how viewers are planning on using social media tonight. I have no regrets. #debates https://t.co/Qub5dwTylr,1474939677404,780579699151994881,3
811,CamiStOnge,I have heard the word #tremendous more times in the past 20 minutes than I have in 5 years. #debates,1474939677568,780579699839737856,2
812,LeftCatcher,These aren't #debates this is an argument... :/,1474939677475,780579699449823232,3
813,GinaLeeMuller2,Clinton does not have a plan to protect the country #Debates,1474939677501,780579699558842370,3
814,bradscorsa,New drinking game.  A shot every time @realDonaldTrump says jobs.  #debatenight #debates #Debates2016 #Elections2016,1474939677714,780579700452261889,1
815,newenglandsox,"This is a shit show and we aren't even 30 mins in, lmao. #debates",1474939677770,780579700687056897,1
816,Silva6640,#Debates why doesn't Trump let Hillary speak? Man! he is just interrupting her..,1474939677789,780579700766674944,3
817,Twizter96,Lo que va a hacer Donald después del debate #debates https://t.co/l5O1v8RARy,1474939677631,780579700103970817,3
818,KayK55,"Not in a good way. RT @ABCPolitics: 15 minutes in, @realDonaldTrump has 79% of the @facebook discussion. #debates https://t.co/hWG3sKqiNG",1474939677628,780579700091392001,1
819,Tzynya,Bad #debatenight strategy: shout over your opponent about Barack Obama. #debates,1474939677841,780579700984819712,1
820,ntrudeau5,Why does she keep closing her eyes?! Hillary wake up there's a debate going on! #debates,1474939678564,780579704017391617,3
821,ScottFordTVGuy,"Bill Clinton #debatenight #debates 

https://t.co/UttnRV9jqb",1474939678684,780579704520658944,1
822,DeltaBlueStrat,"Little known fact, ISIS started in 1966. #debates #debates2016 https://t.co/v9TXY76Phh",1474939678684,780579704520577024,1
823,360Michael,#debatenight or #MondayNightFootball ? I can't believe I'm doing with the #debates they are more entertaining,1474939678512,780579703799312384,1
824,MattCLucas,Last known image of Hillary before she began fighting ISIS #debatenight #debates #Debates2016 https://t.co/SnXxeGR8hG,1474939678154,780579702297595904,0
825,dn_charles,"Donald: No wonder you've been fighting ISIS your entire adult life

me:

#debates https://t.co/nUsYzhq5Ql",1474939678549,780579703954419712,0
826,Fifa_Heaven,Fuck trump #Debates #HillaryClinton,1474939678675,780579704482828288,3
827,newyork4hillary,Delete your statement. #debates,1474939678631,780579704298467329,3
828,xxibyuna,The rich get no tax cuts bc they will reinvest in middle class - I LoVe It #debates,1474939678769,780579704877092864,1
829,anniexo117,How many times can you say tremendous in one sentence before you sound like a tremendous idiot? #debates,1474939678616,780579704235552768,3
830,t_bone_johnson,"Welp, that degraded to shouting match within 10 minutes #debates",1474939678732,780579704722059269,2
831,BjErichsen,He's just making shit up now... #debatenight #Debates https://t.co/Zn0i5O9Dt3,1474939678713,780579704642220032,3
832,KanelsAbel,"#debatenight #debates #Debates2016 #PresidentialDebate 

Clinton chats party lines, Trump chats ive been in the boardroom talk...Easy win",1474939678636,780579704319475713,3
833,davidyetter,#LetGaryDebate #debates #Debates2016 This is why @COSProject has such a following. https://t.co/33oYoHziij,1474939678730,780579704713547776,1
834,QuinnLisaq,Hillary lies lies more lies  #Debates,1474939679695,780579708761092096,3
835,Maiks_World,Think your das has been miserable? Just imagine being the host of #debates tonight.,1474939679449,780579707729416192,1
836,mocha_latte08,All this yelling.. its like he thinks the louder he yells the better he sounds #Debates,1474939679690,780579708740042752,3
837,brandnewflava1,I want to see Gary Johnson vs Trump #debates #PresidentialDebate #Debates2016,1474939679554,780579708169621504,3
838,SammyObeid,I've been fighting ISIS since I was a jihadi sperm #jizzhad #Debates,1474939679701,780579708786266112,0
839,svendawhite,#Debates The Donald thinks ISIS is 40+ years old!,1474939679557,780579708182360064,2
840,77Marisol,Who's this EVERYBODY he keeps talking about??? #debates,1474939679655,780579708593381376,1
841,crysflynt,Ugh---make it stop #debates,1474939679579,780579708274704384,1
842,jchasbeck,You're right. Spending needs to go up. Most economists agree. https://t.co/EkgA2yPn8j,1474939679602,780579708370948097,2
843,AjWylieTherapy,Oh America....do you long for the days of Sarah Palin thinking?  #debates,1474939679659,780579708610154497,2
844,BlueHighwind,"*watches thirty seconds of the #debates *
*two old corpses yell past each other*

Fuck this. I'm going Commie, folk… https://t.co/gXv4PXl5z4",1474939679485,780579707880370177,3
845,prairie_wells,"#Trump attacks saying she is for ISIS, need another square in the #TrumpLies bingo card #Debates #1uVote https://t.co/d4W7ZE4ovQ",1474939678903,780579705439162368,3
846,shallonmnadeau,I would learn more from watching paint dry than from trump's proposals #debates,1474939679708,780579708815671296,3
847,Juicerman778,#Debates Rip skunk lair dftrump!,1474939679706,780579708807229441,3
848,brockbagley,"Not one, not two, but three bigly's. #Debate2016 #debates",1474939679644,780579708547178500,2
849,austinwankenobi,Trump is completely steam rolling Hillary and all she can do is stand there and smile #Debates,1474939679767,780579709063016448,3
850,JannaCook1,So... Did Lester Holt go out for dinner? 'Cause somebody needs to get ahold of this thing. #debates,1474939679698,780579708773818368,2
851,Mynameisarkadi,"@HillaryClinton @realDonaldTrump   #debatenight 
#Debates2016 #debates https://t.co/A8N6oOdfmn",1474939679545,780579708132098048,1
852,StillDriven,Is he going to cut her off through out the whole debate?  #debates,1474939680674,780579712867241985,2
853,ChiTownSinner,"So, uh, the rich people are suddenly going to be generous now? GTFO of here. #debates",1474939680581,780579712477171716,1
854,ArieleStewart,"I'm obsessed with @HillaryClinton's little smile rn. It's just a delight to watch a woman who knows she's right, &amp; knows her facts #debates",1474939680551,780579712351473664,1
855,DevinHamblet,Going nuts https://t.co/lIm4J0qURg,1474939680650,780579712766586880,1
856,PSNDoubleEdge,Hillary Clinton choose a VP who is pro TPP and she knows it. #Debates,1474939680747,780579713173467139,2
857,delmoi,"@dick_nixon Also, retweet my drinking-style game tweet: https://t.co/RCs9iaEBCF",1474939680519,780579712217210884,1
858,ineedtotalktou,@realDonaldTrump #debates @HillaryClinton #PresidentialDebate #debatenight #Debates2016 #IveSeenEnough https://t.co/QUu2RIlhnP,1474939680097,780579710447288324,1
859,josh_michelena,Ay gringos... En qué momento dejaron que Trump llegará tan lejos? #Debates,1474939680645,780579712745639936,3
860,feleciakc,"Can't wait for these ""tremendous"" factory jobs that other countries have ""stolen"" from us #debates",1474939680771,780579713274089472,2
861,dhaarp,I'm voting for the moderator! #Debates,1474939680764,780579713244946432,3
862,JacquiHeinrich,"""You've been fighting ISIS your entire adult life"" - Donald Trump #Debates (tweeting my personal highlights tonight)",1474939680768,780579713261637632,0
863,ErinnMeetsWorld,"What does ""You've been fighting ISIS your entire adult life"" even mean?? As a comment? An insult?? #debates",1474939680824,780579713496612864,0
864,fc7822,"@HillaryClinton: ""Go to the fact checkers!"" Fight your own battles, B**TCH! #debatenight #debates #Debates2016",1474939680753,780579713198596096,1
865,BTrain87,"""I can't beat @realDonaldTrump myself, so please, just go to my website.""  @JoeConchaTV  #debatenight #debates #Debates2016",1474939680874,780579713706110976,1
866,CoriJBrenn,"I can't believe I'm watching this. He's as carry as a middle school girl, with apologies to all the middle school girls I know. #debates",1474939680875,780579713710338049,3
867,vegancunt,"Hillary is the definition of UNBOTHERED, and i'm living for it. #debates #debatenight https://t.co/D6ZxsO3QRE",1474939680225,780579710984126466,1
868,MissIzzieBella,"Where are the fact checkers?!
Are we gonna talk about why he's interrupting? Debate rules??Yelling and sniffing/breathing funny? #debates",1474939681569,780579716621340672,1
869,therealbeaudoin,MAH BOI GARY JOHNSON https://t.co/xdOE4K0hV6,1474939681607,780579716780531712,1
870,thingsinthesink,A child is yelling on stage. An actual child. #debates,1474939681677,780579717074325506,3
871,zaheedonism,@kelsiefraser #debatenight won over fear the walking dead? I'm watching #debates on delay.,1474939681673,780579717057433601,1
872,tamjomi,#Debates2016 Trump is acting like a blubbering baby while @HillaryClinton is showing she is presidential. He is a mess! #Debates,1474939681395,780579715891552260,3
873,JudyMcDonnell,This is the horror show called donald trump. That's called business? Really? https://t.co/nhPWEkEfbg,1474939681472,780579716214448128,3
874,GolightlyGrl427,Yes! Tell it @realDonaldTrump #debates #debates2016,1474939681698,780579717162369024,1
875,catbb33,"Go trump go!!!,   Kick some Kilary ass!  @TeamTrump @WeNeedTrump @Always_Trump @SetUSAFree @MADE__USA https://t.co/Vs7FEorVMa",1474939681628,780579716868648960,3
876,jaschin,"Yes, because ISIS has been around for Hillary's entire adult life. Obviously. #debates",1474939681585,780579716688404481,0
877,TitusTiger,"not sure if that is possible... he shouting isis now
#debatenight
#debates https://t.co/GSdqK6hSMe",1474939681493,780579716302512128,1
878,RikRacer,"AGREE, Rita, A G R E E https://t.co/OKMYVsrrEc",1474939681623,780579716847763456,1
879,imdiaz3,#NationalVoterRegistrationDay https://t.co/ADpc5JoRZJ,1474939681607,780579716780654592,1
880,johnnewburg1,Hillary has no plan.  She's just trying to be anti-Trump.  All she does is lie. #debatenight #debates #ncschoolsdebate,1474939681671,780579717049118720,3
881,pmccratic,Fact check: Red power suit beats blue ties #Debates,1474939681677,780579717074354177,3
882,vaaaleria_Medi,ay trump ojala no gane sino ya valimos madre #Debates,1474939681824,780579717690699776,3
883,terbear49,Trump. Is already loosing his cool. Let's check it out in 20 mins. Prob may turn as red as Hilary's outfit. #lmao #debate2016 #debates,1474939681850,780579717799743489,3
884,ChiffonDior,The only people who are benefiting from this are comedians and snarky tweeters. #debates,1474939681703,780579717183307776,1
885,nerdygirly,I hope Trump's website is done by Go Daddy #debates #Debates2016,1474939681649,780579716956905472,3
886,ylove,Trump is basically giving a commercial for trickle-down economics rn #debates #debatenight,1474939681706,780579717195915268,1
887,gabbie_jane_,"for such a tremendous windbag, @realDonaldTrump never actually says anything. What a candidate. #Debates",1474939681732,780579717304975361,1
888,DominikBraun_,"Trump rules. 
#debates",1474939682662,780579721205514241,3
889,ahbeef,the thing i hate most about these things are when these dick heads interrupt the guy trying to direct the debate #Debates,1474939682684,780579721297866752,1
890,WalkerBragman,"@HillaryClinton is falling into the trap of arguing on Trump's terms: debt, tax cuts, etc. Dems need @SenSanders. #debates #debatenight",1474939682632,780579721079820289,3
891,Wonkette,"Donald Trump: “IS IT PRESIDENT OBAMA’S FAULT? IS IT PRESIDENT OBAMA’S FAULT?!?” Objection, HARANGUING THE WITNESS. #debates",1474939682426,780579720215732224,3
892,tyrus_ballard02,Is bigly a worf? #debates,1474939682728,780579721482383360,2
893,ughsp,I'd be drunk foreva https://t.co/vh92iy8qPI,1474939682540,780579720693882880,1
894,EyePhoto1,"""I have a prettier website than you do, Secretary Clinton!""... Really!? https://t.co/ROgV0WEnHh",1474939682411,780579720152879104,3
895,vkcat4,This guy is a moron #debates,1474939682814,780579721843134466,3
896,tjano5,"Used ""bigly"" OMG #Debates",1474939683687,780579725504761857,2
897,Twitsler,Trump is making Hillary look small despite the camera making her look giant. #debates #debatenight,1474939683691,780579725521489920,3
898,ChavollaPatrik,Lmao I died https://t.co/2ONVQk2tNb,1474939683532,780579724854632448,1
899,thehill,Trump to 'Secretary' Clinton: ‘I want you to be very happy’ https://t.co/3x3Mu8l43j #debates https://t.co/hUjJP25LBS,1474939683507,780579724749840385,3
900,missmarycate_,I have watched 4 minutes of this debate and America.. we are screwed #Debates,1474939683691,780579725521588224,2
901,camaswaguy,The @realDonaldTrump meltdown begins. #debates https://t.co/Mvgg1f59M1,1474939683488,780579724670009344,1
902,breezy16,Things I've learned so far: Trump is really dumb. And Hilary is a great public speaker! #Debates,1474939683685,780579725496373248,0
903,mukupamulo,"The holes are already porous for Dummy Donald Trump, he's acting rude, not following instructions, acting childishly, what an adult #Debates",1474939683694,780579725534236672,3
904,elnuevodiario,"#debates | @realDonaldTrump ""Yo lo que quiero son nuevos grandes empleos"" https://t.co/3odrtQ9YIL",1474939683577,780579725043388417,1
905,IrrakaWolf,"""@realDonaldTrump I know you live in your own world"" - @HillaryClinton  #Debates https://t.co/RoPMkyf7dS",1474939683316,780579723948666880,1
906,Only4RM,"Jeezus! #OrangeMenace said @HillaryClinton has been ""fighting ISIS her entire adult life"" &amp; @LesterHoltNBC...moved on. #Debates2016 #debates",1474939683312,780579723932041216,0
907,netti1226,", Trump couldn't stay on topic if you could nailed him to it #Debates",1474939683815,780579726041620480,3
908,kay_renee89,He legit sounds like this right now tho https://t.co/W6xhuxkIDE,1474939683654,780579725366493185,3
909,ShoreSportsNJ,#LetGaryDebate https://t.co/w9gpFUJ0po,1474939683637,780579725295161345,3
910,Martinez0Andres,Is it just me or does trump look like an elf  #Debates,1474939683784,780579725911523330,3
911,UpstateVoice,"Rep. McClintock Exposes The #ClimateChange Scam. Destroys Obama’s Top Climate Adviser. #DebateNight #Debates
https://t.co/CRIfE52gty",1474939684576,780579729233571840,3
912,Dick_Kaaskop,"Who will win the debate? 

#debates",1474939684665,780579729606897665,3
913,SharkSteak,"Hillary looks like she swallowed #Pepe. Trump is thrashing her #Bigly.

#debatenight #debates #Debates2016",1474939684681,780579729673859072,3
914,JuanMiguelOT,"Trump's not letting Hillary to get away with anything.
#Debates",1474939684758,780579729996779520,3
915,katyfaise,donald trump summed up #Debates https://t.co/RIP3NH1QnW,1474939684209,780579727694266368,3
916,hamilfab,SHUT UP OH MY FOD #Debates,1474939684710,780579729795649537,2
917,analicia666,"*lowering taxes destroys our economy countless times* 

U know what, we should try lowering taxes again #debatenight #debates",1474939684787,780579730118488064,1
918,Learn2choose,He is a broken record- does he even know how the government works? #Debates,1474939684557,780579729153851392,3
919,DiarioQro,#debates | #Trump2016 afirma que #Clinton no tiene un plan para traer empleos. #debatenight https://t.co/tCyXAd8w5n,1474939684559,780579729162309632,3
920,DeadlyFreddie,F*ck this. I might just vote for Gary Johnson #debatenight #debates #Debates2016,1474939684754,780579729980002306,3
921,Zzademps,"Not one but two ""Bigly"" bombs. #NeverTrump #debates",1474939684603,780579729346887680,2
922,BrittanyJanae_,This! 😂😩 https://t.co/i3HN0QWnIT,1474939684775,780579730068086787,3
923,helenhauck,#HillaryClinton you can't lie your way out! https://t.co/jjjULEhUNl,1474939684739,780579729917173760,1
924,CarlHigbie,"@realDonaldTrump, lower taxes to create jobs @HillaryClinton thinks raising taxes will build jobs @GreatAmericaPAC #trumpmentum #debates",1474939684679,780579729665646592,1
925,RaneDays,Why is he yelling? #debates,1474939684707,780579729783001089,3
926,respectfullyno,Hillary is smiling through the pain of having to deal with trumps shit. #debates,1474939684760,780579730005385216,2
927,em616,Make like the oscars and cue the cut off music when necessary #debatenight #debates,1474939684670,780579729627869184,3
928,4xRevenue,#Debates apparently not many conservatives on Twitter feed. I'll play Devils advocate if we need more entertainment,1474939684785,780579730110181377,3
929,ElSoldeSnJuan,#debates | #Trump2016 afirma que #Clinton no tiene un plan para traer empleos. #debatenight https://t.co/jPDvo45g9Q,1474939684613,780579729388802049,3
930,marthathemenace,TRUMP: LOOK AT MY WEBSITE TOO. VALIDATE ME. JOBS. #debates,1474939685673,780579733834575877,3
931,desmarais_l,"@JYSexton 
He has lost it already.
#debatenight #debates",1474939685547,780579733306212354,1
932,TheNewOpum,"I'm assuming her ""fact checker"" is all lies. #Debates",1474939685571,780579733406965760,3
933,CharlesPDavis,How do you defend your position on tax cuts for the wealthy? #debates,1474939685537,780579733264359424,1
934,mfpseth,"Hi, America has ""in-shored"" corporate tax haven profits at lower rates before. It has NEVER - NOT ONCE - helped America. #debates",1474939685687,780579733893287937,2
935,erininvisible,with an eagle clutching an American flag #debates https://t.co/Do3zFZo0FE,1474939685625,780579733633400832,1
936,SeattleDivas,Seriously. #Reaganomics NEVER worked. Is that the best you can do @therealdonald_ - rehash old policies that don't work? #debates,1474939685713,780579734002335744,2
937,ItsGabrielaVega,we are so screwed #Debates,1474939685634,780579733670993920,2
938,CGrzych,Can they not cut the mics? #debates,1474939685413,780579732744265728,2
939,dontsayaword101,This is the best America has to offer for this job? Shame on us! #Debates,1474939685630,780579733654347776,2
940,Supiesonic,"Well... I thought it was going to be a ""debate."" I guess  ""debacle"" is so close to ""debate"" that it's confusing for some people. #Debates",1474939685635,780579733675335680,2
941,URJOURNALISM,"Trump: ""No wonder you've been fighting ISIS your entire adult life."" Clinton was 52 when ISIS was founded #debates",1474939685574,780579733419458560,0
942,ihitcows,"""semi-exact"" #Debates",1474939685695,780579733926842368,3
943,chieflybombast,AHHHHHHH OH MY GOD WHAT THE SHIT ISIS?? MACARTHUR???? #debates,1474939685712,780579733998301184,2
944,CyFrog13,"LOL...""You have been fighting ISIS your entire life""  -  Trump.  LOL  Pretty sure ISIS isn't almost 70 years old.  #Debates",1474939685460,780579732941336581,0
945,Hawk_Hopper,#debates Trump on fire.  Not hearing any sniffles anymore.,1474939685782,780579734291820548,3
946,FunniesPolitics,So many people just went to https://t.co/JJwnbGZdos just now it crashed!!!!! Try it. #debatenight #debates https://t.co/2kMgn7Jmz0,1474939685450,780579732899397632,3
947,jhasua_x,So ashamed to live during this time period  #Debates,1474939685789,780579734321180672,1
948,eagresta,"make ""tremendous"" great again because donald trump ruined a perfectly good word #debates",1474939685694,780579733922783233,3
949,sparkette57,#DonaldTrump lost it @HillaryClinton #HillaryClinton #Debates,1474939685735,780579734094618624,3
950,BriGriffith,#debates TRUMPMENDOUS JOBS. 😂😂😂😂😂,1474939685780,780579734283575296,1
951,iamCANDYbitch,"Trump's main line is ""You're FIRED!"" but now he wants everyone to have jobs 😂😂😂 #Debates",1474939685750,780579734157529088,3
952,TheLuisFernando,Hillary is so poised while getting interrupted. Just a smile and a classy clapback. #Debates,1474939685636,780579733679566849,1
953,svfxo,loooooooool this is hilarious #Debates,1474939685844,780579734551875585,3
954,audenwood,say what you will abt clinton but she has experience and this buffoon has a big mouth and no idea what he's talking about #Debates,1474939686446,780579737076797441,3
955,survivormomOP,I feel so awkward right now... It's like watching a bar fight and I can't look away... #debates,1474939686666,780579737999507456,3
956,matthewhaugen,Yelling! Rabble rabble rabble #Debates2016 #DebateNight #debates https://t.co/FyPBb01fJc,1474939686054,780579735432597505,1
957,garrettmsharp,Shock collars would be handy for both candidates lol #Debates,1474939686672,780579738024673282,3
958,ChermelP_Music,"This debate has lost all seriousness, it's just laughable #debates",1474939686652,780579737940979713,3
959,Kagiso_Loeto,"Waiting for Clinton to play the ""sexist"" ""racist"" ""homophobic"" cards #Debates #trumpclintondebate",1474939686418,780579736959455235,1
960,stlrichierich,😱 getting wild https://t.co/CulunYD8eE,1474939686696,780579738125373440,1
961,newt_ripley,What I am most embarrassed by is Lester Holt being such a spineless jellyfish that he should simply go home. #debatenight #debates,1474939686761,780579738398040065,2
962,flgazr1,@auntieamy90 Single moderator format.What could possibly go wrong?! #debatenight #debate #debates,1474939686496,780579737286553600,3
963,AmandaMagee,I genuinely believe if he were a cartoon his head would just explode in a plume of smoke. #debates #Debates2016,1474939686423,780579736980484096,3
964,iprouting,"Watch live! ""U.S. Presidential Debates"" #Debates https://t.co/shfXLIrbeF
And all the live tweets",1474939686592,780579737689174016,1
965,LifeShantastic,"#Trump showing his hand right now. Trust us, the wealthy (basically)
#debates #debatenight",1474939686602,780579737731117056,3
966,kjrichardson6,🇺🇸🇺🇸🇺🇸 https://t.co/Njt48mp4ci,1474939686540,780579737471225856,1
967,jimcarrig,Just learned Obama founded ISIS but Hillary has been fighting them her entire adult life #debates,1474939686692,780579738108698624,0
968,HorghidanRamona,Arguing like a 5th grader with many many arguments #deplorable https://t.co/9YAA0VXako,1474939686625,780579737827704833,1
969,immemito,Can somebody shut the microphones when the other is speaking ? #debates,1474939686777,780579738465087488,2
970,shanestangel,How do you honestly expect Hillary to act? This is literally as good as she can do with a mentally challenged person arguing her. #debates,1474939687710,780579742378516481,1
971,Bsnowflake_,Both of them are starting to act like children. #debates #JohnsonWeld2016,1474939687657,780579742156226561,3
