,screen_name,text,timestamp,tweet_id,cluster_pred
0,floresjasmine31,Fuh https://t.co/uk6V37AVrj,1474940343672,780582493682491392,3
1,mashablegif,Bragadocious dude #debatenight #debates https://t.co/Aojyr0KYDf,1474940343510,780582493003063296,1
2,Gushayan,Off topic again #Debates,1474940343806,780582494244474880,2
3,KenyaMusic,@SkyyhookRadio Because he's a liar! #losetheaudience #debatenight release your taxes! #trump #Hillary #debatenight #debates #Debates2016,1474940343755,780582494030614528,3
4,K__Sinclair,@taylornhodges14 https://t.co/Wqx6BflJpE,1474940343412,780582492592013313,3
5,suzygeiger,"It is astounding to me how little substance there is in anything Donald Trump says. All anger, attacks and subterfuge.  #debates",1474940343894,780582494613573632,2
6,matsonscotty,#bragadociously #debates,1474940343819,780582494299009024,2
7,TheDudeMattT,Not watching #debates #debatenight #Debates2016 #DebateWatch,1474940343861,780582494475284480,3
8,citizenstewart,Still no good answer on why you're not releasing your taxes. #DonaldDucks #debates,1474940344597,780582497562218497,0
9,muffiweaver,He's right about our airports #Debates,1474940344396,780582496719237120,3
10,0hjayhitit,money money money. #Debates,1474940344650,780582497784516609,2
11,jshorvath247,I made a mistake putting the safety of America at stake. Sorry ;( -HRC #debatenight #debates,1474940344678,780582497901871105,3
12,TimmyAdeoye,@kanyewest for president man!✊🏾 #Debates,1474940344580,780582497490984961,2
13,jenbruin00,#Debates u don't learn a lot from #trump's tax returns b/c u hire people to hide shit for you!,1474940344644,780582497759272960,2
14,BiancaVNugent,Macroeconomics 101 Mr. Trump: there is more to cutting taxes for business to sustain an economy #pnpcbc #debates,1474940344621,780582497662996480,2
15,islandheightser,"he is rambling and loosing his train of thought
  #Debates",1474940344585,780582497511931904,2
16,grabberporter87,"Tax returns vs emails??? I want TaxReturns he's rambling he aint that rich,now hes on airports?? #Debates",1474940344597,780582497562136580,2
17,CellyHOE,‼️‼️‼️ https://t.co/BVbWKFY2ab,1474940344617,780582497646153728,3
18,snatchthatgravy,"Oh please give her a list of banks! Wait, he has money?! Never heard that before
#Debates",1474940344523,780582497251753985,2
19,clintwilliams24,Has Trump ever actually landed in a third world country? Wow. #debates,1474940344599,780582497570557952,0
20,nwg83,Don the Con.  Fraudster-in-Chief.  #debates #Debates2016 https://t.co/7gH2Y2vG8o,1474940344660,780582497826381824,3
21,CaptainChaosMom,Bragidocious?? #Debates,1474940344714,780582498053005312,2
22,VMcVoterface,What is happening #debates,1474940344749,780582498199756800,3
23,amomanon,"""All my friends say..."" Oh! We're playing ""Name that logical fallacy"" now? #debatenight #Debates",1474940344791,780582498375831552,2
24,emilita_jane,Can we get over the emails and talk about real things!!!! #Debates,1474940344744,780582498178772992,2
25,MikeRTweeting,"Ironic, Trump talking about airports #debatenight #debates",1474940344744,780582498178924544,3
26,Tucker_Carlson,"That's it, praise the banks that tanked the housing market you benefited from. #Debates",1474940344708,780582498027712513,2
27,kathybiele,"I have a tremendous income - not braggadocio way @realDonaldTrump 
#debates",1474940344620,780582497658691584,2
28,MehlynnDUH,😭😭😭😭😂😂😂 https://t.co/1liWjwIQJg,1474940344759,780582498241744896,3
29,stardaniellee,Dawg i'm voting for Jesus #Debates,1474940344795,780582498392743936,2
30,BeerGuyRobert,Who would be your running mate? #debates @DepressedDarth,1474940345672,780582502071021568,2
31,LindaKWS1,#HillaryClintonsQualifications and accomplishments #ImWithHer @HillaryClinton #Hillary2016 #DumpTrump #Debates2016… https://t.co/BNmPYYZBhI,1474940345595,780582501748092929,3
32,kellybrooks03,Just watching the presidential debate like... 🇨🇦🇺🇸#debates #ImWithHer https://t.co/eND1FVcFZV,1474940345431,780582501060321280,3
33,mg_jacobs,Hillary has no clue how to manage money. No way in hell she should manage our tax dollars! https://t.co/1uHhoCu9Kb,1474940345529,780582501471444992,2
34,imerikuh,If Trump's hiding something in his tax returns it can't be nearly as bad as what was in the thousands of emails Hillary deleted 🙄🙄 #debates,1474940345692,780582502155059200,2
35,DSNyDE,"Come on, LAX has come a long way. #debates #Debates2016",1474940345696,780582502171680768,3
36,real_kim_wyatt,😂😳 https://t.co/2JsRFJDrXN,1474940345722,780582502280798208,3
37,Bzzy_Bee,This circus is out of control #debates #Debates2016,1474940345716,780582502255636480,3
38,silver_sivan,"how to run a country: watch ""the shows"" #debates",1474940345658,780582502012448768,3
39,NoFreeSpeech69,Darling we're screwed no matter which of these lunatics wins https://t.co/Z7oaWZBpHE,1474940345644,780582501953798144,2
40,ChanSteele,Make airports great again. #debates,1474940345730,780582502314323972,3
41,tj02192943,Instead of talking about what she can do for America she's harping on tax returns? We know she owes money to a Terrorist country!  #debates,1474940345815,780582502670802944,2
42,theChandraMoore,LAX has a Lemonade. I think it's great. #debates,1474940345811,780582502654107648,3
43,HeyHeyTayTay28,Someone who knows about money? May I suggest Jed Bartlett for president? #debates,1474940345778,780582502515761153,2
44,MaWhite79,LOL! https://t.co/jlQQCKnB2U,1474940345806,780582502633119744,2
45,darklingmp,I'm so scared for our future. How could these two be the candidates? Is this really who the U.S. voted for? #Debates,1474940345839,780582502771466240,2
46,AlaskanRadical,Trump says US is a Third World Country. #debates,1474940345783,780582502536613888,0
47,litboi69,Wait let me get that bank list (?) #debates,1474940346691,780582506345050112,2
48,texanjuliet,How is that these 2 both dodge answering every question? They just shift blame and point fingers. #debates,1474940346695,780582506361790465,2
49,louisey,A list of banks... ? Wtf is happening here. #debates,1474940346690,780582506340945920,2
50,leos_haus,An idea of money? You've gone and filed for bankruptcy HOW MANY TIMES? Don't talk about knowing money. #Debates,1474940346671,780582506261278720,2
51,MrDevvysAccount,the last person who was all about money ran america into the ground #debates,1474940346607,780582505992814593,2
52,shanegivesmelif,Wait you haven't watched this yet? GO NOW WHO CARES ABOUT THE #Debates (just kidding educate yourself but you know) https://t.co/c7esWnq8ib,1474940346677,780582506286370816,2
53,howie29uk,Watching this debate is the closest I'll ever get to being waterboarded.  #Debates,1474940346450,780582505334341633,2
54,JamesDalgarno_,"""We have become a third-world country,"" #Trump says. #Debates #debates2016 #Clinton #Trump",1474940346713,780582506437439489,0
55,shepardprice,Has Donald said one specific tonight? #debates,1474940346756,780582506617712640,2
56,BoomerColombine,"The emails! The emails! The emails! The emails! That's all I have. Oh and blame everyone for everything. Except me I'm ""brilliant"" #debates",1474940346765,780582506655387648,2
57,TampaBayReMax,"Hillary
 is getting ready to fall over #Debates",1474940346732,780582506517135361,2
58,Pastabea,I am very under leverage. WTF ones that mean.#Debates,1474940346693,780582506353614848,2
59,CEOofHope,Donald just said that IF he hasn't paid taxes that would make him SMART. Donald? That's a FEDERAL. CRIME. #debatenight #debates,1474940346815,780582506865172480,3
60,JonathonMcNeil1,He's flopping all over the stage on these tax returns. He had to know this question was coming. #debates,1474940346712,780582506433286144,2
61,mikeflacy,Bragadocious? So many new words. #debatenight #debates,1474940346817,780582506873524225,1
62,hexb1999,Bragadocious #Debates,1474940346873,780582507108372480,1
63,TheBookRat,How long do we think The Donald would last in a convo where adverbs and adjectives were banned? Just curious. #Debates,1474940346802,780582506810765316,3
64,malkovichmusic,"""I could give you a list of banks.."" we'll just take the tax returns, thanks. #debates",1474940347672,780582510459625474,2
65,beccaaboo2,"Someone bet him a lot of money that he couldn't work ""bragadocious"" into the conversation #debates",1474940347627,780582510271029248,2
66,CyclingDyke,I gave in. Be kind  #Debates,1474940347552,780582509956378624,2
67,iKayOreOo,"Hillary's face when Trump said ""Bragadocious""
#Debates #Debates2016 https://t.co/x53vDvMd10",1474940347392,780582509285433344,1
68,Josies_tweets,He's burning her before he burns the country https://t.co/0ejdRKfGWn,1474940347575,780582510052843520,3
69,DeAnnaCai,someone tell hillary she has lipstick on her teeth!!! &gt;.&lt; #debates,1474940347641,780582510329729025,2
70,broncomaniac7,#releasetheemails #debates,1474940347772,780582510879084544,2
71,trjh,"Maybe the US wouldn't be so badly in debt if people paid their taxes, Donald #debates",1474940347726,780582510686310405,2
72,reroll,BOOM! https://t.co/3cgNZs7MF9,1474940347645,780582510346592256,3
73,mahercbeaucoup,my list of banks is the best. I have the best list of banks #Debates,1474940347618,780582510233288705,2
74,CwinTalk,"""Bragadocious"" #debates",1474940347665,780582510430416898,1
75,t_stiver,She looks like she's having a seizure! #Debates,1474940347763,780582510841491456,2
76,iNdabz,Give us the list then #debates,1474940347676,780582510476533760,2
77,samrenee2010,Hillary.... LOOSEN UP.  STOP TALKING LIKE A TYPICAL POLITICIAN!  GO AFTER HIM WITH FORCE.  #debates,1474940347745,780582510765932546,2
78,stormclennan,"Honestly don't need a tv to know what's going on in the #Debates .. btwn my family gc and twitter, I feel like I'm there bih",1474940347767,780582510858305536,2
79,yib_elbashir,LOOOOOOL https://t.co/J7cVObNl5S,1474940347587,780582510103257088,3
80,christianfrano,"""ESSENTIALLY financial report OF SORTS"" Stop trying to distract people by talking circles around your shady stupidity.  #debates #nevertrump",1474940347757,780582510816133120,3
81,ahbeef,who cares about fucking airports shut up #Debates,1474940348712,780582514821697537,3
82,PinkPolitical,How is he patriotic when he spends all this time trashing the US? #debates,1474940348734,780582514913980417,3
83,itsukoii,as a canadian watching the #debates I AM SO SORRY,1474940348665,780582514624696321,2
84,nerelleque,Why does Hillary keep blinking so much? #debates drinking game,1474940348695,780582514750529536,2
85,2TheImp,"""Our airports are like a 3rd world country."" WTF?! #MomsAgainstTrump #debates",1474940348332,780582513227993088,0
86,PrincessJosJos,"Donald is trying so hard to reassure everyone, mostly himself, that he's rich #Debates",1474940348655,780582514582781953,2
87,cannonjw,"I don't care about emails. I don't care about tax returns. Can't imagine I'm alone in this. Lester, get your stuff in order. #debates",1474940348599,780582514347876354,2
88,JacobBlackAUTOS,WOW. @LesterHoltNBC not even going to point out that the Republicans have also used their own email servers?! #debates #toothlesstiger,1474940348583,780582514280849408,2
89,SNOOPaLUPE,We really need @GovGaryJohnson on the #debates,1474940348721,780582514859454472,2
90,SamAshleyBlogs,"Did he just say that LAX, Kennedy are dumps? Third world country? I think you need to check your privilege at the door, dude.  #debates",1474940348616,780582514419240961,0
91,TitansHomer,"""Fuck LAX"" - Donald Trump

#debates",1474940348757,780582515010523136,0
92,LKFiction,I'm trying to do my civic duty but the #debates are stressing me out and it's only just started,1474940348689,780582514725355521,3
93,bigtallduncan,Braggadocious! Whoa! #Debates,1474940348707,780582514800799745,2
94,babybearwear,Debate has me more on edge than #GameofThrones. Where's a Xanax? Where's a #whitewalker?! #debates,1474940348761,780582515027251201,2
95,eurogirl24,Bam! Hit her hard!!! LOVE IT!!! https://t.co/MEvulPXJd9,1474940348731,780582514901389312,3
96,WormLightning,The Oswalt Brothers are killing it! I think @MattOswaltVA is slightly ahead of @pattonoswalt on the irreverence. #debatenight #debates,1474940348797,780582515178254336,3
97,sydneysol07,"this man really said ""bragadocious"" ...someone look that up please #debates",1474940348741,780582514943492098,1
98,lizzettejannett,$650 million isn't a lot of money??? What is Trump on and where can I get some? #debates,1474940348767,780582515052572676,2
99,wesleyryanboyd_,I just told @nbcwashington who I think is winning. Cast your vote now! #Debates #NBC4DC https://t.co/GzRKBLgtMD,1474940349668,780582518831493121,3
100,happyhowey,bragadocious......new trumplish word? #Debates,1474940349598,780582518538002432,1
101,ravii97,"""That makes me smart"" lmaoooo is this a joke #debates",1474940349702,780582518974210048,2
102,GabrielleMcKeon,our country is a mess and so am i  #Debates,1474940349702,780582518974091264,0
103,LindsKris,i had no idea airports were now a political issue #debatenight #debates,1474940349640,780582518714171393,3
104,princxpar,Huh… #thirdworldcountryairport #debatenight #PresidentialDebate #debates,1474940349711,780582519011938304,3
105,KimberlyInezDC,"""It's about time a rich person has power!!"" -Trump #Debates",1474940349728,780582519083196416,2
106,JillianPenrod,I always feel like Elle Woods when I work out and watch politics @RWitherspoon #debates,1474940349700,780582518965821440,3
107,mjsante,Fact check: Is Trump as rich as he says he is? #TCDebate #debates,1474940349646,780582518739210240,2
108,TJCorc82,The countries with slave labor have great airports #debates,1474940349690,780582518923726849,3
109,mykuhlann,Donald ever been to a third world country airport? 🤔 #debates,1474940349732,780582519100112896,0
110,TheChunkiest,"How many times has he mentioned our debt crisis, but don't mention how to fix it?? #Debates",1474940349746,780582519158616064,2
111,sliver2964,Swiss bank accounts  #Debates,1474940349783,780582519314022400,2
112,kassy1979,"hahahah
 https://t.co/RifNuf1YfM",1474940349661,780582518802288640,3
113,sgehler,"Donald, how many of your constituents do you think are routinely flying from Dubai to LAX? #debates",1474940349798,780582519376793600,3
114,RonG30,@realDonaldTrump is a joke #debates https://t.co/Hal6V29GMd,1474940349548,780582518328360960,3
115,RealBillWorkmen,"""Under leveraged"" @realDonaldTrump your poor.  #PresidentialDebate #debatenight #Debates #HofDebate16",1474940349825,780582519490039809,3
116,DanyealWilliams,Can someone bring up his statements about women? About immigration? Could be your target Hillary. #Debates,1474940349776,780582519284596736,2
117,RockMasterFly,"With his aggression towards her, we're seconds away from Trump dropping a ""what is she doing out of the kitchen"" joke #Debates",1474940349842,780582519561302016,2
118,QuarterNote_,So @HillaryClinton is crushing this right? I'll admit I am biased but it seems like she is crushing it. #debates,1474940350419,780582521981530112,2
119,thomasjohnston7,#Debates He's not running for President to get rich. She got Rich off the American people.,1474940350624,780582522841276416,2
120,jessica_ley_,Why are we talking about airports #Debates,1474940350612,780582522790907904,3
121,zoitsa1300,He is calling us a third world country? Does he know the definition? #debates,1474940350504,780582522338050048,0
122,Blackair318,@realDonaldTrump it made you smart not to pay taxes.. #Debates,1474940350591,780582522702991360,3
123,Ltos5363,I wish she just used her middle finger to scratch her nose while looking at #trump #Debates,1474940350529,780582522442899456,0
124,SophiaPolicy,Supercalafragilisticexpi-Braggadocious #socpolnyu #Debates,1474940350612,780582522791026688,2
125,Zach_Stephens,YEAH THE EMAIL SCANDAL IS BAD. HILL'S JUST PLAYIN' BALL THO'. #Debates,1474940350378,780582521809543170,2
126,theplayfulmedic,Watching the presidential debate makes me SO happy to be Canadian and very scared for my neighbours to the south.  #debates,1474940350530,780582522446942209,2
127,MichaelKeene,Bra.... bragadocious? #debates,1474940350704,780582523176820736,1
128,Kwaselow,TRUMP JUST SAID OUR AIRPORTS AREN'T NICE ENOUGH IN RESPONSE TO NOT RELEASING HIS TAX RETURNS #debates,1474940350695,780582523139088384,0
129,makosharkattack,bragadocious? #buyadictionary #Debates,1474940350720,780582523243900931,1
130,EvelynO55,@MerriamWebster you are the definition of brilliance! https://t.co/mzOTAS14oA,1474940350470,780582522195410945,2
131,Lin_Dolin,Too many people think highly of T bcz T doesn't pay taxes &amp; bullies people to take less $$ on invoices. #debates #nevertrump @buckhollywood,1474940350696,780582523143270400,3
132,mirrormatt86,'our airports are like a 3rd world country.' ... how does @realDonaldTrump know? wouldn't he fly private? #DebateNight #debates,1474940351687,780582527299784704,0
133,kristiezernack,He's just listing numbers. That's literally what he's doing. Nonsense. #debates,1474940351649,780582527140528128,3
134,ksteeno,"""our airports are like a third world country"" says the man who only flies via private jet #debates",1474940351617,780582527006154752,0
135,andreafaire,Does this mean...is he planning a TrumpAirport?? 😐😑 #debates,1474940351671,780582527232839681,0
136,RobynCorvin,This is like my early childhood... My parents arguing.  #Debates,1474940351590,780582526893101056,3
137,JStuartMacLean,"#debates ""Money is money, paper is paper"" - Thomas Paine https://t.co/WCvgvMqYVt",1474940351593,780582526905495552,2
138,TheMinskys,".@realDonaldTrump thinks that avoiding taxes domestically is 'smart', but doing it overseas is 'wrong'. #debates #hypocrite",1474940351654,780582527161491456,3
139,USChamber,The #TPP would mean better jobs and significantly higher wages for American workers https://t.co/HGB0QOFqXo… https://t.co/UmwDMt49zx,1474940351455,780582526326890496,3
140,TheSaharZ,"$650 million dollars is ""not a lot of money"". The Donald there, appealing to working-class voters. #debatenight #debates",1474940351665,780582527207694336,2
141,saltytoastAU,For real he's complaining about airport decor???? #debates,1474940351778,780582527681507328,3
142,tracee,"Our airports are like a third world country? Dubai and Saudi ones have been built by KINGS, not countries like the U.S. #debates",1474940351705,780582527375319041,3
143,DxpeVssJvs,Yea Trump isnt releasing his tax returns &amp; Clinton isnt undeleting her emails ... #debates,1474940351819,780582527853441024,2
144,dealsamongus,I'm so confused when the topics switch when Trump talks #debates,1474940351788,780582527723380736,0
145,SaraMargaritaA,"Never related to Trump more than when he just generally dropped that he ""has friends,"" just to make it clear. #debates",1474940351714,780582527413194753,2
146,StraightGMoney,what is he even talking about????? #debates,1474940351692,780582527320883200,3
147,IamGMJohnson,"Did he just call our Airports ""3rd world"".  LMAO #debatenight #debates #Debates2016 who gives a shit about what an airport looks like",1474940351766,780582527631233024,0
148,joycearns,bragadocious?  #Debates,1474940351835,780582527920582656,1
149,nicolabennettau,that moron rambling next to Hilary is everything wrong with modern society. and my Tuesday.  #debates,1474940351847,780582527970840576,2
150,ThisIsSabby,"Trump: No seriously guys, I'm really f***ing rich! #debates",1474940351684,780582527287300096,2
151,Sammy316316,#debatenight #LetGaryDebate #debate #debates https://t.co/bHUULRKTuZ,1474940351753,780582527576645633,3
152,iamsporty657,This debate is a joke just like most people expected to be lmao #debates,1474940352678,780582531456495616,2
153,shellylynn14,@MeatSauce1 why weren't you included in the #debates tonight? #makeamericawailagain,1474940352571,780582531007516673,2
154,Alyx31,Let's fact check braggadocious!  #Debates,1474940352637,780582531284348930,2
155,BekahEve,"""I have a tremendous income"" lol #Debates",1474940352687,780582531494207488,2
156,dmorgante94,"I would much rather see Hillary's deleted emails, than Trumps tax returns. #debates",1474940352643,780582531309580290,2
157,ObryanLily,I've been watching the debates with @Patxiciaa over FaceTime lol best friend goals 💙 #debates,1474940352690,780582531506855936,2
158,itsjusentertain,Jon Stewart should be hosting/moderating every Presidential debate! #debatenight #debates #JonStewart #thedailyshow #PresidentialDebate,1474940352628,780582531246788610,3
159,justashley,That's a first https://t.co/E8yqbjMGiB,1474940352537,780582530864910336,3
160,TumourousGuy,"Trump has got me pulling my thesaurus. ""Braggadocio"" #debates #PresidentialDebate #USElections2016",1474940352798,780582531959693312,2
161,RedBlueThing,Donald Trump on Global Warming https://t.co/UeKC7Io49k via @DidSayThat #debatenight #debates #Debates2016,1474940352774,780582531859042304,3
162,JetsLag1,I have a tremendous company. I'm not bragging -Donald Trump #debates,1474940352778,780582531875934210,2
163,BenChicka,How smart is #Hillary? She can translate the alien nonsense language being shouted at her and respond with intelligent sentences. #debates,1474940352672,780582531431297028,2
164,adicloud,"""We've become a third-world country."" DID YOU JUST FUCKING SAY THAT? #debates",1474940352788,780582531917815808,0
165,ninakimpossible,lol disgraceful??? bruhhhhh check yourself #debatenight #debates https://t.co/8tx2XIuAPw,1474940352508,780582530743472128,3
166,Jacobson_taylor,"""My tax returns say very little and thats why i wont release them"".... lol what?? #Debates",1474940352862,780582532228141057,2
167,FPanizzon,The guy does not know what he is talking about https://t.co/gBkgBHlx9u,1474940352715,780582531611496448,3
168,RealJamesKist,What #leftist sallykohn says https://t.co/lvHzNrUMmU,1474940352524,780582530810609664,2
169,9mm_mike,Wuf  is bragadotious   #Debates,1474940352884,780582532320366592,2
170,springbreeze227,#Debates the real problem in america is your fake tan,1474940352870,780582532261810176,0
171,AstraStarr,Braggadocios #Debates,1474940352713,780582531603267585,2
172,jeff_skeels12,She knew what she was doing. Only a fool would believe her https://t.co/qMDdyUlLVO,1474940352892,780582532353892352,3
173,annalynnmartino,Wait..how many times has @realDonaldTrump files bankruptcy?? #debates,1474940353602,780582535331840001,2
174,corinnalb15,Trump right about that! #Debates,1474940353674,780582535633833985,0
175,thejazzyjo,Lots of reasons to follow @chelseahandler's #debates live tweets. #shekeepsusreal,1474940353664,780582535591899136,2
176,americankeith,"#Trump slams #Hillary on emails

#Hillary's response ""I was wrong""

 #debates   #Debates2016   #debatenight   #MAGA

#TrumpTrain",1474940353556,780582535139094528,2
177,LovesEmpoleon,You are a mess. #debates,1474940353535,780582535051042817,2
178,SaharKarimian,DONT TALK ABOUT NEW YORK AIRPORT PUT SOME RESPEK ON OUR NAME  #Debates,1474940353481,780582534824484864,2
179,Junhores,e os jogos começam https://t.co/rAATa6TxZ3,1474940353620,780582535407411201,3
180,bjmay,"Trump: I'm rich, therefore I know about money. #Debates",1474940353733,780582535881371648,2
181,TitusTiger,"donnie, we can't believe you.. put up or close the piehole
#debatenight
#debates",1474940353577,780582535227183104,3
182,StephanieGoins8,Why are Hillary's emails more important than Trump's tax returns? Don't really care! Get to the stuff that affects me!#Debates,1474940353679,780582535654932481,2
183,kmoney_swagbot,I'm deeeead https://t.co/2gVpPnXsTa,1474940353627,780582535436890112,3
184,MartinVaughan16,"F'n dems have ruined this country, and you want to give it to her - stupid people #debates",1474940353667,780582535604514816,0
185,dlightsey89,Who the fuck buys Trump's toupees? They're fucking hideous  #debates,1474940353687,780582535688585217,2
186,gillyarcht,"'You don't learn that much from tax returns' Trump, near-whisper, confidentially, just to you and me

#debates",1474940353667,780582535604690945,2
187,StudioSanctuary,"#debates #debatenight #debates2016Stop Donald, stop defending and start attacking what she's hiding!",1474940353701,780582535747112960,3
188,Djhoisch,"#Trump, saying ""I'm not bragging"" doesn't necessarily excuse the bragging. #debates",1474940353799,780582536158208000,2
189,13gg13,*clapping https://t.co/afry5QhEmc,1474940353465,780582534757449728,3
190,Tobal_Ortiz,Has an idea about money...yeah...someone who has gone through 8 bankrupcies #Debates,1474940353729,780582535864528896,2
191,IceIceNatty023,WHAT IS BRAGADOSIOUS #debates #debatenight,1474940353722,780582535835295748,3
192,jeremy_london,Bragadocious????? #debates,1474940353638,780582535482966019,1
193,champsss_,Our presidential candidates are literal children lolol @ Jesus plz come back &amp; take us home asap https://t.co/aKS6uUTd5s,1474940353770,780582536036495360,3
194,LiberalGribble,"@ Adult America,

As a minor who cannot vote,
fuck you. Look at these fucks.
You should be ashamed.
You did this to my generation.

#debates",1474940353766,780582536019927040,0
195,FortesSnC,I swear the volume goes down a little whenever Trump tries to talk. #debates #Debates2016,1474940353750,780582535952789506,2
196,MRusnock,What is he talking about #debates,1474940354582,780582539442417668,3
197,toni_b,Braggadocious #debates,1474940354691,780582539899482112,2
198,sethgreenland,"If Trump thinks our airports are like a 3rd world country,
he hasn't been to a 3rd world country lately.
#debates",1474940354453,780582538901270528,0
199,RobertoUebel,Trump diz que os aeroportos norte-americanos são como os do terceiro mundo. Não queira comparar DCA com BSB mesmo. BSB melhor. #debates,1474940354598,780582539509596160,3
200,RoseLizenberg,What a petulant dick. #Trump #debates,1474940354713,780582539991719937,2
201,cthulhu4america,"➡️ Won't show tax returns
➡️ Won't show secret email
➡️ Will show what an apocalypse is like
#debates",1474940354528,780582539215839232,2
