,geo,screen_name,text,timestamp,tweet_id,cluster_pred
387,,angelicardour,High school students can be respectful and follow debate rules. Why can't our #PresidentialCandidates? #debatenight #debates,1474940710741,780584033281597440,0
388,,TheAPPhotog,random thoughts... why are people so mad trump is rich?  Wouldn't you want someone who can manage money running the country? #debates,1474940710810,780584033570861057,0
389,,cassysim,Why does Hillary go first?#debates.  Put Donald on the offensive,1474940711659,780584037131939840,0
390,,Mich706,"I just told @nbcwashington who I think is winning. Cast your vote now! #Debates #NBC4DC
https://t.co/3spGUnb4hW",1474940711645,780584037073248258,1
391,,Endless_Shipper,time for cup two of tea #debates  Jesus how do adults do this,1474940711674,780584037194797057,0
392,,mommadona,"He failed, right off the bat 
Audience is now laughing
This is not working
Very embarrassing .@debates https://t.co/VF3JmjkSgd",1474940711704,780584037320568833,0
393,,KellyEmily91,he's very intelligent https://t.co/XKnWRbiy0Z,1474940711642,780584037060665345,0
394,,RockMasterFly,I bet Trump got some ill race jokes in the stash  #Debates,1474940711697,780584037291130881,1
395,,robertLeePerry,"My cat just turns from the screen to lick himself, because it is more substantive...and he can #Debates #LetGaryDebate",1474940711633,780584037022859264,0
396,,JesyJames2,#debates There is a lot of wasteful spending. Especially in the military...,1474940711306,780584035651313665,0
397,,Atheist_Ivory,Look I can succeed in business and equate it to ethical standards #TrumpTrain #debates,1474940711793,780584037693784064,0
398,,MrCharlesPowers,"Two white people, talking about race relations. AMERICA! #Debates",1474940711787,780584037668696064,1
399,,chel69,Politics is just adult drama #Debates,1474940711678,780584037211570176,0
400,,upsidedownhello,they're talking about race. let's see how donald fucks this up #debates,1474940711815,780584037786103808,1
401,,PaulOfFame5,"Hopefully, not the Trump Taj https://t.co/6sOPYS9oFw",1474940711562,780584036725055489,0
402,,NJIvorygirl,#Hillary #Debate2016 #Benghazi #PJNET #Patriots https://t.co/Xt968b7ZEb,1474940711783,780584037652000768,0
403,,kyrajacksonn,I just told @nbcwashington who I think is winning. Cast your vote now! #Debates #NBC4DC https://t.co/1ozUt0BY7O,1474940712523,780584040755761153,1
404,,soverykerri,"Clinton says ""in the criminal justice system"" and I jump up as if SVU is starting #debates #Debates2016",1474940712477,780584040562880512,0
405,,TawnosWins,You heal the divide to throwing out identity politics bullshit. #Debates,1474940712654,780584041305083904,0
406,,rebeccagNYC,One thing Trump is consistently against: WORDS #Debates,1474940712579,780584040990662657,0
407,,thatfreakingcat,"Race relations.

Remember to breathe, everyone. 

Remember to breathe.

#debates",1474940712787,780584041862930432,1
408,,PandybearAndy,What an absolute fucking tit! God help America #debatenight #debates https://t.co/D7I0mCYQbk,1474940712409,780584040277704704,0
409,,WAGGNews,Clinton: We have to restore trust between communities and police. #Debates,1474940712767,780584041779113986,0
410,,ThePurpleMinx,Trump is going to heal the racial divide by building a wall and by killing off black people with his KKK buddies.  #debates #debatenight,1474940712725,780584041603076096,0
411,,emilyquail,You should be there pal. https://t.co/0iVfbBj8Ti,1474940712625,780584041183674368,0
412,,joefxd,Everybody get ready for two rich old white people to talk about how great/rough black people have it these days. #debates,1474940712791,780584041879891969,0
413,,poke107,Tsss se viene un tema escabroso  #Debates,1474940712718,780584041573715968,0
414,,Sara_D,"Lester is a strong believer in the ""if you don't have anything nice to say, don't say anything at all"" philosophy. #debates",1474940713684,780584045625212928,0
415,,philipgalitzine,Solid strategy for a candidate to muse on live TV about what happens when he loses his election. https://t.co/EHol1uH7An,1474940713646,780584045465833472,0
416,,docswifee,Race Question: is Hillary talking in slow motion? https://t.co/atkGdtqFB7,1474940713665,780584045545521152,0
417,,nvulypn,@realDonaldTrump says he has the best solution to the budget. Treat it like business. Agree? #MyAmericaMyVote #debates #WeVote #debatenight,1474940713572,780584045155672064,0
418,,jpskyw4lker,essa piranha n tira esse sorrisinho de vagabunda falsa cinica da cara tnc #Debates,1474940713680,780584045608574976,0
419,,dogaldtrump,My business is the most tremendous business out of every business.  Have I told you how much I made yet? #debatenight #debates,1474940713670,780584045566631938,0
420,,LivinMyTruth,".#debates Trump just gave a 5 minute promo of his building. 
Still no plans!",1474940713616,780584045340229633,0
421,,KassondraCloos,Correct me if I'm wrong but @realDonaldTrump hasn't denied stiffing small businesses. Says he took advantage of laws good for biz #debates,1474940713666,780584045549727749,0
422,,HustonWaters,RACE TRUMP YOU BETTER WATCH WHAT YOU SAY #debatenight #debates,1474940713739,780584045855903744,1
423,,revtedinfo,#debates,1474940713698,780584045684023297,1
424,,RobbieSherwood,Trump took a real beating on taxes. His sniffling got extra loud. #debatenight #debates,1474940713676,780584045591666689,0
425,,T_Joix,EXACTLY! #debatenight #debates #Debates2016 https://t.co/0AswlzLNYM,1474940713685,780584045629411328,0
426,,ruralteacherNY,#debates #mansplaining https://t.co/f01QEM2rM4,1474940713668,780584045558108160,0
427,,MohamedMido1_,Am I the only one that thinks that #Trump is braging about himself and his companys?? #Debates,1474940713760,780584045944201216,0
428,,ThisIsSonjaP,Haha Trump bridging a gap for race issues in this country?! Yeah right! #DumpTrump #ImWithHer #Debates,1474940713763,780584045956571136,0
429,,CommieFlanders,"#Debates #debatenight #Debates2016 

. @realDonaldTrump and @HillaryClinton 
when the topic is Trump's business his… https://t.co/aqse9foVgt",1474940713221,780584043683287040,0
430,,Dizzy_RF,Preach Hillary! #Debates,1474940713794,780584046086664196,0
431,,natephillipsco,@KeyAndPeele Sketch Idea: Trump Zen Translator #debates,1474940713759,780584045939920898,0
432,,MrDaneeyul,I prolly should stay off Facebook for the foreseeable future lest I burst into tears of sadness and simultaneous rage. #debates,1474940714653,780584049689493504,0
433,,angkrieger15,We're really comparing America to a third world country? Please. This is unreal. #debates,1474940714676,780584049786036226,0
434,,Raleighgal64,#debatenight #debates #debatewithbernie https://t.co/0GIfCfPf0x,1474940714293,780584048179699712,0
435,,iamslickrick_,This should be interesting #race #debates,1474940714684,780584049819553793,1
436,,JCFDenton,"Ob boy, race is the theme now #debates #debatenight",1474940714643,780584049647562753,1
437,,_TheOpinion,"DAMN RIGHT, Hil! Damn right, girl. #Debates #debates2016",1474940714651,780584049681141760,0
438,,SoulsticePhotog,How many times is he going to mention 30 years? #Debates #Debate2016,1474940714673,780584049773539328,0
439,,clau1780,Ahora Trump se hace solo un combo breaker #Debates,1474940714690,780584049844822016,0
440,,jimurillo98,"""Let's talk about race"". AND SO IT BEGINS... #debates",1474940714723,780584049983287296,1
441,,riggerx,Under budget cuz you under pay &amp; won't slow your employees to organize. #Debates,1474940714717,780584049958092800,0
442,,anaasts,"I'm #confusada pasamos de los emails a sus impuestos, a las bancarrotas! No entendí ni papa! #debates",1474940714691,780584049848881152,0
443,,Leaderkilla,#Debates oh boy Racist trump incoming,1474940714759,780584050134179840,0
444,,MikKruk,"Focused only on your fam, employees, and companies doesnt mean you'll look after the country Trump...
#debates #debatetonight #debatenight",1474940714669,780584049756762112,0
445,,dt2chow,"We tuned in to watch some #Debates, not a Trump brand free advertising pitch",1474940714649,780584049672847360,0
446,,jackiefox12,I knew he couldn't get through this without saying people love him. Surprised he hasn't hauled out his polling numbers yet. #debates,1474940714826,780584050415116288,0
447,,DaTaxiDriver,"Trump has valid points.But he gets excited pretty early !  #debatenight #USPresidentialDebate
#debates LIVE #FirmaDeLaPaz #Clinton #debates",1474940715657,780584053900578817,0
448,,jeffedelstein,Trump better be careful here on race. He might lose his black vote. All three of them. #debatenight #debates,1474940715595,780584053640720385,1
449,,thanatos1231,Oh great.  2 white people talking about race. #Debates,1474940715715,780584054143934464,1
450,,LMRF929,"Literally cannot catch his breath.
#Trump #debatenight #debates #Debates2016 https://t.co/k86Rc23fVN",1474940715355,780584052633939969,0
451,,touchitorgasm,Race... shit got real #Debates,1474940715628,780584053779103744,1
452,,MSDVisuals,This is what I want to here about: RACE. lets see what y'all got. #debates,1474940715289,780584052357206016,1
453,,Johnny5024,Is #Hillary depressed or medicated? #Debates #Debates2016 #DebateNight,1474940715457,780584053061906432,0
454,,JCitzzz,"#debates @realDonaldTrump just LIED!
LIAR LIAR!! 😂 https://t.co/rOSybQygMb",1474940715361,780584052659073024,0
455,,dmann11,WWE Raw is more true than what comes out of this clown's mouth #Debates,1474940715757,780584054320082944,0
456,,CSPAN_junkie,oh boy who wants to bet trump says a racial slur #debates,1474940715680,780584053997182976,0
457,,JohnnyFoxRox,"THATS BECAUSE WE ARREST TERRORISTS YOU FOOL

#debates #debatenight #Debates2016 #HillarysBubble",1474940715706,780584054106234880,0
458,,brandonsaloy,Lester is killing it with the segues tonight #debates,1474940715713,780584054135619584,0
459,,EddieVill5,This is what a lot of people were waiting for. #racerelations #debates,1474940715814,780584054559125504,0
460,,andreazelinski,"Trump about opening a hotel near the White House: If I don't get there one way, I would get there another. #debates",1474940715907,780584054949187584,0
461,,herschel_matan,#debates Look at Syria for how Hillary handles situations https://t.co/90bvLeVpH4,1474940716302,780584056605908992,0
462,,GAburub,"Now comes the interesting part... race.
#Debates2016 #debates",1474940716454,780584057243521024,1
463,,Activist777mg,Here we go neither one uas anything to say about race relations they will never get it so just move on. Next question! #Debates,1474940716700,780584058275364865,1
464,,ZestyAroma,I really enjoy how little fact checking goes on during this debate. This definitely isn't a shouting match. #debates #debatenight,1474940716559,780584057683873794,0
465,,GaddisCorp,"(Fasten Seat Belts light comes on)
#race #debates #debatenight #Debates2016",1474940716727,780584058388492288,1
466,,2PositiveTweets,"""Race still determines too much."" This is so true. #CNN #debates #PresidentialDebate",1474940716559,780584057683972096,1
467,,fwscouter,Race is a progressive scam. #Debates,1474940716581,780584057776148480,1
468,,joolia,Genius. https://t.co/jn4WsC7d0E,1474940716659,780584058103431169,0
469,,mrkdds,Does Trump know there is Google? #debatenight #debates,1474940716422,780584057109409796,0
470,,SunAndSarah,The newest South Park episode is actually happening. https://t.co/zu9AGebPRJ,1474940716619,780584057935572992,0
471,,JHFonseca,LOL #DebateNight  https://t.co/tBbEpRcG3x,1474940716656,780584058090815491,0
472,,Liya_Bia,Here we go come on HILLARY come home...THIS IS WHERE YOU CAN SHINE #Debates,1474940716677,780584058178994176,0
473,,jstrae,Let's talk about that Criminal Justice Reform Hillary #debates,1474940716732,780584058409611264,1
474,,BBCFRCH,"@HannahThibedeau 

Fox is a Bilderberg puppet, don't quote him!

He is advocating borderless North America!… https://t.co/HyqJP1yuGQ",1474940716393,780584056987594753,0
475,,LeoYarur,Chavos ando vendiendo empanadas  #Debates,1474940717675,780584062364753920,0
476,,LodgeboyWork2,Talking a whole bunch of bullshit https://t.co/K3aI5zabF7,1474940717586,780584061991587840,0
477,,NikRph,@travelingmoms #TMOM #Debates2016 #debatenight #debates yes we r very much behind the times with our updates in airports,1474940717399,780584061207207940,0
478,,SpencerAhrendt,#debates #debatenight https://t.co/ghZELBjdEk,1474940717719,780584062549315584,0
479,,JCHallowell,"Does #Trump sound like an idiot during the whole thing, or is he relatively competent when #Raw isn't at commercial? #Debates",1474940717702,780584062478127104,0
480,,askjayarrre,"""Race still determines to much."" - @HillaryClinton @CNN #Debates2016 #debates",1474940717484,780584061563789312,1
481,,rajgrewal204,"So she's talked about her book for sale, and he's talked about his new hotel. #debates",1474940717707,780584062499057665,0
482,,ScottGwyn16,@BenCardinforMD could you push for legislature concerning the postponement of the 2016 election because these candidates are awful #Debates,1474940717657,780584062289383424,0
483,,GeekyPoliWonk,Take advantage of the laws of the nation by not PAYING people for their work? #DonaldTrump #HillaryClinton #debatenight #debates,1474940717711,780584062515679232,0
484,,cwb_in_tn_81,"MUH RACE WARS 

#Debates
#Debates2016",1474940717792,780584062855503872,1
485,,enochchiu,so boring Cliton! sounds  #Debates,1474940717799,780584062884859904,0
486,,beardedcrank,"@costareports anecdotally, my wife thinks he's coming across as a bully and nut #debates #Debates2016",1474940717640,780584062218018817,0
487,,khadarWag1,Yess finally they talking about Police shootings...Lets talk abouy Justice  #Debates,1474940717801,780584062893297664,0
488,,muricaBall,This is a no-win situation #debates,1474940718571,780584066122977280,0
489,,ericapetersen,@connorwheeler Debate have you fired up for election day!? Make sure you're registered! It takes 2 minutes https://t.co/r7GnKsv6Fq  #debates,1474940718496,780584065808338944,0
490,,barharlemite,Finally someone talks about the real problem with this country: our airports suck. #debates,1474940718580,780584066160689152,0
491,,Baesed_Bitch,"Oh here we go, we talking about race #debates #DEBATENIGHT",1474940718720,780584066747772928,1
492,,Envy_Dymond,The fact that Trump can't let her talk for 2 seconds w/o interrupting..  #Debates,1474940718694,780584066638868480,0
493,,WayneASchneider,"Will Trump lose it all on this answer?
#debatenight #Debates2016  #Debates",1474940718704,780584066680840192,0
494,,Mbelfiore21,I just told @nbcwashington who I think is winning. Cast your vote now! #Debates #NBC4DC https://t.co/PwHRZf3YEn,1474940718576,780584066143940608,1
495,,bobbykrystal,LWKMD....he's like he's seen a Voodoomaker! https://t.co/8Cze6BbT1h,1474940718658,780584066487902208,0
496,,MattLabucki,A little Bernie in here would be worth a watch.  #debates,1474940718794,780584067058118656,0
497,,vincemalfeo,This has to be the most viewed debate of all time...no? #debatenight #debates,1474940718768,780584066949283840,0
498,,13nonameSam,He went to the bathroom! #wakeuplester https://t.co/adFz1HyFbU,1474940718750,780584066873569281,0
499,,DixieBecca,Race. Oh God. Here we go. Pander to the idiots. #debates #debatenight #trump,1474940718735,780584066810732544,1
500,,SarahWhiteBlack,Just turned on debates and they talking about race... Where is my puke bag? I'm afraid #debates,1474940718819,780584067163185152,1
501,,SEP_US,Jerry White #socialist candidate will speak TUES on #Socialism and the #2016Elections in #NYC… https://t.co/xDUNCCAO5c,1474940719271,780584069059018752,0
502,,XRIM,"#XRIM #MONEY : FoxBusiness : .HillaryClinton: ""I think my husband did a pretty good job in… https://t.co/ite0YUJdmT) https://t.co/hfXut38KlJ",1474940719123,780584068438261760,0
503,,Korede_TA,Trump steady comparing JFK to Murtala Mohammed Airport #Debates,1474940719609,780584070476603392,0
504,,MAMA_UMBRIDGE,I want a sad slow zoom in on hillary's face right now #debates,1474940719704,780584070874931201,0
505,,JoeBellofatto,Trump keeps missing opportunities to hit her on her corruption. He mentions a topic &amp; then moves on instead of going for the kill. #debates,1474940719660,780584070690574336,0
506,,SurfSideSams,So true @theclobra so true! https://t.co/aajbOT3iQD,1474940719580,780584070354837504,0
507,,Robbins174,I tried: Zzzzzzz https://t.co/mLp1aE2kgw,1474940719602,780584070447259648,0
508,,lslamIsTrash,"HERE COMES THE ""TRUMP IS RACIST"" #debates",1474940719634,780584070581460994,0
509,,southboundcine,She's the adult in the room. #debates,1474940719746,780584071051091968,0
510,,VermilionMan,@BasedBeefy my dick fell off #debates,1474940719733,780584070996570112,0
511,,BProEditorErin,"Someone not watching the #debates:""Who's winning?"" 
Me: ""Maybe me. I'm cracking myself up with my live tweets.""",1474940719727,780584070971392001,0
512,,amycwest,He doesn't only yell over @HillaryClinton he yells over @LesterHoltNBC. Proving he's a rude bore with nothing substantive to say. #debates,1474940719734,780584071000838146,0
513,,turiansexual,"""lets talk about race""
both clinton and trump:
#debatenight #debates https://t.co/fFhv8Odlwz",1474940719287,780584069126029312,1
514,,NathannnWalker,@LesterHoltNBC are you going to address the fact that 76% of Americans want open debates? #OpenDebates #debates,1474940720603,780584074645766144,0
515,,beatriz_caproni,I just told @nbcwashington who I think is winning. Cast your vote now! #Debates #NBC4DC https://t.co/7t4m8oVVJa,1474940720578,780584074540908544,1
516,,artigaTV,"#HillaryClinton ""debemos reestablecer confianza entre comunidades y la policia"" #debates @NoticieroHechos",1474940720652,780584074851160064,0
517,,Yodaray2,What a sucker punch Trump #Debates,1474940720637,780584074788212736,0
518,,JeffSarcastic,"#Debates2016 
#debates 
#debatenight https://t.co/Atml8GahOL",1474940720337,780584073529917440,0
519,,DanyBoyversion8,OK @realDonaldTrump @HillaryClinton are morphing into @NateDiaz209 @TheNotoriousMMA right now #debatenight #debates https://t.co/zjY0dSmRfy,1474940720253,780584073177755648,0
520,,OGTedCruz,Trump's tax plan will raise taxes on the middle class.  FACTS #debates,1474940720647,780584074830344192,0
521,,FarhanYusufzai,"I don't like @HillaryClinton , but she's dominating @realDonaldTrump |  #debates",1474940720507,780584074243141638,0
522,,beginner_dk,Finally a question about real issue in America! #debatenight #Debates,1474940720718,780584075127959552,0
523,,ConnorRanucci,"Maybe those blacks shouldn't have resisted police officers violently, and instead sought justice in the court of law? #debates",1474940720628,780584074750472192,0
524,,scrowder,Which laugh? https://t.co/xW5GRK1T0L  #DebateNight #Debates https://t.co/LnoJwBI5Db,1474940720581,780584074553548801,0
525,,Dvn_Rashad,Watch her words here she's gonna blame the police #Debates,1474940720714,780584075111370753,0
526,,mcleajennifer,Charlotte made it in the #debates,1474940721637,780584078982733825,0
527,,msharmy,If I wasn't already hungover today I would die of alcohol poisoning watching these #debates,1474940721564,780584078676520964,0
528,,geologysays,"tragic that saying ""race remains a major concern"" is a Bold and Groundbreaking statement for a presidential candidate #debates",1474940720725,780584075157536772,1
529,,HilaryClintin,"#debatenight #debates #Debates2016 PANDER HARDER, HILLARY",1474940721600,780584078827524096,0
530,,OhSoSpechal,Yassss thanks for the relevant questions #LesterHolt waiting for #Trumps answers #debatenight #debates #PresidentialDebate,1474940721754,780584079473291264,0
531,,DayGloSunset,Trump's snorting is subliminally making me blow my nose. #SnottyDonny #debatenight #debates,1474940721554,780584078634549248,0
532,,SOFTXSHUG,Why yes! Lets talk about race! 🤗🙇🏿 #Debates2016 #debatenight #Debates https://t.co/xWE1R7Cfth,1474940721493,780584078378569728,1
533,,joh__000,#DebateNight #debates https://t.co/fdwBzC58Tw,1474940721414,780584078047346688,0
534,,jessicascott714,Trump just admitted he doesn't care if he becomes President. #debatenight #debates #PennsylvaniaAvenue,1474940721703,780584079259426816,0
535,,maural_outrage,Is Trump making throat sounds? Eww. #Debates2016 #debatenight #debates,1474940721674,780584079137894400,0
536,,CommonSenseRv,"#debates #debates2016 none of them is giving a crap about  the average person, they fight about how much money is each of them is making",1474940721360,780584077820882944,0
537,,betsybeil,He has a point #Debates,1474940721737,780584079401947136,0
538,,alienwalkerz,Hillary is getting destroyed. #debatenight #debates,1474940721746,780584079439736832,0
539,,DominicTanza,Donald Trump is a living breathing piece of shit. #debates,1474940721773,780584079552974848,0
540,,darlajcarter,I doubt it. Really?? https://t.co/RbjVaEsMvR,1474940721711,780584079292928000,0
541,,thomas_self,Oh wow. There's @LesterHoltNBC I didn't realize there was a moderator in tonight's entertainment... #debates,1474940721721,780584079335026689,0
542,,jwhitejr,Hey @realDonaldTrump you creep taking advantage of bankruptcy laws may be legal but not moral. We don't need an immoral #potus #debates,1474940721876,780584079985143809,0
543,,stephayana,Race question let's go! #USPresidentialDebate  #debates #ClintonTrumpDebate  #Debates2016  #debatenight,1474940722666,780584083298463744,1
544,,mapitnow1,Haha. https://t.co/jTLhRNd5BD,1474940722525,780584082707058688,0
545,,MorganCagle221,Yes! https://t.co/6si9y6w5W0,1474940722613,780584083076354048,0
546,,lazermoose,Most important candidates: What r u going to do about my screaming 19 month old's cold? #freeSnifflesCare #Debates,1474940722664,780584083290152961,0
547,,JonoZalay,SPOILER: Trump is a ranting lunatic who yells nonsense and Hillary is an un-charismatic policy wonk. #debates,1474940722653,780584083244060674,0
548,,spunkyfuzzguts,So the US should look for bargains on military equipment for its soldiers? #trumpeduptrickledown #supportthetroops #Debates,1474940722661,780584083277484032,0
549,,OptimusDiaz,"Look, I'll be honest here, I lost count of how many words were made up in the last hour. #DEADER   #debates",1474940722762,780584083701141505,0
550,,Tuffer71,"#Debates  There are a ton of politicians who never committed treason, left Americans behind,or used their political power for personal gain",1474940722737,780584083596255232,1
551,,cjtorrado,Clinton is in control #debates,1474940722768,780584083726348289,0
552,,DrAPande,I don't suppose @realDonaldTrump knows that the National Debt is tied to US Treasuries.. https://t.co/tVi7X2Ue1U,1474940722557,780584082841403392,0
553,"[35.40375434, -78.74488602]",tsheinalliv,Lets see what Trump has to say about the police #DEBATES,1474940722750,780584083651002368,0
554,,Colleen_West,WHOSE $$$ are you going to use @realDonaldTrump to build up America? The wealthy are stingy these days. #debates,1474940722644,780584083206189056,0
555,,daclarenceclark,"Truth? America needs to be run LIKE A BUSINESS! Estab politicians have done nothing, Hillary's ideas won't work; let Trump try! #Debates",1474940722730,780584083567108099,0
556,,KawaiiGuyLA,They're about to step into race conversation. This will get ugly with truth - hopefully. #debates #debatenight,1474940722808,780584083894120449,1
557,,lisawanzormeyer,#debates #votenoneoftheabove https://t.co/Iqx4MQok4I,1474940722206,780584081369272320,0
558,,_happymedium,"""Race determines too much""  #Debates",1474940723612,780584087266340864,1
559,,PopGirlsEtc,"Has Hilldawg even drank water yet? Trump's tearing through it like...well, name a desert. #debates",1474940723703,780584087648018432,0
560,,karentaylor11,"Trump, you're a tremendous problem... you're a 4-year-old. Pay your taxes and go home #debates",1474940723618,780584087291465728,0
561,,QuissMyCheeX,#Race #Debates,1474940723595,780584087195095044,1
562,,erucomplex,"Please Herr Trump, don't fuck up this moment. #debates",1474940723674,780584087526531072,0
563,,jake35_g,#BernieOrBust #Bernie2016 #debates,1474940723742,780584087811526656,0
564,,bruntunes,"Lester: ""Let's talk about race."" 
Me: 
#debatenight #debates https://t.co/qlnoPzClfp",1474940723436,780584086528151552,1
565,,palmer_becky,No kidding https://t.co/iUwvIhs84l,1474940723615,780584087278845952,0
566,,EmyKamallive,#Debates kk alright hands up @realDonaldTrump maybe we do need a business man like you to get our country out of defeceit. If you could do,1474940723643,780584087396442112,0
567,,brystjon,Donald on Pennsylvania Ave. #debatenight #debates #Debates2016 https://t.co/uFtBVlmat7,1474940723345,780584086146547712,0
568,,MeeraManek,We are all losing. #debate https://t.co/7UgK6YlcXO,1474940723671,780584087513731072,0
569,,AmberXNicole,"Also, I'm pretty sure he just admitted to not paying federal income tax after defending not releasing his tax return. #debates",1474940723736,780584087786430465,0
570,,Nadia_Cute_Love,Yesss their talking about police brutality now !! #Debates https://t.co/Yi6lRxf2MZ,1474940723672,780584087517966337,0
571,,indigo_bone,#debates OMG! Trump keeps sniffing! He@must have the Plague!,1474940724665,780584091682877440,0
572,,peanutbutaharry,OOHH this is about racist  #debates,1474940724714,780584091888431104,0
573,,jayson_dubbs,"#debatenight #debates Hillary is fully corrupt,  her pay to play schemes are legendary.   She should be in jail https://t.co/cMAyfdpodp",1474940724480,780584090907058176,0
574,,lbwhileblack,This is comedy gold.  Donald J. Camacho out here just saying words.   #debatenight #Debates2016  #debates https://t.co/X2RrtsIP4S,1474940724350,780584090361663489,0
575,,KeishaMonae5921,I can't wait to hear what they each have to say on this!! #debates #debatenight #Debates2016,1474940724736,780584091980738564,0
576,,1n3br14t3d,I'm glad this question was asked. #race #Debates,1474940724779,780584092161024000,1
577,,Delilah399,I'm taking this as an admission. #debates #debatenight https://t.co/2tJnaiCYza,1474940724655,780584091641077760,0
