,screen_name,text,timestamp,tweet_id,cluster_pred
0,KakieF,CNN Money ➡️ Trumps plan would cost 3.5M jobs. Hillary's would create 10M jobs #literallytrump. https://t.co/x9qOLpAM76 #Debates FACT Check,1474939632618,780579511305854976,1
1,pwdorff,Lester needs a gavel #debates,1474939632320,780579510055870464,2
2,anna_hrf,"Can we stop letting the tangerine nightmare interrupt everyone, honestly  #Debates",1474939632564,780579511079493632,2
3,thatniggajr__,F U C K D O N A L D T R U M P !!! #Debates,1474939632664,780579511498792960,2
4,kalebkassaw,I didn't expect better from Trump. #debates,1474939632658,780579511473623040,3
5,bimadew,"""...you've been fighting isis your entire adult life."" #debates https://t.co/8wWCQwaF3U",1474939632314,780579510030917632,0
6,dehansonii36,https://t.co/cqdOyW3E1H #Debates,1474939632712,780579511700074496,1
7,muringa_san,Qq sera que o obama ta fazendo agr? #Debates,1474939632705,780579511670829056,3
8,spellotape,Legit lol https://t.co/3DlwM3FDqx,1474939632687,780579511595216896,3
9,perryrae,"@realDonaldTrump seems to believe that if he yells loud enough, he'll make whatever he's saying actually true #debates",1474939632734,780579511792435200,3
10,Jon_Ore,... wha? #debates,1474939632795,780579512048201728,2
11,lifeshard345,Damn... this is intense. I'm surprised that Lester hasn't flipped the table and left...  #Debates,1474939632662,780579511490543617,2
12,kstarvideo,"Trump wants to levy a tax on corporations that make goods that send jobs overseas, &amp; that's ""a tax cut on the wealthy,"" apparently.#debates",1474939632375,780579510286680064,1
13,shannonsto,"Isis hasn't existed anywhere near her entire adult life, Donnie.  #debates",1474939632790,780579512027258880,0
14,23Amanda84,Oy vey! #debates,1474939632624,780579511330967552,1
15,ncallaway,"Dear @realDonaldTrump, ISIS hasn't existed for Hillary Clinton's entire adult life. #debates #notbeingamoron",1474939632699,780579511645540352,0
16,MizShorts,Donald is behaving like a spoiled 5 year old. Waiting for him to start stomping his feet and spitting. #debates,1474939632727,780579511763075072,3
17,space_menagerie,#Debates 'Fighting ISIS her whole adult life' ? He's deluded.,1474939633559,780579515252826113,0
18,chloeecrosnier,this is savage as fuuuuuuuuuuck #Debates,1474939633599,780579515420540929,3
19,lauramannino,"Trump just said the word ""fact,"" which is the closest he ever got to one. #Debates2016 #debates #debatenight",1474939633603,780579515437240324,3
20,diablamexicana,These two are being so fucking catty right now what is this #debates,1474939633688,780579515793670150,2
21,HappySHxo,트럼프 떼쎀ㅋㅋㅋㅋ #Debates,1474939633689,780579515797954560,2
22,Calamari_89,This debate is the bees knees!!d #debates,1474939633743,780579516024393728,3
23,CRDoman,My heart goes out to the moderator.  You are the real MVP #Debates,1474939633680,780579515760246784,3
24,KKNICKS,Is it just me or is Trump becoming more orange? #Debates2016 #debates #debatenight,1474939633529,780579515126910981,3
25,The_Menace901,We can't vote this man in office.  #Debates,1474939633715,780579515906990080,3
26,veronicamcofre,😂😂😂 https://t.co/LNAzxLaEfD,1474939633619,780579515504394240,1
27,PCP1120,#Debates2016 be like 😂 #debatenight #debates @umuvotes16 #umuvotes https://t.co/LSNKmFcgwq,1474939633154,780579513554075653,1
28,xxcosmicpopexx,Her entire adult life? Really? What an idiot #Debates,1474939633752,780579516062105600,0
29,AngieMoxey,Lester might have to jump up there on stage #Debates,1474939633746,780579516037025792,2
30,chrisrushing,#debates https://t.co/UHJGG18DzN,1474939633542,780579515181391873,1
31,ZionismForJews,Delete This!!!!!!!!!!!!!!!!!!!!!!! https://t.co/Lzh24RepTE,1474939633700,780579515844141056,1
32,nicklackeart,The wealthy will do a tremendous job on tremendous jobs. #debatenight #debates #debates2016,1474939633704,780579515860918273,1
33,LaurenC_Lux,"On Hillary's campaign website, only one post so far is labeled ""mentioned at the debate."" #debates https://t.co/lwCApzcZba",1474939633727,780579515957252096,3
34,masg66,Now we know which Trump is out! It's #CrazyDonald tonight &amp; he's very thirsty! Lol! #Debates,1474939634660,780579519870570496,3
35,stout_87,That boy MAD 😭 #Debates,1474939634553,780579519421906944,3
36,baguettegal,poor Lester Holt #Debates,1474939634607,780579519648395264,2
37,txtmstrjoe,Kill the mics. Moderator ain't able to do his job. #debates,1474939634695,780579520017420288,2
38,emorywilliams00,Even @LesterHoltNBC uses G2s #debates #debatenight,1474939634677,780579519941836800,1
39,caesarologia,"To quote Conrad: ""The horror! The horror!"" #debatenight #debates https://t.co/9WHhlpsKvn",1474939634451,780579518994083840,1
40,sydneycullen99,gotta love my girl grace https://t.co/tEY21TPAjm,1474939634415,780579518842929152,3
41,gbobtomato,"Trump, do you have any ideas that are not rooted in hate? #Debates",1474939634674,780579519929257984,3
42,AnnetteRAVENEAU,#debates https://t.co/GGNuxM9YZk,1474939634483,780579519128281089,1
43,BruceBurhans,"""No wonder you've been fighting ISIS your entire adult life.""

... What? #debates",1474939634674,780579519929327616,0
44,janselman,"Hillary go to my website and see real time fact checker.
What fun! #debates,#debates2016 ,
#voteIRL,#P2,#2016debates,gadems,#gagop, #gapol",1474939634499,780579519195406336,2
45,GeezyQue_,STOP FUCKING TALKING ABOUT JOBS ! Thats not all this about. #debates Donald Trump Is A Dumb Bitch . Im done 💯,1474939634657,780579519857954816,1
46,PolitSpecator,Trump incredibly unpleasant tonight! Trying to compensate for lack of knowledge with NOISE! #debates #debatenight #Debates2016,1474939634665,780579519891509249,3
47,Kairanie,The moderator needs the ability to cut mics. #debates,1474939634666,780579519895707648,2
48,Krewtic_Sway,Lmao this has me rolling 😂😂😂 #Debates,1474939634722,780579520130654208,1
49,kriziadiego,This is getting very interesting. #debates,1474939634749,780579520243834880,1
50,TPRNews,"Looking up word ""bigly"".  It's new to me.  #txdebates #debates @TPRNews",1474939634535,780579519346249729,2
51,oliviathayer_,This is a mess #Debates,1474939634656,780579519853891584,2
52,WrightAaronM,"Poor Lester. The camera is gonna cut to him and we'll just see him with his tie off, nursing a bottle of vodka. #debatenight #debates",1474939634625,780579519723864064,2
53,ProgMid,"Trump has used ""bigly"" in previous instances. It's a corruption of ""big league"" coined by Trump. #Debates",1474939634724,780579520138973184,3
54,TRI_MY_LYFE,#Debates2016 #Debates lester needs to be a big boy and jump in,1474939634806,780579520482902016,2
55,lisababy1124,Lol Trump tells her she telling Isis everything she is going to do that why she can't get anything done. #Debates,1474939634731,780579520168550400,0
56,BreeCharlieAnn,This #debates needs an air horn. So they know when to shut up.,1474939635578,780579523721039872,2
57,seanhackbarth,Clinton has no idea how to handle being attacked other than to smile and mention a website. #debates,1474939635574,780579523704348672,1
58,EleMed93,Me encanta que los candidatos interactúan entre ellos. Ojalá dieran respuestas más concretas respecto a sus propuestas.#debatenight #debates,1474939635434,780579523117064193,3
59,leaffrix,Trump is already getting under her skin .. and he's just warming up. #debatenight #debates,1474939635616,780579523880419328,3
60,Victoria_Elise,Oh good! Lester still exists. #debates,1474939635766,780579524509519872,2
61,BurnsieAnn,#SheWon Focusing on jobs and wages are important to Hillary. That's why #ImWithHer #debates https://t.co/bXACRf7plA,1474939635689,780579524186632192,1
62,srbenoot,No way! This is awesome entertainment!!! Waiting for John Cena's music to hit at any moment! https://t.co/xx1yVmhUMY,1474939635575,780579523708522496,3
63,jjfox9,"""Facts."" https://t.co/7j1Lpkf9W3",1474939635615,780579523876315136,1
64,librarianjade,This killed me 😂 https://t.co/t8o4TyM0mv,1474939635622,780579523905589249,1
65,Jeremy_Jonesn,Donald Trump is on the OFFENSIVE! Is he being offensive #debatenight #debates https://t.co/rHynxOOLYT,1474939635511,780579523439964160,3
66,nae_upnext,His plan is to yell &amp;&amp; cut you off😭 https://t.co/CXQxYdf7IF,1474939635702,780579524241219586,3
67,TheBlingDynasty,Trump is murdering Hillary right now!!! #Debates,1474939635629,780579523935014914,3
68,StoryOfQueenz,Donald trump #Debates https://t.co/QCP9trz7Z1,1474939635620,780579523897155584,3
69,conorsego,General Douglas MacArthur #giantdoucheVSturdsandwich #Debates,1474939635867,780579524933070849,3
70,tcpavela,So true ... He's not there! https://t.co/hXoMz1EiOO,1474939635730,780579524358451200,1
71,LindseyFoat,Gorgeous #kc crowd @TheWWImuseum watching #debates2016KC on @NewsHour on @KCPT. #debates #bingo https://t.co/2N3TwN01KO,1474939632678,780579511557468161,3
72,snorlax_08,@MonaScottYoung there needs to be a Love and Politics spin-off #debates,1474939633427,780579514698956801,3
73,sarahdinahetta,Lol. In your dreams https://t.co/OJkGL5MZOq,1474939635271,780579522433482752,3
74,catbb33,She wudnrt kno a truth if it bit her.....if Kilary is increAsing the taxes on the wealthy....she better open up her… https://t.co/dlNrJaPuVo,1474939633701,780579515848282112,1
75,OCherokee,Trump goes to the kindergarten matt. #Debates,1474939636689,780579528380821504,3
76,azrafathima,"Trump is as usual badly behaved, overstepping time and moderator! #debates #debatenight",1474939636634,780579528150167552,3
77,HyperPikaGirl,"If anyone wants to get in on this, here's the supposedly most accurate stream https://t.co/t1VpwkROF2",1474939636556,780579527823097856,3
78,markkatches,We still have another hour of this. #debatenight #debates,1474939636580,780579527923675137,1
79,TraceySuits,Take a shot whenever Trump takes a drink? Drunk by 10:00. Take a drink whenever Trump interrupts? Drunk by 9:30 #debates,1474939636691,780579528389357569,3
80,valgalgirl,watching #Debates,1474939636616,780579528074600449,3
81,LaurenMuzyka,"""No wonder you've been fighting ISIS your entire adult life..."" -- Trump ...LOL!!!!!!!!!! #debatenight #debates",1474939636767,780579528708009984,0
82,tammyvent,About 20 mins in and I'm about to this off. I can't believe I live in a country where this man is a nominee for President.  #debates,1474939636630,780579528133312512,3
83,fontosaurus,The wealthy are going to create jobs. We've been hearing that since 1980. It's bullshit. #Debates,1474939636751,780579528640913408,1
84,stevensteaches,"Who has a ""TREMENDOUS"" count going? #Debates",1474939636708,780579528460480514,1
85,WiseGalsSMC,"""Well at least I HAVE a plan to fight ISIS!"" 
Damn girl, get him! No mercy! #debates",1474939636746,780579528619941888,2
86,willmelfi,"How many times do you think he's gonna say ""tremendous"" #debates",1474939636520,780579527672094720,2
87,emelinscorner,These candidates are savage af #Debates,1474939636745,780579528615821312,3
88,BernieTheBest1,RTDrJillStein: Join us live to #OccupyTheDebates! #debates #debatenight #debates2016 https://t.co/IJ6L2mwp2I,1474939636731,780579528557096960,1
89,USPatriot_2016,"""please buy my book""
#hillary ""Stronger together"" while she creates rcial division with #obama
anti white, anti #2a… https://t.co/a0Hln1UE1B",1474939636477,780579527491719168,3
90,TheLeftPopulist,"Damn this is embarrassing, wth moderator! #debatenight #clinton #trump #Debates",1474939636762,780579528687181824,3
91,visionsteve,Lmao they need to chill #Debates,1474939636818,780579528921841664,1
92,e_consulta,#debates Trump se le adelanta a Clinton e invita al debate a personas que la incomodan https://t.co/RQKcMAz3z9 https://t.co/dZpEALkvLI,1474939636500,780579527588192256,1
93,JoshGellers,That tax cut/increase exchange ending in #ISIS was UNCOMFORTABLE to watch. #debatenight #debates,1474939636855,780579529077067777,3
94,SeriouslyKelly,@LesterHoltNBC THAT was way more than 30 seconds....then interrupt @realDonaldTrump  #Debates,1474939636806,780579528871673856,2
95,Chase_m88,God Bless America #debates,1474939636873,780579529152606208,2
96,isgoldman,"Is ""bigly"" a word? #debates",1474939636822,780579528938819585,2
97,tinyw10e,"I feel like trumps prep was just playing ""eye of the tiger"" over and over while flexing in the mirror. #debates",1474939637662,780579532461871104,3
98,AlbertoCortez_,Alberto wants to go back to campus  #Debates #Trump #Clinton,1474939637572,780579532084502528,3
99,Amanda_Munger,I think Trump wishes he thought of that fact-checker. #Debates,1474939637661,780579532457652226,3
100,EdwardDaniels,"@sDOTlewis I understand the desire to 'passionately' respond, but this is someone who can't manage his anger &amp; emotions. #debates",1474939637499,780579531778248704,3
101,Aswhore_Memeurr,#debates https://t.co/ggKEHKeoSt,1474939637288,780579530893164545,1
102,SMAdamsDesign,@PhillyD I'm already drunk#debates,1474939637481,780579531702800386,3
103,w_fisher,Hillary's website is like Snapchat and Donald has Instagram Stories. #Ihaveawebsitetoo! #debates,1474939637619,780579532281618433,3
104,MyCaptainSlappy,HAHAHA!...McArthur Snap-Kick to the Head by @realDonaldTrump! NOICE! #debates @elliotmhill Fighting ISIS...forever.,1474939637527,780579531895738368,0
105,_BadMojo_,Did Hillary plug her own book in the debates?  #debates,1474939637724,780579532721967104,3
106,vickiehoff,Fighting and failing!  We are under attack due to her!! https://t.co/ZhgPVl2eCw,1474939637592,780579532168306688,3
107,ajay91467,Donald Trump is coming apart at the hinges I knew he couldn't take it #Debates,1474939637703,780579532633808897,3
108,igMic_Cannon,😭😭😭 https://t.co/3nyDAmEWEv,1474939637615,780579532264931332,1
109,politicalbu,"#debates #Debates2016 DTrump getting rid of the carried interest provision will allow companies, rich guys, to expand their jobs.",1474939637047,780579529882492929,1
110,TARHEELBRAND,@realDonaldTrump needs to stay calm and focus! #Debates,1474939637394,780579531337924609,2
111,FT5AM0,Somebody has to go smack him in the mouth. Jackass! #DebateNight #debates,1474939637688,780579532571021313,1
112,peytonism,This a middle school lunch table roast session. I love it. #Debates,1474939637671,780579532499812352,1
113,CyborgRanger,"#debates #Debates2016 #debatenight 

Hillary got real healthy, real quick.... 
Is it really her?",1474939637745,780579532809961473,1
114,kabachli17,This debate is crazy!!!! Scream fest. My blood pressure is getting way too high😅 #Debates,1474939637631,780579532331941889,2
115,ZTRIPP2000,Want to expand employment in the global economy? #Debates Vote for @GovGaryJohnson #LetGaryDebate @NH4Gary… https://t.co/zwT36EoMrs,1474939637338,780579531103043584,3
116,Moms4HRC,"""Take a look at mine."" #Debates2016 #debates #imwithher #StrongerTogether #dumptrump",1474939637706,780579532646584320,3
117,jayasrig,Forgot Lester Holt was even there #debatenight #debates #Debates2016,1474939637502,780579531790876674,2
118,ThomasKunjappu,"What the what???!!! ""You've been fighting ISIS your entire life""-Trump. Is that an insult? Cry for help? A salute?? #debates",1474939637757,780579532860366848,0
119,DubbleDhee,Trump didn't just say Hillary had no ISIS plan. #PotMeetBlackKettle #Debates,1474939637850,780579533250363392,0
120,Stewtrill,Is this a debate for the highest office in the land or a playground squabble over who farted? 🙄#debates #debatenight,1474939638665,780579536668766208,3
121,TQDEMOCRAT,#debates  her entire adult life did ISIS exist 50 years ago,1474939638487,780579535922270210,0
122,mattlannin,"If talking over people is a prerequisite for being President, both of these people are super qualified. #debates",1474939638602,780579536404484096,3
123,masundbe,"Jesus fuck, he's a goddamn baby screaming into a toilet. #Debates",1474939638581,780579536316530688,3
124,BreeAea,Note: two minute answer. #debates,1474939638674,780579536706482176,2
125,RWFighter2016,Usual bit about wealthy 'paying their fair share.' #Debates,1474939638642,780579536572416000,1
126,sarahvevans,If Trump is too impatient to wait his turn to talk at a debate then how can we expect him to negotiate with world leaders? #debates,1474939638656,780579536631173120,3
127,420Lisa,"Did this fool just say ""bigly""??? #NeverTrump #debates",1474939638578,780579536304046080,2
128,tjpeden,"I trust Hillary's ""fact checkers"" about as far as I can throw her. lol #WhereIsGary? #LetGaryDebate #debates",1474939638562,780579536236716032,3
129,hKerstie,"like wow, indoor voice trump lower the volume,it's hard enough to follow the word vomit that you spew!#debates @realDonaldTrump",1474939638504,780579535993602048,3
130,OTammik,My thoughts on the debate so far #debates #Debates2016 https://t.co/WjE1xUwfQq,1474939638498,780579535968276482,1
131,JimmyLoveFutbol,@spromero86 Favorite line of the night! #bazinga #debates,1474939638503,780579535989399553,2
132,llwng,He's bringing in ISIS already?! #Debates,1474939638766,780579537092481026,0
133,HLHarrington3,Ha! #debates https://t.co/L5GAxXRSAG,1474939638578,780579536304017413,1
134,Lanethainsane,Is this real life like really holy fuck #debates,1474939638631,780579536526127105,3
135,Keladeina,"Trump: ""it's not a great thing for the companies to create a lot of jobs"" WHAT? #Debates",1474939638606,780579536421457920,1
136,fayewrites,"""You've been fighting Isis your entire adult life!"" Yea... we don't need a fact checker for that one, Donald. #Debates",1474939639537,780579540326318084,0
137,ehsteve88,Lester looks considerable more grey over these passed few minutes. #debates,1474939639568,780579540456333312,2
138,AdamMKE,Downgraded from huge to bigly. #Debates2016 #Debates,1474939639608,780579540624179200,2
139,g3nskywalk,How many times can Trump say job #DEBATES,1474939639711,780579541055975425,3
140,SarahofKintu,"When #Trump is defeated, he starts to insult, we've arrived to this point exactly at 9.25pm! #Debate2016 #debatenight #debates #ImWithHer",1474939639655,780579540821311488,3
141,PeterMaHe,#Hillary verweist auf Factcheck auf ihrer Internetseite. Offline-Online-Verbindungen finde ich ja großartig. Cleverer Schachzug. #debates,1474939639584,780579540523421696,1
142,jckasman,"When you see kids misbehaving in a supermarket and the parents are so embarrassed....
WE ARE ALL THE PARENTS RIGHT NOW #debates",1474939639714,780579541068746752,2
143,MattBasically,👏why👏is👏everyone👏yelling👏 #nycdebates #debates,1474939639668,780579540875608064,3
144,YovngNietzsche,Hillary turned her website into a fact checker! #PettyWap #Debates,1474939639677,780579540913557504,2
145,SBalaghi,"""You've been fighting ISIS your entire adult life!"" Trump blasts at the 70year old Hillary Clinton. Off the charts falsehood. #debates",1474939639798,780579541420904448,0
146,alextdaugherty,"Its same to say the last few minutes @realDonaldTrump was going what the kids call ""ham"" #debates #Debates2016",1474939639647,780579540787662849,1
147,covcat,Give him the nuclear codes! #debatenight #debates #Debates2016,1474939639691,780579540972150785,1
148,waltercomw,This is messier than a Real Housewives reunion. @Bravotv #debatenight #debates,1474939639697,780579540997402624,3
149,JWillsNH,"Hillary is shook, I really don't know if any of these facts on either sides are correct, but I do know that HRC is shook 😂 #debates",1474939639542,780579540347260929,3
150,Sam_Frech,"#debates
DJT - You can't have a *PLAN* for fighting ISIS???!??! YOU'RE SPILLING SECRETS",1474939639625,780579540695408640,0
151,Follow_Trejo,This is fun. #Debates,1474939639829,780579541550964736,2
152,a_ilizaliturri,Lo mejor de #debates es cuando los traductores de Foro TV se meten en el personaje y hacen tonos burlones o amenazantes.,1474939639884,780579541781663745,1
153,mkcunningham95,"They were cordial for 5 minutes, who would've thought it'd last that long? #debatenight #debates 🇺🇸",1474939640603,780579544797442050,2
154,AriGoobermensch,Trump lies about not calling climate change a hoax invented by China  by @RobertMackey #debates https://t.co/Vq8aNJ5Ym0,1474939640593,780579544755425280,3
155,kylierosetypo,Just go home @LesterHoltNBC. There's nothing else you can do here. #debatenight #debates @realDonaldTrump @HillaryClinton,1474939640639,780579544948350977,3
156,MikailusPhoto,On ISIS I agree w. Trump. Loose lips sink ships. #Debates,1474939640549,780579544570945536,2
157,rickdelotto,Trust a Clinton fact-checker?  Remember the Benghazi and eMail facts? https://t.co/ITjXTazrnq,1474939640331,780579543656624128,1
158,Agent_KO,Oh yea turning into the shitshow I expected. Oh man we are fucked. #debates,1474939640713,780579545258700800,2
159,njdotcom,"Trump: No wonder you've been fighting ISIS your entire adult life.
Clinton: Fact-checker, please.
#debatenight #debates",1474939640642,780579544960991233,0
160,iibm9_,"عبدالله الخريّف نختاجك بشدة 
@AbdullahK5 

 #Debates",1474939640655,780579545015607296,1
161,redtopfarmoh,Trickle down is still wrong. #debates,1474939640463,780579544210239488,3
162,meanharri,Already sick of the shit show #Debates? Good football game on @espn Tied 14 all,1474939640259,780579543354662912,2
163,PhillyPartTwo,"Hillary's gotta do more than say 'nuh uh, no I'm not'. Get in there and punch like Trump is. #debatenight #debates #Debates2016",1474939640598,780579544776388608,3
164,swifttubers,WHY THE FUCK IS TRUMP LIKE THIS #debates,1474939640775,780579545518710785,3
165,Raulito131,Jesus they're like children #Debates,1474939640639,780579544948355073,3
166,Probgoblin,"As per the #debates the wealthy will create tremendous jobs. Massive jobs. Jobs so big no man can do them, we can only weep at our failure.",1474939640859,780579545871114240,1
167,onyemaechib,#debates #debatenight https://t.co/OP9zNT6uhp,1474939640650,780579544994615301,1
168,RevApplewood,"Hahahahahaha #debates Hillary has been fighting ISIS her ""entire adult life"". Wow.",1474939640500,780579544365400064,0
169,IndeChic47,People start drinking now so this debate will begin making sense 😂 #debates,1474939641661,780579549234892800,3
170,Joanna__Potts,When does Donald Trump think adulthood starts? #Debates,1474939640538,780579544524664832,3
171,whiteknight111,Trump sounds like a crack addict. Might be burying himself here. #debates,1474939641675,780579549293621248,3
172,walidmrealtor,#bigly  #Debates,1474939641562,780579548819783681,2
173,marlat1112,#debates Drumpf getting all puffy and not on point...who would have thought..,1474939641563,780579548823822337,1
174,SpicyLaura,#hillary has been fighting ISIS all her adult life?  How long has ISIS been around? #debates,1474939641552,780579548777721857,0
175,Matt_Tyler_RTHS,"""No wonder you've been fighting ISIS your entire adult life"" -@realDonaldTrump brilliant #debates #rthsdebate",1474939641440,780579548308070400,0
176,duckiesuccumbs,Trickle-down economics doesn't work. Period. Next topic. #debates,1474939641688,780579549348139009,2
177,lisaliuu,@brennaowen losing it #debates,1474939641411,780579548186279936,3
178,TheCoreElements,Whew.... I do not want his job tonight! @LesterHoltNBC  #debates,1474939641618,780579549054574592,3
179,minsd,"La gente se queja de las regulaciones en California, pero es la economia mas fuerte del pais, y la numero 6 a nivel… https://t.co/cZSJgTlySd",1474939641553,780579548781944832,3
180,megancronenwett,"""You've been fighting ISIS your entire adult life"" -- @realDonaldTrump obviously doesn't know ANYTHING about ISIS. #debatenight #debates",1474939641522,780579548652077056,0
181,Vicks8,"""Fighting ISIS your entire adult life"" #DebateQuotes #Debates",1474939641089,780579546835845120,0
182,Probably_Amanda,The most childish #debates,1474939641753,780579549620805632,2
183,GingerGatling,"@realDonaldTrump please stop yelling, i have to turn the TV down when you talk #debates",1474939641667,780579549260099584,1
184,86Dunford,".HillaryClinton: ""Donald, I know you live in your own reality, but that is not the facts."" #debatenight #debates https://t.co/epS615270k",1474939641237,780579547456634881,1
185,AsherTV,Is there a #debates monitor here at all? #debatenight #Debates2016,1474939641668,780579549264228352,1
186,al_masani,#Debates2016 Trump said Clinton will raise and cut taxes - can anyone explain to me how that works? #debates #debatenight #cdnpoli,1474939641696,780579549381820417,1
187,TheMisterPhys,What's everyone's opinion on tacos?  I'm for 'em.  #debates,1474939641629,780579549100769280,2
188,Sojosteven,Do Dems really think the poor or middle class create jobs? #debatenight #debates,1474939641725,780579549503328256,1
189,African_nemoo,#Debates They need to listen to the moderator 2 ears😯👂👂,1474939641785,780579549755142144,3
190,yamaku27,"Hillary trying to persuade the audience by using her ""ethos"" and checking facts, when she has a history of lying in politics #hhsmw #Debates",1474939642678,780579553500549121,3
191,JakobSergei,General Douglas MacArthur? Already arguing..Trump back on jobs #debates .,1474939642554,780579552980504577,1
192,michaelhallida4,"What does ISIS have to do with the TPP and taxes ? 
Trump is flailing.
FACTS are his nemesis #Debates  #Debates2016 #Debates2016",1474939642450,780579552544198656,1
193,HornyTrump,"hit her with the Trump Clash, Donnie #debates https://t.co/x1j29EJoGp",1474939642194,780579551470497792,3
194,sle3751,"Clinton is bringing a tear to my eye with the monumental size of her balls... wait, no. not balls....OVARIES! #debates",1474939642668,780579553458556929,2
195,Embeth10,#debates what this debate need is an air horn to stop the cross babble,1474939642685,780579553529823233,1
196,BigBrian619,"I'm just waiting for a ""your mommas so fat!"" ....lmao #debatenight #Debates2016 #debates",1474939642720,780579553676636164,1
197,immoderator,"Tax cuts have not created jobs, historically. The top marginal income tax was over 85% when Reagan called for his tax cuts, now? #debates",1474939642651,780579553387261952,1
