,screen_name,text,timestamp,tweet_id,cluster_pred
191,MooMinx777,"Instead of talking about bridging the race divide, Trump is inciting racist stereotypes repeatedly over and over #Debates",1474941035612,780585395889242112,2
192,n_e_azil,That didn't last long. Now it's Trump  sentence fragment soup. #debates #debatenight #Debates2016,1474941035617,780585395910156288,1
193,CherryOMighty,so trump's answer to better race relations is cops? i see...🤔 #debates,1474941035181,780585394081595392,2
194,MrBrady__,All this obvious shit he pointing out -_- #debates,1474941035558,780585395662782465,2
195,MLebanik,"Oh shit!  The racist is defending ""Stop and Frisk""!  He took off his klan hood! #debatenight #debates #Debates2016",1474941035182,780585394085781504,1
196,ethan_rector,I just told @nbcwashington who I think is winning. Cast your vote now! #Debates #NBC4DC https://t.co/ZhFhkQC9T3,1474941035542,780585395595665413,3
197,Thinker_Nate,This is true. #debatenight She is against social work values so I will never vote for @HillaryClinton https://t.co/hc4zjfytqi,1474941035546,780585395612286979,3
198,Sant0s_L_Halper,"How many people just now, when Donald Trump says ""Law and Order,"" start humming this :https://t.co/JqK6GzuTUg #debates @nerdist ?",1474941035582,780585395763441665,1
199,kristinbonett,Donald Trump wants to take your guns away!!! #debates,1474941035693,780585396228861952,1
200,lloydkaufman,Oh great! @realDonaldTrump wants MORE police! #debatenight #debates,1474941035587,780585395784384513,2
201,charliespiffs,you mean corrupt police? 💅 #Debates,1474941035627,780585395952156672,2
202,mocha_latte08,Your a bad person Donald Trump... let's take away your brains #debates,1474941035738,780585396417630209,1
203,xolarissamxo,I just told @nbcwashington who I think is winning. Cast your vote now! #Debates #NBC4DC https://t.co/DxOLKlvJCl,1474941035649,780585396044345344,3
204,BGirlMacca,How in the world can anyone vote for this man???!!!!!!!!  How???!!!! #dumptrump #debatenight #debates,1474941035515,780585395482419200,2
205,mrssilveraoy,Stop and frisk is not a way to bridge race relations  #debates,1474941035725,780585396363231232,1
206,CourtneyLTeague,Idea...Everyone that has a gun must have insurance.I bet when insur. comps get tired of paying money. The death rate will decrease #debates,1474941035719,780585396338036741,2
207,cova_pau,"wait Law and Order??? I loooved Chris Noth
  #Debates",1474941035716,780585396325326849,0
208,JaredWYoung,"So stop and frisk is unconstitutional, it is, yet Trump is the defender of the Constitution?! What an ass!
#debates #bigly",1474941036634,780585400175693825,1
209,joelopo1984,But you love the NRA TRUMP!!! Didn't you say if those people in Orlando had guns the tragedy would have been less?? #debates #debatenight,1474941036695,780585400431546368,1
210,Homeless4Trump,https://t.co/zStX8g9HZu,1474941036488,780585399563522048,3
211,borkke,omg couldn't trump have chosen a buzzword phrase that wasn't a tv show #lawandorder #debates,1474941036542,780585399790043136,1
212,wear4u,"King debt #DonaldTrump 
#debatenight #debates 
#Debates2016 
#ImWithHer @HillaryClinton https://t.co/gefecIwhFK",1474941036427,780585399307481088,2
213,BrennaOkazaki,#debates https://t.co/ZLSHyTiSPw,1474941036529,780585399735300097,3
214,NeonIdolAcademy,*dies* #debates,1474941036694,780585400427425792,2
215,acurryx,#WelfareReform @HillaryClinton  @Trump #debates #DebateWithBernie @Hillary @Trump @JillStein Hillary is a republica… https://t.co/Qc4pxuFdMg,1474941036555,780585399844425729,1
216,GuacaFlakaFlame,Really Bro? https://t.co/7jFFKDBOmz,1474941036703,780585400465170432,3
217,Nicc_Furee,Donald Trump is babbling regarding #stopandfrisk #debates,1474941036548,780585399815057408,1
218,TClough84,#debatenight #hilarious https://t.co/fthRsAaCg0,1474941036599,780585400029028353,3
219,rahadulalam,mashable : RT mashablegif: Dun-Dun #debatenight #debates https://t.co/laczBF0xyK (via Twi… https://t.co/pdsHZ0nb2W) https://t.co/BcAlC2vD0S,1474941036486,780585399555072001,3
220,wesg35,NOTHING makes sense lmaoooo #Debates,1474941036736,780585400603672576,2
221,Nico_T14,It's easy to endorse stop and frisk when you're not a PoC. 🙃 #debates,1474941037664,780585404495835138,1
222,ryamatoli,"Trump can't get his thoughts in order...on anything, but whatever. Go ahead and vote for him. #debates #Debates2016",1474941037678,780585404554633216,0
223,dwgamer92,HELP! MY TWITTER FEED HAS BEEN TAKEN OVER BY @realDonaldTrump AND @HillaryClinton! HELP!! #debates #DebateNight,1474941037582,780585404152053760,1
224,Carrie20020,"#debates | @HillaryClinton has touched her nose twice. weird, like #MarcoRubio and th water &gt; it's an indicator of BS",1474941037417,780585403459960836,1
225,SpookyBarracuda,So basically Trump wants to only take certain people's guns away but if Hillary mentions gun control she's trampling our rights ?? #debates,1474941037677,780585404550483968,1
226,MilftasticJJC,Ok so ... Chicago is the only place where there's shootings. Not kindergarten classrooms or movie theaters or prayer meetings  #debates,1474941037207,780585402579255303,2
227,LE_BONES,Trump acting like he got houses on the Southside. #Debates,1474941037582,780585404152025088,2
228,BekaHaidet,Trump is just telling me everything he owns... Thanks you own stuff and I own nothing #debates #debatenight,1474941037723,780585404743323648,2
229,KevinKauffman9,FYI.. @realDonaldTrump  had property EVERYWHERE ... lol #Debates,1474941037724,780585404747485185,2
230,sodapopandpunk,How I feel when people ALWAYS mention Chicago when mentioning gun violence #debates #Debates2016 https://t.co/P0A6MfiKFg,1474941037473,780585403694931969,3
231,__OneEl,Hush hush youngins https://t.co/hyT6KImV1I,1474941037641,780585404399546369,3
232,EricCox,"Stop and Frisk is bullshit, only people who don't live there support it. #debates",1474941037777,780585404969783301,1
233,Ginadou7,"Trump ""most gangs are illegal immigrants"" just stop #Debates",1474941037699,780585404642787329,1
234,tiffanyclay,Now @realDonaldTrump is a constitutional law scholar. M'kay. #debatenight #debates,1474941037788,780585405015916544,2
235,BCohen87,Trump says stop-and-frisk wasn't ruled unconstitutional. Trump doesn't know how that works. #Debates,1474941037649,780585404432994304,1
236,mjmilkyway,I hate when people use my city to try to prove arguments about gun violence. Where is he getting these numbers?? #debatenight #debates,1474941037591,780585404189798401,2
237,gracengantt,Already turned off the #Debates because I can't handle listening to #LyingHillary.,1474941037517,780585403879391232,2
238,jimfromchapter6,"Trump tries to dig himself out of a hole, keeps digging deeper #debatenight #debates",1474941038676,780585408740503553,1
239,jon_ari_,Trump will NEVER pick up black and latino voters with this kind of tone death/racist talk #debatenight #debates #Debates2016,1474941038686,780585408782413824,1
240,TheMoeDee,"Moderator: Should POC be shot by cops? 

Hillary: no, not good. 

Trump: illegal immigrants caused this. 

#debates",1474941038671,780585408719577088,2
241,askitzki,Jfc https://t.co/kU28uqTqpW,1474941038542,780585408178577408,3
242,JimmyJam99,South Los Angeles!! #debates https://t.co/igGt3hO2p2,1474941038559,780585408249724928,3
243,Miss__Hayle,Donald! Please answer the damn question!!! #debates,1474941038667,780585408702787584,1
244,MariePVilla,Does Lester Holt need glasses or is he trying to look intellectual? #Debates,1474941038750,780585409050845185,1
245,NeshaNichelle19,These are people bad people these are bad people uhm ok trump we get it Bad people like the boogie man #Debates,1474941038671,780585408719577089,1
246,Adeeezi,"LESTER YOU'RE NOT LISTENING.... Lester, LESTER, lesterrrrrrrrr..... we got people and guns, and people shooting the guns #MicDrop #debates",1474941038451,780585407796875265,1
247,bamills,SNL is going to go big league after this. #Debates,1474941038667,780585408702713857,3
248,nathenmcvittie,This has to be a parody hahahhahahaha. Donald Trump is arguing against fact. This is unreal. #Debates,1474941038662,780585408681902081,1
249,iiCarlox,"So, he only cares about his property in Chicago. #Debates",1474941038690,780585408799313920,1
250,aintitnifty,he's just. the worst speaker. what is he even getting at. #debates,1474941038471,780585407880671232,2
251,KathTarzwell,Message to @realDonaldTrump ... #Debates https://t.co/B1SsigWyxS,1474941038254,780585406970621952,3
252,CesarAbueg,as much as like to believe #debates but according to @PolitiFact they both lie...So how can I trust? I trust @GovGaryJohnson #WhereIsGary,1474941038720,780585408925237248,2
253,xpat_here,Did more than a little porky pie on stop &amp; frisk slip through fact check? #TrumpSoftballs #debates,1474941038724,780585408941948933,1
254,_Bombasticy,Hmm Trump seems to be rambling… #debates,1474941038804,780585409277366272,1
255,JllynJB1D,"Bad people who shouldn't have them... yet he only mentioned African Americans, Mexicans, and gangs.. what about the whites? #debates",1474941038791,780585409222848512,1
256,ncallaway,I'm sure what the people of Chicago want is stop-and-frisk. #debates #totallyfuckingtonedeaf #whatanasshole #IDontLikeDonaldTrump,1474941039675,780585412930641920,1
257,watermelonduk,"we would still get mad at something and blow each other up 
💣 aaaaaaa there's a boom boom right there https://t.co/qe34X2waQe",1474941039561,780585412452462596,3
258,SivCheruvu,Trump took Lester Holt's race bait in his attempt to sacrifice any appeal to minorities and try and win over every white voter #debates,1474941039556,780585412431675392,1
259,girlsreallyrule,HRC: Everyone should be respected by the law and should respect the law and right now that is not the case. #debatenight #debates,1474941039681,780585412955746304,0
260,southerntalker,#debatenight #debates #SniffingTrump https://t.co/jvearUKAx5,1474941039124,780585410619641856,3
261,scott_abt,"""They're bad people"".... #debates",1474941039714,780585413094223872,1
262,StagedOnPurpose,"Help me understand how ""law and order"" is helping the racial divide?? #Trump can't answer ANYthing! #stopandfrisk? #Debates2016 #debates",1474941039629,780585412737761280,0
263,jake35_g,"@jake35_g People not treating each other with love and respect is to blame for racial tension, Trump. #debates",1474941039717,780585413106802688,1
264,itsthatobvious,The Donald is v. concerned about areas of violence...where he has property. #debates,1474941039468,780585412062539776,1
265,Becky_DiStefano,LESTER! You can get a burger later! #debates,1474941039634,780585412758679554,1
266,pamologie,#debates Did Hillary just give the Donald an eye roll? Allright now!,1474941039755,780585413266198529,1
267,tweetbrk,"Trump responds to race relations with ""more police"" ""bad people"" ""terrible what's going on, i have property there."" #debates OUT OF TOUCH ?",1474941039704,780585413052207105,2
268,manolousa95,Trump/Lester 2016 debate? #debatenight #debates,1474941039641,780585412788154368,1
269,TheMikeAron,Everyone knows that Al Gore invented it... https://t.co/XT3Xkoahnp,1474941039612,780585412666482688,3
270,themust67,Has he ever seen the constitution?  #LetGaryDebate https://t.co/W8UwdnItxI,1474941039802,780585413463244800,3
271,chipduden,Why isn't @VinceMcMahon moderating this debate?  Clearly the only person for the job. #Debates2016 #debates #smackdown,1474941040407,780585416000888832,2
272,JonoZalay,THE FACT TRUMP CAN'T TELL THE DIFFERENCE BETWEEN BAD PEOPLE AND BLACK/HISPANIC AMERICANS IS TERRIFYING. Jump in any time Hillary... #debates,1474941040596,780585416793722880,1
273,Claire_concept,Trump! Don't fight with the adjudicator about what his question means!! #Debates,1474941040372,780585415854157824,1
274,looinrims,"#Debates more police isn't the answer, it's a fine line to walk until it turns totalitarian, I disagree with more police",1474941040636,780585416961454080,2
275,LibertyInGARyan,Increase community relations by allowing police to single out people to stop and frisk without probable cause. #debates #letgarydebate,1474941040577,780585416713908224,2
276,NikkimoPC,Law and order is his response to race relations in America. It's like he is saying this is what those people deserve.  #debates,1474941040689,780585417183666176,0
277,2sad2lift,""" When I look through my glasses upside down and backwards it looked like it says 'peepin''."" #debates",1474941040692,780585417196220417,2
278,DebraAPearlman,"DT keeps saying we have to bring back, my question @realDonaldTrump EXACTLY HOW WILL U BRING BACKwhat ever you want to bring back #Debates",1474941040513,780585416445558784,2
279,LizzieGrl42,I refuse to vote for Hillary but Trump isn't giving me any reason to vote for him. #debates,1474941040751,780585417443651584,2
280,lisanewton90,"""I have property there. It's terrible what's happening in Chicago."" So, it's a problem b/c of your business. #Debates #DonaldTrump",1474941040653,780585417032634368,2
281,annawoodyall,"""bad people-we have to take the guns away from them-bad people"" Great plan, donald. So presidential. #neverknewicouldhatelikethis #debates",1474941040622,780585416902578176,1
282,N_Cog_Neat_O,"I just told @nbcwashington who I think is winning. Cast your vote now! #Debates #NBC4DC
https://t.co/VqGBXzGMc4",1474941040714,780585417288486912,3
283,Linvill27,Yeah... that happened lol. Classic trump https://t.co/pABWOCAFXP,1474941040602,780585416818700290,3
284,mary_justine731,Stop with the hand movements Trump! #Debates,1474941040739,780585417393352705,1
285,King_Yunn,How da fuck can you have better community relationships if you're doing stop and frisk? #Debates,1474941040747,780585417426862082,2
286,ed_grimly,"Relationships matter, you must support police. 

#debates #debatenight #Debates2016 https://t.co/Ywp7HflNhU",1474941040340,780585415720001536,2
287,VolcanicDynamo,"Trump: ""Stop and frisk works""
Holt: ""It was ruled unconstitutional-""
Trump: ""NO ITS WRONG.""
Holt: ""It was racis-""
Trump: ""WRONG""
#debates",1474941040410,780585416013602816,1
288,briasoboojie,Donald Trump's only way to relate to what people in Chicago and Charlotte are going through are his properties. #Debates #DebateNight,1474941040782,780585417573707776,1
289,lexxhope,"Just because you have an ugly tower here, doesn't mean you know ANYTHING. #Debates",1474941040749,780585417435262976,2
290,MattyIcePGH,"A choice of watching the #Debates or @truTVjokers tonight? They are the same thing, but I actually like #ImpracticalJokers! #LetGaryDebate",1474941040550,780585416600723456,2
291,ItsSandraS,Trump is a cakey ass bitch  #Debates,1474941041660,780585421256273920,1
292,jomariemalcolm,"Fact-checkers, is almost 4000 and over 4000 the same thing? #debatenight #debates #Debates2016 #ClintonVsTrump https://t.co/EXDwx9VMEw",1474941041491,780585420547436544,3
293,GeorgiyaY,Clinton doesn't event need to say anything. Trump is shooting himself in the foot #Debates #debatenight #Debates2016,1474941041594,780585420979527680,1
294,aSciEnthusiast,"By ""bad people,"" @realDonaldTrump actually means ""black.""

#debates #debatenight",1474941041661,780585421260492800,1
295,VivaLaFred,"Make airports great again @Boogie2988 

 #debates",1474941041439,780585420329451520,1
296,PantsStatusZero,"Like Hillary, Donald deflects from to #blacklivesmatter to black on black crime #debates",1474941041614,780585421063516160,1
297,thecircle_k,I love the patient tone both HRC and Lester use when explaining a fact to Trump #debates,1474941041567,780585420866236416,1
298,Legendary_Matt_,This shit has to be a joke.  #Debates,1474941041662,780585421264723968,2
299,JazzChocolate,Ya sabemos cual es la serie favorita de #Trump... #debates #PresidentialDebate https://t.co/fMbSAvHQOY,1474941041424,780585420266418176,3
300,PerfectPatches,Stop and frisk is fucking unconstitutional. What happened to Trump as defender of the constitution? #debates,1474941041583,780585420933373952,1
301,tbray,"#debates Trump: Stop&amp;frisk not racial profiling, it's targeting ""bad people.""",1474941041747,780585421621239809,1
302,IAgreeToSee,"""It's terrible, I have property in Chicago"" - Trump #debates",1474941041769,780585421713530880,2
303,ZachBuckner2,So stop and frisk will build better communities? #debatenight #debates,1474941041534,780585420727939072,1
304,Kits,Bad people. Christ. Donald.  #Debates,1474941041787,780585421788975104,1
305,BerniceKwashie,"WAITTTTTTT!!! THIS MAN IS CALLING AFRICAN AMERICANS ""BAD PEOPLE"". A FUTURE PRESIDENT!?! #debates",1474941041762,780585421684273152,1
306,mikebildstein,Stop and frisk?  Violation of rights #NoWay #Debates,1474941041891,780585422225149952,1
307,ColonialChamber,what is up with that statement? #whatdoeshemean https://t.co/QRDpheSz9d,1474941041723,780585421520547840,3
308,ShirleyHorne11,Guns do not kill people.   Put the blame where it belongs. People are to blame. Stop and frisk!#debates #trump,1474941042658,780585425442312193,1
309,LxrdTroimane,Dumbass https://t.co/ww3o2LB40o,1474941042690,780585425576431617,3
310,JO_SCHULER,I can't wait for #LastWeekTonight to slam #DonaldTrump from today's  #debates,1474941042751,780585425832259584,2
311,aykanian,"So, we create better relationships between communities and police, by enforcing racial profiling? Ok, cool. #Debates2016 #debates",1474941042654,780585425425620995,2
312,TKapyamba,He's not answering the question #debates,1474941042675,780585425513615361,2
313,dizzygirl333,@ptsougra why isn't our beloved @Andy  moderating this #debates. THAT I would watch.,1474941042726,780585425727467520,2
314,harperashton12,I just told @nbcwashington who I think is winning. Cast your vote now! #Debates #NBC4DC https://t.co/nU5CUFyq3q,1474941042707,780585425647783936,3
315,ezzoghosh,Who will lose this debate? America #debatenight #debates,1474941042737,780585425773719556,2
316,Omni__POTENT,I rather watch this debate https://t.co/aPocpPwa1j,1474941042594,780585425173905408,3
317,elonalumns,He has property there...like anybody gives a shit. #debatenight #debates,1474941042711,780585425664614400,2
318,cmarkevich,"Moderator: ""Stop and frisk was ruled unconstitutional""
Trump: ""No, you're wrong""
#debates #Debates2016",1474941042480,780585424695635969,1
319,alicemthornton,STOP AND FRISK WAS A FAILURE. #Debates,1474941042788,780585425987571713,1
320,clyveSPEAKS,America: there's an advocate for racial profiling running for president. Let that marinate #debates,1474941042775,780585425933131777,2
321,DaddyFiles,"""It went against a judge who was a very against police judge."" THE MAN CAN'T SPEAK!!!! #Debates #debatenight",1474941042738,780585425777876993,2
322,Amir_G_Beshay,*cringe* #DebateNight #Debates #Debate2016,1474941042801,780585426042183681,2
323,Cgzinsou,The loaded racial language Trump is using regarding guns and #stopandfrisk is simply awful. #debates,1474941043595,780585429372469248,1
324,Wickliffe,Maybe Trump could blame all those murders in Chicago on Clinton? #BlameHillary #Debates,1474941043627,780585429506686976,1
325,ConservativeZNJ,STOP AND FRISK IS RACIST!!!!!!!!!! #debatenight #debates #BlackLivesMatter,1474941043647,780585429590573056,1
326,search4swag,#Ferguson #Debates,1474941043564,780585429242261504,2
327,Mysolohoodlife,"SMH Trump is lying , this year only 500 people has died to gun violence is Chicago not 3000 , he is lying when he says BELIEVE ME #Debates",1474941043704,780585429829464065,2
328,jake_o_rama,"""Against police judge"" #Debates",1474941043660,780585429644914688,2
329,AmandaPaulick,"Okay, 3,000 shootings in Chicago since January 1st? Who's fact checking this one?  #debates",1474941043718,780585429888229376,2
330,JR_Rothenberg,"Ooh, Che-cago. Bang bang. #stripes #debates",1474941043600,780585429393371137,2
331,LeonardEugenius,"Really hope the studio execs take to heart what @realDonaldTrump Is saying and bring back Law &amp; Order #debatenight #debates
#Debates2016",1474941043546,780585429166796806,0
332,kalvrz1029,This is ridiculous #Debates,1474941043697,780585429800144898,1
333,JamesGGlass,Someone fact check the 3k murders in Chicago this year that Trumps claiming? That doesn't sound right. #debates,1474941043613,780585429447811072,1
334,JaileeGabbana,Who are the bad people with guns @realDonaldTrump  #Debates,1474941043466,780585428831395842,1
335,lluuccyyffuurr,stop talking about chicago you too soft to even show ya face here you sodden rump wart #Debates,1474941043556,780585429208670208,1
336,satesq,"""I have property there."" *sniff* #debates",1474941043559,780585429221437441,1
337,essiemay83,"""There's really bad things going on."" #HofDebate16 #debates",1474941043452,780585428772589568,2
338,Shelley514,.@NRA your candidate is talking about taking guns away. #debates,1474941043721,780585429900812289,1
339,JDintheCLE,He only cares about a place if he has a property (financial interest) there? The fuck? #debates,1474941043699,780585429808578560,2
340,DemyWht,I seriously can NOT with this BS. How are you going to debate the fact of racial profiling not being related stop and frisk? #debates,1474941043532,780585429108199425,1
341,astridstars,Seriously not surprised he was for stop and frisk. Ladies and Gents... white privelege at its finest. 😒 #debates,1474941044607,780585433616875520,1
342,SierraToisse1,"Mmmmmm........ 😐😓
#tytlive #debatewithbernie #BernieFinger #debatenight  #debates",1474941044469,780585433038192640,2
343,r0sieg,Wtf.... https://t.co/Ut5RDMPBFO,1474941044503,780585433180807168,3
344,misskinseylane,Interesting... https://t.co/wW6od5Vqgv,1474941044587,780585433533001728,3
345,LeoOlivaresJD,#DonaldTrump I have property in Chicago.  I I I I I... me me me... It's a beautiful thing. #Debates,1474941044673,780585433893699585,2
346,TomKibasi,"How is this newsworthy, @politico? #debates https://t.co/N05WBbynfZ",1474941044231,780585432040046596,3
347,capricious_it,Where do I surrender my rights if I'm non white? #Debates,1474941044665,780585433860182016,2
348,lizalove91,"""Who was a very against police judge."" 
""It's racial profiling and unconstitutional""
""No it's not, these are bad people!"" UGHH
#Debates",1474941044629,780585433709150208,2
349,xlovegood,"I just told @nbcwashington who I think is winning. Cast your vote now! #Debates #NBC4DC
https://t.co/ZRzgGIUavQ",1474941044520,780585433252134912,3
350,dahvs_,LOLOLOLOL https://t.co/loW2DlOyg7,1474941044661,780585433843380225,3
351,BlkTramaStrsDay,Went before a very against Judge the Police... Very good English Donald.  #Debates #Debatenight #Debates2016,1474941044754,780585434233483264,2
352,DDNBreaking,"""You've been fighting Isis your entire life"" - realDonaldTrump to HillaryClinton #Debates https://t.co/gMTCd2iXyo https://t.co/6IEigXZqqF",1474941044678,780585433914802176,3
353,TeeChedda,stop and frisk 🤔. More like Stop and shoot 😒 #debates,1474941044723,780585434103644160,1
354,dauntrisflames,I just told @nbcwashington who I think is winning. Cast your vote now! #Debates #NBC4DC https://t.co/FJEZQwxs6s,1474941044784,780585434359279617,3
355,kellmarguerite,Here we go.. 👊🏼 #HillaryVsTrump #hillaryforpresident #Debates #Debates2016 #debatenight https://t.co/dX0mSrugPE,1474941044574,780585433478602753,3
356,Joyousreads,Oh no he didn't! Where are you NRA?! He wants to take your guns!!!  #Debates,1474941045574,780585437672845315,1
357,Elky305,There she goes people. Going after our 2nd Amendment. #NeverHillary  #debates,1474941045605,780585437802950656,1
358,manamica,And he redirected by going off about Chicago... #smh #debates https://t.co/LIbddIbI62,1474941045599,780585437777825792,3
359,echo_rachel,Because Stop and Frisk will help women/police and black/police relations...wtf donald #debates #Debates2016,1474941045514,780585437421309952,1
360,mikerobillard1,Soooo stop and frisk brings on better community relations? Wow?!?! #Debates,1474941045662,780585438041866240,1
361,JJ_Newberry,It's all about property and investments with Demon. No mention of the actual lives that are (allegedly) impacted in his reality. #debates,1474941045707,780585438230683649,2
362,Montel_Williams,No @realDonaldTrump - #StopAndFrisk didn't work - this is proven to be BULLSHIT #DebateNight #Debates,1474941045717,780585438272561154,2
363,Sophieanimelee,"Trumps sentences genuinely don't make sense, at all #debates",1474941045692,780585438167855104,2
364,soupdesoula,Imagine stop and frisk in Chicago. It wouldn't go well. #debates,1474941045625,780585437886816256,1
365,aneeman,It's terrible because Donald has property there. President Trump will fight for any part of the country where he owns a home. #debates,1474941045580,780585437698088960,1
366,HannaHayden1,"I only care because I have business there. #Trump #debates
#debatenight #quotable",1474941045706,780585438226452480,2
367,DjLifeoverdose,"Back to the ""law and order"" approach... wonder what that means, so all cops are justified for killing unarmed people. #debatenight #debates",1474941045656,780585438016839680,0
368,ThomasLucenti,#debates I hope @realDonaldTrump put some bbq sauce on his shoe to help the taste,1474941045759,780585438448726017,2
369,mlrenald,How do you measure relationships between a community and police? #debates #jagvote,1474941045692,780585438167830529,2
370,MyNiggaPolo,"America doesn't need more Police, America needs better Police. #Debates",1474941046677,780585442299224065,2
371,KnockDownBarns,#Chicago #stopandfrisk I will only submit to #fullbodycavity #debates,1474941046521,780585441644929024,2
372,JelenaVavavoum,"Are his hands really that small, or is it an optical illusion? 🤔 #dta #debates #debatenight",1474941046643,780585442156707841,2
373,shadowx89,Childdddddddd https://t.co/z9RqM8WKPZ,1474941046590,780585441934401536,3
374,mangologist,"""It's all just words."" https://t.co/VlSdjbJLex",1474941046423,780585441233735680,3
