,screen_name,text,timestamp,tweet_id,cluster_pred
197,SoySonyMejia,#debates 😅 https://t.co/uzJhqkoxxy,1474939921535,780580723111505920,1
198,plow4507,"#Debates #HillaryClinton She is diiiirrrrtttyy #Cringe #AmericaNeedsChangeNotTheSame Get used to it, @realDonaldTrump is out new prez🇺🇸🗽",1474939921841,780580724395028480,1
199,Lsohfan,That smug ass grin on Clinton's face though #debates,1474939921642,780580723560484864,1
200,dcalfe,Trump is aggressive but Clinton is way too smug #Debates,1474939921840,780580724390801408,2
201,ggd169,"#debates #realDonaldTrump #CrookedHillary refers to ""wealthy people"" as if she's not one herself?#awkward https://t.co/TRbBdyMLij",1474939921825,780580724327849985,1
202,roselynplacide,"Trump is incompetent on the stage, only attacking HILLARY,Mr Trump what's your policies,but still not releasing his taxes  #Debates",1474939921754,780580724030181376,1
203,CarrieKHutchens,Trump is the one that wanted to get jobs back 4 regular people. What the heck is she talking about? #debatenight #debates #debates2016,1474939921863,780580724487225345,0
204,KatrinaZek,Is this all a hoax to get us to see #Trump &amp; #Hillary's halloween costumes?👻🎃 @NCCollegians #HofDebate16… https://t.co/v1GI0PwCEc,1474939921711,780580723849891841,1
205,writingMaine,"""Foreigners took our jobs."" Anything else, @realDonaldTrump? #Debates",1474939921866,780580724499939328,1
206,jfnaz,#Debates  Holt needs to quit being afraid of Trump and shutting him down when he interrupts.,1474939922708,780580728031485952,1
207,SharanyaaVasan,"Trump making a huge deal that he's being civil and calling Hillary ""Secretary Clinton"" like he deserves a pat on the back #CryBully #debates",1474939922761,780580728253784064,2
208,DKerrFamily,Can we please start the whole election process over . . . neither of these people are fit for the office!!!! #Debates,1474939922696,780580727981158400,1
209,Will_Bourque7,I feel like I'm losing brain cells by the second listening to Trump talk #Debates,1474939922502,780580727167549444,1
210,joppenflopper,Being able to come to Twitter and watch people make fun of the #debates in real time is my favorite part of the 21st century.,1474939922708,780580728031424512,1
211,TrevBaileeTymom,So far the best comment of the night  https://t.co/frZdRDCBWo,1474939922547,780580727356358656,1
212,AmakaTheHungry,Didn't Trump say he knew more that he knew more about ISIS than the generals? #Debates,1474939922706,780580728023216129,1
213,NetteMarie_,lmfaoo someone please get this man back on track smh  #Debates,1474939922689,780580727951876097,1
214,BB2spine,#debates trump is talking in circles.,1474939922707,780580728027348994,1
215,_thisshortgirl,Our country gone suffer more if Donald Trump become president #Debates,1474939922704,780580728014725120,2
216,holllywood13,I wonder if Hilary and trump purposely coordinated their outfits tonight 🇺🇸🇺🇸🇺🇸 #Debates2016 #debates,1474939922836,780580728568414208,1
217,KylieBurgundy,"I LOVE HER SMUG FACE MORE THAN ANYTHING 
#debates",1474939922840,780580728585097216,1
218,SabaChishti,What else would Obama do at a golf course?! #Debates,1474939922564,780580727427563520,1
219,ConfusionLand,#debates thrums a big fat bubble https://t.co/6vG6EOeOXV,1474939922539,780580727322705920,2
220,Marc_McKee,Don't we have the worst recovering economy since the Great Depression because we had the worst crash since the Great Depression? #Debates,1474939922809,780580728455073793,1
221,kvng_alston,Trump is a ASSHOLE!😡😡😡 #Debates,1474939922833,780580728555892736,1
222,Carejanez,This is so interesting to watch 😂 #Debates,1474939922887,780580728782196736,1
223,luscapinho,"CARALHO, TRUMP FALANDO O FED E DA BOLHA QUE EXISTE AGORA
QUE HOMEM  #debates",1474939922866,780580728694251520,1
224,alto_jew26,This debate would be worth watching if @GovGaryJohnson was on that stage #LetGaryDebate #debates,1474939922738,780580728157433856,1
225,WumboHadMeLike,"""we are in a big fat ugly bubble"" #debates https://t.co/ssPTiMpCuh",1474939923107,780580729705074688,2
226,justinmshep,It’s truly night and day with these candidates #debates I really can’t stand the way Trump talks. He has the WORST grammar.,1474939923602,780580731781320709,1
227,peytonism,If he mentions her health I get a BINGO. C'mon Dongo! don't let me down! #Debates https://t.co/mkPS8jJOPR,1474939923312,780580730564993024,1
228,kaylarichard98,"Trump is a big, fat, ugly bubble. https://t.co/tzP2H08T31",1474939923626,780580731881828352,2
229,BridgetAyers,I feel sorry for @LesterHoltNBC this is like trying to herd cats #debates,1474939923660,780580732024389632,1
230,kim_A_mugae,웹은 이렇게 나옴 #Debates https://t.co/3gvSjnzJfJ,1474939923489,780580731307167744,1
231,chunkythndr,"""Refinance their debt from college at a lower rate.""

Federal consolidation loans are at like 3.5%. This crazy old bag. #debates",1474939923669,780580732062273540,1
232,AmyGbldn,Audit. Yeah right.  #debates,1474939923743,780580732372602880,1
233,Circa,"Donald Trump’s website is down right now.

Hillary Clinton’s is up.
#debates #debatenight https://t.co/w5i0Vlo3yW",1474939923156,780580729910689793,2
234,970wfla,Lester Holt asks @realDonaldTrump about not releasing his tax return.  #debatenight #debates #Debates2016 https://t.co/XS3yzR2zcI,1474939923689,780580732146036740,0
235,Lust_ForLife,I hate Donald's jokes. They so fuckin lame  #Debates,1474939923701,780580732196495360,1
236,sarahjo227,"""I'm just going to get blamed for everything tonight"" @HillaryClinton  ""why not?"" @realDonaldTrump *Clinton laughs ""why not?"" #debates",1474939923769,780580732481613825,2
237,jmgwill,"she NEVERS answers questions  useless
  #Debates",1474939923734,780580732334854145,1
238,KivariDaniel,These #debates are a train wreck. The United States of America should be embarrassed to be projecting this to the world.,1474939923829,780580732733300736,1
239,Rayshay7,"The person in charge of mics, someone fire him/her immediately. that baby wont shut up #debatenight #debates #Debates2016",1474939923887,780580732976586756,0
240,_samarans,#debates https://t.co/axFIJLV5Ux,1474939923613,780580731827388416,1
241,astald3r,Donald's interrupting got me heated. #debates,1474939923932,780580733165244416,1
242,chadtheteacher,Ooooo...what's he going to say about his tax returns? #debates,1474939924681,780580736306847745,1
243,_manixoxo,Hillary says debt free college?! YAS HONEY #debates https://t.co/WEdE9HEzAZ,1474939924465,780580735400804354,1
244,ExplorerChara,I'm speaking #Hilary #Debates https://t.co/oAZiJIFXdR,1474939924459,780580735375831040,1
245,jackochoa,"#Debates every time he says ""believe me"" he is making up stuff because he has no clue",1474939924686,780580736327757826,1
246,beachwaves29,I'm sorry... How much do the Clintons charge colleges to speak? And yet... Cut student debt? Not sure how that will work.... #debates,1474939924690,780580736344559616,1
247,adamthespookist,A wall will cut through rivers and villages! #Debates,1474939924753,780580736608776192,1
248,PaulPaino,"DRINK: ""Believe me"" x2 #debatenight #debates",1474939924309,780580734746652672,0
249,TheHomieFallen,Judge Judy woulda kept them in line #debatenight #debates #Debates2016,1474939924670,780580736260673536,0
250,suchalady716,They talking tax returns #debates https://t.co/oqIpbIznDF,1474939924454,780580735354703873,1
251,MeganStilley,"It's called projection Trump. Please stop talking about yourself. #debates ""All talk, not going to work...""",1474939924779,780580736717901828,1
252,WeLoveBernie1,"DrJillStein: The American people are clamoring for #debates with more than Clinton/Trump, the 2 most unpopular candidates in history. #Occu…",1474939924627,780580736080416768,1
253,nolanbearcat,Is it just me or does Hillary sound like Ellen? #debates,1474939924859,780580737053396992,1
254,BBCIC,#Debates how he know Obama plays golf,1474939924712,780580736436809728,1
255,LotsOGiggles,He won't hire Americans here for his hotels but wants to import labor. What a liar and hypocrite!  #Debates,1474939924746,780580736579448832,1
256,theintercept,Trump on rooting for the 2008 housing crisis: “That’s called business” https://t.co/PkVzjyck3b by @samfbiddle #debates,1474939924815,780580736868966400,1
257,TheTonyandTina,"Wait all talk no action, you just said she is to blame for everything, she had to take some actions, can't have it both ways Trump #debates",1474939924794,780580736780890113,1
258,itsKaityCat,That's why I suggest drinking water then instead of booze. https://t.co/NJbR8QEmRn,1474939924724,780580736487215106,1
259,AdoKerrison,"Might not be a good idea to claim someone is ""all talk"" when you've spent the whole time interrupting them #debates",1474939924849,780580737011580929,1
260,BritniDWrites,"Trump's debate strategy: Talking loud and saying nothing."" 
#Debates",1474939925664,780580740429774848,1
261,JulesVerne92,My 5-year-old-godson doesn't throw tantrums as extreme as Trump's. #debates,1474939925687,780580740526317568,1
262,jason_,Lucky for us he's a hot head. #debatenight #debates #Debates2016 https://t.co/7shD7J87oR,1474939925478,780580739649826818,0
263,n_sakurai16,Where are those tax returns! #debatenight #debates,1474939925498,780580739733749760,0
264,Susana_L_M,Ele só diz pão ??????  #Debates,1474939925641,780580740333506560,1
265,XLikeTheLetter,It's Not Funny Anymore Guys #Debates,1474939925704,780580740597592066,1
266,kelsey_819,A perfect example of sending jobs overseas and destroying job.....Trump's business endeavors. #debates #dumptrump,1474939925706,780580740605980672,1
267,AuntieKella,"#debates
#FixitJesus 
Why am I watching this?",1474939925720,780580740664659968,1
268,seanjoudry,"When Trump first talked on stage, I thought he seemed much calmer than usual. That disappeared quickly. #debatenight #debates",1474939925605,780580740182511616,1
269,Bob_Law,"**Lester quietly tip-toes away**
#debatenight #Debates2016 #debates",1474939925616,780580740228583425,0
270,TOKatharine,Trump is just spewing random words in no particular order &amp; interrupting Clinton whenever he pleases. It's making my head hurt. #debates,1474939925658,780580740404682752,1
271,GreenEyedLilo,"Considering how much Trump has associated himself with golf, I don't think he should insult Obama by saying he'll play golf. #Debates",1474939925630,780580740287242240,1
272,notoriousCori,"@Ivonbartok The only way this Canadian can watch the debates. Trump is just a loud mouth talking about ""political t… https://t.co/oFrBWqx8BF",1474939925440,780580739490287616,1
273,RoqueANeto,Release the tax returns! #debatenight #debates,1474939925712,780580740631261184,0
274,WeLoveBernie1,DrJillStein: A Green administration will declare a climate emergency to create the clean energy jobs we need right now. #debates #OccupyThe…,1474939925774,780580740891369473,1
275,millennialmap,Is this #debates real? He's not even formulating sentences. #bigfatuglybubble -- his vocabulary is brilliant. @realDonaldTrump,1474939925766,780580740857815040,1
276,MDTigerham,"""Typical politician, all talk, sounds nice, won't work"" damn politicians talking in a debate #debatenight #Debates",1474939925574,780580740052480000,1
277,stoplurkingfool,I'm gonna get trump why you making jokes about Obama  #Debates,1474939925915,780580741482590208,1
278,iDanniels,Esta que arde esto  #Debates,1474939925903,780580741432377349,1
279,justlikeneon86,Trump- Trump Trump- Trump- Trump- Trump TRUMP IT UP! *beat drop* #Debates https://t.co/otDoX7mnEh,1474939925840,780580741167984640,2
280,jonathancristol,Trump's audit lie is one of his favorite lies. #debates,1474939926568,780580744221655040,1
281,KevinCollide,Can't control himself https://t.co/C9Uq8jWNdo,1474939926606,780580744381009920,1
282,this_nick,"@cockyboys @LesterHoltNBC &amp; @MSNBC are a disgrace, letting him talk during his turn and scream over hers #DebateNight #debates #Debates2016",1474939926544,780580744120897536,0
283,VictorMoreno015,Donald Trump confirmed to be a #Jojo fan #Debates,1474939926735,780580744921948160,1
284,socrates_99,This Bloomberg fact check is wack. Headed back to #CNN. #debates #debatenight,1474939926690,780580744733290496,0
285,_karenstefania,Literal estoy asi jajaja https://t.co/cvl6sZTgU7,1474939926577,780580744259366912,1
286,betaburgers,Why are we in a big fat bubble? Grease! #nogrease2016 #debatenight #debates #,1474939926661,780580744611635200,2
287,coolnilk,Oh shit Trump is exposing the NWO #debates,1474939926744,780580744959627264,2
288,JpYourHero,If Donald Trump revealed the NX I would honestly not mind voting for him. https://t.co/6hOOSjQw3p,1474939926567,780580744217395201,1
289,Star2fireDenise,#truestory 😂 https://t.co/LRr9nnT8u8,1474939926603,780580744368263168,1
290,kohilaaaa,Who's watching the #debates,1474939926761,780580745031016449,1
291,datachick,Shit. Forgot to invest in liquor stocks because  #debatenight #debates,1474939926578,780580744263507968,1
292,minusbeer,SAME AS OBAMA WAIST OF SPACE https://t.co/Lk1L7HiwwE,1474939926650,780580744565514240,1
293,heyhollyjay,#debates https://t.co/3jIIvQ9rvT,1474939926200,780580742678052865,1
294,looinrims,"#Debates trump coming in going after Obama too, Jesus fuck",1474939926763,780580745039450112,1
295,BriannaFagin,Don't? That's an excellent idea tho. #debatedrinkinggame2k16 https://t.co/aSRmMM49M5,1474939926864,780580745462939649,1
296,perfectlyMia,He's delusional. https://t.co/PJFePoz9W3,1474939926787,780580745139990528,1
297,lit_lyd,Dude Trumps favorite word is Mexico. #debatenight #debates,1474939926796,780580745177890816,0
298,SecretLee_,Why is @LesterHoltNBC not cutting off #DonaldTrump? He's not staying on topic and he cuts into #HillaryClinton's time. @NBCNews #debates,1474939927692,780580748935831552,1
299,JxhnBinder,FACT: Hillary has NEVER released her paid speeches to Wall St. #debatenight  #debates,1474939927447,780580747908411392,0
300,edwin_tran,"after watching these #Debates
join me 
in leaving the country",1474939927635,780580748696838144,1
301,DavidBrelin,Someone get Donald a Netty Pot please. #Debates,1474939927674,780580748860399616,1
302,leahmariedainty,Trump: we are in a big fat ugly bubble...you are going to see some very bad things happen. #Debates,1474939927744,780580749154119680,2
303,ChrisOfRights,Hillary says experts say plan won't cost &amp; will create jobs. Trump should ask if these are same experts who that about ObamaCare. #debates,1474939927745,780580749158133760,1
304,dathowitzer,"He talks like the guy in the pub. It's impressionistic, not communicative #Debates",1474939927744,780580749154127872,1
305,djmenj,"Hillary""Are you gonna blame everything on me""
Trump""Why Not"" #debatenight #debates 
what a fucking joke",1474939927725,780580749074370560,0
306,_aaace,Who can actually follow what Trump is saying?  #Debates,1474939927635,780580748696883201,1
307,byTeddyK,"""Worst revival for the economy since the Great Depression"" Uh yeah, a little event called World War II kind of sped up the process. #debates",1474939927656,780580748785049600,1
308,HoldingCoPhoto,Has your opinion changed thanks to this #trainwreck? Me neither. #debates #debatenight #Debates2016,1474939927745,780580749158121472,0
309,seankennedy1,The fed is more political than Clinton...huh? #debates,1474939927563,780580748394950656,2
310,iramzq,lol #Debates,1474939927797,780580749376311297,1
311,waywaw,let's get 'say more crazy things' trending again #debates https://t.co/vJomMwWB85,1474939927375,780580747606364160,1
312,alexgormonster,"""All talk. No action"" Okay, @realDonaldTrump - then actually give us some of your policies instead of blaming Hillary. #debates",1474939927772,780580749271404544,1
313,Jerkulez_,That EYE ROLL HILLARY #Debates,1474939927854,780580749615460354,1
314,EDISON_TECH_,Donald Trump NOT CLEVER! @realDonaldTrump  FAKE #Debates,1474939927844,780580749573496832,2
315,jporcelli11,He loves this bubble #Debates,1474939928707,780580753193132033,2
316,thegingersoul99,knock knock who is INTERRUPTING TRUMP #debates,1474939928593,780580752715030529,1
317,AndrewDKoch,The Fed shouldn't have a job Mr. Trump. #debatenight #debates,1474939928773,780580753469870082,2
318,WhitneyWingate,Real question: at this point does anyone get persuaded by these debates or it is just like watching a bum fight? #debates,1474939928746,780580753356709888,1
319,AlexBerdis,"Is Lester Holt sexist, or just unqualified to moderate? #debatenight #debates",1474939928733,780580753302224896,1
320,TeddieGoesRawr,"this hashtag #TrumpedUp needs to be trending 😂😂
#debatenight #Debates",1474939928775,780580753478344704,0
321,yoyamimi,"#debates en ingles ma' o menos entiendo, y en univision me duele la cabeza de oir al traductor tambien 😒",1474939928725,780580753268625408,1
322,hannahdivine,she's taken some of bernie's base ideas and brought them into her own campaign and that makes me feel better #debates,1474939928727,780580753277091840,1
323,NadyAndrade,Trump criticando os políticos... uai filho.... vc não virou um agora também???  #Debates,1474939928583,780580752673103873,1
324,NJHighlands,Tax returns!!!! #Drink! #debates,1474939928737,780580753319034880,1
325,SoozeKY,"Yeah, because I trust her fact checkers just as much as I do Detroit tap water!  #Hillary4Prison https://t.co/lzVbq9eKWV",1474939928573,780580752631205889,1
326,codyjonez,"only in America can you watch 2 potential presidential candidates act like bratty, condescending assholes on national television #debates",1474939928792,780580753549647873,1
327,SheIsAmore,The fact that Trump compared himself to Reagan as if the Reagan years were great tho. Reaganomics anyone? #debates,1474939928370,780580751779753986,1
328,BK56481225,#Debates There is a reason Clinton isn't running for re-election . The people don't trust her.,1474939928801,780580753587507200,1
329,Twinkle_B,She's slaying!! https://t.co/BbYfYyMM5O,1474939928791,780580753545375748,1
330,JoyKarley,Sniff sniff sniff... sniff sniff... is Trump still living in the 80s? What did he snort to prep for this debate? #debates,1474939928784,780580753516134400,1
331,GirlsGotSole,@essayareayaitch Lester Holt #debates,1474939928775,780580753478418433,1
332,xt0rt,This is like watching the most uncomfortable episode of It's Always Sunny In Philadelphia. #cbsnreax #debates,1474939928770,780580753457422336,1
333,MelJBowler,"What, @HillaryClinton? Trickle down economics caused the great recession? #debates #debatenight #Debates2016",1474939928835,780580753730043904,0
334,ruthstarkman,"Trumps insult== Hillary is a ""typical politician"" and the bubble is going to burst
. #debatenight #debates",1474939929696,780580757341245440,0
335,EMcAlice,"VOTER: I'm undecided

*sees Donald Trump geofilters on Snapchat*

VOTER: Make America Great Again
#debates",1474939929585,780580756875800576,1
336,EricLSchwartz,"""As soon as the audit's finished in 2020. #debatenight #debates #Debates2016",1474939929631,780580757068623872,0
337,ojengwa_,Darn! Typical politician... solid comeback from @realDonaldTrump #debates,1474939929625,780580757043642368,1
338,Mackletrain,Trump repeating the audit lie. #debates,1474939929751,780580757571932160,1
339,EMS2006,Oh poor #Trump  he is not going to make it the fill 90 minutes of this #debates,1474939929627,780580757051936768,2
340,iastater09,I think @TonyReali should be running this debate. @LesterHoltNBC needs a mute button! #Debates #debatenight #Debates2016,1474939929629,780580757060202496,0
341,lennysfocus,"End of 1st Quarter, Trump 14  Clinton 3 https://t.co/y5q2yeYlak",1474939929700,780580757357998080,1
342,Mr_Cynic,#Debates OH HOLT DROPPING THE HAMMER ON THE TAX RETURNS,1474939929774,780580757668376576,1
343,MegAhsens,"'Big fat ugly bubble' is a self reference there, orange Hitler. #debates",1474939929779,780580757689413632,2
344,SalvadoRPG97,"Today's #debates theme. #debatenight
https://t.co/4aAqw2JUbO",1474939929679,780580757269913600,0
345,Austhebossman,Is it just me or does Hillary look like she's on drugs right now? #debates #debatenight,1474939929632,780580757072994305,1
346,an_amria,He has not released his tax returns yet... Wow.  #debates,1474939929425,780580756204707840,1
347,QuillandBoots,"The real question, Lester, is: Why do 53K+ Twitter users not know how to spell Hillary's name properly?  #debates #Debates2016",1474939929577,780580756842250240,0
348,madelineclaire_,"What is ""the worst revival of our economy since the Great Depression"" what is he referring to? #debates",1474939929803,780580757790134272,1
349,CindyRZel,@shondarhimes Best comment yet!!! #debates,1474939929662,780580757198610432,1
350,cherylnaylor,@realDonaldTrump be like go to my site 😂😂 #debatenight #debates #Debates2016 https://t.co/nBclSF2Wsx,1474939929389,780580756053696512,0
351,kamahaazi,Where are your tax returns? How can Republicans trust you if you might be poor? #Debates,1474939930657,780580761371971589,1
352,LegallyRidic,Does #Trump realize that policies like #Hillary2016 were very similar to those used after the great depression? #debatenight #debates,1474939930711,780580761598586880,1
353,_xStiro,Hilary is apart of ISIS end of story... #debatenight #debates #TrumpPence16 #Trump #Killary,1474939930632,780580761267306497,0
354,TheWivelihood,"Trump has aaaaaaaalllllllll the flapjacks 
Bruuuuuh 😂😂😂please answer these questions if you can 
#Debates2016 #debates #PresidentialDebate",1474939930670,780580761426591749,0
355,TonyLoyd,Release the returns!!!!  #debates,1474939930690,780580761510346753,1
356,Sullivan_LM,OOOHHH TAX RETURN QUESTION #debates @realDonaldTrump,1474939930749,780580761758031872,1
357,MacDaddy611,TPP is #Racist and #RacistHillary has always been promoting TPP! #NeverGonnaHappen #CrookedHillary #NeverHillary… https://t.co/FK4wb1eetW,1474939930628,780580761250459652,1
358,poku_c,"""Broad-based, inclusive growth"" #HC #Debates2016 #debates #DebateNight",1474939930508,780580760747122688,0
359,mariamhaas,"Ain't we all, Donnie? Ain't we all? #DonaldDeplorable https://t.co/e8mBTIF1bo",1474939930698,780580761544056833,1
360,Pinkomomma,Lookit me! Quoting a sane Republican. https://t.co/SUJ5X0t0Cw,1474939930607,780580761162297344,1
361,Liamerven,Fire him! ;) https://t.co/f6lqxoy4Zz,1474939930730,780580761678249985,1
362,iAmAnitaMarie,He won't!! He's been in audit for how long? #Debates,1474939930763,780580761816604672,1
363,SeattleBern,EXPORTS in exchange for donations to her foundation. https://t.co/Y4hcGuZRhr,1474939930665,780580761405562880,1
364,Probgoblin,"As per the #debates: bubbles are big, bubbles are fat, bubbles are ugly. Only two heroes can stop this: https://t.co/jNKGKKmSNy",1474939930658,780580761376202752,2
365,becky_whitaker,Wasn't gonna drink but it's happening #Debates,1474939930842,780580762148012033,1
366,Juliaflorad,Total circus #debates,1474939930649,780580761338384385,1
367,ProfCAnderson,Just ask the tax question.  The audit lie!!!!! #debates,1474939930825,780580762076770304,1
368,PeeTeeGee,#Debates. He is showing his diplomatic style RIGHT NOW!  Bullying his way through the debate.,1474939930778,780580761879523329,1
369,jayisnotsexy,tax returns !!! #Debates,1474939930969,780580762680758272,1
370,TumourousGuy,Hillary is certainly smiling more. Nervous?#debates #PresidentialDebate #USElections2016,1474939931667,780580765608185856,1
371,fishingLSC,hillary is responsible for benghazi  #Debates,1474939931708,780580765780160512,1
372,HashtagSpiruli,"Big, fat, ugly bubble we're in, says @realDonaldTrump. #Debates #debatenight #Debates2016",1474939931672,780580765629157377,2
373,MVPenergy,"At the end of all this, I hope all Americans are inspired to get involved. You gotta vote. But you have to respect other opinions. #debates",1474939931709,780580765784387585,1
374,CGayle,I know y'all are waiting for Donald to throw a fit #debates,1474939931644,780580765511933952,2
375,MCNMG,Trump is unfit to lead. https://t.co/UhLyVV0B5Z,1474939931566,780580765184757761,2
376,kylemra,Da Feds. #debates,1474939931667,780580765608267776,1
377,BiteMeTrump,Trump is lying. He has massive conflicts of interest. #Debates2016 #debatenight #debates,1474939931715,780580765809737729,0
378,TravRuiz,"Trump says he's under routine audit and when it's done, his taxes will be released #debates #debatenight",1474939931607,780580765356683264,0
379,SawMyHeart,Yes!! @LesterHoltNBC mentioning Trump not releasing his taxes! #debates,1474939931547,780580765105029120,1
380,TheOneTrueShire,You don't need too wait for the audit #debates,1474939931714,780580765805404160,1
381,LannyCDB,He hasn't answered one question  #debates,1474939931772,780580766048587777,1
382,tama_knight,AYYYYYY LESTER GOING IN ON THE TAX RETURNS #Debates,1474939931697,780580765734174720,1
383,hildepants,"""Routine audit"" my ass. #Debates",1474939931643,780580765507682305,1
384,davidcarlson1,Wow Trump is actually making a lot of sense on the Federal Reserve. We absolutely are in a bubble. #debatenight #debates #Debates2016,1474939931692,780580765713268736,0
385,Dan_Roehm,"#Debates  Hilary will not win on 'Rich people' - oh, here it comes - taxpayer subsidization of college tuition...Trump - dummys, the Fed?",1474939931707,780580765776146433,1
386,Cassie_Temple,Donald Trump is a big fat ugly bubble #debates,1474939931773,780580766052851712,2
387,jessbahl,Trump scaremongering now. #debates,1474939931660,780580765578960897,1
388,NAimprov,Not very well @bpolitics #debates #debatenight #Debates2016,1474939931657,780580765566275584,0
389,michaelctraylor,"Top down only works if you're Jermaine Dupri, screaming out money ain't a thang. #Debates",1474939931807,780580766195458050,1
390,ronaldojones53,"Faces, faces, faces, look at the Donald's expressions. he's not gonna make it till 10:30 #debates",1474939932609,780580769559445505,1
391,Sunburncooter,"Trump just doxed the Fed. You skypes about to get audited in 6 months. This is your notice. 

#debatenight 
#debates",1474939932620,780580769605431296,1
