,screen_name,text,timestamp,tweet_id,cluster_pred
617,sophievodka,"""I get audited all the time"" - because you con all the time? #debatenight #debates",1474940071616,780581352596869120,2
618,anag_g,You guys should really think about this. 4 years of Trump yelling and yapping like this. Save us. #debates,1474940071708,780581352982794241,0
619,patrick_muxlow,No Lester let them heckle. #debates,1474940071756,780581353184124928,1
620,sarpra_1629,Watching the debate like #debatenight #Debates2016 #PresidentialDebate #debates https://t.co/yNhDYFACru,1474940071395,780581351670022144,2
621,Petite_Flaneur,"Biggly?? Really? Sorry, Mr. Trump. #fail #grammariansagainsttrump #Debates https://t.co/TVz59vJtPJ",1474940071274,780581351162609665,0
622,IAdoreShady,"Literally why is Donald orange?

#debatenight #debates",1474940071708,780581352982908928,2
623,EvanK21,The only candidate that has a sure fire plan to decrease taxes across the board? @GovGaryJohnson #debates,1474940071725,780581353054150657,0
624,DanielleRkelley,Oh lord here is the emails... #debates,1474940071711,780581352995295232,1
625,SkyCloud_,when ya tired of hearing his bullshit. #debates https://t.co/FGjDxLqjlq,1474940071378,780581351598596097,0
626,SoyPuri,"""¡Todos los países del mundo nos roban!"" Excepcionalismo  para blue collars. #Debates",1474940071723,780581353045823488,0
627,TugmanFunkowitz,Oh cool trump decided to wear a birds nest on his head ballsy move let's see if it pays off for him #Debates,1474940071614,780581352588578816,0
628,cmclymer,"Historic moment: Lester Holt just became the first journalist to call out Trump's bullshit on national television.

#debates #debatenight",1474940071735,780581353096110081,0
629,Generacion1020,#Debates this dudes just keeps going around in circles lol no substance,1474940071721,780581353037271040,2
630,kristinshake,"irs says you can release your taxes...
but you say you wont. #Debates",1474940071649,780581352735289344,0
631,GirlygirlinMN,I LOVE #TRUMP! https://t.co/FnAugN3Tbc,1474940071734,780581353091768320,0
632,jrrdodson,Feeling sorry for Lester Holt. He be like... #debates https://t.co/EpUZIFc8Ld,1474940071524,780581352210956288,1
633,stout_87,Rednecks hollering in the crowd...oh bless #Debates,1474940071742,780581353125445632,0
634,andersonmt09,Is the lawyer who is telling him not to release his tax returns the same one who didn't know Trump was down in every poll? #debates,1474940071713,780581353003900928,1
635,NotRyanDavidson,I GET AUDITED EVERY YEAR YOU GUYS. LITERALLY EVERY YEAR #debates,1474940072678,780581357051256833,2
636,CCrase95,Literally watching the debates just for laughs lol. We're doomed. #debates,1474940072203,780581355059048448,2
637,Geai__Geai,Of course he would bring that up lol pathetic #Debates,1474940072686,780581357084741633,1
638,gringochulo1,#debates Unfortunately raising minimum wage will be an incentive for companies to leave....give them incentives to stay,1474940072690,780581357101514752,0
639,Z_Fresh7,I feel like getting audited by the IRS isn't a good thing? #Debates,1474940072357,780581355704856576,2
640,Dani_James22,"I'm surprised it took 30 minutes to bring up the emails. Way to show restraint, Don. #debatenight  #debates",1474940072671,780581357021958145,1
641,arkhambw,Release emails  and destroyed cell phones hillary  #Debates,1474940072649,780581356929556480,1
642,miradog17,@HillaryClinton --you are being too nice! #debates,1474940072582,780581356648669185,1
643,httpmensa,that crowd is obviously on Trumps side. lame asses #Debates,1474940072751,780581357357367297,1
644,cutepouts,wow  #Debates,1474940072733,780581357281878016,0
645,pegheldhostage,Is Trump really this stupid? What is wrong with him? Lester needs to get control of this. #debates,1474940072724,780581357244194817,0
646,CrushTrump,How many times is going to repeat himself? #Debates #taxreturns https://t.co/FOhJ0yl3VZ,1474940072353,780581355688173568,0
647,sailawayjake,Touchdown Donald trump. #ThingsMoreTrustedThanHillary #debatenight #HillaryClinton #debates,1474940072636,780581356875251712,0
648,andyzoric,is @RealBenCarson in the audience... you know in case hilary has another one of her episodes  #debates,1474940072725,780581357248323584,0
649,Sparky_McGuire,"""I've been audited for 15 years."" I'm not sure you should be so proud of that, Don. #debatenight #debates",1474940072757,780581357382569985,2
650,Parlett316,Just a bunch of hot from two clowns #debates,1474940072695,780581357122494467,0
651,1glforce,i had hypothyroidism and i was as retarded as all four candidates - but i got out and can enjoy women again... #Debates,1474940072683,780581357072289793,0
652,chemistry_kidd,JUST RELEASE YOUR TAX RETURNS MY GOD #debates,1474940072541,780581356476784640,1
653,KelsiSickmann,I've been under audit for 15 years...? Ummmmmmm did he think that would help him? #debates,1474940072798,780581357554503680,0
654,theemikefinazzo,God I hope this ends with him pulling a Bud Dwyer #debates,1474940072706,780581357168754688,0
655,darrellgandy,"If you keep getting audited, maybe you keep raising IRS suspicion with creative math #Debates",1474940072779,780581357475000321,2
656,GinaLeeMuller2,Clinton looks like the Beverly Hill Billy #Debates,1474940072800,780581357563019269,1
657,VikBht,I see your #deletedemails and raise you my #taxreturns … #debatenight #debates,1474940072797,780581357550317569,0
658,ArrayFPS,Emails &gt; tax returns. Which is more important honestly. #Debates,1474940072933,780581358120734720,1
659,flowseph21,Tax returns for emails? That's a new one #Debates,1474940072558,780581356548030464,1
660,janifer,"My boyfriend, a lifelong republican, have just walked into the kids bedroom and shut the door to avoid the #debates .",1474940072684,780581357076480000,0
661,girlstartup,Please FEDS get the routine audit done!  #debates,1474940073684,780581361270726657,0
662,latercera,"Trump 🇺🇸: ""Voy a publicar mi declaración de impuestos cuando termine mi auditoría""  https://t.co/TztFIvCKN2 #Debates",1474940073563,780581360763363328,0
663,ashleymhendel,Oh jfc here's the emails #debates,1474940073459,780581360327163904,1
664,RMCrow2,Quid pro quo  #Debates,1474940073689,780581361291702272,0
665,kaylacarpenterr,I'm dead 😂😂😂😂😂 https://t.co/Vny3uvO5hn,1474940073579,780581360830472193,0
666,Just_Kurt,@realDonaldTrump will release his tax returns when #HRC releases the 33k emails...he's on fire! #debatenight #Debates2016 #debates,1474940073656,780581361153343488,1
667,shork_kyle,Hillary loves blinking #debates,1474940073620,780581361002295296,2
668,MrMelvinCarter,His lawyer #huh ? Hmm #debates #debates2016 #imwithher,1474940073706,780581361363148801,0
669,iamthedriving,I don't know how Donald Trump made $656 million in this horrible economy. #debatenight #debates #Debates2016,1474940073662,780581361178607616,0
670,thebeatsmiff,Dam Donald you slipping  #Debates,1474940073644,780581361103036416,0
671,Rubypdx,Please! https://t.co/JE0tEcpvRB,1474940073616,780581360985530368,0
672,QueenDebrahB,Liar release your taxes #JusticeOrElse THE JUSTICE PARTY  #Debates https://t.co/0NR4ldKuzs,1474940073437,780581360234799105,0
673,KatieMarie_yeah,AND THE EMAIL TACTIC IS PULLED #Debates,1474940073738,780581361497309184,0
674,RWCDFJax,Would the public even understand Trumps tax return? It's probably lengthy! #debates,1474940073769,780581361627258880,1
675,juliiles,Emails. #Drink #Debates,1474940073680,780581361254105088,1
676,Lady_Berde,Awwwwww shit I was waiting for this #Debates,1474940073746,780581361530920960,0
677,maggie_long,"""I get audited all the time"" well, maybe there's a REASON for that, dumbass. #debates",1474940073682,780581361262456832,2
678,JonBudaBellyGrl,Emails.... take a shot!!!! #Debates,1474940073771,780581361635594240,1
679,ghod,I'm surprised it took this long to mention the emails to be honest #Debates,1474940074659,780581365360177152,1
680,vasdrimalitis,"There we go, Hillary's emails get their first mention... only half hour into the debate. #debatenight #debates",1474940074564,780581364961832960,2
681,pkultgen,You get audited because you've repeatedly violated tax laws. #hillaryformo #debates,1474940074681,780581365452460033,2
682,NoisyAstronomer,#Baitandswitch #debates,1474940074617,780581365184131078,0
683,DigitalDealsMD,Release those emails #Debates,1474940074521,780581364781424640,1
684,dougdmetcalf,Trump thinks loud will trump a plan.  #Debates,1474940074621,780581365200789504,0
685,BuddysMom06,#WhereIsGary #teamgov #LetGaryDebate need some sanity @debates #debates #Debates2016,1474940074699,780581365527916545,2
686,rbMSHELIA,"33,000 emails  😂🙌🙌🙆 #Debates",1474940074631,780581365242851328,1
687,MrTAndersonJr,"Wait, you can release tax returns only when she releases emails? #debates #Debates2016",1474940074628,780581365230166016,1
688,HollywoodDebi,"unconscious @theyearofelan ?
you'd be DEAD
#debatenight #Debates #Debates2016",1474940074619,780581365192364032,2
689,_oreokookies_,Hahaha yes 33k emails vs probably really questionable business deals. #Debates,1474940074753,780581365754376193,0
690,bomiksu,YESSSSSS!!!! #debates #debatenight RELEASE THE EMAILS!,1474940074720,780581365615988736,1
691,muscle_demon,That a boy get her emails #Debates,1474940074661,780581365368623107,1
692,djpony639,"her face
  #Debates",1474940074740,780581365699928064,2
693,Chastitellez,holding the tax returns hostage #debates,1474940074709,780581365570043904,1
694,spoapst,I HAVE BEEN AUDITED FOR 15 YEARS! TRUST ME! ITS WHY IM TRUSTWORTHY! #debates,1474940074752,780581365750255616,2
695,TruthinessCheck,Truthy or fishy statement? Tweet your fact-check! https://t.co/8UmF0VWDuv,1474940074606,780581365137993733,0
696,firewall5000,"I've always detested the notion of ""trickle down"", it's beyond dumb so stop promoting it #Debates2016 #debatenight #debates",1474940074638,780581365272096768,2
697,ChermelP_Music,"""It's not negotiable!"" 😂 #debates",1474940074719,780581365611896836,1
698,LeScriz,He can't listen to lawyers. Wonder how he'll listen to his advisors. #debates,1474940074743,780581365712621569,0
699,EmFilmFan,"DON'T LET TRUMP SIDE STEP THE QUESTION, HOLT! #Debates #Debatenight #Debates2016",1474940074790,780581365909553152,2
700,ShirersHope,Keep kissing Hillary's ass https://t.co/OjSZLWjeV2,1474940074732,780581365666443264,2
701,theshenerd,Update 2: Cast mates didn't appreciate me commenting on our work with hands as  hand jobs. #HenryIV #debates,1474940075635,780581369453826048,0
702,marrsipan,"Impossible to even listen to Trump right now. I came objective &amp; ready to hear both sides, but how can you listen to this jerk? #debates",1474940075521,780581368975749120,0
703,DcWisDems,Donald Trump would be a disaster for Wisconsin’s economy. #debates #debates2016 https://t.co/chieA0a59Q,1474940075511,780581368933646336,0
704,ProjectTECA,Why would his lawyers say not to release his tax returns.  Anything to hide? #debates,1474940075683,780581369655205888,1
705,nicole473,#debates #debatenight Real-time fact-checking of Trump's LIES. https://t.co/0bJHk7JgKF,1474940075644,780581369491623937,0
706,MistahMarvel,No bruh thats evading the point. Bruh you dont pay taxes Frump-avich #Debates,1474940075762,780581369986617345,1
707,Schmushi,YOUR AUDIT HAS NOTHING TO DO WITH YOUR FUCKING TAX RETURNS @realdonaldtrump #Debates #FactCheck,1474940075721,780581369814650880,1
708,Uvaack,"In my brain, @HillaryClinton just says to him ""DELETE YOUR ACCOUNT"", drops the mic, and walks away #Debates #Debates2016 #ImWithHer",1474940075704,780581369743339525,2
709,Loggiant,"""I get audited by the IRS every year, nobody else as rich as me does""
Sounds like #TaxEvasion by #Trump #Debates",1474940075788,780581370095689728,0
710,sfpelosi,DT says he has been audited for 15 years. BUT last year's were not audited. #liar #debates,1474940075734,780581369869131776,2
711,JabberBates,@YNB Been under audit for 15 years... so we won't get them until 11 years after his term?! What the hell kinda argument is that?? #debates,1474940075754,780581369952948224,0
712,ASKuboth,"That's it, if this is how the #debates go then it is time to welcome @realDonaldTrump as the next president.",1474940075843,780581370326228992,0
713,Ad0rebel,Mentions email - chugging for dear life #Debates,1474940075780,780581370062106624,2
714,SedaRaul,"Ee get it Trump, you dont pay taxes... #DebateNight #debates https://t.co/URXli7jz5m",1474940075631,780581369436999680,0
715,gesn10,It's not illegal to release your taxes while being audited.  #debates #debatenight https://t.co/ViQZiMA04k,1474940075760,780581369978105860,2
716,duane19015,Enough with the emails already #Debates #Debates2016,1474940075716,780581369793699841,1
717,OVOKali,Oh shit he bought up the emails  #Debates,1474940075926,780581370674360320,1
718,aliyatlecky,Is he audited for last 40 years?? #debates #debatenight,1474940076678,780581373828435968,2
719,pdxpen,"He gets audited almost every year, guys. Every year. #debatenight #Debates2016 #debates",1474940076719,780581374000365568,2
720,jfreemon63,and the Trump supporters in the audience forsaking the rules of engagement... #debates,1474940076657,780581373740363776,0
721,laandaay,oh nah #debates,1474940076627,780581373614620672,0
722,GrasieMercedes,Again with these damn emails?!#debates #debatenight,1474940076608,780581373534842880,2
723,_ASJ522,YEET https://t.co/wf7TE9J5ZS,1474940076559,780581373329469442,0
724,jaysnead1,FREE the emails and tax returns #Debates,1474940076561,780581373337804801,1
725,0liviaDowling,SHOTS FIRED #debates,1474940076569,780581373371355138,0
726,daclarenceclark,@LesterHoltNBC Who cares about Trump's tax returns? He is a man of action! He is a jobs creator! #Debates,1474940076640,780581373669175296,0
727,iRhysTay,.@LesterHoltNBC has on big boy pants.  I recant.  #debates,1474940076763,780581374184923136,2
728,simplifyandgo,How to make presidential #debates better without breaking them https://t.co/DNHkmhDGE8 https://t.co/PqrAx9TxOc,1474940076518,780581373157539840,0
729,dakimist,"Trump ain't giving up no income tax forms,never! #Debates",1474940076714,780581373979623424,1
730,RightyMarky,EMAILS!!!!!  #Debates,1474940076691,780581373883064320,1
731,ErinSchrode,"""No wonder you’ve been fighting ISIS your entire adult life."" What, Trump? This man makes ZERO sense. UNFIT to be prez. #NeverTrump #Debates",1474940076643,780581373681819648,0
732,D4BrosComedy,Hillary takes out her emails from her pocket. Dr. Oz style. #debatenight #debates #Debates2016,1474940076794,780581374314938368,2
733,angieesaldana,Holy fuck he brought up the emails  #Debates,1474940076781,780581374260449280,1
734,johnelerick,"""it's a tremendous audit, let me tell you"" #debates",1474940076723,780581374017142785,0
735,GreenBounding,Masterful Distraction and Obfuscation #Debates,1474940076803,780581374352723968,0
736,PetersonParker,"""You will learn more about Donald Trump by going down-"" #quotesoutofcontext #whocareswhynot #Debates",1474940076769,780581374210301955,0
737,TheVashra,"""Watching shows...""  #Debates",1474940076750,780581374130524160,2
738,OGobana8,There goes trump mentioning the emails #Debates,1474940076709,780581373958508544,1
739,Jessica_Liliana,Emails #debates https://t.co/K2t9QTHIhW,1474940076451,780581372876521473,1
740,BillyLTaylor,Oh shit he brought up the emails 🙈 #SurpriseSurprise #Debates,1474940077672,780581377997615104,1
741,raulvillesca,The deals that come out of Washington DC are insane. Trump will fix those deals. #Debates,1474940077466,780581377133547520,0
742,anamaria7887,Trump gets audited every year? #debates didn't the irs say that I could release a tax return even when u r being audited?,1474940077564,780581377544716288,1
743,Emi_MonteCano,Trump ain't president yet? #Debates,1474940077690,780581378073079808,0
744,bgw195,Release your taxes! Trump you crook! #debates,1474940077666,780581377972416517,1
745,eigenscape,Trump totally ignores Holt's fact check. He can release his tax returns under audit. #Debates,1474940077715,780581378177896448,1
746,CactusFlow3r,"""I get audited by the IRS, other people do not"" Hillary: *looks into the camera like on The Office* #debates",1474940077569,780581377565679616,2
747,jerradpeters,"#Trump gets a ""whoop"" from the audience. #Debates",1474940077737,780581378270212098,1
748,ActivisFeminist,Lester is in The Shills pocket. Of fucking course. #Debates,1474940077678,780581378022780928,1
749,NaturallyYAS,Don't bring it up when you are hiding shit too .@realDonaldTrump #Debates,1474940077591,780581377658019842,0
750,josefbailey,Release those emails woo woo #Debates,1474940077792,780581378500939776,1
751,ajlposh,And there's the first email jab of the night #debates,1474940077687,780581378060537856,0
752,Newfamilyguy,Trump made 694million in a system he says is rigged against us #debates,1474940077728,780581378232582144,0
753,klebersonMBC,Sensacional esse #Trump 😍👏👏👏 #Debates,1474940077736,780581378266173440,0
754,IsisPaola13,I should've done the #debates drinking game. I would've been drunk by now.,1474940077775,780581378429685761,2
755,DSweda3,"#debatenight #debates smile and lie Hillary Clinton, like you always do #TrumpTrain #TrumpPence16",1474940077811,780581378580684800,2
756,WSFranco,this guy is ridiculous #Debates,1474940077808,780581378568122368,2
757,moretwitt,#debates #debatenight #DonaldTrump  #debatenight #DudeCHILL You can't vote for someone who hasn't show tax #corrupto #corruptTrump #Corrupt,1474940077833,780581378672910337,2
758,cm_sully1,"If this were Mario Kart, Trump would be running people off the track while Hillary would constantly spam the lightning attack. #Debates",1474940078706,780581382334451712,2
759,PhillyTrib,"Trump: I will release my tax returns, when Clinton releases her 33,000 deleted emails. #debates #debatenight",1474940078702,780581382317707265,1
760,C_P_Randall,"""When she releases her emails I'll release my tax details"" brilliant 😂 #debates",1474940078595,780581381869072384,1
761,hazelinealejan2,#Debates https://t.co/CAr9CU1oMz,1474940078199,780581380207947776,0
762,yougettobehappy,Call him out on that bait and switch! Yesss! #debates,1474940078713,780581382363885568,2
763,juliargordon,Trump's supporters can't control themselves either. #debates #fb,1474940078604,780581381906636801,0
764,DavidPontious,"NOW: Trump's website is down.
#debates https://t.co/4eonxYQTxv",1474940078390,780581381009207298,0
765,lavfilho,Certeza que foi o @vinnybrandt que montou... https://t.co/dynpz9uewo,1474940078569,780581381759959041,0
766,_MelissaAmy,Can someone just put him on a timeout already? #Debates,1474940078667,780581382171033601,0
767,cdbond,"Twitter is definitely the winner of the #Debates tonight! 

#debatenight",1474940078672,780581382191845376,2
768,djchema78,The moderator Lester Holt is nowhere to be seen as a moderator. Are you doing a good job Lester? #debatenight… https://t.co/VpVbTlpjMq,1474940078349,780581380837244928,0
769,PE_designs,Visit our sister company https://t.co/N4EcisBbNW &amp; Get you Fuck Hillary Shirt today #debates #debatenight #debates2… https://t.co/wCyGLc7wIe,1474940078328,780581380749230080,0
770,RealJamesKist,What #leftist sallykohn says https://t.co/Aoi7bMzega,1474940078639,780581382053629952,0
771,Itsnadia4,This debate is getting hot!  #debates,1474940078655,780581382120611841,0
772,USAIncorporated,BOOM! #Debates,1474940078686,780581382250700802,1
773,ObsrvntObsrvtns,9:33 pm ET @realDonaldTrump brings up @HillaryClinton emails. What took him so long? #debates,1474940078711,780581382355492864,1
774,alanblackmon,Suffering? Bad decisions? Okay whatever https://t.co/j1E0gA0Tsb,1474940078449,780581381256642560,0
775,Jamesbroispx,"Trump's first ""its unfair"" of the night #debates #debatenight",1474940078677,780581382213042177,0
776,Myles__B,feels like stone cold is about to come out of nowhere and give them both the stunner #debates,1474940078733,780581382447824900,0
777,katesongin,Trump: I will release my tax returns as soon as Hillary Clinton releases her emails #debates,1474940078771,780581382607298560,1
778,PolidixUSA,This debate! #SMH. #debates https://t.co/U6XYeqOfCG,1474940078643,780581382070407168,0
779,Peasberry,Interesting how Clinton is wearing red and Trump is wearing blue.  #WhereIsGary #debates,1474940078855,780581382959489025,0
780,ChasingIssues,"Ugh, here comes the email scandal. Please stick to policy. #Debates",1474940078924,780581383248891904,0
781,_lumicube,"Hillary: *looks into the camera like she's on The Office*
#debates",1474940078930,780581383274049537,2
782,curi42,Hillary has a really condescending way of smile. she doesn't have to talk to be a smug bitch. #debates,1474940079683,780581386432294912,2
783,PunkSmurph,Didn't take long to nag for #taxreturns to come up.  #debates,1474940079638,780581386243616768,1
784,L3ftprincess,SLAY HILLARY #debates,1474940079529,780581385786372096,2
785,craftykat1,There we go. Emails tax returns #Debates,1474940079354,780581385052495872,1
786,iknc4miles,Praise Jebus! https://t.co/Hm3ZlSrb00,1474940079527,780581385778135041,0
787,cgranade,He keeps trying to escape the tax returns question. Now he's even tying it to the e-mail manufactorversy. #debates,1474940079535,780581385811537920,1
788,BilalBadry,"America's 2016: Wild animals win, only!

#debates",1474940079702,780581386512130048,2
789,_RihTweet,Who df did this ??????!!!????? 😂😂😂😂😭😭 https://t.co/xPfsbjfq1W,1474940079652,780581386302390272,0
790,_x0eden,BRUH THE FREAKING FBI SAID HILLARY'S EMAILS WERE COOL JUST SHUT UP ABOUT IT  #Debates,1474940079766,780581386780483586,2
791,thomasKnesbitt,"Me to my professors about my homework: ""my lawyers they say don't do it"" #debates",1474940079761,780581386759528451,1
792,infamousjimyg,"#Trump going full Kenny Powers, ""I don't know why I am yelling but I can't stop because that means I lose!"" #debates #debates2016",1474940079737,780581386658787328,0
793,KristinaL1113,"Seriously, maybe Trump is deaf. Think about it.  #debates",1474940079793,780581386893701120,0
794,3amjosh,Shots fired! #debates,1474940079398,780581385237061632,0
795,Im_RandomRoss,"Trump says he'll release his tax returns until the emails, lol this election is sad #debates",1474940079763,780581386767835136,1
796,MichAnthonyB,"TAXES DO NOT EQUAL EMAILS, DONALD! #Debates https://t.co/Y9MrnjrlK7",1474940079556,780581385899651072,0
797,lilmeckia,"There it is! Who had, 35 minutes in?  Emails have been mentioned. #baitnswitch #debates",1474940079727,780581386616995841,1
798,kendrachubbuck,EMAIL! take a shot #debates,1474940079744,780581386688143360,1
799,WhosGoneGalt,"Hahahahaha...I will release my Tax returns when she releases her 33,000 Deleted Emails...lmao GO @realDonaldTrump #debates",1474940079670,780581386377793537,1
800,ddIjb,"É, ele é definitivamente uma pessoa descontrolada #Debates",1474940079792,780581386889601024,2
801,TheStoneJones,He's been under audit for 15 years... so we'll get these returns when he's dead? #debates,1474940079836,780581387074174977,1
802,hkline01,The mediator is having fun reminding Trump of his financial records #Debates,1474940080660,780581390530162692,0
803,DetSharkAttack,#debates I am suprised he did not try to sell steaks. He will never release his tax returns. The IRA has already told him he can do it,1474940080551,780581390072950784,1
804,SmurfetteTeaser,yayyyy on the 30000 emails. #debates,1474940080472,780581389741719552,1
805,Inkredibly,"""Audience, please be as silent as me during this debate."" - Lester Holt #debatenight #debates",1474940080704,780581390714757120,1
806,MizGlasper,He can say anything he wants and no one is stopping him #Debates,1474940080647,780581390475628544,0
807,mikegod20,I just told @nbcwashington who I think is winning. Cast your vote now! #Debates #NBC4DC https://t.co/yg0Wge0OA6,1474940080666,780581390555291648,0
808,Meldotte,#debates Where is Trump saying we can find his financial forms?,1474940080616,780581390345797633,0
809,cashmeremya,"AS SOON AS SHE RELEASES HER 33,000 EMAILS LMFAOOO #Debates",1474940080744,780581390882443265,1
810,prof_taxi,@LukeRussert Waiting for #Trump to literally pull his hair at the #debates.,1474940080691,780581390660272128,0
811,CambriaEaston,TRUMP JUST BROUGHT UP THE EMAILS IM SCREAMING #debates,1474940080650,780581390488252417,1
812,Twit_ster,EMAILS! EVERYONE TAKE A SHOT!!! #trump #debatenight #debates #debate2016,1474940080534,780581390001647617,1
813,yehuda_jacob,Good line trump! #Debates,1474940080750,780581390907617280,0
814,nvrggivup,"#debates why did she delete 33,000 emails",1474940080668,780581390563676160,1
815,taraepowers,"Wait, @HofstraU, are you seriously applauding for the emails right now? As he expounds on how he's been under IRS audit for yrs?? #Debates",1474940080730,780581390823911425,1
816,FenNasty,Shots Fired! 😳🔫 Where them Emails with all that smiling??? #debates,1474940080805,780581391138295808,1
817,AndrewMaxLevy,Release them. #TrumpTaxes #Debates,1474940080647,780581390475603968,1
818,marangdream,Trump's so shady! We wanna see those tax returns! 😅💦💦 #Debates,1474940080751,780581390911954944,1
819,EliGundry,Hmmm why have you been under audit for 15 fucking years. Get your shit together @realDonaldTrump #debates,1474940080670,780581390572199936,2
820,rrevognah,he's bringing up the emails o shit waddup #debates,1474940080817,780581391188697088,1
821,miijazziivoice,He's full of be... #Debates,1474940081600,780581394472984580,1
822,RichyLARams,But y tho???? #Debates,1474940081662,780581394732855296,0
823,rachel_drumm,Are they gonna fight in the parking lot when this is over? #debates,1474940081581,780581394393231361,0
824,SgtQman19,#Debates When is America going to wake up to this bitch Hillary! Hillary for Prison!!!!,1474940081631,780581394602795008,2
825,CleverKimberly,Emails!!! Time to take a shot! #debates,1474940081255,780581393025765377,1
