,screen_name,text,timestamp,tweet_id,cluster_pred
0,PoliticsUSmore,"@FoxNews It's easy for @HillaryClinton  ready for the #debates when all she did was rest for about a whole month plus a usual politician,",1474940210694,780581935932243968,3
1,ChrisArrr,"Wait, that's not how urls work... https://t.co/p1LHNWudhc",1474940210350,780581934489538560,3
2,ReadHttp,#Debates Iraq Is supposed to grow faster than China? right?,1474940210600,780581935538065409,3
3,britt_brat_94,Clinton owes the Benghazi victims an explanation. #debates,1474940210664,780581935806615553,3
4,fenjamin,I just told @nbcwashington who I think is winning. Cast your vote now! #Debates #NBC4DC https://t.co/lAXFfPla5s,1474940210560,780581935370285057,3
5,shanney32,"""I will release my tax returns against my lawyer's wishes."" Isn't that some ish #Debates #DebateNight",1474940210705,780581935978602496,3
6,priyanki_bh,Is this a debate or a mudslinging contest? So confused. #WhereIsThisCountryGoing #Debates,1474940210796,780581936360140801,1
7,FandomFreakVine,"Oh there he goes, puckering his lips. #debates",1474940210696,780581935940792321,3
8,Paula68154,"Lol

Trumps a pussy https://t.co/3Vh8R9xFpa",1474940210573,780581935424811008,3
9,mrvotto,"""That makes me smart."" Yeah, we're all just a bunch of fucking suckers, right? #debatenight #debates",1474940210653,780581935760478208,2
10,ovokiya,Lmao Hilary is really not this nigga ass  #Debates,1474940211676,780581940051054594,3
11,KtotheY1980,So looking for ways to NOT pay your taxes is smart?! WTAF! #debates,1474940211598,780581939724087296,2
12,katr666na,theres no prohibitions on releasing tax returns during audits!! slay hillary #debates,1474940211691,780581940114055170,3
13,lannadelgrey,"""I have no reason to believe that he will ever release his taxes. Because there's SOMETHING he's hiding."" -- @HillaryClinton #debates",1474940211592,780581939698884609,3
14,NHLivFREE,Waren does this https://t.co/x9HKxtUvu9,1474940211260,780581938306441216,1
15,cactuspower1234,Why am I watching this I'm Canadian  #Debates,1474940211716,780581940218826752,3
16,brownkid_12,@DonaldTrump won't release taxes unless @HillaryClinton releases emails ... isn't that blackmail or ransom or hostage?? #debates,1474940211654,780581939958849536,3
17,mks9929,@twitter #Debates ... Ummmm... Clinton cannot release those emails. Has no power to do so. He is obliged to release his tax info.,1474940211625,780581939837140993,3
18,graysonmpike,"The crowd cheered as @realDonaldTrump talked about @HillaryClinton's 33,000 missing emails. #debates",1474940211633,780581939870834688,3
19,TIMEIdeas,These are the bombshells that could be in Trump's taxes: https://t.co/AhHQZa36mL #debates by @danieljmitchell,1474940211518,780581939388542976,3
20,Elementarybitch,@LesterHoltNBC waiting for them to listen to him #Debates https://t.co/HPhuiaOnvL,1474940211557,780581939552129024,3
21,luceroshayna14,"Clinton tells everyone https://t.co/Iv6nATi5MS has been turned into a fact checker. ""Look at mine too,"" Trump says of his website. #debates",1474940211702,780581940160237568,1
22,MrFlickHimself,AND he was Snapchatting the whole thing! Oh my god!! #debates #snap,1474940211587,780581939677986818,3
23,xxLauraxx63,quick question why does trump not get to pay taxes but I DO?? #debates,1474940211730,780581940277702657,2
24,angelagim,Could we get Lester to staple Donald's lips shut? #debatenight #debates,1474940211793,780581940541870081,1
25,TheRobertBarry,Who wants to pay taxes? I don't blame #Trump. #debates #debatenight,1474940211754,780581940378365952,1
26,RafiDAngelo,"Hillary: He didn't pay any federal income tax.
Donald: That makes me smart.
Viewing Audience: 
#debates https://t.co/aBuJB3GbYd",1474940211413,780581938948104193,2
27,CapnCapes,Are these people presidential candidates or reality TV stars? #Debates,1474940211794,780581940546052097,3
28,DanScheeler,Clinton just stole Trump's hand gesture! #debates,1474940211602,780581939740827648,1
29,doubleuu88,lost count on the number of sips of water trump has had...anyone? #Debates,1474940211817,780581940642525189,3
30,KaneCunico,"Didn't pay income tax, yet @realDonaldTrump says ""that makes me smart."" Did anyone catch that? #Debates2016 #debates",1474940211830,780581940696981506,2
31,The_Arkayde,"Trump, not paying taxes does not make you smart. That makes you an ass. The average American would be harassed by the IRS for that. #debates",1474940212579,780581943838736384,2
32,philipgalitzine,I'll add an LOL to that last tweet just to make it clear. #Debates,1474940212599,780581943922524160,3
33,quiinthieu,*sip tea* 󾦄 #debatenight #debates #Debates2016 https://t.co/nqZXKPca4b https://t.co/KPMVDG3H4v,1474940212620,780581944010637313,1
34,_JAlcaraz,That eye roll #debates,1474940212740,780581944513794048,1
35,Foro_TV,En Vivo: ¿Qué tipo de interés está ocultando? (Trump) @HillaryClinton #debates #debatenight https://t.co/jXqcvqoGdB,1474940212684,780581944279044101,1
36,patsynp,"😳 BILLARY where's the 30,000 emails? #debates",1474940212654,780581944153243648,0
37,CharlotteFare,"trump justifies every awful thing he's done by saying ""that's just good business"" #debates",1474940212665,780581944199229440,3
38,SeverinPick,"""[...] He payed no federal income tax"" - ""That makes me smart!"" Ach so ist das! #Debates",1474940212707,780581944375599104,2
39,Richie_Menlo,Twitter reactions to the #debates way better than actual #debates,1474940212806,780581944790618112,3
40,Specneedsmom4,Way beyond wiping the floor &amp; leaving him behind in the muck where he belongs! Ur a asswipe @realDonaldTrump.… https://t.co/SXtshbgIbr,1474940212612,780581943977009153,3
41,JoeThaPro,In bed with Russia and he want to be Putin foot soldiers  #Debates,1474940212805,780581944786493442,3
42,mcr_michealene,@AriFleischer @bluelyon #DebateNight  its impossible for him. He is such a pompous ASS https://t.co/8D0Bs1XMhG,1474940212735,780581944492822530,3
43,CHilkewich,"""That makes me smart."" Trump on not paying taxes. #debates",1474940212742,780581944522178562,2
44,JamesDalgarno_,"""Who does he owe money too?"" #Clinton asks of #Trump. #Debates #debates2016 #Clinton #Trump",1474940212774,780581944656531460,1
45,beckythebarber,@BikersForTrump @realDonaldTrump   #debatenight #debates #Debates2016 #NeverHillary #CrookedClinton https://t.co/rMwZNuJ0Wp,1474940212465,780581943360516098,1
46,Coonie81,#debates #Debates2016 She got him on his tax returns,1474940212791,780581944727830529,3
47,PKdoeshair,@realDonaldTrump makes you smart not to pay taxes but us little people who live pay check to pay check support this country for you #debates,1474940212731,780581944476233728,2
48,Saabuham,#debates Trump won't release his tax returns until he reads Hilary's 33 thousand emails. see you in 2030,1474940213677,780581948443860992,3
49,CharlesHBateman,"""That makes me smart"". Sorry...that makes you greedy. #debates",1474940213597,780581948108472321,2
50,KaEeben,"It's smart to not pay federal taxes if you can avoid it Donald? The rest of us pay our fair share, why not you? #Debates",1474940213669,780581948410519552,2
51,alejandrogls,Sooo... no paying your federal taxes makes you smart... dear lord... #debatenight #Debates2016 #debates,1474940213626,780581948230172672,2
52,nextpresidentt,Just stop it Hillary. #debatenight #debates,1474940213681,780581948460859392,1
53,GenKittVonKnox,@HFA PPL don't fucking care you Trump Taxes! Get fucking over it! #debatenight #debates  #Debates2016,1474940213485,780581947638706176,1
54,MrCharlesPowers,ARE THESE REALLY OUR LAST TWO OPTIONS?! #Debates,1474940213803,780581948972339201,3
55,jonsaidstuff,"Trump's Tax Plan... Plain &amp; Simple.
#debatenight 
#debates 
#TrumpVsClinton https://t.co/lL7tIVbKU5",1474940213568,780581947986837504,1
56,joeyohern,"If I had a dollar for every time the term ""tax returns"" was said I could reopen the Trump Taj Mahal. #Debates",1474940213719,780581948620144640,3
57,Trump_Landslide,#SickHillary speculating as if she's never seen a 1040 in her life. #debates #debatenight #Debates2016,1474940213820,780581949043650562,1
58,mkfers,53 #Debates,1474940213815,780581949022703618,3
59,trinar78,So much more entertaining with a bloody mary. #debates,1474940213753,780581948762705920,3
60,AAlmightyAlyssa,"""That makes me smart"" who's mans is this! Smart like JD not paying taxes huh #Debates",1474940213754,780581948766892035,2
61,Jackiee00_,@TreySongz is joining y'all 😂 https://t.co/6YfgBAX4Ef,1474940213612,780581948171313152,3
62,JonathanWax123,#debates wow @realDonaldTrump is messing this up bad,1474940213831,780581949089783808,3
63,NawazMurshed,mashable : RT mashablegif: That #Trumpsniffle though #debatenight #debates https://t.co/bfzfiFeeYN (via Twitter … https://t.co/7AZvtHJ7Kn,1474940213657,780581948360097792,1
64,GinaLeeMuller2,Clinton not upfront with Veterans and money not given to them  #Debates,1474940213829,780581949081550848,3
65,rakkasan1187,We know she always money to foreign governments especially those who don't like women orgays #Debates,1474940213714,780581948599263232,3
66,beshka33,Hmmm. He insisted on Obama and his birth certificate but refuses to share his tax returns.  #debates,1474940214627,780581952428445696,3
67,CBuch64,"#debates Hillary, what about pay for play ambassadorships?",1474940214686,780581952675917824,0
68,Julian_Epp,When Hillary brings up the tax returns #debatenight #debates https://t.co/quinl7PUDh,1474940214510,780581951937781760,3
69,tammyvent,"Ok, that's it. I can't watch this. This man is scary. #debates",1474940214525,780581952000667649,1
70,bethsheffield,"Oh, now he says he's ""smart"" for not paying his taxes??
  #Debates",1474940214708,780581952768258049,2
71,abc4utah,"Secretary Clinton claims that Donald Trump does not pay federal taxes. Trump: ""That makes me smart."" #Debates",1474940214362,780581951317180416,2
72,_AdeleBuck,OH. MY. GOD. https://t.co/0avlANajXQ,1474940214627,780581952428601344,3
73,Favstar_Bot,"@rejectedjokes Congrats on your 500❤️ tweet! https://t.co/IvPaIenhJX

https://t.co/f595he45nN",1474940214668,780581952600498176,3
74,obcpippa,"she shouldn't of brought up ""hiding things"" perfect trump transition #debates",1474940214710,780581952776572928,3
75,IcemanDaGenius,American People know Financial Disclosure Forms SHOW MORE than Taxes. AND ITS NOT CLOSE. Crooked Hillary lying through her teeth. #debates,1474940214779,780581953066020864,3
76,kitsunesenpaii,This man is getting shut down!!! #Debates,1474940214746,780581952927793152,3
77,frecklycash1,Emails #Debates,1474940214888,780581953523154945,3
78,linuxxor,#debates donald hiding. Killory is all about hiding,1474940214738,780581952894009344,3
79,sevenwithcheese,"""I made a mistake using a private e-mail...""
""That's for sure!""
#debates #debatenight",1474940214947,780581953770840064,0
80,depressingdemon,Hillary has my vote!! #Debates,1474940215677,780581956832497664,0
81,grndpam,If he didn't pay any taxes I want to hire his tax attorney  #Debates,1474940215487,780581956035743744,3
82,Millienand1,This debate is ugly already. Smh #debates,1474940215511,780581956136435712,3
83,WAGGNews,Clinton: What are the conflicts? Who does [Trump] have dealings with? #Debates,1474940215730,780581957054844929,3
84,Phyla67,#debates where the hell did MacArthur came into the debate,1474940215546,780581956283170819,3
85,djpacko,Trump's little random comments during her 2 minutes makes me chuckle. #makesmesmart #debates,1474940215711,780581956975071233,2
86,feniangirl,OMG! #hillary She has her nerve! What a clown - she accuses him of what she has done! #debatenight #debates #Debates2016,1474940215551,780581956304109568,1
87,penelopepickles,Not paying your federal taxes like the rest of us makes you smart? Asshole!  #Debates,1474940215600,780581956509659137,2
88,miualoha,トランプ氏の「税務申告はいま監査してます。終わったら公表します」って、前東京都知事みたいだね。 #Debates  #nhk #米大統領選,1474940215731,780581957059039232,3
89,ashek1,something he is hiding #Debates,1474940215756,780581957164040193,3
90,avhassett,"""That makes me smart""--Donald Trump, on avoiding paying federal taxes. #debates",1474940215718,780581957004582912,2
91,jungminsjuliet,"Trump evading his Taxes and getting away with it? ""that makes me smart"" kay #debates",1474940215816,780581957415469057,2
92,wallenthusiast,Hilary clintons whole semester seems staged and played out. #debates #debates2016,1474940215765,780581957201567747,1
93,ECPickett,"If @realDonaldTrump pays no income tax,he has very good lawyers,CPA's.What is she hiding? #TrumpPence16 #debatenight #Debates2016 #debates",1474940215604,780581956526280705,1
94,cooljakari4,Man release your tax returns #Debates,1474940215117,780581954483814400,3
95,AmandaCCoyne,Clinton raises questions of debt obligations that would be revealed in Trump tax returns #debates,1474940215676,780581956828487680,3
96,socrates_99,Donald is hiding something on his taxes. WHAT IS HE HIDING? #debates #debatenight,1474940215848,780581957549850624,1
97,Cubjoe,"Now we are talking, you are hiding @HillaryClinton, release your emails. https://t.co/3Hl08nwEdX",1474940215716,780581956996268033,3
98,strxngebyers,"""you go girl"" - my mom at hilary #debates",1474940216698,780581961114849282,3
99,NivaSpook,Lmao #Debates,1474940216682,780581961047810049,3
100,JoshHarman123,We need a split screen w/ Lester Holt's reactions. #debates,1474940216721,780581961211359232,3
101,Big_Wilkie,WOW. https://t.co/DXm96pQhbX,1474940216608,780581960737394688,3
102,citizenpsych,#debates2016 #debates @HillaryClinton definitive case for Donald's bait &amp; switch re nonrelease of taxes.,1474940216694,780581961098158080,1
103,LdyNJ1,#Debates2016 #debatenight #debates how about you Hillary in regard to your Clinton Foundation Charity what about #Haiti you are #despicable,1474940216753,780581961345605632,1
104,BrennanWads,Did he just say it was 'smart' to not pay taxes? #debates,1474940216442,780581960041140224,2
105,jamiekg484,"I'm pretty sure I've deleted in excess of 100,000 spam emails in my life. Let's see the Viagra ads @HillaryClinton… https://t.co/pW9Grrggmm",1474940216569,780581960574009346,3
106,Darren32895836,#debatenight #debates #debates2016 Hit Her on the Foundation Donald Trump!!!!,1474940216664,780581960972283904,1
107,roselynplacide,#Debates,1474940216726,780581961232486402,3
108,lizmoon22,Next segment please #debates,1474940216748,780581961324634112,3
109,Statistar30,She is so fucking arrogant. Do you have something to hide in your speeches @HillaryClinton? Who do you owe favors to? #debatenight #debates,1474940216732,780581961257586688,1
110,hottienkadi,WHY DID HILLARY JUST DRAG TRUMP TO HELL AND BACK AND READ THIS MAN FOR FILTH. #debatenight #Debates #hillay,1474940216693,780581961094094852,1
111,moloofficial,The pot calling the kettle black here #debates,1474940216704,780581961140101120,3
112,jmarley929,@warriors_mom it's not talking points when you're answering the questions you're asked #debates,1474940216668,780581960989151234,3
113,FreddiePSoft,"Not paying Federal Tax ""That makes me smart"" #DUMPTRUMP #Debates It makes all the Americans ""Dumb?""",1474940216760,780581961374965760,2
114,maltesepeter,"""That makes me smart"" Donald Trump on not paying any federal income taxes #Debates",1474940216726,780581961232486401,2
115,juliaonken,"Trump - ""That makes me smart"" on not paying Federal Taxes. Are you fucking kidding me???? #Debates2016 #debates",1474940216659,780581960951357440,2
116,helfelynn,There's something he's hiding? Seriously? I can't believe she said that #debates,1474940216640,780581960871776260,3
117,Carejanez,How many times is Trump gon touch his mic? #Debates,1474940216821,780581961630822400,1
118,BurnsSarita,That makes you an A$$.....#noncontributer #wantstoleadbutnothelp #Debates,1474940217762,780581965577584640,3
119,itsajacobthing2,Are we going to talk about race and women's roles? #debates,1474940217438,780581964218793986,1
120,saw_bhs07,I'm really praying for everyone who made a drinking game out of tonight's #debates cause I think 9/26/16 is gonna be a high fatality day,1474940217735,780581965464342528,3
121,jessicalyneross,"Trump might be hiding something. But Hillary what were you hiding in those 33,000 emails? Pot calling the kettle black. #debates",1474940217633,780581965036740609,3
122,RodWade,"Clinton - I made a mistake using a private emails, not going to make any excuses, it was a mistake #debates",1474940217698,780581965309235201,0
123,emweezus,"""That makes me smart"" 💀🙄 #Debates",1474940217641,780581965070233600,2
124,RGGumm,yeh so this happened https://t.co/C6aSfbkwYP,1474940217624,780581964998934528,3
125,S_Park89,Trump says he was smart to not pay his income taxes... #debatenight #debates #Debates2016,1474940217751,780581965531451392,2
126,KaelsKomments,"ISIS didn't exist her entire life, dummy. @realDonaldTrump #Debates2016 https://t.co/53jmxJH8WZ",1474940217429,780581964181082112,3
127,HannahKae3,Hillary talking about charitable like her charity money doesn't go towards her campaign😂 #Debates,1474940217628,780581965015748608,3
128,Mrrebooty,Email 😀😀😁😁😀😈😕😮😴😑😇😈😕#Debates,1474940217517,780581964550119424,0
129,napernurse,@RichmondDoc You bet he's hiding something by not releasing returns! #debates,1474940217727,780581965430923264,3
130,ramsey__phelps,"Trump brings up a good point: ""You've been doing this for 30 years, why are you just thinking about these solutions now?"" #JMC3413 #Debates",1474940217763,780581965581856768,1
131,Shoshana08,"""Not paying taxes makes me smart."" No, DT, it makes you an asshole. #Debates",1474940217825,780581965841911808,2
132,nchlsmnrng,Kek pepek muka kau anjing https://t.co/OSaste1kZn,1474940217728,780581965435023360,3
133,MalachiS15,#debates,1474940217826,780581965846179841,3
134,kingjimmy1982,"Dear Clinton:If you have to give the middle class a bunch of free stuff to help them thrive,have you really made them thrive? #Debates",1474940218508,780581968706670592,3
135,SimrahAwan,I just can't get this grin off my face #debates,1474940218628,780581969209991169,3
136,EBryniarski,I feel so bad for Lester. Debates in my high school English class were more professional than this. #debates,1474940218634,780581969235156992,3
137,Jump_Mann,Why release his taxes that's his business.. Just like the 3500 email was yours ...hmm ain't you hiding shit too tho 🤔 #Debates,1474940218619,780581969172303872,3
138,emphyseema,Did Trump just admit he doesn't pay federal taxes and that makes him smart? #debates #Debates2016,1474940218536,780581968824135684,2
139,MDanWooldridge,"""something he's hiding"" too many questions about his past to trust him. #Debates",1474940218690,780581969470054401,3
140,bluegreg,"He's paid nothing.  ""Zero for troops, zero for vets, zero for schools.""  #debates #imwithher",1474940218422,780581968345989120,3
141,BurnsClarence11,@yellagirl02 this #debates is so silly they are just yelling at each other,1474940218752,780581969730019328,3
142,DanoSauter,This tax thing from Hillary is smart. Donny's response is exactly what she was hoping for.  #Debates,1474940218696,780581969495076864,3
143,MizarKey,At least Donald didn't delete his tax return. #debates,1474940218695,780581969490915328,3
144,modernskeptic1,yes hillary all indignant  #debates,1474940218731,780581969642094592,0
145,BlueMartee,"""that makes me smart” #Trump on not paying taxes like the rest of us #debates",1474940218633,780581969231052800,2
146,Mickolas9,"@realDonaldTrump right now is like ""fuck @HillaryClinton just caught me. fuck fuck fuck"" #debates",1474940218259,780581967662190592,3
147,StumpyRingFingr,God I miss Bernie. He would have been a hoot debating Trump #debates,1474940218721,780581969600012289,3
148,skategrace87,"Trump's slander campaign feeds we the people with ""crazy"" to confuse us #Debates",1474940218872,780581970233397249,3
149,KRobertKroeger1,#debates #debatenight Donald is getting mad. Not good. #Hillary is killing you on the taxes. Just release the damn taxes.,1474940218894,780581970325610496,2
150,Normanwildcat,"American people deserve to know why 33,000 emails were deleted too #debates",1474940219584,780581973219651584,3
151,DatLe,"Trump is raw, rough around the edges, but he just oozes fearlessness. Brash, misguided, but fearless. #Debates",1474940219547,780581973064454144,1
152,aMMPh,.@SandyChoiRadio on #Periscope: Watch me watch the #Debates https://t.co/CUHa2f4YcF,1474940219611,780581973332987904,3
153,KoriDonatsu,Got some popcorn for the #debatenight #debates https://t.co/nT4iaCgBmQ,1474940218870,780581970225012736,1
154,ChasingIssues,You'd know about hiding! #Debates,1474940219672,780581973588717568,3
155,benavidez_matt,#Debates #0EMAILS,1474940219723,780581973802627072,3
156,wokick1,@CNNPolitics what is going on with Trump #debates can't understand not thing with the constant sniffling while he speaking.,1474940219696,780581973689524224,3
157,3m3h3n,Lester wasn't interrupted. #FinishTwoDrinks #Debates,1474940219736,780581973857177602,3
158,sanchez_cl,"Trump endeudado y no paga impuestos, por eso oculta su declaración de impuestos. Directo al mentón lo puso @HillaryClinton . #debates",1474940219583,780581973215633409,1
159,Twistd_Chavo305,The Falcons are up 21-14 late in the second quarter.  #Debates,1474940219770,780581973999747075,3
160,CSLovely,"I don't want this crook ""investing"" in anything in my life. #NeverHillary https://t.co/74namjckNc",1474940219408,780581972481544192,3
161,sassychele,I hate both candidates #debates,1474940219589,780581973240770560,3
162,ErisRenee,Fucking Nixon did it. Jeebus. #debates https://t.co/QELXqFDrTG,1474940219680,780581973622390784,3
163,lul_papii,gone be drunkkkk 😂😩 https://t.co/lHSAmWRowY,1474940219643,780581973467226112,3
164,juanitasant_,I'd hold my hand out every time trump spoke.. know your place.  #Debates,1474940219683,780581973635043329,3
165,ThaJabberwock,"Im guessing that Hillary calling trump ""not rich"" will lead to a nice, frothy rage. #debates",1474940219757,780581973945384960,3
166,lgd8235,"she is a qualified, intelligent, competent leader who's ideas are just, moral, and  for the good of our country… https://t.co/0U36C9Qb30",1474940219380,780581972364128256,3
167,JeffreyMDavids1,We keep guess what was in her emails #Debates,1474940219776,780581974025052160,3
168,grimyglitter,i feel like lester #Debates,1474940219789,780581974079574016,3
169,gryr,The best thing about watching the #debates is that it makes me incredibly grateful for Norwegian politicians.,1474940219610,780581973328793600,2
170,LeeWhitneyHayek,And might we ask what Hillary is hiding? #debates #email #health #etc,1474940219692,780581973672820736,0
171,BeairshelleWNCN,'Who does he owe money to? He owes you the answer' Clinton about Trump tax releases #debates,1474940219897,780581974532427777,3
172,uglytruth556,"I would've said ""I will release my tax returns when you UNSEAL your Goldman Sachs speeches"". #DropMic #debatenight #debates",1474940219866,780581974402445312,3
173,davillafane,https://t.co/IVruCnFaIF,1474940220576,780581977380364288,3
174,RowanGrey,"Trump keeps adjusting his mic like, ""My intelligibility filter isn't working...""  #debates",1474940220619,780581977560940544,1
175,Wesc72,He's hiding? What about those deleted emails. She owes us the truth !! #debates,1474940220690,780581977858699264,3
176,SmashMasterShow,"TAX RETURNS
EMAILS
TAX RETURNS
EMAILS
TAX RETURNS
*smash cut to america like literally actually on fire*
EMAILS #debates",1474940220730,780581978026409984,3
177,JennGrapevine,"""There's something he's hiding"". Biggest understatement ever. HUGE. #Debates",1474940220611,780581977527296000,3
178,uiekazoo,#Trump just endorsed breaking our collective social contract. He is the Joker from Batman. #debates #trumptantrum,1474940220467,780581976923377665,3
179,ProudlyLiberal2,"Trump: Paying zero in taxes ""makes me smart"".  Yes, we should bear the burden for him. #debates",1474940220483,780581976990445568,2
180,sousatweets,Trump absolutely must be hiding something with his taxes. 100% #debates,1474940220506,780581977086984192,1
181,nadame96,"""That makes me smart""

No, that's tax evasion and that's a crime. 

#debates #ImWithHer",1474940220788,780581978269552641,2
182,SMahmoodKazmi,Trump has interrupted Hillary Clinton at least 14 times so far tonight. He doesn't represent gentlemen. #debates #debatenight,1474940220792,780581978286370816,1
183,tyleryz3,"Time to bring up the Clinton foundation @realDonaldTrump 
 #debates  #debatenight #Debates2016",1474940220777,780581978223448065,1
184,SammieDavis371,This debate is sexism at its finest #debates,1474940220733,780581978039083008,3
185,grjs,#Debates Talk about HIDING!! Come in Hillary.,1474940220808,780581978353520640,3
186,tiffintegra,Unemployment in Michigan is 4.5 percent; Ohio rate is 4.7 percent. Both are better than the national average of 4.9 percent. #debates,1474940220754,780581978127163392,3
187,Southviabirth,#ImWithHer #nevertrump https://t.co/oityyJ9JVP,1474940220720,780581977984475136,3
188,IamNeyski,What are you hiding? #Debates,1474940221672,780581981977321473,3
189,Echo__Chamber,DID HE JUST ADMIT TO NOT PAYING TAXES MY GOD WHAT #debates,1474940221625,780581981780402176,2
190,Calfort80,#debatenight #debates Trump know he lying about releasing his tax return.,1474940221685,780581982031876096,3
191,joyreaper,"Hillary's emails 30,000 missing.  If I had it to do over again I'd do it differently! 
 #Debates",1474940221629,780581981797097472,0
192,JessiMcmanis,They're both hiding things #Debates,1474940221673,780581981981642756,3
193,JohnnyFoxRox,*TURNS ON MASTER OF PUPPETS* #debates #debatenight #Debates2016 #HillarysBubble https://t.co/275fEwDcXp,1474940221211,780581980043874304,1
194,AlaynaChanel,YOU OWE THE WORLD ALL YOUR MONEY BITCH #debates,1474940221671,780581981973131265,1
