,screen_name,text,tweet_id,cluster_pred
0,shoychong,Provavelmente eles aplicaram a regra da Maggie Smith 🤔 mas eles foram ótimos tb kkkkkkkkk #Emmys,777689421940400128,3
1,MalashaMonique,Great live was not even all that tho . . . How ? #Emmys,777689422208770048,2
2,SuuhCarius,@Lavernecox TIRO 🔫🔫 linda demais  #Emmys,777689422229831681,3
3,rmagia,literally the whitest thing on TV directed by the whitest men. #Emmys,777689422208856064,3
4,opsdaanieel,CADE ESSA VAGABUNDA https://t.co/FeaXOoDhC2,777689421604851717,3
5,McTelevision,This is a category I don't really care about &amp; even I know #GreaseLive deserved to win. #Emmys,777689422716293120,2
6,Susana279714,totalmente yo #Emmys vamos  #GameofThrones https://t.co/cAfdsae7B5,777689421948735488,2
7,deontegib_13,They disrespecting the Lyon Dynasty https://t.co/jMjbUsW614,777689422426931200,3
8,lisa_steinicke,"Anytime now...&lt;3
#EmmyForMaslany #Emmys #Emmys2016 #orphanblack 
#CloneClub",777689422817071104,3
9,quiwcksilver,As bixa é poderosa https://t.co/qGBl9eEfRy,777689421919375360,3
10,Sam_Sam_Bam34,Baseball? #NatsFOTY1 https://t.co/r3T6jEEn5z,777689422472949765,3
11,chelseaadelaine,hahahahaha grease live just beat beyonce hahahhahahahahhaha #Emmys,777689423156801536,2
12,Vic_Stone1,"The ""Stranger Things"" kids stole the show at the #Emmys red carpet https://t.co/RvPwF1IJHY via @HuffPostEnt #StrangerThings",777689422288388097,3
13,abbygardner,The Grease guys better beware the wrath of #TheBeyhive. #Emmys,777689422804418560,2
14,lyndzaroo,Waiting for @Lin_Manuel's congratulatory tweet for Thomas Kail #Emmys,777689423345516544,1
15,rustyhatchell,"WHYYY?!?!? Absolutely not. Like, literally any other nominee is a better choice. #Emmys",777689423286771712,3
16,Pie_SocialMedia,Fuck the NRA. Be a Betsy. https://t.co/PvuiWO2A4i #Emmys #GoKnowControl #ThisIsNotTheEndOfOneDirection #XFactor #gunviolence  #momsdemand,777689423400071168,3
17,needhelppackin,Laverne Cox is slaying us all in that dress #Emmys,777689423525720064,0
18,okey_computer,Prêmio de look mais lacrador da noite https://t.co/2QhahuO1cR,777689422221418496,3
19,FeministRainbow,Grease live won over BEYONCE?!1? ARE YOU KIDDING ME!!! #Emmys,777689423572004864,2
20,itshueyy,Somewhere the door of a limo slammed and Beyoncé drove off #Emmys,777689423924322304,3
21,Misandryblanc,Suddenly there's a million things in my eye &amp; my allergies are acting up &amp; it's dusty &amp; I'm not crying you're crying https://t.co/s9BBPn4PsN,777689423282659328,3
22,deuseIena,posso falar a verdade? se rami malek nao ganhar o emmy eu vou fazer o maior escândalo #Emmys,777689426549964801,2
23,grownandcurvywo,Effing Grease Live won over Lemonade?!! FOH! #Emmys,777689426675785728,2
24,Leah617,I mean... Lemonade. But also Grease was directed within an inch of its life. So I don't know what I'm feeling. #Emmys,777689426495496192,2
25,Twario14,@jdavidhairworks Beyonce lost blah #Emmys,777689426625384452,0
26,IAmRoemello4,"Welp, that's 2 hours I'll never get back. #Emmys",777689426612871168,3
27,shutup_sal,Lmfao when Grease Live beats Beyoncé at the #Emmys uh huh,777689426868723712,2
28,JackieBrunoNECN,This was great! https://t.co/IYNdtxGXMo,777689426243837952,3
29,mijansen09,Laverne Cox is slaying my entire life on the #emmys right now 😍,777689426981945344,0
30,RobbieSherwood,Grease Live? For real? C'mon man. #Emmys,777689426855993344,2
31,goodfilm,#Emmys #GreaseLive  very... https://t.co/I9xm2L0oVb,777689425316868096,3
32,realityeo,I can't lie. I really enjoyed #GreaseLive Sorry Amy and Beyoncé. #Emmys,777689427028086784,2
33,EME_demujer,Kit Harington saca su lado más ocurrente presentando el Emmy a mejor programa de variedad #Emmys 😂 https://t.co/3Em9wUC3VX,777689426285780992,3
34,beingbrit89,TOMMY!!! #emmys  so happy !!,777689427254644736,1
35,mariacallzona,Laverne é muito maravilhosa #Emmys,777689427476971520,0
36,cafeaulazy,Wait Lemonade didn't win? Bedtime. #Emmys,777689426960920576,3
37,KelorHive,COMO ASSIM O LEMONADE PERDEU? #Emmys,777689427493711872,2
38,lovelyleann,I thought Grease Live was totally fun. Loved Boyz II Men. #Emmys,777689427028037632,2
39,Adibogodi,@AyoAdi you not watching the #Emmys?,777689426503749632,3
40,jennifervm,Grease Live beat Beyoncé? Where's Kanye when you need him? #Emmys,777689427669880832,2
41,atalija,Lembrando que Thomas Kail é HAMILTON nos #Emmys,777689427644649473,1
42,JessDorado,#Emmys 😊👏👏👏,777689427627900929,0
43,wallstvmx,#Emmys,777689427711787008,0
44,MissCaroline,@Lavernecox 🙌🏻😘❤️❤️❤️ #Emmys,777689427954970624,3
45,KtotheY1980,Wait what?! Grease Live won an Emmy?! #Emmys,777689427871145984,2
46,doliver8,As a musical theater and Beyonce fan I am so torn with this win #Emmys,777689430916071424,0
47,VaniiaQuezada,Laverne Cox !!  #Emmys,777689430631051264,0
48,New_Delia,Imperdível. https://t.co/QfnLdIi0P4,777689430270308352,3
49,MNMcCrary,Bey was robbed. #Emmys,777689430488473600,3
50,omelete,Grease Live leva o prêmio de Melhor Direção em Programa de Variedade! https://t.co/4jNSyshYcq #emmys https://t.co/GKrp8JJvJ3,777689429649612800,2
51,TYFofficial,"Congratulations, @GoGrease! #TYFEmmys #Emmys https://t.co/ktYYiroU28",777689429972516865,3
52,taylorcunning9,Laverne is glowing. Gold on gold on gold on beautiful gold hair. #Emmys,777689431528448000,3
53,CEOofGV,o @Meu_Lindo_  tbm tá na torcida pelo #Emmys de HOC,777689431482494976,3
54,ramimslek,enquanto isso vamo olha essas imagens do álbum de família #Emmys https://t.co/uLKVuZwhfj,777689429779636224,3
55,bestawittyfool,You know when the disaster Grease Live beats Lemonade it's fucking rigged #emmys #wtf,777689431537057792,2
56,hot995,Directing- Variety special : Grease! live #emmys,777689431478300672,2
57,mandamanda___,when grease live beats beyonce:  #Emmys https://t.co/7ain8xpzwM,777689430345736193,2
58,ssoderquist2202,🔥🔥 https://t.co/esbUaXaQNs,777689431708798976,3
59,adoreflatline,the DAB my children are cute https://t.co/MCBhRMRysa,777689431734005762,3
60,fillenthe_____,Lemonade should have won but TOMMY KAIL 😍 #Emmys,777689432291962880,1
61,lokibandida,beyonce sua burra pq n foi #Emmys,777689432459706372,0
62,bitchhjoao,Coitada da laverne ela queria tanto entregar esse prêmio pra beyonce #EMMYs,777689432187084800,0
63,snyd4848,"#Emmys John Oliver has more serious news than any cable channel, congrats.",777689433646698500,2
64,MJStarLover,How the fuck did Grease Live win over #Lemonade?!!! #Emmys,777689434745606145,2
65,airanalbino,"sou celebridade, pae. https://t.co/cwpJwXNCas",777689434296836096,3
66,CHillPR,Where is @kanyewest when you need him???!!!!! #Emmys 😮,777689434384953344,3
67,autumn_koin,"I think the #NutrishCat rocked the red carpet at the #Emmys.
https://t.co/6wwgwSC6di",777689434795958272,3
68,AlyssaTyson,Yaaas Queen!! @Lavernecox looking a stunning statuette. You go wom! #Emmys,777689435404062720,3
69,gosociallylive,".@violadavis - pretty in pink. 󾓑 #EMMYS 
#htgawm #tv #movies #film #sports #music #hiphop #singers... https://t.co/WqlTAX4Lar",777689435185876996,3
70,michaelcollado,At least we got a bit of a glimpse of Gina Rodriguez at the #Emmys https://t.co/dXf660jkqj,777689434598834176,3
71,WhoIsTreyMorgan,.@jimmykimmel switch from black to white tuxedo. Not much to see here. #Emmys https://t.co/oZs2bnlz0S,777689434129072128,3
72,elrincontv,Nos queda 1 hora por delante ¿Aguantáis sin dormiros? #Emmys #Emmys2016,777689436331073538,3
73,Xanderdash,#Emmys Grease won over Bey. Waits for twitter outbursts. https://t.co/LPgVqGLF8X,777689436259807232,2
74,larrysina,beyonce perdeu thau foi isso #Emmys,777689436846952449,3
75,_mercurialone,"We all knew Lemonade wasn't winning otherwise Beyoncé, The Queen, would have been present and accounted for. #Emmys",777689436423352321,2
76,Emily__Hirsch,Tommy kail for the win #Emmys,777689436943417344,1
77,agusparadis,lo mejor de los #Emmys hasta ahora fue Kit Harington,777689436918255626,1
78,LindsTeach1386,@Kel_Pac I know! Definitely one of the highlights tonight! #Emmys,777689437018787840,3
79,JDahbur,Hating is different than bullying  https://t.co/XJ1LkwmB4R,777689436708634624,3
80,Bizbee19,Thank you @chrisrock for that honest reaction! #Emmys,777689436561743872,3
81,thesoapoperaway,Grease Live was awful. 👀 #SorryNotSorry #Emmys,777689437446647808,2
82,MelinaAndreu,#Emmys #SarahPaulson Congrats 👏 @MsSarahPaulson,777689436993818624,3
83,writingvee,Beyoncé deserved that emmy #Emmys,777689437320912896,2
84,QueenNothing303,so Beyonce's not there. i didn't think she would be. #Emmys,777689438734385152,0
85,rita100rocha,Como assim beyonce nao ganhou #Emmys,777689438923153408,0
86,AlysiaSimone,Damn Laverne Cox went a wee bit overboard on the  gold body powder #Emmys,777689439359397891,0
87,hugodilaurentis,Como assim Lemonade ñ ganhou? #Emmys,777689439162228736,2
88,glaad,"""Give trans talent a shot!"" - @Lavernecox #Emmys #FeelTheVerne",777689439350947840,3
89,neyneyzone6,I just turned my TV off hfisksksjjw #Emmys #FUCKTHEEMMYS,777689438751170560,3
90,PatrickMalon,"Thanks Chris Rock, for the first honest reaction in awards show history. Or was it? #Emmys",777689439229341700,3
91,montsebernalg,"Grease Live! Ganó!!! Me están gustando mucho los Emmy de hoy, nadamás falta mi Game of Thrones y ya.

#Emmys",777689440080633860,3
92,coisasdaanablog,Melhor Direção em Especial de Variedades: Thomas Kail e Alex Rudzinski por Grease: Live!!! #Emmys #EmmyNaWarner,777689437748748288,1
93,RebelAStudios,So freaking adorable!  https://t.co/RlM3ZRYoCX,777689439728496640,3
94,emilyfinds,I'll never understand the appeal of Grease *shrug* #Emmys,777689440080764928,2
95,oyeponcho,#Emmys,777689440353292288,0
96,Boyntonrobin3,Who TF likes grease live.... lemonade was wayyyy better... #Emmys #Emmys2016 #Lemonade,777689440122642432,2
97,talktodenene,@Lavernecox Damn! You look beautiful #Emmys The body glow is so fab,777689440307208193,3
98,andrearalp,"Vai se fuder!!
Beyoncé rainha,o resto nadinha.
#Emmys",777689440433102849,3
99,tonianncanovaaa,Well now we know why Beyoncé decided she didn't want to grace people with her presence 😒 #Emmys,777689440433139712,3
100,BeyHarmony4,RAINHA MSMO #Emmys https://t.co/gLUtJMYATM,777689440244342784,3
101,purpwsr,LAVERNE É MARAVILHOSA #Emmys,777689440076570624,0
102,Melqqqq,BEYONCÉ VERGONHOSA HUMILHADA #Emmys,777689440609267712,3
103,T_Money84,Lmao at Chris Rock's face #Emmys,777689440714186754,3
104,kalaelarson,Y'ALL FUCKED UP #yonce #emmys,777689440764342272,3
105,corinne_mcg,Jimmy should have won. #Emmys https://t.co/g0Q6RdK00t,777689439850074113,3
106,tinchoortiz21,#EmmysPorWarner Esperando por las categorías de #GameofThrones y #BetterCallSaul disfrutando de los #Emmys desde Argentina!,777689440995119104,1
107,Bethany2357,YES TOMMY KAIL #Emmys,777689441062232065,1
108,_BunmiA,#Emmys  WHAT BEYONCÉ AINT BLOW UP CARA FO THIS,777689443289432065,3
109,natigoncalves,Coisa mais sexista esse #Emmys com um homenzinho segurando uma estatueta 🙄,777689443247554566,3
110,kimrossible,GO GREASE LIGHTNING #EMMYS,777689443469754368,2
111,AboutSgxbiebr,QUEEN B donde esta😩👑 #Emmys,777689443427688448,3
112,vanessaleigh4,But honestly I'm glad Beyonce didn't win. #Emmys,777689443356512256,0
113,AdrianaMarinSh,Por eso Beyoncé no fue. Jajajaja! Hasta Laverne Cox está decepcionada. #Emmys,777689443507531780,0
114,seleenalauren,grease live sucked bye #Emmys,777689443440484353,2
115,Tomatokill,"Ay, y yo que no me he visto Grease: Live. Muy atrasado Mauricio Gómez. 🙄 #Emmys",777689443729825794,2
116,sarahc792,HOW DID BEYONCÉ NOT WIN #Emmys,777689444098990081,3
117,rosiecip,I'm going to need a bat so I can destroy Grease Lightning #Emmys,777689444136656896,2
118,ECCultura,"En unos minutos los #Emmys se centran en la categoría dramática, en la que #JuegodeTronos aspira a repetir triunfo https://t.co/SL4QhtNos0",777689444170080256,3
119,SquadLeaderAce,"""Grease Live"" over BEYONCE? Let the internet explode! #Emmys",777689443708743684,2
120,JessPiercy11,STRANGER THINGS : 10/10 would recommend https://t.co/E5jZGvKWYe,777689443046154241,3
121,LordSamberg,Andy looked so good #Emmys,777689444677591040,3
122,TheBookOfObi,This is the only good use of the Glam cam I've ever seen at an award show. I want to hang out with them so bad. https://t.co/FBsRPKLg4G,777689443838914561,3
123,helloJalyce,LEMONADE OVER EVERYTHING 🙅🏾🙅🏾🙅🏾 #Emmys,777689444346388480,2
124,TheGameOfNerds,Grease Live! Won best directing in a Variety! #Emmys,777689444535140352,2
125,jimchap,"I'd rather shoot my toe off than watch Grease Live.
#Emmys",777689444145037314,2
126,realredmag,Mejor dirección de un show de variedad en los   #Emmys es #GreaseLive,777689444623093760,1
127,itsnotmarika,NO I love Grease but the Live version was just no #Emmys,777689444711297024,2
128,doctorwhowhovia,And on my way out Grease Live wins and #Emmys . YES! Love it!!! And NOW I'm out :),777689445034233856,2
129,SGirl2118,Jesus!!!! 👅💦 https://t.co/yavxbSXHIs,777689444564492288,3
130,brookcty,WHERE IS KANYE...LEMONADE SHOULD OF WON 🔪🔪🔪 #Emmys,777689445382262784,2
131,htgawmaddict__,Did y'all see Chris brown tho! 😂😩 #Emmys,777689445428494336,3
132,JavierVasquez85,Variety special directing winner: Grease Live #Emmys,777689447328428032,2
133,ohthatsbeyonce,What channel is the emmy's on😩😩 #Emmys,777689447127056384,2
134,Sk8j,WHERE IS KANYE RIGHT NOW?? #Emmys,777689447563272192,3
135,allisonsaiko,What a cutie!!!! Pissed he got snubbed https://t.co/Wlrz1Y4ksf,777689447135449089,3
136,HeroinaGuerrera,·#Yo siempre jajajja https://t.co/TpXbAkB63h,777689447345299456,3
137,G_Reelz,Grease Live! wins best directing for a variety special! beating out @Beyonce so they should hide now. #Emmys #Emmys2016 #beyonce #GreaseLive,777689447332667392,0
138,TheTwoCents,Outstanding Directing in a Variety Special goes to #GreaseLive!  #Emmys https://t.co/hb8g3sh60F,777689447643045888,3
139,EchoDoesRadio,I'm sure Laverne Cox's slayage is causing mixed emotions for straight men everywhere #Emmys,777689447743819780,0
140,taybrettl,I loved Grease Live and I don't care who knows it. #Emmys,777689448028917760,2
141,SacredWall,"Thomas Kail of ""Hamilton"" success wins the Emmy for directing ""Grease Live! #Emmys",777689448142163968,1
142,lanewilliamson,Tommy Kail just beat Beyoncé... #Emmys,777689447706034176,1
143,colastrom_,Laverne Cox faz meu coração bater mais rápido #Emmys,777689447550812160,0
144,FightJamesFight,🙌🏻🙌🏻🙌🏻🙌🏻 https://t.co/DJ6h8QzNyq,777689447416475648,3
145,dinahlawrel,A MULHEE FALOU JULIANA HOUGH KDKDJDKD eh julianne hough meu AMOR #Emmys,777689448087773185,3
146,Forest__Blues,Time to turn the tv off #Emmys,777689448289079296,3
147,jasonsproblem,That bitch!!! https://t.co/TQbeRkZ8Sn,777689447857086464,3
148,Cookiebaby23,Grease Live won?! #Emmys https://t.co/30d41zmaLV,777689447789985792,2
149,romper,WHAT?! #emmys https://t.co/9GIPk7Ml1L,777689446091284480,3
150,GabeGalindez,#LaverneCox stunning in gold. #Emmys,777689448289038336,3
151,isspanda,Awwww sorry bebe @twhiddleston . But Vance &amp; Gooding Jr. are more deserving. Great series 👏🏻 #PeoplevsOJSimpson https://t.co/ny33PuE3jX,777689447760404481,3
152,MariaBrittoF,"Get Chris Rock's reaction on a gif asap please 
#Emmys",777689448532279297,3
153,SophiaNugget,#Beyonce didn't win?!... Where's #Kanye when you need him!?! #Emmys #Emmys2016,777689448351948800,0
154,yupCarol,Laverne Cox é tão maravilhosa q maravilhosa não é suficiente p qualificar mdsssss #Emmys,777689448301690880,0
155,ewintGda,Ver el boomerang de @emiliaclarke yendo a los #Emmys fue lo mejor de este puente ❤️,777689448733483012,1
156,jpu87,Geniosss!!! https://t.co/ChZ8UKym4w,777689448142233600,3
157,thatgirljoannuh,They look good together. I ship them!! 💕 sorry Rose ✌ https://t.co/4NaTxalh6l,777689448653819906,3
158,Terrysagirl,"I don't want to judge but if you don't like Matt Damon, you're probably a despicable excuse for a human being.
#Emmys",777689449123635200,3
159,_rdl007,Clare  Danes deserve a award goddamt #Emmys,777689451640172544,2
160,karelyntesouro,The King and Queen #targaryens  #GameofThrones #Emmys https://t.co/1piqG0dwWd,777689450721734656,3
161,ayyy_fig,TOMMY WON THE EMMY IM CRYING ~Look at my son~ #Emmys,777689452030201856,1
162,DrameSheikh,#Emmys you are fucked up😒😒😒😒,777689451904598016,3
163,yungug1y,I wish I could shine and glitter like Laverne Cox... #Emmys,777689452600696832,0
164,stfukae,#Emmys I THOUGHT SHE WAS GONNA GIVE IT TO BEY. THAT WOUILD BE PERFECT,777689452458156034,3
165,ReporterReed,What?? #Lemonde didn't pull that over Grease? #Emmys https://t.co/NZVtgACHjm,777689451715637248,3
166,JY26,If Beyonce would've won.... 😮😳 #Emmys,777689452697313280,0
167,rachelmarotta,Beyonce punk'd all of us #Emmys #Emmys2016,777689452881780740,0
168,_Galaxyof_Harri,But Grease Live wasn't even that good...😒 #Emmys,777689452483190784,2
169,penedix,"Emmy e dê vexemmy
#Emmys #Emmys2016",777689452974108672,0
170,AbilLovesRubius,Tengo que dormir pero acá edtoy viendo los #Emmys,777689452563075072,1
171,MallieRydzik,How is the direction on award shows any competition with something like Grease Live? #Emmys,777689453154471936,2
172,orramos,Graaaaan momento de Kimmel. https://t.co/LzLWU40sta,777689453133299713,3
173,ShadeOfLemonade,#Emmys https://t.co/lati5PiDhx,777689452386906112,3
174,OkSillyInk,Jon Mayer playing you off. What it's like to win and lose all at once. #Emmys,777689453821239296,3
175,TheRedWineGal,"I had no clue #ChrisRock directed #AmySchumer's special. Wow!!! 
Bummer he didn't win #Emmys",777689453917720577,3
176,cheersashley,Tommy Kail with the #Emmys for Grease Live!,777689455545159680,1
177,hoyCinema,#Emmys mejor dirección de programa de variedades para Thomas Kail y Alex Rudzinski por #GreaseLive,777689455230681088,1
178,leapessanha,MAS GREASE GANHOU E EU TO FELIZ #Emmys,777689455842975744,2
179,TMSJay,"Directing in a variety special, @GoGrease: Live. Not surprised -- clever staging -- but would have loved to see @Adele special win. #Emmys",777689455494848512,2
180,Lisa_NGTV,Grease live? Really? #snore #Emmys,777689456572637184,2
181,gracieeepro,"Beyoncé didn't win, see thats were you went wrong. #Emmys",777689456421724160,3
182,Kerrin_N_Coke,Grease Live beat the POTUS... and Beyonce? TF are y'all doing over there?! #Emmys,777689456602189825,2
183,mia_claire,Tommy Kail!!!!! @HamiltonMusical @Lin_Manuel #Emmys,777689456052727808,1
184,unel,"👉 Jasa Tambah Follower Twitter dan Instagram 👻 List Harga Baca di www[.]followback[.]net tanpa tanda kurung
 ~ #Emmys ~ 57",777689456543272960,3
185,coolbreeeze_,Grease Live over Lemonade? hm. #Emmys,777689456987869185,2
186,CostaMellina,lorde de winterfell &lt;3 https://t.co/3xYHjWedoI,777689456451194880,3
187,KwalityPro,I voted for #MrRobot to win ‘Outstanding Drama Series’ at the 2016 #Emmys. Place your vote with @OSN. https://t.co/AtAPFVszIR,777689456644067328,3
188,alexmalgat8,"Incredibly happy for @pattonoswalt on the Emmy win, richly deserved. Bring a speech for next year! #Emmys",777689456736366592,3
189,Matine_CineTV,'Grease Live' levou o prêmio de direção em programa de variedade! Parabéns! #Emmys #EmmyNaWarner,777689456958726145,2
190,chelsea_hunter,"Where do I buy these guys from? I want the full set, but. https://t.co/1mf6bMY8eP",777689456790769664,3
191,dan_quiterio,Tommy Kail is getting used to that awards stage. #Emmys #Hamilton,777689457659154432,1
192,TomatazosCom,Mejor Dirección (Especial de Variedad): #GreaseLive. #Emmys https://t.co/qHqKZMKEuQ,777689452835696640,1
193,JacksonEric,Nice to see some #Emmys love for #GreaseLive.  So well-deserved!  Fantastic production.,777689457919193089,2
194,justjenae,Omg😂 https://t.co/b5ePJ9MdJQ,777689458204291072,3
195,itsjustOriena,YOOOOO TOMMY KAIL NAILING IT!!!! YAS FOR #GREASELIVE AND THE GENIUS OF TOMMY #Emmys,777689458229534720,1
196,heavyglitter,😍✨✨ https://t.co/ZnJ6cncwyf,777689460142211072,3
197,TheDailySampler,The Beyhive is going to destroy those two guys. #Emmys,777689460284809221,3
198,tortor1522,Oh man...Grease Live beat out Beyonce?! #Emmys,777689460209319936,2
199,pwilson720,#Emmys #Emmys2016 Theater!!!,777689460561575940,3
200,BeyonceRoyalty,Beyoncé perdeu o prêmio que concorria #Emmys https://t.co/qXROuIHA5h,777689459642994688,3
201,HargitayRizzles,How did Grease Live beat out Beyonce? I don't understand #Emmys,777689460410617856,0
202,txsxe,Laverne Cox sana aşığım #Emmys,777689460695822336,0
203,_CONeill03,.@Lavernecox is so luminous. Goregous. #Emmys,777689460620292096,3
204,nenetuittero,"Madre mía, esta chica es trans. Joder el cirujano 

#Emmys https://t.co/kH33Vb22g4",777689459638829056,3
205,eddieolmos_,Yes grease live deserves it. Alex is a great director #Emmys,777689460511088640,2
206,eonlinebrasil,Abaixa que é tiro! Laverne Cox matando a gente do coração com tanta maravilhosidade! #TapeteVermelhoE no #Emmys https://t.co/CXL7K4ccMx,777689458217017344,0
207,mayradgp,YAS GREASE LIVE 😍 #Emmys,777689460922286080,2
208,miamia697,#Emmys the beyhive is gonna be pissed https://t.co/wdOqDxOfrI,777689460972490752,3
209,peevovarcheck,Grease Live! vs. Lemonade is going to tear the gay community apart #Emmys,777689461899440128,2
210,geisyassis,"Já posso dormir, devolve o tempo que eu perdi aqui #Emmys",777689461429833729,1
211,paulasoup,Are the @AcademyAwardHD taking notes re: what diversity looks like during an awards show?  #Emmys,777689461404602369,3
212,CanoninCb,Man naw lol https://t.co/EUlPH9M5tk,777689461207425024,3
213,DarrellDass,"@Lavernecox is statuesque &amp; slaying! 
@OITNB @RockyHorrorFOX @TheEmmys #LaverneCox #Emmys",777689462113464321,3
214,JustJoya,"Yay, #GreaseLive! Congrats Paramount TV #Emmys",777689462771810305,3
215,JessikaWalsten,Anyone counting how many times Gary Newman and Dana Walden have been thanked? #Emmys,777689462406991872,2
216,revealingmia,I really need to understand how Grease Live beat Lemonade. EXPLAIN THIS TO ME LIKE I'M FIVE!?!?!?!? #Emmys,777689464105820162,2
217,MasOlhaJa,"Winter is coming! Game of Thrones is my choice for best drama series in @CoxComm's #Emmys poll!
https://t.co/VrOPyj0nGI",777689463510147072,3
218,JovonnieB,Beyoncé knew she wasn't going to win! That's why her ass didn't show up! #Emmys https://t.co/0POF1E4msO,777689463602475008,2
219,Kerri_Lauren,TOMMY KAIL!!!!! #GreaseLive #Emmys,777689464462315520,1
220,tristyn_wilm,Grease Live blew me away! So happy it won https://t.co/RUXosAnQk5,777689464483164160,2
221,jodmentum,#Grease? Whuh? It's not the word. #Lemonade is the word. #Emmys,777689464592224259,2
222,BoyandPiano,"Damn. I wasn't just rooting for Beyoncé, I was also rooting for Laverne Cox's giving an award to Beyoncé.

#Emmys",777689463732436992,0
223,LegendaryLPF,!! Another #GreaseLive #Emmys win! 😊,777689464348942336,1
224,matiasvafi,Lo único que pido es que Game of Thrones NO GANE como Mejor Serie Dramática #Emmys,777689465083027457,1
225,Tamfavor,Bey lost 😭 #Emmys https://t.co/pGmALiPR4o,777689463308767232,3
226,WIF_LosAngeles,"""Give trans talent a shot! I would not be here tonight if someone hadn’t given me a chance.""
—@Lavernecox #Emmys #JenjiKohan #QueerStories",777689464860610560,3
227,isabelleariane_,n consigo lidar https://t.co/DpmjHaQLmm,777689464772653056,3
228,MorganicInk,❤️❤️❤️❤️ #baegoals #Emmys  https://t.co/QNPOnXoM1M,777689464969625600,3
229,nicholaisays,The #Emmys denied Laverne Cox the opportunity to crown Beyoncé. Godspeed.,777689465087229952,0
230,stylinsonhonor,"Nunca achei que diria isso na minha vida, mas Bey perdeu... é até estranho ""Beyonce"" e ""perdeu"" na mesma frase  #Emmys",777689465452109824,3
231,paperheartsmx,Uh la Beyhive se va a enojar #Emmys,777689465544323072,3
232,BrittanyActs,SLAY @Lavernecox!!!! #Emmys,777689465271836672,3
233,enwmyfire,MEUS NAMORANO JAKE PERALTAE JAO DAS NEVE https://t.co/mYooYi7eCR,777689465145925632,3
234,miss_lisabrooke,Yaaaay!!! #GreaseLive #emmys,777689468417503232,1
235,DizzleOnTwizzle,Beyoncé got robbed.  Grease live?!?! 🍋🍋🍋 #Emmys,777689468463644672,2
236,DiarioElPeruano,#Emmys Mejor dirección para serie de variedades: Thomas Kail y Alex Rudzinski,777689468107100160,1
237,gomzofthrones,QUE MULHER #Emmys https://t.co/Np890jwF6h,777689467205324800,1
238,FedeDiGG,"GREASE LIVE VINCE AARON TI PREGO COMPARI E FAMMI UN DUETTO CON JOHN TRAVOLTA NON CHIEDO TANTO

#Emmys",777689468182597633,2
239,KaitlynStanley,The only time I'll wish that Kanye was in the building #Emmys #lemonade,777689468002193408,3
240,ninatypewriter,"Directing, Variety Special ~ GREASE LIVE
#Emmys #Emmys2016",777689468329394176,2
241,candeagain,laverne cox !!! #Emmys https://t.co/HCyn2OJUsk,777689468027502592,0
242,domferrara5,"So, Tommy Kail is officially an #Emmys winner!!!!! #Hamilton",777689468547588098,1
243,HMLomi,Guuurl I know you were ready to do the Formation coreography! I love youuuuu @Lavernecox #Emmys,777689468908306432,3
244,carollani,"Imma let you finish, guys from Grease Live, but... #Emmys #Beyoncé",777689469315014656,2
245,BlazingEyes,@Beyonce was robbed. #Lemonade #Emmys,777689469289836545,0
246,4everAwake1,My mommy 😘 #Emmys https://t.co/arLvhecECG,777689468992118784,3
247,YoursTrulyBeee,When they give the performance to Grease over Lemonade #Emmys *waiting for the Bey stans* https://t.co/INSveHLHix,777689468044242944,2
248,BIGGYshortee,Stunning https://t.co/gNgYAaEObi,777689469122207744,3
249,karlosandrefs,WTF!!! Greese ganhou de Lemonade!? Que merda é essa... #Emmys,777689469583491072,2
250,Isiahmmiller,When Beyoncè doesnt win #Emmys #Emmys2016 https://t.co/mWzD2AgdYx,777689468455096320,3
251,azsportsguy,Wow.  Way to go all out for the applause on that award.  #Emmys,777689469738627072,3
252,vicmtorresc,Tatiana Maslany já ganhou o #Emmys dela???,777689469642219520,3
