,screen_name,text,timestamp,tweet_id,cluster_pred
188,kindadistracted,Advice to @realDonaldtrump: Finish one sentence before you start another. #Debates,1474940395674,780582711794761728,1
189,jaxster3,Absolutely glorious!!!!!! https://t.co/VT7e0WfP1k,1474940395630,780582711610138628,0
190,taephitty,Is bragadocious a word? #Debates2016 #debates,1474940395717,780582711975038976,0
191,Tayylorrr4,"Tax returns or not, the smug look on Clintons face is because stolen money from her ""charity"" doesn't get taxed. #debates #debate2016",1474940395697,780582711891070977,1
192,mukupamulo,I think Trump FAKE talk talk is a collection of 99 worst liars brought together in one casino. #Debates,1474940395689,780582711857713152,0
193,ijimba,Taxes is personal and email is national security  #Debates,1474940395779,780582712235008001,1
194,In_bel_Air,#Debates the hail is donald talking about?😂,1474940395728,780582712021254157,1
195,SoSeaEmerald,"So far, Trump attacks Clinton's emails &amp;uses blanket statements on her previous politics. Clinton attacks Trump's taxes &amp; company. #debates",1474940395702,780582711912083456,0
196,theBenEstes,Yes airports! Finally the issues people care about. #facepalm #pleasestop #debates #Debates2016,1474940395767,780582712184754178,1
197,miguelurreab,"#debates #debates2016 Trump: ""La infraestructura de EEUU es del tercer mundo""  :o 👅😜😥😭 😨😱😰",1474940395573,780582711371112448,1
198,NomadCram,"Donald Trump  ""I am so smart. S M R T"" 

#debates #debatenight #Debates2016 https://t.co/XNKOytR0Mp",1474940395381,780582710565822464,0
199,AleciaConway3,I just told @nbcwashington who I think is winning. Cast your vote now! #Debates #NBC4DC https://t.co/ui3O6Wru6N,1474940395654,780582711710756864,0
200,sarahrlehrer,"sitting in my room, about to go tune into the #Debates when i hear my mom go ""YOU'RE NOT SAYING ANYTHING!!"" from the other side of the house",1474940396754,780582716324532224,1
201,accidentalhippy,Well...large debt burdens kinda happen w/wars of choice &amp; excess tax breaks for the upper class. #debates,1474940396566,780582715535921153,1
202,JonathanWax123,"#debates @JoyAnnReid wow, Trump is just making an ass out of himself",1474940396746,780582716290895872,1
203,TallGuySchmidt,"boyyyy, that sniper is taking an awful long time to load...
#debates",1474940396703,780582716110696448,0
204,altbritannia,Well done Hillary you've beaten down the Despot a few pegs #Debates,1474940396748,780582716299415552,0
205,MEschRadtke,"Only she's lying through her teeth.
But so's he.
#LoseLose 👎🏼👎🏼 https://t.co/s8FxmtyN8t",1474940396705,780582716118999041,0
206,DemonBara,Third world country?! BECAUSE OF OUR AIRPORTS?! #debates,1474940396712,780582716148330496,1
207,keylolo914,Donald's all over the place. Expected nothing less smh #Debates2016 #DebateNight #debates https://t.co/GNzlribf7J,1474940396425,780582714944675840,0
208,sethwstewart,"We've had the ""at least I have"" argument. Who's is going throw out ""I know you are but what am I"" line?  #debates",1474940396576,780582715577999360,1
209,politics_r_dumb,#dicksout for this debate because rip in peace america #Debates,1474940396773,780582716404301824,1
210,_h0ffm4nn_,"@realDonaldTrump ""We have become a Third World Country"". Great display of pride in your country. No, really #debates #debatenight",1474940396709,780582716135841793,1
211,MorgansWildRide,"Go Google Image ""3rd World Country Airport"" - I dare you! #debates",1474940396767,780582716378980352,1
212,gidaltiasoto,"""This country needs someone who needs to know how to handle money""-Trump and umm wat make u think tht should be u😒 #Debates",1474940397592,780582719839408130,1
213,pashionhodges,WHAT THIRD WORLD COUNTRY HAS HE BEEN TO TO COMPARE AND CONTRAST?? #debates #airports,1474940397472,780582719336034307,1
214,acacias_mom,We don't have the money because people don't pay taxes @realDonaldTrump #debates,1474940397624,780582719973527553,1
215,Humanitarian66,"""A report that I just saw"" - is that this you cite when you file ""a financial form of sorts""? #debates",1474940397694,780582720267255809,1
216,lankinomusic,"""Third World""? Showing his age there. #debates",1474940397748,780582720493674496,1
217,vna43,AIR PORTS ARE FROM ZIMBABWE #3rdworldcountry #debates,1474940397662,780582720133066753,1
218,hyphykeeks,For fucking reaallss😂 https://t.co/DUvCRa7YSN,1474940397681,780582720212656128,0
219,tweet_elva,We're a third world country Donald???? This guy is more deluded than I thought.  #ImWithHer #Debates,1474940397566,780582719730229248,1
220,snark_princess,Trump isn't even making any damn sense. #debates,1474940397530,780582719579357185,0
221,MrsCourtneyP,"Ah, yes. Airports. The mark of our country's success. #debates",1474940397639,780582720036544512,1
222,larissal333,This just in..the airports are Hilary's fault too. What next Donald? Global warming is all from Hillarys emails? #Debates,1474940397651,780582720086937601,1
223,mov_ayacucho,https://t.co/NISm5vPMLp Hablando claro. Se les hunde el barco https://t.co/zothUzrrkB y tuitean #YoMeDeclaroEnDesobediencia S.O.S #debates,1474940397603,780582719885611008,0
224,aprlroz,What is the actual topic right now? I've lost track... #debates,1474940397709,780582720330166272,1
225,mymyoomy,So airports determine whether a country is 3rd world? 🤔 #debates,1474940397691,780582720254644224,1
226,GoldingGirl617,Come in from China? Really? Wasn't Trump just shading China. #Debates,1474940397769,780582720581828608,1
227,retirprmill,A government worker would be fired. #Debates,1474940397650,780582720082702336,0
228,newshoundbrown,Woah. That's a thing that's happening.... https://t.co/0BtjXTB7gE,1474940397630,780582719998791681,0
229,SilentTTR,This is just insane. #debates,1474940397716,780582720359522304,1
230,kenkanobi25,#debates I cannot listen to this ego manic I heard nothing yet  gave up waiting,1474940397777,780582720615383040,0
231,jennesworld,This is the best tweet #debates #Debates2016 https://t.co/VdOEdKp7FC,1474940398520,780582723731750912,0
232,Linksofme2,#debatenight #debates not paying my taxes #makesmesmart,1474940398202,780582722397999104,1
233,Jasooner1,Damn Hillary hitm#Debates,1474940398588,780582724016812032,0
234,SueRealeKidney,#bragadocious yup #debates,1474940398671,780582724364963840,1
235,Morgan8304,Anyone who thinks it would be a good idea to put this ridiculous man in the White House needs to have their head examined. #Debates,1474940398558,780582723891134464,1
236,TheNotoriousNME,We're a debtor nation because of the #GOP #NeverTrump #debates,1474940398634,780582724209872897,0
237,allenonline247,"if Trump thinks the US is a third world country, i wonder what he thinks of the Philippines? 

#Debates",1474940398749,780582724692127744,1
238,markhenely,Donald Trump is sick and tired of our airports not being fancy enough! #debates #debatenight,1474940398619,780582724147052546,1
239,spiceislandman,#debates but where is the tax return.  Maybe your taxes will help rebuild  them Donald,1474940398702,780582724495110144,1
240,ConnerWS,SHOTS FIRED #debatenight #debates #Debates2016,1474940398672,780582724369125376,0
241,rahafiz83,they are talking about america's debt but still donate trillion of money to israel. #Debates,1474940398689,780582724440428549,1
242,mydailywalk,Was that an admission Donald? #Debates,1474940398771,780582724784549888,1
243,dee_ambrosini,"Yes, our airports are horrible compared to overseas. Thanks to your republican cohorts. #debatenight #debates #Debates2016",1474940398792,780582724872527872,1
244,tylerscactuss,"""BRAGADOCIOUS"" Donald trump *POSSIBLE* future president of the United States of America #debates #DebatesNight",1474940398752,780582724704800768,1
245,LianneMH,A list of banks?!? Is this a joke?! Get off the stage clown! #debatenight #debates #Debates2016,1474940398787,780582724851666944,0
246,Gno85,"When the regular people make mistakes they paid the $ ,but when deep pockets , crooked politicians do they get a slap on the hand.  #Debates",1474940399613,780582728316121088,1
247,Jacobs_World,@StefanMolyneux she says it's a classic bait and switch and then never talks about her emails. Fucking lol #debates,1474940399558,780582728085405698,1
248,litebeaner,"I don't think either is really wrangling in those undecideds yet, but it's not over #Debates",1474940399701,780582728685105152,1
249,bethrevis,He did NOT deny that he doesn't pay income taxes. HE DID NOT. #debates,1474940399639,780582728425148416,1
250,Sharmila82,"Clinton: ""Trump paid no federal income tax.""

Trump: ""That makes me smart.""

SMH!!!! #DebateNight #debates #PresidentialDebate",1474940399570,780582728135770113,1
251,LovesEmpoleon,Trump how about you squander your face into a wall. #debates,1474940399655,780582728492257280,0
252,TheRealGCK,So happy Trump wants to change this country and make it great again #Debates,1474940399685,780582728617963520,1
253,Zefareu,"He thinks America is a third world country. Hear that, rest of the world? #DEBATES",1474940399574,780582728152473604,1
254,M_Racz,Trump saying the same old same old #debatenight #Debates2016 #debates,1474940399692,780582728647475200,0
255,CourtFlower,WTF does airports have to do with anything??? *Rambling* #Debates,1474940399593,780582728232165377,1
256,jessie_frick,"Dear Trump, I don't give a shit how much money you have/have made. I care about your ability to lead. So tell me about that please #debates",1474940399712,780582728731234304,1
257,LettyBKNY,Braggodacious let's look that up. #Debates2016  #Debates,1474940399716,780582728748138496,0
258,ilve2sing,I think neither of them should president! #debates @ingridnilsen,1474940399527,780582727955390464,1
259,pottstrouble,Trump is talking loud and not saying anything  #debates,1474940399622,780582728353845248,1
260,SAPL,All these things paid by taxes #Debates,1474940399676,780582728580358144,1
261,RenayCrowe,braggadocious #Debates,1474940399589,780582728215310336,0
262,TheChloeDawn,I learned a new word tonight: braggadocios. #debates,1474940399652,780582728479760385,0
263,calg04,Yea yea we know so whats your plan trump #Debates,1474940399715,780582728743858176,0
264,Lumbergh88,#HillaryForPrison2016 #debatenight #debates,1474940399315,780582727066214400,0
265,TheCatCampbell,"""serious deader nation"" is my new band name #debates",1474940399756,780582728915902464,0
266,The_Mike_D,Herbert Hoover had a ton of money.  He led us into the Great Depression. #Debates,1474940399768,780582728966078464,0
267,josetav92,What report  #Debates,1474940400697,780582732862586880,1
268,__Pantha,How Trump HOW. #Debates,1474940400715,780582732938162176,1
269,darealgreglopez,I can understand being in debt 9 trillion dollars if our country was in good shape @realDonaldTrump  #Debates,1474940400693,780582732845883392,1
270,marikatogo,Did he really just call the United States a third world country? #debates #debatenight https://t.co/MjR2EhmhBW,1474940400401,780582731621265408,1
271,Ammie508,Trump all but admits he hasn't paid taxes. #debates #debatenight,1474940400675,780582732770467841,1
272,D34D1337P00L,Why Trump talking about things needing to be built when he buildings things? #conflictofintrest #debates,1474940400755,780582733105856512,1
273,noah_emma4,Only fear no solution trump. Trump car sales man #Debates,1474940400800,780582733294608385,1
274,gigiho,And did Trump just say and think that being audited every year for 15 years is normal?! #debates,1474940400732,780582733009473540,1
275,ericvale,"I don't know for sure about the murders, but if he can make up insane shit so can I. #Debates",1474940400827,780582733407924224,1
276,a_ditk,"All of Trump's answers tonight, basically... #debates #debatenight https://t.co/vfb6b5Km6z",1474940400028,780582730056790021,0
277,_beanzzz,What does the way LAX look like have to do with submitting your tax return🤔🤔🤔 #debates,1474940400657,780582732694822912,1
278,ElliePepper3,"China, China, China #debatenight #debates",1474940400859,780582733542150144,0
279,oni_mb,#braggadocious oh i see #Debates,1474940400868,780582733579816960,0
280,reelmoments1,"so not paying any federal taxes is ""smart"" so millions of Americans who paid taxes are just dumb according to Trump #debates",1474940400957,780582733953265664,1
281,YFlix,Wow. Third world country... #Claim.  #Debates,1474940401686,780582737010827265,1
282,jillianlare,"I wish someone would fact check the existence of some of Trump's vocabulary...like ""bigly (biggly)"" and ""bragadocious"". #debates",1474940401631,780582736780070913,0
283,RogueLeader42,Oof. Clinton: 1 Trump: 0 #Debates,1474940401581,780582736570552320,1
284,rdarling42,"My two fav things about the #debates , ""braggadocious"" and ""trumped up trickle down"" hahahaha ""braggadocious"" lol",1474940401540,780582736398385152,0
285,therealezway,"Hey Trump, Dubai isn’t a country and China isn’t a third world country. #ImWithHer #SheWon #debates",1474940401674,780582736960557056,1
286,springbreeze227,#Debates new fake tan,1474940401656,780582736885153792,0
287,JWW69,you chose to serve a sand nigger president https://t.co/KmraICzPFn,1474940401646,780582736843018240,0
288,stefdeal,"Whoa, Trump learned other country names besides Mexico and China. Kudos Qatar and Dubai (which is actually a city in UAE). #debates",1474940401521,780582736318697472,1
289,PCBSHUTTLETAXI,you chose to serve a sand nigger president https://t.co/eVOtjalbFt,1474940401652,780582736868155392,0
290,EthanRitz,"@DonaldJTrumpJr I ask a practical question: when was the last time you used the commercial terminals at LGA, LAX and EWR? #debates",1474940401281,780582735312150528,0
291,c_fick1,This is more like drama tv than a debate #Debates,1474940401771,780582737367343104,1
292,mgsiegler,Puppy dogs can fly according to ...a report I just saw. #debates,1474940401760,780582737321222144,1
293,lany891,He just followed the laws made by lifelong politicians like hillary https://t.co/3pe65bfzzR,1474940401206,780582734997716994,0
294,SheKnowsMedia,"The #HatchKids are watching the #debates tonight too! Tomorrow, get Gen Z's take on @HillaryClinton and… https://t.co/se1TnWaIG5",1474940401442,780582735987572736,0
295,CarlosRR_,Que mala traducción de @CNNEE @CNNMex  y las voces son = #VotoLatino #DebatePresidencial #DebateNight  #Debates2016  #debatenight  #debates,1474940401718,780582737144983552,0
296,SensiblySecular,"Damn straight we're a 3rd world country in the making. Know what'll fix that? #FightFor15 #CleanEnergy #ACA 

#debatenight #debates",1474940401761,780582737325547520,1
297,Tike_Le,"Trump can't decide on a number, but he thinks the number you're thinking of is 6. Is 6 your number? #debates",1474940401750,780582737279262721,0
298,Lord_Kingsley,Drumpf thinks you live in a 3rd World Country. #Debates,1474940401439,780582735974760448,1
299,JarodKintz1,#Debates Hillary doesn't want to spend tax dollars repairing our infrastructure. She wants to use that money to destroy other countries.,1474940402673,780582741150576640,1
300,jhaaythehaay,so why am i almost sure that third world countries don't even have freaking have airports #Debates,1474940402682,780582741188366336,1
301,Guilt_Free_Life,I'm sorry is the man who doesn't pay taxes complaining about crumbling infrastructure? #debates,1474940402574,780582740735369216,1
302,MC013,Trump saying he's not braggadocios  but rather he should be president because he knows how to handle money #Debates,1474940402509,780582740462755841,0
303,Richard_Scholl,Airports built by slaves there Donnie! #debates,1474940402442,780582740181782528,1
304,JTdobilas,What's going on. #Debates 🕴,1474940402732,780582741397995521,1
305,bungalevista,I'd just like to point out that Clinton did not answer the e-mail question until Lester Holt reminded her of it. #Debates,1474940402800,780582741683253248,1
306,Givenb_,"Lol! Donald Trump: ""We've become a 3rd world country"" #debates",1474940402807,780582741712723969,1
307,hofthefields,#Debates #Debates2016 https://t.co/7drz6AAVRO,1474940402596,780582740827615232,0
308,focusfoxx,Donald. We are not a third world country. Come on. #debates #Debates2016,1474940402701,780582741267972096,1
309,ClintBollinger,"Trump could have excoriated Her on email scandal, left it on the table. #trumpfail #debates",1474940402650,780582741054197760,0
310,technomics1,Third world country airport. Irrelevant to the issues are being discussed.  #Debates,1474940402768,780582741549027328,1
311,alli_gahan,"Who cares about airports when people can't feed their kids, afford day care or get medical care?  #Debates",1474940402840,780582741851017216,1
312,Ayenne_R,"#debates #debatenight If your taxes are boring, why not release them Donald J. Trump? What are you hiding?",1474940402741,780582741435936769,1
313,katiapatakss,I feel like I'm being mind fucked by a quick change artist.... what is he even saying and how did he get there #debates,1474940403396,780582744183177220,1
314,MarcInSF415,Did he really just refer to the US as a third world country? So what's he's really saying is #america is beneath him #Debates,1474940403726,780582745567141888,1
315,danita0053,"I can give you a list of banks, too. And it would tell you as much about my income. (And I'm not being bragadocious, either.) #debates",1474940403562,780582744879312898,0
316,Seamus_Mullan,Trump basically admitted he doesn't pay taxes #debates,1474940403628,780582745156136960,1
317,speakupdeepak,So if I pay federal taxes...does that make me stupid? #debates,1474940403584,780582744971735040,1
318,Tspinnerchaser,@slone @noltenc @seanhannity @KateHyde55  #debates she would squander his income just as fast,1474940403604,780582745055436800,0
319,DahliaBellona,"""I take responsibility for it."" Yeah, proven fact she got away with not being prosecuted and destroyed evidence is… https://t.co/RpdGcFd89h",1474940403449,780582744405512193,0
320,kt_spain,Trump needs help... Send him a Webster Dictionary and Adderall #debates,1474940403487,780582744564850688,1
321,Tykeez,YESSSSS Hillary with the taxes shot. #Debatenight  #Debates  #Debates2016,1474940403595,780582745017843712,0
322,alissasmurf,"How many times has he said ""tremendous""  #Debates2016 #debates",1474940403700,780582745458241536,0
323,list412,America's failing infrastructure is what I view as the #1 threat to national security. #debates,1474940403575,780582744934023168,1
324,baygrande,is he really talking about being in debt ?? how many times has he gone bankrupt again 🤔🤔🤔 #debates,1474940403728,780582745575526401,1
325,SP1K99,"Watching Clinton vs trump is ""hilaryous""#debates #debatenight",1474940403658,780582745282060288,0
326,TheTygryss,"I have, I have, I have...  #Debates https://t.co/DqMLYFrPrc",1474940403406,780582744225185793,0
327,CourtneyHadden,Best. Word. Ever. 🙌🏼 https://t.co/AHRtmQ7IAS,1474940403604,780582745055502339,0
328,coffee_whiskey,"""I know guys who have dicks. Trust me, they're impressed. It's stupendous. Let me tell you, I have a great dick."" #debates",1474940404679,780582749564317697,1
329,yuck_elva,@ trump #Debates https://t.co/zF1zk3VcQ6,1474940404434,780582748536786945,0
330,TerryGlavin,"Oh Christ he's bragging about how rich he is again. But not in a ""braggadocious way."" Which isn't even a word. #debates",1474940404410,780582748436123648,0
331,amazingoffersus,Stop hopping between social media apps...use OneSoci to post to all your accounts. https://t.co/qUN0vygJSm #debates #debatenight,1474940404665,780582749505724416,0
332,blessmode22,Trump sounds like a loud mouth wanting attention #debates,1474940404648,780582749434417153,1
333,UDWC_MD,#debates https://t.co/ErsQJu0eCG,1474940404581,780582749153464320,0
334,KyCarla,"Clinton: Trump paid no federal income tax.
Trump: ""That makes me smart.""
Me: Hmm...what does that make me?  #debates",1474940404683,780582749581221889,1
335,graisinbrand,Trump filibustering right now. #Debates,1474940404698,780582749644070912,1
336,Chris__Copley,#Trump insulting the country is classic #demagogue behavior #ImWithHer #debates,1474940404718,780582749728038912,1
337,themaskeddemon1,Airports... #Debates,1474940404671,780582749530951681,1
338,TheOnlyMattBuek,"I just want Hillary to say ""What the fuck do I even say to that"" after one of these incoherent monologues. #debates",1474940404640,780582749400731648,1
339,MeePlusTeeVee,If she's smart she'll say we are in debt because men like him don't pay taxes.  #Debates,1474940404635,780582749379948544,1
340,MalissaCGauthie,Believe me #Debates,1474940404469,780582748683591681,1
341,Myranda_Pauley,#Debates @HillaryClinton YAS girl call him out. Yes.,1474940404549,780582749019275264,1
342,LauraPolisseni,So America's airports make us a third world country now? #Debates,1474940404756,780582749887266816,1
343,heyjossh,"""Bragadocious"" - Trump #Debates",1474940404776,780582749971197952,0
344,tontonlove,Maybe because you haven't paid any tax returns for a lot of years. Zing! #debates,1474940404513,780582748868214785,1
345,floweredphan,"""the only thing they have in common is the color of their hair"" --my mom 2k16 #debates",1474940404829,780582750193487873,1
346,trump_sniffle,👌🏼 #Debates2016 #Debates #debatenight #ImWithHer https://t.co/jGQSU6y2Cu,1474940404416,780582748461395968,0
347,lo_really,He just praised airports built by underpaid and exploited workers.  This is insane. #debates,1474940405652,780582753645522946,1
348,ElamGilson,Hillary for prison #Debates,1474940405742,780582754022928384,0
349,ashleymhendel,Hey guys I'm just chillin in America with my lack of clean water and no access to health care since this is a third world country! #debates,1474940405669,780582753716867073,1
350,BJCollins131,The only thing that you have said that I agree with. https://t.co/ZhLub39Ns8,1474940405540,780582753175678976,0
351,izzi_is_crazy,I would be watching the #debates but i want sleep💤,1474940405697,780582753834262528,0
352,allybis,USA A THIRD WORLD COUNTRY LMAO 💀 #debates,1474940405612,780582753477791744,1
353,widdershins22,Trump's sniffling was an early symptom of verbal diarrhea. #debates,1474940405518,780582753083326464,0
354,tonyaajw,"So if his tax returns won't tell anyone anything, why won't he just release them and settle the matter? #debates",1474940405632,780582753561677825,1
355,WannabeOPA,So when you cut the taxes how are you going to pay for these new roads and airports and infrastructure?  #debates,1474940405743,780582754027089920,1
356,earthaluv2,Did Donald just quote a Mary Poppins song? #debates,1474940405779,780582754178170880,1
357,TSTpolitics,"""It's $6 trillion, maybe $5 trillion"" I dunno. Something something Middle East #debates https://t.co/9TcbwUr7gL",1474940405493,780582752978669568,1
358,anDrew_A_Blank,I like JFK airport... We have shake shack... #debates,1474940405696,780582753830113280,1
359,Perpetual_Ro,"Apparently America is a third world country because our airports are less pretty than Dubai, Qatar and China's airports. #debates #painful",1474940405634,780582753570095107,1
360,jon_ari_,She going in for the kill #debatenight #debates #Debates2016,1474940405875,780582754580770816,0
361,IamJOSESERRA,Watching the #debates at work tonight. I'll always remember this...never have I felt so uncomfortable. @HillaryClinton @realDonaldTrump,1474940405881,780582754605936641,0
362,witchcults,"#Debates yikes,",1474940405809,780582754304032768,1
363,twwat2016,"Trump says ""secretary"" like she was taking short hand and fetching coffee. #debates",1474940405614,780582753486200833,1
364,shanejayhayes,Clinton is now responsible for Newark airport being a dump. #debates,1474940405830,780582754392170497,1
365,alleybush77,Trump is an angry orange that can't answer a simple questions asked of him. #debates #debates2016,1474940406657,780582757860675585,0
366,HOPE_Speaks,#Debates I Cannot Believe #Hillary is Wasting Our Time Talking About #Trump #Taxes. ~ #USA #2016PresidentialCandidate #MichelleHOPEWalker,1474940406645,780582757810319362,1
367,TeeVanity,Hit em with jab Hillary lol #Debates,1474940406661,780582757877608449,0
368,DavidElya,Smirking Hillary #debates #Debates2016,1474940406604,780582757638541313,0
369,SharonInostroza,"El debate entre Clinton y Trump solo es ataque, donde están sus ideales al llegar a la presidencia (?) #debates #debatenight",1474940406713,780582758095749121,0
370,Jason4Liberty,Trump is spiraling #debatenight #Debates2016 #debates,1474940406755,780582758271684608,0
371,ShillForHillary,"""We're a debtor nation and we don't have the money""
  #debates",1474940406736,780582758192152576,1
372,ricklynn_,"Oh we have the money, y'all just have it in rotation amongst yourselves . #Debates",1474940406799,780582758456238080,1
373,Orianajosr_,Estados Unidos se va a quebrar horrible si gana Trump #Debates,1474940406786,780582758401835019,0
374,kalvrz1029,Ikr  #Debates,1474940406713,780582758095593472,0
375,mitchellhart95,Stop cheering you idiots... You have one job. #debates,1474940406399,780582756778643456,0
376,TomWilson0101,"Donald Trump just insinuated that Newark, NJ is a third world country #debatenight #debates #NeverTrump #fuckingidiot",1474940406601,780582757625888768,1
377,StrongDemocrat,"No, Mr. Trump, we are not a 3rd world country. We are a great country. #debatenight #debates",1474940406686,780582757982429184,1
378,youcantdress,Trump not saying anything  #Debates,1474940406909,780582758917615616,1
379,Colleen_ham1,Trump is now bragging about all the places he gets to travel. Middle &amp; lower income not relating to the braggart! #debatenight #debates,1474940406751,780582758255058944,1
380,dissonance_pod,I agree that our airports suck. Many don't have a Starbucks #priorities #debates,1474940406696,780582758024351748,1
381,Jay_Pee_51,I just told @nbcwashington who I think is winning. Cast your vote now! #Debates #NBC4DC https://t.co/Nm1OHFTdQO,1474940407486,780582761337880577,0
