,screen_name,text,timestamp,tweet_id,cluster_pred
382,DaijahMari,I just told @nbcwashington who I think is winning. Cast your vote now! #Debates #NBC4DC https://t.co/pTbQVXoc7p,1474940407531,780582761526468611,0
383,Snoopy_7200,Sad to say this... but go trump#Debates,1474940407595,780582761794981888,1
384,MarinaCastroBz,Clearly Trump has never been to a 3rd world country... #Debates,1474940407634,780582761958612994,1
385,victorxlr007,Which dimension is trump  from cus his eyes are seeing some shit #Debates,1474940407678,780582762143158272,1
386,GregBHutchins,"I agree we need to invest in infrastructure spending, and we have the money. It just needs to be reallocated.  #debates",1474940407693,780582762205937664,1
387,baileyharris,Not sure what more evidence you need that Trump is the outta touch one than him comparing fucking LAX to a third world country #debates,1474940407639,780582761979518976,1
388,goodwillfiction,The audience is making more noise than they should. #debatenight #debates,1474940407746,780582762428456960,0
389,sillikid_399,SHE FUCKIN SNAPPPEDDDDD #Debates,1474940407472,780582761279131648,0
390,CVOBryan,Someone please fix his nasal valve collapse #debates #ENT #forthelove,1474940407600,780582761816006658,0
391,AhaValencia,MAYBE WE WOULDN'T BE A DEBTOR NATION IF CONMEN LIKE YOU PAID YOUR FUCKING TAXES! #Debates,1474940407728,780582762352812033,1
392,holdfast0321,@Varneyco @HillaryClinton MAYBE ITS THAT YOU ARE A LIAR #debates,1474940407801,780582762658967553,1
393,KellyHodgey,OMG WE ARE NOT A 3RD WORLD COUNTRY. WHAT THE F TRUMP. SHUT UP.  #Debates,1474940407514,780582761455321089,1
394,sharilynns65,New name for #debates Debate-gate !!!,1474940407836,780582762805809152,0
395,Olivia_Pirog,Our country is going to have serious problems in a couple of months #Debates #debatenight #Debates2016,1474940407785,780582762591891456,0
396,anthonymcduck,JFK AND LAGUARDIA ARE THIRD WORLD COUNTRIES?! I AM FUCKING DEAD!!!!!!!!  #debatenight #debates #Debates2016,1474940407620,780582761899888640,1
397,BenjaminKweskin,Neither. https://t.co/sbuys2bRvu,1474940407638,780582761975406593,0
398,etoilee8,"""Maybe because you haven't paid any federal income tax ..."" #zinger  #DebateNight #debates",1474940407854,780582762881257472,1
399,CageyCayy,"I didn't know having ""bad airports"" is equal to being a third world country wow #Debates",1474940407845,780582762843627520,1
400,Lolakhaffilat,Donald Trump at it again 😀😀😀 #Debates,1474940407615,780582761878937600,1
401,TheMentaLife,Shoutout to Hilary Clinton for holding her composure #debates,1474940407830,780582762780688385,0
402,yaimdamon,"He said ""bragdocious"" #Debates",1474940407866,780582762931556352,1
403,MelaniedeArakal,#debatenight #Debates2016 #debates Yeah! Monday night football! Geaux Saints! Who dat nation!,1474940407886,780582763015438337,0
404,RazeenKarim,IM DRUNK and I don't even drink https://t.co/qRc017CyHl,1474940408603,780582766022832128,0
405,sensemuses,Shiiieeeee I've never paid taxes in my life so that must make me a genius 🙃#Debates,1474940408637,780582766165372928,1
406,Ztriker8,OOOHHHHHHHH  #Debates,1474940408684,780582766362529792,1
407,jlnourieh,weve become a 3rd world country?? Trump is delerious #Debates,1474940408708,780582766463168512,1
408,lafnlab,#DEN and #IND are very nice airports #Debates,1474940408626,780582766119309312,1
409,LifeShantastic,"You know how bridges and roads are built, #Trump? 
TAXES. (That you don't pay)
#debatenight #debates
@billmaher",1474940408671,780582766308012032,1
410,Barbara17558239,"Saying I ""made a mistake and take responsibility"" is a copout!!#Debates",1474940408548,780582765792141312,0
411,erinoface,Trump mentions Hillary's emails like my mom mentions when she caught me with pot @ 15. It was 90% opportunity for the high ground. #debates,1474940408573,780582765897154560,1
412,FlyinSighsAgain,She doesn't know what to say... https://t.co/9sTNvGChS1,1474940408656,780582766245130240,0
413,Miranda0203,"@tamronhall Yep it has shown me Trump is a bully, who lies, and has no concept of how to lead the US! #debatenight ##debates",1474940408637,780582766165495808,1
414,Izzy772,#debates https://t.co/YKinaH4EmQ,1474940408478,780582765498605568,0
415,kayleden,"Having an idea about money and using the capitalist system to your privileged advantage are two VASTLY different things, Donny. #Debates",1474940408707,780582766459006976,0
416,dtrombino,Lets talk about the businesses! #Debates,1474940408714,780582766488543232,0
417,roseanneonayan,Third world countries barely have airports but okay  #Debates,1474940408439,780582765335044096,1
418,GabeDiLaurentis,"Liar liar pants on fire. Don't be stupid America, do not vote for him, do the right thing. #debates https://t.co/PluQpF9mza",1474940408603,780582766022885376,0
419,westeros_queen,I apologize to all my neighbors hearing us curse out the television during the #debates,1474940408682,780582766354239489,1
420,GravityMS,"""We have ugly airports, thus the US is a third world country"" -The Trumpy #Debates",1474940408743,780582766610186240,1
421,Scout_Finch,"Oh, shit - it's business time. #debates",1474940408748,780582766630928385,0
422,Jam_Bklyn_man,Your rambling orange man. Sip some more water liar. Repeating yourself like Rubio. #debates #debatenight,1474940409591,780582770166919168,1
423,moooonbat,Someone who knows about money? Trump thinks he's that person? #debates #Debates2016 #debatenight https://t.co/eWEm8vIrTp,1474940409237,780582768682135553,0
424,ToXicViper103,WOAH  #Debates,1474940409665,780582770477195264,0
425,valmediadesigns,"We owe 19.7 trillion dollars, and Sec. Clinton would like to keep on spending. #Debates",1474940409562,780582770045227008,1
426,TorraineWalker,DAAAAAAAAMN! #Debates,1474940409658,780582770447974400,1
427,ChasenCampbell,"""It's about time some1 ran this country that has an idea about money"" 

Trump's crushing right now. Strongest performance thus far #debates",1474940409700,780582770623913984,1
428,TrustMiguel,"HILLARY RUINED ALL THE BRIDGES. THANKS OBAMA
#debates",1474940409695,780582770602942464,0
429,DannySlavich,Hillary is winning this right now. She looks like a President. #debates,1474940409653,780582770426777600,0
430,DaddyFiles,Listen to these BS numbers Trump is using. Apparently they didn't teach math at #TrumpUniversity. #debates #debatenight #debate2016,1474940409594,780582770179469313,0
431,hitsutoshirou,"Mano a Hillary devia ser acrobata de circo, o tanto de malabarismo que ela faz não é brincadeira #debatenight #Debates2016 #debates",1474940409746,780582770817044480,0
432,StillHoward,"Trump says America has turned into a 3rd world country 😂😂😂
#debates",1474940409672,780582770506629121,1
433,sonamkaps,"""Bragadocious"" got me kind of wet #debates",1474940409761,780582770879795200,0
434,DJD_Allday,"#debatenight #debates
Whoa did her voice waiver?",1474940409797,780582771030827009,1
435,SchuylerAntane,Don't even Start on payment to Iran #Debates,1474940409508,780582769818730496,1
436,rafaelrodrigues,"do pedaço que vi, Trump está dominando o debate. ele realmente pode ser eleito. isso é um desastre completo. #debates",1474940409695,780582770603069444,0
437,eemilio59,I just told @nbcwashington who I think is winning. Cast your vote now! #Debates #NBC4DC https://t.co/9iVLIFecw9,1474940409709,780582770661691392,0
438,ashtynian,Can we get back to the issues? We've heard enough about the scandals. #debates,1474940409672,780582770506477570,1
439,FeliciTRON,Via @NPR: Live Fact Check: Trump And Clinton Debate For The First Time https://t.co/DckmMl8FFr #debates,1474940409592,780582770171060230,0
440,bwentwhat,Has Trump ever even been to a third world country? F him. #Debates,1474940409759,780582770871373824,1
441,KnowParty,"Notice when talking of the economy, neither Trump nor Clinton talked about the banks. See where the bread is buttered. #debates",1474940409690,780582770582093825,0
442,sarahsmacdonald,Donald's body language exactly like a drunk bro at a bar believing any of us give a shit about what he's yelling about #debates,1474940409751,780582770837979136,0
443,Tallulahs_Ghost,Trump compared said our infrastructure is behind Qatar...a slave nation. #Debates,1474940409521,780582769873133568,1
444,lisahowetn,"So Donald Trump thinks the economy is horrendous, and he made $700 million last year. That doesn't sound so bad. #debates",1474940409779,780582770955259906,1
445,ZAL_1954,6 or 5. Trillions who knows  #Debates,1474940409777,780582770947067904,0
446,OliviaGrills1,I'm struggling to understand what airports has to do with American prosperity #debates,1474940409799,780582771039371269,0
447,som_Universe,워우 #Debates,1474940410680,780582774734331904,0
448,3m3h3n,Son of a bitch there's already a @TrumpSniff twitter handle.. #Debates Should have been a drink for every parody account created,1474940410668,780582774683992064,0
449,winbaby2,How are you going to cut taxes and rebuild airports. #debates,1474940410393,780582773530697729,1
450,Alexand41749257,Trump is destroying him self and  Clinton is laughing#Debates,1474940410574,780582774289891328,1
451,KingGold24,lol hillary funny #Debates,1474940410682,780582774742757376,0
452,taylorbeil,Trump lost five minutes into the debate. He's just getting destroyed now #Debates,1474940410687,780582774763757568,1
453,chamorrodiana,"Wait, airports? #Debates2016 #Debates2016 #Debates",1474940410643,780582774579171328,0
454,tannerray0903,Trump got that 💸💸💸 #Debates,1474940410649,780582774604521474,1
455,ColinTheRoo,"No longer will we have first world problems. Cause we live in a third world country. Right, @realDonaldTrump?! #debates",1474940410296,780582773123710976,1
456,drzengo,#interruptingtrump let her talk. #debates,1474940410654,780582774625406977,0
457,DqddyAJ,(Meme) #debates,1474940410664,780582774667378688,0
458,ThinkReason1,Ok. Early call   President Trump. Like it or lump it. #debates @HillaryClinton @realDonaldTrump,1474940410657,780582774637862912,0
459,JasonWright_,"Trump talking about debtors, when he's survived on loans from the middle east. #hillary2016 #debates #HillaryN2016n20",1474940410673,780582774705037312,1
460,KaitlinLaMoine,"I'll give him a triple word score for working in ""braggadocios."" #debates",1474940410748,780582775019626496,0
461,TheRealCatWiley,Scary side realization of this election: knowing now how many ppl think it's ok to treat women/anyone like this and thus prob do #debates,1474940410749,780582775023820800,1
462,MrFlickHimself,God damn! Lincoln just threw down some sick truths yo. Guys got potential. Dying to see what he'd do next. #debates #lincolnisdead,1474940410290,780582773098708995,1
463,AmericasDouche,#Trump is bitching about poor roads and $20 trillion in taxes right after he just smugly admitted he didn't pay fed income taxes. #debates,1474940410589,780582774352773121,1
464,eatatmilliways,Deader Nation would be a good name for a band #debates,1474940410701,780582774822481920,0
465,AmoreLeath,"damn braggadocious is a real word, trump really out here teaching me #debates",1474940410717,780582774889672704,0
466,VOX1NIHILI,"4,6, or5 trillion dollars. Think is more like 5.  What is he talking about #Debates",1474940410721,780582774906519554,1
467,msitver,"Trump keeps forgetting the operative words ""in debt"" #debates #Debates2016 #debatenight",1474940410544,780582774164119552,0
468,SpaceyCasey407,What 3rd World Country airports have you been to lately? #Debates2016  #debates,1474940410674,780582774709293056,1
469,j_cohl,#ImWithCthulhu https://t.co/ItNJmxndCt,1474940410544,780582774164099072,0
470,mdtoorder,"STFU, Donald. Yes, let's start the clock again, Lester. And again. (I can see where this is going ... ) Cut the damn Mike, Lester! #debates",1474940410720,780582774902104065,0
471,missdunnegan,Kilt him dead. https://t.co/imurNaRMpU,1474940410729,780582774940065792,0
472,rs_ellis,Did Trump compare us to a third world country 🤔 has he even been to a third world country  #Debates,1474940410806,780582775262961665,1
473,brianna_dolan_3,Just stfu😂😂#Debates,1474940411675,780582778907742208,1
474,Herr_Quansah,Thought you guys are all knowing. https://t.co/nJEJK3389G,1474940411627,780582778706464768,0
475,HighHeelEsquire,"""And maybe cuz you haven't paid any federal income tax in several years...""

Hillary could just keep repeating that. #Debates",1474940411586,780582778534502401,1
476,MrDadAut,#debates  TRUMP is hitting hard on tax returns v emails,1474940411585,780582778530177024,1
477,jimwitkins,This. Trump is for trump. Not for America. #DebateNight #debates #debates2016 #Imwithher https://t.co/ToRBI0VjW1,1474940411368,780582777620164608,0
478,JAREDandSARAH,Trump said our airports are like third world countries. I think @PHLAirport is very nice. #DebateNight #Debates,1474940411676,780582778912010240,1
479,KimmieKim84,This muthafocka talkin about the damn AIRPORTS?!? #Debates2016 #Debate #Debates,1474940411683,780582778941349888,1
480,mwittenberger,"""It would be squandered too, believe me"" Did Trump just admit to still not paying taxes??? #debates",1474940411417,780582777825660929,1
481,akeda_l,Homie is stuck on china and mexico  #Debates,1474940411743,780582779193032705,1
482,vrai777,"⛵#BK .HillaryClinton demands realDonaldTrump's tax returns, takes responsibility for email ""mistake"" #debates https://t.co/4xRZjZ9Kjh",1474940411557,780582778412892160,0
483,mmministries10,#Debates no taxes paid,1474940411673,780582778899460096,1
484,tangrnesunflwr,Wooo! America the third world country! Wtf Trump.... #whatishappening #Debates,1474940411764,780582779280994304,1
485,fancyfeet07,😂😩😂😩😩😩😩😩😩😩😩😂😂 #Hillary is coming for BLOOODDD!!!!!!!!!! Lmbo!!!!! Oh my gosh! #debates #Debates2016,1474940411754,780582779239018496,0
486,officialardelle,😭 https://t.co/dLBUEwPWcB,1474940411673,780582778899423232,0
487,VomitingBrain1,"#debatenight #Debates2016 #debates  @realDonaldTrump panting again, I think he may have the stamina problem",1474940411774,780582779323092992,0
488,zachias_,Trump is very good at talking in circles. I have no idea what we're discussing at this point. #debates,1474940411624,780582778693832704,0
489,ladye2301,Lies...lies...lies...he's NOT going to release his tax return. #debates,1474940411708,780582779046268928,0
490,MarcoNunezF,#Debates,1474940411657,780582778832289792,1
491,__OutKast__,#Debates How he gon say that our airports look bad then name great looking airports. . . ?,1474940411785,780582779369160705,1
492,MeroonGS,When Trump takes down Hillary's 2 minute argument in 10 seconds #debates #MAGA https://t.co/jP7uew2BnV,1474940412568,780582782653247488,0
493,sallyholmes,bragadocious. #debates,1474940411357,780582777574006784,0
494,TheRealRamonabd,Yes he actually said that on Live TV. I guess us regular tax paying citizens are dumb #Debates We not dumb. We know… https://t.co/woBj8Zspct,1474940412692,780582783173337088,1
495,quebEQrider,will he ever shut up? #Debates,1474940412642,780582782963585024,1
496,The_Raisin_Cult,"yeah dude come over to canada, our prime minster is fucked as well so.... https://t.co/bZpmRcnlqO",1474940412662,780582783047593984,1
497,NitehawkBeats,#DonaldTrump can't win #debates,1474940412288,780582781478903813,1
498,bloomaces,"@Strep is your #debates commentary going to be all bring it on references? If so, amazing!",1474940412738,780582783366246400,0
499,BacksliderDee,"I mean, we do need new infrastructure #Debates",1474940412541,780582782540115968,0
500,TheArchitectsKC,"""according to...a report that I just saw"" LOLOLOLOLOLOL #Debates",1474940412657,780582783026552835,1
501,prodempla,"Sinds 11 september 2001, heerst in VS een gemilitariseerde politiestaat,potentieel fascistische dictatuur tegen VS-arbeidersklasse.#debates",1474940412707,780582783236333568,0
502,darcyboucher,I'd say so. #debatenight https://t.co/sEH8XoIosK,1474940412587,780582782733017088,0
503,artisticjohann,SHE DID THAT #Debates,1474940412810,780582783668264961,1
504,XO945Gaming,@KaronerYT Trump now turns orange #debates https://t.co/nwc5PrxlFI,1474940412670,780582783081000961,0
505,nickkreiss,Trump is an airport elitist #debatenight #debates,1474940412798,780582783617867776,1
506,bitty_boop,"Not only did Hillz come with receipts, she came with the FACTS!!!  #debates",1474940412630,780582782913347584,1
507,TenIsMyDoctor_,"Hillary, you're doing a great job keeping your chill but I can still tell you wanna punch him in he face. ME TOO 🙌🏽 #Debates",1474940412760,780582783458488320,0
508,ElusiveEmDash,YAAAAAAAS hillary #debates,1474940412731,780582783336886274,0
509,DOUTEUR,LE PLQ ET NOTRE GRAND MÉDECIN NATIONAL EN CHEF FONT LE CONTRAIRE ICI. COUPER L'ÉDUCATION AFIN QUE LES ENFANTS IGNOR… https://t.co/yQgrtB2EPm,1474940412667,780582783068565504,0
510,NomadnessTribe,"""Our airports are like a third world country."" - Trump #Debates",1474940412640,780582782955315200,1
511,dan0king,"With all of his sniffing and fast talking, I wonder if Trump did some cocaine before the start of the #debates #trumpbump",1474940412796,780582783609692160,1
512,tehrrific,donald trump discussing his tax returns #debatenight #debates https://t.co/5B5ksmyWk3,1474940412533,780582782506504193,0
513,jfordberry,Watching the #debates and I have to say I wish they would answer the questions directly without constantly cutting each other down.,1474940412909,780582784083628033,1
514,Shaazaam_,Deader Nation?  #Debates,1474940412652,780582783005650945,1
515,emilythickinson,AND MAYBE BECAUSE YOU HAVEN'T PAID ANY FEDERAL INCOME TAX FOR YEARS.....i just screamed biiiiitch so loud omg go girl #debatenight #debates,1474940413660,780582787233394689,1
516,RyCouldntStopIt,WHY ARE YOU TALKING ABOUT AIRPORTS!? #debates #PresidentialDebate https://t.co/lS3aTlecLu,1474940413501,780582786566615042,0
517,yank65,"Get back on her Trump, I want to hear her excuse for all those e mails. #Debates",1474940413683,780582787329830912,1
518,laikasputnik57,Does Trump have asthma? #debates #debatenight,1474940413565,780582786835091457,0
519,MasonLLL,"""Our airports are from a third world country."" Stahhhhp😂😂 #debatenight #Debates2016 #debates",1474940413615,780582787044610049,1
520,jewelsdivision,Now we're a 3rd world country🤔🤔 #Debates,1474940413713,780582787455733761,1
521,AlexLancast3r,BURN! #Debates,1474940413615,780582787044769792,1
522,RobinJones98,businessinsider: RT bi_politics: Trump on the economy. #debates https://t.co/lxxDTlkOML https://t.co/rYjvCfvH9j,1474940413658,780582787225092096,0
523,cintia_azalini,US presidential candidate is allowed not to disclose his/her income tax???? WHATAFUCK???? #Debates2016 #debates,1474940413650,780582787191566336,1
524,ThisOneThing7,Hilary is handling Donald. He's pissed #Debates,1474940413747,780582787598475264,0
525,OmgFloppySeal,"#Debates DID HE JUST SAY ""DEADER"" ??????? 😂😂😂😂😂",1474940413788,780582787770441732,1
526,Siuspot,"Trump, financial disclosure includes your tax return... just a tip ;) #debatenight #debates #Debates2016",1474940413794,780582787795615744,1
527,allistewart,Being a successful country isn't necessarily measured in airports. #DebateNight #debates #nevertrump #payyourtaxes,1474940414677,780582791499046912,1
528,Dakamargeo,And cutting taxes is totally the way to raise money to build all those things. #debatenight #debates,1474940414652,780582791394291712,0
529,jamielevdan,You need public money to build things like airports. Public money comes from taxes. #debatenight #debates,1474940414563,780582791020969985,0
530,davrone86,When Hillary claps back #debates https://t.co/1kajhYjHmD,1474940414352,780582790135808000,0
531,honeyxpie,Trump is the biggest bull shitter ever. #Debates2016 #debates,1474940414592,780582791142580224,0
532,B0RRACHIT0,"Donald Trump va a terminar haciendo el pinche muro sólo para que Vicente Fox no pase a EUA. 😂

#debates
#debatenight 
#Debates2016",1474940414676,780582791494807552,0
533,ErikaTordsen,Yeezy for president #debates,1474940414689,780582791549292544,0
534,bleukittie,"the gloves are coming off, get him HRC!!!!#Debates",1474940414534,780582790899306496,0
535,gregsimmsjr,Knife to the RIBS!  #debates,1474940414618,780582791251566592,1
536,AirJet_SoledOut,"Trump actually proud of the fact he didn't pay taxes, making a joke about it.. Yet middle and low classes have to  #Debates",1474940414693,780582791566110720,1
537,LWileyvoice,"He is such a liar- you can believe me.
#debates #debatenight #ImWithHer",1474940414382,780582790261723136,1
538,m_beeze,Admitted to tax evasion again. Keep em coming #debates,1474940414650,780582791385866241,0
539,suzibouveron,"Okay, Lester, let's get back to something relevant and important. #debates",1474940414650,780582791385788416,0
540,RoninMemes,"YES! 😂😂😂😂😂😂😂😂😂😂😂😂😂😂😂😂😂😂😂😂😂😂😂😂😂😂😂😂😂😂😂😂😂😂😂😂😂😂😂😂😂😂😂😂😂😂😂😂😂😂😂😂😂😂😂😂😂😂😂😂😂😂😂😂😂😂😂😂😂😂😂😂😂
#Debates2016 #debates  #DebateNight https://t.co/r37riIwvv3",1474940414446,780582790530117632,0
541,RayofInterest,"now @realDonaldTrump  trying the ""typical politicians"" lines #Debates",1474940414808,780582792048500737,0
542,ChazPofahl,"@realDonaldTrump says he's ""smarter"" by not paying any fed taxes while making $650. How is this guy the populist candidate??? #Debates",1474940414761,780582791851417602,1
543,CaminoForCancer,"@realDonaldTrump I pay ZERO in taxes, but $650 MILLIon is not a lot of money. #Debates",1474940414789,780582791968854019,1
544,anicole__xo,Trump stay interrupting Hilary like chill bro you'll have your time to talk let's be adults here and take turns. #debatenight #debates,1474940414842,780582792191016960,0
545,truAllyjay,"I'm Rich, I mean super rich, did you know I was rich?, oh by the way I'm rich,did I mention I have money? #Debates",1474940414829,780582792136495104,0
546,Carejanez,Savage #Debates,1474940415683,780582795718463489,1
547,ThStckMktBlprnt,THIS is the event that's been hyped as much as the Super Bowl? #debates #Debates2016,1474940415700,780582795789803520,0
548,Valerieqilei1,"oh you got him hilary
  #Debates",1474940415738,780582795949187072,0
549,ojhernandez93,"""I wish infrastructure was better."" - Candidate who brags about not contributing to said infrastructure. #debatenight #debates #Debates2016",1474940415630,780582795496136707,0
550,4xRevenue,#Debates a report I just saw?  My goodness. Please. Conservative or not. The man is a boob,1474940415711,780582795836059648,1
551,crisco_89,Hahaha 👊👊👊 https://t.co/qgsnzfA6oO,1474940415640,780582795538202624,0
552,allthesarcasm,You can make some real nice airports when you just use glorified slave labor #debates,1474940415602,780582795378880512,1
553,DallasSingleMom,Damn dig Hillary! For the win! #debates #debatenight @hillaryClinton,1474940415670,780582795663912960,0
554,AlxPage,@realDonaldTrump buildings don't make America great.When will you understand that it's the working people that makes us strong #debates,1474940415743,780582795970248704,1
555,mjkimberly_k,"@rabiasquared wondering.....His skin, his hair, all a different color. No more orange. #Debates #debatenight #Debates2016",1474940415634,780582795512950784,0
556,JessicaPettry,Haha! https://t.co/Txv7esW2Mu,1474940415628,780582795487830016,0
557,kaywilk15,Trump you suck at business. #Debates,1474940415777,780582796112728065,1
558,ThomasMonbergSF,What about @SenSanders for prez instead? Or Michelle Obama? or just not one of those two? #debates #Debates2016 #debatenight #dkpol,1474940415627,780582795483680769,1
559,megfusselI,He just said BRAGADOCIOUS. 🙄 #debates,1474940415790,780582796167303170,0
560,haroldb21,Donald Trump sniffing like he just did a bump. #debatenight #debates #Debates2016,1474940415776,780582796108582912,1
561,CheReal85,"""You haven't paid any federal income taxes"" Yasss @HillaryClinton #debatenight #debates #cspan #msnbc",1474940415846,780582796402184192,1
562,tbm007,I wish Hillary would just stop and excuse Trump’s behavior because he’s never been on a legitimate debate stage before. #debates,1474940415738,780582795949150208,1
563,stefani_brian,I honestly thought of her and Amy Poehler on SNL whenever she laughs. #Debates  https://t.co/HanBusQWWN,1474940415716,780582795856973824,1
564,Funmilola,Yup. https://t.co/t2l3bsgdt2,1474940415756,780582796024774656,0
565,guntotingnurse,"""I made a mistake"" no #Hillary what you did was illegal and you belong in jail  #Debates",1474940415846,780582796402327552,0
566,JLCarter_Sr,LMAO! https://t.co/j8k6zzH4Qy,1474940415716,780582795856883712,0
567,_Mattingly_,"Great, great, great line by Clinton. #debates",1474940416728,780582800101478402,1
568,TinyCroc,"When it's a woman you're debating and you're a man, it's harassment and bullying to counter her arguments. #debates #feminismlogic",1474940416727,780582800097316864,0
569,EnchantedCshel,.#Iknowalotofpeople #debates,1474940416653,780582799786905600,1
570,vonitralechele,Maybe because you haven't paid any taxes! Tell 'em @HillaryClinton #debates,1474940416750,780582800193757185,1
571,moewilds,"He's speaking to such a large, uneducated crowd and it's so scary that people actually trust him...#debates",1474940416741,780582800156221440,1
572,betnywriter,#debatenight #debates #Debates2016 https://t.co/u1MhPqWSwh,1474940416405,780582798746943488,0
573,ludwigad,Trump train baby chooo chooo! Get on or get run over #Debates,1474940416756,780582800218988544,1
574,smokeysroom,Love Trump's hate @HillaryClinton 2016 #Debates,1474940416770,780582800277680128,1
575,bakerlarry84,"#DEBATES YUP TRUMP IS HIDEING HIS TAXES BECAUSE HE ISNT PAYING THEM, NO OTHER ANSWER, HE IS A CROOK,  LIKE SHE IS… https://t.co/J2VMlXLtlg",1474940416639,780582799728181248,1
