,screen_name,text,timestamp,tweet_id,cluster_pred
0,RowanGrey,"Trump is all ""I'm not going to talk about policy. Let me tell you how rich I am. Like, SO RICH, omg. So rich. Riiiiich.""  #debates",1474940341629,780582485113638915,3
1,realfandumbgirl,What the ever loving fuck is this man talking about with airports??? #debates,1474940341556,780582484807389184,1
2,yung_smit,"oh god, he's repeating himself #Debates",1474940341667,780582485273014272,2
3,ryantgillette,"Take a shot every time Dipshit Trump and ""I"" .... #Debates2016 #debates",1474940341692,780582485377724416,3
4,the_spet,#bragadocious is my new favorite word #DebateNight #debates #trump2016,1474940341650,780582485201649664,3
5,Forever324Young,Trump is so happy to be so rich while the rest of y'all broke #debates,1474940341398,780582484144599041,3
6,abbyfried,"How many times do you think Trump looks up ""great"" in a thesaurus? #debates #ImWithHer #HillYes",1474940341722,780582485503647744,3
7,originalprez,"@HamiltonsGuide I hear ya, buddy! #debatenight #debates",1474940341766,780582485688250369,3
8,jlwism,Why does he trash USA so much? #Debates,1474940341894,780582486224932864,3
9,gravel_monkey,A mistake that would have gotten anyone else arrested! #debates,1474940341756,780582485646114816,3
10,cheyduhh,"thankx for explaining what 'taking the fifth' means. i gave a report on the bill of rights in 4th grade so i'm solid, but thanks #debates",1474940341787,780582485776138240,3
11,STEFAN1E__,Um excuse me trump.. I think JFK is pretty great. #debates,1474940341723,780582485507842049,3
12,dory1028,Or you could just release the tax returns.  #Debates,1474940342665,780582489458868224,0
13,raboyd2,Donald Trump says it's time that the country has someone who has an idea about money running it &amp; bemoans infrastructure and debt. #debates,1474940342667,780582489467129856,0
14,TheShreks,Tried to watch the #debates but had to stop. Just can't stand listening to @realDonaldTrump. #debatenight #shutupalready #ImWithHer,1474940342457,780582488586514432,3
15,thworstdan,Eish esse gajo é ganda animal mas tá a esmagar a Hillary com os emails #Debates,1474940342518,780582488842395648,3
16,ElizabethEllenJ,Is it bad if I keep muting the debate because I'm getting a headache? #Debates,1474940342683,780582489534427136,3
17,ldurham_18,👏🏻👏🏻👏🏻👏🏻👏🏻 https://t.co/hm37rfxaFp,1474940342374,780582488238329856,2
18,cqminaj,He will give us a list of banks and the name of his hair stylist but not his taxes  #Debates,1474940342687,780582489551097856,0
19,tmzanthony,#DonaldTrump is that friend who just screams because they don't have a point but they want to sound smart. #Debates,1474940342752,780582489823727616,3
20,cathykleinbart,"DT:  I have a tremendous income.  Release your taxes, big man, and show us what you got #debates",1474940342385,780582488284561412,3
21,mharris621,"If Trump is such a good businessman, why has he declared bankruptcy 6 times? #debates #debates2016",1474940342542,780582488942977024,3
22,4n0nym0u5m1n10n,Dems only talking point #Trumps taxes. WEAK! #debatenight #debates #Debates2016,1474940342778,780582489932783617,3
23,garden4u_wa,None issue Donny https://t.co/2oy6Fa8IbY,1474940342736,780582489756622848,2
24,jpickett941,Braggadosious? #Debates #Debates2016,1474940342732,780582489739976704,3
25,slauhoff,And the reality is that nobody gives a flying fig about what is in it. https://t.co/5h6NRbMYim,1474940342644,780582489370791936,2
26,Jazmine_shanae_,I just told @nbcwashington who I think is winning. Cast your vote now! #Debates #NBC4DC https://t.co/5IWspmsDuI,1474940342773,780582489911767040,3
27,jerseyoriginal,Pretty sure that makes someone felon. Not smart. https://t.co/MDLxPCJYqv,1474940342685,780582489542635520,2
28,moneyintheblank,Hey! Don't you dare trash Newark airport! #debatenight #debates,1474940342643,780582489366622208,3
29,keith_browning,Literally what is the question right now? #debates,1474940342461,780582488603176962,3
30,LaurenWern,Donald Trump's interjections are pretty creepy. I don't know. I can't stop laughing at him. It's almost like he's cat-calling. #debates,1474940342719,780582489685389312,0
31,GoRasika,Live coverage #USPresidentialDebate #debates https://t.co/mUIHy2nUA1,1474940342705,780582489626517504,2
32,blondepolitic,RIP America. #debatenight #debates #Debates2016,1474940342801,780582490029326336,3
33,Jennybegs3,Amen!#debates  https://t.co/9lG4D21dGS,1474940342658,780582489429516288,2
34,drdbroker,"#debates Dangerous for HRC to say T is possibly hiding something when HRC deleted 33,000 emails.That's not hiding something?",1474940342764,780582489874010112,3
35,RedConversation,"You learn a lot more from the abridged version, eh? I wish my teachers had believed that. #Debates",1474940343686,780582493741211648,3
36,ignitedfire2005,"Is ""bragadocious"" a word??? https://t.co/HLxbwqdWK6",1474940343613,780582493434937344,2
37,StandUpDave,"Sources indicate that of the 30 deleted emails, 19 thousand were from Lane Bryant.  Can we just move on? 
#Debates #debatenight",1474940343619,780582493460176896,3
38,xcollidescopex,Totally just tuned trump out #Debates,1474940343729,780582493921562624,3
39,Gobias_Industry,Brag-a-docious? #debates,1474940343535,780582493108002816,3
40,iamlegend1623,Trump doesn't think tax returns tell much about him. Wish we could see em to make sure he's right. #debates,1474940343659,780582493627879425,3
41,ScribeHard,"""I'm extremely under-leveraged"" plays well in the heartland, I'm sure. #DebateNight #debates #Debates2016",1474940343659,780582493628035073,3
42,KSLAndrew,"""We've become a third world country."" #debates",1474940343746,780582493992779776,4
43,hesham1,"""Bragedoshess"" another new Trump word #Debates2016 #debates",1474940343644,780582493565100032,3
44,floresjasmine31,Fuh https://t.co/uk6V37AVrj,1474940343672,780582493682491392,2
45,mashablegif,Bragadocious dude #debatenight #debates https://t.co/Aojyr0KYDf,1474940343510,780582493003063296,2
46,Gushayan,Off topic again #Debates,1474940343806,780582494244474880,0
47,KenyaMusic,@SkyyhookRadio Because he's a liar! #losetheaudience #debatenight release your taxes! #trump #Hillary #debatenight #debates #Debates2016,1474940343755,780582494030614528,3
48,K__Sinclair,@taylornhodges14 https://t.co/Wqx6BflJpE,1474940343412,780582492592013313,2
49,suzygeiger,"It is astounding to me how little substance there is in anything Donald Trump says. All anger, attacks and subterfuge.  #debates",1474940343894,780582494613573632,3
50,matsonscotty,#bragadociously #debates,1474940343819,780582494299009024,3
51,TheDudeMattT,Not watching #debates #debatenight #Debates2016 #DebateWatch,1474940343861,780582494475284480,3
52,citizenstewart,Still no good answer on why you're not releasing your taxes. #DonaldDucks #debates,1474940344597,780582497562218497,3
53,muffiweaver,He's right about our airports #Debates,1474940344396,780582496719237120,1
54,0hjayhitit,money money money. #Debates,1474940344650,780582497784516609,0
55,jshorvath247,I made a mistake putting the safety of America at stake. Sorry ;( -HRC #debatenight #debates,1474940344678,780582497901871105,3
56,TimmyAdeoye,@kanyewest for president man!✊🏾 #Debates,1474940344580,780582497490984961,2
57,jenbruin00,#Debates u don't learn a lot from #trump's tax returns b/c u hire people to hide shit for you!,1474940344644,780582497759272960,0
58,BiancaVNugent,Macroeconomics 101 Mr. Trump: there is more to cutting taxes for business to sustain an economy #pnpcbc #debates,1474940344621,780582497662996480,3
59,islandheightser,"he is rambling and loosing his train of thought
  #Debates",1474940344585,780582497511931904,3
60,grabberporter87,"Tax returns vs emails??? I want TaxReturns he's rambling he aint that rich,now hes on airports?? #Debates",1474940344597,780582497562136580,0
61,CellyHOE,‼️‼️‼️ https://t.co/BVbWKFY2ab,1474940344617,780582497646153728,2
62,snatchthatgravy,"Oh please give her a list of banks! Wait, he has money?! Never heard that before
#Debates",1474940344523,780582497251753985,0
63,clintwilliams24,Has Trump ever actually landed in a third world country? Wow. #debates,1474940344599,780582497570557952,4
64,nwg83,Don the Con.  Fraudster-in-Chief.  #debates #Debates2016 https://t.co/7gH2Y2vG8o,1474940344660,780582497826381824,3
65,CaptainChaosMom,Bragidocious?? #Debates,1474940344714,780582498053005312,3
66,VMcVoterface,What is happening #debates,1474940344749,780582498199756800,0
67,amomanon,"""All my friends say..."" Oh! We're playing ""Name that logical fallacy"" now? #debatenight #Debates",1474940344791,780582498375831552,0
68,emilita_jane,Can we get over the emails and talk about real things!!!! #Debates,1474940344744,780582498178772992,3
69,MikeRTweeting,"Ironic, Trump talking about airports #debatenight #debates",1474940344744,780582498178924544,1
70,Tucker_Carlson,"That's it, praise the banks that tanked the housing market you benefited from. #Debates",1474940344708,780582498027712513,0
71,kathybiele,"I have a tremendous income - not braggadocio way @realDonaldTrump 
#debates",1474940344620,780582497658691584,3
72,MehlynnDUH,😭😭😭😭😂😂😂 https://t.co/1liWjwIQJg,1474940344759,780582498241744896,2
73,stardaniellee,Dawg i'm voting for Jesus #Debates,1474940344795,780582498392743936,0
74,BeerGuyRobert,Who would be your running mate? #debates @DepressedDarth,1474940345672,780582502071021568,2
75,LindaKWS1,#HillaryClintonsQualifications and accomplishments #ImWithHer @HillaryClinton #Hillary2016 #DumpTrump #Debates2016… https://t.co/BNmPYYZBhI,1474940345595,780582501748092929,2
76,kellybrooks03,Just watching the presidential debate like... 🇨🇦🇺🇸#debates #ImWithHer https://t.co/eND1FVcFZV,1474940345431,780582501060321280,2
77,mg_jacobs,Hillary has no clue how to manage money. No way in hell she should manage our tax dollars! https://t.co/1uHhoCu9Kb,1474940345529,780582501471444992,2
78,imerikuh,If Trump's hiding something in his tax returns it can't be nearly as bad as what was in the thousands of emails Hillary deleted 🙄🙄 #debates,1474940345692,780582502155059200,0
79,DSNyDE,"Come on, LAX has come a long way. #debates #Debates2016",1474940345696,780582502171680768,3
80,real_kim_wyatt,😂😳 https://t.co/2JsRFJDrXN,1474940345722,780582502280798208,2
81,Bzzy_Bee,This circus is out of control #debates #Debates2016,1474940345716,780582502255636480,3
82,silver_sivan,"how to run a country: watch ""the shows"" #debates",1474940345658,780582502012448768,4
83,NoFreeSpeech69,Darling we're screwed no matter which of these lunatics wins https://t.co/Z7oaWZBpHE,1474940345644,780582501953798144,2
84,ChanSteele,Make airports great again. #debates,1474940345730,780582502314323972,1
85,tj02192943,Instead of talking about what she can do for America she's harping on tax returns? We know she owes money to a Terrorist country!  #debates,1474940345815,780582502670802944,0
86,theChandraMoore,LAX has a Lemonade. I think it's great. #debates,1474940345811,780582502654107648,3
87,HeyHeyTayTay28,Someone who knows about money? May I suggest Jed Bartlett for president? #debates,1474940345778,780582502515761153,0
88,MaWhite79,LOL! https://t.co/jlQQCKnB2U,1474940345806,780582502633119744,2
89,darklingmp,I'm so scared for our future. How could these two be the candidates? Is this really who the U.S. voted for? #Debates,1474940345839,780582502771466240,2
90,AlaskanRadical,Trump says US is a Third World Country. #debates,1474940345783,780582502536613888,4
91,litboi69,Wait let me get that bank list (?) #debates,1474940346691,780582506345050112,0
92,texanjuliet,How is that these 2 both dodge answering every question? They just shift blame and point fingers. #debates,1474940346695,780582506361790465,3
93,louisey,A list of banks... ? Wtf is happening here. #debates,1474940346690,780582506340945920,0
94,leos_haus,An idea of money? You've gone and filed for bankruptcy HOW MANY TIMES? Don't talk about knowing money. #Debates,1474940346671,780582506261278720,0
95,MrDevvysAccount,the last person who was all about money ran america into the ground #debates,1474940346607,780582505992814593,2
96,shanegivesmelif,Wait you haven't watched this yet? GO NOW WHO CARES ABOUT THE #Debates (just kidding educate yourself but you know) https://t.co/c7esWnq8ib,1474940346677,780582506286370816,3
97,howie29uk,Watching this debate is the closest I'll ever get to being waterboarded.  #Debates,1474940346450,780582505334341633,3
98,JamesDalgarno_,"""We have become a third-world country,"" #Trump says. #Debates #debates2016 #Clinton #Trump",1474940346713,780582506437439489,4
99,shepardprice,Has Donald said one specific tonight? #debates,1474940346756,780582506617712640,3
100,BoomerColombine,"The emails! The emails! The emails! The emails! That's all I have. Oh and blame everyone for everything. Except me I'm ""brilliant"" #debates",1474940346765,780582506655387648,3
101,TampaBayReMax,"Hillary
 is getting ready to fall over #Debates",1474940346732,780582506517135361,3
102,Pastabea,I am very under leverage. WTF ones that mean.#Debates,1474940346693,780582506353614848,0
103,CEOofHope,Donald just said that IF he hasn't paid taxes that would make him SMART. Donald? That's a FEDERAL. CRIME. #debatenight #debates,1474940346815,780582506865172480,3
104,JonathonMcNeil1,He's flopping all over the stage on these tax returns. He had to know this question was coming. #debates,1474940346712,780582506433286144,0
105,mikeflacy,Bragadocious? So many new words. #debatenight #debates,1474940346817,780582506873524225,2
106,hexb1999,Bragadocious #Debates,1474940346873,780582507108372480,3
107,TheBookRat,How long do we think The Donald would last in a convo where adverbs and adjectives were banned? Just curious. #Debates,1474940346802,780582506810765316,3
108,malkovichmusic,"""I could give you a list of banks.."" we'll just take the tax returns, thanks. #debates",1474940347672,780582510459625474,0
109,beccaaboo2,"Someone bet him a lot of money that he couldn't work ""bragadocious"" into the conversation #debates",1474940347627,780582510271029248,3
110,CyclingDyke,I gave in. Be kind  #Debates,1474940347552,780582509956378624,3
111,iKayOreOo,"Hillary's face when Trump said ""Bragadocious""
#Debates #Debates2016 https://t.co/x53vDvMd10",1474940347392,780582509285433344,3
112,Josies_tweets,He's burning her before he burns the country https://t.co/0ejdRKfGWn,1474940347575,780582510052843520,2
113,DeAnnaCai,someone tell hillary she has lipstick on her teeth!!! &gt;.&lt; #debates,1474940347641,780582510329729025,2
114,broncomaniac7,#releasetheemails #debates,1474940347772,780582510879084544,3
115,trjh,"Maybe the US wouldn't be so badly in debt if people paid their taxes, Donald #debates",1474940347726,780582510686310405,3
116,reroll,BOOM! https://t.co/3cgNZs7MF9,1474940347645,780582510346592256,2
117,mahercbeaucoup,my list of banks is the best. I have the best list of banks #Debates,1474940347618,780582510233288705,0
118,CwinTalk,"""Bragadocious"" #debates",1474940347665,780582510430416898,3
119,t_stiver,She looks like she's having a seizure! #Debates,1474940347763,780582510841491456,3
120,iNdabz,Give us the list then #debates,1474940347676,780582510476533760,0
121,samrenee2010,Hillary.... LOOSEN UP.  STOP TALKING LIKE A TYPICAL POLITICIAN!  GO AFTER HIM WITH FORCE.  #debates,1474940347745,780582510765932546,1
122,stormclennan,"Honestly don't need a tv to know what's going on in the #Debates .. btwn my family gc and twitter, I feel like I'm there bih",1474940347767,780582510858305536,2
123,yib_elbashir,LOOOOOOL https://t.co/J7cVObNl5S,1474940347587,780582510103257088,2
124,christianfrano,"""ESSENTIALLY financial report OF SORTS"" Stop trying to distract people by talking circles around your shady stupidity.  #debates #nevertrump",1474940347757,780582510816133120,3
125,ahbeef,who cares about fucking airports shut up #Debates,1474940348712,780582514821697537,1
126,PinkPolitical,How is he patriotic when he spends all this time trashing the US? #debates,1474940348734,780582514913980417,2
127,itsukoii,as a canadian watching the #debates I AM SO SORRY,1474940348665,780582514624696321,3
128,nerelleque,Why does Hillary keep blinking so much? #debates drinking game,1474940348695,780582514750529536,3
129,2TheImp,"""Our airports are like a 3rd world country."" WTF?! #MomsAgainstTrump #debates",1474940348332,780582513227993088,4
130,PrincessJosJos,"Donald is trying so hard to reassure everyone, mostly himself, that he's rich #Debates",1474940348655,780582514582781953,0
131,cannonjw,"I don't care about emails. I don't care about tax returns. Can't imagine I'm alone in this. Lester, get your stuff in order. #debates",1474940348599,780582514347876354,0
132,JacobBlackAUTOS,WOW. @LesterHoltNBC not even going to point out that the Republicans have also used their own email servers?! #debates #toothlesstiger,1474940348583,780582514280849408,0
133,SNOOPaLUPE,We really need @GovGaryJohnson on the #debates,1474940348721,780582514859454472,2
134,SamAshleyBlogs,"Did he just say that LAX, Kennedy are dumps? Third world country? I think you need to check your privilege at the door, dude.  #debates",1474940348616,780582514419240961,3
135,TitansHomer,"""Fuck LAX"" - Donald Trump

#debates",1474940348757,780582515010523136,3
136,LKFiction,I'm trying to do my civic duty but the #debates are stressing me out and it's only just started,1474940348689,780582514725355521,3
137,bigtallduncan,Braggadocious! Whoa! #Debates,1474940348707,780582514800799745,0
138,babybearwear,Debate has me more on edge than #GameofThrones. Where's a Xanax? Where's a #whitewalker?! #debates,1474940348761,780582515027251201,3
139,eurogirl24,Bam! Hit her hard!!! LOVE IT!!! https://t.co/MEvulPXJd9,1474940348731,780582514901389312,2
140,WormLightning,The Oswalt Brothers are killing it! I think @MattOswaltVA is slightly ahead of @pattonoswalt on the irreverence. #debatenight #debates,1474940348797,780582515178254336,3
141,sydneysol07,"this man really said ""bragadocious"" ...someone look that up please #debates",1474940348741,780582514943492098,2
142,lizzettejannett,$650 million isn't a lot of money??? What is Trump on and where can I get some? #debates,1474940348767,780582515052572676,0
143,wesleyryanboyd_,I just told @nbcwashington who I think is winning. Cast your vote now! #Debates #NBC4DC https://t.co/GzRKBLgtMD,1474940349668,780582518831493121,3
144,happyhowey,bragadocious......new trumplish word? #Debates,1474940349598,780582518538002432,2
145,ravii97,"""That makes me smart"" lmaoooo is this a joke #debates",1474940349702,780582518974210048,3
146,GabrielleMcKeon,our country is a mess and so am i  #Debates,1474940349702,780582518974091264,4
147,LindsKris,i had no idea airports were now a political issue #debatenight #debates,1474940349640,780582518714171393,1
148,princxpar,Huh… #thirdworldcountryairport #debatenight #PresidentialDebate #debates,1474940349711,780582519011938304,3
149,KimberlyInezDC,"""It's about time a rich person has power!!"" -Trump #Debates",1474940349728,780582519083196416,0
150,JillianPenrod,I always feel like Elle Woods when I work out and watch politics @RWitherspoon #debates,1474940349700,780582518965821440,2
151,mjsante,Fact check: Is Trump as rich as he says he is? #TCDebate #debates,1474940349646,780582518739210240,3
152,TJCorc82,The countries with slave labor have great airports #debates,1474940349690,780582518923726849,1
153,mykuhlann,Donald ever been to a third world country airport? 🤔 #debates,1474940349732,780582519100112896,4
154,TheChunkiest,"How many times has he mentioned our debt crisis, but don't mention how to fix it?? #Debates",1474940349746,780582519158616064,3
155,sliver2964,Swiss bank accounts  #Debates,1474940349783,780582519314022400,3
156,kassy1979,"hahahah
 https://t.co/RifNuf1YfM",1474940349661,780582518802288640,2
157,sgehler,"Donald, how many of your constituents do you think are routinely flying from Dubai to LAX? #debates",1474940349798,780582519376793600,3
158,RonG30,@realDonaldTrump is a joke #debates https://t.co/Hal6V29GMd,1474940349548,780582518328360960,2
159,RealBillWorkmen,"""Under leveraged"" @realDonaldTrump your poor.  #PresidentialDebate #debatenight #Debates #HofDebate16",1474940349825,780582519490039809,3
160,DanyealWilliams,Can someone bring up his statements about women? About immigration? Could be your target Hillary. #Debates,1474940349776,780582519284596736,3
161,RockMasterFly,"With his aggression towards her, we're seconds away from Trump dropping a ""what is she doing out of the kitchen"" joke #Debates",1474940349842,780582519561302016,2
162,QuarterNote_,So @HillaryClinton is crushing this right? I'll admit I am biased but it seems like she is crushing it. #debates,1474940350419,780582521981530112,3
163,thomasjohnston7,#Debates He's not running for President to get rich. She got Rich off the American people.,1474940350624,780582522841276416,2
164,jessica_ley_,Why are we talking about airports #Debates,1474940350612,780582522790907904,1
165,zoitsa1300,He is calling us a third world country? Does he know the definition? #debates,1474940350504,780582522338050048,4
166,Blackair318,@realDonaldTrump it made you smart not to pay taxes.. #Debates,1474940350591,780582522702991360,3
167,Ltos5363,I wish she just used her middle finger to scratch her nose while looking at #trump #Debates,1474940350529,780582522442899456,0
168,SophiaPolicy,Supercalafragilisticexpi-Braggadocious #socpolnyu #Debates,1474940350612,780582522791026688,0
169,Zach_Stephens,YEAH THE EMAIL SCANDAL IS BAD. HILL'S JUST PLAYIN' BALL THO'. #Debates,1474940350378,780582521809543170,2
170,theplayfulmedic,Watching the presidential debate makes me SO happy to be Canadian and very scared for my neighbours to the south.  #debates,1474940350530,780582522446942209,3
171,MichaelKeene,Bra.... bragadocious? #debates,1474940350704,780582523176820736,2
172,Kwaselow,TRUMP JUST SAID OUR AIRPORTS AREN'T NICE ENOUGH IN RESPONSE TO NOT RELEASING HIS TAX RETURNS #debates,1474940350695,780582523139088384,0
173,makosharkattack,bragadocious? #buyadictionary #Debates,1474940350720,780582523243900931,2
174,EvelynO55,@MerriamWebster you are the definition of brilliance! https://t.co/mzOTAS14oA,1474940350470,780582522195410945,2
175,Lin_Dolin,Too many people think highly of T bcz T doesn't pay taxes &amp; bullies people to take less $$ on invoices. #debates #nevertrump @buckhollywood,1474940350696,780582523143270400,3
176,mirrormatt86,'our airports are like a 3rd world country.' ... how does @realDonaldTrump know? wouldn't he fly private? #DebateNight #debates,1474940351687,780582527299784704,4
177,kristiezernack,He's just listing numbers. That's literally what he's doing. Nonsense. #debates,1474940351649,780582527140528128,3
178,ksteeno,"""our airports are like a third world country"" says the man who only flies via private jet #debates",1474940351617,780582527006154752,4
179,andreafaire,Does this mean...is he planning a TrumpAirport?? 😐😑 #debates,1474940351671,780582527232839681,3
180,RobynCorvin,This is like my early childhood... My parents arguing.  #Debates,1474940351590,780582526893101056,2
181,JStuartMacLean,"#debates ""Money is money, paper is paper"" - Thomas Paine https://t.co/WCvgvMqYVt",1474940351593,780582526905495552,2
182,TheMinskys,".@realDonaldTrump thinks that avoiding taxes domestically is 'smart', but doing it overseas is 'wrong'. #debates #hypocrite",1474940351654,780582527161491456,3
183,USChamber,The #TPP would mean better jobs and significantly higher wages for American workers https://t.co/HGB0QOFqXo… https://t.co/UmwDMt49zx,1474940351455,780582526326890496,2
184,TheSaharZ,"$650 million dollars is ""not a lot of money"". The Donald there, appealing to working-class voters. #debatenight #debates",1474940351665,780582527207694336,0
185,saltytoastAU,For real he's complaining about airport decor???? #debates,1474940351778,780582527681507328,3
186,tracee,"Our airports are like a third world country? Dubai and Saudi ones have been built by KINGS, not countries like the U.S. #debates",1474940351705,780582527375319041,4
187,DxpeVssJvs,Yea Trump isnt releasing his tax returns &amp; Clinton isnt undeleting her emails ... #debates,1474940351819,780582527853441024,0
188,dealsamongus,I'm so confused when the topics switch when Trump talks #debates,1474940351788,780582527723380736,3
189,SaraMargaritaA,"Never related to Trump more than when he just generally dropped that he ""has friends,"" just to make it clear. #debates",1474940351714,780582527413194753,3
190,StraightGMoney,what is he even talking about????? #debates,1474940351692,780582527320883200,1
191,IamGMJohnson,"Did he just call our Airports ""3rd world"".  LMAO #debatenight #debates #Debates2016 who gives a shit about what an airport looks like",1474940351766,780582527631233024,4
192,joycearns,bragadocious?  #Debates,1474940351835,780582527920582656,3
193,nicolabennettau,that moron rambling next to Hilary is everything wrong with modern society. and my Tuesday.  #debates,1474940351847,780582527970840576,3
194,ThisIsSabby,"Trump: No seriously guys, I'm really f***ing rich! #debates",1474940351684,780582527287300096,2
195,Sammy316316,#debatenight #LetGaryDebate #debate #debates https://t.co/bHUULRKTuZ,1474940351753,780582527576645633,3
196,iamsporty657,This debate is a joke just like most people expected to be lmao #debates,1474940352678,780582531456495616,3
197,shellylynn14,@MeatSauce1 why weren't you included in the #debates tonight? #makeamericawailagain,1474940352571,780582531007516673,3
198,Alyx31,Let's fact check braggadocious!  #Debates,1474940352637,780582531284348930,0
199,BekahEve,"""I have a tremendous income"" lol #Debates",1474940352687,780582531494207488,2
200,dmorgante94,"I would much rather see Hillary's deleted emails, than Trumps tax returns. #debates",1474940352643,780582531309580290,0
