,screen_name,text,timestamp,tweet_id,cluster_pred
740,TomYoungComedy,"I have no idea what Trump just said. Finish a sentence, man. #debates",1474941093762,780585639788019712,0
741,elleabis,Haha didn't know my lovely suburban home with spa and pool is hell. Compulsive stereotyping of people. Not beautiful.  #debates,1474941094498,780585642875031556,1
742,ceciliamarie,I agree with Trump. We need Law &amp; Order instead of watching whatever this is.#debates,1474941094622,780585643394998272,2
743,Braeden_Mayer,nugh #Debates,1474941094644,780585643487350784,0
744,T_monster,Uh uh. No it wasn't. I know you are but what am I? -Trump on #StopAndFrisk #debates https://t.co/lF7TKrsOTf,1474941094370,780585642338246657,0
745,RickXX6,#debates Guys. Dont forget to head over to your Facebook Newsfeed after this for all the intelligent post-debate discussion. #JustKidding,1474941094665,780585643575345152,1
746,Qwezzy215,#Debates these rich motherfuckers just want the title they don't give a fuck about me or america,1474941094655,780585643533565952,0
747,bugmango,"It's amazing that someone can say so much, while saying nothing at all #debates",1474941094672,780585643604742144,1
748,_chaichai7,so HOWWWWWWW. law and order how. by taking away guns? or what what. #Debates,1474941094687,780585643667812352,2
749,DeitschFactor,#Debates How many is that compared to the gun deaths in Chicago from the ten years prior to @POTUS?,1474941094618,780585643378249728,1
750,ToothpasteWords,"Everytime Trump talks about Law &amp; Order, I think of the TV shows..... #debatenight #debates #Debates2016",1474941094667,780585643583926272,2
751,lancekarasti,I love how Trump just corrected a black man on if a policy is racist. Whitesplaining to the max. And he got away with it. #debates,1474941094718,780585643797721088,0
752,fmjosuel,"""Stop &amp; Frisk"" is just the opposite of ""Having better relationships"" ... Contradictory statements, Mr. Trump #Debates",1474941094653,780585643525206016,2
753,jedijojo,Trump arguing with Lester Holt about the constitutionality of stop &amp; frisk... And he wants minority votes? #Debates,1474941094755,780585643952910336,1
754,MrAltDennis,At least it's calmed down a bit but it's still über tense #govyo #debates,1474941094702,780585643730612225,1
755,MONEY,Everything you need to know about @realDonaldTrump’s corporate tax plan https://t.co/fDIUZlQjCJ #Debates https://t.co/ac2HpigCDW,1474941094066,780585641063088129,1
756,Mellysail78,Now interrupting the moderator. But wait he's African American so he doesn't matter. #TrumpLogic #Debates,1474941094629,780585643424550912,1
757,trudygonzales,#debatenight #debates So white people never commit crimes,1474941094713,780585643776684032,1
758,RoOonah511,#Debates Hola Trump 🤘🏽,1474941094754,780585643948830720,0
759,thelawyernerd,@realDonaldTrump has properties everywhere that he wants to make better with our money. #debates,1474941094843,780585644321968128,1
760,jazcomegetme,I wonder which version of Law &amp; Order Donald likes. I personally like SVU. #Debates,1474941094816,780585644208721921,2
761,T_Joix,"""We need law and order in the inner cities."" #truth #debatenight #debates #Debates2016 #WakeUpAmerica #OnlyTrump",1474941094836,780585644292616193,2
762,azab733,Trump talking about equality for blacks when his dumbass won't even condemn the KKK who strongly and openly support him #debates  #ImWithHer,1474941094750,780585643932024836,0
763,SamoraDat,Why does he hate African American and Mexican people?  #Debates,1474941095667,780585647778127872,1
764,kamalsingh,"There is only one party in US, where are other party candidates? Why are they banned from debates? https://t.co/Ix3wtJvnEA",1474941095566,780585647354425344,1
765,NattyLinn,"If you believe in ""stop and frisk"" u probably don't believe in white priviledge, but you're definitely living it. #debates  #Debates2016",1474941095548,780585647279050753,1
766,__kenzieroo,We need Detective Olivia Benson.  #Debates,1474941095705,780585647937556480,2
767,jstarkCLE,"As soon as they finally cancel all the Law and Orders on TV, Trump is asking for it back to save the country from profiling #debates",1474941095562,780585647337775105,2
768,yasmin1_ca,#trumped up history. https://t.co/agleM1cFzc,1474941095723,780585648012922880,1
769,Danakin33,"""Law &amp; Order!"" Except no regulations, no Geneva protocols, bring back stop-and-frisk, don't pay taxes, etc #debates #debatenight",1474941095612,780585647547396099,2
770,CullenHammett,I just told @nbcwashington who I think is winning. Cast your vote now! #Debates #NBC4DC https://t.co/NlUV2uJaeL,1474941095601,780585647501369346,2
771,BethanySwinney,"Except for #HillaryClinton, right? https://t.co/33wRdi24BT",1474941095502,780585647085989889,1
772,TheTygryss,"These ppl. Felons. Bad ppl. Way 2 lay the bricks, Donald. #Debates",1474941090977,780585628106981376,0
773,JamieMBlanchard,I'm looking for all those stats to back up #Trump's rambling. #ImWithHer #debatenight #debates https://t.co/qXclkaewMq,1474941095571,780585647375384577,0
774,Filippellius,He is really doing nothing other than repeating platitudes over and over. #debates,1474941095666,780585647774072832,0
775,K_Brodas,😂😂 https://t.co/mEMjhWgctA,1474941095722,780585648008810496,1
776,SuCh,If this man says Chicago one more time... #debates #debatenight https://t.co/RFl3q7w6YZ,1474941095595,780585647476125697,0
777,jvzmoyer,"Trump: ""there's some bad things going on, some really bad things. "". Yes, like you speaking. Really really bad .   #debates",1474941095648,780585647698477057,0
778,_WMGilbert,I just told @nbcwashington who I think is winning. Cast your vote now! #Debates #NBC4DC https://t.co/kqlk0yU6pC,1474941095736,780585648067645440,2
779,lilyjenzen,Let's vote! https://t.co/LepR6ccVSO,1474941095826,780585648445005824,1
780,TheaHaigh,This is real life. 😩 https://t.co/YDeYBYy0yv,1474941096528,780585651389534209,1
781,KyleMeraz,I wish we had two different candidates #debates,1474941096735,780585652257640448,1
782,hJayk,"Would be nice if Donald has a detailed plan to restore ""law and order"" not just empty words #Debates",1474941096604,780585651708239873,2
783,HaileyLanierPR,🙌🏻🙌🏻 PREACH https://t.co/mYtuntLX7H,1474941096559,780585651519578113,1
784,BruceDwayne,We need LAW and ORDER ! Love that show. #Debates,1474941096345,780585650621968384,2
785,Neoptolemvs,SLAY HIM BABE #debates #SheWon #debatenight,1474941096691,780585652073168896,0
786,tamjomi,"We need more law &amp; order especially in the inner cities according 2 Trump! If that's not racist, I don't know what is! #Debates2016 #debates",1474941096682,780585652035448832,2
787,waifuz,#debates something came in the mail today,1474941096781,780585652450500608,1
788,TommyOnTheRadio,"We do need Law &amp; Order, Don...we do. #debates https://t.co/7y3b4YjKFd",1474941096326,780585650542313472,2
789,twerkingjohanna,I just told @nbcwashington who I think is winning. Cast your vote now! #Debates #NBC4DC https://t.co/7brWtRWcGg,1474941096673,780585651997728769,2
790,JStar4e,"""Stop and frisk: unconstitutional, but you got to have it!"" -Trump #debates #CantMakeThisShitUp",1474941096603,780585651704061953,1
791,foreverlorraine,Eating a taco bowl on Cinco De Mayo doesn't mean you know anything about Hispanics #debates #learn,1474941096844,780585652714819584,2
792,IamGMJohnson,Trump is SOOOO  LOSSTTTT on this Race question. SOOO LOST. He went wayyy left and got it wrong #debatenight #debates #Debates2016,1474941096693,780585652081532928,0
793,AustinVolador,Stop and frisk is UNCONSTITUTIONAL! #debates,1474941096855,780585652760956928,1
794,the_hooligan831,"I knew @MSNBC was going to be more harder on @realDonaldTrump than they are on @HillaryClinton 
#debatenight #Debates #Debates2016",1474941096875,780585652844802048,1
795,emergingexec,"#debates bragadocious, bigly,and me me me &amp; my hotel business. Would've been nice to hear some content.",1474941096790,780585652488441857,1
796,chevixter,"We need more police ""stop n' frisk"". Lol really Trump #Debates",1474941097668,780585656170885120,1
797,PopGirlsEtc,This is like an underleveled boss fight. #debates #notallelderscrolls,1474941097679,780585656216977408,1
798,dpcenturypools,The fact that we need fact checkers to verify both our presidential candidates should speak volumes to the state of our union.  #Debates,1474941097686,780585656246349824,1
799,angelayoussef,"we need LAW and ORDER ah, a true  revelation  #Debates",1474941097573,780585655772536832,2
800,sojennika,"So when all of these mass shootings happen, are African American and Hispanic people the problem? 🤔 #Debates",1474941097648,780585656087027712,1
801,PrincessLyss55,Does trump know what debate means? Supposed to let both candidates talk lol  #Debates,1474941097695,780585656284176385,1
802,Javaughn12,"Top Trump response: "" I have property there"" #ImWithHer #debates",1474941097536,780585655617392640,0
803,GoodOldMemo,Not in Texas Thoe🤘 #Debates,1474941097484,780585655399219200,1
804,vsreekanti,Trump so incoherent that he's losing his own train of thought while speaking. #debates,1474941097709,780585656342818816,1
805,Dark_Decay,"Trump has said the words ""Chicago"", ""Law and Order"", ""Guns"", and ""4000 people"" 50 times in the past 3 minutes.  #Debates",1474941097658,780585656129036288,2
806,ardenchopsticks,funny how he turns the gun issue from police brutality to gangs #debates,1474941097678,780585656212975616,1
807,Rachel_DC91,Trump loves Law &amp; Order. Someone get him the box set for Christmas #Debates,1474941097702,780585656313647104,2
808,SmackYourDookie,"""I'm proud of Chicago"" #debates",1474941097716,780585656372396032,0
809,Danny_Coradazzi,New favorite account #debates https://t.co/pyXEDj0xzk,1474941097509,780585655504101377,1
810,keonvw,"all i hear is Chicago is the ghetto, Blacks &amp; Hispanics are bad &amp; Blue Lives Matter 😴 https://t.co/tzz0rYviEi",1474941097626,780585655994843136,2
811,bdf,"""I have property there"" is my new favorite phrase  #debates",1474941097672,780585656187617280,0
812,ntnsndr,Both Clinton and Trump seem to agree that guns should be taken away from black people. @theyesmen say otherwise. #Sharethesafety #debates,1474941097691,780585656267345920,0
813,NerdOnACorner,"That voice when he said ""They have guns. And they shoot people."" #Debates",1474941097678,780585656212983813,1
814,mikeroz11,"How many times has Donald said ""law &amp; order"" in one response? #debates #vcusmclass #lawandorder",1474941097544,780585655650947072,2
815,cencia7895,Yes https://t.co/j71ix5B6AM,1474941097665,780585656158416896,1
816,Perkins4Action,nice shot. https://t.co/pF9HhwzUPP,1474941097111,780585653834743808,1
817,michaelrthomas2,This is what he want for black people. https://t.co/T5tRtyqbgs,1474941097621,780585655973863424,1
818,tonylowephoto,It sounds like Donald has a cold. He must not be capable of facing the riggers of a presidential campaign. #debates,1474941092612,780585634964660224,1
819,SuperheroRadio,"""So there's some bad things going on, some really bad things. And we need law and order""--Trump #shameful #Debates",1474941092268,780585633521729536,2
820,vampiregoddess8,"so Lester states a FACT, and Trump responds immediately, by saying that it's untrue #debatenight #debates #Debates2016",1474941093007,780585636621279232,0
821,maru107,He is just a very bad candidate for the job https://t.co/Fi1YwVnm6p,1474941098558,780585659903934464,1
822,Wasabimame1,새누리당으로 영입되면 좋을분이 있다! #Debates,1474941098693,780585660470005760,1
823,frankoanderson,"""That was unexpected: Trump fact-checks Lester Holt"" - @RafaelArancibia #debates2016 #debates #debatenight",1474941098635,780585660226961408,0
824,wpphibou,"""Obama is from Chicago"" -Trump
No shit. #debates",1474941098525,780585659765522432,0
825,JustEric,Bring back Law &amp; Order: Criminal Intent #TeamDOnofrio #Debates,1474941098694,780585660474396673,2
826,bWALK_it_out,Trump wants militarized zones... No thank you #Debates,1474941098633,780585660218499074,0
827,DKLAshley,trump said immigrants are gang members. said they're also bad people. #debates,1474941098647,780585660277063680,1
828,emcclatch,ok but POLICE have killed at least 790 people since the beginning of this year alone so? what are u going to do about that donald? #debates,1474941098702,780585660507914240,1
829,sabrinabrowne_,THIS! 👇💥 #Debates https://t.co/dAK0OiQmJV,1474941098643,780585660260507648,1
830,IrieCultura_,"He's contradicting himself, go away. #Debates",1474941098705,780585660520562688,1
831,carolinabasille,SIM CLINTON!!!!!! #Debates,1474941098647,780585660277198848,1
832,BigSixxRaven,#debates   My ex explained how to get in my pannies better than Trump trying to explain about crimes against blacks. Le sighhhh,1474941098772,780585660801363968,1
833,Ian_Flat,I need Law and Order back on Netflix #debates,1474941099678,780585664601427968,2
834,rachelenader,Did @realDonaldTrump just tell Lester he was wrong?#Debates #Fanny2016 #IdRatherVoteFanny,1474941099657,780585664513318912,1
835,Ash_in_PDX,Watching the #debates from the Philippines right now. I'm embarrassed.,1474941099666,780585664551104513,1
836,jwb625,Donald Trump - They're Bad people. Bad people. BBad. Bad starts with a B. Just saying. #debates,1474941099593,780585664245104640,0
837,cheysshi,you're not talking about race tho. why are  you avoiding race? #Debates,1474941099701,780585664697937922,1
838,Darth_Rthano,"""He didn't pay any federal income tax.""
""That makes me* smart.""
So NOT supporting the country that you want to run makes you great? #debates",1474941099621,780585664362471424,1
839,daniel333,"War on Drugs is 50% of the incarcerated. without ending that, there will never be real reform. https://t.co/ueMTEdldrj",1474941099615,780585664337235969,1
840,Blacksin73,Hillary Clinton like her husband are chameleon #debates,1474941099711,780585664740024320,1
841,FloridaGov,"""These are bad people."" -@realDonaldTrump who Latinos and African Americans? #debatenight #debates #Blacklivesmatter",1474941099693,780585664664305664,1
842,jamalrustler,"Lester shut the fuck down by Trump as he tried to interrupt. Lester, why do you sit quietly for Hillar? #debates #debatenight #Debates2016",1474941099712,780585664744153090,0
843,Brigida__Santos,Me too. https://t.co/jSsstEmiqM,1474941099627,780585664387526656,1
844,tyra_finch,"Both of them are referring a universal ""we"" who the fuck is that?? #debates",1474941099801,780585665117380608,0
845,VondaNorwood,"I like she claims he is a fraud, but she's lost me saying guns are violent. https://t.co/cBZ8x8eRaP",1474941099588,780585664223903744,1
846,sholt87,"Trump: ""Five police officers were killed, one night, very violently.""
Sounds like a Longfellow poem.
#debatenight #debates #Debates2016",1474941099761,780585664949739521,0
847,KraigBeaudoin,Someone should break the news to Trump that Jerry Orbach is dead. #NoMoreLawAndOrder #Debates,1474941099698,780585664685432832,0
848,DJSubterrain,#debates @BernieSanders What's disgraceful is that you didn't stand independently and stop these two.,1474941099278,780585662923825153,1
849,puppygrammy,"#Debates OMG trumps law and order, stop and frisk is making my popcorn pop right out of my mouth!",1474941099687,780585664639361025,2
850,STXLAURENT,I just told @nbcwashington who I think is winning. Cast your vote now! #Debates #NBC4DC https://t.co/YxpYvblrqC,1474941100614,780585668527480832,2
851,MarcusMrowka,One person on stage sounds presidential. The other sounds like a petulant second grader. #debates,1474941100226,780585666900029440,1
852,ranhaven,I just told @nbcwashington who I think is winning. Cast your vote now! #Debates #NBC4DC https://t.co/2PVfrSOjHh,1474941100609,780585668506423296,2
853,pshil16,Wrong?? Where are the highly paid hot shot quant guys in trump organization? https://t.co/wsN261gmKr,1474941100671,780585668766412801,0
854,BoboDoobee,Many. https://t.co/Lie8f5DiXC,1474941100706,780585668913143809,1
855,Arestelle,"gorram it, I can't anymore. I just can't. good night internet. #debates",1474941100532,780585668183465984,1
856,badgalrr,trump denying racial profiling is a real thing is quite scary but something I knew he would say #Debates,1474941100754,780585669114535936,0
857,JessicaHuseman,"Now I have the law and order theme song stuck in my head, damn it. #debates https://t.co/WTzXXDriym",1474941100442,780585667805974528,2
858,According2Mandy,Yes!!! https://t.co/eauzUovLLy,1474941100556,780585668283990016,1
859,WisdomRow,HOW ARE YOU BRINGING LAW AND ORDER? HOW WILL YOU TAKL TO PEOPLE? HOW WILL YOU TAKE AWAY GUNS? #Debates,1474941100710,780585668930052096,2
860,erickmschmidt,"Trump be like......
#debatenight #debates https://t.co/pyVtK9W2vC",1474941100586,780585668410011648,0
861,att4lif2,stop and frisk is essentially what the democrats thought arizona SB 1070 was #debates,1474941100900,780585669726904320,1
862,martynies,"HELL NO, Trump. He is INSANE!! #Debates",1474941100761,780585669144023040,0
863,GOPbaldspot,Did Trump just say he was going to take guns away? #debates,1474941100770,780585669181575169,0
864,Seckbach,Trump says since obama took office 4000 people have been murdered in chicago wants to bring back law and order #debates,1474941100830,780585669433266176,2
865,ReallyAmerican1,@realDonaldTrump lying again! #debatenight #debates #factcheck https://t.co/j9ge2uTFtJ,1474941100712,780585668938387456,1
866,PuntReturner,"""We need law and order""  den den 

#debatenight #debates",1474941101681,780585673002618880,2
867,babyducker,"Holy shit ""we need stop &amp; frisk"" wow @realDonaldTrump full of smarts aren't you? Apparently fuck the law #debates #voteforgary #DumpTrump",1474941101583,780585672591577088,2
868,matteastwood,Talk about sound bites ... taken altogether this is just a bunch of Trump gibberish ... #debates,1474941101702,780585673090662400,0
869,averagesnipe420,Trumps grammar is Worse than his plans  #Debates,1474941101723,780585673178755072,1
870,MEanErnie,Where is this collaboration!? #TrappedInTheTower https://t.co/yAXXlD1fCS,1474941101601,780585672667049984,1
871,xzatcheryx,I'd rather be watching The Manchurian Candidate. I'd rather be apart of The Manchurian Candidate.  #PresidentialDebate #Debates2016 #debates,1474941101597,780585672650297344,1
872,lizzyg67,#Debates trump is a joke,1474941101694,780585673057181698,0
873,stanrisdon2,"Holt forgot that ""stop and frisk"" is constitutional use of police powers based on Article 12.... https://t.co/f8ekVgBN83",1474941101511,780585672289685508,1
874,VEPeyton,Such a way with words https://t.co/dlNJi6O3Fs,1474941101261,780585671241129985,1
875,supermariaabros,I just told @nbcwashington who I think is winning. Cast your vote now! #Debates #NBC4DC https://t.co/Wq95xB5Gdx,1474941101694,780585673057263616,2
876,OfficialGarwood,This guy is running for president. omfg #Debates2016 #debates https://t.co/ed1GESq1to,1474941101496,780585672226766848,1
877,michelito13,Creo que las directrices del discurso de trump son lo más parecido a la programación de AXN de los miércoles  #debates #Debates2016,1474941101764,780585673350717441,1
878,gray179662_,Archie Bunker go back to Trump Tower. #Debates,1474941101715,780585673145192448,0
879,TheRealKamie,If he mentions one more place he has property... YOU HAVE MANY A CAUCASIAN HOME - WE GET IT. #debates https://t.co/nHzJukJFfH,1474941101385,780585671761223680,0
880,caitlinrain,"Does anyone have Chicago shooting stats handy? They are v high this yr, but I don't think that high... ? #Debates",1474941102595,780585676836335616,1
881,jovenk25,"I just told @nbcwashington who I think is winning. Cast your vote now! #Debates #NBC4DC
https://t.co/zaqqiaE6Ob",1474941102589,780585676811022336,2
882,MegMa88,Haha trump has property in Chicago...in the loop..let's send him to the south side.. #debates,1474941102573,780585676743938048,0
883,13AndrewsP,Glad I tuned in for the Lester Holt vs Trump #debates,1474941102658,780585677100425216,1
884,SparksImagine,i like that hillary addressed that it's cops shooting black teens and donald says it's all gangs.  #Debates,1474941102587,780585676802760704,0
885,robertwgee1,"What was the over-under on ""law and order""? #debates",1474941102683,780585677205319680,2
886,ArmandoAvilesJr,"@HillaryClinton, she's calm and collected.  @realDonaldTrump ...frazzled. #Debates2016 #debatenight #debates",1474941102631,780585676987305984,1
887,Alex_Flecha16,America is fucked. How did we let it come down to these two? #debates,1474941102783,780585677624864768,1
888,JeffCallahan75,So now the Black community is the emerald city now? LOL  #debates,1474941102713,780585677331234816,1
889,30ishRealist,"""Your two minutes are up, please deposit your tax return @realDonaldTrump"" #debatenight #debates",1474941102778,780585677603733504,1
890,MittRegularGuy,"Does Trump think the torture rooms the Chicago Police Department had to beat blacks has anything to do with community relations?

#debates",1474941102788,780585677645877248,1
891,jamaicawest312,So you're just going to bring up Chicago as a scapegoat for systematic racism ? #BOYBYE #Debates,1474941102654,780585677083770881,0
892,Philip_Coleman,Trump limiting his vocabulary to that of a Hank the Cowdog book to try to better communicate to millennials #goodpeople #badpeople #Debates,1474941102809,780585677733957633,1
893,johncbussey,"Stop and frisk, the wrong way to reach out to blacks &amp; hispanics, disproportionately stopped and frisked. Ruled unconstitutional. #debates",1474941102580,780585676773396480,1
894,Belen_Moran,Trump who are you calling and people?  Cállate! #debates,1474941102867,780585677977227264,2
895,el_sanchez7,Race relations can be solved by removing guns in our communities. Simple as that. Hollow responses from both sides. #debates,1474941103672,780585681353449472,1
896,ultidc,boy denied racial profiling bye #Debates,1474941103686,780585681412235264,0
897,shars_books,"No solutions but offensive comments. 
#debates #debatenight",1474941103630,780585681177411584,1
898,CaitlynLewis404,"Trump kept saying in Chicago blah blah, its all over other cities too. Shooting is rampant #debates",1474941103665,780585681324081153,0
899,AirGuitarGenius,"I think what we really need is more White politicians telling Black people in the ""inner city"" what we ""need."" #debates #fb",1474941103470,780585680506413056,2
900,Freedomrings22,#debates she's made none https://t.co/NEdb2l40pa,1474941103626,780585681160638464,1
901,dnova03_2,"#debates #debatenight
Holt you know shit blacks commit disproportionate rates of crime
https://t.co/Im1PWpr9cO",1474941103611,780585681097818112,1
902,LizHoey,@realDonaldTrump sees no value in places where he doesn't have investments. Human (esp black) life has ZERO VALUE to him. #debates,1474941103611,780585681097601024,1
903,robertalexander,We need LAW and ORDER. #debates,1474941103711,780585681517092864,2
904,ChynnaHaas,Has Trump ever actually read the United States Constitution? #HighStakesNov8 #debatenight #debates,1474941103719,780585681550573568,1
905,punkrockruhle,"""a very against police judge"" lmfao #debates",1474941103650,780585681261322240,1
906,ppc59,@HillaryClinton is not the one to do that https://t.co/Ebs9UeFzlC,1474941103537,780585680787374080,1
907,Stormviking010,"He might have pneumonia, or zika...Either way sniffling must mean he's dying.. Right? #debates #debatenight https://t.co/xoiZBJ6e15",1474941103703,780585681483472896,1
908,sbnorthart,"Depends on what ""winning"" is right? Substance? It's ny even a contest. #Debates2016 #FactCheckTheDebate #ImWithHer https://t.co/AGwRdJaZDj",1474941103696,780585681454325760,1
909,rozakush,#Debates https://t.co/3joEfNSSLs,1474941103227,780585679487115265,1
910,iCannnon,This man seriously doesn't have a clue. I hope this debate is making people realize how unqualified Donald Trump is. #Debates,1474941104665,780585685518389248,2
911,AnnaSophiaKlap,"I know law and order is a Nixon/Reagan theme from the 60s, but I keep hearing the soundbite from the tv-show not #veryverygood #debates",1474941104660,780585685497577473,2
912,keenanvil,"""A very against police judge... and something tells me this is a guy that would say everyone in this country needs to speak English.#debates",1474941104683,780585685593894912,1
913,bvsedDEEZY,HOW DO YOU PUT THE FAULT ON BLACKS AND IMMIGRANTS WHEN THE KILLINGS ARE COMING FROM WHITE COPS 😑😑😑 #debates,1474941104684,780585685598113793,1
914,falconzy,突然觉得，这两人，就是欧阳锋和岳不群嘛。。。 #Debates,1474941104647,780585685442961409,1
915,hayter_robin,Mediator: But that was ruled unconstitutional. Trump: We still need it! #debates #debatenight,1474941104563,780585685090656256,1
916,LyingCandidate,Did @HillaryClinton just admit she attends @realDonaldTrump rallies?? I think she did!! #debatenight #debates #Debates2016,1474941104693,780585685635825664,1
917,imakittencx_,Trump keeps repeating himself. :/ #debatenight #debates,1474941104706,780585685690482688,0
918,34thState,"It worked in the movie ""Dave."" https://t.co/EfMUGeqSdg",1474941104692,780585685631676416,1
919,MDCMaineMarie,An admission of guilt. WOW He should be escorted straight to jail for tax evasion! #debates https://t.co/uXNmrkmCUQ,1474941104365,780585684260294656,1
920,TamiaBuffy,Lester get your shit together! Stop letting him talk over you. He can't answer the question about race relations. He is a racist. #debates,1474941104667,780585685526929408,1
921,CubanAvenger,"Watch live! ""U.S. Presidential Debates"" #Debates https://t.co/JtdnoVRBXc",1474941104779,780585685996609536,1
922,SuperbHerb,We need law and order...in corporate boardrooms. #trump #debatenight #debates,1474941104670,780585685539586048,2
923,HampsonJoshua,Did Trump just 'uh' a positive statement about the African American community? #debates #debatenight #Debates2016,1474941104664,780585685514350592,0
