,screen_name,text,timestamp,tweet_id,cluster_pred
775,MissNikkeyNik,Sooo Trumps solution to the racial divide and police shootings is to increase policing?! 😳 #debatenight #debates,1474940998633,780585240787947520,4
776,MarilynMead,They said illegal immigrants! Drink! #Debates #DebateNight https://t.co/Gturlh7KLh,1474940998261,780585239227863040,3
777,boatsandcurrent,"""A very against police judge."" Very eloquent. #Debates",1474940998730,780585241195012097,5
778,MichaelBeeman,"My brain stopped generating new memories out of self defense when Trump started taking about race, did it go well? #debates #debatenight",1474940998708,780585241102651394,4
779,aub_bre_bre,Is it just me or does Hilary look like a crayon?#Debates,1474940998803,780585241500979200,4
780,TheTrumpBlogger,"#debates We have ""Law and Order Candidate"" Trump still on 9/26/16.Where Hillary Clinton causes the shootings on police,by taking away hope.",1474940998778,780585241396203520,0
781,EvelinASantos,"So how about when the police is ""the  criminals"" 🤔 #Debates",1474940998762,780585241329082368,5
782,Dististik,I'm almost certain that illegal immigrant bs Trump just spewed isn't very correct. #debates,1474940998652,780585240867680256,2
783,craftjoshua,"Trump up here acting like he actually cares about black people. Boy, bye #debatenight #debates",1474940998795,780585241467580416,2
784,djcuri8,For a question about race Trump sure did avoid saying anything about race #Debates,1474940998802,780585241497010176,4
785,cgdh,"Tax-dodging American running for President, preaching ""if we don't have Law &amp; Order, we don't have a country."" #wtf #debates #Debates2016",1474940999674,780585245154213888,0
786,idkyourbfftiff,"There it is. Gangs are ""majority immigrants"". #debates",1474940999657,780585245083045889,3
787,rocnrollr,"Trump to Lester Holt ""no you're wrong"" regarding ""stop and frisk"" #debates what a child.",1474940999639,780585245007417344,4
788,stevasaurus17,"""I know people wouldn't usually rap this
But I got the facts to back this
Just last year, Chicago had over 600 caskets""
-@kanyewest #debates",1474940999674,780585245154287616,2
789,TrumpsDisciple1,#debates #Debates2016 #debatenight #Trump She is so messed up she looks like she is falling asleep.,1474940999722,780585245355614208,4
790,webjournalist,"Lester: Stop and frisk has been ruled unconstitutional.
Trump: No, you’re wrong.
#debate #debates",1474940999709,780585245301026816,4
791,TazhiLuxe,"I love that Donald Trump just told Lester Holt that he's wrong about Stop and Frisk. No, honey. You're wrong. #debates",1474940999655,780585245074685952,2
792,_iEditDreams,#debates https://t.co/vkCOTd0row,1474940999487,780585244369891328,1
793,eatapc,He went to the dog whistle: Law'n'order. #debatenight #debates,1474940999544,780585244609146880,0
794,alexajulian7,#debates,1474940999464,780585244273573888,2
795,OneliaEstudillo,He'll take care of this clown for sure. https://t.co/2avTOb2ztv,1474940999676,780585245162676224,1
796,BekaHaidet,We need to take guns away from bad people.... Hows that working with drugs? #debates #debatenight,1474940999770,780585245556875264,2
797,yolandaperry86,Stop and frisk was ruled unconstitutional dumb ass Trump!!!! #debates,1474940999664,780585245112492032,4
798,lauranico1e,"You've heard it here, if Law &amp; Order: Chicago is made, everything will be better. Dick Wolf, get on it!! #debates #Debates2016",1474940999717,780585245334708225,0
799,HampsonJoshua,I don't even know what Trump is saying anymore. Is he saying to take away guns? #debatenight #debates #Debates2016,1474940999663,780585245108232192,4
800,holonet242,A very against police judge #Debates,1474940999774,780585245573844992,5
801,mitchdotcom,"Lester: ""Well, stop-and-frisk was pretty controversial--""
Trump: ""No, you're wrong""
Lester:
#debates https://t.co/2IkanYdc7d",1474940999352,780585243803648000,2
802,mrbilltran,"Donald Trump doesn't know the definition of the word ""decimated."" Is this who you want in charge? #debates",1474940999854,780585245909274624,4
803,drocthaboss,How are the police afraid when they're the ones killing the citizens?  #debatenight #debates,1474940999806,780585245707870209,5
804,chadtheteacher,"OH DANG! LESTER HOLT PULLS OUT UNCONSTITUTIONAL LINE...but Trump follows up with ""bad people"", so I guess that's no big deal. #debates",1474940999687,780585245208752128,4
805,writingMaine,"Trump really say ""police are too afraid to do anything""? #debatenight #debates",1474940999757,780585245502562304,5
806,gracehelbig,"""a very against police judge"" #debates",1474940999955,780585246332899328,5
807,Zach_Brinkley6,I just told @nbcwashington who I think is winning. Cast your vote now! #Debates #NBC4DC https://t.co/OLA9ZsWIiJ,1474941000349,780585247985569792,1
808,kaaatttherine,@realDonaldTrump oh fuck off #debates,1474941000601,780585249042378752,2
809,juliadefreitass,Vou dormir com a mensagem: Trump é um bosta #Debates,1474941000551,780585248832778240,4
810,jonrud00,"""He was a very against crime"" Trump
#debates",1474941000420,780585248283324416,4
811,AdrianFig1,#LetGaryDebate #WhereIsGary #1Million @debates https://t.co/oFrLEZl0AO,1474941000440,780585248367190016,1
812,yinette_,So now illegal immigrates are the ones that are buying guns and are doing mass shootings. Okaaaaay. #debates https://t.co/d5y8GyWmQp,1474941000430,780585248325242880,3
813,Ollie_621,Lester Holt should not interfere at the #debatenight #debates #Debates2016STOP IT!!!!,1474941000634,780585249180905472,4
814,sadgirlc,Exactly. He's acting the like police aren't the ones killing people out here https://t.co/xOCkQBG68B,1474941000620,780585249122185216,5
815,hvnlygaines99,"#debates Thanks for the push back and facts about Stop and frisk, Lester",1474941000655,780585249269026816,4
816,Dailytakes,These two. Sigh. #debatenight #debates,1474941000487,780585248564404224,4
817,GTAGamingiFunny,Stop and frisk is not a racial thing. It's to articulate if someone has weapons #debates #debatenight get your facts right,1474941000705,780585249478541312,4
818,dbrown987,@realDonaldTrump questioning another Judge?! Seriously? That is actually horrifying  #debates,1474941000635,780585249185071104,4
819,jacobaf1221,Trump also just said that an unconstitutional ruling doesn't hold up. I don't think he quite understand what that means. #debates,1474941000834,780585250019618817,4
820,soulof98,Wth did trump say that had anything to do with the racial divide 🤔 #Debates,1474941000794,780585249852055554,2
821,Hram924,Trump is against guns now? #Debates,1474941000880,780585250212544512,2
822,MichelleF0918,"Hillary over there like, 😳😡, telling herself, ""Deep breaths, just take deep breaths."" 

#ImWithHer #Debates2016 #debatenight #debates",1474941001691,780585253614129152,2
823,jmgpix,"""He was a very against police judge"" #idiocracy is here folks #debates",1474941001643,780585253412954116,5
824,AnJaeWoo,트럼프가 국경에 장벽을 쌓으려는게 농담이 아닌가보다 (...) #Debates,1474941001713,780585253706403840,4
825,CenterStageKXLU,@realDonaldTrump what are you hiding?  Release your tax returns. #Debates,1474941001643,780585253412872195,4
826,dot_brave,"And, the #debates moderator takes a side finally.  #debatenight Was just a matter of time.",1474941001583,780585253161332736,4
827,NetteMarie_,oh lord stop and frisk? that'll make everything worse #Debates,1474941001613,780585253287104512,4
828,vickiringer,Trump doesn't know that stop-and-frisk has been ruled unconstitutional and he's arguing now with Lester Holt. #debates,1474941001043,780585250896408576,4
829,ArtfulDodger24,YAY NATIONWIDE STOP AND FRISK #Debates,1474941001565,780585253085798401,4
830,janeemmabarnett,I'm legitimately offended by Trump's response on race. Offended. #debatenight #debates,1474941001632,780585253366820866,4
831,dwb5192723,"Fact Check: Trumped Up Trickle Down?
Debunking The Leftist Fallacy of Trickle Down Economics
https://t.co/cmnP7VO9Gr #debatenight #debates",1474941001615,780585253295403008,4
832,StephenAnfield,"*3 hours pass*

Lester Holt: Mr. Trump, your 2 minutes have passed. #debates",1474941001656,780585253467402241,4
833,PatrickDowd88,Fact checks gonna be coming in HOT on this one. 🔥 #Debates,1474941001736,780585253802868737,2
834,SensiblySecular,"The hubris it takes to tell the moderator ""you're wrong"" - the uninformed, poorly educated #Trump. #debatenight #debates",1474941001690,780585253610061824,2
835,Larbzz,"""No it's not unconstitutional"" -the guy who wants the job to PROTECT THE CONSTITUTION. That is what it says when you're sworn in #debates",1474941001771,780585253949706241,4
836,lizziebowgirl,Missing @BernieSanders!  #debates #debatenight #Debates2016,1474941001562,780585253073195008,4
837,Inbredipus,"My god, Trump kinda looks like a dirty sock puppet. #Debates",1474941001712,780585253702406145,4
838,MaxwellSteele,I'm going to this show. It will be even funnier than all the collective hot takes on twitter tonight #debatenight https://t.co/Oj9KVN8ZHa,1474941001618,780585253308133376,1
839,BrintonMegan,Watching Donald Trump speak is making me reconsider ever bringing children into this world. #debates https://t.co/aYuRVwmm1P,1474941001688,780585253601615872,4
840,whitorwithoutyu,"Take the gun away from ""criminals."" The police? #Debates",1474941001803,780585254084050945,5
841,MKopil,He has no idea what Lester is asking him... #debatenight #debates,1474941002594,780585257401626624,4
842,RavennaBonet,Hey Hillary tell the blacks to stop rioting. #debatenight  #debates,1474941002629,780585257548394497,4
843,DanielDagris,So glad that Trump can fact check the fact checker... I wouldn't know who to believe. The fact checker or Donald's word salad. #debates,1474941002704,780585257863032833,4
844,da_Photobrick,"Hillary: Here's what you wanna here. ""We"" need to do this. Trump: LAW &amp; ORDER. Voting for #meteor2016 this election. #debates",1474941002549,780585257213001728,0
845,mikeclark2,"Bad people have guns... A FUCKING LAWYER WENT ON A KILLING SPREE, DONALD. #debates",1474941002632,780585257560969225,2
846,aliciasanchez,"donald trump just said ""stop and frisk worked very well"" and that ""illegal"" ""immigrants have guns and use them.""… https://t.co/Nc0KeDv9jI",1474941002194,780585255723991041,3
847,AngelaLefevre,Stop and frisk was ruled unconstitutional. Screw you Trump. Never Trump #debates,1474941002582,780585257351471105,4
848,hofthefields,#Debates #Debates2016 https://t.co/RKD6akswpn,1474941002502,780585257015779328,1
849,cassienks,That helps with the divide! #BAZINGA https://t.co/02Jn3ZRhxp,1474941002569,780585257296916480,4
850,nabradshaw,Stop and frisk is effective? Where the fuck at!!!?! But only Black and Spanish people are stopped and frisked🤔 #debatenight #debates,1474941002676,780585257745743872,4
851,leonardoquispea,"#debates #debatenight incredible debate, the only goal is to make America a land of opportunity for Latinos",1474941002685,780585257783492610,4
852,SlayAnimosity,Noooooo!! #debatenight #debates https://t.co/vQ3NrmLZXc,1474941002550,780585257217069056,1
853,kenyafurbish,No. Stop and frisk was unconstitutional and not a good thing. Please stop you idiot. #Debates,1474941002649,780585257632346112,4
854,rach3lina,I've taken a drink every time Trump has said something ungrammatical and now I can't remember my name #Debates,1474941002669,780585257716375553,4
855,Candice_C_Marie,Does he know exactly how many have been killed? He keeps going back and forth with numbers. #debates,1474941002803,780585258278195200,4
856,ANorfleet,"""It was a very against police judge"" breathtaking  #Debates",1474941002290,780585256126652417,5
857,Hislovekeptmee,Wait why just african American communities. White neighborhoods have crime as well as carry guns! #Debates,1474941003708,780585262074081280,4
858,SincerelyUrs216,Trump lil hand is soooooo irritating #Debates,1474941003738,780585262200066048,4
859,HBPrincess530,"Yes, we must restore TRUST by electing someone we CAN NOT TRUST. #debatenight 
#NeverHillary https://t.co/vQxbPLMM7y",1474941003657,780585261860163585,4
860,chillinkristen,@pattonoswalt his butt sphincter or his neck sphincter? Did you see this?? https://t.co/P0eaFNAI1M,1474941003108,780585259557646337,4
861,sandyslove123,"Yeah right she barely gets out of bed! @HillaryClinton LIES LIES LIES LIES 
SHES A WORDSMITH NOTHING MORE
#debates https://t.co/SH40FVIE9U",1474941003605,780585261642244096,4
862,SmawtAss,"Donald Trump says stop &amp; frisk wasnt a civil rights violation, the judge was wrong. He's all about militarizing the nation tho #debates",1474941003719,780585262120333312,4
863,MrsDicha,Did this orange negro just tell Lester that he was wrong about Stop and Frisk? It was deemed UNCONSTITUTIONAL fruitcake! #debates,1474941003725,780585262145351680,2
864,dianalemp,Yessssss Lester slay with the fact check on stop and frisk #itsracist #debatenight #debates,1474941003570,780585261495357440,4
865,presto_foster97,"""A very against police judge"" #debates",1474941003359,780585260610355200,5
866,aeroangel3321,STOP AND FRISK was a terrible unconstitutional policy! WTF Trump!!! #debates,1474941003763,780585262304878594,4
867,trendstodayapp,"Trump: ""I will release my tax returns... when she releases her 33,000 emails that have been deleted."" #debatenight #debates #Debates2016",1474941003515,780585261264572417,4
868,JacobMSchmitt,LOL HE JUST ARGUED WITH LESTER HOLT #debates #debatenight,1474941003819,780585262539608064,4
869,laurie_hilliard,Lets see how fast the NRA responds........................ https://t.co/N6ofdTQCKX,1474941003792,780585262426431488,1
870,kittybutts3,...thanks Obama. You're the reason why Chicago is a war zone. #Debates according to Trump.,1474941003638,780585261780520960,4
871,TheBlackzilian1,#StopAndFrisk #Racist #Debates #DebateNight,1474941004698,780585266226401280,4
872,meghanbeatty,Moderator fact checkin' Trump. Oh snap. #Debates,1474941004721,780585266322870273,2
873,misterbozz,"""Against police judge"" is this a thing? #Debates",1474941004565,780585265668644864,5
874,dei_lyn,WHY IS NO ONE TALKING ABOUT POKICE BRUTALITY #Debates,1474941004676,780585266134315009,4
875,Fastt_Lifee,FDT-@YG #Debates,1474941004560,780585265647722496,4
876,Pjalundh1,"Who are ""bad"" people #Debates",1474941004653,780585266037854209,2
877,chuckbarney,A break in the action: Holt and Trump now debating. A TV timeout for Hillary #debatenight #debates,1474941004662,780585266075447297,4
878,sbodenheimer,Has anyone else noticed that Trump speaks in sentence fragments? #debates,1474941004695,780585266213888001,4
879,prjwitt,Damn these against police-y judges! #debates,1474941004761,780585266490724359,5
880,Lalabeansalad,When will Trump stop repeating the same thing and answer the freakin question #Debates,1474941004695,780585266213949440,4
881,Morpheus2011,#LetGaryDebate https://t.co/1pnkqa7JHw,1474941004566,780585265672826880,1
882,PaladinCornelia,"Oh yes!  ANOTHER Trump supporter!
  #debatenight #debates  #Debates2016 https://t.co/vhiin4b9Gg",1474941004629,780585265937027072,1
883,SFN8TE,"""YOU'RE WRONG"" Lester... lol #debates",1474941005670,780585270303338499,2
884,thats_sya_dude,And Trump just OFFICIALLY lost the #Debates stop and frisk? Really?,1474941005593,780585269980459009,4
885,rutak92,I'm not ready for his answer #debates https://t.co/XlJCdWBaqE,1474941005349,780585268956897281,4
886,ChathamLacy,Looting innocent businesses has nothing to do with race relations #Debates,1474941005627,780585270123134976,2
887,LTVillan,They let over the phone questions?  Obama where u deh... #Debates,1474941005631,780585270139846658,4
888,tophersouth,"Guys, Trump is whitesplaining black lives to Lester Holt. Maybe my favorite optic of the year. #debates",1474941005673,780585270315843584,4
889,UpstateVoice,"Typical Hillary blaming guns instead of the criminals who misuse them. She'll grab every gun until #2A is meaningless.
#DebateNight #Debates",1474941005664,780585270278324224,4
890,vijayagrawal,"#debates Trump just said, you are wrong!",1474941005717,780585270500401156,2
891,flszen,Trump wants to take your guns away #Debates,1474941005617,780585270080974849,2
892,mayaalvarez99,Hoe does he tell Lester he's wrong? 😂😂😂 omg #Debates,1474941005459,780585269418397696,2
893,JuanSaaa,"Donald Trump dice que Latinos y Afro-Americanos viven en un ""infierno""

El infierno verdadero seria la presidencia de Donald Trump. #Debates",1474941005616,780585270076960768,4
894,JacqueMarrero,"#HillaryClinton... Boo, Imma need you to interrupt, speak up, clap back. #debatenight #debates #Debates2016",1474941005618,780585270085316609,4
895,jrdragon94,#RaceInAmerica #Debates,1474941005547,780585269787525122,4
896,Hey_Cassie,Why does he keep bringing up Chicago? #debatenight #debates,1474941005659,780585270257344513,4
897,sierraayoo_,Chicago isn't Barack's hometown it's Michelle's #debates,1474941005470,780585269464477696,4
898,Perhaps_Then_We,"Ruled stop and frisk unconstitutional, so therefore she's biased. That's what happens when you don't get your way 🙄 #debates",1474941005726,780585270538301441,4
899,MrHellisuwondin,Of course not. https://t.co/LZX6p2kMSO,1474941005684,780585270362202113,1
900,seanmcevoy_,Lester!!! Don't take that! Ughhh #debates,1474941005772,780585270731272192,4
901,tweepsome,"""a very against-police judge"" *facepalm* #debates",1474941005692,780585270395727872,5
902,ReneeSessler,He tells Lester Holt he's wrong?! Holy cow. The man is deluded. #debates,1474941006674,780585274514432000,2
903,cmcateer,"Race relations &amp; police brutality in America? Trump is worried about his ""investments.""  ""These people"" = Blacks #debates",1474941006551,780585273998487552,2
904,ArieleStewart,"I'm so pumped. You debate that candidate, Lester!! It's pointless to try to fact check for this man. #debates",1474941006695,780585274602577921,4
905,Snyky,Sounds to me like Donald Trump wants to take our guns away! #debatenight #debates #Debates2016,1474941006629,780585274325688320,2
906,TXScooter,"@DayDaVonne_ could you imagine being stuck in a house for 1 day, let alone 99 days with either of these 2?!#debates",1474941006759,780585274870861824,4
907,levraitaz,Does Trump want to bring back Law and Order the series? #Debates,1474941006640,780585274371743744,0
908,jetblackrise,mood https://t.co/gCEiKgeyWM,1474941006742,780585274799562752,4
909,leanneelston,"I don't even have words for tweets, guys. #debates",1474941006451,780585273579151369,4
910,babydonaldjr,Delete your account. https://t.co/DrmN5UnOTE,1474941006536,780585273935749120,1
911,Sunfire2109,"You guys, even the dictionary is fact checking him. https://t.co/K4xV2tZGQF",1474941006625,780585274308960256,4
912,BarbMurphyLeary,"Racist, profiling - how about getting rid of guns??  #donald #debates",1474941006777,780585274946400256,4
913,SmittyCvn,When frustrated get louder! #debates,1474941006779,780585274954833921,4
914,CharlesQuarry,"#debates #debatenight It's almost all gang related. 60-70 Gangs 100,000 to 150,000 members. 12,000 shootings since 2010 #chicago",1474941006828,780585275160403968,4
915,Oquium,https://t.co/wOLFhE1stT,1474941006716,780585274690662400,1
916,markvoe22,Hahaha 😂 😂 😂 https://t.co/MMz2AYyPPn,1474941006806,780585275068182528,1
917,RimaMandwee,Stop talking about stop and frisk that is literally unconstitutional and blatant racial profiling #debates,1474941007449,780585277765013504,4
918,mitchasfck,"#debates trump who are ""these bad""people??? The blacks? The Mexicans? Scared to say it now huh?",1474941007722,780585278910009345,2
919,SarahHarman53,TRUMP: You have to have stop and frisk in Chicago. #debates,1474941007459,780585277807099905,4
920,hcaelleinad,Trump is completely controlling this debate #debatenight #debates #Debates2016 #MAGA,1474941007617,780585278469615616,4
921,_marycatherine1,IT WAS RULED UNCONSTITUTIONAL. THATS THE 'LAW AND ORDER' YOU JUST TALKED ABOUT #Debates,1474941007620,780585278482345985,0
922,richiekimkh,I just told @nbcwashington who I think is winning. Cast your vote now! #Debates #NBC4DC https://t.co/6FgPSdcavm,1474941007545,780585278167744512,1
923,ChristInCenter,"Trump's solution to heal race relations is ""law and order.""To stop and frisk Hispanics and Blacks. #debatenight #debates #DangerousTrump",1474941007628,780585278515716096,0
924,kiefheady,Can tell what has better quality right now....my Twitter feed or my tv #debates,1474941007712,780585278868164608,4
925,American_Bubba,"Did Hillary just sigh? 
#debatenight  #Debates2016  #debates",1474941007486,780585277920276481,2
926,ForbesOpinion,Check out Forbes contributor Tom Basile's play-by-play of the debate: https://t.co/FHprP6v7p1 #debates,1474941007467,780585277840560130,4
927,dennismannon,Epic! https://t.co/DowCN1DvwN,1474941007570,780585278272577537,1
928,SteezeMatic,Trump's answer on race relations and police... Smh #Debates,1474941007611,780585278444605440,4
929,chas_spears,"123... THE CREW IS CALLED BDP
AND IF YOU WANNA GO 2 THE TIP TOP
STOP THE VIOLENCE IN HIP HOP
#TRUMP2016 #DEBATES #debatenight",1474941008668,780585282877820928,4
930,________Mental,#debates https://t.co/BzVKzvFr2A,1474941008350,780585281543995393,1
931,Good_Old_Bhoy,"It is, actually, when the opposition (Clinton) panders to the rioters. https://t.co/SQBQ1wv0IU",1474941008515,780585282236284928,4
932,MissEssynce,"Da hell is ""a very against police judge?"" #Debates2016 #debatenight #debates",1474941008682,780585282936590336,5
933,schmitzkaylee,I just told @nbcwashington who I think is winning. Cast your vote now! #Debates #NBC4DC https://t.co/3rxIvM7ifW,1474941008627,780585282705862656,1
934,Inverted_Author,Im just gonna sit here and watch wrestling and not allow two liars to lie to my face #Raw #debates,1474941008547,780585282370437121,4
935,malikah313BK,Notice Clinton is just letting him dig himself into a bigger hole lol. #debates #debatenight #DemBates,1474941008487,780585282118774784,4
936,YouCaughtScott,"""No you're wrong"" about stop and frisk. WOW. #debates",1474941008656,780585282827542528,4
937,winbaby2,"#debates fear mongering again, blaming immigrants for crime",1474941008623,780585282689261569,4
938,trodzilla,stop and frisk...is fun for everyone...and fair. #debates #Debates2016,1474941008703,780585283024674817,4
939,FecundStench,Chicago is Hilbama's home town. #Debates,1474941008700,780585283012222976,4
940,bangkokdave,"Hillary: You stiffed your employees, contractors out of money.
Trump: It's all words. 
#debatenight #debates",1474941008656,780585282827612161,4
941,BrazillianDrumz,"#Debates  @realDonaldTrump  FUCK LAW AND ORDER, WE NEED ORDER ON LAW! THE ONLY PEOPLE KILLING PEOPLE R THE POLICE THEMSELVES PERIOD! FACTS!",1474941008470,780585282047389697,0
942,_andresdlr,HOW IN THE HELL IS THAT NOT RACIAL PROFILING #Debates,1474941008686,780585282953441280,4
943,miike_gonzalez,what part of unconstitutional do you not understand!!! #debates,1474941008682,780585282936512512,4
944,jackster133,So illegal immigrants shoot people to now 🤔 #TrumpGetALife #debates #debatenight,1474941008744,780585283196624896,3
945,lolkristin,"""Hillary is afraid of two words, one of which she just used several times in her 2 minutes. LAW AND ORDER!"" #Debates2016 #debates",1474941008557,780585282412294146,0
946,finelh,Cool he just said immigrants have guns and kill people cool cool cool #Debates,1474941008614,780585282651492352,2
947,RWWrites,I'm more afraid of the police than walking down my street. #Debates,1474941009688,780585287156051968,4
948,gamerfranta,"shut the fuck up, trump  #Debates",1474941009646,780585286979903488,2
949,Itslizyo,Although most of my friends are busy putting deer or bee faces on Hillary/Trump I'm glad that they are at least watching the #debates 🐝,1474941009637,780585286942224384,4
950,tootiebug7,#debatenight #debates #Debates2016 #MAGA https://t.co/pcy1b4tsjN,1474941009634,780585286929518593,4
951,riokitty,"""These people"" 😡 #debates",1474941009652,780585287005171712,2
952,tanyawbu1,Trump is basically calling African Americans and Hispanics felons #debatenight #debates,1474941009662,780585287047151616,4
953,kmarley1,"A judge,a very against police judge. ..!!!!...nice sentence structure !!!! #Debates",1474941009629,780585286908665856,5
954,EileenMGiblin,Blah blah #Debates,1474941009682,780585287131009027,4
955,UrbanTVUganda,"THE RACE ISSUE - #Debates #DebateNight
""Get guns out of the hands of wrong characters"" - @HillaryClinton says https://t.co/VNkD5AB76m",1474941009462,780585286208196610,1
956,JamesFettes,#debates https://t.co/2gHVAGzU0B,1474941009563,780585286631698432,1
957,youcancareless,Dont talk about chicago like you know what its like #Debates,1474941009772,780585287508340737,4
958,JamesCohenour,Can we get a fact check on Lester please?  #debatenight #debates,1474941009679,780585287118381056,2
959,RayofInterest,WHAT THE FUCK @realDonaldTrump #Debates,1474941009681,780585287126704130,2
960,ReadyItsEddie,Trump please tell me what cops were afraid to shoot unarmed black men and kill them? #debates,1474941009673,780585287093219328,4
961,jillibeans21,I mean they both failed this question but Trump failed bigly so....#debates,1474941009667,780585287068094466,4
962,koshercrowee,"""A very against police judge..."" -Trump #debates",1474941009774,780585287516688386,5
963,FieldsofCream,Are you sure Donald Trump doesn't have some version of Narcissistic Personalty Disorder? #DebateNight https://t.co/1z2RtOH0A9,1474941009736,780585287357345793,4
964,LibbysVoice,Thank you Lester for pointing out Stop-and-frisk is unconstitutional #debates,1474941009788,780585287575625728,4
965,SNeverything,"Someone tell Donald Trump to smile more.

#debates #debatenight",1474941010671,780585291279011840,4
966,RevPokemon,"@SnapPopCrackle weird part is if you added the word ""reform"" then it would be partly right #debates #debatenight",1474941010673,780585291287449600,4
