,screen_name,text,timestamp,tweet_id,cluster_pred
0,taylorcrumpton,We cannot be a third world country based on airports #debates,1474940386705,780582674175889408,1
1,laurenkazoo,"Yeah and can to relate, to when I'm fucking flying in from Dubai to New York City. Yeah. #debates #Debates2016",1474940386735,780582674301714433,0
2,wagingWarr_,Well trump if u pay your taxes we could fix a road or two! #debates,1474940386746,780582674347896832,1
3,TnlucasLucas,#ImWithHer #Hillary #ClintonKane2016  https://t.co/t0mYbKdeTu,1474940386516,780582673383325696,0
4,freelulu,"America is a third world debtor nation. Um, okay. #debates #payyourtaxesdrumpf",1474940386732,780582674289217538,1
5,KimAcheson,"Trump thinks we need a leader who knows money? When was the last non-millionaire president?

 #debatenight  #debates",1474940386754,780582674381410304,0
6,Fadelzz3454,"Not gonna lie....trumps got a point there. Lots of debt, but not like everything is solved... #debates",1474940386554,780582673542684677,1
7,Seanatonin,"If Trump wins, the plot of Richard Bachman's The Running Man will happen! #debates",1474940386737,780582674310139904,1
8,1thinchip,"Yeah, wtf is this about? https://t.co/dHf4Quf257",1474940386599,780582673731301376,0
9,_singing_snakes,its because people like you don't pay taxes #debates,1474940386759,780582674402377732,1
10,Robaleano,Watchen these crazies speak got me like #debates #debatenight #Debates2016 #streetart #pisshead #BeerOclock… https://t.co/hAcQAk5500,1474940386382,780582672821256192,0
11,CarolDanes,"what is up with @realDonaldTrump and the word ""tremendous""? does Melania call his dick that, so he can feel better about it? #debates",1474940386766,780582674431893509,0
12,SeanyWony,Our airports are like 3rd world country's airports?   Ummmm...I've flown out of America &amp; out of Grenada...  Big difference.  #Debates,1474940386650,780582673945419776,1
13,ArcticDred,"Trump is a liar, release the taxes up to 2008 then?!? #Debates",1474940386746,780582674347851777,1
14,OppressedFart,@benshapiro Benji doesn't even realize what Trump is doing here. He is tying those attacks to BEST OF THE COUNTRY #Debates #DebateNight,1474940386746,780582674347982848,1
15,aolanibani,they're both messy. bye. #Debates https://t.co/95phjzuvtk,1474940386659,780582673983025155,0
16,William_Dagger,"No, it's in a bragadouche way. Stop talking about how much money you have and how much dept #America is in. #Debates",1474940386646,780582673928552450,1
17,AuditoresBane,"""I know something about money,"" say the man who has gone bankrupt multiple times #debates",1474940387686,780582678290575361,1
18,danestevez,"Please watch this fucking video, at least try to understand the whole Hillary e-mails shit a bit bettter. #debates https://t.co/EO1NnlNdk0",1474940387655,780582678160510978,0
19,danielakrientz,I can only imagine me saying telling the IRS that paying no taxes makes me smart.  #inners #debates,1474940387752,780582678567366656,1
20,ashantirholder,"#debates I don't know what he thought this was this isn't like a game ""if you show yours I'll show mine"" like no if you wanna win show-",1474940387722,780582678441582592,1
21,CarlstromSara,Oh my God if I have to hear one more thing about damn emails. Find something new to tag her on cause thats all you got #debates,1474940387745,780582678537998336,0
22,ZMYaro,“We've become a third-world country.”  —A man who has never experienced a third-world problem  #Debates,1474940387692,780582678315798528,1
23,brentonhgreen,"To be fair, Laguardia really is trash #Debates",1474940387502,780582677518901249,1
24,RygelXVItronic,Infowars feed is hilarious guys! https://t.co/n3E3kWrf2l,1474940387700,780582678349410304,1
25,MicheIIeMyBeIIe,Yaaaasss!!!!! #votetrump https://t.co/b2tELz0CHm,1474940387687,780582678294847488,0
26,nimashan,Yes and the GOP has blocked every chance they have gotten to block money to infrastructure. that was the fault of the GOP #Debates,1474940387339,780582676835119104,1
27,_al_man,I'd like to see Donald say the same things about emails to Colin Powell... https://t.co/YVdCnL6KGm #debatenight #debates #Debates2016,1474940387459,780582677338611712,0
28,JDRucker,"Is it me or did he get some training on how to saw ""China"" a little more normally? #debates",1474940387833,780582678907150339,1
29,Djenepha,#NeverHillary #TrumpPence16 #debatenight #debates https://t.co/EjrA1tzs3A,1474940387697,780582678336712706,0
30,DrRimmer,Donald Trump says that he is not 'Braggadocious' https://t.co/gYRItBhrkd #Debates,1474940387727,780582678462472192,0
31,2chanel4yu,Trump just cares about how nice are airports look like lmao  #Debates,1474940387788,780582678718394369,1
32,jasminechaneats,I mean I agree that our airports are a third world mess. I'll give you that. #Debates,1474940387299,780582676667441152,1
33,EMalorni,#Debates des bonnes banque qui vont voler votre argent pour me le donner.,1474940387762,780582678609403908,0
34,lyhines39,"We don't need a list of banks, just your taxes please #debates",1474940387818,780582678844231680,1
35,SgNDreamCatcher,Why do they both try so hard to dodge the question they're actually asked.. #Debates,1474940387638,780582678089371648,1
36,valsthewoman,@HillaryClinton you are not fit.   You missed your 3AM call.  Deleted Emails. Private Servers. 4 dead Americans #debates,1474940387872,780582679070646272,1
37,WolfBritton,"HRC says it was a mistake... using bleachbit is not a mistake, there was clear intent! #debatenight #debates #Debates2016",1474940387385,780582677028143104,0
38,SapphiresRoblox,"Watch live! ""U.S. Presidential Debates"" #Debates https://t.co/aABPWzs4J7",1474940387520,780582677594464258,1
39,MegaVanBeek,I pay more in taxes than Donald Trump and in one month I will be classed as 'illegal' when my greencard expires.  #GoFigure #Debates,1474940387890,780582679146139648,1
40,MahlenasGuide,"""Simply put, white people, come get your boy."" - @wkamaubell via @Salon  #Debates2016 #debates 
https://t.co/mlvOQfVGvM",1474940388695,780582682522550273,0
41,HaroldItz,"Not paying taxes ""makes me smart."" #debates",1474940388621,780582682212401158,1
42,shekhargowda,How is Donald going to bring jobs back from China &amp; Mexico when he could not bring back jobs to Atlantic City? @realDonaldTrump #debates,1474940388337,780582681021145088,0
43,masundbe,Supercalifragilisticexbibraggadoccious. #debates,1474940388574,780582682015232000,0
44,EugeneRMiller,No answers #trump just points out the problems!  #Debates #votes,1474940388691,780582682505912320,0
45,riluex9,hillary is laughting of all the stupidity Trump is saying #Debates,1474940388257,780582680685645824,0
46,dan_smolnik,The Donald complains about national debt and complains about  Hillary's plan to reduce that debt #Debates,1474940388674,780582682434662400,0
47,joelcab123,#Trump knows his numbers. I gotta give him credit for that. #PresidentialDebate #debates,1474940388747,780582682740662273,0
48,geezlouweezy,"Well, Trump knows all about debt. #debates",1474940388764,780582682812121088,1
49,drunkenalpaca,"I care less about Trumps taxes then I do about her emails. 

#debatenight #debates",1474940388794,780582682937831424,1
50,clementsp92,He should be paying taxes.  #whitesagainsttrump https://t.co/i4548jUcUb,1474940388586,780582682065502208,0
51,WeezielouJ,Is brag-a-dotious even a word? Trump thinks so...#debates #debatenight,1474940388747,780582682740662274,0
52,thinker,"Clinton: maybe he's paid no income tax?
Trump: that makes me smart... 
Me: #wtf
#Debates",1474940388799,780582682958761984,1
53,doctorskillet,Yo @Lawrence! https://t.co/OsX9mER5Un,1474940388709,780582682581278720,0
54,Race_Lemon,Deray confirmed economically illiterate #debatenight https://t.co/Z6og7KXBb1,1474940388740,780582682711429120,0
55,MozzleStead,#Debates  He is so hiding something. Omg! someday they will make a movie about #DonaldTrump's fall and it will be because of his TAXES.,1474940388814,780582683021864960,1
56,yesthisisaurora,Aren't people tired of giving @HillaryClinton a chance to perform her Email Server Monologue? What do you think will change???  #debates,1474940388792,780582682929528832,0
57,rosie_james6,"""On a report that I just saw"" seems legit #trump #debates",1474940389687,780582686683303937,1
58,xDark_Echox,Trump just referred to the US as a third world country?  Has he even been to one? #Debates,1474940389651,780582686532317185,1
59,DonutsForCollin,He's off on another tangent and Hillary is letting him hang himself with his ridiculous rant.   #debatenight #debates,1474940389638,780582686477910016,0
60,RockStefan,"""According to a report I saw"" -Trump citing his sources in the #Debates",1474940389677,780582686641442816,1
61,CaesarsButt,I love this  #Debates,1474940389563,780582686163361792,1
62,Flow_ridaaa,Noo.. trump.. nooo #Debates https://t.co/lHTbFb1j6E,1474940389605,780582686339440641,0
63,ThePettyLatina,So somehow the way our airports look is the determining factor in what makes us a third world country?  #Debates,1474940389703,780582686750453762,1
64,J_JRoon,"""I made a mistake using private emails"" lmao more like 33,000 mistakes @HillaryClinton #debates",1474940389592,780582686284845056,0
65,pcgeek86,"Government is the antithesis to #freedom and #liberty.

#debatenight #debates #Debates2016",1474940389696,780582686721052674,0
66,lucyjml19,😂 https://t.co/u31hHWc6Bq,1474940389641,780582686490365952,0
67,bobbydi9ital,I find it interesting that Trump is wearing blue and Hilary is wearing red. Lol They ain't loyal to their party's colors. #debates,1474940389566,780582686175801344,0
68,WillAkoto,"""I pay zero in taxes, that makes me smart"" says @realDonaldTrump #debatenight #debates https://t.co/3Gzl1WC9Nj",1474940389307,780582685089464320,0
69,YetAnotherBrian,"""Bragadocious""??? That's a speaktastrophe. #debates",1474940389657,780582686557634560,0
70,Robscruz131,America has become a third world country? News to me. #Hillary #ImWithHer #Debates,1474940389688,780582686687498240,1
71,MsGlea,Trump when he says he has an idea about money --- WHAAAAT? How many bankruptcies have you filed ??? #GTFOH #Debates https://t.co/TShJlFh1dm,1474940389533,780582686037389312,0
72,kidalecks,"""It's about time this country had somebody running that knows about money.""

I guess it can't be Trump then. #debates",1474940389646,780582686511370240,1
73,heartofabigail,"Trump: ""We've become a third world country"" I'm sorry have you BEEN to a third world country?! #debates",1474940389781,780582687077564416,1
74,itsblessingg,the US is a third world country because... airports? i guess... #Debates,1474940389758,780582686981185536,1
75,ClaudiaMUA1,Good point Trump 👌🏽 #Debates,1474940389751,780582686951780352,1
76,DrLWalczak,Our airports are THIRD WORLD?! We've become a third world country?! What?! #debatenight #debates #Debates2016,1474940389605,780582686339530752,1
77,rhodymike,#Debates2016 #Debates #BRAGADOCIOUS!!!,1474940389756,780582686972866560,0
78,ClapBackForBlac,Finally Hillary good jab. #debates,1474940389698,780582686729474052,0
79,tbbrwn,I don't want to pay taxes next year. Does that make me smart or a criminal? #debates,1474940389709,780582686775574528,1
80,jnelleiz,Trump has said nothing of substance. Shut off the lights. End this. Karate chop him Hillary. #debates,1474940389836,780582687308251136,0
81,thenolan,"Trump just said he made $649,000,000 last year...Why the fuck does this motherfucker want to be president? #debates",1474940389898,780582687568334848,1
82,katemonster54,"@realDonaldTrump ""We're a debtor nation."" How many times have you filed for bankruptcy? #debates",1474940389674,780582686628937728,1
83,IamChrisBeatty,WTF @realDonaldTrump talking about????? UGHHHHHHHHH STOP ALREADY!!!! WHAT IS YOUR PLAN??!!!!!!!  #debates,1474940390621,780582690600972288,1
84,al_style_,I'm curious on how much trump pays in taxes  #debates,1474940390696,780582690915356672,1
85,andelman,Stacy wins the Internet! https://t.co/kaWVnxCJpQ,1474940390497,780582690080694272,0
86,VIICCXCIX,Watching the #debates,1474940390664,780582690781265921,1
87,eggycrunchybob,"Did trump channel Jordan Belfort? Cause that was like the yatch scene
#debates #debatenight #Debates2016 https://t.co/jXz00hknsB",1474940390618,780582690588286978,0
88,herbertsnow,Trumpy acting like child #debates,1474940390644,780582690697478151,1
89,thefeva,#HillaryClinton torn to shreds (video) https://t.co/PhEnMtHvGs #Debates2016 #debates,1474940390516,780582690160390144,0
90,GaryLeeGrant,Donald has loads of money again - Braggadocious! #debates,1474940390713,780582690986795009,0
91,BrianMcKeown5,Did he just call this country a third world country?   Is he out of his mind? #debates,1474940390608,780582690546483200,1
92,bcmgsupermommy,"Trump: If only we were more like China, and the UAE. You know. Democracies. 
#debates",1474940390727,780582691045412864,1
93,trimblegator,The Clinton foundation moved HQ to dodge taxes #Debates,1474940390782,780582691276292096,1
94,wld1,"Is my TV reception is bad, or are all liars really, really thirsty? By the way, a ""small loan"" in my family is $100. Yours? #debates",1474940390801,780582691355799552,0
95,KimMcNichol,"So we can confirm Trump didn't/doesn't pay his taxes? He said ""it was smart"" #Debates",1474940390854,780582691578056704,1
96,MPHaus,"Props to @LesterHoltNBC for letting them go back and forth.

#debates",1474940391677,780582695030042624,0
97,beRealcoach,Blame the politicians... I need new shoes... Give me your income taxes! #Debates,1474940391665,780582694979719168,0
98,reservologic,トランプ、ヒラリーにあんたはプライベートメールを公務に使ったのはわざとやったんだと決めつける。決めつけてどうする。わざとやっても誰も得しない。 #Debates,1474940391554,780582694514065408,1
99,blobert,"We spend money is the midddle east? How come?
https://t.co/QNUfaXNzEr
#debates",1474940391668,780582694992293888,0
100,GAPeach1913,Vote people...this madness can't continue! https://t.co/rcPeOkrGPb,1474940391562,780582694547849216,0
101,ScienceClau,"#HillaryClinton was always going to debate well, but so far the most impressive thing is her ability to NOT roll he… https://t.co/nl0sTvndcQ",1474940391483,780582694216462337,0
102,memorybank,Donald talking about airports was the most coherent thing he said so far and it’s still stupid. #debates,1474940391668,780582694992293889,1
103,mcampbellpike,"Braggadocious , that a word, guys? #Debates",1474940391541,780582694459678729,0
104,Hendrixgood,Pele se la come #debates,1474940391737,780582695281782784,1
105,Field62Steven,"Watch live! ""U.S. Presidential Debates"" #Debates https://t.co/HAlDsrR3Fu Trump = Moron",1474940391390,780582693826420736,1
106,Mr_Cynic,"#Debates ""Our airports look like a 3rd world country's"" Man how would you know? You ever been to one?",1474940391742,780582695302672386,1
107,RaychJackson,"""If I had to do it over I would not do it again. It was a mistake.-Hilary on those emails-&gt;USING THE MAN CAUGHT CHEATING EXCUSE 😭
  #Debates",1474940391759,780582695374032896,0
108,HisRoyalNate,@FoxNews @HillaryClinton @realDonaldTrump #CrookedHillary should worry more about Bill hiding his pecker in Bimbos #Debates,1474940391844,780582695730450432,0
109,Dailytakes,"Poor man wanna be rich, rich man wanna be king. And a king ain't satisfied
'til he rules everything #debatenight #debates",1474940391703,780582695139209220,1
110,JoeBroToGo,"It's okay, Donald, I get 5s and 6s confused sometimes, too. #debates",1474940391734,780582695269203970,0
111,Sir_itad,I'm sure my Political Science lecturer would love this! #Debates,1474940391652,780582694925336576,0
112,HLoveMoneyMusic,Who are these retards that were cheering during that email bullshit ass cut??? Idiots. #debates,1474940391719,780582695206256640,0
113,news10,"טראמפ: ""פוליטיקאים כמו קלינטון יצרו את הבעיות שלנו, אנחנו צריכים בתי ספר חדשים, בתי חולים חדשים - אבל אין לנו את הכסף לכך"" #debates",1474940391703,780582695139155970,1
114,rachelngann,Does Trump know what a Third World Country is?? #Debates,1474940392703,780582699333328897,1
115,andrescruz,Umm what was the question.... #debates,1474940392722,780582699413024769,1
116,andiandi2011,"Just bcz you paint everything gold doesn't mean you know a damn thing bt money.  All that glitters, ya know...#ImWithHer #HRC #Debates",1474940392671,780582699199180800,0
117,PatEnt07,Did Trump just brag several several several times that he is a billionaire? Fact check: Yes #Debates,1474940392699,780582699316772864,1
118,dfreelon,"""We've become a third-world country."" Do people really believe this? #debates",1474940392652,780582699119550464,1
119,2sunnyday2,#debates #TrumpTaxes https://t.co/I4l2F2Aejv,1474940392561,780582698737774596,0
120,Prynzdlp,Trump just keeps saying the same thing over and over and over again. Come up with some new material dude. #Debates #DebateNight,1474940392612,780582698951684096,1
121,NekoDanny120,OH SHIT #debates,1474940392652,780582699119550465,0
122,APoliticalNerd,I like American Airports tbh #debatenight #debates #Debates2016,1474940392759,780582699568209920,0
123,aokcamp,I just told @nbcwashington who I think is winning. Cast your vote now! #Debates #NBC4DC https://t.co/DSsSAhfaoD,1474940392628,780582699018911744,0
124,Uncanny390,He needs to talk more about that debt. Big issue for people. I mean he won't fix it but bring it up anyway #debates,1474940392621,780582698989608960,1
125,unhatched,I have banks. Luxurious banks where I store my vinyl. #debates https://t.co/3oOJsyCRBf,1474940392451,780582698276446208,0
126,BrianneKohl,"To be fair, La Guardia is pretty third world. 

#debates",1474940392677,780582699224403969,1
127,Scruffmcgruff,This is perfect. #Debates https://t.co/zX2yq4s8KS,1474940392537,780582698637156354,0
128,arocxcvii,America's a 3rd world country?  #Debates,1474940392730,780582699446697985,1
129,_Gramz_,Still tryna figure who we owe 6 trillion bucks too... #debates,1474940392728,780582699438309376,1
130,parlocolmuro,La Clinton ha appena messo Trump ko sul reddito ma lui ancora non se ne è accorto.. #Debates,1474940392746,780582699513905152,0
131,kennysandytoes,Did Trump just call America a 3rd world country??? #debates,1474940392856,780582699975139329,1
132,john_leek,Why don't they talk about spending reductions? https://t.co/1615iolbQ2,1474940392628,780582699018907648,0
133,jacki_burke,Bragadocious. Shit that is NOT on my bingo board. #dammit #debates,1474940392798,780582699731980290,0
134,Pumas_Dav1d,yes yesssssssssssss #Debates,1474940393657,780582703334731776,1
135,MeganC121,"be careful when talking about hiding things, Secretary.  #Debates",1474940393662,780582703355703296,0
136,dcsohl,I think @realDonaldTrump just volunteered to rebuild the US for the low price of $3T. #debatenight #debates #Debates2016,1474940393596,780582703078907904,0
137,vivek_mogal,"A crook is running for president who thinks not paying taxes is ""being smart"" #debates #debatenight #Debates2016",1474940393583,780582703024529408,0
138,pils13,"TRUMP, DUDE HAVE YOU EVER BEEN TO A THIRD WORLD COUNTRY?! BECAUSE DUDE OUR AIRPORTS DO NOT LOOK LIKE YOURS AT ALL #debates",1474940393581,780582703016054785,1
139,juliette_morgan,"ROAST HIM, HILLARY TAKE HIM DOWN #debates",1474940393579,780582703007686656,0
140,Fromgirltogirl,#NAFTA wasn't signed by Bill Clinton. It was signed by Republican George H.W. Bush. https://t.co/30axIOqgnx,1474940393509,780582702714064897,0
141,zmshoward,3rd war country? #Debates,1474940393663,780582703360045060,1
142,VistaOfZim,Now he's whining about airports? #Debates,1474940393668,780582703380836352,1
143,ash_a_lee26,Wow....lol #Debates #debatenight,1474940393653,780582703318130688,0
144,devrimnow,"New word from Trump dictionary: Bragginatious

#DebateNight #debates",1474940393706,780582703540219904,1
145,DonatoCon,I don't pay back people who get me late-night drunk food #thatmakesmesmart #debates,1474940393690,780582703473291264,1
146,sarahamymc,DID HE JUST CALL AMERICA A THIRD WORLD COUNTRY? #debates,1474940393674,780582703406120961,1
147,GinaLeeMuller2,Trump hitting targets in country needs #Debates,1474940393728,780582703632711680,1
148,Father_Sloth,Hillary is very respectable and it seems that every time Donald starts to lose ground he lashes out at everyone lmfao  #Debates,1474940393781,780582703854825472,0
149,TaylorLMaloney,"""You don't learn that much from tax returns."" -Trump ....so just release them then...? #debates #debatenight",1474940393745,780582703703863296,1
150,KimberlyFritz,HES THE TWEETS OF THE BEAST @realDonaldTrump is Satan! #devates2016 #debates https://t.co/goPultCEbU,1474940393434,780582702399516673,0
151,FCB_08,We are screwed😫 https://t.co/VhyhvNc1v7,1474940393531,780582702806396928,0
152,pandemona,wow @realDonaldTrump just compared La Guardia to a 3rd world country. Also calls Dubai 3rd world. what planet are we on right now #debates,1474940393795,780582703913512960,1
153,DJ_Hallows,Thought Clinton was gonna scratch her nose with her middle finger for a second lol #Debates,1474940393823,780582704030953472,0
154,HRaleighspeaks,"One of @realDonaldTrump 's best line tonight-""It's about time someone who understands money to run this country!"" #debatenight #debates",1474940393793,780582703905251328,1
155,TeKeHall,OOOOOOOOOOOOOOOOOOHHHHHHHHHHHHHHHHHHHHHHHHHH Hilary #debates,1474940393823,780582704031133696,0
156,KLonjack,Trump is so materialist lol he called us thirld world because tourist sites have better airports 😂 #Debates,1474940394666,780582707566829568,1
157,professorives,#debates China! Drink!,1474940394539,780582707034152961,0
158,duntagolfer,Robot  #Debates,1474940394685,780582707646521344,1
159,bluedevilzach19,"last I checked LAX &amp; JKF offered me free wi-fi, charging ports, oh and special privileges for ""1st class"". sounds pretty 1st world. #debates",1474940394588,780582707239583744,0
160,ScottStarns1,At least Trump has created jobs by the Thousands within his own company.Hillery has never created one! #Debates,1474940394605,780582707310886914,0
161,prof_taxi,"Love from the #debates, #Trump is deleting tweets while complaining about deleted e-mails.

Believe me. https://t.co/bikJ0x0sEB",1474940394553,780582707092918272,1
162,MicheeAlexis,"We're not voting for the world's richest person, @realDonaldTrump. We don't care how much money you have! 😡 #debatenight #debates",1474940394647,780582707487133696,1
163,optaisamme,"""We've become a Third World country!"" Yup, he said that. #debates",1474940394673,780582707596103680,1
164,ParisMomma53,He should audition for Dancing With The Stars. #debates,1474940394520,780582706954592256,0
165,TheWilsonWilson,HEY BUDDY LAX IS A DECENT AIRPROT @realDonaldTrump  #debates,1474940394711,780582707755520000,1
166,cdrobick,Wait what the fuck is bragadocious???  #debates #debates2016,1474940394510,780582706912587776,0
167,NickFlora,Yeah you REALLY don't learn a lot from tax returns. They tend to be super vague and not detailed AT ALL. 🙄 #debates,1474940394709,780582707747094529,1
168,Their_Malarkey,Trump talking about the deterioration of our infrastructure and the need to rebuild.    #debatenight  #Debates2016  #debates,1474940394554,780582707097178116,0
169,iDeepdown,Hmmm.... #Debates,1474940394637,780582707445194753,1
170,AndrewCrow,"Did not anticipate ""four syllable word"" on the bingo card tonight tbh. #debates",1474940394750,780582707919069185,0
171,GoldenrodRoom,"HAHAHAHAHA ""because you haven't paid any income tax"" GREAT BAITS! #Debates",1474940394719,780582707789168640,1
172,Tina_in_PDX,It sounds braggadocious b/c...it is. Obviously. I'm incredible. Everything that's previously happened is bad. End debate. -Trump #Debates,1474940394721,780582707797426177,0
173,Dfranks54,Here come all these uneducated opinions #debates,1474940394787,780582708074287104,1
174,rocklanddems,#shame https://t.co/CLM9aXTBzk,1474940394537,780582707025805312,0
175,yehuda_jacob,Stop crying Hillary! #Debates,1474940394817,780582708200091648,0
176,mrphilosopher3,Wild out magic https://t.co/e1DQfsSens,1474940395586,780582711425507328,0
177,MichaeLechner,"@billmaher @LOLGOP Listening to @realDonaldTrump talk about himself, you'd think he was the greatest person that ever lived. #debates #bigly",1474940395241,780582709978554368,0
178,KanelsAbel,"#debatenight #debates #Debates2016 #PresidentialDebate 

Hillary mate ur a crime lord, get off the stage.",1474940395580,780582711400472576,0
179,lllaui222,ترجمو #Debates,1474940395669,780582711773827073,1
180,MsSaraG,"I think I'll start using ""to be semi-exact"" next time I want to be taken seriously. That should work, right? #debates",1474940395625,780582711589236737,0
181,NickBarb719,Trump just said paying no federal taxes makes him smart. He is a fraud and it is a disgrace that America allowed him on this stage. #debates,1474940395665,780582711756849152,1
182,PwrRob,Bro. That's totally bragadocious #Debates #PresidentialDebate,1474940395626,780582711593406464,0
183,ChalupaBatmanGG,Where people take 8min to answer to answer a YES or NO questions #debatenight #debates #Debates2016 #PresidentialDebate,1474940395742,780582712079814656,0
184,maurtosay,"This guy is a COMPULSIVE LIAR!! Sure...you don't learn anything from his tax returns! And her he goes changing the subject AGAIN!
#Debates",1474940395557,780582711303999488,1
185,Emanncook,Good to know we've become a third world country based on our airports. #debates,1474940395679,780582711815569408,1
186,ZeyuHu,"only truth @realDonaldTrump would say tonight: ""our airports are from a third world country"" #Debates",1474940395645,780582711673192448,1
187,SuperStartz,"Denver International Airport has healthy snacks AND a brewery! How dare you, Mr. Trump. #debatenight #debates
#Debates2016",1474940395728,780582712021319682,1
