,screen_name,text,timestamp,tweet_id,cluster_pred
0,MomoIggy,FUUUUUKK! Things got a little heated!! #Debates,1474940083725,780581403385696256,0
1,mrs_maegmott,Trump is a savage. Can't wait to hear what good Ole Hillary says about these emails now. #debates,1474940083778,780581403608178689,1
2,brianna_rose47,#IVoteCanada https://t.co/4YHt5cBsU2,1474940083732,780581403415023616,0
3,RantingRecluse,"Big, tough @realDonaldTrump hiding behind his lawyers. Real Tough indeed.

#ReleaseTheReturns 
#DebateNight
#Debates",1474940083850,780581403910037504,0
4,MereHorowski,If @realDonaldTrump can't keep his cool during this debate how can we trust him to keep his cool w/the nuclear button? #NoRedButton #debates,1474940083632,780581402995744769,0
5,hammerhead1421,Where's the corkscrew? #pantsonfire #Debates,1474940083827,780581403813490688,2
6,Tayla_P_S,"Even as a 16-year-old Kiwi, I'm worried about this  #Debates",1474940083841,780581403872284673,0
7,NjGMEN973,Even tho I'm not voting I kinda want Donald Trump to win just to see how America react #debatenight #debates,1474940083781,780581403620671494,2
8,tevinlinson,Trump dumb af #Debates,1474940083831,780581403830345728,2
9,rach3lina,We're being ripped off by every country in the world? Really? Tell me again how Bangladesh or Cambodia or Guam is oppressing us #Debates,1474940083783,780581403629088769,0
10,bigdaddyspring6,This is Presidential..crazy Trump??? #debates,1474940083892,780581404086198272,2
11,Rated_MK17,"Emails have been mentioned.

Somebody call Matt Hardy. DELETE DELETE DELETE!!! 

#debatenight #debates",1474940083584,780581402794483713,1
12,jyang_1,"@realDonaldTrump: ""I will release my tax audits when she (@HillaryClinton) releases her 33,000 emails."" #debates",1474940084666,780581407332585472,1
13,ladyogrady,C'mon Hills... Sweep the leg! #Debates #debatenight https://t.co/BA6kSve5kg,1474940084354,780581406023880705,0
14,WriteChrisD,"SOUND BITE ALERT! ""When she releases her 30,000 deleted emails, I'll release my taxes"" - Donald Trump #debates #debatenight #Debates2016",1474940084612,780581407106052096,1
15,TheRalphRetort,"Trump says he will release his tax returns soon as Hillary releases the 30,000 emails she deleted.

HAHAHAHA

#debatenight #debates",1474940084655,780581407286521856,1
16,TdotWeav,Yes! Schooled!  #ConAllTrump #debates https://t.co/AYCqh3OWqC,1474940084650,780581407265468417,0
17,honeybeejay86,my lawyers says dun du it &gt;.&lt;  #debates,1474940084705,780581407496081408,2
18,Tike_Le,@realDonaldTrump why are you always being audited? #debates,1474940084633,780581407194132480,0
19,Crutnacker,Trump will go against his own people's advice if Hillary does something.  That's how much integrity Don has.  #DebateNight #Debates,1474940084736,780581407626137600,0
20,RevApplewood,EMAILS!!!!! #debates #bingo,1474940084668,780581407341088768,1
21,skoaldiver,#Debates Trump will release tax returns when Hillary releases her 33K deleted emails.,1474940084679,780581407387099136,1
22,nbcsandiego,"Trump says he will release his tax returns once Clinton releases ""her 33,000 emails."" WATCH LIVE: https://t.co/1dAE0tXAtr #debates",1474940084508,780581406669934592,1
23,PunkRapRockMom,All Donald Trump needs is a wife beater shirt and a cigarette hanging out his mouth. #debates  #debates,1474940084637,780581407211065345,2
24,geniesaurus,#Debates in the background; still surprised that they haven't stooped to attacking each other's website structures. https://t.co/EO7pyQWoyv,1474940084486,780581406577598464,0
25,paulinacorcoran,"great trump, bring up her emails again why don't you #debates 🙄🙄",1474940084627,780581407168933892,2
26,Regulatetheman,"#Debates REGULATE! The Man! Trump talk to quick, don't talk to me slick. It is written! You are in here!",1474940084743,780581407655497728,2
27,lydorito,YOU CAN RELEASE THEM NOW YOU DONT NEED TO WAIT UNTIL THE AUDIT IS OVER #debates,1474940084726,780581407584288768,2
28,sd20dfl,@realDonaldTrump is afraid to release his returns. What is he hiding? #debatenight #debates,1474940084688,780581407424864256,2
29,NOW_NYC,When @realDonaldTrump brings up emails. Let's talk about the real issues. #debates https://t.co/uRq95tKaa3,1474940084375,780581406112088064,0
30,zachsimone,Tax return v.s. emails. Stay tuned! #debates,1474940084853,780581408116846592,1
31,MomLAVISH,Bait and switch ! #Debates,1474940084791,780581407856787457,2
32,arizonaonmymind,Uh oh! @realDonaldTrump is kicking your ass! #debatenight #Debates2016 #debates https://t.co/WDxtDrbV0x,1474940084252,780581405596135424,0
33,LWileyvoice,Bait and Switch.  or BS. #debates #debatenight #ImWithHer,1474940084921,780581408402055169,2
34,TisWhatItTIS,@realDonaldTrump hasn't answered a question yet... is he stable? #notfirtolead #debatenight #debates #bateandswitch,1474940085697,780581411656863744,2
35,lany891,To show he's a builder and not a destroyer like the clintons!! https://t.co/IwvSLDAk0N,1474940085560,780581411082338308,0
36,AwakeDeborah,"Hillary thinks deleting 33,000 emails are funny - big broad smile at the mention of them
#Debates2016 #debates #debatenight",1474940085656,780581411485089794,1
37,MAcatholicmom,bait and switch is the clinton way...bait the women rape the women and then switch to great right wing conspiracy. #Debates,1474940085480,780581410746818560,2
38,thebeckybird,I hope @HillaryClinton wins in Nov. and the #Republicans get their act together so she faces a candidate worthy of debate in 2020. #Debates,1474940085754,780581411895980032,0
39,whatsucksblog,"Yeah, looks like @realDonaldTrump can really handle the nuance of being the President. #debates",1474940085395,780581410390302720,0
40,gryffindreamt,ลุงงงงงง  #Debates,1474940085852,780581412306944000,2
41,danielurena,"Golpe de Trump: ""Publicaré mi declaración de la renta cuando Hillary publique sus e-mails borrados"". #debatenight #Debates2016 #debates",1474940085814,780581412147716096,0
42,skellingtor,It's all building up to the swerve face turn. #debates https://t.co/TwTGFQjgG5,1474940085756,780581411904512000,0
43,harpentuan,I honestly have a headache already. #ibuprofen #debates,1474940085834,780581412231577600,0
44,Smag89,"We need Dr. Evil to host this debate, he knows how to get a word in. #Debates  https://t.co/5K7cQUidpY",1474940085779,780581412000899072,0
45,brettjtalley,"So I take it that means Hillary won't be providing those 30,000 emails. #debates",1474940085676,780581411568967681,1
46,jillybird42,Yep.  He's hiding something.   #debatenight #debates,1474940086703,780581415876304897,2
47,NJ_Chef,"If there's anything good coming out of this shitshow, it's that Trump is being exposed as the lying con-artist that he truly is. #debates",1474940086615,780581415507398656,2
48,jerrieadidas,I love that Hilary laughs whenever he has his turn to speak #Debates,1474940086693,780581415834365952,2
49,card_player87,"If Trump's been audited for the last 15 years, you'd think he'd know the rules about when he can release them. #debates",1474940086632,780581415578693633,2
50,MrsMAlberts,#Debates trump keeps going round and round and round and round,1474940086691,780581415826042880,2
51,Delta5012,Woahhhh!!! #debates,1474940086690,780581415821963265,0
52,raymondchung,Wow. Trump will release his tax returns if Clinton releases her 33K emails. Wow. #debates,1474940086682,780581415788306433,1
53,Sarah83211,Emails !Ba-yum ! #debates,1474940086699,780581415859712002,1
54,spideyrnan,"LESTER: BOY YOU CAN RELEASE YOUR RETURNS DURING AN AUDIT
TRUMP: I CANT I HAVE AN AUDIT  #Debates",1474940086711,780581415910051840,2
55,curlypoets,#debates OH SHIT LOL,1474940086683,780581415792414720,0
56,AntiGlib,"Donald Trump won't release his tax returns. He doesn't people to know that he's being paid by Russian oil barons, along with Putin. #Debates",1474940086386,780581414546739201,2
57,YTmillennial,RELEASE THE EMAILS #Debates #debatenight #Debates2016 #HILLARYCLINTON #TRUMP,1474940086811,780581416329445377,1
58,sxfiasalinas,ya kync #Debates,1474940086835,780581416429948928,2
59,Morgan_Romano,@mercurioj2111 https://t.co/xgCba0NyFH,1474940086678,780581415771578369,0
60,Aliss_ilA,ヒラリーさんのメール問題再び #Debates,1474940086867,780581416564170752,0
61,the1janitor,All Clinton has to do is let this man talk and she wins the debate #debates,1474940086764,780581416132304896,0
62,igualanada,He's like Marco Rubik with that water glass. #debates,1474940086887,780581416648122372,0
63,djKSM,"Audience, stfu #debates",1474940086821,780581416371314688,0
64,hlopez_,Oh snap brought up the emails. #Debates,1474940086874,780581416593526784,1
65,Dattolo10,SHOTS FIRED😂😂 https://t.co/zHW0dnGfHX,1474940086812,780581416333705218,0
66,Legal_Investor,"For someone who has paid attention to the campaign since the beginning, this hasn't revealed anything new #debatenight #debates",1474940087666,780581419915411457,0
67,CStallingsArt,The only thing keeping me on this #debates stream is the fact they're jumping to live feeds of Art Farm and some of the animals in it.,1474940087660,780581419890257920,2
68,Becca13Walsh,I hope I'm not the only one watching frozen instead of the #debates #oops #sorrynotsorry,1474940087506,780581419244544000,0
69,outrspacebutler,Guys my plan will create jobs. Write in Elon Musk. Colonize mars. I'll be your butler. #debates,1474940087638,780581419797983233,0
70,StrotherMason,SAVAGE https://t.co/VxiZqYcB4W,1474940087463,780581419064102918,0
71,sauvejon,"I just told @nbcwashington who I think is winning. Cast your vote now! #Debates #NBC4DC
https://t.co/9KRbiuRsEc",1474940087635,780581419785519104,0
72,honeylieg,ouch #johnsonweld2016 #Debates,1474940087713,780581420112617473,0
73,benhuelskamp,Ex-presidents play golf after leaving office? Tell that to Bill Clinton and Jimmy Carter  #Debates,1474940087659,780581419886051328,2
74,delduca25,GOT EM https://t.co/Gt0VbvQAlv,1474940087603,780581419651330050,0
75,DHRush61,"#Debates  for those claiming he's out of control, the Washington DC establishment has been under control, composed and ineffective.",1474940087580,780581419554705408,2
76,Sean081799,mentions the emails OK #Debates,1474940087752,780581420276195329,1
77,chirofrenzy,Who cares about his Tax returns if he was audited you know he has been on the  up and up https://t.co/XOOaUqSoml,1474940087545,780581419408039936,0
78,mich12345,Pretty sure this is what I'm watching #debates https://t.co/cQaj2U6hCZ,1474940087520,780581419303079936,0
79,Redonred1,"Screenshot of the presidential ""debate"" #debates #Debates2016 https://t.co/LwqaWLfpqS",1474940087455,780581419030634497,0
80,mille8294,THE EMAIL!!! Whoop there it is #debates 🍻,1474940087773,780581420364238848,2
81,JasonBoxman,@HillaryClinton where are those emails #debates,1474940087742,780581420234317833,1
82,AdamsAtcha,Donald is neverrrr releasing his taxes   #Debates,1474940087769,780581420347584512,2
83,AshleyJuneMarie,"""Watching the shows, and reading the papers"" #debates",1474940088738,780581424411750400,0
84,fuckseafood,shots fired #debates,1474940088659,780581424080556032,0
85,truthbrarian,#debates oh gross audience cheering for Trump abt Hillary emails. So dumb. #DebateNight,1474940088661,780581424088907776,1
86,Thogori,Why are tax returns gated on emails? Orthogonal issues. #Debates,1474940088692,780581424218845184,1
87,Sir_Ruffy,Trump show tax but no excuse. #Debates,1474940088694,780581424227311617,2
88,ableremainder,Watching Lester Holt try to reason with DJT is hilarious #actslikeatoddler #debates,1474940088746,780581424445460480,0
89,TimTindallArt,OHHHHHHHH! Taxes for emails  #debatenight #debates,1474940088769,780581424541806592,1
90,redostoneage,"FBI says Hillary Clinton withheld 17,500 work-related emails https://t.co/5bYvP4gCjZ #debatenight #debates",1474940088623,780581423929499649,1
91,ed_hooley,HILLARY STARES INTO SPACE #debatenight #debates #Debates2016 #MAGA #Hillary #UnlikelyDebateGuest https://t.co/A1ZUpgUG7B,1474940088302,780581422582988800,0
92,TariqMuziq,"That surprise would have been, ""Wow another couple million?? Thats Tremendous."" #Debates",1474940088741,780581424424480768,0
93,Gronah,Donald Trump is dodging the tax return question like it was poison ivy. #debates,1474940088684,780581424185405440,2
94,ValeriaNews12,@HillaryClinton is chuckling while @realDonaldTrump speaks #debates,1474940088701,780581424256675840,0
95,MMartinez1845,That smile is evil af #Debates,1474940088821,780581424759869440,2
96,summerclb1,There is clearly only one choice.  Keep up the great job!   https://t.co/96A4eS6Lyz,1474940088765,780581424524963840,0
97,HeatherRietKer1,Here we go agree bate and switch by the Donald release your taxes #Debates,1474940088645,780581424021835777,2
98,KamVTV,"I could give a RATS ASS about Hillary Clintons TAXES or Donald Trumps TAXES! I guess taxes help with war
#debatenight #debates #Debates2016",1474940089659,780581428274745344,2
99,deetotheann,I'm beginning to think that Trump thinks the job description for SOS is keeping notes at POTUS meetings #debates,1474940089541,780581427779960832,2
100,AliBoxingFan,"#HillarysEmails Wipes Server #BleachBit Software - ""Emails Deleted Forever?""
  https://t.co/jv3mmOD5YH #debates… https://t.co/MUMDwaAzko",1474940089345,780581426957651968,1
101,ElectedMob,#debatenight #debates #Debates2016 #HillaryClinton #factcheck #factcheck2016 #FactCheckTheDebate https://t.co/97kOJVbZgg,1474940089242,780581426525634562,0
102,bunnymeowmeow,"#Debates Legit question am I only seeing tweets that agree with my ""likes"" &amp; search history or everyone's tweets in the debate feed?",1474940089680,780581428362784768,0
103,RealIslandBwoi,I will release my tax returns once she release her 33000 delated emails ... Stfu #donaldTrump ugh #Debates,1474940089680,780581428362739712,1
104,SheSeauxSaditty,"He just negotiated and then said ""no it's non-negotiable"". 

#debates",1474940089703,780581428459282440,0
105,kavywavy,"Donald hasn't answered a damn question directly &amp; keeps resorting to how his ""thinking"" is the kind of thinking the country needs #debates",1474940089671,780581428325036032,2
106,PegGall,"#Trump started out so quiet, and calm ... But here he goes!
#crazy #debates",1474940089550,780581427817635840,0
107,faseidl,"#Trump: I will release my taxes when the audit is over. No wait... I'll do it when she releases her deleted emails.

#debates.",1474940089665,780581428299902976,1
108,tacxboxflash,Trump is nuts. Holy Cheezwizz.  #Debates,1474940089718,780581428522135552,2
109,cokes311,Took him 34 minutes to mention the emails. Remarkable restraint from Mr. Trump. #Debates,1474940089315,780581426831953921,2
110,spacedude23,Just looking for an excuse not to release them taxes https://t.co/MZZzoHozoJ,1474940089694,780581428421468161,0
111,voxboxmag,Donald Trump: “Tenemos un déficit comercial con todos los países con los que negociamos de 800 mil millones de dólares” #debates,1474940089690,780581428404695041,2
112,kmjdu,Bait and Switch.Exactly.    #Hillary   #debates,1474940089528,780581427725398016,2
113,caprafan,"Hint: If you're being #audited annually, you might be #CookingTheBooks, .@realDonaldTrump. #debates",1474940089739,780581428610281472,0
114,LoriHillmore,All this talking in circles...JUST RELEASE THE DARN TAXES!!! #Debates,1474940089470,780581427481939968,2
115,BirdiesFDR,Are they afraid HRC will have a seizure if the audience claps? WTH. #debates,1474940089741,780581428618670080,0
116,SuperMarie2014,"#Debates #WhoIsTheAccountant  ""Bait &amp; Switch"" from Trump https://t.co/EN0rdQ44lw",1474940089207,780581426378878977,2
117,nekochik,DUDE EMAILS ARENT ILLEGAL AVOIDING TAXES IS #Debates,1474940089763,780581428711006208,1
118,bigcarmen,I don't care about Trumps tax returns yo #debates,1474940089671,780581428325130241,1
119,xlalohx,Girl you better release them emails @HillaryClinton #Debates,1474940089803,780581428878684161,2
120,PeggyPeggy0727,@HillaryClinton do not give the face he is baiting you  #Debates,1474940090662,780581432481546240,0
121,miatoosaucy,trump is just gonna implement reaganomics again and hope it works this time #debates,1474940090672,780581432523567104,2
122,journeysincolor,Why don't Trump's lawyers want him to release his tax returns? #debates,1474940090707,780581432670294017,1
123,leftgear,The look on Hillary's face during the tax reply is priceless. #debates,1474940090570,780581432095805440,1
124,LADYforL1BERTY,How bout hose emails though. #debatenight #debates,1474940090629,780581432343179264,2
125,HerschelVB,Super dumb. Her emails have nothing to do with your taxes #debatenight #debates,1474940090470,780581431676399617,1
126,CuRB0619,Now that was a hammer dropped #debates,1474940090728,780581432758370304,0
127,EBentzel,Release the emails! #debates,1474940090525,780581431907119106,1
128,DavidRosner,"and she'll release the 33,000 emails when Karl Rove releases the 23 Million he deleted... #Debates",1474940090673,780581432527728640,1
129,aniiiiita,De repente Trump de convirtió en Assange y Lester en Tinelli #debates #desastre,1474940090489,780581431756091393,2
130,TimeWellTell2,Why do you tell Donald Trump to be quiet when Hillary's talking but he didn't tell Hillary to be quiet when Donald https://t.co/Nnekq29WpL,1474940090650,780581432431443968,2
131,DalenMale,#debates. Hillary release your emails,1474940090765,780581432913780736,1
132,GinaLeeMuller2,Clinton has lost classified emails #Debates,1474940090762,780581432901132288,1
133,Mike_Bedard,#debates - Lester Holt - harder on the audience than the candidates.,1474940090696,780581432624316416,0
134,fgtorres0405,Dead ideas that won't stay dead https://t.co/FBEUr5kNN1,1474940090669,780581432511107072,0
135,QuinnLisaq,Shup up  taxes common more trash  #Debates,1474940090850,780581433270165504,2
136,IPhilpot,"Okay, so Trump's audit numbers for the lat 15 years haven't been tallied yet? #debates",1474940090773,780581432947273729,2
137,fabyousalon,He is not for the middle class. https://t.co/5TGrIUohe1,1474940090684,780581432574021632,0
138,jimwitkins,.@realDonaldTrump lying about taxes. What are you hiding? #fraud #crook #DebateNight #debates #debates2016,1474940091492,780581435962978304,2
139,USAforTrump2016,"""As soon as Hillary Clinton releases the 30,000 emails, I will release my taxes"" -Trump #debates #debatenight 

SILENT AUDIENCE JUST CLAPPED",1474940091686,780581436776673280,1
140,laurieeconnors,"Surprised it took him this long. He hit all of his talking points so far-Mexico, China, isis, emails https://t.co/HZOfKzddLv",1474940091681,780581436755628032,0
141,SqueekTheMayor,Someone please count how many times he interrupts.#Trump #Flapdoodle @realDonaldTrump #Debates2016 #debates,1474940091621,780581436504043520,2
142,Roobbiinnnn,Trump's strategy for beating Hillary in a debate: don't let her debate #debatenight #debates #someoneshutthisguyup,1474940091702,780581436843712512,0
143,CapnCapes,"OMG Hillary's face when Trump said ""deleted emails"" #Debates #triggered",1474940091636,780581436566798337,1
144,RandomDork1,#Debates I don't know what to think at this point...,1474940091722,780581436927639552,2
145,WhiteMentat,#Debates  fuck off lester,1474940091729,780581436956946432,0
146,AlexiaPolachek,@realDonaldTrump #debates #debatenight https://t.co/5VMR3pFnyh,1474940091565,780581436269142017,0
147,unmiraclededieu,Finally. https://t.co/SKVXcuz5aY,1474940091666,780581436692664320,0
148,nenaa__a,Here we go with the emails! 🙂🙃#debates,1474940091523,780581436093042689,1
149,bc54_52,Clintons face when Trump was speaking 😂😂😂😂 #debatenight #Debates,1474940091842,780581437430861824,2
150,jameswillemswwe,Why am I watching the debate right now just kill me #debates,1474940091764,780581437103808513,0
151,danteb1,.@realDonaldTrump : you got audited for 15 straight years because you've been a crook &amp; con man all that time (and longer) - #debates,1474940091755,780581437066010624,2
152,jenstrong411,Hilary stop rolling your eye and take trump seriously he knows his shit. #Debates,1474940091788,780581437204344834,2
153,VinLew,oh god the emails 🙄 #debates,1474940091808,780581437288218624,1
154,verocruz,HAHAHA LESTER CALLS YOU OUT DONNIE SMALLHANDS  Stop hiding ypur tax returns #Debates,1474940091830,780581437380579329,0
155,schestowitz,"Tories in the #uk are doing the same thing, it's despicable https://t.co/tVgksQJKNf",1474940091650,780581436625649665,0
156,tayloranneadams,watching the #debates like https://t.co/O8WgPMpUUG,1474940091386,780581435518353409,0
157,ahavarose333,#debates She has the same look on her that she did at the Congressional hearings for Benghazi. Very condescending.,1474940091610,780581436457947136,2
158,FamousTPerks,Just answer the questions Donald #PresidentialDebate #debates #Debates2016 #HillaryClinton,1474940092695,780581441008640001,2
159,fireballofdoom1,hillary seizing up #Debates,1474940092667,780581440891211776,2
160,whinknee,Is he bragging about being audited every year? #debates,1474940092629,780581440731746305,0
161,JosephDiNardo,"#BOOM @realDonaldTrump drops the hammer. @HillaryClinton needs to release her 30,000 emails! #debatenight #debates #Debates2016",1474940092691,780581440991789056,1
162,michelleesucks,#debates https://t.co/Hns4mYkSqE,1474940092397,780581439758700545,0
163,candiceriddell,TRUMP IS SUCH A SAVAGE #debates,1474940092720,780581441113468928,2
164,RachelA_Adler,These tweets will help remind you how weird tonight’s presidential debate is https://t.co/3wUZMTxghl #debates,1474940092690,780581440987672576,0
165,courtnedicesare,My screen =💩|💩 #Debates,1474940092716,780581441096777728,0
166,HannaTadesse,Lol I don't think he knows what fact checking means https://t.co/931ObTk9bL,1474940092685,780581440966635521,0
167,n2r3ndr2,@its_akaash @realpreityzinta @YouTube Watch @bpolitics' special coverage of the first debate @Twitter #debates https://t.co/ZoIQ6QsxFD,1474940092682,780581440954175488,2
168,Kaseydrum,"""Bait &amp; switch""
Classic Trump
#debates",1474940092775,780581441344266240,2
169,crazyjackblox,Emails mentioned #debates,1474940092779,780581441360965632,1
170,henreyclay,BINGO #debates https://t.co/v0EUAswY74,1474940092451,780581439985311744,0
171,TeeVanity,His family frontrow cheering tacky as all fucks! #Debates,1474940092807,780581441478549504,0
172,megankshea,.Admonish the audience? I wish I could admonish 50% of the US.  #debates,1474940092752,780581441247870977,0
173,Realrobwebb,Drink whenever they say emails  #Debates,1474940093575,780581444699754497,1
174,Carmelcandi68,How much of that $694 million came from Outsourcing your companies to Mexico &amp; Abroad? https://t.co/wwbUJEJTG4,1474940093480,780581444301172736,0
175,__pedico,How about Donald releases his Taxes and Clinton release the emails. Level the damn field so we can all move df on #debates,1474940093560,780581444636839936,1
176,merve_d9,"""watching the shows, reading the papers...every lawyer says don't release your taxes"" WHAT? #debates",1474940093522,780581444477456384,2
177,HPastura,"Hillary don't use hairspray, she use glue.

#debatenight #debates #Debates2016 #TrumpPence16",1474940093557,780581444624146432,1
178,diana_huskerfan,Release the emails!!!!!! #CrookedHillary #Debates,1474940093669,780581445093830656,1
179,andersonranchtx,Me to... especially since I am not watching the debate from my Ranch here in Texas... The posts are better.. https://t.co/jB3JAu54H4,1474940093646,780581444997349376,0
180,DagnyRed,"Why did she delete 33,000 emails lol ha #SlippingHillary release your medical records! #Debates",1474940093683,780581445152628736,1
181,Ewok_Ears,"#debates trump, ""I'll release my taxes when you release your emails"" my eyes can't roll further",1474940093661,780581445060464640,1
182,imjoyeon,Eita menina pode ate assistir o debate pelo twitter #Debates,1474940093596,780581444787765249,0
183,joshyblackwood,Where dem emails at? 🐸☕️ #Debates,1474940093665,780581445077172225,1
184,jupiter_attic,"Holy shit, it's done. 1st applause of the night
#debatenight #debates",1474940093701,780581445228072960,0
185,DecoRain2014,30K emails released .. When?   #delete #Killary #Debates,1474940093727,780581445337288707,1
186,merengwe,Trump vai levar essa hein .. #Debates,1474940093739,780581445387612165,2
187,danny_ivers,"Donald Trump said when Hillary Clinton releases her e-mails, he'll release his tax returns (even when in audit) #DebateNight #debates",1474940093684,780581445156896768,1
188,theartofthexpat,"My tax returns are an embarrassment about how little new I make. I'd prefer not to release the,@ 🤕 #Debates",1474940093724,780581445324668928,2
189,NathanDimitroff,"Blah Blah Blah, Blah Blah Blah, Blah Blah Blah, Mexico, shif, Blah, China, Secretary Clinton, Blah Blah Blah - Trump #debatenight #debates",1474940093652,780581445022670849,2
190,callmemuldeen,"Math is hard, right @realDonaldTrump ? https://t.co/eCFChSuStg",1474940093693,780581445194702849,0
191,camisaamarela,Qualquer semelhança do #debates com certos países é mera coincqueria estar morta,1474940093757,780581445463056384,0
192,cheyrose13,#debates I would love to see those emails,1474940093687,780581445169393664,1
193,finnsspilot,Trump you're actually a joke do you even know what you're saying? #Debates,1474940093869,780581445932765184,2
194,GeekAaron,Why would the audit prevent him from releasing the tax returns? Doesn't the IRS already have them? #Debates,1474940094666,780581449275629568,1
195,alaw312,"When trump says every single country is ripping us off, does that include Antartica? Dang I didn't know the Penguins didn't like us #debates",1474940094437,780581448315183109,0
196,The_luccky_one,#debatenight #debates https://t.co/pWrCrEcYET,1474940094132,780581447035785216,0
197,LadeeNiecee,"He evades everything, especially releasing his tax returns...what are you hiding, sir...what are you trying to alter #debates",1474940094517,780581448650817536,1
