,screen_name,text,timestamp,tweet_id,cluster_pred
0,delsina363,"Donald will start a recession, but she will get it done with clean energy?  Idiot!!! #debates",1474939054690,780577087300206592,1
1,Talon_Skye,I also feel like: #Debates2016 #debatenight #debates I will not subscribe to these shit choices you call candidates… https://t.co/lds8EVBKE9,1474939054570,780577086796947461,1
2,TSTpolitics,#debates https://t.co/jfqmJydY4S,1474939054648,780577087124074496,1
3,HumgarcJr,Will Donald be able to use any of his money during his presidency? #Debates,1474939054911,780577088227057664,1
4,GisellePhelps,"Whatever sedative Trump's camp gave him is finna wear off in 3, 2... #debatenight #debates #Debates2016",1474939054854,780577087988043776,1
5,bodabill1,Hillary now 8 yrs ago the economic crisis was because of GREEDY BANKING &amp; their CEO'S WHO FLEASED THE AMERICAN PUBLIC #Debates,1474939054707,780577087371382784,1
6,GeorginaTunt,I just keep thinking of how trump looks like a soggy cheeto  #Debates,1474939054920,780577088264744961,0
7,JimnBL,"Trump's having trouble breathing! What's up with his health?!? emphysema, chronic bronchitis, chronic asthma??? #debatenight OR #debates",1474939054760,780577087593803776,1
8,isabellegirlxo,Why is Donald sniffling like he just took a hit of coke backstage? #debates,1474939054942,780577088357142528,1
9,theNOLAgay,Wait... is @realDonaldTrump wearing pink eye shadow? #Debates2016 #Debates,1474939055005,780577088621252608,1
10,JonathanMMelvin,Donald Trump is nervous. He already has had two drinks of water. #debates #debatenight,1474939055687,780577091481837568,1
11,Cjbogue,"""That's called business."" Don't ignore him, Hillary. He just gave you a gift. #debates",1474939055612,780577091167412225,2
12,npuig2,That's called business.  I am a person that lost a house in that tragedy.  Be human  #Debates,1474939055672,780577091419041792,2
13,zachary_balog,"Trump's foreign policy is simplified down to ""jobs going to Mexico"" ... There are other countries you know. #debates",1474939055641,780577091288956928,0
14,mikemillan51,"Let the ""faces"" begin #Debates",1474939055165,780577089292537856,0
15,steve62269,Mediator already tried to interject and cut off @realDonaldTrump when he went after her 30 years of experience of f… https://t.co/StddV0OIZV,1474939055636,780577091267862528,1
16,NordanEros,F*** you trump  #Debates,1474939055824,780577092056469505,0
17,AlixanderRazali,Clinton referenced her plan to layer new tax increases on high-income households. Watch live: https://t.co/3TjxU7bIoU 🔓 #debates,1474939055502,780577090706046976,1
18,Tex0322,I thought Donald Trump has said several times he believes in free trade? Doesn't sound like what I just heard. #trump #clinton #debates,1474939055755,780577091767013376,0
19,sharpstick5,Donald's answers to the questions can be found on the same place as his tax returns #debates #debatenight,1474939055647,780577091314192384,1
20,AnkaDede,#Debates That's my GIRL.,1474939055777,780577091859337220,1
21,labroides,"""Business"" was also the excuse the guy used for closing down the community center in Breakin' 2: Electric Boogaloo #debates",1474939055444,780577090462687232,2
22,NadiaReality,Why am watching this??? #debates,1474939055794,780577091930718208,1
23,KSTP,".@HillaryClinton: Trump's economic plan ""trumped-up trickle down"" economics #Debates https://t.co/bsnXI1hGMq",1474939054708,780577087375544320,1
24,oakspear,did not deny saying it #debates,1474939055900,780577092375195648,1
25,LeJonR,"#debates trump just admitted he wanted the housing market to crash in 2008. Trumps remarks ""that's called business""",1474939055895,780577092354318336,2
26,BrevityShmevity,"I'm sure Trump has been called ""sniveling"" his entire life.
It's neat that during his first presidential debate it became literal.
#debates",1474939056661,780577095567020032,2
27,queenadalite,When Trump snorts loudly it's like a bad rhinoplasty or too many deviated septums from cocaine? No answer on bringingUS jobs back #debates,1474939056723,780577095827075072,0
28,king_celcior,So how are you gonna stop jobs from leaving  #Debates,1474939056709,780577095768379393,0
29,SkeezyDonald,"So thirsty, that I can tell you.  #debatenight #debates",1474939056551,780577095105777666,1
30,RockyTopGal14,I'm bored. When do they start fighting? #debates,1474939056655,780577095542005761,1
31,alliepsto,"I wish my parents would give me a small loan of $1 million. Where you at, Sharon &amp; Jeff? #debates",1474939056678,780577095638478852,0
32,lwelty10,Hilary is trying too hard. #Debates,1474939056533,780577095030304768,1
33,myguynoah,*sniffle* #debatenight #Debates2016 #debates,1474939056801,780577096154304513,1
34,albbc87,That's business  #Debates,1474939056795,780577096129060866,2
35,gpetsche,There is no way water made it into the Donald's mouth on that sip. #debates https://t.co/fDuH4uvB99,1474939056395,780577094451466240,1
36,joey_cabal,"Details, baby.  #FTW #ImWithHer #debates",1474939056760,780577095982391296,0
37,DeforestMessina,can everyone just shut the fuck up and watch  #Debates,1474939056763,780577095994966017,0
38,DanielRadiance,Trump did a line of coke just before this #sniffles #debates,1474939056848,780577096351354880,0
39,365REBEL365,dEMOCRATS RAN AN WAS OVER THE BOARDS THAT REGULATED hOMES AN bANKS THAT BROKE AMERICA WHEN IT IT COLASPE #Debates,1474939056847,780577096347234305,1
40,Boulderchick,Omg @realDonaldTrump is sick with pneumonia? Bad cold? Conspiracy theory guys where are u  #debates #debatenight,1474939056775,780577096045244416,1
41,kaylaaaaaaaa17,"""that's called bussniess by the way"" 😂😂😂 #Debates",1474939056856,780577096385069056,2
42,marcylauren,Seems like he snorted cocaine to me https://t.co/6gSIK5sdfd,1474939056730,780577095856427008,1
43,MKEmxp,Did @realDonaldTrump do coke before the debate or is he allergic to Lestor Holt's mohair sweater? #debates,1474939056783,780577096078860288,1
44,fvicentedasilva,A dama de ferro versão soft vai perder isto. #Debates,1474939056707,780577095760093186,1
45,twakelingtweets,I think @therealdonald_ has said #mexico 10 times and its been 10 minutes 😂 #debates #trump #HilaryClinton,1474939056970,780577096863068161,0
46,JFER1202,"Lol! ""Trumped-up trickle down"" - love her! #Debates #Hillary2016",1474939056822,780577096242434048,1
47,crmerryman,"""That's called business, btw"".  Give me a break. #Debates",1474939057012,780577097039220737,2
48,sambridiG,Something something jobs something something jobs: First few minutes of #debates #Debates2016,1474939057151,780577097622298625,1
49,TheBenSeamans,It was Bill Clinton's policies that ultimately caused the market crash of 2008. #debatenight #debates,1474939057663,780577099769716736,1
50,GregBHutchins,Investing in the right sectors will lead us to a better economy. #debates,1474939057721,780577100012978177,1
51,DonaldSchlong,Donald Trump is proving he would be the Rambler and Chief. #Debates #debatenight,1474939057421,780577098754887680,1
52,Pak48828537527,US presidential #debates will be.,1474939057747,780577100122222592,1
53,happyface25,"Watch live! ""U.S. Presidential Debates"" #Debates https://t.co/BOd5Vz30YA",1474939057745,780577100113653760,1
54,realityfangirl1,#debates Donald's already thirsty? LOL. This is gonna be a LONG night. Clean the floor with him Hill! #HillYes,1474939057743,780577100105408512,2
55,maritzaemunoz,How is $14 million a small loan?! I struggle to get $5 from my brother #Debates,1474939057660,780577099757162496,0
56,_SaraFranklin,Why is it okay for women to be interrupted when they are making an important point? #debates,1474939057698,780577099916709892,1
57,pus_ce,"Hillary did not come to play with Trump tonight, this is what we've been waiting for. #debates",1474939057740,780577100092809216,1
58,TvibopeOficial,#debates,1474939057777,780577100248018944,0
59,AFCboston,I just want to see the South Park episode they're gonna make out of this debate... #Debates,1474939057767,780577100206051330,1
60,malikamalik13,Omg 😐 #Debates,1474939057798,780577100336160771,1
61,kasarache,Lmfao trump really has it out for mexico  #Debates,1474939057867,780577100625502208,0
62,PragObots,"I hope Hillary brings up the fact Trump produces his products in Mexico, China...etc. #debatenight #debates",1474939057878,780577100671639552,1
63,emilywynnej0nes,I don't understand how politicians can act so immaturely and expect to be respected #Debates,1474939057941,780577100935880704,1
64,Thogstacker,"#debates

I'm sorry. I can't stand either one of them.",1474939058681,780577104039596036,1
65,technomics1,Both candidates came strong so far #Debates,1474939058683,780577104047902720,1
66,__jaayrock,Interesting.... #Debates,1474939058613,780577103754383360,0
67,markimus,Nervous water gulp #Debates,1474939058738,780577104278630400,1
68,BenjaminRivas,Hillary acusa a trump por ser parte de la crisis del 2008 #Debates,1474939058673,780577104006115329,0
69,ToniWilliams94,FastCompany: Audi is going big (and backwards) for the presidential #debates https://t.co/fJdPjrfYfg https://t.co/KFknuAlX9v,1474939058686,780577104060641281,0
70,ProgressVA,#debates Economists: @realDonaldTrump’s tax plan relies on “pie in the sky” math that simply doesn’t add up https://t.co/sGyoMLetde,1474939058556,780577103515443200,1
71,TARHEELBRAND,I feel bad for my fellow #LGBTQ People who vote for @HillaryClinton! Brain washed #America!😥 #Debates,1474939058606,780577103725092864,1
72,Niheala,He just keeps repeating  perceived  problems still does not say how he will MAKE business stay. #debates,1474939058632,780577103833993216,2
73,giovannilpm,lol Don has the sniffles  #debates,1474939058750,780577104328921088,1
74,ipsilva_bh,"Tenho esperança que os EUA vejam o quanto esse cara é demagogo. Não tem plano pra nada, é tipo ""confia em mim que eu sou o cara"" #debates",1474939058602,780577103708319744,1
75,roast_brew,#giantdouche #turdsandwich you're both controlled by special interests #Debates,1474939058703,780577104131792896,1
76,brook108,Is Obama the moderator? #Debates,1474939058775,780577104433934336,1
77,RenayCrowe,"interested to hear about student loans and college costs
  #Debates",1474939058717,780577104190668804,1
78,CallieW1217,Investments where we can grow the economy. There's the key. #debates,1474939058689,780577104073142272,1
79,Unanimousangel,Take a shot every time trump says wall  #Debates,1474939058794,780577104513544192,0
80,vivek_mogal,"Omg that was bad. Really ""that's called business"" wtf #debatenight #debates #Debates2016",1474939058771,780577104417153024,2
81,viperden,#debates  @HillaryClinton your in bed with big banks booooooooooo,1474939058759,780577104366702592,1
82,democratican,Seeing plenty of people complain about what Hillary is wearing.  Seriously? #debates,1474939058826,780577104647843840,1
83,MaxVillela1,Estados Unidos desde el incio ya nos dio una leccion sobre como se deben hacer los #Debates.,1474939058865,780577104811307008,1
84,AliciaLynne_,THAT'S CALLED BUSINESS BTW????? I can't  #Debates,1474939059756,780577108548526080,2
85,MaliekBlade,He's starting to get mad lol #Debates,1474939059632,780577108028432385,1
86,sholt87,"I'm bored now.
#debatenight #debates #Debates2016",1474939059770,780577108607246336,1
87,brooklyndamera,Trump actually just called exploiting the fall of the economy a business...goodnight #Debates,1474939059803,780577108745674752,2
88,prejpol,Trump's facial complexion looks alright for once. Good on his makeup artist. Good on the cameras. #debates,1474939059817,780577108804374529,0
89,Hanan_AAKARIM,Donald Trump and Hillary Clinton kick off the #debates by standing together and shaking hands https://t.co/3IWDQsF8in,1474939059763,780577108577906689,1
90,joanwood5626,"""Secretary Clinton. Is that ok? Good I want you to be happy. That's very important to me"" LMAOO subtle roast… https://t.co/QOjYs9YiwG",1474939058857,780577104777928704,1
91,GLaverriere,#GAMEON #BearPoked #debates,1474939059796,780577108716322816,1
92,LeeTomson,Either he is on coke or has pneumonia. What's up with that sniffing? @realDonaldTrump #debates #Debates2016,1474939059868,780577109018288128,1
93,MartinLockman,Debate drinking game: Drink whenever @realDonaldTrump drinks. #debatenight #debates,1474939059639,780577108057784320,1
94,wandalitwiller,Wow Hillary's already bashing Donald Trump and would someone put some toothpicks in her eyes I think she's falling asleep #Debates,1474939059923,780577109248843780,0
95,SymRob,Secretary Hillary Clinton ×2 I want you to be happy. ~ Donald Trump  #debatenight #debates #Debates2016,1474939059851,780577108946984960,1
96,wendyr13,She's rolling out too many statistics; keep it simple #debates,1474939059755,780577108544348160,1
97,SociableSport,"Enjoying this! Couldn't find the stream anywhere else. Bravo! ""Watch live! ""U.S. Presidential Debates"" #Debates https://t.co/4sFzAdX91a""",1474939059904,780577109169147905,1
98,RaymondLindsay1,I think Hilary is already getting to him. #debates,1474939059963,780577109416607744,0
99,Brasco113,This Dude Donald is a fool and a smart ass...pretty comical  #debates,1474939059978,780577109479559168,2
100,NicThorington,Ooooo-oooh! Donnys gonna regret that 'business' remark #Debates,1474939060030,780577109697765377,2
101,hugov89,HRC looking real calm!  #Debates https://t.co/Te8EOuKBf1,1474939059983,780577109500567553,1
102,JLAYFevah,"Oh gawd, are we going to have another Cruz booger lip moment from Trump? He needs to blow his nose, but no breaks #Debates",1474939060680,780577112423931904,0
103,Myranda_Pauley,#Debates climate change is real,1474939060503,780577111681724416,1
104,mistressmatisse,"""That's called 'Business'."" Niiiiiice.  #Debates",1474939060716,780577112574918656,2
105,AngelinaPhage,"""climate change is a hoax by the chinese"" #debates",1474939060810,780577112969273344,1
106,ConnorKropp,What hashtag should I be using? #debatenight #debates #Debates2016 #debate,1474939060831,780577113057275904,1
107,RodEccles,Come back from what? Lowest job participation rate since the 40's. Real Unemployment near 10% yea you are working for us Hillary #Debates,1474939060586,780577112029794305,1
108,geekyfighter,I'm actually watching this  #Debates,1474939060785,780577112864464897,1
109,girlsreallyrule,"HRC says he rooted for the housing collapse, he interjects w/ ""That's called business""-meanwhile 9 million lost homes #debatenight #debates",1474939060906,780577113371910144,2
110,NaohmiC,How many people are drunk already? https://t.co/RUrvbHAf1i,1474939060709,780577112545648640,1
111,michaelhallida4,"""That's called business by the way"" - @realDonaldTrump 
Hoping Americans lose homes is business for Donald.
#debatenight #debates",1474939060835,780577113074130944,2
112,Conscious,Eagerly waiting for Hillary to do the Harlem Shake. #debates,1474939060847,780577113124507649,1
113,GeneItsgene,#debates what's with the sniffles Donald? Are you ill? Unable to run for office?,1474939060891,780577113308995584,2
114,JohnnyFoxRox,"COLLAPSE ALREADY HILLARY FFS I WANT LULZ!

#debates #debatenight #Debates2016 #trumpedup",1474939060855,780577113158066178,1
115,Turntablez,No disrespect but is Trump having a nasal / breathing issue tonight? Like ... more than usual? #Debates,1474939060693,780577112478613505,0
116,lisaslusher2,Does that include Donald's jobs that he has outside the USA??? https://t.co/0XJn9KCT5Z,1474939060798,780577112919052292,1
117,AlanCayce,"""That's called business, my dear."" - Donald Trump #debates",1474939061044,780577113950658560,2
118,solitudeSlicer,"Trump is literally bragging about being ""smart"" by seeing a business opportunity in THE FUCKING HOUSING CRISIS #debates",1474939061124,780577114286272512,2
119,ztinthesouth,I wish I hadn't eaten dinner right before the #Debates because I'm gonna throw it all up everywhere.,1474939061681,780577116622467072,1
120,lenambadr,'we have to stop #mexico and #china from stealing our jobs.' -@realdonaldtrump #debates https://t.co/t2Y0GpXNah,1474939061521,780577115951468545,1
121,kelli_kainz,He just touched his eye brow!! Signaled the Illuminati #Debates,1474939061651,780577116496732160,1
122,HowieBlumenkopf,Trump looks like Nixon in 1960 #debates,1474939061670,780577116576419840,0
123,TrivWorks,"""He looks low-energy..."" #debates #debatenight https://t.co/BMnqJ7c497",1474939061563,780577116127580164,1
124,shesxyesi,the way to make her happy is to drop out of the race lols https://t.co/NUrqpge7yb,1474939061729,780577116823785472,1
125,__its_shahjm_x,&amp; it looks like he has the case of the sniffles RT @Refinery29: Trump can literally not stand still for 2 seconds #debates,1474939061736,780577116853329920,0
126,edengodbee,😂😂😂 https://t.co/6caFMb46Xm,1474939061463,780577115708194821,1
127,GoTimothy,"The #realDonaldTrump snorting through his nose like he did a few lines of cocaine.
#Debates #DonaldTrump #HillaryClinton #Debates2016 time",1474939061683,780577116631040000,1
128,IamChrisBeatty,#debates @realDonaldTrump  hasn't offered a plan yet nor answered the question about what he would do to bring companies back to the US!!,1474939061662,780577116542885888,1
129,KristinRuthK,"Where can I get a small, million dollar loan? #debates #debatenight",1474939061792,780577117087989761,1
130,kymgab,fact checkers better start Hillary is talking #Debates,1474939061824,780577117222363136,1
131,natalybtw,Did trump snort cocaine before this? #Debates,1474939061844,780577117306183681,0
132,HelloKiddies,What a stupid tweet https://t.co/Eynd3YxMrs,1474939061863,780577117385875456,1
133,vasmigaming,"guys, I'll try to behave tonight while watching #Debates when it comes to tweeting... I typically dislike too much… https://t.co/2glebH3tJF",1474939061768,780577116987338752,1
134,GTO_OGsaintP,#debates #debatenight DO NOT drink every time The Donald sniffs!,1474939061922,780577117633470466,2
135,emmylanepotter,GO IN ON HIM @HillaryClinton. You better slay with FACTS. #imwithher #debates #Debates2016,1474939061833,780577117260148736,1
136,MandeeHayes,Trump received a small loan of $1 million from his father. I got $100 loan from mine. #jkilovemydad #debates,1474939061943,780577117721337856,0
137,BLACKSTEMUSA,Hillary knows the details of her and Trump's policy proposal. Trump knows enough to keep the conversation going. Ouch! #Debates,1474939061715,780577116765184002,0
138,GentlemansHall,Can someone ask her about Glass-Steagal? Bill allowing that legislation die is what took eyes off Wall Street #tytlive #debatenight #debates,1474939061936,780577117691977728,1
139,bylibbybk,Why doesn't HRC point out all of Trump's businesses that are his own special interest?  #debates,1474939061886,780577117482291200,1
140,thenewsdujour,#Debates2016 https://t.co/U32fo6jMPl,1474939061922,780577117633286145,1
141,TweetsAvenger,.@realDonaldTrump really needs to #Smile more. And what's up with the color of his tie? #debates.,1474939061972,780577117843095553,1
142,MAcatholicmom,NO WE WONT....unless donald wins.  She has no idea how to make jobs....what has climate change to do with the question? Defection #Debates,1474939062025,780577118065393664,1
143,GreatArtiste45,#Debates Trump just necklaced #SickHillary with all her bad trade deals as SoS.,1474939062089,780577118333706241,1
144,Matt_Fost,How to stay entertained during the #debates https://t.co/NZqkKaEyPK,1474939061645,780577116471582720,1
145,JAGtheDJ,Hillary was first to be polite but also first to get personal with mention of Donald's dad's money. #debates,1474939062114,780577118438629376,1
146,ljteralIy,watching the #debates to try and understand what's going on as a non-american.....wtf trump,1474939062736,780577121047449604,0
147,fredbauerblog,"A reversal of Clinton's strategy: For months, she's argued that Trump isn't a typical Republican; now, she's saying he is typical. #debates",1474939062628,780577120594620417,0
148,MAGAMan_X,"Falling for the clean energy meme
#debates",1474939062784,780577121248825344,1
149,caroline_hunter,@bpolitics #debates https://t.co/LsBo8sQCZt,1474939062704,780577120913358848,1
150,oakleyass,STOP DAMN INTERRUPTING!!! #Debates,1474939062747,780577121093713920,2
151,ravireport,"Donald is the one who rooted for the housing crisis- Clinton
#debates #debatenight #housing #crisis #jobs #business #Clinton #Trump",1474939062639,780577120640794624,2
152,ashleynconnor,Wait your turn Donnie #debates,1474939062767,780577121177575424,2
153,damonwon,He clearly doesn't know what PRECIPICE means. 😂😂😂😂*sips water* #debates #Debates2016,1474939062768,780577121181769728,1
154,ECPickett,Hillary knows nothing about economics. She lies about it. #TrumpPence16 #debates #Debates2016 #debatenight,1474939062862,780577121575903233,1
155,CyberMegan,STOP INTERRUPTING HER #debates,1474939062813,780577121370566656,2
156,bxkitcat,Weren't Trump's clothes made in China? Did I remember that wrong?? #Debates #Debates2016,1474939062749,780577121102077952,1
157,davidHidalgo19,Hillary Clinton coming out here ready for battle looking like the red power ranger lol #debates #FirstDebate,1474939062874,780577121626304513,1
158,sagesera,"""That's called business"" 9 mil. people losing their jobs, millions losing their homes, etc. Doesn't matter. It's all just business #Debates",1474939062869,780577121605332993,2
159,A13Tre,"Is the audience really necessary?! 
I want a debate like Nixon &amp; Kennedy
#debates #debatenight #Debates2016",1474939062867,780577121596903424,1
160,ClintThompson4,When your pro trade and none of the major candidates supports your view #debates,1474939062894,780577121710120962,1
161,thelonliestmonk,"""We (the government) are going to invest in you (the people the government took the money from)."" -Hillary #debates",1474939062895,780577121714307072,1
162,jstutte,Did @realDonaldTrump not get his coke all snorted up before the show?  WTF with the sniffing? #Debates,1474939062640,780577120644894721,1
163,MakeupWhoreder,Trump looks like a disgruntled racist grandma. There I said it.  #Debates,1474939062986,780577122096119808,0
164,runwithskizzers,"""I hope it does collapse"" - Tr*mp confronted by his resp to the housing crisis says, ""That's called business, by th… https://t.co/Wz4arL6hGE",1474939063022,780577122247204864,2
165,NumberOneDouche,"""That's called business by the way"" lol so funny! #TrumpQuote #debates",1474939063710,780577125132742657,2
166,ASpiritedHussy,"Roast his ass, Hillary! #Debates",1474939063687,780577125036425217,1
167,Lurking4Music,This live tweetin' is gonna be cool #debates,1474939063768,780577125375938560,0
168,thephucpham,Hillary's getting in some mean hits #Debates,1474939063546,780577124444991488,1
169,fazebieber,here we go #Debates,1474939063784,780577125443080192,0
170,StephanieRuiz20,Watching the #Debates like https://t.co/JTvkQqLkEa,1474939063555,780577124482682880,0
171,Brazil201,Trump is cracking lmao  #Debates,1474939063848,780577125711523842,0
172,koharapierce,😂😂😂 https://t.co/PkTuAyvvxG,1474939063716,780577125157986304,1
173,jakesprague,I'm digging this Lester Holt guy. Let's make him president. #debates,1474939063824,780577125610827776,1
174,Nic4Nack,"Some people say he has COPD, really bad. Some people say it. https://t.co/vycdQaDMmE",1474939063665,780577124944076800,1
175,DStevems,#Debates financial crisis was caused by the banks that got greedy.,1474939063859,780577125757616128,1
176,_theReal_Cory,"""Science is real"" lol
  #Debates",1474939063972,780577126231707648,1
177,j_s_l,Trump being Trump declares everything awful and he will make it better with zero details (but great constipated expressions) #debates,1474939064053,780577126571323392,0
178,CeRodg,Don't talk over each other please #debates https://t.co/RBN7C8qaoL,1474939064091,780577126730780676,1
179,slossmary,#trump: are the sniffles a result of #boogersugar or bubonic plague? Let's analyze ... #debatenight #debates #Debates2016 #coldsarecommon 🙃😒,1474939064747,780577129482162176,1
180,Teycer_OG,I love that twitter does this 👍🏾 #Debates,1474939064747,780577129482231808,1
181,Churchillmom,#debates https://t.co/XYCo2e1m6G,1474939064667,780577129146626048,1
182,ordilectgirl,Watching debates without Twitter?  You are missing out! #debatenight #Debates2016 #debates,1474939064774,780577129595404288,1
183,lmadams12,Why the sniffles Donald? #Debates2016 #debates,1474939064675,780577129180389377,2
184,SmugVegetarian,#Trump THIRSTY...#bigly #debates,1474939064745,780577129473843201,0
185,nadiazucc33,Saline spray works great @realDonaldTrump #cleartheairways #breath #sniffsniff #debates,1474939064701,780577129289441281,1
186,preawwy,เมืองไทยน่าจะเอานักการเมืองมา #Debates แบบนี้บ้าง ก่อนจะเลือกตั้ง จะได้รู้อะไรนิดหน่อย ดีกว่าไม่รู้อะไรเลย แล้วเลือกเพราะพรรคไป,1474939064676,780577129184591872,1
187,1080skibunny,Lying Hillary just lied again #Debates,1474939064744,780577129469796353,1
188,JameeBelle,"Yo- I'm all about clean energy, girl. #debates",1474939064724,780577129385852932,1
189,EEmersonWhite,"He's furious that she called him Donald, and not Mr. Trump.

#debatenight #debates #Debates2016",1474939064732,780577129419407360,2
190,yagirltflow,#trump called capitalizing on the pain and suffering of those of us who suffered from the recession as BUSINESS. Is that right?! #debates,1474939064720,780577129369104385,2
191,otpbubbletea,Take a shot every time trump says something about Mexico #debates,1474939064862,780577129964507137,0
192,TrzinskiN,a cara do Trump me estressa #Debates,1474939064708,780577129318715398,0
193,CyberAnonymous,"timesofindia: Wealthy need to pay their fair share, says HillaryClinton

https://t.co/liatX0fgL2

#Debates2016 #debatenight #debates",1474939064871,780577130002411521,1
