,screen_name,text,timestamp,tweet_id,cluster_pred
0,LaytonEWilliams,I want a gif of that face Hillary just made. And then it's going to be my response to everything absurd ever. #debates,1474940960752,780585081903706113,1
1,tieoptional,"Attack the judge. Nice, trump. #debatenight #debates",1474940960710,780585081727574016,5
2,Slypickle,"""in Chicago almost 4,000 people have been killed [by guns]"" maybe it's a gun issue and not a policing issue 🤔🤔🤔 #Debates",1474940960810,780585082146856960,4
3,tsudrats_,Ща буит мясо))0) #Debates https://t.co/73K4gs2NMH,1474940960589,780585081219915777,4
4,mollybommarito,"@amyschumer trying really hard to stick with the debate, but just got your book and it's calling my name.… https://t.co/LsnNqqX5Ar",1474940960559,780585081094017024,4
5,usweekly,"Trump: ""No wonder you've been fighting ISIS your entire adult life!"" Live #DebateNight updates:… https://t.co/njkbecVbCS",1474940960226,780585079697469440,4
6,MultiTasker75,Dumas Drumpf - stop and frisk is illegal.  #debates,1474940960794,780585082079903744,3
7,wetdreaams,How are police afraid to do anything ?? They shoot anything walking  #Debates,1474940960943,780585082704633857,5
8,PlatinumMom1985,CLINTON CRASHED! TRUMP TRIUMPHS AGAIN!! #Debates2016 #debatenight #debates #TrumpPence16 #TrumpTrain @realDonaldTrump,1474940961676,780585085779050497,4
9,EileenMGiblin,WTF is he talking about #Debates,1474940961656,780585085695324160,4
10,JoelleCharming,Law and order? Wow. The question is about race. This guy can't actually be running for president in 2016. #debates,1474940961695,780585085858750464,0
11,LittlestWinslow,Bring back #LawAndOrder? AGAIN!? That show just won't die. #debates https://t.co/YX2CNGpkLn,1474940961255,780585084013408256,1
12,linzeelu,Wow. He just made it sound like the people killed in Chicago by guns over the last decade was somehow Obama's fault. #thanksObama #debates,1474940961718,780585085955211264,2
13,maural_outrage,"His supporters are so dumb that he says ""law and order"" like a dozen times and they piss their pants and vote for him. #debates #debatenight",1474940961640,780585085628248064,0
14,Kylewyatt,How many different ways can I say Fuck this guy? I need all the ways right now. #debatenight #Debates2016 #debates,1474940961723,780585085976272896,2
15,JohanNDaCut,DID HE BLAME OBAMA LOL #Debates,1474940961642,780585085636673540,4
16,PrincessxEevee,Exactly! #Debates,1474940961655,780585085691199489,4
17,Nate_Allbomb,"When does Lester Holt interrupt and say ""it's Saturday night live!!!"".  It's coming soon, right? #debatenight #debates",1474940961756,780585086114680837,4
18,PheenixDreamer,Since when do guns shoot people? #Debates,1474940961764,780585086148153344,2
19,RonLybrand,I just told @nbcwashington who I think is winning. Cast your vote now! #Debates #NBC4DC https://t.co/eGEf6VWzKx,1474940961622,780585085552721920,1
20,Esmie661956,He has no idea what the heck he's saying! Here we go another long babbling explanation #Debates,1474940961751,780585086093701121,4
21,PinkieWbaby,"Just saying,Hilary sounds more mature than Trump. #debates",1474940961705,780585085900845056,4
22,jasn_lee,Is Trump preaching gun control??  #debates,1474940961586,780585085401694209,4
23,AngryDante,Make no mistake. He knows what he's doing- making meaningless statements that still illicit an emotional response by the uniformed #debates,1474940961735,780585086026551297,4
24,schweety5,I just told @nbcwashington who I think is winning. Cast your vote now! #Debates #NBC4DC https://t.co/9Nt71B85je,1474940961647,780585085657608192,1
25,lluuccyyffuurr,ugh keep your stop and frisk out of my city you turdnugget  #Debates,1474940961751,780585086093631488,4
26,xdirtypanda,Make anime great again Kappa #Debates,1474940961823,780585086395658241,4
27,_iiTorusuX3,Why is it all about the immigrants? When it's the police for shooting innocent people! #debatenight #debates,1474940962675,780585089969205248,5
28,TaylorLetofsky,He wants to bring back Stop &amp; Frisk? Oh my gosh #debates,1474940962554,780585089461870592,4
29,michaelheinley,"We need law and order. The original, Svu, criminal intent, and all the rest #debates",1474940962657,780585089893662722,0
30,reesycup,#Debacle2016 #debates #LetGaryDebate,1474940962662,780585089914712064,4
31,stevemincer,"you're a moron. ""This means that airports must operate like businesses – funding their operations from their revenu… https://t.co/Pogw28ff9X",1474940962631,780585089784700929,4
32,josephesr,This fool just said #stopandfrisk is an effective policy #Debates,1474940962683,780585090002915329,4
33,SNeverything,"Never thought I'd hate words like hundreds &amp; thousands &amp; millions because I like money. But thanks to Trump here I am
 #debatenight #debates",1474940962673,780585089960845312,4
34,TighRickman,Trump doesn't pay income tax because he's smart? So what does that make the rest of us? #debates,1474940962601,780585089658867713,4
35,stephcastro904,LESTER LIKE YOUR TWO MINUTES EXPIRED SIR #debates,1474940962701,780585090078351360,4
36,aykanian,"If Stop and Frisk was so successful, it wouldn't be spoken of only in the past tense. #Debates2016 #debates",1474940962663,780585089919049728,4
37,Becky_Good_Hair,"""A very against police judge"" ~@realDonaldTrump #debates",1474940962607,780585089684103169,5
38,jmay06,Repeating more discredited myths.    #Debates,1474940962699,780585090069979138,4
39,cricketylarry,Okok cool but when is he actually going to answer the question #Debates,1474940962722,780585090166300672,2
40,badIandhs,#Debates UGH DID HE DAY ITS THE ILLEGAL PEOPLE'S FAULT WHATBTHRFUCK,1474940962650,780585089864462340,2
41,melwrightwv,Stop and frisk ala Guliani is unconstitutional!!! Stop staying that! #Debates,1474940962607,780585089684148224,4
42,annsaxtonmurphy,Can we bring back Law and Order? Says Trump. Isn't that TV show cancelled? #Debates #OAPolitics,1474940962714,780585090132750337,0
43,RealGFGG,"Taking guns away? What about the second amendment you keep talking about Trump?

#debatenight #Debates2016 #USPresidentialDebate #debates",1474940962721,780585090162188288,2
44,vegancunt,Me watching the debate #debates #debatenight https://t.co/ypq0kckoJd,1474940962499,780585089231093760,1
45,DRE3K,"""In many cases their illegal immigrants."" --referring to gangs?! #debates https://t.co/CRC58ZRPav",1474940962460,780585089067585541,3
46,SweaterKobain,This man said immagrants got guns &amp; they shoot ppl  #Debates,1474940962719,780585090153721857,2
47,AlexPalombo,"Black man: ""Actually, stop and frisk was ruled unconstitutional.""
Donald Trump: ""No, you're wrong.""
#debatenight #debates",1474940962644,780585089839337472,4
48,missnighthawk,"The over under in vegas for trump to say ""I love black people"" is 4 #debates #Debates2016",1474940962858,780585090736730112,2
49,Shamstack,Stop in frisk did not work well. #debates,1474940963683,780585094197022721,4
50,thattinywebsite,Lester Holt looks like he's doing everything in his power not to backhand Trump. #debates,1474940963537,780585093584785408,4
51,MAReyesAUTHOR,Bring back law and order! #Debates https://t.co/VaHsG63zbc,1474940963295,780585092569829376,0
52,Cybersoulja,The police are afraid? The ones trained to serve and protect their citizens are afraid? LMAO man get this orange nut off my TV #debates,1474940963703,780585094280990721,4
53,kellyhorsley,"""Law and order."" #Debates",1474940963766,780585094545158144,0
54,natchristmas,The change we need in the word #debates https://t.co/qokdzokjr9,1474940963666,780585094125846529,1
55,MissyMoyMoy,So Trump is actually not making any point you know.. #Debates,1474940963678,780585094176206848,4
56,paromau5,"@realDonaldTrump advocating for what he calls ""law &amp; order."" Hitler would have done the same thing my friend #debates",1474940963699,780585094264283136,0
57,CharityTD,Its official: #drunkuncle is the GOP nominee this year #debatenight #Debates2016 #debates,1474940963573,780585093735718912,4
58,LaureneUgalde,".HillaryClinton: ""We have to restore trust between communities and the police."" #debatenight #debates #Debates2016 https://t.co/r5EgULgQpw",1474940963702,780585094276911104,5
59,BrandonHaskey,He's befuddled by the racial profiling question. #debates,1474940963687,780585094213959680,4
60,pete0721,"He pointed at Hillary when he said, ""We need to take guns away from Criminals who should not have them"" #Debates",1474940963706,780585094293487619,2
61,haileyywrightt,"Can't decide if Trump is saying ""law and order"" or ""law and otter"" #debates #debatenight",1474940963806,780585094712995840,0
62,Marley_Killer,Stop and frisks worked well?!?? Wait run that back Trump.  #Debates,1474940963729,780585094390116352,4
63,Doctor_PMS,Hillary just sighed so bad now #debates,1474940963808,780585094721380352,2
64,larimonteiro90,Trump is the king of giving long answers and not answering anything at all #debates #debatenight,1474940963696,780585094251704320,4
65,reboredough,"""Your two minutes is up but go ahead keep talking"" #debates",1474940963700,780585094268481536,4
66,KraigBeaudoin,Trump says we need to bring back Law and Order...if he says we are bringing back The X-Files he might have my vote. #Debates,1474940963646,780585094042030080,0
67,openbrackets,"law and order = violence, atm

#noplan
#trump
#debates",1474940963672,780585094151020544,0
68,ZombieGiraffe17,"""They have guns and they shoot people"" -Trump  #Debates",1474940963775,780585094583054340,2
69,nes709,"We need law and order in our country.
#debates 
#debatenight https://t.co/ZpdxHx7xSr",1474940963621,780585093937045504,0
70,M_Sitter,Live fact checking care of @NPR @nprpolitics https://t.co/9yn8vLoXd2 #Debates,1474940963688,780585094217994240,1
71,BoringDrew,"Dick Wolf, we need more Law &amp; Order. Please, hear our cries #Debates",1474940963727,780585094381576197,0
72,ginny_rush,"I'm sorry, the moderator is wrong, Mr. Trump? #debates",1474940963773,780585094574641153,2
73,FergHodgson,Trump’s authoritarian side ins’t pretty. #debatenight #debates https://t.co/naKqLQHahB,1474940963729,780585094390087681,4
74,robthe4th,Anybody want to know how to run a live #factcheck ?  Take a look at https://t.co/Lc6jCIRbcL #debates Way to go @NPR,1474940963791,780585094650011648,1
75,scaria1995,thousands sounds high #debates,1474940963808,780585094721466368,4
76,caffeinequeenxo,I'm originally from DuPage in Illinois and it happens to hold a part of Chicago and my parents refused to let me go to the city #debates,1474940964682,780585098387320832,4
77,monica_foote,"Dang, Lester! #debates #stopandfrisk",1474940964784,780585098814947328,4
78,denby10562,#Debates Donald is drinking a LOT of water ---choke---!,1474940964607,780585098072694784,4
79,ellen_g,Of course police unions endorse Trump. They’re racist and so is Trump. Perfect match. #Debatenight #debates,1474940964783,780585098810798080,4
80,Unisheep_72,"Obama is now responsible for murders in Chicago??? Blame the black guy, huh?#Debates",1474940964664,780585098311852033,4
81,janna_tay,"""DONALD I KNOW YOU LIVE IN YOUR OWN REALITY"" 👏🏼 #debates",1474940964799,780585098877870080,4
82,nikkirich61,I'm sorry? #Debates,1474940964626,780585098152325121,4
83,sle3751,"Trump: we need to use ""stop and frisk"" 
Holt: that was ruled unconstitutional due to racism
Trump: nuh-uh
#debates",1474940964697,780585098450042880,4
84,bucksbarne,gang gang #freekodak #1k #Debates,1474940964676,780585098362155008,4
85,KevinMedley2,#Debates How smart is he...guns are smuggled into the states.,1474940964743,780585098643140608,4
86,jayhel,How do you heal the racial divide? Stop being racist! #debates,1474940964703,780585098475212800,4
87,Bossip,What the F**K did ANY of that have to do with race?!?!? #debates,1474940964672,780585098345377792,2
88,TheBishopTuTu,Trump says you're wrong Lester. There is no room for facts. This is a debate. #Debates #DebateNight #MSNBC,1474940964332,780585096919277568,2
89,MamaKeiki,A very against police judge? WTF? #Debates,1474940964706,780585098487799810,5
90,marilock,"""Charlotte: A city that I love, where I have investments."" - @realDonaldTrump I see what u care abt $$$ #debates https://t.co/qQ7pKVOPqY",1474940964595,780585098022313985,4
91,bavery614,Tell me @realDonaldTrump didn't just praise stop and frisk... What. A. Moron.  #debates,1474940964768,780585098748067841,4
92,Taiwon1on,@realDonaldTrump you don't give Flying fuck about Chicago!!!#debates2016 #debates #FuckTrump,1474940964746,780585098655727616,2
93,kelnmeyer,"Trump saying Stop &amp; Frisk worked. Fact checkers, I'm looking at you. #debates",1474940964830,780585099007963136,4
94,tchop__StL,"Already seeing white male journalists declaring Trump has won because ""jerks win debates."" I'm honestly not making that up. #debates",1474940964954,780585099528015873,4
95,0hjayhitit,trump. resources  #Debates,1474940964943,780585099481853956,4
96,KronTom,"MORE...""Law and Order""??? Haven't we been punished enough. #debates https://t.co/IxP2O3hdea",1474940964836,780585099033141248,0
97,PaladinCornelia,"Yet another Trump supporter.
  #debatenight #debates  #Debates2016 https://t.co/2cRKajREBU",1474940964797,780585098869473280,1
98,Talia_Yepes,"Stop and frisk? Are you kidding me? Yeah, real smart Donald. Dumbass. #debatenight #debates",1474940965689,780585102610866176,4
99,LazyGinger,I agree! Bring back Law and Order! It's weird that SVU is the only one left #debates #debatenight,1474940965480,780585101734322183,0
100,JackeeHarry,"Trump is using ""law and order"" as code for ""militarized police."" #debates",1474940965641,780585102409658368,0
101,shparrow,Just saying.. #debates https://t.co/moIWG3Y6lx,1474940965576,780585102136844288,1
102,jrustman99,"Granted a higher % of blacks based on population are shot, however other minorities  have an even higher % yet no riots. #Debates",1474940965734,780585102799613953,4
103,readerobserver,Donald's answer to the racism question was to say brown and black people are criminals #debates,1474940965680,780585102573121537,2
104,Grassonmydesk,"#Withher or not, 'who's winning' is not disputable. If you're tweeting how they're 'both terrible', you just don't look smart, soz. #debates",1474940965641,780585102409695232,4
105,milyryder,"""You are wrong."" #dumptrump #NeverTrumpOrHillary #debates",1474940965742,780585102833250304,2
106,giftedchoice_,"This guy is basically saying arrest all minorities or quote unquote ""Law &amp; Order"" #Debates",1474940965750,780585102866681856,0
107,jnelleiz,But Trumps answer is worse BY FAR. #Debates,1474940965735,780585102803734528,4
108,HampsonJoshua,A very against police judge? #debatenight #debates #Debates2016,1474940965749,780585102862671872,5
109,IAmMaxBraun,"@realDonaldTrump logic. ""I'm losing money so America is obviously failing."" #debates #selfinvolved",1474940965636,780585102388658179,4
110,panther_dragon,"Trump: ""How do we solve race relations? Two names: Lenny Briscoe &amp; Jack McCoy"". Whaaaa?! #lawandorder #debatenight #debates",1474940965712,780585102707425280,2
111,Faekofall1,#Debates Immigrants???? Really????,1474940965872,780585103378362368,3
112,ArtsyBarika,Lol he doesn't even know #stopandfrisk is unconstitutional #debates,1474940965739,780585102820638721,4
113,kcwriteaway,Trump did you just use the time to talk about race to big up police? #debates https://t.co/O7DEnoKCtP,1474940965669,780585102527045632,4
114,MickeySCarolina,It's as if she's reading off a TelePrompTer. Her prepared answers make it obvious she had questions in advance https://t.co/LPcetFhEeP,1474940965748,780585102858477568,4
115,thebmacattack,THE STOMACH ULCER IS HEREEEEEEEEEEEEEE #trumpsthoughtsonrace #ICANFEELITINMYBONES #debates,1474940966527,780585106125840385,4
116,mattatarms,Wasn't 20+ seasons enough #lawandorder #debates,1474940966673,780585106738077696,4
117,fsingleton19,Is he talking about gun control or am I crazy? #debates,1474940966615,780585106494853120,4
118,kylielarosa,trump just repeats the same phrases over and over and never really explains himself... #Debates,1474940966604,780585106448617472,4
119,kinseyschofield,Anyone else seeing Hillary Clinton's awkward blinking? Has it gone viral yet? #debates,1474940966627,780585106545250304,4
120,NWA_Alli,"""No, YOU'RE WRONG."" 

#debates",1474940966604,780585106448658432,2
121,CDestructor12,#debates,1474940966643,780585106612350976,2
122,TheErinLane,Stop and frisk was successful? #debates,1474940966639,780585106595536897,4
123,Brekene,Is Donald Trump really this stupid?#debatenight #debates,1474940966603,780585106444550144,4
124,mcbride_glen,#Debates This debate brought to you by Brawndo: The thirst mutilator,1474940966737,780585107006431232,4
125,Cliffwho,I just told @nbcwashington who I think is winning. Cast your vote now! #Debates #NBC4DC https://t.co/K2NFoWF0UZ,1474940966504,780585106029309954,1
126,heyits_sraaa,I'm gonna go watch Friends instead and not lose my mind #debates,1474940966525,780585106117386240,2
127,badman_ac,This nigga ain't trynna answer the question #Debates,1474940966693,780585106822066176,4
128,_DanPark_,Oh lord did Donald Trump just try and correct Holt? LOL This is ridiculous. #debates,1474940966721,780585106939469825,2
129,GoForJazzy,"Trump, say '""thousands"", again... #debates https://t.co/L4RTBQWFCN",1474940966563,780585106276622336,4
130,bhodili73,Trump's plan to heal racial divide is to bring back law and order to include more stop and frisks.  #debates,1474940966750,780585107060994049,0
131,stukeyaki,Is trump debating Hillary or President Obama #debates #Debates2016,1474940966653,780585106654294016,4
132,DjErikaB,"Hold up, he wants Stop &amp; Frisk? ?!!!! Jesus!  #Debates wow he's done",1474940966703,780585106863976449,4
133,BiaBrazil,"Hillary is a north-american version of Dilma Rousseff! Yes, they both are capable of ruining our countries! https://t.co/ek0fU4EPM7",1474940966632,780585106566250496,4
134,CreativeHijinks,My kingdom for a commercial. #debates,1474940966723,780585106947833856,4
135,gtmakeup,"""A very against police judge"" #Debates2016 #Debates #debatenight",1474940966675,780585106746507265,5
136,ArzackSylpheed,"He talks needs, he doesn't talk solutions #Debates",1474940966721,780585106939514881,4
137,tagreedabdallah,IF TRUMP MENTIONS OBAMA ONE MORE TIME HE BEST BE SQUARING TF UP SMFH #debates,1474940966792,780585107237240832,4
138,waltees31,"I would rather see her on my tv during the next American Tragedy, just saying. #debates",1474940966708,780585106885017600,4
139,TheUnionHiphop,What language was that sentence Trump? #debates,1474940967479,780585110118825984,4
140,MrMurdochh,#debates,1474940967689,780585110999404544,2
141,speedfrce,he needs to STOP with the stop-and-frisk #debates nobody deserves that treatment because of their ethnicity,1474940967651,780585110840246272,4
142,SecretaryStreep,"Panelo, Andanar and Yasay, Trump needs you rn. @nobodybutedj  #Debates",1474940967636,780585110777192448,4
143,bigdaddyspring6,You get shot..need law and order??? Throw them in prison..stop and frisk..no plan at all #debates,1474940967709,780585111083331584,0
144,Vote4JillStein1,"Hillary will do for Women what BarackObama did for African-Americans- 'NOTHING' ! Oligarchs don't care about anyone!
#debatenight #debates",1474940967618,780585110701768705,4
145,Bgummercomicart,I'm looking at the #ClintonFoundation and the corruption they have perpetrated #tytlive #DNCleak #ImWithHer… https://t.co/rWV8bVhaDE,1474940967514,780585110265442304,1
146,heathdavi,"Welp, there it is #debates",1474940967626,780585110735298560,4
147,JulietHuck,Fact check him. Wow.  #debates,1474940967604,780585110642896896,4
148,AvidReaderBlog,Trump keeps repeating himself and doesn't give a plan.... #Debates,1474940967682,780585110970241026,4
149,bigmech21,@jemelehill 😂😂 https://t.co/fjKcQNvZpx,1474940967593,780585110596759552,4
150,TheCaNerdian,"""Our police are afraid to do anything.""  You know, except regularly gun down civilians.  #Debates2016 #debatenight #Debates",1474940967766,780585111322398720,5
151,BenMCHickey,Politics and money should not mix. https://t.co/DMtugYG31o,1474940967664,780585110894702594,1
152,LePetitErik,#debates THANK YOU MODERATOR FOR FACT CHECKING HIM. DO. NOT. ARGUE. WITH. THE. MODERATOR.,1474940967633,780585110764711936,2
153,quietbutriots,"""Stop and frisk isn't racist"" LMAOOOOOOOOO #debates",1474940967734,780585111188283393,4
154,emmthebrave,Oh NO HE DID NOT. #stopandfrisk #debates,1474940967430,780585109913268224,2
155,Juliek1029,This topic should have been at the top #Debates,1474940967715,780585111108591616,4
156,msjennmurphy,"""a very against police judge"" WHO TALKS LIKE THIS?!?!?! #debates",1474940967827,780585111578226688,5
157,KwaiziahWright,"Lol @ ""restore trust""  #Debates",1474940967786,780585111406292993,4
158,peggyjags,Lester - don't let him get away with the lies #debates,1474940967720,780585111129579520,2
159,ICUJockingJazzy,Who tf looks up how many ppl have died in Chicago since Obama has been in office?? #debates,1474940967765,780585111318327296,4
160,scofforama,"I'm sorry...how does ""law and order"" bridge the racial divide? #debates",1474940967551,780585110420750337,0
161,JuellaB,STOP AND FRISK DID NOT BRING ANYTHING BUT INNOCENT PEOPLE AND TRUST DOWN. #debates #debatenight #Debates2016 #TYTLive,1474940967802,780585111473512448,2
162,fejimanz,Trump is a legal POWERHOUSE.  #Debates,1474940967777,780585111368585217,4
163,milaughclass,Donald please stop your African-American outreach...it...is...painful.... #debatenight #debates #debate2016,1474940967802,780585111473393664,4
164,Obiwanbluedogie,Undocumented immigrants are all gang members. #Debates,1474940968671,780585115118215168,3
165,BabyMila2011,"Very bold ""correcting"" the moderator #debates",1474940968695,780585115218948097,4
166,GunterFrancisco,"D: ""Charolette a place I love, a place I have investments in""
So you care more about money than the lives of citizens?
#debates",1474940968685,780585115176939520,4
167,jpreston4thewin,The police are afraid to do anything? THEY'RE KILLING INNOCENT PEOPLE. #debates,1474940968625,780585114925273088,5
168,maturewoc,this is sad. #Debates,1474940968578,780585114728366080,4
169,DaarkChocolatee,I can not take Trump seriously#Debates,1474940968696,780585115223101440,4
170,Anthony80069394,"Trump just made the most racist statement by claiming minority communities are ""hell,"" as this is the myth of the violent minority. #Debates",1474940968645,780585115009355777,4
171,rousejoe,"@realDonaldTrump obviously visits urban communities often.

""Law and order"" and ""stop and frisk.""

Wow.

#debatenight #debates",1474940968425,780585114086629376,0
172,audreyoooo1,So Trump's solution to racial tension is 'be strong' #debates,1474940968699,780585115235868672,4
173,msdrjuris,Greatttttttttttt. Donald interrupting the moderator. #debates,1474940968704,780585115256631296,4
174,TaritaC,Trump wants more stop and frisk. So much for the Constitution. #Debates,1474940968624,780585114921304064,4
175,jphoganorg,#LesterHolt #NBCDebate #Debates2016 #DebateNight #Holt &gt; #Debates: Irony in Hillary say #TrickleDown aft #GreenAgenda all top down.,1474940968483,780585114329808897,2
176,devonkianna5,"Trump says Clinton doesn't want to use the words ""law and order."" He continues, ""We need law and order in our country."" #debates",1474940968753,780585115462303744,0
177,DeitschFactor,"#Debates What about the police and their ""help"", @realDonaldTrump?",1474940968752,780585115458035712,5
178,Ngongang,Why are all these dogs barking? #debates,1474940968778,780585115567001602,4
179,Movement2016org,Stop and frisk DOES NOT work. It never has. #Movement2016 #debates,1474940968549,780585114606694401,4
180,JOSHUACMB,Who was a very against police judge .... #debates,1474940968765,780585115512700933,5
181,marycmccormack,"If we don’t have law and order, what’re we going to watch on TV? #ChicagoFire? #Debates",1474940968771,780585115537641472,0
182,Ekalaka,#totally #fersure #trump #debates,1474940968747,780585115437051904,4
183,DillonJaden,"Stop &amp; Frisk My Dick, Trump. #debates",1474940968764,780585115508506624,4
184,MeganByrnes2,And meaningful gun reform. https://t.co/09Vrm41s2M,1474940968809,780585115697029122,1
185,icaro_9,Bring back Law &amp; Order original cast please @HillaryClinton @realDonaldTrump  #debatenight  #Debates,1474940968790,780585115617558529,0
186,eren_CiM,@realDonaldTrump Leave the stats and tell Americans HOW... #DebatesNight #Debates,1474940969670,780585119308320768,4
187,sfcpeteret,#debatenight #Debates2016 #debates I don't understand why we still see color. This is one Nation Under God. I wasn't raised that way.,1474940969653,780585119237017600,4
188,DukeOfEarley,Debate break! #debates https://t.co/5LnBDLnOoj,1474940969481,780585118515724288,1
189,summerskate,"Don't do it, Lester!  It's a trap!  #debates",1474940969638,780585119174258688,4
190,TheKimNguyen,STOP THE PRESSES! Lester Holt finally interrupted the #debates with a #factcheck,1474940969540,780585118763057152,4
191,montanaosu,No Lester you are wrong.  Let me whitesplain it to you. #debates,1474940969672,780585119316779009,2
192,artificialjinri,WHQT TJE FUCK ARE YOU TALKING ABOUT #Debates,1474940969722,780585119526428672,4
193,besimche101,''race'' Jobs for minorities anyone?  #Debates,1474940969553,780585118817718273,4
194,PunkSmurph,#Trump brought up stop and frisk on a question about race.  Bad move. #debates You can't defend stop and frisk,1474940969682,780585119358652416,4
195,indranibala,How has this man not even mentioned police brutality once in this speech on race #debates,1474940969685,780585119371370497,5
196,USJeffersonianA,Pls RT: #debates #ReEnterSanders! Bernie Sanders: Our Enemies Are Not Overseas (3/31/1992) https://t.co/uw55tfd5rI,1474940969668,780585119300128768,1
197,unwaveringAXIS,AND DID!!! https://t.co/NYCUPuYaLh,1474940969684,780585119367041028,1
