,screen_name,text,timestamp,tweet_id,cluster_pred
0,SRQuigley,Trump says 3000 shootings and 4000 people killed. #debates,1474941054637,780585475685945348,0
1,_tatianap,Wait a second... does anyone hear Trump's breathing? Is he sick? #debates,1474941054613,780585475585273856,1
2,SaraMKnox,Trump's unpaid bills: https://t.co/ShfZqK08kp #debatenight #debates,1474941054678,780585475857801216,0
3,ndante25,IS HE SERIOUS RIGHT NOW IS HE SERIOUSLY ARGUING THAT STOP AND FRISK SHOULD BE BROUGHT BACK DID HE JUST TELL LESTER HE WAS WRONG#debates,1474941054619,780585475610406912,1
4,TennisLover03,Can @realDonaldTrump finish a sentence coherently?? Or even answer a question??? #debates,1474941054502,780585475119513600,1
5,Heyam000,Trump has no idea what he is doing he can't finish a sentence  #Debates,1474941054670,780585475824160772,0
6,Their_Malarkey,Trump is fact checking Lester's fact checking - He is clarifying the facts &amp; keeping the press honest #debatenight  #Debates2016  #debates,1474941054718,780585476025712644,1
7,mzneisha0005,He's insane. #thatisall #debatenight #debates #Debates2016,1474941054563,780585475375521792,0
8,daynickuh,"Yeah, that old ""stop and frisk"" really helped build relationships... #WTF #debatenight #Debates2016 #debates",1474941054583,780585475459256320,1
9,brando8675,Trump is the only one that can new us from being destroyed. At least between the two of them  #Debates,1474941054618,780585475606138880,0
10,nataweejunks,racial violence cannot be solved by racial profiling #debates,1474941054597,780585475518201857,0
11,XxViper_TxX,"What season of ""Law and Order"" do we need? #Debates",1474941054811,780585476415643648,2
12,Vinlockz,"#debates You could ask Trump ""How old are you?"" you'd learn the age of everyone in the world before you still don't get an answer.",1474941054771,780585476247859200,1
13,taticavante,Queria me tornar uma cidadã norte americana só pra votar no Trump #debatenight #debates,1474941054802,780585476377968640,1
14,Toledowholesale,"Retweeted Gov. Gary Johnson (@GovGaryJohnson):

.@realDonaldTrump decoder: ""law and order"" means throwing away the #constitution #debates",1474941054678,780585475857911808,2
15,mawsonjohn,Shit. I can't join a gang now. Im not an illegal immigrant #debates #trumplogic,1474941054772,780585476252049408,1
16,LauraHarrisWFTS,"LESTER : ""The argument is racial profiling.""

TRUMP : ""Nope, just taking guns from bad people.""

#Debates",1474941054769,780585476239532032,0
17,msrbt,AND THEN YOU WANNA BUILD A WALL #debatenight #Trump #Debates,1474941055667,780585480006012928,0
18,_Smythe_,That's honesty right there #racist #debates,1474941055627,780585479838265344,1
19,BlackSantaFTW,"Lester Holt: Stop and Frisk was deemed unconstitutional and discriminatory against blacks. 
Donald Trump: No it was… https://t.co/vZUxXWemw8",1474941055378,780585478793916416,1
20,Tatumspop,"Dammit, someone call timeout and give Donald some Flonase! #debates #sniff",1474941055780,780585480479924225,1
21,mistermocha,"""take the guns from the bad people"" and how do we do that? #Debates",1474941055632,780585479859150848,1
22,Vlaka3210,Why don't we just give the police Nerf guns? #Debates2016 #debates #debatenight #debate #USA #PresidentialDebate,1474941055683,780585480073125888,1
23,stellarghouls,Which one? https://t.co/PNTFl8PVJl,1474941055613,780585479779577856,1
24,julisvoice,"#debates no, stop and frisk is a good thing, says the white rich guy.  Reality check please- unconstitutional",1474941055702,780585480152899584,1
25,MichaelJMIV,"Stop frisk and shoot anything that looks at you the wrong way, right? #debates",1474941055695,780585480123539456,1
26,AlphaFoxWarfare,"Clinton looks like fucking Mort from Madagascar except ugly. 

#Debates #Debates2016 #debatenight #Hillary #HillaryClinton #ImWithHer",1474941055523,780585479402061824,0
27,staceystowe,Lester Holt has to be more assertive #debates,1474941055712,780585480194785280,1
28,MisterMott,The sniffing of @realDonaldTrump is the sound a dementor makes when it steals your soul. #debates #debatenight #sniffofdeath,1474941055598,780585479716626432,0
29,alesiabmartin,"""LawAndOrder"" in Ohio 2 where #heroin epidemic is happening.NewHampshire, Utah. What about those bad places &amp; #drug areas #Donald #debates",1474941055724,780585480245174274,0
30,alexvogel14,Respect is a 2way street #Clinton  between police and the community  #debates,1474941055671,780585480022847488,1
31,CurtisKFOX_CBS,There you are Lester ! 👏🏼👏🏼 #debates,1474941055731,780585480274321409,1
32,dreday1215,No joke man. Trump just doesn't get it. #debates https://t.co/MR3aBjuRwx,1474941055694,780585480119160832,2
33,OhYouMad_Tho,How to gone have good community relation when cops gunning down the community #Debates,1474941055709,780585480182177792,2
34,sweetsallysue,#debates2016 #debates platitudes Trump.  Ya gotta do better than that,1474941055694,780585480119214080,0
35,Sal_Natale,#Debates RIP,1474941055712,780585480194822144,1
36,iAm_IsaiahBurns,Stop &amp; Frisk? Yeah Police Already Do That Based On Racial Profiling #debates,1474941055786,780585480505139201,1
37,reaIDonaldTrup,"""We need law and order"" #debates #debatenight",1474941055771,780585480442277888,2
38,aekaitz,Since when does the president control city legislation in Chicago!!!?? #debates,1474941055718,780585480219951109,1
39,LIVEFORLLC,"It's called BIASED, not ""He was against very police Judge"" #Debates",1474941055818,780585480639291392,1
40,MadVeganChef,Word https://t.co/3FgQrwNnGh,1474941055715,780585480207339520,1
41,mrsdavie80,LESTER WE NEED LAW AND ORDER  #Debates,1474941056616,780585483986317313,2
42,akaWallace,So crazy to look out the window at neighboring apartment buildings and see the same image on every TV screen. #debates #debatenight,1474941056564,780585483768168450,1
43,petevanliere,Watch out for those gangs? #really? #debates Get outta town racist little hand guy.,1474941056681,780585484258938883,1
44,drmom20,These are bad people#You need stop and frisk#chicago#donaldtrump #debates,1474941056509,780585483537645569,1
45,cplouis,Bad things. Bad things. Bad things. Meanwhile ..Lester stays quiet.  #debates,1474941056667,780585484200271872,1
46,ajoyfulnoiz,If only he saw it that way https://t.co/bLy6EC13lF,1474941056625,780585484024213504,1
47,YoungNobler,"The more flustered Donald Trump gets, the more he slips into his Woody Allen impression. #debatenight #debates #Debates2016",1474941056501,780585483504156672,0
48,MagickTheMenace,Glad @realDonaldTrump stupidity is being broadcasted no edits  #Debates,1474941056694,780585484313432065,1
49,ValMapAck,"Stein: we need policing of Wall St., but enforcement ended. Immigrants are statistically less likely to commit crime. #debates #JillStein",1474941056699,780585484334534656,1
50,DPikesWorld,"And of course, the obligatory mention of his investments in Chicago. #debates",1474941056717,780585484409905152,0
51,fishgirl27,"I believe Trump just said he wants to take away our guns!!! That doesn't help your ""stop &amp; frisk"" RACISM! #debates",1474941056617,780585483990659072,1
52,HondoGratten,Just give Donald a shovel those hands are getting scruffed up digging his hole.  #Debates,1474941056659,780585484166627329,1
53,TiffanyTononi,I'm not ready for a loud breathing president. #sorrynotsorry #debates,1474941056817,780585484829405184,1
54,dbxfulldead,#Debates le vocabulaire de trump est tellement limité et ses chiffres tellement peu precis et rarement dis clairement 0_0un enfant de 5 ans,1474941056643,780585484099649536,0
55,AlexisIsAwkward,Thank You! https://t.co/sNIhacuH3V,1474941056714,780585484397453313,1
56,NoahJest,"Trump is very worried about his property... Fuck off
#Debates2016 
#debatenight 
#debates",1474941056720,780585484422639617,0
57,L_Santonas,A very against police judge...hahaha! Our nominee ladies and gentleman. Words hard. #debates,1474941056743,780585484519141376,1
58,DJDoubleH,LOUDER FOR THE PEOPLE IN THE BACK #debatenight #Debates #Debates2016 https://t.co/ejE2YhW8BK,1474941057614,780585488172195844,1
59,luckyturner,"“We need law and order in the inner cities!”
#debates",1474941057711,780585488579108865,2
60,VENUSPrincess_,He literally avoided the question #Debates,1474941057659,780585488361152512,1
61,mecrum522_m,Why is he sniffing so much? #Debates,1474941057647,780585488310730752,0
62,TazhiLuxe,"If this asshole brings up his properties in ""inner cities"" one more time, I might tear my hair out. #debates",1474941057672,780585488415588352,1
63,Gateskp,"""It's terrible! I have property there in Chicago!""
Is this entire debate ""Trump business geography""?
#debates #debatenight #Debates2016",1474941057524,780585487794900992,0
64,JuellaB,"""it went before a judge who was a very against police judge."" 5 y.o. have better vocabulary. #debates #debatenight #Debates2016 #TYTLive",1474941057590,780585488071663617,1
65,attack_yak,Trump's that comedian that just says anything until the crowd responds #Debates,1474941057745,780585488721641472,0
66,VMcVoterface,How did this happen? #debates,1474941057615,780585488176455680,1
67,CapulongJo,I just told @nbcwashington who I think is winning. Cast your vote now! #Debates #NBC4DC https://t.co/l1pYGXZGpH,1474941057697,780585488520323072,2
68,Sh00kaL00k,Such a lame response https://t.co/h14Lkqs3sM,1474941057581,780585488033968128,1
69,katiesueruth,😂👏🏼👏🏼👏🏼 https://t.co/zE1E8uHq0x,1474941057679,780585488444821504,1
70,hurgling,"Trump keeps crowing about the crime rate, but isn't the crime rate way down? #debates",1474941057584,780585488046518272,1
71,lenaglad4,What? Only African American and Hispanic people are bad and killing people? #debates,1474941057746,780585488725966848,1
72,Mario_Vash,Trump: Debemos traer de regreso Law and Order #Debates 😂 https://t.co/Z6dNoJBzJR,1474941057729,780585488654610432,2
73,StephBLively,Get her Trump!! Hillary had her chance &amp; has done hardly anything to help this country!! Plus she's corrupt!! #Debates,1474941057681,780585488453369856,0
74,victoriaagram,YAS LESTER DRAG HIM! STOP AND FRISKS WERE RULED UNCONSTITUTIONAL #debates,1474941057751,780585488747036672,1
75,grlong85,👏👏👏👏👏👏 https://t.co/xcyXiWafdC,1474941057660,780585488365199361,1
76,jenjenjake,#debates Just take guns away from bad people... problem solved. 🤔 just that easy... Really!?,1474941057824,780585489053028354,0
77,rgatanis,Is he just naming cities he knows in the US and his favorite crime show? #Debates,1474941057755,780585488763629568,0
78,GoldingGirl617,So it's only terrible in Chicago because you have property there? #Debates,1474941057776,780585488851865600,0
79,PowellyPowell,Question about race = Drumpf talking about Law and order and Stop and Frisk #no #Debates,1474941057790,780585488910548992,2
80,IeyIaa_,"blame the police, victims did nothing wrong  #debates",1474941058677,780585492630806528,1
81,EnzoBrill,HAHAHAHAHA supot 1% trillanes style amf https://t.co/WzKGpWZJ9I,1474941058620,780585492391743488,1
82,adamput,very against police judges are the worst. #debates,1474941058631,780585492437839872,1
83,WorkoutLilJoe,Trump is pretty much saying we should racially profile to make our country safer.  #Debates,1474941058680,780585492643393539,0
84,lee12177,There he goes again with the bigotry  #debates,1474941058610,780585492349878272,1
85,AdviceIShouldHa,"things Trump is not big on: the constitution, rights, facts

#debatenight  #debates #Debates2016",1474941058390,780585491427188737,0
86,knightcali,"Racial tension
vs.
Investment
$Trump #debatenight #debates #USPresidentialDebate",1474941058724,780585492827865088,0
87,tatiannalyla14,"Trump says Clinton doesn't want to use the words ""law and order."" He continues, ""We need law and order in our country."" #debates",1474941058717,780585492798726144,2
88,leahloves26,"@therealdonald_  ""no, your wrong"" @HillaryClinton #debatenight #debates #debate",1474941058639,780585492471578624,1
89,TheGlamLyfeBby,#Debates,1474941058680,780585492643545089,1
90,CameronTheLion,Way to swap party colors in fashion attire... #debates,1474941058467,780585491749941248,1
91,TheBookOf_A,Stop and frisk?! Stop frisking your daughter @realDonaldTrump ! #debates https://t.co/Cvom5pReuP,1474941058581,780585492228169729,1
92,ThomasMonbergSF,"Og det er klassisk for Trump, siger en masse ord uden at sige noget som helst. Men det virker på de statstrætte… https://t.co/sKzKLnpSGv",1474941058603,780585492320518144,1
93,SincerelyUrs216,"&amp; speak TF UP Lester , stop letting them OVER talk you #Debates",1474941058696,780585492710555649,1
94,Aujanae_Bby794,"""THESE ARE BAD PEOPLE."" Stop and frisk is unconstitutional. #debates",1474941058757,780585492966408196,1
95,gottosayit,#debates I hate to say this but trump is taking her lunch money.....,1474941058722,780585492819480576,1
96,DeitschFactor,"#Debates ""You're wrong. The judge is dumb and I am smart."" - @realDonaldTrump",1474941058755,780585492958023680,1
97,sarahtvrussell,Trump feels bad about race relations in Chicago bc he has properties there...  #Debates,1474941058862,780585493406765056,0
98,Bowtothe__Queen,He's talking about five police officers being killed but not the hundreds of black lives lost to the police. #debates,1474941058689,780585492681101312,1
99,TrumpVolume,Lets make the Clintons #BrokeAgain ~  Join https://t.co/Mj7KqKE0ac https://t.co/ot9gusglng,1474941059617,780585496573468672,1
100,outsiders4lyfe,You can't use 2 cities out of the whole country to group all the African American cities in the country #Debates,1474941059555,780585496313470976,1
101,LngHairThkRdBn,WOOOOOW!!!!! This Moderator SUCKS!  Cut his mic OFF! #Debates stop letting him talk over people,1474941059679,780585496833564674,1
102,StillBernin,"America, you're getting a police state no matter what you do. #debatenight #debates #Debates2016",1474941059692,780585496887963648,1
103,ambrs_,Also I think he has the flu. Tissues to the dais pronto! #debates,1474941059729,780585497043177473,1
104,FuntyLove,Hilary low-key looks like Trump is putting her to sleep 😂😂😂 #Debates2016 #debatenight #Debates #Trump #Clinton #MortalKombat,1474941059705,780585496942698496,0
105,garpo3000,Donald Trump does not own any property within a 30 minute limousine drive of where young African American men are shot in Chicago #Debates,1474941059601,780585496506462209,0
106,MissMarciaC,I thought Trump had the best words? But he just keeps repeating the same shit. #debates,1474941059722,780585497014009856,2
107,RhinoUp,We need stop &amp; frisk because Trump's property taxes are at stake. #Debates,1474941059656,780585496737046528,0
108,Detroitthought,Please hear this. We SHOULD PROFILE WE SHOULD STOP AND FRISK. THIS IS A PRESIDENTIAL CANDIDATE SAYING THIS  #Debates,1474941059555,780585496313524224,1
109,lizurds,I'm dead inside #debates,1474941059727,780585497034981376,1
110,josephesr,Stop him now please #Debates,1474941059705,780585496942706689,1
111,dsholes,Trump is an idiot.  #Debates,1474941059674,780585496812617729,0
112,themaryfetts,#Debates 1000 shootings in Chicago one minute and then 3000 shootings another??? Truth??,1474941059766,780585497198403584,0
113,kerryknerr,"Did he just say ""take away people's guns?"" Like multiple times? #debates",1474941059737,780585497076707329,1
114,McDeeSweet,Off topic but WHYNOT? Is it me or is @realDonaldTrump sniffing a lot ?  #debates,1474941059832,780585497475375104,1
115,tatiannalyla14,"""Stop and frisk was ruled unconstitutional in New York,"" Lester Holt says. ""No, you're wrong."" Donald Trump responds. #debatenight #debates",1474941059802,780585497349525510,1
116,theRachelWoods,"There we go, finally those illegal immigrants in...ugh  #debatenight #debates #Debates2016 #DonaldTrump #HillaryClinton",1474941059867,780585497621991426,1
117,xx_nixie_xx,PREACH IT OMG https://t.co/L53nSpfPKM,1474941059858,780585497584283649,1
118,AndrewWamugi,Please tell me @TheDailyShow is live after this debate. I can't wait for @nbcsnl on Saturday or @LastWeekTonight on Sunday. #debates #comedy,1474941059784,780585497273839616,1
119,LettingItHang,"How you gonna argue a fact!  That law was, in fact, ruled unconstitutional!  #debates #debatenight",1474941060692,780585501082341376,1
120,_sofisss,Hahaha https://t.co/KhKDUiUCCB,1474941060412,780585499908042752,1
121,BruceHore,"Man, anyone else missing the Leader's Worm? #debates",1474941060647,780585500893601792,1
122,No1PittSports,I just told @nbcwashington who I think is winning. Cast your vote now! #Debates #NBC4DC https://t.co/m2Lfd6TZB6,1474941060691,780585501078192128,2
123,jtlaliberte,Lester has left the building! #Debates,1474941060361,780585499694100481,1
124,KatieMacR,"""you have to have stop and frisk"" ITS UNCONSTITUTIONAL you halfwit!!!! #Debates",1474941060633,780585500834926592,1
125,CBarcaQC,Not even Donald has any idea what he's saying. #debates,1474941060673,780585501002727425,0
126,PhillyFan1221,Huh? https://t.co/38S4LNHz2W,1474941060405,780585499878645760,1
127,_GoldenGuh,"Let's talk about these piss poor ass schools, let's talk about redlining, let's talk about lead poisoning in black neighborhoods. #debates",1474941060765,780585501388443649,1
128,TWill876,"Ohhhhhhhhhh so because u have property ah Chicago....thats why it so very bad there Donald.
Ohhhhhhhh cause your property affected #Debates",1474941060794,780585501510164481,0
129,MinecraftGeek35,Blink blink blink blink blink blink blink blink blink blink blink blink blink blink blink #debates,1474941060739,780585501279518720,0
130,KristinaMpage,Wow he has bumped his head! https://t.co/sZCQ3WS9Aa,1474941060562,780585500537188352,1
131,thisisoutspeak,Lester Holt make sure the point is made. Stop and frisk is racist. #debates #debates2016 #debatenight,1474941060768,780585501401223170,1
132,wdsu,".@realDonaldTrump: ""You have to have stop and frisk."" #debates https://t.co/hTPeSWIyJA",1474941060815,780585501598199808,1
133,funnyordie,"""Stop and frisk worked in New York. Kristallnacht worked in Germany."" - Trump #debates",1474941060872,780585501837316097,1
134,lindsaystidham,"I don't want a police state, I want gun control. Please let HRC speak! @LesterHoltNBC #Debates",1474941060840,780585501703057408,1
135,thatsme_vinay,"Mr. Trump stop saying LAW and ORDER again and again, you may wanna look what exactly that means!!! #Debates",1474941060795,780585501514313728,2
136,rcgooding,#LetGaryDebate https://t.co/j3a4JdtFox,1474941061516,780585504538439681,1
137,uzodollars14,"And btw, Chicago has always been under a democratic leadership, Mayor Rahm Emanuel the former chief of staff for Obama is a failure #debates",1474941061682,780585505234628608,1
138,humadawha,"Rest In Peace , Trump #debatenight #debate #debates #Debates2016 https://t.co/I5B06Al8zK",1474941061291,780585503594721280,0
139,bsinghK,"Donny can't even finish a fucking sentence, I can't believe HRC can keep her composure. #debatenight #debates #Debates2016",1474941061456,780585504286896128,0
140,eitaksnevib,"SAY LAW &amp; ORDER ONE MORE FUCKING TIME, DONALD #debates",1474941061118,780585502869250048,2
141,gucciandadidass,let's solve race related problems by using a plan that racial profiles people #debates,1474941061679,780585505222045696,0
142,ylansegal,"He said: ""we have to take away the guns for these people"". These people? Is the NRA cool with taking guns away? #Debates",1474941061432,780585504186085376,1
143,CarmelinaHart,Judge Rejects New York’s Stop-and-Frisk Policy - https://t.co/ZewpuPzRep #debates  https://t.co/DRY11iL0CP,1474941060957,780585502193823744,1
144,JustLikeMercury,All this #debatenight is doing is affirming that @realDonaldTrump is a flaming hot cheeto w/ an asshole for a mouth. #debates #Debates2016,1474941061718,780585505385701376,0
145,Adonnis,Stop and frisk is unconstitutional because is a violation of your rights. Both universal rights and 4th amendment rights #debates,1474941061715,780585505373065216,1
146,woyciesjes,Did Trump actually admit that he agrees with Hillary on something?? :D #Debates,1474941061500,780585504471408642,1
147,Scicopath13,#Debates These are people that are baaaaaaaaaaaaaad people- @realDonaldTrump I spoke more eloquently in 5th grade.,1474941061508,780585504504844288,1
148,trblheaux,"""These are BAD people"" #debates https://t.co/5XVNcq9Svi",1474941061556,780585504706326528,1
149,moyleang21,Stop telling me about your investments and property. TELL ME HOW YOU'RE GOING TO MAKE THIS COUNTRY BETTER #Debates,1474941061655,780585505121447937,0
150,Leko_Suave,He sounds stupid omg he needs to be stopped  #debates,1474941061430,780585504177811458,1
151,openib,"@realDonaldTrump imploding,  sounds like a rambling idiot. Hasn't answered a single question. #debates",1474941061724,780585505410850816,1
152,ElyseSunnyday,How are you going to fix the divide between cops and the community? #debatenight #debates #debate2016 https://t.co/VVpbgzMHUA,1474941061276,780585503531868161,1
153,Mr_DePHInition,"How Donald yall mans but he doesn't know that ""stop and frisk is unconstitutional #Debates https://t.co/UJPfoWlwyY",1474941061228,780585503330603008,1
154,parkersJoking,Donald don't tell a guy that has a stack of papers with facts written on them that he's wrong #debates #debatenight,1474941061840,780585505897361408,1
155,sarahdistortion,Have you guys ever heard someone so stupid? Seriously. #debates,1474941062676,780585509403840512,1
156,THE_Evan_Stone,Did Trump really just bring up 'stop and frisk'??? #debates,1474941062687,780585509449928704,0
157,ThatguyPoyraz,They have guns and they shoot people #debates #PresidentialDebate,1474941062547,780585508862824448,1
158,ddiannashen,he's not even on topic? the question was about police brutality &amp; race. #Debates,1474941062708,780585509538045952,1
159,indiawestcanad1,#Debates D Bought Real Estate with High Crime Areas ? Future Investments,1474941062749,780585509709946881,0
160,BMehee,"""I have property in Chicago""...I can see inequality from my house #Debates",1474941062686,780585509445898240,0
161,ranote_aman,Bad people have guns and they shoot the police. Bruh !! #Debates,1474941062702,780585509512998912,1
162,simonladesma,Stop and Frisk. Yay...?!? #Debates,1474941062738,780585509663940608,1
163,xOctobersOwn_,!!!! https://t.co/GUBt40icpq,1474941062703,780585509517090816,1
164,yoelapalkin,This is so frustrating. The future of #America depends on two volatile emotional &amp; dishonest creatures. #debates,1474941062797,780585509911265280,1
165,AbsoluteAbsol,You haven't even talked about race. You've just brought up gun violence. #Debates,1474941062658,780585509328449537,1
166,ashalaia,No one cares you have fucking property #Debates,1474941062737,780585509659836418,0
167,JazAndrea23,So so sad. #Debates https://t.co/e9bwCEsUdJ,1474941062667,780585509366136836,1
168,ThatsJustBogus,"Trump sounds like an ignorant, blubbering fool. Dang GOP, how could you let this happen? #debatenight #debates",1474941062736,780585509655543808,0
169,ShunShine13,"""Stop and frisk""   is basically another form of racial profiling! Is he stupid or what? Then he tell Lester Holt, he's wrong... wth #debates",1474941062750,780585509714292738,1
170,nachow,"Y elige Chicago, la ciudad con la comunidad de negros más flaite de USA. Classic. #debates",1474941062247,780585507604557825,1
171,Chazboski,"He's literally saying something that was found to be unconstitutional in 2013 was not only legally ok, but perfect and not racial.

#debates",1474941062827,780585510037184512,1
172,liberalvixen,"Trump has property that needs to be protected, everyone. So your sons and husbands can go screw. #debatenight #debates #Debates2016",1474941062740,780585509672189952,0
173,CromerZome,"All your racist uncles are on facebook right now like ""Yes, Chicago, he has a point"" #debates",1474941062419,780585508325982209,1
174,zachhaller,"Think either candidate will say ""#BlackLivesMatter""? #debates #debatenight",1474941063683,780585513627496450,1
175,SpontaniousRAWR,Slitting my wrists watching The Presidential Debate. #killme #theoblywayout #orcanada #debates,1474941063672,780585513581367297,1
176,Havanavo,'It's terrible in Chicago. I have property there.' #Trump in a nutshell. #debatenight #debates,1474941063555,780585513090707456,0
177,swaveymari,I swear Trump thinks he's making sense but he really isn't  #Debates,1474941063619,780585513359028224,0
178,AndyOwens85,"""Stop-and-frisk was rendered unconstitutional."" ""No, you're wrong..."" #debates",1474941063703,780585513711460353,1
179,MacaCorvalanS,Trump no se ahogara con tanto estuco? #Debates,1474941063661,780585513535344640,1
180,lindsay_london,Sometimes it seems like he doesn't have all the best words. #debatenight https://t.co/yIsu6RRErm,1474941063628,780585513396817921,2
181,margschow,take a sip of water lol #debates,1474941063700,780585513698914304,1
182,LiaSimcina,trump is like the idiot who doesn't know wtf they are talking about and don't have a social queue when to stfu #debates,1474941063666,780585513556279296,2
183,ZoltanCOMEDY,Sounds likes Trump's major goal in becoming president is protecting his property in major cities @LaughsTVShow #Debates,1474941063015,780585510825713664,0
184,libelousliberal,#debates so remind me of trump's constitutional credentials?,1474941063794,780585514093187072,2
185,watsupmyepeeps,@realDonaldTrump #debates https://t.co/KgouF4KS1U,1474941064399,780585516630540289,1
186,DiannaVeloz,lmao why is this man still talking 🤔😂 #debates,1474941064641,780585517645725696,1
187,crgonzalez,Note to Trump: Stop &amp; frisk undermines community relationships. #Debates,1474941064728,780585518010466306,1
188,tonynearydesign,I feel sick right now. Please stop talking  #debates,1474941064576,780585517373087744,1
189,Heff8281,Immigration is infiltration @realDonaldTrump #Debates,1474941064666,780585517750583296,1
