,geo,screen_name,text,tweet_id,cluster_pred
256,,ARnews1936,".@HlLLARYCLINT0N: ""I deserve some #Emmys

 https://t.co/VD8FZlam6M""",777698615883993089,0
257,,WinglessDreamy,"Winter is coming! Game of Thrones is my choice for best drama series in @CoxComm's #Emmys poll!
https://t.co/VIOhUxaugU",777698615800233984,0
258,,MysticMerGirl,#Emmys @LievSchreiber C'Mon #BestActor @Showtime @RayDonovan_SHO,777698615921930241,0
259,,yanalukina,Kerry Washington in Brandon Maxwell @ the 68th Annual Primetime Emmy Awards #Emmys https://t.co/DOeSemKFLk,777698612553850880,0
260,,RussellFalcon,In memoriam: Jimmy Kimmel #Emmys,777698616290926593,0
261,,clapifyoulikeme,Okay @TheAmericansFX fans let's get ready for another disappointment! We're good at this by now! #Emmys,777698616538456069,0
262,,mai_tai25,IT'S RAMI'S TIME (ain't never watched an ep of Mr. Robot but i'm rooting for my egyptian zaddy) #Emmys,777698616454545409,1
263,,scrapbook_gal75,"YES! The Marcia, Marcia, Marcia episode of #PeoplevsOJSimpson won! #Emmys",777698616819404800,0
264,,SoyUnMachoAlfa,"Rami Rami Rami Rami!!!!!! 

#Emmys",777698616806748160,1
265,,afterbuzztv,"Which shows, actors, actresses, etc. have YOU been rooting for during this year's #Emmys?",777698616706072576,0
266,,ericamarkunas,aiaaiaiaia é agoraaaa #Emmys,777698616773337088,0
267,,starxgaryen,primeira vez que acompanho o emmy e nenhum ator de got ganha #Emmys,777698617150898178,0
268,,carina_castro,ENTREGA LOGO ESSE PRÊMIO PRA TATIANA PELO AMOR DE DEUS #Emmys #EmmyForMaslany,777698618031636480,0
269,,MILTANP,"mashable : Hillary Clinton is a fan of Kate McKinnon, just like you. … https://t.co/lpag26yGR5) https://t.co/ca4oRPtP9H",777698616827838464,0
270,,ramirezbsofi,"Como es que el cast de Game Of Throne no ha ganado ni un solo premio estoy realmente indignada 
#Emmys !!",777698620506271745,0
271,,MovieManiac89,I'm just gonna leave this here for you @T_Kennedy9 https://t.co/FfmW0vUrGJ,777698620258738176,0
272,,spearsbreathe,BOB BOB BOB BOB PLEASE #Emmys,777698620409864192,0
273,,chene_95,Pero quien creen que actua en #GoT #GameofThrones TÍTERES ??? #Emmys2016 #Emmys #EmmysPorWarner https://t.co/3wufV2lX7A,777698620086689793,0
274,,PurpleGMag,#BlackLoveIsBeautiful #Emmys 💜 https://t.co/xQ9NuAXCTa,777698620082688000,0
275,,Tristanrock55,If  Rami Malek don't win the #Emmys I riot,777698621751828480,1
276,,BJGEsq,I love me some Liev Shreiber idc idc idc #emmys,777698621487710208,0
277,,alejandroxsoto,Rami Malek please... #Emmys,777698621785374720,1
278,,h2Mn_i,باقي بس يفوز رامي وتكمل السهره #Emmys .,777698621483520000,0
279,,Toooshie,"And in the darkness of the world, we need only look to @AllisonBJanney to see the light. #Emmys",777698621869453312,0
280,,Yoongi2handsome,"Winter is coming! Game of Thrones is my choice for best drama series in @CoxComm's #Emmys poll!
https://t.co/bDPHVjxEc4",777698621668163584,0
281,,rshuffandstuff,We should all strive to look as good as Allison Janney does on the stage tonight. #Emmys,777698622079115264,0
282,,luisffd,ai que nervoso menina #EmmyForMaslany #Emmys,777698622498627584,0
283,,itAllNeverEnds,Ñ importa quanto tempo passe eu vou chorar sempre q ver algo assim #always my hero #emmys https://t.co/UQdfNFgVfh,777698623400374272,0
284,,misskubelik,Soooo why do we get to see clips of the drama acting but not the comedy? Comedic acting counts too! #Emmys,777698624520073216,0
285,,newt_ripley,I ❤️ Bob Odenkirk so much. #Emmys,777698624675336193,0
286,,ThamiiSweet,💔 https://t.co/dfNuwl2vdZ,777698624608333824,0
287,,lovelyleann,Oh! I forgot about #MrRobot. I watched like the first 5 episodes this season and then...?? Better catch up. #Emmys,777698624910139392,0
288,,BiboEnVivo,"#GameofThrones comes to an end and @IAMLenaHeadey does not have Emmy. 
#Emmys 
#Emmys2016",777698625098883072,0
289,,DeaditeWheatley,We all know Rami Malek is gonna win but I kinda want to see Bob Odenkirk snatch it. #Emmys,777698625623392258,1
290,,planetaemocion,Obviiiiiiooo https://t.co/2wPLAmc3TE,777698625795137536,0
291,,amandalouzadaf,adorooooo #Emmys,777698625753341952,0
292,,alicegiusti,E voi vi aspettavate #MaggieSmith a un'americanata come gli Emmy? 😂😜  Ti si ama comunque Maggie. ❤️ #Emmys https://t.co/CwIJfwQUOe,777698624000106496,0
293,,vinaytion,"Wow, they're presenting the Emmy's out of order this year. I'm excited! #Emmys",777698626134913024,0
294,,Shop_OwnerMark,"mashable: Hillary Clinton is a fan of Kate McKinnon, just like you. https://t.co/54RgVSS2KW #Emmys https://t.co/8AneThbe3C",777698625258479616,0
295,,Daniela__Rock,"Bob or rami &lt;3.
#Emmys",777698625996492800,1
296,,Bonkaiasf,If Rami don't win imma cry #Emmys2016 #Emmys,777698626047016965,1
297,,nivia_,Bob Odenkirk é genial #Emmys,777698626139291648,0
298,,EukaryotaCell,Rami Malek por favor #Emmys,777698625292034048,1
299,,IsadoraCgn,Meu boo Rami tem que ganhar #Emmys,777698626701230080,1
300,,thinnchrispy,Still hard to believe Snape is no more.. #Emmys https://t.co/6ixVtg33ZW,777698625518383104,0
301,,Killian666_,"L'UNICO VERAMENTE VALEVOLE QUI È RAMI, LO SAPETE
VERO?

NON FATE CAZZATE #Emmys",777698628987084800,0
302,,parthona98,"ValaAfshar : Impossible is not a fact. Impossible is nothing.

—MuhammadAli dodges 21 punc… https://t.co/6hoMpMxLEh) https://t.co/2tYigeJGJE",777698628223832064,0
303,,gomesdudis,"mas amo kyle chandler, não reclamaria se ele ganhasse #Emmys",777698628664188928,0
304,,janaine,Nem estou torcendo para seu ninguém para estar acompanhando o #Emmys. Mas vamos ficando por aqui mesmo.,777698629217812480,0
305,,JULYADBX,Meu Zé droguinha tem que ganhar!!!! #Emmys https://t.co/GiMeuuPs3s,777698628651585536,0
306,,EverettMartin,"@AliceInChains Oh! It was @AllisonBJanney! I mean, that's cool, too. You can rock out, right, Allison? #Emmys2016 #emmys",777698629154922497,0
307,,gzmaydnart28,Oha lan Kit ödülü alamadı! Ben sizin adaletinizi şey edeyim! Lan sırf o sahne için Oscar bile verilir ya!! Yaşasın Ulukurtlar!! 🐺🐺 #Emmys,777698629737906176,0
308,,MarseUC,Denle el premio a todos. Todos lo merecen maldita sea #Emmys,777698629922463745,0
309,,ChenoaCoviare,Top 10 best dressed for sure! https://t.co/fvQZPr4coH,777698630274646016,0
310,,ludominici,Sorry but Rami Rami Rami 🙏🏻🙏🏻🙏🏻🙏🏻 #Emmys,777698629964468225,1
311,,SodaJones17,@LeBatardShow John Travolta looks like the guy who had plastic surgery done to look like John Travolta. #Emmys2016 #Emmys #travolta,777698630878711808,0
312,,LucaIdek,"Formation alone should have won that directing award #emmys
https://t.co/VWEKOjQii2",777698630312534016,0
313,,lanie_devine,@errowo https://t.co/Er1VORKXHC,777698630903947264,0
314,,sonnysgal4life,Wooooooo!!!! Yes lord!!!! @Bloodline 👏 https://t.co/BsF6BsNX1E,777698630379638784,0
315,,nostressmaine,muito merecido aaaaaaa https://t.co/DDyiub0qjN,777698631088533504,0
316,,karynaharleik,"No Peter Dinklage...that sucks!! It's my fav! 😥😣
#GameofThrones #Emmys https://t.co/V7lyFGTnts",777698632808013824,0
317,,andrewbenkovic,Those PB&amp;J sandwiches is the most carbs some of these celebs have had all month. #Emmys,777698633164722180,0
318,,106th,is the guy from this #Bloodline show the same guy from that show about the dude who got the newspaper daily that told the future? #Emmys,777698633311514624,0
319,,cindyarroba,Rooting for @whoismrrobot #RamiMalek #Emmys #Emmys2016 #EmmysPorWarner,777698633412206592,0
320,,alzfinds,#Emmys https://t.co/rz63mJ0y2M,777698632883580928,0
321,,AsToldByDej,Romi Malek looks like Inspector Gadget #Emmys,777698633663729664,0
322,,gnzalomartin,Ray Donovan 👍💪🏆 #Emmys,777698633693159424,0
323,,cabelllofire,EU QUERO A TATIANA #Emmys,777698633923850240,1
324,,rogerdelegado,"SE O KEVIN SPACEY NÃO GANHAR EU DESISTO DE VIVER.
#Emmys #EmmyNaWarner",777698634213318656,0
325,,PaleDragonCbus,Why are only the lead drama acting nominees getting clips? All actors should get this #Emmys,777698633961476097,0
326,,chescaleigh,bae #Emmys https://t.co/E0C4cdA7Xo,777698633613443072,0
327,,Cassandra2174,EMMY FOR RAMI!!!!!!!! #Emmys,777698634498400256,1
328,,spnwx,kkkkkkkkjjkk https://t.co/g6eTLAybWi,777698636394299393,0
329,,in_consistent,twenty one pilots fans will understand https://t.co/OUTjwS8qgV,777698637606420480,0
330,,tastedcyrus,SO MILEY HAS NOW AN OSCAR AND AND EMMY. WHEN WILL YOUR FAVE EVER? 👑 #Emmys,777698637795164160,0
331,,futnuckings,HAWAK KAMAY NA TAYONG LAHAT AT MAGDASAL FOR BEBE GIRL TATIANA #EmmyForMaslany #Emmys,777698638180909056,0
332,"[-23.40963344, -142.29016686]",recentideas,BITCH I SHUT DOWN THE STREET TO—I CAN'T SLEEP RT—HE'S A BITCH MEET ME HERE I COME HOME FOR A DRAMA SERIES MORE WINNERS HERE #EMMYS—LOVE LOVE,777698638281646081,0
333,,GabydeLaGuardia,Indeed https://t.co/e9AMLyI972,777698638046765056,0
334,,jhesandys,Vai Mr Robot vai que é tua #Emmys,777698638663417856,1
335,,_Kokoa,RAMI IS MY BABY #Emmys,777698638692753408,1
336,,gabrielealves_,óbvio que o carinha de mr robot ganha #Emmys,777698638734712832,0
337,,ivannadrpic,RAY DONOVAN EVEN THO THIS SEASON IS SLIPPIN #Emmys,777698639149838337,0
338,,aelmacioglu,"Better Call Saul is my choice for best drama series in @CoxComm's #Emmys poll!
https://t.co/BaG08yN2Al",777698638596304897,0
339,,VaroTOON,"Better Call Saúl...

#Emmys",777698639095267328,0
340,,peajai,Jimmy Kimmel's jokes are the worst thing that has happened on this show. #Emmys,777698639414165506,0
341,,geistertraumer,sì ma nella stessa categoria c'è anche Kevin io voglio che vincano entrambi che vita di merda #Emmys,777698639716179968,0
342,,marisolcitag,Matt Damon Revenge!!!! 😂😂😂 #Emmys #Emmys2016 https://t.co/y9FVOTEjsg,777698639502278657,0
343,,heybeccamarques,"amoooo o Bob Odenkirk, mas não tomo fé. #Emmys",777698640248856576,0
344,,gyroEMILYfeta,COME ON RAMI!!! #Emmys https://t.co/knNe6xdt4t,777698639569424384,1
345,,eu_maah_,prox semana tem How to Get Away with Murder #Emmys &lt;3,777698640659873792,0
346,,queenbeIIisario,a felicity huffman ganhou? ALGUEM ME AJUDA Q EU CHEGUEI EM CASA AGR SOCORRO kajsakjs #Emmys,777698641314217984,0
347,,larryzinha_2015,Onde tá passando ? E #Emmys,777698641322598400,0
348,,25shadesoffeb,Let Rami win #Emmys,777698641553321984,1
349,,AJornaleira,É AGR Q O #RAMIMALEK GANHA! #EMMYS,777698641813336064,0
350,,arthurows,"Parece que sim, e conseguiram!! https://t.co/DbN2JDuJba",777698641817534465,0
351,,TheDanBarrett,Would be great if this was Coach Taylor's year! #Emmys,777698642433970177,0
352,,jlwtcher,"""não vejo nada de mais em game of thrones, nem é tudo isso que falam""
#Emmys https://t.co/CpDfZ8yX0f",777698640827645952,0
353,,VioletaGarcia96,Ayyy no aguanto más! Ya ya ya quiero la séptima temporada https://t.co/QKZ8IohA3H,777698642048192512,0
354,,lisalisetta3,I just realized that the Emmys are on. #Emmys #abc #LievSchreiber #RayDonovan #bettercallsaul #bloodlines,777698642350247936,0
355,,WubsNet,There are SO MANY great TV shows on now. #Emmys Seriously. SO. Many Great. Ones,777698642874556416,0
356,,SharSaysSo,I like Allison Janey. #emmys,777698642677276673,0
357,,Fhaid,I have a feeling Rami will get this. #emmys,777698644002758656,1
358,,BeckyASparks1,"I think the #NutrishDog was dressed to impress at the #Emmys
https://t.co/LIb4OMv43H",777698644262805506,0
359,,DavidUrban54,"I now officially, unquestionably, without reservation, hate that offensive, snarky, lame #Emmys host.",777698645000851456,0
360,,Feldaniel,Vamos #RamiMalek #MrRobot #Emmys,777698645378473985,0
361,,amdeeeeeee,Rami better win #Emmys,777698645294579712,1
362,,trapsoulomon,An incredible spirit ✌💚 https://t.co/qCMDvBfo5Q,777698645089128448,0
363,,VicuRuiz,👏👏👏 https://t.co/NL0HLTtz9C,777698645240152064,0
364,,WriterNamedNG,"Remember, Beyonce got that #Emmys nod for #Lemonade https://t.co/m4ucRBitGo Will her cup runneth over? #Emmys2016 https://t.co/o21QnQUpMV",777698644506120192,0
365,,dissealgo,Tentei não criar expectativa pq sempre sou tombada mas não deu certo já estou aqui esperando o discurso da Tatiana #Emmys,777698645810569217,0
366,,swandaberry,#Emmys@gameofthornes congratulations,777698645739180032,0
367,,JoaoGabrielPL,Go Elliot é seu e nem precisa hacker pra ganhar #Emmys,777698645764349956,0
368,,heylyla_,Vamos Bob!!! #Emmys,777698645827317761,0
369,,MZGunter,This is another tough category. #Emmys,777698646238367744,0
370,,GrahamZielinski,"Watching the #Emmys tonight, so many wonderful actors winning, and also so many wonderful actors lost :'(",777698646066286592,0
371,,CaliforniaFash,ManRepeller: They know nothing. #Emmys https://t.co/M4PSym7Fa9,777698646414487554,0
372,,Miss___MooN,"Tori kelly everyone,,flawlesssssssssssssss #Emmys https://t.co/h8HO4lCS9G",777698646393446400,0
373,,Trevenclaw,"Nice tits, Allison Janney. #Emmys",777698646427131905,0
374,,pamplemoussee76,Give it to Ramy already! #Emmys,777698646603206657,0
375,,IAmHopeMcCollum,Well earned cause that show was hilarious! https://t.co/JmhG6mN9PS,777698646603157504,0
376,,markwonderful,"Ray Donovan, not allowed to watch it. Too Depressing. Mr Robot = homosexual, anti-US meme. #BetterCallSaul AWESOME! KYLE #BLOODLINE #Emmys",777698647303524352,0
377,,anticuchoz,Los #Emmys ya me hicieron extrañar #GoT,777698647534362624,0
378,,MMokren22220,#Emmys https://t.co/hClp262f0n,777698646909448192,0
379,,lizunga,"""Other people make important TV, I make recess.""-Garry Marshall ""Thank you for inviting us into your schoolyard.""- Henry Winkler #Emmys",777698647790260226,0
380,,djolder,Liev has an endearing way about him whatever he does. Saw him play Henry V in Central Park and it was a damn good performance #Emmys,777698649845497858,0
381,,smanak,The #emmys aka the Netflix and chill awards,777698650151460864,0
382,,Ashley_Reynolds,"I'm just going to say this, Kyle Chandler better not win this year (sorry but kind of not sorry). #Emmys",777698650528985088,0
383,,OjosCafeseses,"Es muy difícil ver los #Emmys y #MasterChefMx al mismo tiempo, ya me mareé amixes.",777698650784804864,0
384,,valsadie,They did?!? Missed that... https://t.co/xfkCROvabX,777698649744617472,0
385,,stainedtkellz,I can't believe tori kelly invented the #Emmys,777698650575241221,0
386,,angiep213,Kyle Chandler for all the things. #emmys,777698650185207809,0
387,,ClauuDisaster,"Rami, no importa lo que pase, ese emmy es tuyo #Emmys",777698650709307392,1
388,,sejemenasedu,Rami Malek ou Kevin Spacey #Emmys,777698650533355520,1
389,,MizzyII,Don't know what was more sad #ToriKelly singing Hallelujah or the names that are no more #Emmys2016 https://t.co/dKoRhG4b06,777698650474504192,0
390,,time4myopinion,"this belongs to matthew or rami, lbr #Emmys",777698650902462464,1
391,,CaliforniaFash,FIDM: Key &amp; Peele 👏🏽👏🏽👏🏽👏🏽 #Emmys https://t.co/lWBIlChLuD,777698650772340740,0
392,,iSpencerMiller,Please be Rami. Please be Rami. Please be Rami. #Emmys #Emmys2016,777698651019894784,1
393,,jaburks,"Just helped Jimmy Kimmel prank the 68th #Emmys by delivering over 7,000 PB &amp; J sandwiches! First paid comedy gig! 🙂 https://t.co/jmb6G41tep",777698650306650112,0
394,,MartinaSancehz,"Yo, rezando para que gane Tatiana #Emmys https://t.co/547w81jOwi",777698650575216640,0
395,,AleBattistin26,que parteeeeee https://t.co/Q3s82B29BJ,777698651225350145,0
396,,kellyte13,#EmmysPorWarner adelantémonos y terminemos temprano... Solo de le el #Emmys a #GameofThrones ninguna se le iguala... Con 2 cap 10/10,777698651669798916,0
397,,obrienxvoid,"ESCUTA AQUI, RAMI MERECEEEE #emmys #emmynawarner",777698651716063232,1
398,,RogueGinny,You know those #pbj sandwiches are just going to be wasted - wasting time and food. #Lame #Emmys2016 https://t.co/Xx490HHFly,777698652022120453,0
399,,MisterBrandonM,"I love award show clips, but I don't like how only the lead drama actors get them. It should be either all categories or none, imo. #Emmys",777698654010290176,0
400,,liya_zhu,"Rami Malek, recitami tutta la divina commedia con la tua voce. 

#Rai4 #Emmys",777698654325006336,1
401,,omgchante,I'm missing this????? her voice is so beautiful.  https://t.co/msCQiJUQJV,777698654593294336,0
402,,annaroseiovine,I've literally never heard of Bloodline before tonight. #Emmys,777698654245232640,0
403,,jamiebeth_words,Why do the dramatic male lead actors get clips?!? NO ONE ELSE GOT CLIPS #confused #emmys,777698654530437120,0
404,,pfvrmarino,RAMI MALEK PELO AMOR DE DEUS #Emmys,777698654908014592,1
405,,5wild_77,"ههههههههههههههههههههه ياكثر اللي كانو يحترون جون سنو يفوز 😂

 #Emmys",777698654979231744,0
406,,EduardoNicoleit,VAMO https://t.co/xYwlByeISU,777698654866051072,0
407,,tonjatomblin,"I hope Kimmel didn't write his own and jokes so he has someone to blame. Every time he speaks, I cringe. #Emmys",777698655293673472,0
408,,igorstiloso,"Nesse momento eu queria ser o @HugoGloss, indo de cadeira a cadeira, tirando fotos com todos, af #Emmys",777698655092572161,0
409,,sabrinaobscura,There is one person I want to win and one acceptable runner up should he not be able to accept. #Emmys,777698655499268097,0
410,,moviesharkd,"Joke about topping ""In Memoriam"" next year is soooo inappropriate @jimmykimmel. #Emmys",777698655033626624,0
411,,LifeStories91,Why do they do clips for only one category? #Emmys,777698655822225408,0
412,,allonsyglow,aaaaaa https://t.co/xCvdwuwrMK,777698655625179136,0
413,,MichelleMClarke,Will #Bloodline be the spoiler? #Emmys,777698655197245440,0
414,,CaliforniaFash,FIDM: Hats off to Dame Maggie Smith on winning an Emmy for her role on DowntonAbbey! #Emmys https://t.co/RbK91WTSGa,777698655784624128,0
415,,deusesperfeitos,melhor do mundoooooooooooooo #Emmys https://t.co/YJUNKFikN4,777698655369297920,0
416,,JasonKrump,"Wonderful ""In Memoriam"" tribute by @ToriKelly. 2016 has been a tough year. #Emmys",777698656254177280,0
417,,azuldietetico,Cuando sea grande quiero ser como Allison Janney #Emmys,777698658087239681,0
418,,delaney218,"Nada, ahora que ganen Rami y Tatiana o sinó pierdo la fe en esto #Emmys",777698658141761536,1
419,,jamdownrocks,Stiff competition #Emmys,777698658426970113,0
420,,Giomanky,Creo la segunda temporada no ayudo mucho a la oportunidad de Rami #Emmys,777698658795950080,1
421,,VicFerrari50,Preview hysterical new Ebook for free! https://t.co/DdNp89VUyv #emmys #nfl #RayDonovan #trump #powertv #amazonkindle https://t.co/J7j1QbpDmA,777698657424506880,0
422,,sznnmorse,Hollywood loves the Confessional but the sacrament is usually done face to face these days. #Emmys,777698658527637507,0
423,,FeershBP,QUE GANE BETTER CALL SAUL GRINGOS PUTOS #Emmys,777698658787688449,0
424,,Shavonne191920,@nanoTuinenga https://t.co/ZEp3dLu3u7,777698658481496064,0
425,,MlLEYREYCYRUS,why are all the actors men smh🙄😤😤 #Emmys,777698658867351553,0
426,,ChrisBerg25,Anyone other than Malik is a robbery. #Emmys,777698659139891204,0
427,,AngieAddario,@sterlingkb1 So deserving!!!Congratulations!!! https://t.co/gy9OMwR8fj,777698659123290113,0
428,,Mecoello,Como es posible que no ganara mejor actor ni mejor actriz ninguno de GOT. Esto estararo.  los que ganaron ni siquiera fueron 👊👊👊👊 #emmys got,777698659425259520,0
429,,BecksVanAcker,I swear Allison Janney just keeps getting more and more attractive #Emmys #dayumgirl,777698660062593024,0
430,,uaidessa,RAMI OU MATTHEW #Emmys,777698659932790784,1
431,,thewlkingdoctor,IF RAMI DOESNT WIN IM GONNA SUE #Emmys,777698660192772096,1
432,,thekuhlest,"RAMI OR MATTHEW, MAKE IT HAPPEN, #EMMYS.",777698660893155328,1
433,,tommorefri,mas queria msm que o kyle ganhasse #Emmys,777698661291528192,0
434,,zatannav,RAMI VAI GANHAR EM NOME DE JESUS #Emmys,777698662155689984,1
435,,micqah,PEGA ESSA RAMI &lt;3 #Emmys,777698662189240320,1
436,,jakedimariaa,"From the Stranger Things kids to Sarah Paulson, this years #Emmys are one of the best!",777698662495428608,0
437,,Steph_hrp,Il est pour Rami celui là ! #Emmys,777698662617059328,1
438,,iamchrisbarlow,MATTHEW. MATTHEW. MATTHEW. #Emmys,777698662428372992,1
439,,clicktipu24,"mashable : Hillary Clinton is a fan of Kate McKinnon, just like you. … https://t.co/230DK9wv7K) https://t.co/qRwpZOywI8",777698661706915840,0
440,,pat_dameron,CONGRATS BAE https://t.co/koT5VCZzhO,777698662990254080,0
441,,MissSainz,#MrRobot es una sería que aún tengo pendiente #Emmys,777698663376179200,0
442,,isathegreat_,Wait a minute. WHERE'S WILL??? pun intended. Lmaoo https://t.co/I46cRJygvG,777698663036358656,0
443,,dvfalcone,@torikelly was on point at the #Emmys and now I need a downloadable version,777698663242067968,0
444,,kimjinwhoo,"ele é muito amor, eu tô no chão #Emmys https://t.co/6xs2e218j8",777698662499676160,0
445,,Douglas_bruce_5,Mama😍😍💘 https://t.co/756DGUTsne,777698663439081473,0
446,,sleepybean93,Kyle Chandler is SO dreamy #Emmys,777698663954944000,0
447,,abbudyasmin,AO VIVO no #Periscope: Quem esta assistindo o Emmy ? #emmys  https://t.co/934iYbnCyS,777698664387112960,0
448,,forexpcb,#emmys  THIS... https://t.co/X72i52an4M,777698665099956224,0
449,,chris_drop,#KeyAndPeele @KeeganMKey @JordanPeele #Emmys you've got to be kidding Key &amp; Peele finally won an Emmy but the shows done NO MORE Cmon😢,777698666349854721,0
450,,ccorvj,Matthew Rhys &lt;3 #Emmys,777698666819751937,1
451,,celesssste,Arrasa tia mcdonald https://t.co/fKljNxzsqx,777698666568093696,0
452,,mya_barrens,The cast from stranger things are so cute I'm crying  #Emmys,777698667151040512,0
453,,WazzoGames,"I think the #NutrishDog was dressed to impress at the #Emmys
https://t.co/nikP9aPMNv",777698667054628864,0
454,,nacarpe,Prince 💜🙏 #Emmys https://t.co/RdO5FOZtly,777698665469054981,0
455,,legallyblonde,"I don't care, Kyle Chandler should win this. #Emmys",777698667826262016,0
456,,LuccasGini,Eu não acredito que alguém realmente gostou da segunda temporada de Better Call Saul #Emmys,777698667411177472,1
457,,MrMtz_,Me arrepio quando o Kyle aparece #Emmys,777698667511816192,0
458,,YYZclone,I just shoved a bunch of chewy candy in my mouth to help with my nerves @OrphanBlack #EmmyForMaslany #Emmys,777698667746750464,0
459,,Twizleyterrific,Beyoncé lost. Changes the channel #Emmys  #LEMONADE https://t.co/4WWjHa1Xh5,777698667042078720,0
460,,T20G3,12 Celebs Who Turned Every Head At The 2016 #Emmys https://t.co/4Ta3OSpvkC https://t.co/nsbL8RNg32,777698667562016769,0
461,,pipocasclub,#TeamRami #Emmys,777698668531085312,0
462,,stellabonita,I want Odenkirk to win. But I'll be ecstatic for Rami #Emmys,777698668342304768,1
463,,TimeOutNewYork,It's finally time for the big awards! #Emmys,777698668283629568,0
464,,_BruuHenrique,"Ta quasee, ai meu core Tatianaa #Emmys",777698668539437056,0
465,,kateOFF_,Pero pa qué po https://t.co/aTLMeWKYpp,777698669852291072,0
466,,spidevrman,VEM RAMI #Emmys,777698670762393603,1
467,,fckdalange,meu coração tá muito apertado #Emmys,777698671089647616,0
468,,ericamarkunas,vamo Rami #Emmys,777698671370592257,1
469,,IHeartKimberlyC,❤️ https://t.co/arl9dHsW8K,777698671269928961,0
470,,TrentonJocz,Michael Emerson and Aden Young deserved Lead Actor nominations. #Emmys,777698671961870336,0
471,,SongulPinarBalc,#Emmys elliot,777698671739699200,0
472,,YouRGirrrl_Kayy,Wow. Such a classy lady. Said no one. #TrumpPence16 https://t.co/QgvExQTBKZ,777698671563595776,0
473,,tapeworthy,COACH TAYLOR JUST SWORE. ON TV. #Emmys,777698672377229312,0
474,,Patyy_s,Olho o Rami e lembro de Amanhecer  #Emmys,777698672494518273,1
475,,NdyaSVann,I might have to wear white for prom this year just because of this dress😍😍😍 https://t.co/TIz9JpOt3E,777698672452698112,0
476,,marvelady,VAI RAMI #Emmys,777698673228713984,1
477,,neighbourobot,VEM MELHOR ATOR DE SERIE DRAMA PRO RAMI MALEK  https://t.co/W9BleJno6T  #Emmys,777698673564278784,1
478,,mafeerslove,@VazquezAX @AnncCid así estaba hasta que decidieron no darle un emmy a nadie del Cast de Game Of Thrones #Emmys,777698673887031297,0
479,,smilenwaven,Allison Janney is gorgeous and so freakin talented! #Emmys,777698673916608512,0
480,,Depecher,This is it!! #Emmys,777698674822483968,1
481,,LazerShow530,IT'S RAMI TIME!! #EMMYS #MRROBOT,777698675350876160,1
482,,Demicraft2,#Emmys si no gana got iré hasta allá y con dajarys con mis dragones quemó todo junto a fuego valyrian,777698675455725569,0
483,,luvsgreyts,Amen! https://t.co/T7TieiXRvI,777698674835152896,0
484,,jasonfechner,"Oh, hey there, CJ... #Emmys #WestWing https://t.co/lm8SVWClpw",777698674444861440,0
485,,MichelleOakland,self explanatory tweet about @torikelly BLESSING everyone w her incredible voice #Emmys,777698675430662145,0
486,,savvatiipanfil3,"lff
#من_منطلق_خبرتي_بالحياه
#Emmys
#متصدر_لاني_اتحادي https://t.co/Z4YQj7TH4I",777698674847674373,0
487,,thaliabarros,"Pra sempre. Impossível não lembrar dele, ainda mais com Aleluia...💓🌌 https://t.co/uXvS0Jr8he",777698675367768064,0
488,,pamferreirad16,#EmmyForMaslany #Emmys Tatiana maslany ta chegando a hora... E como é que eu tô?! https://t.co/ZsIzSfJAXQ,777698674101129216,0
489,,rbaon1,I think the #NutrishCat rocked the red carpet at the #Emmys. https://t.co/VvaoRY7SV1,777698675309043712,0
490,,motelbatistao,vai q é sua rami!!!'nn #EmmyNaWarner #Emmys,777698676089229312,1
491,,SuzetteValle,Yes! https://t.co/kK0YumCnOz,777698676785328129,0
492,,HeadOverFeels,This category is LIT. #Emmys,777698676659589121,0
493,,lonely_tourist,"as much as I adore Kit and Peter, Ben Mendlesohn is so deserving of that Emmy. #Emmys #bloodline",777698676764356608,0
494,,4trendsworld,"Matt Damon e Jimmy Kimmel, esses caras são demais, não envelhecem. #Emmys https://t.co/kjCcYGUxFK",777698676177248256,0
495,,Hope_n_l_3,That right there was a bad piece of acting #Emmys,777698677322346496,0
496,,loveSueP,#inmemoriam #ToriKelly #RIPCharmianCarr 🙌🙌🙌 https://t.co/fcsIcB9EC7,777698677473153024,0
