,screen_name,text,tweet_id,cluster_pred
246,Jo__SL,😭😭😭😭😭😭😭😭😭😭😭😍😍😍😍😍😍 https://t.co/ZOPz4XLj4i,777690689685561344,1
247,pombareswho,Alguém me explica como que a Ellen perdeu? #Emmys,777690690214039552,1
248,StarryMag,Winner for Guest Actor and Actress in a Dramatic Series are #HankAzaria #MargoMartindale   #Emmys,777690690184704001,0
249,DeePhunk,Grease Live aka Sandy with the good hair. #Emmys,777690690750996480,1
250,MichelleBaileyB,Amazing skiit with Matt Damon &amp; Jimmy Kimmel #Emmys #veryfunny #greathost,777690690172096512,1
251,HiddenRemote,They keep mispronouncing Margo Martingale's name. It's Character Actress Margo Martindale. Sheesh. #Emmys #Emmy https://t.co/2IYJE0QIZL,777690690151129088,0
252,estaoutra,"Thomas Kail já ganhou um Tony e  um Emmy. EGOT, será? #Emmys",777690691707207680,1
253,verde_mica,Looking #Emmys #EmmysPorWarner from #Argentina .. #GameofThrones https://t.co/PR9xScgBhG,777690691417862148,1
254,thaessnm,"sessão drama. agora sim sou profissional, inclusive na vida #Emmys",777690692269268992,1
255,iamtherog,Rami Malek more like RaMEOW Malek am I right because he kind of looks like a cat when you wake it up by shaking a treat bag. #Emmys,777690692500029444,1
256,HearMyValyrian,"MI MOMENTO.

#Emmys https://t.co/pFw88cX7NR",777690691778519042,1
257,jocelyn528,Margo Martindale is the most wonderful Hollywood name.  #emmys,777690693271691264,0
258,wolfie74,"Again, what's with the limited tv show representations? #Emmys",777690693321883652,1
259,Waleed_CVF,يستاهلون 👍 https://t.co/U38WpO7Q8P,777690693515014144,1
260,9TheFix,Guest Actor and Actress in a Drama Series go to... @HankAzaria and Margot Martindale! #Emmys,777690693984620545,0
261,Ramah_Nyang,Totally deserved this one. https://t.co/xshg7ZVqzN,777690693410127872,1
262,betscoo44,Con esto se acaban de ganar un lugar bien chingon en mi corazón los niños de Stranger Things https://t.co/908TBU8eON,777690693552656384,1
263,d19arte,Neste caso a equipa de acusação ao OJ é que ganhou 😂 a Sarah (Marcia Clarck) e o Sterling K Brown (Chris Darden) #Emmys #SicCaras,777690693447843840,1
264,astridg_o,Carrie Preston no ganó. Fuck everything. #Emmys.,777690694219472896,1
265,FancyHam89,#Emmys https://t.co/W5L2H5Bh0k,777690693393321984,1
266,TheRyanHoward,Thank God that Key &amp; Peele won! I dreaded Schumer would win &amp; we'd hear her NOT thank all those comedians she stole her jokes from. #Emmys,777690694366400512,1
267,angellytabata,@WarnerChannelLA #Emmys #EmmysPorWarner Una vergüenza que los ganadores de The people v. O.J Simpson no hayan terminado su discurso.,777690694362300416,1
268,denvergadura,And the winners were? WTF? #Emmys,777690694588727296,1
269,lawrenconha,essas crianças de stranger things ainda vao ganhar muitos premios na vida #Emmys,777690694030860289,1
270,RamosComics,Check out #Marvel #Spidey Universe X Special #1 Recalled Slander DF #DynamicForces VF  https://t.co/I4L2gO8vY6 via @eBay #emmys,777690694232186882,1
271,likejournals,"Winter is coming! Game of Thrones is my choice for best drama series in @CoxComm's #Emmys poll!
https://t.co/h9q9pfLe8r",777690694534176768,1
272,abbeserphos,"The #Emmys are my third favorite awards show, but are these a little boring?",777690694899073024,1
273,IsadoraCgn,Como assim Michael não ganhou?! #Emmys,777690695754743809,1
274,coachNicodemo,I love the drama categories at the #Emmys so many great nominees.,777690696400703488,1
275,loopdlu,Rami Malek sounding like he's at the Golden Globes. #Emmys,777690697239363585,1
276,kellyte13,#EmmysPorWarner lo que todos queremos ver! Vamos #GameofThrones #Emmys,777690697633701888,1
277,Travon,The Wire never won an Emmy. #NeverForget #Emmys,777690698191544320,1
278,BillBishopKHOU,Key &amp; Peele wins best Variety Sketch Series at the #Emmys .  #khou,777690698036367361,1
279,todotvnews,#Emmys2016| Mejor Programa de Variedad Sketch es para #KeyAndPeele  #Emmys https://t.co/mw9Od9RAQe,777690697591816192,1
280,jameskorkie,Congratulations @pattonoswalt! I am so happy for you and Alice. Best wishes for more happy days in the future. #Emmys,777690698166505473,1
281,laughriverasm,YES YES YES https://t.co/u8RCicsA9k,777690697952440320,1
282,joshrodi,what sucks is that Lemonade which was so progressive for minorities and women in a patriarchal society lose to fucking GREASE.. #Emmys,777690698543955968,1
283,vodkstew,TÁ CHEGANDO A CATEGORIA DA TATIANA #Emmys https://t.co/5T9Vp5czK3,777690697608593408,1
284,annjuck,#Emmys Guest Actress goes to Margo Martindale #TheAmericans,777690698766319617,0
285,kuwq3rg1,"سناب مميز جداً
اضغط على الرابط للاضافه7
https://t.co/lc0Jx3EZjv

 #Emmys #كلنا_ضد_مريم_بيفور137 #لهجه_عربيه_ودك_تتعلمها #iPhone_7",777690698799808512,1
286,favoritefuuck,قولولي مين احلى وحده؟ #Emmys,777690698380378112,1
287,HollyelizWalker,WHAT?!?!?!?! #Emmys @KeyAndPeele!!!!!!!!!!! YAAAASSSSSSS!!!!!!,777690699630272512,1
288,marinafloro,RAMI MALEK EU TE AMO TANTOOOOOOOOOOOOO #Emmys,777690699252764672,1
289,veenacrownholm,“@people: #MasterofNone writer Alan Yang speaks out on asian-american diversity at #Emmys https://t.co/ZpbywNPtT2 https://t.co/ptaY9kbQ7q”🙌,777690699751788545,1
290,rickysheat,margo martindale is incredible #Emmys,777690699668094976,0
291,circumambiennt,RAMI ASKLNDLÇA  #Emmys,777690699777146880,1
292,gameofbatman,COMEÇOU DRAMA CARALHO NINGUÉM ME SEGURA #Emmys,777690699198238721,1
293,SCARETRXYE,CARALHO EU QUERO CHORAR COM O RAMI ELE TA TAO LINDO #Emmys,777690699684806656,1
294,jjasontodd,"rami malek is a beautiful, beautiful man #Emmys",777690700129275904,1
295,NickHgMn96,Hank Azaria! #Emmys,777690700255154176,1
296,TheFitFoodnista,#GameofThrones #GameofThrones #GameofThrones #Emmys,777690700565524480,1
297,a_tuts,AHHH that was so well deserved! She is fantastic on #TheAmericans #Emmys,777690701379334144,1
298,ChewyYorkie,"Margo Martindale 👏👏👏 Love her, but what a stacked category! #Emmys",777690701337362432,0
299,SarahHalleCorey,CHARACTER ACTRESS MARGO MARTINDALE @BoJackHorseman #Emmys,777690701823750144,0
300,colorscolor,"still laughing at that #Emmys bit from tonight where amy schumer ate paper, because she's SO FAT. HAHAHAHAHA LOVE THAT GAG",777690702037684224,1
301,rickollie,@tLoebLookout @Lavernecox You are already Taylor...#Emmys,777690701966434304,1
302,TVKel,"Carrie Preston should have won, despite how much I love Margo Martindale and championed her #Justified win. #Emmys",777690702335598593,0
303,jajalucianaa,La milf obvio! Ay ay ay #emmys,777690702620848129,1
304,avraham15,"Winter is coming! Game of Thrones is my choice for best drama series in @CoxComm's #Emmys poll!
https://t.co/zDHYxXBbnB",777690702574739460,1
305,SimplyCindy85,"Support your man, girl! #Emmys https://t.co/U8YomxhUaU",777690702717284352,1
306,mortosvivo,NAO ACREDITO QUE RAMI MALEK INVENTOU O MUNDO #Emmys,777690703040245761,1
307,Glamourousbyx,@pattonoswalt Congratulations on your win at the Emmys. By the way I'm going to need a lanyard!😉  #Emmys,777690703182921728,1
308,247Newsdesk,Keegan-Michael Key on his Obama &amp; Trump impressions: https://t.co/gcAVSWgJjR #Emmys https://t.co/YFf5ss6OVx,777690702918590465,1
309,AmyLi_15,"Ya viene lo bueno de los #Emmys 
Vamos @GameOfThrones",777690703509852160,1
310,greysmorte,@gamedostrones @IsabelaQuem https://t.co/tloKtX7Zs2,777690702931189764,1
311,gianlucaneri,"Per ora non c'è stato ancora un #Emmys non meritato. Eh, ma arriveranno. #TeamGrease #TeamLastWeekTonight",777690703480627200,1
312,DanMahowny,FYI https://t.co/yF1O46leam,777690703451131904,1
313,Albert1027,"Retweeted Television Academy (@TelevisionAcad):

.@SofiaVergara's reaction to #MattDamon's appearance #Emmys... https://t.co/6kfHw5DCiO",777690705237909504,1
314,jonbaesnow,agora é GOT amém ao drama #Emmys,777690705980452864,1
315,notperrysboat,SIM MEU DEUS QUERO PRA ONTEM https://t.co/lfYU2rSLWi,777690705883987968,1
316,pfvrmarino,rami malek vamo se abraçar de língua #Emmys,777690705984679937,1
317,sgreen3,"Alright, now it is hopefully time for lots of wins for The Americans. #Emmys",777690706118897665,1
318,DatDudeKP12,Bae when she turns 18 I promise https://t.co/LjwS59xZAP,777690705963745288,1
319,rodrigo1993,#Emmys Is it me or is the Mr. Robot dude a little scary looking?,777690706492043264,1
320,BobbyNamdar,Who is this woman? Im in love with her - presenting the guest drama winners for reference e#Emmys,777690706538274816,1
321,ManuelDuarte24,Hearing the Game of Thrones theme song when the nominations are shown just makes me want season 7 even more #Emmys,777690706932563968,1
322,thefader,Key &amp; Peele win for best sketch series. #Emmys https://t.co/eFyRc2oLpZ,777690706160812032,1
323,domingoelanvai,Não consigo ver a Margo Martindale sem lembrar de Bojack Horseman hahahaha #Emmys,777690707033198592,0
324,SolelyGirl,Não dá p pagar tds né https://t.co/YgafM5uVNf,777690707012222976,1
325,ahmed_madridsta,if it doesn't fit...you must acquit https://t.co/rKOJCI5yoz,777690707590991872,1
326,DerellaDeVil,This is why Beyoncé is absent https://t.co/8lqTK8sKYS,777690707477852161,1
327,marianahsantoos,Se Tatiana nao ganhar junta todo mundo e quebra tudo la #Emmys,777690708127916032,1
328,roseaids_,THEYRE SO CUTE https://t.co/r0ZVVlypro,777690709792960512,1
329,LauraLindberg2,"#GreaseLive  picks up another #Emmys. story with moral that girls need to change themselves and ""put out"" to get a guy.  we can do better.",777690709763710976,1
330,nerdisticoNews,Melhor Série de Variedades/Esquetes: Key &amp; Peele #Emmys,777690709734359040,1
331,LexiLawson,Congratulations Tommy Kail on your Emmy wins!!!! Wooooooooooooohooooooo #Emmys,777690709763719168,1
332,tvandwine,love this... @lievschreiber liev and sasha getting ready for the #emmys @mariaann79 #emmys2016 #lievschreiber... https://t.co/iFjlOkOBMX,777690710032220160,1
333,ashlovestv,Beloved character actress Margo martindale #Emmys,777690710417866754,0
334,JameyAbercromb1,Meds....trying to be Presidential but we see through your BS lady! Trump Train!!!! https://t.co/gZevJQbr3a,777690709868613634,1
335,SiniAhuja,"Okay, we're logging off to watch the rest of the #Emmys and light a prayer circle of candles so ItsRamiMalek wins! Enjoy the show!",777690710220873728,1
336,amandalemos,Drama 🔪#Emmys,777690710426484737,1
337,edwardistheman,@VanessaHudgens @TVGuide all I got to said is this @GoGrease is the word and will always be the word #Emmys,777690710501789696,1
338,SaraFederbush,Rami Malek's jawline is my favorite actor. #Emmys,777690710925578240,1
339,bonfimer,essa atriz de The Americans #Emmys,777690711177199616,1
340,kcrw,.@KeyAndPeele win best variety sketch series #Emmys https://t.co/n2RVvbToOb,777690708635299841,1
341,DougMarkowitz,CHARACTER ACTRESS MARGOT MARTINDALE IS ALIVE #Emmys,777690711168839680,0
342,kityharington,got ganhou esses trem tudo ai #Emmys,777690711462260737,1
343,whoniior,O DRAMA CHEGOU #Emmys https://t.co/HJvSc18Bm9,777690710644518914,1
344,ReelTalker,"still don't know how Hank Azaria won out of, like, anyone else in that category #Emmys",777690711378591744,1
345,pepper34,Congratulations sarah_paulson and @sterlingkb1 on your Emmy win👌#emmys #sarahpaulson… https://t.co/qHsZj0skMu,777690711634350084,1
346,suwaidi_ayesha,#GameOfThrones is a surefire winner for ‘Outstanding Drama Series’ at the 2016 #Emmys. Place your vote with @OSN. https://t.co/on95tqoSqD,777690711672098816,1
347,Jake_Rudy,Margo Martindale is an angel sent from above. #Emmys,777690712242479104,0
348,JediGrrrrl,"Imma let you finish Grease Live, but #Beyonce had the best special class program #Emmys",777690714050146304,1
349,CaylaClarke,"Let's talk about Rami and how he's sporting two of my favorite menswear yes'-- a bow tie and no break in those trousers. YAS, LOVE. #Emmys",777690714125787136,1
350,charltonandlola,"When there is more diversity at the #Emmys vs the #Oscars, you realize the TV is really doing it for storytelling in Today's America. Love!",777690714243293193,1
351,thetelevixen,Character actress Margo Martindale is here! #BoJackHorseman #Emmys #EmmyVixen,777690714129960961,0
352,unel,"👉 Jasa Tambah Follower Twitter 4000 Follower Rp 100.000 CP 085711761114 / BBM : 54D0F2D4
 ~ #Emmys ~ 44",777690713622405120,1
353,tbreitfeller,Margo Martindale!! LOVE #TheAmericans #Emmys,777690714083766272,0
354,YoungerthanKeon,And here i thought no one else appreciated Hank Azarias work on #RayDonovan #Emmys,777690714738130944,1
355,VINGAT1VA,Meu coração n aguenta agora #Emmys,777690714889150464,1
356,PhantomSpaceCop,"@TheEmmys look at this, you’ve upset Alicia Lutes. I hope you’re pleased with yourselves https://t.co/AWF3cIyZQM",777690713853136896,1
357,lorrainecink,It me https://t.co/G9jHJP1QSm,777690714507444224,1
358,Gonzalo_DaCon,Los amo siempre #Emmys https://t.co/4L5Hhy44fv,777690713005916160,1
359,LucasAugustoCS,Tadinho do Chris Rock... #Emmys https://t.co/RiLsz8mJE8,777690714914291712,1
360,ptd3001,So the Best Guest Actress in a Drama  nominees are like my dream dinner party. #Emmys.,777690715103039489,0
361,7Shioko,Premio para #TheAmericans #Emmys,777690715677683712,1
362,kthilburner,"With drama starting, pour one out for Rectify snub #Emmys",777690716067594240,1
363,grosenstein,Margo Martindale's best role was in BoJack Horseman. #Emmys,777690715891662848,0
364,RealFriscoKid,#EMMYS  and the winner for Best Variety Sketch Series is.. https://t.co/w5wcmj3U1V,777690714935205889,1
365,BeautyReflectTS,OMG HANK AZARIA LIVE IN PERSON...it's like a rare spotting of a wolverine #Emmys,777690716159877120,1
366,gabscrf,Agora bora ver se GoT leva tudo de novo haha #Emmys,777690716457865217,1
367,justinbdefense,!!1!1!!!!! https://t.co/d8ybFim9vx,777690716340383748,1
368,96sendy,COMO COÑO PUEDE SER TAN PERFECTO MR. MALEK? #Emmys,777690716663263232,1
369,scottyaloha,#lol https://t.co/E3fBfLKFxU,777690716004769792,1
370,Bey_Hive_,SÓ USARAM O NOME DA BEY P TER AUDIÊNCIA #Emmys,777690718148132864,1
371,cumberlocked,Ram and Carly #MrRobot #Emmys https://t.co/XaQIYPaWxS,777690718257242112,1
372,ManuAlcalaS,When the Drama change was the least dramatic one tho #Emmys,777690718730981376,1
373,JeanneMicallef,#Detroit loves you too @KeeganMKey. Congrats on the #Emmys win for #KeyAndPeele https://t.co/Cg8N6MON3D,777690718684930048,1
374,nathie_sousa,O moço do Mr Robot é de uma beleza estranha. #Emmys,777690718823391232,1
375,petyr_baelish10,"AL FIN EL DRAMA! VAMOS GAME OF THRONES!! #Emmys 
#TeamGoT https://t.co/1ixl8wykfL",777690717170700288,1
376,SavvyStyleQueen,Yassss https://t.co/oGdzc8kmCW,777690718324215808,1
377,ZaidJilani,only thing from emmys i care about https://t.co/QCf3niuCP8,777690718965944320,1
378,Kim0Br0wn,"I'm torn with these categories...House of Cards, Game of Thrones, Masters of Sex are all faves!  #Emmys",777690719720869888,1
379,thor_azul,@BoJackHorseman dude your girl Margot won an Emmy #Emmys,777690719754579968,1
380,lynellewhite,@drunkhistory didn't win... 😞 #Emmys https://t.co/SAELvQCZeL,777690719070724096,1
381,karsh,"Horace and Pete got a nomination? That's surprising. Lord, that was a depressing ass show #Emmys",777690720027209732,1
382,targaryleda,Finalmente el Drama. Escalofríos #Emmys,777690720886939648,1
383,JuliDbastos,House of Cards cadê teus prêmio? #Emmys,777690720647909377,1
384,ItsJustPosts,Grease live beat Lemonade #Emmys https://t.co/pdzUeMXFkg,777690721117667330,1
385,311tessa,I hate Hank Azaria on Ray Donovan. #Emmys,777690722380058624,1
386,_misscuriosity,A gnt assiste o #Emmys #EmmyNaWarner mas os comentários são stickers entre eu e @mayrahc acertando tudo até agora! Não.,777690722392834048,1
387,jordan0404,Margoooo #Emmys,777690722736738304,1
388,restlessinvb,I love it when they show these random women with too much Botox and you can't tell if that's a reaction or just their faces. #Emmys,777690722656985088,1
389,greysfan,It's Scotty!!!! #Suits #Emmys,777690723021750272,1
390,herois_da_tv,Quem está aí no #Emmys é o   Elliot ou o Mr. Robot?,777690722711572480,1
391,greenylimes,FINALLY DRAMA #Emmys #EmmyForMaslany,777690722292170752,1
392,lucasglee4,Melhores Convidados em Série Dramática: Hank Azaria e Margo Martindale #Emmys #Emmys2016 #EmmyNaWarner,777690722745057280,0
393,alfabebada,#Emmys eu to passando mal gente,777690722904469504,1
394,wehavelaunch,"Hank Azaria - Guest Actor - Drama Series
Margot Martindale - Guest - Actress - Drama Series #Emmys",777690723911143428,0
395,hot995,Drama series guest actor/actress: Hank Azaria and Margo Matrindale #emmys,777690723973996544,0
396,gc_marines,Margo Martindale #TheAmericans #Emmys,777690723718168576,0
397,jonhartmannjazz,"thank God
the #Emmys
will slow the ice melt.
we might want our grandkids
to have some dry ground, non-acidic...dontchaknow #extinction
PTL",777690724754034688,1
398,filmgatereviews,I want @KeeganMKey to win all the awards for everything he does because he's always so delightfully funny #Emmys,777690724074565632,1
399,tamartian_xo,Finally the category I've been waiting for #Emmys,777690724800299008,1
400,colastrom_,"Agora vamo ver Game of Thrones rapelando os baguiu, mas Mr. Robot vai jogar na cara q é bem melhor #Emmys",777690724569587712,1
401,RojasMedia1,When your invite gets lost in the mail #Emmys https://t.co/EuQSSJ0sTB,777690725068726272,1
402,ccookstar1218,@aileen_garcia_ Congrats to #KeyAndPeele @ComedyCentral love #SNL on @nbc both good comedy shows #Emmys,777690725026856964,1
403,BiaMG11,Ainda to tentando me recuperar do fato da Beyoncé ter perdido #Emmys,777690726620602368,1
404,butwevegotheart,Please let Sam Esmail win this. #Emmys,777690726972915712,1
405,JohPauloh,Pra mim deu! Não quero mais ver essa porcaria sem Beyoncé levar prêmio. Lemonade é uma obra de arte excelente! #Emmys #EmmyNaWarner,777690727082057732,1
406,Nitu_23,@BuzzFeedNews definitely the highlight of #Emmys2016!!! @priyankachopra is so perfect! 😍😍😍 #Emmys #EmmyswithPC,777690726687793152,1
407,platoscaves,They don't even get to say their speech? They gotta present? #Emmys,777690727019053056,1
408,m77_alshehri,"تذهب جائزة افضل برنامج سكتشات منوعة الى #KeyAndPeele 
#Emmys 
#Emmys2016 https://t.co/NvspKbRh6G",777690725513359362,1
409,ChrisHanratty85,Rami Malek looks like he is either tired af or high af #Emmys,777690727207702528,1
410,cassbakes,Grease Live deservedly won over Lemonade. #myunpopularopinion #Emmys,777690726247170048,1
411,nerdssauros,Key &amp; Peele são os vencedores em Melhor Programa de Esquetes #Emmys #emmyssauros https://t.co/YOH3yoRt9o,777690727035928576,1
412,sunoppositemoon,"Well damn. Margot's (sp?) character scared me, so I am alright. https://t.co/Moqqg5qrRL",777690727967027201,1
413,adrianacxdena,#EmmyForMaslany  #Emmys,777690727753003008,1
414,davidlonan,ANAMAMAAAAAAAAAAAAAAAAAA #EMMYS,777690727983747072,1
415,dul_mtz,Vamooos #GameofThrones #Emmys,777690728323358720,1
416,QAccessGlobal,mashable: RT mashablegif: .Lavernecox echoes Jeffrey Tambor's earlier statement at the #Emmys https://t.co/6YKffWCS4F,777690728654929920,1
417,unicornialauren,ESPERANDO GOT LEVAR TUDO #emmys https://t.co/96vZPEwIYZ,777690727589511168,1
418,JarrettHill,"I'm not saying Lemonade should've won, bc there were a lot of great shows nom'd, but I AM saying nothing. #Emmys https://t.co/1CbdlAEmMD",777690728398934016,1
419,PrinceEros_,Damn you. https://t.co/i1n1sCGWiB,777690729153912833,1
420,MichaelDroel,Yessss character actress Margo Martindale! #Emmys,777690729707626496,0
421,stolenfromyou,Ma parliamo della VOCE DI RAMI io mi sciolgo quando parla #Emmys,777690729590194176,1
422,vozos,"Rami Malek, to Hank Azaria: Dad? #emmys",777690729510567936,1
423,ShotDiva,Hey @Lesdoggg You look good tonight in your blue jumpsuit! Hope I run into you here at the #Emmys,777690730852589568,1
424,a002798ab,"حساب مفيد #السعودية حساب يستحق المتابعة @MofeedKsa اسلامي ثقافي اجتماعي وكذلك مسابقات وجوائز قيمة .
#Emmys https://t.co/xmICNDs31S",777690729678147584,1
425,perryhurts,TATIANA MASLANY TATIANA MASLANY TATIANA MASLANY TATIANA MASLANY TATIANA MASLANY TATIANA MASLANY TATIANA MASLANY TATIANA MASLANY TATIA #Emmys,777690730894622720,1
426,nomorequeerss10,Oooppssss...  #Emmys https://t.co/Su9ujTHOID,777690731087474689,1
427,iAHMEDsalih,Key &amp; Peele wins Best Variety Sketch Series #Emmys,777690731477622785,1
428,m_malandro,congrats character actress margo martindale #Emmys,777690731649470465,0
429,__Daviann,😂😂😂😂 https://t.co/QqIJYqS5mu,777690731511029760,1
430,luannem7,Meu homem 😍💘💕 https://t.co/XSHhMONx8y,777690731372773376,1
431,iskolohista,MY BABIES https://t.co/PqotGSrqiM,777690731431342080,1
432,Kathryn_Dani,I'm reminded of how much I miss House of Cards.#Emmys,777690731905449984,1
433,SRQConcierge,Helllllll yes! #loveyoudetroit #detroitlove @KeeganMKey https://t.co/GNdajFYHaj,777690731850919936,1
434,pitchfork,Beyoncé’s Lemonade was shut out at the 2016 #Emmys https://t.co/DuOxszaHUu https://t.co/0n9MAViIr2,777690731469234176,1
435,imcarly,Watching the #emmys and didn't realize that Margo Martindale was a real person. I though @BoJackHorseman made her up. #learnedsomethingnew,777690731930644480,0
436,Miichelneves_,Winter is coming! Game of Thrones is my choice for best drama series in @CoxComm's #Emmys poll! https://t.co/bdST1X82UK,777690731976749056,1
437,dale88fantx,Watching the #Emmys instead of Football. Congrats to The People vs. OJ Simpson cast!,777690731645284353,1
438,keri_jo215,where's my friend Tori Kelly #Emmys,777690732618321920,1
439,itsbooyeah,Margo Martindale is a force of nature ❤️ #emmys,777690732727525380,0
440,brightsideniall,la voz de rami malek es lo más bonito de este planeta y del siguiente #Emmys,777690732803096576,1
441,pegaita,Rami Malek has Steve Buscemi eyes... #Emmys,777690732719173632,1
442,Lost_Starrr_,Rami ganhador da noite! #Emmys,777690733134352384,1
443,JamarDJakes,I love #HouseOfCards #Emmys,777690733339824129,1
444,hellobatima,AI O RAMI MALEK MEU ETERNO CRUSH #Emmys,777690733386104834,1
445,jenjenwood,"*replays @ItsRamiMalek's voiceover saying ""sex"" 17 times* #Emmys",777690734484946944,1
446,oyetanya,Um did Grease Live just beat Beyoncé's Lemonade? #Emmys #wtf2016,777690734535114753,1
447,MBPLeo,RT: EonlineLatino: Las nominaciones van pasando muy rápido. Quedan menos de una hora y hay muchos premios por entregar #Emmys,777690734963097600,1
448,MorcegoAnemico,#Emmys Ahhh Sansa...,777690735395176448,1
449,Cancunisima9,"Lo quieroooo para ir un domingo a cinépolis de #plazaLasAméricas 😂😂😂
#Emmys https://t.co/iqhaxw6FtC",777690732677050368,1
450,GoT_Truther,Oh god here we go.... #Emmys,777690735919235072,1
451,allforstupidity,Yes! And Yes! https://t.co/RmnLAv21mY,777690736003342336,1
452,lizmcgillz,I LOVE RAMI SO MUCH #Emmys,777690736493944833,1
453,Ultima_Walker,#Emmys https://t.co/ZgccXoTVCc,777690735407693824,1
454,TheAdham2911,Why isn't @jimmyfallon on stage tonight?? #Emmys,777690736414167040,1
455,1800miaa,ALLISON JANNEY PLS #Emmys,777690736867233792,1
456,hairdressing004,emrata's #Emmys look was so steamy that she needed to cool down a little: https://t.co/IIl0eeaJPx … https://t.co/KjRmFNXbpw,777690737211240448,1
457,coralesque,she was robbed tho. https://t.co/GsCTlyzejd,777690737253224448,1
458,OhioOrganic,#Emmys Loved director  #SusanneBeier  dress - FABULOUS top!,777690737450377216,1
459,calditoosopanda,"Winter is coming! Game of Thrones is my choice for best drama series in @CoxComm's #Emmys poll!
https://t.co/bRbm56zeDY",777690737693581313,1
460,pfogs,I heart Margo Martindale. #Emmys,777690738272395265,0
461,leapessanha,Elenco de got já pode se preparar pra levantar o tempo todo #Emmys,777690738863767552,1
462,Gerardo48233517,Game of Thrones va ser la vencedora esta noche  #Emmys,777690739325009922,1
463,ladymaricota,Draaaaaamaaa #emmys,777690739220353025,1
464,bonelesside,Rami eu te amo todinho #Emmys,777690739241279489,1
465,jiyongdope,"nha
primeira indicação de got e n levou #Emmys",777690739241279488,1
466,jano1987,Mi amada Margo merece de todo #Emmys,777690739421634560,0
467,gameof_series,"NON CI CREDO
INIZIO A LEGGERE DRAMA E MI SI ILLUMINA IL MONDO
#Emmys  #rai4",777690739430002688,1
468,hairdressing004,When KeyAndPeele win at the #Emmys https://t.co/AcGWQnEIHq https://t.co/T5Qj9Bl19P,777690739165757440,1
469,modakoaj,Muy elegante Rami Malek en la #redcarpet ✨✨✨ #Emmys #MrRobot https://t.co/155jPYYvRi,777690738813464576,1
470,graciousjb,COMEÇARAM AS CATEGORIAS DE DRAMA #Emmys https://t.co/rexsjqJFB6,777690738960261121,1
471,carlafowler16,Waitinggggg.... #EmmyForMaslany @OrphanBlack @tatianamaslany #Emmys https://t.co/dsjXxDb25K,777690738599407618,1
472,howlovelyamanda,Key and Peele!!!! 😈🙃😂😝 #Emmys @KeeganMKey @JordanPeele,777690739878850560,1
473,ira,Rami Malek's voice sounds like a riverboat swindler that could have my millions for one night and a bottle of bourbon #Emmys,777690740038045696,1
474,roosvzla,A dormir- Mañana me cuentan cómo terminan los #emmys.,777690740105285632,1
475,keegxo,Rami ❤ #Emmys,777690740402958336,1
476,elamangai_,Winter is coming! Game of Thrones is my choice for best drama series in @CoxComm's #Emmys poll! https://t.co/vMrHQs6h0D,777690740449173504,1
477,TheRachaelE,"Using💃 as inspiration for your #Emmys look is always a good idea. I mean, just look at @priyankachopra 🔥 https://t.co/x9rOYPcycT",777690740520607745,1
478,icaro_054,GO Game Of Thrones POHA #Emmys,777690740843540480,1
479,meganNwalsh,Especially to fuckin Grease Live! https://t.co/wc7DJVHYIy,777690740503609344,1
480,GagaUnderKinney,I love Hank. Congrats!!! #Emmys,777690740394635264,1
481,Allinonestaff,#Emmys awesome show!,777690741384568833,1
