,screen_name,text,tweet_id,cluster_pred
0,ioana_d79,Drama series #Emmys omggggg,777690664607907840,0
1,UNEMejorjuntos,Empieza la categoría Drama. #Emmys https://t.co/2UNkbsR7MV,777690663785734144,0
2,baumsie,WOOOO!!! 🎉🎉 @KeyAndPeele @Atencio #Emmys,777690664750374916,0
3,arollingbeauty,There's a lot of pretty white dresses tonight #Emmys,777690665136324608,3
4,shokoshik,Character actress Margo Martindale! #Emmys,777690665371271168,2
5,kawaiikells,"Finally, drama. Now give me Game of Thrones. #Emmys",777690665455001601,0
6,badgal_ari,Awwww my heart https://t.co/mTObp9iowE,777690666126106624,3
7,thethesislife,All y'all bitches like Wells because he reminds you of @ItsRamiMalek. #BachelorInParadise #Emmys #Emmys2016,777690666054844416,3
8,c_mars_,Hi @ItsRamiMalek. I have 5 unwatched episodes of #MrRobot on my DVR. I feel shame. #Emmys,777690666239352834,3
9,nokonovalova384,Mejor Actriz de Reparto (Comedia): Kate McKinnon por #SaturdayNightLive. #Emmys �� MORE &gt;&gt; https://t.co/CdfnFaLTxl,777690666142924801,3
10,theRealTrayonce,American Crime Story: https://t.co/zah565p1AH,777690665958445057,3
11,flickchickdc,Margo!!!!!!!!! Who should win every award forever and ever!!! #Emmys,777690665601732608,2
12,louisfrannta14,She's still the Queen #Emmys https://t.co/gRBA5yvZgj,777690665069252608,3
13,IndependentBey,"Meu amor, botou o acento porque, Legion e TBHT ficaram falando de Emmy pra que caralho? Eu podia estar de boa curtindo meu domingo!! #Emmys",777690666801500160,0
14,Albert1027,"Retweeted Television Academy (@TelevisionAcad):

We'll be right back with more great #Emmys moments on ABC!... https://t.co/lFqafdKy6w",777690667854073856,0
15,davidpastrana,Ni un solo número de entretenimiento en lo que va de gala. ABC no ha querido gastar mucho dinero #Emmys,777690668177186816,3
16,rhythmandchange,Ok so M. Ali  is seriously underrated tho #Emmys,777690668537970689,3
17,drwsmistake,POR FIN UN CATEGORÍA DE GOT #Emmys,777690668231716864,1
18,robertcyoung,Ohhhhh shit so #TheAmericans won one already!!! #Emmys,777690668802019328,3
19,LucreciaTroia,AL FINNNN!!! VAMOS #GameofThrones !!!!! #EmmysPorWarner #Emmys,777690668307193856,4
20,makeitrayna,Why is thing so long? #Emmys,777690668852350976,3
21,alealier,Eu ainda acho justo dividirem o prêmio entre Tatiana Maslany e Robin Wright por motivos de muito rainhas #emmys,777690668659568640,0
22,lorecarivi,Rami Malek 😻 Ay esto es demasiado para mí #Emmys,777690670278541312,1
23,FrankDeSalesman,love u jeb https://t.co/7MDgCPsTTL,777690670098022400,0
24,jmkarmstrong,I do wish character actress Margo Martindale had been nominated for @BoJackHorseman. #Emmys,777690670337236996,2
25,UsernameSsSuck,See. Now what we're NOT going to do here... https://t.co/pzk6yiHK2A,777690670899171328,3
26,hunghoneybadger,"If Ray Donovan wins an Emmy, let's all commit mass .... Oh fuck #Emmys",777690672040030208,4
27,Taisbgp,"Nem falo de GOT, pois donos e proprietários desse Emmy com 23 indicações #Emmys",777690672224698368,1
28,RealMSA941,"If #CrookedHillary was smart, she would've made tonight a fundraiser in LA..her domestic donors are all at the #Emmys . #Emmys2016 #MAGA",777690672296038400,0
29,johnnykrnas,LAS CATEGORÍAS DE GAME OF THRONES #Emmys,777690672400781312,3
30,curlyheadx1,Is Beyoncé even there 😂 #Emmys,777690672325427200,3
31,Codigo_Magenta,#Emmys: #KeyandPeele gana por Mejor Serie de Variedad de Sketches https://t.co/gCfoHmSfow,777690671175958528,0
32,Andrewbrennan97,"Wow, even at the #Emmys @ItsRamiMalek still seems like Elliot. @whoismrrobot",777690671851319296,0
33,GDIGM,Congratulations @MargoMartindale Guest Actress Drama series  @TheEmmys #Emmys,777690672665075712,0
34,AlexandreCalm,pelo menos temos o #Emmys do Super Bowl !,777690672996515840,3
35,kae_98,#Emmys @ItsRamiMalek  You are amazing😍 I love you so much 💜,777690673495412737,0
36,doctornayaka,#KeyAndPeele for the win!!! #Emmys https://t.co/WiVuwukx7k,777690672295911424,0
37,huoters,I solely believe Grease Live deserved to win bc of Keke Palmer's three costume quick change had and Aaron Tveit's short shorts #Emmys,777690673654792192,3
38,quikjl,shout out to KEY AND PEELE for the Emmy win...because sometimes the winners actually win. #Emmys,777690673306710016,4
39,laurenzaremba,This has run of guest actor nominees just reminded me I really need to finish the last season of House of Cards. #emmys,777690673780822016,0
40,That_Girl_Dawn,@IMKristenBell and that dress - both gorgeous ❤ #Emmys #Emmys2016,777690673537552385,3
41,JanThePlan_,And she is slaying her pregnancy 😍 https://t.co/X951MsXJo7,777690674112192512,0
42,Itspedrito,"Sabotaram a Beyonce, rainha  injustiçada #emmys",777690676255461376,3
43,TVGroove,"【第68回 #エミー賞 】#Emmys
バラエティ・スペシャル監督賞は、ヴァネッサ・ハジェンズ、カーリー・レイ・ジェプセンら出演で話題となった「グリース・ライブ！」。同作はAmazonビデオで視聴可能（有料）。 @GoGrease
https://t.co/dMiIJuony2",777690676389515265,0
44,WrecklessLove,House Of Cards gets no love #Emmys,777690676486176768,0
45,Fool_4_Music,Love Margo Martindale. 💞 #EMMYs,777690676553187328,2
46,therealww7,Finalmente Drama  #Emmys #Rai4,777690676821630976,0
47,pulhut,Jesus https://t.co/6mO0U1fNt1,777690676247093248,4
48,Jordyne_Lynn,House of Cards x20 💀 #Emmys,777690676787937280,0
49,Sauniell,Is Bey performing because I'm about to change the station? #Emmys,777690676788158464,0
50,LemenStudio,Key &amp; Peele take the win!! #Emmys https://t.co/hcxvPWuSgY,777690675546460160,3
51,DeFlowerz,"YES, character actress #MargoMartindale!
#Emmys",777690677677215744,2
52,sortathatguy,Hank Azaria and Margo Martindale. That'd be a fun dinner party. #Emmys,777690677576601600,2
53,lacantekin,HOW. https://t.co/F6PDmar0k8,777690677413048322,3
54,eruwaffuru,категория драма просто каждая номинация ААААА ЧЕ ЖДАТЬ ТО #Emmys,777690677421498368,3
55,Antu_Giorgetta,"Te amo ""chico trastornado"".  #Emmys #RamiMalek",777690680504221698,1
56,chelseaadelaine,CHARACTER ACTRESS MARGO MARTINDALE #Emmys,777690680550420480,2
57,ssydneyscott,yasss https://t.co/nMayGOUG3L,777690680848113664,3
58,almeida_ja1,@NetflixBrasil ano que vem quero meus filhotes ahazani levando tudo ❤️ #Emmys,777690680672083968,3
59,BlackGirlNerds,I'll be shocked if we don't see Mahershala Ali back for Luke Cage next year. Just sayin #emmys,777690680940298240,3
60,SciFi4Me,"Guest Actor in a drama went to hank azaria
Guest actress in a drama went to margo Martindale #Emmys",777690681091297281,2
61,anywayimallyson,Here comes drama #Emmys,777690681145958400,0
62,fabulousfallon_,Jimmy definitely should have won that Emmy! 🙈😑 LIKE FR... @jimmyfallon #Emmys #falpal,777690681506619392,0
63,bonniegillespie,"My #Emmys votes were pretty on-point. My ""non-winners"" were all ones I knew would be a longshot, but had to vote for 'em anyway. PROGRESS!",777690681011765248,3
64,JMartOutkick,"If I were @ItsRamiMalek, I wouldn't walk too far away from the stage. #Emmys",777690681359921153,3
65,raeeetx,Omg I'm dying. They are so cute! https://t.co/rqceIK7awB,777690681309470720,3
66,who4fan,"I think the #NutrishCat rocked the red carpet at the #Emmys.
https://t.co/c0eqwhmT00",777690681481527296,3
67,screamxngface,DRAAAAAAAAAMA TATIANA ALELUYA #Emmys,777690681611579392,0
68,sofiprofumo,Y Game Of Thrones para cuando? #Emmys https://t.co/tY7VU0BIOP,777690680009355268,3
69,iguaannaa,a categoria da minha vida também conhecido como drama #Emmys,777690682110672896,0
70,DIANAPR1NCE,Robin Wright deserves an Emmy! #Emmys,777690682597122052,0
71,HugoGloss,Melhor programa de esquetes: @KeyAndPeele #Emmys #EmmyNaWarner https://t.co/msZL6DRsNC,777690681292750852,3
72,lexiehammesfahr,I will never forget Hank Azaria from #TheBirdcage #Emmys,777690682249076740,3
73,FajardoJoselin_,"Oh. Sí, ya iniciaron las categorías donde está #GameOfThrones 👌

#Emmys
#EmmysPorWarner",777690682861510656,4
74,OBenespanol,Ok atentos que estamos cerca parece... #emmys   #EmmyFoMaslany https://t.co/9eOVYS1gX7,777690681389289472,3
75,meresger1,Always happy when Margo Martindale wins. #Emmys,777690684648108032,2
76,PrincessMexanic,RAMI'S SMILE I-  #Emmys,777690684681662464,1
77,amandahernand31,Yo 👇🏼 https://t.co/xd7ZpO1hHd,777690684098809856,4
78,samuelramosss,MAXXX #Emmys,777690684824354816,0
79,laylawrote,Rami 💕 #Emmys,777690684958633985,1
80,n_narvalia,Rami Malek's voice is making me blush. #Emmys,777690684895682560,0
81,pitogamer254,Hola #Emmys,777690685092745216,3
82,GQMagazine,43 spectacular minutes of Key &amp; Peele you should watch right now https://t.co/DjlF4P0yE0 #Emmys https://t.co/kcFEt7qgs7,777690683901640705,3
83,itsokaysad,segura meu coração que o drama chegou #Emmys,777690685243785217,0
84,casadehadeis,AI TO NERVOSA #Emmys https://t.co/qaVoou7Jzm,777690685101277184,3
85,ledasana8tt830,Right on Key &amp; Peele. Now I'm just waiting for Tat to win  #Emmys,777690685591826432,3
86,carlyBAMF,I really want Margo Martindale as a friend. #emmys,777690684878884864,2
87,Hugo_Ernesto13,Llegó Drama: lo mejor de lo mejor #Emmys,777690685315047424,0
88,buttagal,NICE HANK WON! #RayDonovan #emmys,777690685491339272,0
89,31pottergirl,"@miamckenzie I can't wait to win something so I can say, ""I'm so possessive so I rock his Roc necklaces."" #TopplePatriarchy #Emmys",777690685466152960,0
90,TVOvermind,Character Actress Margo Martindale! #Emmys #Emmys2016,777690685348642820,2
91,RJCity1,Hank Azaria's win is long overdue as Murray's dog walker in Mad About You. #Emmys,777690685751365633,0
92,simoni_siqueira,"Ai meu Deus,as premiações pra #DramaSeries vão começar!! Ai meu coração!!  #Emmys",777690685780754432,1
93,revol_less,Character Actress Margo Martindale! #Emmys,777690685902389253,2
94,ta_mcknight,Oh are we finally to the drama portion? #Emmys,777690686413910016,0
95,13hFY,"مسابقات وجوائز ايفونات
وفقرات شعريه
سناب مميز جداً
-
-٧

 #من_منطلق_خبرتي_بالحياه #اروع_ما_تراه_عينك #Emmys #بن_عطيه https://t.co/CjwRWEFeIP",777690685877186560,3
96,LauraLives,I've never watched a full #Emmys show before - do they always do these wonderful transitions for the genre change?,777690686141390848,0
97,lovemeimdri,Can someone go get Bey and tell her she had somewhere to be today?! 😐 #Emmys,777690687122894848,3
98,janersm,Laurie Metcalf and Allison Janney got a few nominations this year. #Emmys,777690688783724544,1
99,jammyjam25,"Rami Malek just uttered the phrase ""Masters of Sex"", sorry you missed out TL. #Emmys",777690689035317248,1
100,scarymino,I'm not sure who Abigail spencer is but she's beautiful #Emmys,777690689568210944,0
101,Johnkees77,"#Emmys@jimmykimmel jimmy has became such a weirdo, thank god Americans have common sense and don't listen to celebrities",777690689685581824,1
102,MidwestCurls,Winter is coming! Game of Thrones is my choice for best drama series in @CoxComm's #Emmys poll! https://t.co/QJ4Nk2tO01,777690689744142336,3
103,larrybiebrx,EU TÔ AQUI PRA ENALTECER A MELHOR SÉRIE DO MUNDO #Emmys https://t.co/KqU7l9ZPUe,777690688565702656,3
104,Jo__SL,😭😭😭😭😭😭😭😭😭😭😭😍😍😍😍😍😍 https://t.co/ZOPz4XLj4i,777690689685561344,3
105,pombareswho,Alguém me explica como que a Ellen perdeu? #Emmys,777690690214039552,3
106,StarryMag,Winner for Guest Actor and Actress in a Dramatic Series are #HankAzaria #MargoMartindale   #Emmys,777690690184704001,3
107,DeePhunk,Grease Live aka Sandy with the good hair. #Emmys,777690690750996480,3
108,MichelleBaileyB,Amazing skiit with Matt Damon &amp; Jimmy Kimmel #Emmys #veryfunny #greathost,777690690172096512,3
109,HiddenRemote,They keep mispronouncing Margo Martingale's name. It's Character Actress Margo Martindale. Sheesh. #Emmys #Emmy https://t.co/2IYJE0QIZL,777690690151129088,2
110,estaoutra,"Thomas Kail já ganhou um Tony e  um Emmy. EGOT, será? #Emmys",777690691707207680,3
111,verde_mica,Looking #Emmys #EmmysPorWarner from #Argentina .. #GameofThrones https://t.co/PR9xScgBhG,777690691417862148,4
112,thaessnm,"sessão drama. agora sim sou profissional, inclusive na vida #Emmys",777690692269268992,0
113,iamtherog,Rami Malek more like RaMEOW Malek am I right because he kind of looks like a cat when you wake it up by shaking a treat bag. #Emmys,777690692500029444,0
114,HearMyValyrian,"MI MOMENTO.

#Emmys https://t.co/pFw88cX7NR",777690691778519042,3
115,jocelyn528,Margo Martindale is the most wonderful Hollywood name.  #emmys,777690693271691264,2
116,wolfie74,"Again, what's with the limited tv show representations? #Emmys",777690693321883652,3
117,Waleed_CVF,يستاهلون 👍 https://t.co/U38WpO7Q8P,777690693515014144,3
118,9TheFix,Guest Actor and Actress in a Drama Series go to... @HankAzaria and Margot Martindale! #Emmys,777690693984620545,2
119,Ramah_Nyang,Totally deserved this one. https://t.co/xshg7ZVqzN,777690693410127872,4
120,betscoo44,Con esto se acaban de ganar un lugar bien chingon en mi corazón los niños de Stranger Things https://t.co/908TBU8eON,777690693552656384,3
121,d19arte,Neste caso a equipa de acusação ao OJ é que ganhou 😂 a Sarah (Marcia Clarck) e o Sterling K Brown (Chris Darden) #Emmys #SicCaras,777690693447843840,3
122,astridg_o,Carrie Preston no ganó. Fuck everything. #Emmys.,777690694219472896,0
123,FancyHam89,#Emmys https://t.co/W5L2H5Bh0k,777690693393321984,4
124,TheRyanHoward,Thank God that Key &amp; Peele won! I dreaded Schumer would win &amp; we'd hear her NOT thank all those comedians she stole her jokes from. #Emmys,777690694366400512,3
125,angellytabata,@WarnerChannelLA #Emmys #EmmysPorWarner Una vergüenza que los ganadores de The people v. O.J Simpson no hayan terminado su discurso.,777690694362300416,1
126,denvergadura,And the winners were? WTF? #Emmys,777690694588727296,4
127,lawrenconha,essas crianças de stranger things ainda vao ganhar muitos premios na vida #Emmys,777690694030860289,0
128,RamosComics,Check out #Marvel #Spidey Universe X Special #1 Recalled Slander DF #DynamicForces VF  https://t.co/I4L2gO8vY6 via @eBay #emmys,777690694232186882,3
129,likejournals,"Winter is coming! Game of Thrones is my choice for best drama series in @CoxComm's #Emmys poll!
https://t.co/h9q9pfLe8r",777690694534176768,3
130,abbeserphos,"The #Emmys are my third favorite awards show, but are these a little boring?",777690694899073024,3
131,IsadoraCgn,Como assim Michael não ganhou?! #Emmys,777690695754743809,3
132,coachNicodemo,I love the drama categories at the #Emmys so many great nominees.,777690696400703488,0
133,loopdlu,Rami Malek sounding like he's at the Golden Globes. #Emmys,777690697239363585,3
134,kellyte13,#EmmysPorWarner lo que todos queremos ver! Vamos #GameofThrones #Emmys,777690697633701888,4
135,Travon,The Wire never won an Emmy. #NeverForget #Emmys,777690698191544320,0
136,BillBishopKHOU,Key &amp; Peele wins best Variety Sketch Series at the #Emmys .  #khou,777690698036367361,3
137,todotvnews,#Emmys2016| Mejor Programa de Variedad Sketch es para #KeyAndPeele  #Emmys https://t.co/mw9Od9RAQe,777690697591816192,3
138,jameskorkie,Congratulations @pattonoswalt! I am so happy for you and Alice. Best wishes for more happy days in the future. #Emmys,777690698166505473,3
139,laughriverasm,YES YES YES https://t.co/u8RCicsA9k,777690697952440320,3
140,joshrodi,what sucks is that Lemonade which was so progressive for minorities and women in a patriarchal society lose to fucking GREASE.. #Emmys,777690698543955968,3
141,vodkstew,TÁ CHEGANDO A CATEGORIA DA TATIANA #Emmys https://t.co/5T9Vp5czK3,777690697608593408,3
142,annjuck,#Emmys Guest Actress goes to Margo Martindale #TheAmericans,777690698766319617,2
143,kuwq3rg1,"سناب مميز جداً
اضغط على الرابط للاضافه7
https://t.co/lc0Jx3EZjv

 #Emmys #كلنا_ضد_مريم_بيفور137 #لهجه_عربيه_ودك_تتعلمها #iPhone_7",777690698799808512,3
144,favoritefuuck,قولولي مين احلى وحده؟ #Emmys,777690698380378112,1
145,HollyelizWalker,WHAT?!?!?!?! #Emmys @KeyAndPeele!!!!!!!!!!! YAAAASSSSSSS!!!!!!,777690699630272512,0
146,marinafloro,RAMI MALEK EU TE AMO TANTOOOOOOOOOOOOO #Emmys,777690699252764672,1
147,veenacrownholm,“@people: #MasterofNone writer Alan Yang speaks out on asian-american diversity at #Emmys https://t.co/ZpbywNPtT2 https://t.co/ptaY9kbQ7q”🙌,777690699751788545,4
148,rickysheat,margo martindale is incredible #Emmys,777690699668094976,2
149,circumambiennt,RAMI ASKLNDLÇA  #Emmys,777690699777146880,1
150,gameofbatman,COMEÇOU DRAMA CARALHO NINGUÉM ME SEGURA #Emmys,777690699198238721,0
151,SCARETRXYE,CARALHO EU QUERO CHORAR COM O RAMI ELE TA TAO LINDO #Emmys,777690699684806656,0
152,jjasontodd,"rami malek is a beautiful, beautiful man #Emmys",777690700129275904,0
153,NickHgMn96,Hank Azaria! #Emmys,777690700255154176,0
154,TheFitFoodnista,#GameofThrones #GameofThrones #GameofThrones #Emmys,777690700565524480,4
155,a_tuts,AHHH that was so well deserved! She is fantastic on #TheAmericans #Emmys,777690701379334144,3
156,ChewyYorkie,"Margo Martindale 👏👏👏 Love her, but what a stacked category! #Emmys",777690701337362432,2
157,SarahHalleCorey,CHARACTER ACTRESS MARGO MARTINDALE @BoJackHorseman #Emmys,777690701823750144,2
158,colorscolor,"still laughing at that #Emmys bit from tonight where amy schumer ate paper, because she's SO FAT. HAHAHAHAHA LOVE THAT GAG",777690702037684224,0
159,rickollie,@tLoebLookout @Lavernecox You are already Taylor...#Emmys,777690701966434304,1
160,TVKel,"Carrie Preston should have won, despite how much I love Margo Martindale and championed her #Justified win. #Emmys",777690702335598593,0
161,jajalucianaa,La milf obvio! Ay ay ay #emmys,777690702620848129,0
162,avraham15,"Winter is coming! Game of Thrones is my choice for best drama series in @CoxComm's #Emmys poll!
https://t.co/zDHYxXBbnB",777690702574739460,3
163,SimplyCindy85,"Support your man, girl! #Emmys https://t.co/U8YomxhUaU",777690702717284352,3
164,mortosvivo,NAO ACREDITO QUE RAMI MALEK INVENTOU O MUNDO #Emmys,777690703040245761,1
165,Glamourousbyx,@pattonoswalt Congratulations on your win at the Emmys. By the way I'm going to need a lanyard!😉  #Emmys,777690703182921728,1
166,247Newsdesk,Keegan-Michael Key on his Obama &amp; Trump impressions: https://t.co/gcAVSWgJjR #Emmys https://t.co/YFf5ss6OVx,777690702918590465,3
167,AmyLi_15,"Ya viene lo bueno de los #Emmys 
Vamos @GameOfThrones",777690703509852160,4
168,greysmorte,@gamedostrones @IsabelaQuem https://t.co/tloKtX7Zs2,777690702931189764,3
169,gianlucaneri,"Per ora non c'è stato ancora un #Emmys non meritato. Eh, ma arriveranno. #TeamGrease #TeamLastWeekTonight",777690703480627200,0
170,DanMahowny,FYI https://t.co/yF1O46leam,777690703451131904,3
171,Albert1027,"Retweeted Television Academy (@TelevisionAcad):

.@SofiaVergara's reaction to #MattDamon's appearance #Emmys... https://t.co/6kfHw5DCiO",777690705237909504,3
172,jonbaesnow,agora é GOT amém ao drama #Emmys,777690705980452864,1
173,notperrysboat,SIM MEU DEUS QUERO PRA ONTEM https://t.co/lfYU2rSLWi,777690705883987968,3
174,pfvrmarino,rami malek vamo se abraçar de língua #Emmys,777690705984679937,1
175,sgreen3,"Alright, now it is hopefully time for lots of wins for The Americans. #Emmys",777690706118897665,3
176,DatDudeKP12,Bae when she turns 18 I promise https://t.co/LjwS59xZAP,777690705963745288,3
177,rodrigo1993,#Emmys Is it me or is the Mr. Robot dude a little scary looking?,777690706492043264,1
178,BobbyNamdar,Who is this woman? Im in love with her - presenting the guest drama winners for reference e#Emmys,777690706538274816,0
179,ManuelDuarte24,Hearing the Game of Thrones theme song when the nominations are shown just makes me want season 7 even more #Emmys,777690706932563968,3
180,thefader,Key &amp; Peele win for best sketch series. #Emmys https://t.co/eFyRc2oLpZ,777690706160812032,3
181,domingoelanvai,Não consigo ver a Margo Martindale sem lembrar de Bojack Horseman hahahaha #Emmys,777690707033198592,2
182,SolelyGirl,Não dá p pagar tds né https://t.co/YgafM5uVNf,777690707012222976,3
183,ahmed_madridsta,if it doesn't fit...you must acquit https://t.co/rKOJCI5yoz,777690707590991872,3
184,DerellaDeVil,This is why Beyoncé is absent https://t.co/8lqTK8sKYS,777690707477852161,3
185,marianahsantoos,Se Tatiana nao ganhar junta todo mundo e quebra tudo la #Emmys,777690708127916032,1
186,roseaids_,THEYRE SO CUTE https://t.co/r0ZVVlypro,777690709792960512,0
187,LauraLindberg2,"#GreaseLive  picks up another #Emmys. story with moral that girls need to change themselves and ""put out"" to get a guy.  we can do better.",777690709763710976,1
188,nerdisticoNews,Melhor Série de Variedades/Esquetes: Key &amp; Peele #Emmys,777690709734359040,3
189,LexiLawson,Congratulations Tommy Kail on your Emmy wins!!!! Wooooooooooooohooooooo #Emmys,777690709763719168,3
190,tvandwine,love this... @lievschreiber liev and sasha getting ready for the #emmys @mariaann79 #emmys2016 #lievschreiber... https://t.co/iFjlOkOBMX,777690710032220160,0
191,ashlovestv,Beloved character actress Margo martindale #Emmys,777690710417866754,2
192,JameyAbercromb1,Meds....trying to be Presidential but we see through your BS lady! Trump Train!!!! https://t.co/gZevJQbr3a,777690709868613634,3
193,SiniAhuja,"Okay, we're logging off to watch the rest of the #Emmys and light a prayer circle of candles so ItsRamiMalek wins! Enjoy the show!",777690710220873728,4
194,amandalemos,Drama 🔪#Emmys,777690710426484737,0
195,edwardistheman,@VanessaHudgens @TVGuide all I got to said is this @GoGrease is the word and will always be the word #Emmys,777690710501789696,0
196,SaraFederbush,Rami Malek's jawline is my favorite actor. #Emmys,777690710925578240,1
197,bonfimer,essa atriz de The Americans #Emmys,777690711177199616,3
198,kcrw,.@KeyAndPeele win best variety sketch series #Emmys https://t.co/n2RVvbToOb,777690708635299841,3
199,DougMarkowitz,CHARACTER ACTRESS MARGOT MARTINDALE IS ALIVE #Emmys,777690711168839680,2
200,kityharington,got ganhou esses trem tudo ai #Emmys,777690711462260737,1
201,whoniior,O DRAMA CHEGOU #Emmys https://t.co/HJvSc18Bm9,777690710644518914,0
202,ReelTalker,"still don't know how Hank Azaria won out of, like, anyone else in that category #Emmys",777690711378591744,0
203,pepper34,Congratulations sarah_paulson and @sterlingkb1 on your Emmy win👌#emmys #sarahpaulson… https://t.co/qHsZj0skMu,777690711634350084,3
204,suwaidi_ayesha,#GameOfThrones is a surefire winner for ‘Outstanding Drama Series’ at the 2016 #Emmys. Place your vote with @OSN. https://t.co/on95tqoSqD,777690711672098816,4
205,Jake_Rudy,Margo Martindale is an angel sent from above. #Emmys,777690712242479104,2
206,JediGrrrrl,"Imma let you finish Grease Live, but #Beyonce had the best special class program #Emmys",777690714050146304,3
207,CaylaClarke,"Let's talk about Rami and how he's sporting two of my favorite menswear yes'-- a bow tie and no break in those trousers. YAS, LOVE. #Emmys",777690714125787136,0
208,charltonandlola,"When there is more diversity at the #Emmys vs the #Oscars, you realize the TV is really doing it for storytelling in Today's America. Love!",777690714243293193,3
209,thetelevixen,Character actress Margo Martindale is here! #BoJackHorseman #Emmys #EmmyVixen,777690714129960961,2
210,unel,"👉 Jasa Tambah Follower Twitter 4000 Follower Rp 100.000 CP 085711761114 / BBM : 54D0F2D4
 ~ #Emmys ~ 44",777690713622405120,3
211,tbreitfeller,Margo Martindale!! LOVE #TheAmericans #Emmys,777690714083766272,2
212,YoungerthanKeon,And here i thought no one else appreciated Hank Azarias work on #RayDonovan #Emmys,777690714738130944,0
213,VINGAT1VA,Meu coração n aguenta agora #Emmys,777690714889150464,1
214,PhantomSpaceCop,"@TheEmmys look at this, you’ve upset Alicia Lutes. I hope you’re pleased with yourselves https://t.co/AWF3cIyZQM",777690713853136896,0
215,lorrainecink,It me https://t.co/G9jHJP1QSm,777690714507444224,3
216,Gonzalo_DaCon,Los amo siempre #Emmys https://t.co/4L5Hhy44fv,777690713005916160,4
217,LucasAugustoCS,Tadinho do Chris Rock... #Emmys https://t.co/RiLsz8mJE8,777690714914291712,3
218,ptd3001,So the Best Guest Actress in a Drama  nominees are like my dream dinner party. #Emmys.,777690715103039489,0
219,7Shioko,Premio para #TheAmericans #Emmys,777690715677683712,1
220,kthilburner,"With drama starting, pour one out for Rectify snub #Emmys",777690716067594240,0
221,grosenstein,Margo Martindale's best role was in BoJack Horseman. #Emmys,777690715891662848,2
222,RealFriscoKid,#EMMYS  and the winner for Best Variety Sketch Series is.. https://t.co/w5wcmj3U1V,777690714935205889,3
223,BeautyReflectTS,OMG HANK AZARIA LIVE IN PERSON...it's like a rare spotting of a wolverine #Emmys,777690716159877120,3
224,gabscrf,Agora bora ver se GoT leva tudo de novo haha #Emmys,777690716457865217,1
225,justinbdefense,!!1!1!!!!! https://t.co/d8ybFim9vx,777690716340383748,4
226,96sendy,COMO COÑO PUEDE SER TAN PERFECTO MR. MALEK? #Emmys,777690716663263232,3
227,scottyaloha,#lol https://t.co/E3fBfLKFxU,777690716004769792,4
228,Bey_Hive_,SÓ USARAM O NOME DA BEY P TER AUDIÊNCIA #Emmys,777690718148132864,3
229,cumberlocked,Ram and Carly #MrRobot #Emmys https://t.co/XaQIYPaWxS,777690718257242112,3
230,ManuAlcalaS,When the Drama change was the least dramatic one tho #Emmys,777690718730981376,0
231,JeanneMicallef,#Detroit loves you too @KeeganMKey. Congrats on the #Emmys win for #KeyAndPeele https://t.co/Cg8N6MON3D,777690718684930048,0
232,nathie_sousa,O moço do Mr Robot é de uma beleza estranha. #Emmys,777690718823391232,1
233,petyr_baelish10,"AL FIN EL DRAMA! VAMOS GAME OF THRONES!! #Emmys 
#TeamGoT https://t.co/1ixl8wykfL",777690717170700288,3
234,SavvyStyleQueen,Yassss https://t.co/oGdzc8kmCW,777690718324215808,3
235,ZaidJilani,only thing from emmys i care about https://t.co/QCf3niuCP8,777690718965944320,4
