,screen_name,text,tweet_id,cluster_pred
728,VivoRadioNet,#Emmys Dirección de Especial en Vivo: Kail &amp; Rudzinski por Grease Live. https://t.co/5xzCHltsok,777690827778879489,3
729,Francesco_Adam,OMG #DRAMA #EMMYS it's getting real!,777690828387053568,0
730,rilayabr,priyanka's so perfect OMG https://t.co/5o6z7tT6FR,777690828646920192,3
731,bluegxrls,To tremendo #Emmys,777690827934015490,1
732,tennackles,QUERO GOT GANHANDO UMA PÁ DE COISA MESMO #Emmys,777690828898787328,1
733,CherokeeLair,My phone us dying/this show is too long but @jimmykimmel is keeping it fun! 💖💃💋 #Emmys,777690828852592644,3
734,rmecheeya,BATTLE OF THE BASTARDS!! #Emmys,777690829129383936,1
735,DiferenteJose,DOWNTON ABBEY #Emmys,777690829242691585,3
736,fatsophieturner,BATTLE OF THE BASTARDS !!!!! #Emmys,777690828621963265,1
737,Phllp_Wnslw,The Americans v Mr Robot all night #Emmys,777690831549558785,1
738,katiebreslin,Time will be on @Beyonce'a side on Lemonade over Grease Live. I can't even remember what song @taylorswift13 won over @beyonce. #emmys,777690831587115008,3
739,selenabetters,VEM GAME OF THRONES #Emmys,777690831608225793,3
740,Bethany2357,Remember when hank azaria and rami malek played brothers in night at the museum #Emmys,777690832027672577,1
741,slippycaff,How did Ming not win? #Emmys https://t.co/Y43KNydl58,777690831373250560,3
742,Umshipper,MEUS pais  #Emmys https://t.co/dYmr9WsNSG,777690830966587392,3
743,MotivationFash,InStyle: MissSarahPaulson's making a strong case for shoulder pads. 👌 #Emmys https://t.co/jFreRQfZeH,777690832036040705,3
744,YaGirlMelberne,C'mon #GoT!!!!! #Emmys #TYFEmmys,777690832455380992,1
745,Robert_Zeigler,I feel like @JordanPeele will be running his own film studio one day and it'll be incredible. #Emmys,777690832807858176,3
746,christinalizzo,"Dear @ItsRamiMalek. Love, all of us. #Emmys https://t.co/OVwkO70QdS",777690832367386625,0
747,LoveLiv____,A king named Rami #Emmys,777690833462054913,1
748,writingvee,Qui tifo Game of Thrones  #emmys,777690833151791104,3
749,AbbyDraper,Ditto https://t.co/SYX9FzgzZz,777690833482940416,4
750,leydylaura,Battle of the bastard deserves 20 #Emmys,777690834095443968,0
751,marielmarrz,Rami 💛 #emmys,777690835622043649,1
752,ashleyvbenson23,Game of Thrones is my choice for best drama series in @CoxComm's #Emmys poll! https://t.co/9YtVSb2Zzg,777690835127308288,3
753,rafxss,Drama venga drama #Emmys,777690835785777152,0
754,_joaodavis,Isso querida deu um spoiler legal #Emmys,777690835752214528,1
755,kilteralbuquerq,E o Rami Malek ein? #Emmys https://t.co/E3dKFf06nh,777690834053558272,1
756,BraindamagedFr,Meilleur actrice invitée dans un drama #Emmys Margo Martindale pour #TheAmericans,777690835534118913,2
757,nzuri_mnyama,"Dipped in chocolate, bronzed in elegance, enameled with grace, toasted with beauty.

#BlackGirlMagic at the #Emmys https://t.co/KECOOr7ibn",777690835446030337,0
758,cambio,The best-dressed stars on the 2016 #Emmys red carpet https://t.co/HyQReGUo2Z https://t.co/m8BKW3jSpm,777690833365639168,3
759,TheIllestRican,Is it me or does it feel like they're rushing the #Emmys right now???,777690835878088704,0
760,colleenc24,Had @ACSFX not been so good @FargoFX would have owned the #Emmys can they both win?,777690836423155713,3
761,sunchick8,Is kissing Kyle Chandler a thing now?  If so... #Emmys https://t.co/9OsUgh4WQR,777690835710316545,3
762,CaseyFrancis,Twitter + #Emmys ❤️😍,777690836515651584,3
763,meridak,"Ok, my guys @KeeganMKey @JordanPeele @Atencio take home the statue in last season of Key&amp;Peele. Those dudes are totally Undefeated.#Emmys",777690836087742465,3
764,Eduufardo,VAMO LÁ GOT #Emmys,777690836498784257,1
765,SFLABird,Watching the #emmys makes u want to binge watch all of the shows one never has time to watch.,777690836725182464,0
766,liadaywalker1,#Emmys #KeyAndPeele just beat #SNL 😱 dead so much love. So funny. My hands hurt from clapping #inclusion right men win,777690836582686720,0
767,MartezRhyine,There's a chair empty at the #Emmys with Beyoncé's picture on it and glitter left on the seat.✨,777690836519776257,3
768,fernandovital,rainha mesmo https://t.co/msyUIJ2xne,777690836612026368,3
769,Zach_Lozano,Why would you have two nominees present immediately after the categories they might win in? #Emmys #producingfail,777690837245235200,3
770,moonlight_sarax,Che vinca GOT o Downton Abbey mi va bene comunque #Emmys #rai4,777690837199224832,1
771,borderline_cool,Hmmm. I wonder what's happening at the Emmys? Nope. No I don't. #Emmys,777690837010481152,1
772,gabirobot,Adoro the americans também #Emmys #EmmyNaWarner,777690837367005186,3
773,caiogomest,GO SAM ESMAIL #Emmys,777690837568385024,4
774,NikkiNycole,Each time the Emmys change catergorie I think of the hunger games #Emmys,777690837803147264,3
775,leafsweetie,"#RamiMalek repping us ""good"" Arabs!  #Emmys",777690839854100480,3
776,mothwinged,"Okay, alright. Here they come, the drama awards. I'm not ready, y'all. #Emmys",777690840361676800,0
777,beliebersmiling,"Raga, battle of bastards è TROPPO  #Emmys",777690840152076289,1
778,24karatsue,So excited for @iamjohnoliver and @LastWeekTonight Congratulations Mazel  #Emmys,777690840311279616,3
779,EnGalasso,"#emmys #Rai4 è tardi, ma per Rami che sembra comunque un disagiato, perdòno tutti. Drama!",777690840135262209,0
780,smolboyfranta,i love them sm https://t.co/yxb4AiBWZk,777690840281980928,0
781,LabVince,Julia Louis-Dreyfus meilleure actrice dans une comédie pour la 5ème fois consécutive : je l'aime d'amour ! #VEEP #Emmys,777690840143659009,3
782,coisasdaanablog,Margo Martindale 😍😍😍 #Emmys #EmmyNaWarner,777690840449900544,2
783,ParkerMetts,😻😻 https://t.co/H3C6yk9Neo,777690840277843969,3
784,candiesbling,How can Grease beat anything with Aretha involved? HOW SWAY #Emmys,777690840533725184,0
785,Filmcricket,Beloved character actress Margo Martindale! #Emmys,777690839908749312,2
786,vitorugos,VAI GOT #EMMYS,777690840776970240,1
787,il2ill,Rami is so cute 😿💜 #Emmys,777690841007652864,1
788,strangerslives,apareceu o rami eu ja tava kerendo chora #Emmys,777690840894410753,1
789,Pepamint83,"#GameOfThrones BETTER WIN i dont care which episode 

#Emmys #Emmys2016",777690841817157637,4
790,SASSYAF28,UNREAL BETTER WIN OMFG #Emmys,777690841599148032,0
791,kaahmelbetth,agora drama #Emmys  #EmmyNaWarner,777690841653645312,0
792,themattcruz,NO CU! 😒 #EMMYs https://t.co/SiLX9dkhKG,777690841779494912,3
793,cellainthesky,A BATALHA DOS BASTARDOS POR FAVOR NUNCA TE PEDI NADA #Emmys,777690841934684164,0
794,walyson_bfr,Torcendo também pro Rami Malek #Emmys,777690842698047488,1
795,MmmLiz,"Key &amp; Peele win: ""The craft services were amazing!"" Some PA just popped some champagne. #Emmys",777690844086218752,3
796,vane_0729,Ahora si se puso bueno esto...Llegaron los premios mas esperados! #Drama #Emmys,777690844140806146,3
797,juliekosin,GIVE BATTLE OF THE BASTARDS EVERYTHING #got #emmys,777690844497346560,1
798,VoiceofDarrellC,Hank Azaria...very talented! #Emmys,777690844593786881,3
799,Wynner4Life,So elated that #KeyAndPeele finally won a #Emmys So well deserved!!,777690844807700480,0
800,TheDanielsSk,Battle of the Bastards pfvrrrr #Emmys,777690844770041861,1
801,msAlezhiCabrera,Se viene lo bueno #Emmys,777690844962787329,3
802,cuatrobastardos,MEJORES ACTORES INVITADOS EN DRAMA: Hank Azaria y Margot Martindale #Emmys #Emmys4B,777690844920942593,2
803,LisbethHanna,Margo Martindale! #mygirl #Emmys,777690844711223296,2
804,TaynaYagami,#Emmys quero Game Of Thrones pelo amor de deussss,777690845302628352,3
805,Sidrat2011,Winter is coming! Game of Thrones is my choice for best drama series in @CoxComm's #Emmys poll! https://t.co/PcyoB92ony,777690845210443777,3
806,sincelouis,rainha de oitnb #Emmys https://t.co/PRT4uiHFMx,777690844556034050,3
807,ItsScooterDuhh,I bet this STILL end up being about beyonce!!!!! #Emmys,777690845914988544,3
808,CyberAnonymous,"CBSNews: RT CBSNewsEnt: Patton Oswalt makes touching reference to late wife in #Emmys speech: ""The other is waitin… https://t.co/VfIYScSYy8",777690845612998657,3
809,format1on,Como as pessoas confirmar Beyoncé e ela na verdade não vai? #Emmys,777690846233845760,3
810,VickyChimento,"¡Bien, un premio para #TheAmericans! #Emmys",777690848037306368,1
811,aliasociety,VEM GOT PORRAAAA #Emmys,777690848343498752,1
812,KateSpencer1,The Americans should win everything since it took so long for nominations. #Emmys,777690848372727812,3
813,starwars531,@KeyAndPeele Great work  boys! #Emmys #Emmys2016,777690848439967744,0
814,LBright94,"Like, I'm about to hit 10,000 steps. If I hit my goal before 8pm, I know who to blame. #Emmys #EmmyForMaslany",777690849073180673,3
815,Senhora_Queen,Seria meu sonho???? https://t.co/vBXzi31zrx,777690848314155008,3
816,malcbenn,Emmys out! Night! #Emmys,777690848943366145,1
817,danni_burgh,ACTRIZ DE REPARTO MARGO MARTINDALE TE AMO #Emmys,777690849178071040,2
818,Melqqqq,"VEM BATTLE OF THE BASTARDS
#Emmys",777690849035550720,1
819,ManuelReis,Como é que o final de Good Wife foi nomeado para isto? Não sei. #Emmys,777690849035640832,3
820,tawhoslf,será q got vai levar? #Emmys,777690848905596928,1
821,spidevrman,VEM MR ROBOT OU GAME OF THRONES #Emmys,777690849400483840,1
822,CyberAnonymous,"CBSNews: RT CBSNewsEnt: Patton Oswalt makes touching reference to late wife in #Emmys speech: ""The other is waitin… https://t.co/K5KCE0b4ab",777690849325027328,3
823,yoncehot,"beyoncé já sabia que ela não ia ganhar, por isso nem foi #Emmys",777690849383768064,3
824,jungleoflooks,"battle of the bastards e hello friend ! 
#Emmys",777690849757040640,1
825,wishdebnam,tenho quase certeza q tatiana vai ganhar. por mais q eu esteja torcendo pra viola e queira mt q ela ganhe sei q tatiana merece tbm #Emmys,777690849966686208,0
826,isalilsand,#Emmys2016: #JaneKrakowski is the new grape vine at the #Emmys #RedCarpet #EmmyAwards #EmmyAwards2016 https://t.co/4VcroyjDA3,777690848880242688,4
827,kisschava,Viendo Los #Emmys 😊🍸🚬,777690850637721600,1
828,YouLoveKimber,"So wait, did #Beyonce ask in advance if she won before even re-routing her jet? 😂😂😂 Shame on #Emmys for even teasing her appearance!",777690852407644160,3
829,catchyourwill,"Guys, what if Fellowes takes it? #Emmys",777690852558835714,1
830,GladiatorNprada,#TheAmericans really needs to win #Emmys,777690852462358528,3
831,ErikMAdams,I apologize for all of the exclamation points I'm going to use during the categories in which The Americans is nominated. #AVCTV #Emmys,777690852621684737,3
832,noahvirgerror,BATTLE OF THE BASTARDS!!!!!!!!!! #Emmys,777690852516913152,1
833,Otimista__,Isso é demais para o meu coração  #Emmys,777690853162749952,1
834,Diario_ElTiempo,Hank Azaria y Margot Mantindale ganan el premio a Mejor actor o actriz invitado en una Serie de Drama #Emmys,777690853276000256,0
835,Invisibae,Booooooooooooooooooooooooooooo https://t.co/6obOVu00e0,777690852982489088,4
836,starksliam,ta me dando aquele frio na barriga #emmys,777690853473214464,0
837,a_ditk,CHARACTER ACTRESS MARGO MARTINDALE! #Emmys,777690853024403456,2
838,camilammacedo,VAMO BATTLE OF BASTARDS #Emmys,777690853372485632,1
839,frankdecaroshow,Keegan-Michael Key can collect his congratulatory hummer from me any time in the next twenty years. #Emmys,777690853527609344,3
840,thinnchrispy,Matt told Jimmy exactly what I thought after his loss 😂😂😂😂 #Emmys,777690853779255296,1
841,davidlonan,EU EU EU EU NAO TO BEM ANDA LOGO PFVR #EMMYS,777690853506740225,0
842,iDebanik,#Emmys great,777690853582057473,0
843,mixdeseries,#raydonovan #emmys #emmynawarner https://t.co/NHwx8EaRB6,777690852667879424,0
844,_biafs_,GOT GOT GOT GOT GOT GOT GOT  #Emmys,777690854014193664,1
845,amaisingkristen,BATTLE OF THE BASTARDS PLS PLS 🙏🏻 #Emmys,777690853808730113,1
846,Ethan_Anderton,"Would have loved to see DOCUMENTARY NOW! win and Emmy, but KEY &amp; PEELE also deserves some love too. #Emmys",777690854282498048,3
847,_raphaelaleite,batalha dos bastardos já ganhou né #emmys,777690854005805056,4
848,guillehormigo,"Ahora sí, empiezan las GoT 's rules #Emmys",777690853846507521,1
849,Keiko2Lucia,GoT Got GoT GoT #Emmys,777690854529957888,1
850,albz,"I think it's time I come clean. I created the show the show ""Mom."" #Emmys",777690854173642752,3
851,SCARETRXYE,VAI MR ROBOT #Emmys,777690856673468416,1
852,tayxphile1013,"I can't look at Margo Martindale with a straight face after watching #BojackHorseman, haha. #Emmys",777690857088638977,2
853,EvDayaLilSeth,"Okay, I went w/ @samesmail Mr. Robot for this even though I love The Americans because he writes ALL of them! #Emmys2016 #Emmys #EmmyAwards",777690855821934592,0
854,TepidSharkTake2,"So aside from different networks, the difference between #AmericanCrime &amp; #AmericanCrimeStory is made up crime vs. real life crime? #Emmys",777690856937496576,3
855,famoustwink,"VAI, GAME OF THRONES #Emmys",777690857717768192,1
856,louiegrendon,"I feel like only Emmy voters watch Ray Donovan, right? No one is REALLY watching Ray Donovan. #Emmys",777690857285615616,0
857,anadavis_,GoT tem que ganhar essa #Emmys,777690858175008773,1
858,ShahrazadBoe,"New Song of Moroccan Amazing▶💃🎊💃https://t.co/LERzl84020
#IhabAmir 
#Emmys 
#GoKnowControl 
#ThisIsNotTheEndOfOneDirection 
#XFactor 😄😄",777690858036596736,3
859,ZackFord,"Oh neat! I didn't realize Horace and Pete had been considered for nominations. Great show, hidden gem from Louis CK! #Emmys",777690857814097920,3
860,AFortiori,"""I love you, Detroit!"" - @KeeganMKey 🙌 #Emmys #Emmys2016",777690858237730816,0
861,Stephannisuarez,JUEGO DE TRONOS POWER BITCHES #Emmys  #Emmys2016,777690858208501760,3
862,historyofjess,It’s time to show how good you are #Emmys. Give them all to The Americans.,777690858153967616,3
863,kairon_villa,Boss. https://t.co/v5KWdGhjDt,777690858065887232,4
864,cohenica,Let's have some fun? !  Find my name here    https://t.co/Qp1Pzn6ZdZ https://t.co/VH9NcWhW2R,777690857797513220,4
865,JoeWhitehead7,So psyched for #ThePeoplevOJSimpson &amp; #GreaseLive both winning #Emmys tonight!! @ACSFX @GoGrease,777690858795786240,3
866,dcbrown94,I thought that @GoGrease was probably the best live TV musical to broadcast these last few years. Happy to see the directors win. #Emmys,777690861438107648,3
867,terrance_may,"Lmao, yes https://t.co/oIoPQsd81f",777690861865930752,3
868,KarmaKaiFilms,Margo is really good on @TheAmericansFX.  One of my top shows.  #Emmys,777690858757902336,3
869,bIackboyfIy,They really did. https://t.co/uKG8gfA1p9,777690858657312768,3
870,BeyHartman,JA PODE CANCELAR O #Emmys,777690860930695170,3
871,heyjdey,"#TheAmericans forever and for everything, idc idc idc. #Emmys",777690859638706176,3
872,GoodFellaAZ,What is a key and peel? #Emmys,777690860859240448,3
873,DCRobTV,Very exciting to be watching the #Emmys as a Television Academy Member https://t.co/iuK0IU9WwZ,777690858883723268,3
874,luizawho_,GENTE GAME OF THRONES NÉ PELAMORDIDEUS #Emmys #EmmyNaWarner,777690860825747456,3
875,andactionnow,Unable to can. https://t.co/SIugKkt78a,777690862310391808,3
876,Jazneeet,#battleofthebastards pls #Emmys,777690861467373568,3
877,__alasca,#Emmys BORA GOT,777690859374571520,1
878,BER0000,Matt and Jimmy are hilarious 😂😂😭😭😂❤️ #Emmys  https://t.co/4tjyzAljKb,777690859097776129,4
879,C_L_Ash,#got #Emmys,777690861744234496,1
880,dxblashine,GOEA AME THOEONES POR FAVOR BATTEKE OF BASTARAS  #Emmys,777690861492666368,3
881,j_s_l,Key and Peele well deserved win to two of the funniest guys around #Emmys,777690861400457216,3
882,saveferris,FAMED CHARACTER ACTRESS ON THE LAM AT THE EMMYS MARGO MARTINDALE! #Emmys,777690863128358912,2
883,catastrophe_is,Gane of Thrones batalha dos bastardos  #Emmys,777690863371710465,4
884,nSquib,"Susanne Bier? The Night Manager??? Over OJ, the show of the year?????? JFC #Emmys",777690863426076672,3
885,veneceos,I choose the Americans for best drama series in @CoxComm's #Emmys poll! https://t.co/pCtVsrYRnE,777690861949820929,3
886,T_Money84,#GoT better win #Emmys,777690861643661312,1
887,SuicidalVicky,Ahora se viene lo bueno #Emmys,777690862075703298,3
888,ItsMeNersho,Esto es de #GameofThrones si o si #Emmys,777690865745690624,4
889,AytannaOliveira,#Emmys,777690865837965312,1
890,Lucy_ofMidgard,You go @samesmail #Emmys,777690866362093568,3
891,MeganKnotts,Where was Kanye to bitch? https://t.co/f9Uo3yUmzS,777690862159626240,4
892,solsihh,Ahora empieza la bueno en los #Emmys,777690865003335680,3
893,marcosilvavini,Meu deus a batalha dos bastardos #Emmys,777690866123206656,4
894,ta_mcknight,"I love Rami Malek and his beautiful, but slightly creepy smile. #Emmys",777690866206990336,0
895,ViraGunn,I really love the design of the stage this year. I think it might be the best one they've ever had. #Emmys,777690866395873282,3
896,victoria_deon,É AGORA QUE BATTLE OF THE BASTARDS VAI GANHAR #Emmys,777690863002607616,1
897,NYDNgossip,We loved Practical Magic! #Emmys #MargoMartindale,777690865154269184,1
898,tymadisonmom,#StrongerTogether #ImWithHer #HillarysHealth @timkaine #ClintonsMemory #Emmys #Clinton #ClintonFoundation https://t.co/49gProstFG,777690861970698240,3
899,BoniniGirl,Margo Martindale is an amazing actress! #Emmys,777690866882383872,2
900,_ChristineNatal,Y'all I'm still not over @DowntonAbbey 😭😭😭 #Emmys,777690866379005952,3
901,DreamyUnicorn5H,Chocada que a Tina não foi indicada para melhor atriz dramática  #Emmys https://t.co/yr8U0YKKWW,777690861949902849,3
902,GarrickPttrsn,About damn time y'all gave @MsSarahPaulson her Emmy 👏🏽👏🏽👏🏽 #Emmys,777690866810888193,3
903,GeekDelCine,Ahorita en #LaHoraNacional @ModernYeezus y yo hablaremos de todos los ganadores de los #Emmys,777690866685059072,4
904,kingchaos371,Huge @TheEmmys win for @KeyAndPeele @KeeganMKey @JordanPeele So great! Now it's time for an #Oscar for @KeanuMovie #Emmys #BingeWatchers,777690867645583360,0
905,Fortitude1913,Why am I so bored? I'm never this bored watching @TheTonyAwards! #emmys,777690866123153409,1
906,ibookthief,BATTLE PF BASTARDS QUE MANERA DE SUFRIR CHABON TE LA DEBO #emmys,777690867025010688,1
907,racheldavidso,If game of thrones doesn't win.... #Emmys,777690865560981505,3
908,bren_pali,Confirmed: No @Beyonce 💔😔#Emmys https://t.co/qb33G5bcV9,777690865061933057,3
909,klaustrofobica_,OH MDS  #Emmys,777690867050086400,1
910,sopitas,¡Se vienen las categorías de Drama en los #Emmys! https://t.co/mLDWeosXOI https://t.co/IEAMPz9xhd,777690862826303488,3
911,olusca_,vamo mr robot #Emmys,777690867444449280,1
912,barblarrat,alá primeiro premio pra The Americans bom sinal #Emmys,777690869285720064,1
913,hughesa03,missing the #Emmys 😢,777690864952881152,3
914,pleasuremotors,Will never get enough of Character Actress Margot Martindale #Emmys,777690865418383360,2
915,nelsontheroad,VEM BATTLE OF THE BASTARDS PORRAAAAAAAAAAAAAAAAAAAAAAAAAAAAAAAAAAAAAAAA #Emmys,777690865192038400,1
916,lalocadelosfavs,#Emmys,777690869612896256,1
917,olucasfreires,A musiquinha que dor no coração deu vontade de perder a memória só pra rever Downton Abbey.  #Emmys,777690869457715200,3
918,Ivorycristina,Sam better win #Emmys,777690870128586752,4
919,unicornialauren,VEM GOT #emmys,777690869772193793,1
920,cami_notcami,BATTLE OF THE BASTARDS #EmmysPorWarner  #Emmys,777690869721890816,1
921,dianedeps,GAME OF THRONES #Emmys,777690870145572870,3
922,Johnmarc,Mr robot come on  #Emmys,777690870350872576,1
923,HugoGloss,"O que vocês acharam da vitória de ""Grease: Live!"" sobre ""Lemonade""?! #Emmys #EmmyNaWarner",777690870120415232,3
924,soundofsam,Yay! https://t.co/wPZjj5J1Im,777690869570768896,3
925,Ao3Shadow7,Game Of Thrones! Common! #Emmys,777690870032269312,3
926,cosima666,BATTLE OF THE BASTARDS #Emmys,777690870376259584,1
927,ThatsSooJalen,Beyoncé really brought us a damn piece of high art and this is how y'all treat her. Once again smh #Emmys #Lemonade https://t.co/ec0g4yzKOm,777690864940351488,3
928,jonsnous,A BATALHA DOS BASTARDOS MERECE GANHAR PORRA #Emmys,777690870099374081,1
929,vsaoficial,Melhor Ator Convidado em Série de Drama: Hank Azaria - Ray Donovan #Emmys2016 #Emmys,777690870036434949,0
930,bonelesside,VOLTA PRA VOZ DO RAMI QUE FOMOS TODOS ABENÇOADOS #Emmys,777690865942794240,1
931,ChadLivengood,Jeb! (Bush) appears as Uber driver in #Emmys cameo | via @TheHill https://t.co/c1QKmDrMnP,777690866089496576,4
932,AlejaCetina,Tal vez esta será la buena para GOT #EmmysPorWarner #Emmys,777690870770393088,1
933,arayyay,my exact expression right now. who cares about any of this. https://t.co/2RXu5dVFOc,777690869503762432,0
934,karynaharleik,"Variety Sketch Series
| WINNER | 🏆
Key &amp; Peele

#Emmys #Emmys2016",777690870430650368,3
935,DivulgacoesLisa,O CAÇADOR DE FADAS https://t.co/tQkzQCFW76 #Emmys #Fantástico #CerimoniaDeEncerramento #PanicoNaBand #Fantástico https://t.co/QiKlVjHSOI,777690869923246081,4
936,shotgunconcepts,Want a list of trashy liberal social issues Hollywood wants to shove down our throats? Watch an awful awards show like #emmys or #oscars,777690870594363392,3
937,lancekeebler,House of cards got like all the nominations how did it not win??? #Emmys,777690869482655744,1
938,mxtheuss,aquela é a avó da hannah montana??? #Emmys,777690873513598976,3
939,FujiwaraArmbar,The #Emmys are fun to watch though. These people are so in their own little bubble and out of touch with the real world. It's hilarious.,777690868836728834,3
940,anaprieto,Yo no voy a los #Emmys porque no tengo nada para ponerme.,777690869193400320,1
941,shraderlarson,GAME OF THRONES !!!! #Emmys,777690873257684992,3
942,bravoplanbe,WELL deserved. You did great work this year sir. @LastWeekTonight #Emmys https://t.co/EZDeQmFYRw,777690873068818432,3
943,nicolasbusa,"Tô muito cansado pra tentar acompanhar os #Emmys... Espero que role um resumão do @AhNegao amanhã, pra me salvar",777690874058797056,3
944,karennmicaela,"VAMOS GOT
#Emmys",777690874381754368,1
945,amnesiazain,BATALHA DOS BASTARDOOOOOOOS PQP  #Emmys,777690869566697472,0
946,lucas_8886,"Character-actress Margo Martindale levou, quem assiste BoJack conhece hahaha #Emmys",777690874704781313,2
947,redtubullock,eu esperando a categoria de drama #Emmys https://t.co/V52NKiq7SX,777690868371320832,0
948,heeyDaniele,"Ai Gente, to nervosa! #Emmys",777690870447480832,3
949,Walkin_mn,Battle of the bastards o hello friend #Emmys,777690875837112320,1
950,mwranos,drama até q enfim #Emmys,777690875442978816,0
951,micnic1291,IS IT TATIANA MASLANY TIME YET?!?!?! #Emmys,777690870783078405,0
952,Kim0Br0wn,"Battle of the Bastards!!!!  

#Emmys",777690877888045056,1
953,AmyAlex63,See #demo of @TheEmmys voters. https://t.co/moKsam5Wc4,777690875300311041,0
954,EnyPaez,Game of thrones all the waaay #Emmys,777690878026670080,3
955,Giomanky,Margo ganó por su actuación en #BoJackHorseman!? #Emmys,777690874989809664,0
956,annecberkeley,How can Azaria and Martindale awards have been secret if they are the very next presenters?  #Emmys,777690874444742656,3
957,gameof_series,COME POSSO SCEGLIERE TRA DOWNTON ABBEY E GAME OF THRONES. #Emmys #rai4,777690874134269952,3
958,thankslerman,"GAME OF THRONES MI PARE OVVIO 

#Emmys #Rai4",777690878169284608,3
959,wtfnogitsune,VEM MR. ROBOT #Emmys,777690874637586432,1
960,xxD7m,"اباجيل - سكوتي 🔥🔥
#Emmys",777690874318819328,3
961,NicoCarnev,Los #emmys una vez terminada la participación de los pibitos de Stranger Things. https://t.co/oN6Au87vfc,777690873899417600,3
962,Alice_arc,I'm jealous of everyone watching the #Emmys right now.,777690874729857024,0
963,TYFofficial,FYI @DowntonAbbey will never be present at the #Emmys again. #TYFEmmys https://t.co/763lzI7GkV,777690878106341376,3
964,angelstar2,Hubby just said (about Rami ) ain't that the guy from #twilight ? I trained him right ya'll #Emmys,777690874964799488,0
965,Jonnytown,@Beth_Tris a qué hora @britneyspears en los #Emmys ? #LypsincForYourLegacy ?,777690875321159680,3
966,brookenlullaby,MR ROBOT TEM Q GANHAR #Emmys,777690877548490752,1
967,lawdood,Peels?  https://t.co/SNYrTOqeeK,777690878080978944,3
968,sensatebane,MR ROBOT VAI VAI VAI  #Emmys,777690875958816768,1
969,flaviaggabriel,A categoria mais difícil p mim é atriz de drama. #Emmys,777690878089502720,0
970,stephsfrancis,Is @TheAmericansFX  good? #Emmys,777690877657513984,3
971,thekrissychula,GAME OF THRONES!!! BATTLE OF THE BASTARDS DESERVES SEVERAL EMMYS #Emmys,777690878265753600,1
972,RoamingRebee,Loki showing how he feels about the #Emmys. https://t.co/5BUMb4PwnC,777690878580133888,3
973,aaron_bolton_,GAME OF THRONES SNAGGED THAT #Emmys,777690878873862144,3
974,theclobra,I'm shaking in my seat hoping Michael J. Fox wins. #Emmys,777690879070875648,4
975,tracytran,"#Emmys Winner and Character Actor, Margo Martindale.",777690879234637825,2
976,ro_haddad,Começou o drama #Emmys #EmmyNaWarner,777690879163305984,0
977,GoodPressShanno,This is a tough category #Emmys,777690877711912960,0
978,AranzaSolano,Ahí va el primero de la noche GOT por supuesto  #Emmys,777690878236254209,1
979,josueperini,Torcendo para #MrRobot no #Emmys #EmmyNaWarner #Curitiba,777690881675624448,0
980,alishagaines,black faces. white writers. #Emmys,777690882078232576,3
981,GonLoseYoWife,LAVERNE WHY DIDNT YOU LIE I WAS ROOTING FOR YOU WE WERE ALL ROOTING FOR YOU #Emmys https://t.co/sqI8pEuqcu,777690878005522432,3
982,iihsxii,"Lol, he made him cry 😂 #Emmys https://t.co/UMTdv36MS3",777690877951086594,3
983,grmindyjean,"Congratulations, you won an award. All we're going to let you do is present the next award. 🤔 #Emmys",777690877724680193,3
984,AndrsFelipeBaq3,Ya me of drone #Emmys,777690879523979264,4
985,achibazan,Vamos #GOT #emmys,777690882132758529,1
986,lucasdras,The Battle of Bastards vai ganhar #Emmys,777690883055550464,1
987,lorranylimas,VAI GOT VAI MR ROBOT #Emmys,777690882904559617,1
988,pizzadadlives,It is sooo good!! #veep #hbo https://t.co/DyjW8dlvrH,777690880878714880,3
989,ItsKirG,TIENE QUE GANAR GOT #EMMYS,777690882241859585,1
