,screen_name,text,tweet_id,cluster_pred
482,Mudifer,#Pakistan puts all her issues aside &amp; goes to #UNGA with single point agenda ; #Indian #massacre in #Kashmir !! #Emmys #2030Now @sageelani,777690741229416448,1
483,QuelBPorto,"Ai, é agora! #Emmys",777690741422317568,1
484,frantasticflame,I love James Corden so much why did Grease Live win? #Emmys @JKCorden,777690741774704640,1
485,purficklyclean,Character Actress Margo Martindale &lt;3 &lt;3 &lt;3 #Emmys,777690743158693888,0
486,Daniela__Rock,*Esperando que tatiana maslany gane un Emmy* #Emmys,777690743615873024,1
487,Dreito_Lara,"Thomas Kail: You've got the Tony, now the Emmy. When is the @HamiltonMusical movie coming to get the Oscar? #Emmys",777690743674642432,1
488,ac_bitter,"""Veteran character actress Margo Martindale..."" #BoJackHorseman #Emmys",777690743498477568,0
489,JaylenLaunza,😍😛 https://t.co/HyqOUkLmvt,777690743892684800,1
490,brentcarcher,Tambor shaking Hale's hand made my night. #Emmys #ArrestedDevelopment,777690743947362304,1
491,HJMP_MX,El_Universal_Mx: RT Univ_espect: Donald Trump es tema recurrente en los #Emmys https://t.co/m3NcOvyt73 https://t.co/Yr729C8nrO,777690743800561664,1
492,JackWBryant,"As the kids would say, Rami Malek tho. #Emmys",777690743624331264,1
493,CJMasessa,"Reg E. Cathay should've won just for the way he delivered the line ""You're a motherfucker, Mr. President."" #Emmys",777690744136036352,1
494,BraindamagedFr,Meilleur acteur invité dans un drama #Emmys Hank Azaria pour #RayDonovan,777690743724990464,1
495,Elit_e_LoQuence,~`Damon looks amaaaaazing 👀👀👀 #Emmys`~,777690744509300737,1
496,MonroeAlabama,Is this a #HoC solo category?!  #Emmys,777690744844853249,1
497,jsonwho,Margo Martindale for all awards!! #Emmys,777690745511620608,0
498,mauhvado,rami malek #Emmys https://t.co/XjGtjhpinv,777690744672759810,1
499,camiciacoibaffi,Wooh for character Actress Margot Marindale #BojackHorseman #Emmys #Rai4,777690745654370304,1
500,la_sol_soleil,Ay que se ve rico Rami #Emmys,777690748238127104,1
501,TreasurHooligan,SCREW GAME OF THRONES Michael J Fox has to win Idec #Emmys,777690748351311872,1
502,ghprz_,Ok todo para Game of Thrones pls #Emmys,777690748527476736,1
503,Frhfd1Frhfd,"4sy
#من_منطلق_خبرتي_بالحياه
#اروع_ما_تراه_عينك
#Emmys
#لهجه_عربيه_ودك_تتعلمها https://t.co/mTHYWlC8V5",777690747613110272,1
504,ChalkAndCarrots,"#Emmys: ""Grease: Live"" wins directing for a variety special https://t.co/4R10rKxXUE https://t.co/gqWzm0SM8W #film… https://t.co/dGkbXwIifq",777690747441127424,1
505,iparisday,começou drama!!!!!!! #Emmys,777690748753997824,1
506,PerlaSoreim,#Emmys #EmmysPorWarner #Emmy2016 Glorioso #MattDamon https://t.co/jyChT6qRk3,777690749160697858,1
507,cakecyrusz,Eu vejo o Rami e não consigo não lembrar de Until Dawn desculpa #Emmys,777690749144010752,1
508,One_Who_Matters,Oh my God... Drama category hurry up... #Emmys https://t.co/zdVOCsDXPI,777690748460204033,1
509,LilNoNoKnows,Loooove Abigail Spencer's dress. #Emmys,777690749487894528,1
510,_yved_,I want my award to be televised 💁🏽💁🏽#Emmys,777690749513175040,1
511,MsLierre,I just heard a peculiar sound. I think it may have been everyone in the PDX area sighing with relief that Portlandia didn’t win. #Emmys,777690749823365120,1
512,rutesantannax,#Emmys ❤,777690751710953472,1
513,citizenjaney,character actress margo martindale. national treasure. #Emmys,777690751861940224,0
514,dlboylan,Character actress Margo Martindale!!! #Emmys #TheAmericans,777690751903813632,0
515,auntieyonce,is anyone really surprised that a black artist isnt getting the recognition they deserve #Emmys,777690752193146880,1
516,RHAPfan21,Ehhh they're aight. https://t.co/BtBkReByJz,777690751744417792,1
517,TySOTW,.@HankAzaria is also a great poker player. Hell yeah! #Emmys,777690752562241536,1
518,jacj00,Love me some @KeyAndPeele!!!! @TheEmmys #Emmys,777690752088276992,1
519,jeansensitiva,GAME OF THRONES VAI  LEVAR TUDO... JÁ LI A MENTE DOS JURADOS #Emmys,777690752759455745,1
520,cturnip,Margo is a legend in acting and I hope she never goes away. #Emmys,777690752537231364,1
521,cashbacktime,"Now! https://t.co/XZIiWxvQXy Yes, that's DEFINITELY something Shakespeare said. 💀😂 #Emmys https://t.co/iKckvpiOvW #bestbuy #job #np #music…",777690751077609472,1
522,eyesonffire,Winter is coming! Game of Thrones is my choice for best drama series in @CoxComm's #Emmys poll! https://t.co/GTALraV4X7,777690752709120001,1
523,SilviaB_08,"Bene,siamo al drama e l'audio in inglese ancora non è tornato..grazie ancora, #Rai4 !😠 #Emmys #Emmys2016 #EmmyForMaslany",777690752314961924,1
524,carissinha,"Categoria injusta, já que todos os convidados foram incríveis. #Emmys",777690752927358977,1
525,bonfimer,É AGORA #Emmys,777690753455849473,1
526,andradiego_,ai que saudade de the good wife #Emmys,777690753401315328,1
527,drgoddess,Thank you! It caused me to angry-tweet at @jimmykimmel for 30 minutes straight! I'm STILL mad. https://t.co/eaNoW64I8o #Emmys #Emmys2016,777690753132797952,1
528,Sspenny1,"Well, I was going to vote for #HillaryClinton but after watching the #Emmys I have to vote for #TrumpPence16 lol!",777690753690632192,1
529,kykyblueeyes,This is my fav gif of alllll time😍 https://t.co/7kRISDAtjG,777690753497702400,1
530,justinbdefense,AI PORRA VAI LOGO #Emmys,777690754407919616,1
531,Sch_Finans,"USATODAY: RT usatodaylife: ""Are you finished?"" jimmykimmel to Matt Damon. #Emmys",777690754223407104,1
532,mrskristinmyers,"Wow @cher, now that's low. Fabricating a picture to make #Trump supporters look racist. Disgusting. Apologize! https://t.co/AAPXuj3Cr4",777690754403622912,1
533,Usuario_Idiota,Esses dubladores são sem graça já até falam spoiler dos ganhadores   #Emmys,777690755238338560,1
534,AndyTweetsStuff,I have seen none of these things! 😬 #Emmys,777690755603193857,1
535,NekoSmall_Lady,"No pos, Hank tambien es genial
#Emmys 
#Emmys2016 
#EmmysPorWarner",777690755917832192,1
536,frederixen_,E eu achando que a Bey ia receber o prêmio fazendo performance de Formation #Emmys  https://t.co/hflai7yc2B,777690755913682944,1
537,SoySkrollex,¿Alguien tiene un zelda para ver los #Emmys? :'V,777690756639109120,1
538,plot_tv,Hank Azaria ganhou  melhor ator convidado em Série de Drama #Emmys,777690756559568896,1
539,LordSamberg,Never expected? They fucking acted together in 7 days in hell.. https://t.co/2X541IqgEC,777690756370669569,1
540,nataliasam1434,#GameOfThrones is a surefire winner for ‘Outstanding Drama Series’ at the 2016 #Emmys. Place your vote with @OSN. https://t.co/GUZQsmLppW,777690756035194880,1
541,Michael_Rosch,No award for The Three-Eyed Raven #Emmys,777690756664418305,1
542,heybeccamarques,agora vamos que vamos né Game Of Thrones. #Emmys,777690757029396480,1
543,TatianaKing,Key and Peele wins for Outstanding Variety Sketch Series #Emmys https://t.co/nPXwcEPmjt,777690754382692353,1
544,LeighLo__,Awesome! I love #theAmericans and #RayDonovan #Emmys,777690757281026048,1
545,Skepacabra,No award for The Three-Eyed Raven #Emmys,777690756647641088,1
546,Nick_Alxander,"Game of Thrones perdio una categoria.
Baia #Emmys",777690757603979264,1
547,implodere,Matt😍 https://t.co/r2WWSaEPN1,777690757134188544,1
548,BigCityJames,Hank Azaria doesn't wear shoes because they make him fall down #Emmys,777690757985476608,1
549,raya_sandra,Pero llega el...Drama. #Emmys,777690760187568132,1
550,leannexmac,YESSSS SHE LOOKS SO GOOD https://t.co/ncxOqVy6Q0,777690760380608514,1
551,viceanglais,So happy to see Character Actor Margo Martindale. #Emmys,777690760812564480,0
552,ChalkAndCarrots,"#Emmys: ""Key &amp; Peele"" wins best variety sketch series https://t.co/4R10rKxXUE https://t.co/kbgSH1botr #film #musi… https://t.co/cpezAzz1RK",777690759432724482,1
553,gordirro,"Alguém dá um vale refeição pra moça no palco ao lado do Mr. Robot, por favor #Emmys",777690760837730304,1
554,natsfashion411,"@YaraShahidi I LOVE your dress. As a 17 year old myself, I appreciate your awareness for looking your age! #Emmys https://t.co/Niw3uSRn3d",777690757960531968,1
555,dchlyd,#Emmys Key and Peele are Emmy winners!  Faith restored after Lemonade lost out.@KeeganMKey @JordanPeele,777690759931817984,1
556,diegomartins,Claire Danes esperando a vez dela #Emmys #EmmyNaWarner https://t.co/4tfreUCatw,777690759692771328,1
557,gameofdrama,VEM OS DRAMA DE GOT #Emmys,777690761315946496,1
558,Vickyt_o24,Proper 👌💯 https://t.co/UCYcDDqb20,777690760909037569,1
559,NeginFarsad,Ramy Malek should do his introductions in the form of a disassociated voiceover. #Emmys,777690761483718656,1
560,FackToeDumb,I wonder if Claire Danes' Donald Trump is water-based. #Emmys,777690761500450816,1
561,sgcabello97,af perdemo #Emmys,777690761986879489,1
562,princesosamuel,#EmmyForMaslany https://t.co/dx1jymgon0,777690761475284993,1
563,DevFull,Character actress Margo Martindale!!! #Emmys,777690762309935105,0
564,cashbacktime,Now! https://t.co/XZIiWxvQXy #KeyAndPeele wins for Outstanding Variety Sketch Series at the #Emmys! 💯 https://t.co/j4QxVsIupK #bestbuy #jo…,777690764704972800,1
565,youngodxz,So faltava Quântico estar lacrando no #Emmys pra ficar perfeito,777690764742692864,1
566,MauraLorgan,Margo Martindale is on TV @morganzetajones! #Emmys,777690764411154432,0
567,MrJohnQZombie,"Translation: ""Bombard people with emotional blackmail, and they will submit to artificial social pressures.""

@THR https://t.co/Ke7uxYPHRa",777690764931235841,1
568,arifiba21,mashable : RT mashablegif: .Lavernecox echoes Jeffrey Tambor's earlier statement at the #Emmys … https://t.co/ZVJOTCInie,777690765040422912,1
569,shumiley,Remember when Vanessa Hudgens' father died and she went out and slayed on live TV that same night? Grease Live deserved it #Emmys,777690765334052864,1
570,theframe,Open space age pod to reveal Margo Martindale and @HankAzaria #Emmys,777690766172835840,0
571,rickysheat,the americans plsssss #Emmys,777690765686439952,1
572,laurenamgibbs,Good old Character Actress Margo Martindale. #Emmys,777690765791297536,0
573,fionak4t3,Same https://t.co/GMveElmhvE,777690765707382785,1
574,viperrob,"If I started getting played off, I'd just sing the rest of my speech matching the piano music 😅 #Emmys",777690767175266304,1
575,ZombieMusicMx,AP_Espectaculos: Variedad de colores y diseños en la alfombra roja de los #Emmys  https://t.co/i11vU2x4hc https://t.co/o2dJH2RMBo,777690766906884096,1
576,cashbacktime,Now! https://t.co/XZIiWxvQXy Beyoncé loses for best directing at the #Emmys: https://t.co/rCyeHObp2p https://t.co/P0CNTrg8kl #bestbuy #jo…,777690769092124672,1
577,MO2luis,#Emmys Key and Peele! WINNER These guys are FIRE!  #ComedyCentral 💘❤❤❤❤👏👏👏👏 https://t.co/yn0XVZ4w1M,777690768718856192,1
578,targaryencool,SENHOR DEUS https://t.co/i4uGNs1lnx,777690769385725952,1
579,NecklacesFash,InStyle: MissSarahPaulson's making a strong case for shoulder pads. 👌 #Emmys https://t.co/PAoriZYaF6,777690769704509440,1
580,LynnetteBenni,LOL! You guys are the greatest! @tatianamaslany @GraemeManson1 @JohnFawcett75 @KevinHanchard https://t.co/lZPgjoIM9n,777690769847119874,1
581,tamy4815,ja comecei perdendo nos coadjuvantes #Emmys,777690769977118720,1
582,unibroward4405,Where he belongs https://t.co/6Dnxj7quZh,777690769637244929,1
583,tracyjust,#Emmys awww god the good wife😫😫😫,777690770547445760,1
584,AnaliaCorreia__,Pra ir dormir feliz com essa foto linda de Kerry e Tony maravilhosíssimos do mundo 😍 Oiiin essa barriga #EMMYs,777690770178502656,1
585,CarltonAbner,Just think - next year at this time all these people will be cartoon frogs. #Emmys,777690770195124224,1
586,bravcla,Hank azaria é um lindo #Emmys,777690770342023168,1
587,BethBricken,"Everytime the People vs OJ Simpson wins, yet another happy around our living room ✨🙌 #Emmys",777690770375602176,1
588,TGVIA,Somehow 'Lemonade' lost to 'Grease: Live' https://t.co/KIbZlV2QoW #Emmys https://t.co/S4N4Vzbywp #Tech #News #Technology #aws #startup,777690770513985537,1
589,romitamborenea,#KristenBell esta tan diviiiina. #Emmys,777690770820173828,1
590,MartinaSancehz,"AY VENGA, QUE PARECE QUE VA LA CATEGORIA DE LENA AHORA DESPUES! #Emmys",777690771222892544,1
591,xlckfs,To só um pouquinho nervosa só um pouquinho #Emmys,777690771440996352,1
592,serenitysay,Rami looking both slight and mighty. #Emmys,777690771814125568,1
593,mafi20_,"Winter is coming! Game of Thrones is my choice for best drama series in @CoxComm's #Emmys poll!
https://t.co/kQzNlYITtp",777690771000586241,1
594,TriviaMail,"Ah, a Margo Martindale. Como adoramos essa atriz! #emmys",777690771759702016,0
595,NecklacesFash,InStyle: QUEENS! #Emmys https://t.co/xxOdDn0ZpR,777690771692593152,1
596,MySweet_Time,JOSH WHAT ARE YOU DOING PRESENTING AN AWARD? I THOUGHT YOU WERE A WENDIGO #Emmys,777690772745297920,1
597,ShigeruNews,Key and Peele :D #Emmys https://t.co/Te7m6U7t8p,777690771722043392,1
598,sscnoemi,URLOOOOOOOO DEVE VINCERE BATTLE OF BASTARDS #rai4 #Emmys,777690772686704641,1
599,wtfjonatto,GENTE EU PODERIA VOMITAR DE TÃO NERVOSA #Emmys,777690772917329920,1
600,taygarien,Winter is coming! Game of Thrones is my choice for best drama series in @CoxComm's #Emmys poll! https://t.co/IuBgRe4xOR,777690772770590720,1
601,UnknownPenguin,Margo Martindale is goddam national goddam treasure goddammit. #Emmys,777690773114327040,0
602,katuketi,"Ganó Claudia, mi soviética favorita. #Emmys",777690772841885696,1
603,MonaLiNYC,"Love me some Margo Martindale...
#Emmys #Emmys2016",777690773043175424,0
604,AppleShowbiz,Guest Actor and Actress in a Drama Series go to... HankAzaria and Margot Martindale! #Emmys,777690773143912454,0
605,JuanCDalmas,"Emilia Clarke, Jonathan Banks, Claire Danes, Kevin Spacey, Game of Thrones. Los que quiero que ganen. #Emmys",777690773588418564,1
606,ScreenReels,Congratulations to the tour de force that is Margot Martindale for her Emmy win #Emmys,777690773684748288,1
607,shergion_,La sceneggiatura a tutti ma non a D&amp;D vi pregoooo #Emmys #Rai4,777690774288887808,1
608,plansgetcomplex,CHARACTER ACTRESS MARGO MARTINGALE #Emmys,777690774225887232,0
609,DaxAdams,The Knick better win a fucking #Emmys,777690775115018241,1
610,santlarents,ESPERO Q GOT GANHE #Emmys,777690774481866752,1
611,time4myopinion,"ever since bojack horseman i always think ""CHARACTER ACTRESS MARGO MARTINDALE"" every damn time lmfao #Emmys",777690777032032256,0
612,riogreyhound,MT: Monitoring POLICE &amp; Federal activity at the #Emmys &amp; additional Federal Operators roll'n to the #emmys  from #SEAvsLA,777690776968925188,1
613,BenRagusa,"So Jeb Bush was funny and Louie Anderson and Aziz Ansari won? Yeah right... wait, WTF? #Emmys #Jebexclamationpoint #Aziz #LouieAnderson",777690777128435713,1
614,Sanniel,But Allison Janney in Master of Sex is a gift we don't deserve. #emmys,777690777443000324,1
615,harIeyzqueen,eu vou fingir que eu não vi o Lemonade perder viu gente #Emmys,777690777631727617,1
616,sucrelove,"DRAMA
marina joyce to torcendo muito #Emmys",777690777556291584,1
617,thefilmtemple,"THE AMERICANS vs. a lot of other stuff, imo #Emmys",777690777711366145,1
618,AnneMShearer,Game of Thrones Battle of the Bastards for this one. #Emmys,777690777941970944,1
619,kelly_streets,character actress Margo Martindale! #Emmys,777690778143522820,0
620,Bawsic,91 and still slaying #blackdontcrack https://t.co/X4gLvbyukF,777690777652690945,1
621,OreosOnPizza,Hello creepyboy with creepyface #Emmys,777690778244096000,1
622,iRikahi,Rami and Carly #MrRobot #Emmys https://t.co/wKvLyBwQ4M,777690777875013632,1
623,Aru_cha,"Vengan a comer a casa, les hago milangas 😍 #Emmys https://t.co/HYcVwtGeMZ",777690776742551552,1
624,PSawyerSchue,Man I Need To Rewatch House Of Cards. Friggin' Netflix &amp; Their Once A Year Witchcraft. #Emmys,777690778856525824,1
625,nacarpe,Matt Damon was hilarious! #Emmys,777690778722144256,1
626,MdyeaminSarker,mashable : RT mashablegif: .Lavernecox echoes Jeffrey Tambor's earlier statement at the #Emmys … https://t.co/JPXHRWBNbB,777690778248343556,1
627,lindseymichele9,"what are these ""variety"" awards?? it's comedians. just call it comedian award 👌🏼 #Emmys",777690778537689088,1
628,joaoi,não lembro minha aposta nessa #emmys,777690778810417153,1
629,sasinshort,I'm very fond of both Margo Martindale and my old boss who looks like Margo Martindale. #Emmys,777690778646745089,0
630,PamelaAnnBerry,Same reaction here 😊 https://t.co/uvSda3u355,777690778713722880,1
631,MwenReleNaomi,You mean none of the 5 actors from house of Cards won?? Jesus #Emmys,777690779116572673,1
632,Michael_Vasanth,IMDb: Here are all of tonight's #Emmys winners (updating live): https://t.co/RMRprIoQJQ https://t.co/0XQIKgGSYY,777690778919469056,1
633,tim7white,@BoJackHorseman character actress #MargotMartendale #emmys,777690779041095681,0
634,xxD7m,"رامي مالك 😍😍
#Emmys",777690779674415106,1
635,phervans,The Queens!👑 #Emmys https://t.co/7fbCeztzKy,777690778474799104,1
636,ItsJohnlockHell,💃🏽💃🏽👏🏼👏🏼👏🏼👏🏼 YASSSS https://t.co/feD5NS3GYk,777690779716313088,1
637,andres_twr,"Grrr 🍑🔥La cola de @SofiaVergara. 👌
Es toda mi opinión al respecto.  #Emmys",777690781524066304,1
638,conniengh,Yeeeesssss 🙌 #Emmys https://t.co/FMi3PWXYX7,777690781444300800,1
639,_bpolar_,FATE. TACERE. GLI. INTERPRETI. ITALIANI. #Emmys,777690781616332800,1
640,denisetx,Sherlock for Best Movie! #Sherlock #Emmys,777690781821710336,1
641,LoveLiv____,"Ayeee that Detroit shout out. #Emmys 

Love ya too.",777690782090211328,1
642,BreakfastClaire,Thank you for the kevin spacey ad. https://t.co/nXngsMtfJI,777690781951852544,1
643,jorgenavarijo,.@LastWeekTonight con John Oliver @iamjohnoliver se lleva el premio a Mejor Talk Show de Variedades en EU #Emmys. https://t.co/4BAiAhJOK9,777690781503021056,1
644,Alannister27,Que hermosa foto. https://t.co/Do4tf7xht5,777690782362853376,1
645,5demayode1988,"Got va a ganar toda vaina, guarden el tuit #Emmys",777690782253850625,1
646,LuuanRamos,Melhor roteiro é de Mr Robot né #Emmys,777690782492925952,1
647,CobyJo,@kylielizzybethh fellow god &amp; goddess https://t.co/hh2tJ1mgYM,777690782488629249,1
648,andyaug84,@boxpopsite categoria drama: vai começar o Game Of Humiliation... #Emmys,777690782597808128,1
649,Michael_Vasanth,"IMDb: Who would win in a fight, Heimdall idriselba, or Loki twhiddleston? #Emmys https://t.co/BIBBZannPx https://t.co/MQ784Rtrno",777690783096905728,1
650,MyInkFlow,The directors of Grease Live better join the witness protection program because the Beyhive is not happy 😂 #Emmys,777690783503650816,1
651,victory_manual,@KeeganMKey  @JordanPeele   biiiiiiiiiiiiitch!  #Emmys,777690783126163458,1
652,alejandrobrien,RAMIIII AJSJSJKSKS #Emmys,777690785336717313,1
653,InSUBs,Moe de The Simpsons e Character Actress Margo Martindale no palco. #Emmys,777690785613549568,0
654,NecklacesFash,InStyle: QUEENS! #Emmys https://t.co/xxOdDn0ZpR,777690785559052289,1
655,TaylarAnne,🙌💃😁 at the fact that @KeeganMKey just gave a #Detroit shout out in his acceptance speech. #Emmys,777690785714089984,1
656,builtlovato,A avó da Hannah montana #Emmys,777690785936510976,1
657,karlamancera,Alguien sabe que hace Walter Mercado en los #Emmys?? 😕 https://t.co/4kVYKtZn66,777690785965707264,1
658,KowVarner,I get all kinds of excited when I hear the theme music to Game of Thrones. #Emmys,777690785873485825,1
659,n_narvalia,Character actress Margo Martindale. #Emmys,777690786242723840,0
660,blurryturner,"AMEM
RAMIIII  #Emmys",777690786259472384,1
661,Graddakh,vai got #emmys,777690786410496000,1
662,iRUNx_LA,He knew Beyonce should've won! https://t.co/nfy4OccRch,777690786028724224,1
663,kamikazekn,#Emmys cada novo tweet um berro,777690786381107200,1
664,itslaurk,Love @ItsRamiMalek! #Emmys #ElonEmmys,777690786590760960,1
665,Emputecida,"BEM QUE A BROCHU PODERIA ANUNCIAR A TAT 
#EmmyForMaslany #Emmys",777690786192318464,1
666,juandavid2506,Ya empezamos con GoT #Emmys #EmmysPorWarner https://t.co/XyQvarvq1J,777690784468533248,1
667,sarahwarn,"Haven't watched a lot of Key and Peele, but Peele as played great guest characters in so many other shows #Emmys",777690787270098944,1
668,Mrohnoes,Dunno who's gonna win for Drama writing #Emmys,777690787148472321,1
669,thwnderbird,"VAMOOOOOS 
#Emmys",777690788109152256,1
670,JaviRods,Rami Malek representando Mr Robot #Emmys,777690789589712896,1
671,potenspuella,"Come on, #GameofThrones! #Emmys",777690789430386688,1
672,dd9000,"Cable News has 24x7 hrs to fill, isn't in same news universe as teams working for Jon Stewart, John Oliver https://t.co/TQOBVoofYN",777690790130614272,1
673,KMe_ki,Margo Martindale won for The Americans! Glad The Americans won but I don't even remember her being on this season #Emmys,777690790076100608,0
674,ConciertosEcu,When Ross met Eleven at the #Emmys. https://t.co/4Kas78doaU by @vine via @c0nvey,777690790130806785,1
675,VictorMGonz,WHAT'S WRONG WITH YOU PEOPLE #Emmys https://t.co/Yfyg0aWTQe,777690789262553092,1
676,robertbonx,"DRAAAAMMMAAA, oh wait. It's fucking Game of Thrones again.  #Emmys",777690790084550656,1
677,CelesteKatzNYC,Character actress Margo Martindale wins; @BoJackHorseman rejoices. #Emmys,777690790432743424,0
678,cmondepp,GAME OF THRONEEEES #Emmys,777690790759895041,1
679,KaraRutkinLV,I had no idea who Rami Malek was until about a week ago but now I think it's imperative I date him. #Emmys #swoooon,777690791166693376,1
680,danielofthrones,Hank Azaria! Un grande Cochran. #Emmys,777690790986481664,1
681,mlstagg,So the #Emmys is like the opposite of the #Oscars. Minorities and LGBT nominated and winning left and right.,777690791003193345,1
682,ellieboren,Why didn't they introduce her as Noted Character Actress Margo Martindale?? #Hollywoo #Emmys,777690790885752832,0
683,BlackEstar11,Watching the #Emmys is a good homework procrastination reason if i do say so myself,777690790436798464,1
684,TheSpaceBar,"Lots of fury on the Twitters about GREASE beating Beyonce for directing. It's simple: if in doubt, vote for the live production. #Emmys",777690791414079488,1
685,khushizjm,Ohmygod stunning😍😍 https://t.co/rJI9G9zKo3,777690790948642816,1
686,ramblingfilm,Come on GoT..#Emmys,777690791472799744,1
687,dani_pitter,Drama time!! Come on Maslany!! #EmmyForMaslany #Emmys,777690791359619072,1
688,mauro_mancera,Definitivamente lo mejor de la noche 😂😂 #Emmys https://t.co/Yc662s7pqs,777690791359709184,1
689,WhoIsTreyMorgan,@HankAzaria wins!!!! #Emmys,777690791913349125,1
690,fercomentaa,VEM EMMY P TATIANA #Emmys,777690791753949184,1
691,JenBen76,Hank and Mango...two whom I could not adore more #Emmys,777690791821004800,1
692,Prasemprebey,"Beyoncé perdeu, agora só me resta a Tatiana ganhar. Fé no pai que esse emmy hoje sai #emmys",777690793708548096,1
693,mizhollywd,Congrats to #pattonoswalt for best writing in a variety series! #Emmy #hollywoodlife #emmys #hollywooddreams... https://t.co/M5G8xtdjyV,777690793662226432,1
694,_sidequest,É hora de melhor roteiro para Drama #Emmys,777690793742045189,1
695,rorhas,ESSE MAXILAR ME FODE &lt;3 #Emmys,777690793746264064,1
696,trapcry,Let's start here. #Emmys https://t.co/xOpqetrISE,777690793658183680,1
697,Gerudito,Paréntesis: una vez conocí a Hank Azaria comprando hamburguesas y es un tipo increíble. #Emmys,777690794392117248,1
698,SethAbramovitch,Grease Live deserved to win. #Emmys,777690794442362880,1
699,celsofer94,Espero que GOT gane todo #Emmys,777690794107006976,1
700,LunaWeasley98,"Al fin, drama. 👌🏻💕 #Emmys",777690794769600512,1
701,WTSkaditch,#Emmys I'm going with Game of Thrones Bastards,777690795067322368,1
702,SYMBOLIZEJACKS,#Emmys oj simpson is the new mad max,777690794996236288,1
703,RachelATC,#Emmys lumping Best Actor &amp; Actress in a drama into one presentation then not giving winners their moments? Not a fan.,777690795235160064,0
704,LovelyNCGal,😂😂😂😂 https://t.co/sCwR2HsirO,777690794677440512,1
705,theRati,"Pshhh, Beyonce doesn't need an Emmy she's already QUEEN. #Emmys #screwyougrease",777690794157223936,1
706,drine333,All these men in Louboutin at the #Emmys 😍 #laclasse,777690795155550208,1
707,xoselizabeth,stunning https://t.co/2XLnliJdlC,777690794610262016,1
708,Oursweet_,Meu coração chega a acelerar quando vejo algum ator de Game of Thrones  #Emmys,777690795155582976,1
709,bruunacezario,Não sei lidar com essa carinha do Rami gente como faço pra ele me conhecer pelo Twitter e a gente começar a namorar? #Emmys,777690794522189824,1
710,Sprinklr,And @TheEmmys surpassed 600k mentions #emmys https://t.co/UOwLxGjBA4,777690794346049536,1
711,grandrna,Cmon Carrie Preston snatch this win queen #Emmys,777690795902013440,1
712,LizCisme,whew!  https://t.co/UNIp5YPdQG,777690795369459716,1
713,wheresackles,caralho aquele homem fez friends #Emmys,777690796212486144,1
714,Roberthav,To passando mal já #Drama #Emmys,777690796690669569,1
715,glasneronfilm,"You won.  You don't get to say thanks, but go give someone else something.   Um. Awkward.  #Emmys drop a few categories and stop cramming.",777690798037037056,1
716,scarls17,"Okay, drama time! These are my jams. #Emmys",777690798322282498,1
717,SweetshadeLane,Come on #GameofThrones #Emmys,777690798502490113,1
718,cortexiphaned,Sonunda drama #Emmys,777690798456537092,1
719,akccm,Margo Martindale é demais! #Emmys,777690798766878720,0
720,edgarparada,#GameOfThrones is a surefire winner for ‘Outstanding Drama Series’ at the 2016 #Emmys. Place your vote with @OSN. https://t.co/eERiJ8TMFb,777690798997381120,1
721,nandamedeiros_,"Grease Live #Emmys 

https://t.co/WTyjcSQWo6",777690797936377856,1
722,DsilvaBarbara,"Chove ""maixx q tá pouco "" SP!!!!!! #Emmys",777690799492431872,1
723,FMPreachersWife,Can we demand a recount? I'm seriously confused. #Emmys https://t.co/d3Q44IHKja,777690797562998784,1
724,FlappingTrump,#CerimoniaDeEncerramento #Emmys #SantaGabriela #VidalConSG #Fantástico #GoPackGo https://t.co/cbSHoHRDqo,777690799857405952,1
