,screen_name,text,tweet_id,cluster_pred
0,awesomemitten,Huge congrats to Detroit native @KeeganMKey on his Emmy win for Outstanding Variety Sketch Series! #Emmys,777690625126830080,1
1,Lucy_ofMidgard,Escuchen nada más esa vocecita #Emmys,777690625827233792,1
2,Lim1nha,"#Emmys oq é o Emmy perto dos melhores do ano no Faustão, né",777690625877676033,1
3,MeettheClooneys,"Again...why I""m not watching #TheEmmys #TheEmmys2016 Did this asshole address yesterday's ISIS attack in MN? NOPE. https://t.co/pl8GY7gPq1",777690625667923968,1
4,brightsideniall,No puedo creer LO HERMOSO QUE ES RAMI #Emmys,777690626204852225,1
5,RojasMedia1,"Beyoncé is probably like, whatever I'm still Beyoncé #Emmys https://t.co/IRilQB4KEZ",777690626313846784,1
6,belaprofetag,AGORA VAAAAIII PUTA Q PARIU #Emmys,777690626548703232,1
7,tatianeshin,"Michael kyle zus... saudade 😍
 #Emmys",777690626641039360,1
8,Jersb16,YES!! GAME OF THRONES!! #Emmys,777690626909437953,1
9,Kickpuncher,7 Days in Hell reunion! https://t.co/oS706ThCjU,777690626989105152,1
10,midgetsass,#getphilto4mil for the #Emmys,777690627882512384,1
11,MissTerryA,My Sarah-baby is an Emmy winner finally!!!! So well deserved! #mexicantears #blessed #imamess #emmys https://t.co/gBgJIFV8EL,777690626661900289,1
12,Marshal_Knight,"Why, that's Character Actress Margo Martindale! #Emmys",777690627995734016,0
13,jk_darklord,Ganó Gargamel. #Emmys,777690627970445312,1
14,SlackCaroline,when ya bois kill it on and off screen https://t.co/2339yZaXdB,777690628700471296,1
15,cadehtaylor,SARAH PAULSON WON 🎉 #Emmys,777690629199368192,1
16,trinidmgirl,rami u.u #Emmys,777690630227189760,1
17,JeffDLowe,"Wait, all of those #HouseOfCards actors and actresses are considered GUESTS and not supporting? Seems odd to me. #Emmys",777690630646489088,1
18,FrancoSG,"Rami Malek tem um jeito muito estranho de falar, mas ele é tããão legal. #Emmys",777690630231384065,1
19,hktamim25,mashable : RT mashablegif: .Lavernecox echoes Jeffrey Tambor's earlier statement at the #Emmys … https://t.co/GDuqVqXJAA,777690630017392640,1
20,bookish_notes,Finally. The drama category. #Emmys,777690631174918144,1
21,JonathanLM06,#Emmys,777690631086886916,1
22,calebtraitris,dubladora dando spoiler calaboca #Emmys,777690630885605376,1
23,JasmineDAvilar,I can't believe Lana Del Rey won her first #Emmys tonight!!! Congrats! https://t.co/pfFa2B9zxQ,777690630189412352,1
24,Vikuuuus,Llegó el drama y presentado por mi bebé Remi #Emmys,777690630285910016,1
25,iAHMEDsalih,"Kit Harington and Emilia Clarke 😍🔥
  #Emmys https://t.co/iyGEsMcOA9",777690629098901504,1
26,juliamonteirofr,❄️ Ice and Fire 🔥 https://t.co/9IebHuA2Uu,777690630986293248,1
27,calikusuASB,Dramaaaaa Allaaaaam sonundaaaa haydin hizli olun bakayim usaklar :D #Emmys,777690631632195585,1
28,GeekyLawGal,Congrats to @iamjohnoliver of @LastWeekTonight on your well deserved win!! #Emmys,777690631682400257,1
29,Danilisceth,Siempre me ha gustado Hank Azaria #Emmys,777690631783190529,1
30,ClaraAB2,"Like last year, #Emmys telecast divided into 3 parts: comedy, limited/variety, drama. Not a fan of this format.",777690632005484544,1
31,zaineedz,QUE SOCÃO #Emmys https://t.co/KudFB1KvuB,777690631351173120,1
32,mypsychosexy,rami malek rei do #Emmys,777690631883857920,1
33,JLMadridFederer,MARGOT MARTINDALE!!! #Emmys,777690632206753793,0
34,24karatsue,So excited for @iamjohnoliverand @LastWeekTonight Congratulations Mazel  #Emmys,777690632949145600,1
35,Backabum,É tão estranho ver o Rami Malek contente. Parece tão fora de personagem. #Emmys,777690632894685184,1
36,lylasgotica,Finalmente chegamos em drama #Emmys,777690634551431168,1
37,newstick1,#Emmys red carpet kicks off https://t.co/HJuuAhwUcE 05:05:19,777690634887004160,1
38,narcexy,MOLLY DONA DO MEU CU #Emmys,777690634694131712,1
39,Jake_Meyerson1,"Low key Caleb McLaughlin is one of the most fashionable kids around, I wish I had his sense of style when I was 12💯👌 https://t.co/EJZPxVPi1d",777690634794725377,1
40,lexlynnea,"Watching the #Emmys really just consists of us sitting around yelling ""Oh my god, I love them.""",777690635058970624,1
41,jilltayloor,best part of the #emmys is definitely when the kids from stranger things deliver pb&amp;j to the audience,777690635109224448,1
42,HiddlesFashion,"Tom Hiddleston and Priyanka Chopra waltzing onto the stage at the #Emmys 
https://t.co/EwqI7MvHU4 https://t.co/UQKe9k40zE",777690631766286336,1
43,bealedhead,Hey #Emmys where is #RayDonovan #WalkingDead #TheMiddle #VICE #QueenOfTheSouth #outcast #TheAmericans .... so much good TV out there,777690635750957060,1
44,DJWarrenYoung,"Retweeted Good Morning America (@GMA):

#Emmys Outstanding Variety Sketch Series - Key and Peele @KeeganMKey... https://t.co/s02JUwcMrv",777690635767681024,1
45,WNHelen,"#SundayNightScares Enjoy #TheShrine, everyone!  I got sucked into the #Emmys so I'll watch the movie later.  Hope y'all have a great time!",777690636367519749,1
46,_Danhero,#Emmys #EmmysPorWarner House Of cards,777690636342394880,1
47,aryamadbro,Finally drama #Emmys,777690636145143808,1
48,sHy_119,"""Scottie"" looking so fine 😍😍 #Emmys",777690637319626752,1
49,geovanemorgan,rewatch the VMAs and thats why https://t.co/wjrmAP4Y5d,777690637273489408,1
50,mariano_12,Margo Martindale tendría que haber ganado por Bojack Horseman #Emmys,777690638502465536,0
51,dayah_dias,vamos dar esse prêmio para o menino Mr Robot? #emmys #MrRobot,777690638309613568,1
52,DyanaMoliNOT,"I'm not above the following statement: ""Rami Malek, hubba hubba."" #Emmys",777690638879981572,1
53,Utsbraz,LINDO que voz......................................... #emmys,777690639316160512,1
54,123gotozoo,The Walking Dead was ignored by @TheEmmys so I'm not watching it. @WalkingDead_AMC #TheWalkingDead #Emmys,777690639370641408,1
55,democracydiva,"key &amp; peele, AKA my other dream threesome (i'll start ranking them soon because aziz and alan are also up there) #Emmys",777690639085531136,1
56,dennisderdoedel,Rami Malek läutet mit seiner Laudatio für die Guest Actors die Drama-Kategorien ein. #Emmys,777690638800281600,1
57,heynurayme,"FÉ EM GOT,AMÉM  #Emmys",777690639500804104,1
58,slsmnds,House of Cards. House of Cards. House of Cards. House of Cards. House of Cards. House of Cards. House of Cards. House of Cards #Emmys,777690639597182976,1
59,iCaaroooh,What's the name of that actress on the stage right now? #Emmys,777690639806914560,0
60,roxinsomnia,Es una bendición ver a Rami Malek #Emmys,777690639894913024,1
61,svintillediluce,"Ah così 
Ok
 #Emmys",777690640473808896,1
62,iamaswankepner,ñañañaña los amo a los de sony https://t.co/8C9oiJMFoE,777690640125747200,1
63,MellingtonMelmo,Yes! I miss him in this campaign. I ❤️ him so much!  https://t.co/jiNw4iLif3,777690640637235200,1
64,spicymayoooo,.@TheEmmys I would like to speak to the manager. Who picked Grease (Live) over #LEMONADE?! #Emmys https://t.co/5YLgkg16F9,777690639769169920,1
65,maruiggy,"Rami, I luv u!! #Emmys",777690641937666049,1
66,AkilahObviously,Margot Martindale forever! #Emmys,777690642763780096,0
67,ProtestPreacher,So there are no performances tonight at the #Emmys? 🙄,777690642793267202,1
68,JosephGNevin,"Wish twitter feeds reporting the #Emmys would actually tell me WHO THE FUCK ARE WINNING EMMYS instead of this ""yas queen/I see you"" bullshit",777690643246166016,1
69,laanabananah,SARAH PAULSON GANÓ UN EMMY HIJOS DE PUTAAAS👍👍👍👍💪👏👏👏👏 #Emmys #Emmys2016,777690643263025152,1
70,binalouisee,Finalmente a categoria Drama! Veeem prêmios pra GOT #Emmys,777690643946737665,1
71,maximwoff,"Winter is coming! Game of Thrones is my choice for best drama series in @CoxComm's #Emmys poll!
https://t.co/1AuAy8GKmo",777690643795742720,1
72,targarxen,protejam o rami #Emmys,777690643623796736,1
73,putsrafaj,AAAA DDRAMA #Emmys,777690643984416768,1
74,KimberGracie,"Drama time, drama time, drama time!! AKA time for the #EmmyForMaslany #Emmys",777690644231827456,1
75,ElleLatham,FUCK YES!!!!!!!! @KeyAndPeele just won!!! I need to compose myself! @JordanPeele @KeeganMKey #Emmys #BestSketch https://t.co/KHZJixgSnw,777690643552350208,1
76,fropavg_,The best https://t.co/0C0SidgsEI,777690645343395840,1
77,Marghereti1,algo mas queres house of cards? #Emmys ,777690647046266880,1
78,bonelesside,"QUE DELÍCIA DA VOZ DO RAMI, QUE DELÍCIA DO RAMI #Emmys",777690646979158016,1
79,rorhas,MEU HOMEM #Emmys,777690647595802624,1
80,joao_kukamonga,"Que site ""Xvideos"" e esse no histórico do computador? #Emmys https://t.co/hOCQhdwyf7",777690646941433856,1
81,svrawxz,woooww tom💙💙😍😍😍  https://t.co/2xll7xMu0v,777690647406977024,1
82,tamartian_xo,😂😂😂 https://t.co/bGWK4So8yl,777690647641882624,1
83,carissinha,Tá chegando a hora da verdade.  #Emmys,777690647885180929,1
84,SashaSchech,Hooray Key &amp; Peele! @calhounschool pride. #Emmys,777690648111620096,1
85,selenaworld,VEM LEVAR TUDO GAME OF THRONES!!! #Emmys,777690648245854208,1
86,RebeckaSchumann,.@MsSarahPaulson apologizes to the real Marcia Clark during #Emmys speech https://t.co/1FLhZJOr91 https://t.co/VsTGIkXluy,777690645972586496,1
87,BuzzFeedMexico,WINTER IS COMING. #Emmys,777690648820318209,1
88,domsherwood,GENTE JA JA É A TATIANA EU TO MUITO NERVOUSO #Emmys,777690648875003904,1
89,THEEBARII,#Emmys https://t.co/X65gpFenbT,777690648379916288,1
90,AutTransKing,Ha! Chris Rock's reaction to not winning the #Emmys is priceless!,777690649785008130,1
91,sels70,Yay! Congratulations @KeyAndPeele on your #Emmy NOOICE! #Emmys #KeyAndPeele,777690649801822208,1
92,Sicfric,#Emmys que gane el cuervo de Game of thrones,777690649839669248,1
93,tah_viapiana,"Aiii que legal, vi sexta passada e gostei bastante! https://t.co/EgnxOHQWb0",777690650003271680,1
94,jdelbeni,"Michael J. Fox, caries Preston, and Allison Janney nominated for an award?! Yassss #emmys",777690650900893698,1
95,innafan_Chakon,Drama!! 😱😱😱 #Emmys #EmmyForMaslany,777690651202760705,1
96,fernandosjc,amo a voz do Rami Malek #Emmys,777690651047657473,1
97,takeddls,PEGA NA MAO DE DEUS E VAI PQ É AGORA GENTE #Emmys,777690651127406592,1
98,mrswsoldier,COMEÇOU BRASIL #Emmys,777690651223789568,1
99,spaceliontobi,I did this with Abigail Spencer doing her routine next to Malek. https://t.co/p7zJh6ILhA,777690650804228097,1
100,CourtSpinelliTV,"Great to see winners that shout out the entire production staff, all the way from EP's down to grips, keys and PA's. #Emmys",777690651500556290,1
101,JoyfullyReviewd,Hank &amp; Mary!!! #Emmys,777690651840446464,1
102,RieMcAz,Not to be confused with #BasketOfDeplorables https://t.co/Moc45W208g,777690651836096512,1
103,greyc23,Winter is coming! Game of Thrones is my choice for best drama series in @CoxComm's #Emmys poll! https://t.co/he8SAAJtj9,777690652087726080,1
104,LoBoogie,"Laurie Metcalf, in a lot of shit I've never heard of. #Emmys",777690652792524800,1
105,bgluckman,"Way to go, Character Actress Margo Martindale! #Emmys",777690652616392704,0
106,Ju_GonS,Eu também não https://t.co/EIO8V0f7lF,777690652696084480,1
107,thaispupato_,ENFIM OS DRAMAS me sinto em casa #Emmys,777690653430087681,1
108,MimieZaforas,The #emmys basically trolled the beyhive so fuck them.,777690654046560256,1
109,msLAS,Allison Janney and Laurie Metcalfe are nominated in every #Emmys category. Werk.,777690655455793152,1
110,Neethz426,"Wait did I just see , #JusticeForLemonade &amp; #EmmysAreRacist? Stop. I wanted Bey to win too, but yall just making her look bad now #Emmys",777690655279685632,1
111,thedarknigxt,CHEGOU A CATEGORIA DRAMA E COM ELA OS PREMIOS DE GOT #Emmys,777690655116197888,1
112,theMadJayWoman,"Can I just say again that I love that #DrunkHistory got a nom. So pleasurable, can't wait for the new season  #Emmys #AVCtv",777690655871082496,1
113,queen_diva_yonc,"Melhor Direção Especial de Variedades: #Lemonade perdeu o prêmio para Grease Live.
#Emmys",777690655808258048,1
114,_ChloeAJ,character actress margot martindale (!) #Emmys,777690656236040192,0
115,anatomycalzona,"amo adoro viola , porem Tatiana merece pakas #Emmys",777690656424730624,1
116,Ruth_Josa,EMPIEZAN LAS CATEGORÍAS DE GOT  😍😍😍😍😍😍😍😍😍😍😍😍😍 #Emmys ♡,777690656579825672,1
117,Norbbs,The amazing @ItsRamiMalek #Emmys,777690655808249856,1
118,BiggiBenzo,Bout time they won.....did it really have to be at end of it all tho? #KeyAndPeele #emmys,777690657037094913,1
119,blakelivelegend,rami te amo #Emmys,777690656932265984,1
120,inccomic,RAMI MALEK TAKE YOUR SHIRT OFF YEAH I'M DRUNK FUCK YOU #Emmys,777690656961617920,1
121,EdStudioM80,What should the next #Emmys category be? Outstanding...,777690657263497216,1
122,minervadiretora,AAAAAAAAAAAAAAAAAAAA DRAMA AGORA #Emmys,777690657376854016,1
123,dazzle715,I guess if I found out I lost to goofy Grease Live I wouldn't have shown up either. #robbed #Emmys #LEMONADE,777690657984909312,1
124,isabelecrf,Começou a categoria que todo mundo gosta: drama #Emmys,777690658127679488,1
125,_julianabp,Torcendo por The Good Wife! #Emmys,777690658568081408,1
126,BURTV0N,Ho la nausea per l'ansia #GameofThrones #Emmys,777690659549507584,1
127,GabrielGMoore,"Escorreu uma lágrima 
n disse por onde #emmys  #RemiMalek",777690659583094786,1
128,ShakaJuju,Rami 👏🏼👏🏼👏🏼 Rami 👏🏼👏🏼👏🏼 #emmys https://t.co/GuPpAoedn8,777690656559038465,1
129,stali_habib,@MsSarahPaulson in Prada killin it! #Emmys,777690659553619968,1
130,MenoxMusic,Outstanding Drama Series Guest Actor/Actress - Hank Azaria and Margo Martindale. #Emmys,777690660912574464,0
131,spacnova227,CHARACTER ACTRESS MARGO MARTINDALE #bojack #emmys,777690661210456064,0
132,flirtyharmony,"CAN TATIANA PLEASE WIN ALREADY  I'M CRYING I'M SUPER STRESSED

#Emmys #EmmyForMaslany",777690661797494784,1
133,AltiusTendo,Elsbeth Tascioni! Gosh I miss #TheGoodWife #Emmys,777690661722071042,1
134,samlozadajr,#Emmys terms of endearment million times better now showing on starz encore,777690662162403332,1
135,jesslina,Another great #Emmy2016 moment: #JamesCorden &amp; @jimmykimmel. 😆 🎵 https://t.co/2IEMiFZwKV,777690661449445377,1
136,Canal_Sony,Mejor actriz de Drama.... ¡hagan sus votaciones! #Emmys,777690662275653633,1
137,CarolyAnchieta,Queen 💙💙 https://t.co/vsU87KTGKo,777690661726420992,1
138,VScanuforever,Finalmente i premi che mi interessano #Emmys,777690662477131776,1
139,DanYanofsky,Good for John Oliver. Love the show #Emmys https://t.co/U2ODAnNFNy,777690661743198208,1
140,sharonlroy,She is rocking someone's chain! Go get me @kerrywashington #Emmys https://t.co/kUZxd64EZs,777690663764787204,1
141,cleodeja,Rami Malek is so hot #Emmys,777690664314232832,1
142,ioana_d79,Drama series #Emmys omggggg,777690664607907840,1
143,UNEMejorjuntos,Empieza la categoría Drama. #Emmys https://t.co/2UNkbsR7MV,777690663785734144,1
144,baumsie,WOOOO!!! 🎉🎉 @KeyAndPeele @Atencio #Emmys,777690664750374916,1
145,arollingbeauty,There's a lot of pretty white dresses tonight #Emmys,777690665136324608,1
146,shokoshik,Character actress Margo Martindale! #Emmys,777690665371271168,0
147,kawaiikells,"Finally, drama. Now give me Game of Thrones. #Emmys",777690665455001601,1
148,badgal_ari,Awwww my heart https://t.co/mTObp9iowE,777690666126106624,1
149,thethesislife,All y'all bitches like Wells because he reminds you of @ItsRamiMalek. #BachelorInParadise #Emmys #Emmys2016,777690666054844416,1
150,c_mars_,Hi @ItsRamiMalek. I have 5 unwatched episodes of #MrRobot on my DVR. I feel shame. #Emmys,777690666239352834,1
151,nokonovalova384,Mejor Actriz de Reparto (Comedia): Kate McKinnon por #SaturdayNightLive. #Emmys �� MORE &gt;&gt; https://t.co/CdfnFaLTxl,777690666142924801,1
152,theRealTrayonce,American Crime Story: https://t.co/zah565p1AH,777690665958445057,1
153,flickchickdc,Margo!!!!!!!!! Who should win every award forever and ever!!! #Emmys,777690665601732608,0
154,louisfrannta14,She's still the Queen #Emmys https://t.co/gRBA5yvZgj,777690665069252608,1
155,IndependentBey,"Meu amor, botou o acento porque, Legion e TBHT ficaram falando de Emmy pra que caralho? Eu podia estar de boa curtindo meu domingo!! #Emmys",777690666801500160,1
156,Albert1027,"Retweeted Television Academy (@TelevisionAcad):

We'll be right back with more great #Emmys moments on ABC!... https://t.co/lFqafdKy6w",777690667854073856,1
157,davidpastrana,Ni un solo número de entretenimiento en lo que va de gala. ABC no ha querido gastar mucho dinero #Emmys,777690668177186816,1
158,rhythmandchange,Ok so M. Ali  is seriously underrated tho #Emmys,777690668537970689,1
159,drwsmistake,POR FIN UN CATEGORÍA DE GOT #Emmys,777690668231716864,1
160,robertcyoung,Ohhhhh shit so #TheAmericans won one already!!! #Emmys,777690668802019328,1
161,LucreciaTroia,AL FINNNN!!! VAMOS #GameofThrones !!!!! #EmmysPorWarner #Emmys,777690668307193856,1
162,makeitrayna,Why is thing so long? #Emmys,777690668852350976,1
163,alealier,Eu ainda acho justo dividirem o prêmio entre Tatiana Maslany e Robin Wright por motivos de muito rainhas #emmys,777690668659568640,1
164,lorecarivi,Rami Malek 😻 Ay esto es demasiado para mí #Emmys,777690670278541312,1
165,FrankDeSalesman,love u jeb https://t.co/7MDgCPsTTL,777690670098022400,1
166,jmkarmstrong,I do wish character actress Margo Martindale had been nominated for @BoJackHorseman. #Emmys,777690670337236996,0
167,UsernameSsSuck,See. Now what we're NOT going to do here... https://t.co/pzk6yiHK2A,777690670899171328,1
168,hunghoneybadger,"If Ray Donovan wins an Emmy, let's all commit mass .... Oh fuck #Emmys",777690672040030208,1
169,Taisbgp,"Nem falo de GOT, pois donos e proprietários desse Emmy com 23 indicações #Emmys",777690672224698368,1
170,RealMSA941,"If #CrookedHillary was smart, she would've made tonight a fundraiser in LA..her domestic donors are all at the #Emmys . #Emmys2016 #MAGA",777690672296038400,1
171,johnnykrnas,LAS CATEGORÍAS DE GAME OF THRONES #Emmys,777690672400781312,1
172,curlyheadx1,Is Beyoncé even there 😂 #Emmys,777690672325427200,1
173,Codigo_Magenta,#Emmys: #KeyandPeele gana por Mejor Serie de Variedad de Sketches https://t.co/gCfoHmSfow,777690671175958528,1
174,Andrewbrennan97,"Wow, even at the #Emmys @ItsRamiMalek still seems like Elliot. @whoismrrobot",777690671851319296,1
175,GDIGM,Congratulations @MargoMartindale Guest Actress Drama series  @TheEmmys #Emmys,777690672665075712,0
176,AlexandreCalm,pelo menos temos o #Emmys do Super Bowl !,777690672996515840,1
177,kae_98,#Emmys @ItsRamiMalek  You are amazing😍 I love you so much 💜,777690673495412737,1
178,doctornayaka,#KeyAndPeele for the win!!! #Emmys https://t.co/WiVuwukx7k,777690672295911424,1
179,huoters,I solely believe Grease Live deserved to win bc of Keke Palmer's three costume quick change had and Aaron Tveit's short shorts #Emmys,777690673654792192,1
180,quikjl,shout out to KEY AND PEELE for the Emmy win...because sometimes the winners actually win. #Emmys,777690673306710016,1
181,laurenzaremba,This has run of guest actor nominees just reminded me I really need to finish the last season of House of Cards. #emmys,777690673780822016,1
182,That_Girl_Dawn,@IMKristenBell and that dress - both gorgeous ❤ #Emmys #Emmys2016,777690673537552385,1
183,JanThePlan_,And she is slaying her pregnancy 😍 https://t.co/X951MsXJo7,777690674112192512,1
184,Itspedrito,"Sabotaram a Beyonce, rainha  injustiçada #emmys",777690676255461376,1
185,TVGroove,"【第68回 #エミー賞 】#Emmys
バラエティ・スペシャル監督賞は、ヴァネッサ・ハジェンズ、カーリー・レイ・ジェプセンら出演で話題となった「グリース・ライブ！」。同作はAmazonビデオで視聴可能（有料）。 @GoGrease
https://t.co/dMiIJuony2",777690676389515265,1
186,WrecklessLove,House Of Cards gets no love #Emmys,777690676486176768,1
187,Fool_4_Music,Love Margo Martindale. 💞 #EMMYs,777690676553187328,0
188,therealww7,Finalmente Drama  #Emmys #Rai4,777690676821630976,1
189,pulhut,Jesus https://t.co/6mO0U1fNt1,777690676247093248,1
190,Jordyne_Lynn,House of Cards x20 💀 #Emmys,777690676787937280,1
191,Sauniell,Is Bey performing because I'm about to change the station? #Emmys,777690676788158464,1
192,LemenStudio,Key &amp; Peele take the win!! #Emmys https://t.co/hcxvPWuSgY,777690675546460160,1
193,DeFlowerz,"YES, character actress #MargoMartindale!
#Emmys",777690677677215744,0
194,sortathatguy,Hank Azaria and Margo Martindale. That'd be a fun dinner party. #Emmys,777690677576601600,0
195,lacantekin,HOW. https://t.co/F6PDmar0k8,777690677413048322,1
196,eruwaffuru,категория драма просто каждая номинация ААААА ЧЕ ЖДАТЬ ТО #Emmys,777690677421498368,1
197,Antu_Giorgetta,"Te amo ""chico trastornado"".  #Emmys #RamiMalek",777690680504221698,1
198,chelseaadelaine,CHARACTER ACTRESS MARGO MARTINDALE #Emmys,777690680550420480,0
199,ssydneyscott,yasss https://t.co/nMayGOUG3L,777690680848113664,1
200,almeida_ja1,@NetflixBrasil ano que vem quero meus filhotes ahazani levando tudo ❤️ #Emmys,777690680672083968,1
201,BlackGirlNerds,I'll be shocked if we don't see Mahershala Ali back for Luke Cage next year. Just sayin #emmys,777690680940298240,1
202,SciFi4Me,"Guest Actor in a drama went to hank azaria
Guest actress in a drama went to margo Martindale #Emmys",777690681091297281,0
203,anywayimallyson,Here comes drama #Emmys,777690681145958400,1
204,fabulousfallon_,Jimmy definitely should have won that Emmy! 🙈😑 LIKE FR... @jimmyfallon #Emmys #falpal,777690681506619392,1
205,bonniegillespie,"My #Emmys votes were pretty on-point. My ""non-winners"" were all ones I knew would be a longshot, but had to vote for 'em anyway. PROGRESS!",777690681011765248,1
206,JMartOutkick,"If I were @ItsRamiMalek, I wouldn't walk too far away from the stage. #Emmys",777690681359921153,1
207,raeeetx,Omg I'm dying. They are so cute! https://t.co/rqceIK7awB,777690681309470720,1
208,who4fan,"I think the #NutrishCat rocked the red carpet at the #Emmys.
https://t.co/c0eqwhmT00",777690681481527296,1
209,screamxngface,DRAAAAAAAAAMA TATIANA ALELUYA #Emmys,777690681611579392,1
210,sofiprofumo,Y Game Of Thrones para cuando? #Emmys https://t.co/tY7VU0BIOP,777690680009355268,1
211,iguaannaa,a categoria da minha vida também conhecido como drama #Emmys,777690682110672896,1
212,DIANAPR1NCE,Robin Wright deserves an Emmy! #Emmys,777690682597122052,1
213,HugoGloss,Melhor programa de esquetes: @KeyAndPeele #Emmys #EmmyNaWarner https://t.co/msZL6DRsNC,777690681292750852,1
214,lexiehammesfahr,I will never forget Hank Azaria from #TheBirdcage #Emmys,777690682249076740,1
215,FajardoJoselin_,"Oh. Sí, ya iniciaron las categorías donde está #GameOfThrones 👌

#Emmys
#EmmysPorWarner",777690682861510656,1
216,OBenespanol,Ok atentos que estamos cerca parece... #emmys   #EmmyFoMaslany https://t.co/9eOVYS1gX7,777690681389289472,1
217,meresger1,Always happy when Margo Martindale wins. #Emmys,777690684648108032,0
218,PrincessMexanic,RAMI'S SMILE I-  #Emmys,777690684681662464,1
219,amandahernand31,Yo 👇🏼 https://t.co/xd7ZpO1hHd,777690684098809856,1
220,samuelramosss,MAXXX #Emmys,777690684824354816,1
221,laylawrote,Rami 💕 #Emmys,777690684958633985,1
222,n_narvalia,Rami Malek's voice is making me blush. #Emmys,777690684895682560,1
223,pitogamer254,Hola #Emmys,777690685092745216,1
224,GQMagazine,43 spectacular minutes of Key &amp; Peele you should watch right now https://t.co/DjlF4P0yE0 #Emmys https://t.co/kcFEt7qgs7,777690683901640705,1
225,itsokaysad,segura meu coração que o drama chegou #Emmys,777690685243785217,1
226,casadehadeis,AI TO NERVOSA #Emmys https://t.co/qaVoou7Jzm,777690685101277184,1
227,ledasana8tt830,Right on Key &amp; Peele. Now I'm just waiting for Tat to win  #Emmys,777690685591826432,1
228,carlyBAMF,I really want Margo Martindale as a friend. #emmys,777690684878884864,0
229,Hugo_Ernesto13,Llegó Drama: lo mejor de lo mejor #Emmys,777690685315047424,1
230,buttagal,NICE HANK WON! #RayDonovan #emmys,777690685491339272,1
231,31pottergirl,"@miamckenzie I can't wait to win something so I can say, ""I'm so possessive so I rock his Roc necklaces."" #TopplePatriarchy #Emmys",777690685466152960,1
232,TVOvermind,Character Actress Margo Martindale! #Emmys #Emmys2016,777690685348642820,0
233,RJCity1,Hank Azaria's win is long overdue as Murray's dog walker in Mad About You. #Emmys,777690685751365633,1
234,simoni_siqueira,"Ai meu Deus,as premiações pra #DramaSeries vão começar!! Ai meu coração!!  #Emmys",777690685780754432,1
235,revol_less,Character Actress Margo Martindale! #Emmys,777690685902389253,0
236,ta_mcknight,Oh are we finally to the drama portion? #Emmys,777690686413910016,1
237,13hFY,"مسابقات وجوائز ايفونات
وفقرات شعريه
سناب مميز جداً
-
-٧

 #من_منطلق_خبرتي_بالحياه #اروع_ما_تراه_عينك #Emmys #بن_عطيه https://t.co/CjwRWEFeIP",777690685877186560,1
238,LauraLives,I've never watched a full #Emmys show before - do they always do these wonderful transitions for the genre change?,777690686141390848,1
239,lovemeimdri,Can someone go get Bey and tell her she had somewhere to be today?! 😐 #Emmys,777690687122894848,1
240,janersm,Laurie Metcalf and Allison Janney got a few nominations this year. #Emmys,777690688783724544,1
241,jammyjam25,"Rami Malek just uttered the phrase ""Masters of Sex"", sorry you missed out TL. #Emmys",777690689035317248,1
242,scarymino,I'm not sure who Abigail spencer is but she's beautiful #Emmys,777690689568210944,1
243,Johnkees77,"#Emmys@jimmykimmel jimmy has became such a weirdo, thank god Americans have common sense and don't listen to celebrities",777690689685581824,1
244,MidwestCurls,Winter is coming! Game of Thrones is my choice for best drama series in @CoxComm's #Emmys poll! https://t.co/QJ4Nk2tO01,777690689744142336,1
245,larrybiebrx,EU TÔ AQUI PRA ENALTECER A MELHOR SÉRIE DO MUNDO #Emmys https://t.co/KqU7l9ZPUe,777690688565702656,1
