,screen_name,text,tweet_id,cluster_pred
0,DivaPhodastica,O apresentador disse que vai ter 2 surpresas. A BeyHive pira #Emmys,777700302736728064,1
1,lmalarissa,SOCORRO AMÉM TATIANA MASLANY #Emmys  https://t.co/MQ18p2fqfF,777700303126818816,0
2,AtStakeMagazine,This one makes me happy! Love this show #MrRobot https://t.co/pIPGefYPst,777700305769078784,1
3,TreasurHooligan,"I didn't know much about the other girls, I bet they were good but gosh Tatiana plays like 20 different people in a same ep #Emmys",777700305979015168,1
4,lucasglee4,"Gente, esse foi por Sarah, Cos, Rachel, Alison, Mika, Beth, Helena, Kira, S. e Fee❤ #Emmys #EmmyForMaslany #Emmys2016 #OrphanBlack",777700306410962944,1
5,gilbaezinforma,Planoinforma: Hilarante inicio de 68 entrega de los Premios #Emmys ¡Entérate! https://t.co/qBsOpvEEM7 https://t.co/bvVEU5OuXE,777700306448769025,1
6,MaeAbdu,YES!! https://t.co/ZfaTtK1Mdr,777700306293587970,1
7,eltor0pt,Olha os spoilers!! #SICCaras #Emmys,777700306650038272,1
8,KAYDEEkylie,Yes! Finally. So well deserved. https://t.co/AXMyc3KfLM,777700305999978496,1
9,maysoonzayid,I challenge Bean to an #Emmys pic off @allieri Gauntlet thrown. Bow down popples! https://t.co/HjzaHH9oeh,777700304573853696,0
10,pick_jeremy,This Audi commercial is eerily reminiscent of the ending to Season 3 of BoJack #Emmys,777700306763313152,1
11,KatieReeed,Yaaaaaaas bitch yaaaaas https://t.co/gPe4Qy270K,777700306717204480,2
12,Karliet_Karla,BDP https://t.co/YXvuLcKU4i,777700306960384000,1
13,tx_shaun,#Emmys,777700306805149696,0
14,annie_lovegood,😍👑😍👑😍👑 https://t.co/UilArrAIvP,777700307052601346,1
15,ChecheVeliz,Holy shit @tatianamaslany ❤️❤️❤️ #Emmys,777700307123830784,1
16,amyburzak,YAAAAS #CLONECLUB YAAAAS @tatianamaslany #Emmys @TheEmmys #OrphanBlack @OrphanBlack,777700307253940224,1
17,allybautista,"I truly wasn't expecting @tatianamaslany to win because awards are weird af, but that was such a long time coming. I'M SO THRILLED!!! #Emmys",777700310642941956,1
18,JackSkierka,"They showed clips of all the lead actors, but skipped through all the lead actresses... Weird... #Emmys",777700310735212544,1
19,_smiLYN_,Where. Is. her. Cover. Tho. https://t.co/tmrJYoJvKs,777700310458494976,1
20,ratacaro,Merecidísimo!!! #Emmys https://t.co/fp4NCveQnS,777700310190096385,2
21,_Delly_P,Everybody needs to be watching @OrphanBlack. Real talk. #Emmys #CloneClub #demclones #sestra #OrphanBlack,777700310580137988,1
22,gordirro,"Categorias principais de atuação dramática resolveu premiar novos talentos, pensando no futuro da TV. #Emmys",777700310840205312,1
23,p_ramosbio,Alguem manda um Emmy pra cada ? https://t.co/lMuJXuQGVB,777700310559100928,2
24,OliverTolentino,Marcia Clark @thatmarciaclark in our gown with @MsSarahPaulson at the #Emmys #Emmys2016. #MarciaClark https://t.co/ljEYp8kiCN,777700309418201088,1
25,YhuryNukui,"TATIANA, MINHA FILHA, FÉ NO PAI QUE O INIMIGO CAI. 

E caiu. ❤️ #Emmys",777700310852722688,1
26,igipatt,Man of the hour #Emmys https://t.co/rpiYNTekQ7,777700310076780545,1
27,2LEGIT2QUITBRIT,Robin should've won that #Emmys,777700310924025856,1
28,jhanteigh,"I mean, Orphan Black has not been good for a while, but Tatiana Maslany is the shizz. #Emmys #Keri2017",777700311154778112,0
29,felipeperosso,Remi e Tatiana levando #Emmys pra casa. A justiça foi feita finalmente,777700311616061440,0
30,MichaelCastner,Over the moon for @ItsRamiMalek . So well-deserved!. You might not believe it but we do ❤️ https://t.co/3cyfP4WIdS,777700314874904576,1
31,0910163030,"mashable : Hillary Clinton is a fan of Kate McKinnon, just like you. https://t.co/5tOPYCqqx9 #Emmys … https://t.co/kPvtSIUIJY",777700313268715521,1
32,laurenlogia,PORRAAAAAAAAAAAAAAAAAAAAAAAAAAAAAAAAAAA https://t.co/ppXKeEaDyk,777700314401169408,1
33,quartaparede1,Nossa!!! Tatiana Maslany levou o #Emmys de melhor atriz em série dramática! Entregaram quantos? 😀  #EmmyForMaslany https://t.co/YBcHbkQ33R,777700314241695744,0
34,carolinetulka,YOU GUYS FINALLY #EmmyForMaslany #Emmys,777700314728259584,1
35,tholmz,My favorite #Emmys moment of all time was John Oliver quoting Courtney B. Vance quoting Sterling K. Brown quoting Jay Z.,777700314400948225,1
36,Cinema_Tvseries,"عاجل : 
رامي مالك يفوز بجائزة الإيمي لأفضل ممثل رئيسي في عمل مسلسل درامي عن مسلسل Mr. Robot. 

#Emmys 
#Emmy2016... https://t.co/SO8N6irfkk",777700315273564160,1
37,louistommogoals,"ESSE ANO TÁ QUEBRANDO AS MALDIÇÕES, PRIMEIRO O DICAPRIO GANHA O OSCAR E AGORA A TATIANA GANHA O EMMY #Emmys",777700315227357184,2
38,DannFarias,So happy Rami Malek won. All my favorites are winning this year #Emmys,777700314904395776,0
39,marchthird5h,O AMOR GANHOU SAAAAAJSKFKKWKD FINALMENTEEEEE #Emmys #OrphanBlack https://t.co/8FHwypMj0J,777700314686291968,1
40,dracaryspreto_,tatiana ganhou kdhdjddndbdjdbdhdjdbhdhdjdhdhd #Emmys https://t.co/Rr1SBaXSOP,777700314287861760,2
41,NaatiiMiranda,Muito mais que merecido esse #Emmys para Tatiana Maslany.,777700315437080576,2
42,victoria_deon,"SARAH PAULSON E TATIANA MASLANY GANHANDO EMMY NA MESMA NOITE 
AMÉM EMMY 2016 #emmys",777700315600740353,0
43,GracingTheWorld,GO RAMI (even though I don't watch Mr. Robot). #Emmys,777700315558776836,0
44,Bey4Ever_s2,Prêmio da minha vida!! #Emmys https://t.co/kjDY1n5ZZx,777700315684597760,1
45,hwrleyquinzel,quwria que a viola tivesse gamhado #Emmys,777700318926831617,2
46,dreebarros,"Rami Malek e Tatiana Maslany ganhando o #Emmys ! É muito bom pra ser verdade, sorry Viola Davis",777700319170093056,0
47,protonem,Ganaron el actor principal de Mr Robot y la (múltiple) actriz principal de Orphan Black. Me gusta me gusta #Emmys,777700318666784768,2
48,InvestingLatest,"WSJ: RT WSJspeakeasy: Rami Malek wins Outstanding Lead Actor, Drama. #Emmys: Read the winners list https://t.co/JWMkNHkuiV",777700318821904385,1
49,Alohomorra_,VOLTA P DOCTOR WHO MOFFAT #Emmys,777700319371337728,1
50,ErickaVidal4,TODOS EN LA SALA SE ASUSTARON PORQUE PEGUE EL GRITO AL CIELO!!!!!!😭😭👏🏼👏🏼❤️❤️❤️❤️❤️ https://t.co/ZPaP5AlANP,777700319253921792,1
51,migasualoukah,"Eu to bem feliz agora, bem feliz mesmo. Vou imprimir essa foto e colar no caderno. Meu amoor. #Emmys https://t.co/iFV6F2n1DU",777700317412651008,2
52,david_rubio7,"Ya solo quedan 2 premios, los gordos. Mejor serie cómica y drama.
Apuesto por Transparent y Juego d Tronos, pero no votaría x ninguna
#Emmys",777700319392399360,2
53,allschilling,não esperava menos #Emmys,777700319576940544,2
54,Indiegencia,SHE WON HOLY CRAP #Emmys,777700317857210372,1
55,_PinkRose777,#TatianMaslany she DESERVE IT .  #Emmys #Emmys2016 #OrphanBlack https://t.co/EacI3bt8ML,777700318591221760,1
56,SmarcGalcroft,Rami Malek wins Outstanding Actor in a Drama series for 'Mr Robot'. https://t.co/7ABQcK7I9G #Emmys https://t.co/n6lFzsqi53,777700319337779201,1
57,dani_almeida11,"SARAHHHHHHHHHHHHHH
#Emmys",777700319614603265,1
58,BraindamagedFr,Le recap complet du Palmarès pour vous qui nous rejoignez est ici &gt;&gt;&gt; #Emmys #RamiMalek #GameofThrones https://t.co/cSvBfP9FUk #Emmys2016,777700319325282304,1
59,ngbezn,MERECE MUITOOOOOOOO https://t.co/NhNjYgVXBC,777700319522357248,1
60,vausemanhoe,OH MYYY GODAANbbb. https://t.co/as1Uuwg4hK,777700319958491136,1
61,cassafras007,"I love that Jonathan Banks was nominated for Better Call Saul, even though I've never seen it. He was fabulous in Breaking Bad. #Emmys",777700320730353666,1
62,JamesJetsOften,.@whoismrrobot @carlychaikin @PortiaDd @ItsRamiMalek @USA_Network @gracegummer @ChristianSlater COME ON RAMI! #Emmys,777700323448074242,1
63,tefi_m,AY QUE FELIZ ESTOY POR TATIANA SE LO MERECÍA TANTO 😭😭😭 #Emmys,777700323314036736,2
64,doabsurdo,"queria meeeeeesmo era robin, mas é mto bacana ver o trabalho da maslany finalmente sendo reconhecido #Emmys",777700323301392384,0
65,fakingitpodcast,@tatianamaslany making 🇨🇦 and women PROUD! #FemaleHeroes https://t.co/5jgC7Uuu5z,777700323200733185,1
66,TodoEnDiscos,Mejor Actor en Drama: @ItsRamiMalek por MR. ROBOT. Me hubiera encantado Matthew Rhys o Bob Odenkirk. #Emmys https://t.co/88eKCHZlGA,777700323838324736,1
67,omglaurenj,AMO A TATIANA HACE COMO OCHO PERSONAJES TOTALMENTE DISTINTOS Y ES UNA ACTRIZ DE LA PUTA MADRE AL FIN LOCO #EMMYS GRACIAS,777700323855040512,1
68,inovelasi,Ganhoooooooou! 👏👏👏 #EmmyForMaslany https://t.co/tbUE3i5Xtc,777700323502727169,1
69,rowsewood,TATIANA MASLANY GANHOU CARALHOOOO MEU DEUS MAIS QUE MERECIDO #Emmys #EmmyForMaslany,777700323452420096,2
70,starxgaryen,ELA MERECIA UM EMMY PRA CADA PERSONAGEM #Emmys,777700324215779328,0
71,revistasisomos,"#MilenioAlMomento | Desde la ceremonia de los #Emmys, AlvaroCueva​ nos comparte el ambiente que se vive https://t.co/BWW1hojLqW",777700323737669632,2
72,moviestuffshow,"Meh...Keri Russel robbed, but this might be the first acceptance speech read off a phone #Emmys",777700327210545153,1
73,alinepraseres,"Estou tão feliz que Tatiana Maslany ganhou ela mereceu tanto esse #Emmys a atuação é simplesmente impecável, incrível amo muito essa mulher",777700327328014336,2
74,SirJohnnyBravo,They finally got it right!!! @tatianamaslany and @ItsRamiMalek win at the #Emmys,777700327390797824,1
75,creators,Rami Malek deserves that Emmy so much! #Emmys 👍🏻,777700327726444544,0
76,baldyeri,MELHOR ATRIZ MELHOR TUDO FODE ESSA BUCETA https://t.co/fEN18KMuAn,777700327395094528,1
77,raidetico,A TATIANA GANHOU AEEEEEEEEEEEEEEE RAINHA DE MAIS #Emmys,777700327583801345,2
78,bkosok,@conniebritton luv seeing you on stage 4 the #Emmys WIN https://t.co/GuNuQFVgcy,777700325968850944,1
79,marisacp51,Love that Rami Malek &amp; Tatiana Maslany won!! #Emmys,777700327906762752,0
80,carajitopitt,Se lo robaron a @RealRobinWright se merecía ese #Emmys,777700327910940672,2
81,msfreshfish,"I just never believe that actors accepting awards are legit thrown. They're playing it up. Conversely, if nervous, ACT composed. #Emmys",777700327902576640,2
82,httpsreedusx,👏👏👏👏 #Emmys #EmmyForMaslany https://t.co/xUm1NU5KcD,777700331836682240,1
83,MConstanzaBosio,"SR presidente, vamos a tener que ir a la guerra por esto...no saben lo que hacen   @KevinSpacey @RealRobinWright  merecian los #Emmys",777700331732004864,2
84,SalCapizziNYC,When I was in high school Kids would tell me i looked like a fatter Louie Anderson. #Emmys,777700331681701888,1
85,renatorn,".@NetflixBrasil Gente, tá na hora de vcs colocarem @whoismrrobot no catálogo! Será q é pedir muito?? #Emmys",777700331824218112,1
86,adrians650,HOLD THE DOOR. One of the greatest episodes ever. Shoulda won #Emmys,777700331685752832,1
87,ScottimusPrime1,HALLELUJAH!!!!!!!!!! #CloneClub #Emmys #Emmys2016 https://t.co/iKpUiiTnY7,777700331543207936,1
88,EW,#CloneClub rejoice!!!! 🙌 #Emmys https://t.co/Xe9ofQBZNT,777700330733727744,1
89,Marsteus,OLHA...DSCLP...MAS ESSA AQUI É A REAL VENCEDORA!!! #Emmys https://t.co/cEu7cvjcqi,777700330020737024,1
90,shelovesdamon,WIDHFEWIDFHIWUGFHFGWU TATIANA FUCKIN WON!!!!! I KNEW IT!!! SHE DESERVED THIS MORE THAN ANYONE!!! #emmys,777700332252135424,0
91,JenJenMA,Give her all the Emmys! https://t.co/yjomANJ4TO,777700331702591492,1
92,larmanzo,Ela merece reconhecimento gente essa mulher é foda amém Tatiana Maslany #Emmys,777700332902187008,0
93,jaureguilaurin,DEVERIA GANHAR 9 PRÊMIOS NÉ https://t.co/qEVWphXZIS,777700335351652352,1
94,juliaoliv2,Uhuuuuuu merece muito! #Emmys #EmmyForMaslany,777700335540432896,1
95,orangeahs,ELA GANHOU SOCORRO EU TO CHORANDO QUE FELICIDADE #EmmyForMaslany #Emmys2016 #Emmys,777700336018583552,2
96,Carloslqt,Kevin Spacey también se merecía ese premio 😔 #Emmys,777700335657873408,1
97,Sneef17,"""Who is this Emmy of whom you speak?"" - my brother, pop culture connoisseir #Emmys",777700335540441088,0
98,evilaIien,TATIANA MASLANY FINALLY FUCKIN WON HER EMMY I CAN FINALLY BE AT PEACE #Emmys @tatianamaslany,777700336026857472,0
99,4a_pared,Vamoooos!!! Tatiana Maslany de #OrphanBlack es la mejor actriz de drama. #Emmys #L4PEmmys https://t.co/ZlQZc3Q2sz,777700335494234112,0
100,Cattcatastrophy,WHEN THEY SAID TATIANA MASLANY WON FOR LEAD ACTRESS. ABOUT TIME! 🙌🏼 #EmmyForMaslany #OrphanBlack #Emmys https://t.co/Xa9zzVmyY0,777700335288586240,0
101,Deidrissima,https://t.co/wFUSNdSGB0,777700336182013952,1
102,lo_ollyy,"@carolmoreira3 entrevistando fica fazendo que sim com a cabeça, eu to rindo #Emmys #EmmyNaWarner",777700336043778049,2
103,PamyNovaes,"EU TO NO CHÃO! Ela ganhou!!! Mais do que merecido,.. #Emmys @tatianamaslany  #YouGoGirl #EmmyForMaslany",777700336182161408,2
104,IWatchAnime92,"@notsam You gotta give @RyanKavanaugh time and support.
Harambe will win a #Emmys eventually: https://t.co/ZQ3pCJvBhv",777700335590662144,1
105,Hansmadera,#EmmysPorWarner Tatiana maslany de orphan black  y Rami MAlik de Mr. Robot .....Gran noche en #Emmys,777700335796322304,0
106,Grace_Cordelia,OH MIODIO SI HA VINTO SIIII #Emmys https://t.co/R5IrVZ1SPw,777700334412201984,1
107,lizziebelle,It's about time! Yay @tatianamaslany! You deserve it and more! #Emmys,777700336303763456,1
108,LorraineDWilke,There is literally no woman on TV with a tougher challenge &amp; she meets it like magic. https://t.co/CeqjWLnmXI,777700335548706816,1
109,starkgotico,"eu to muito orgulhoso do meu filho
#Emmys https://t.co/r3fTYnQ4F4",777700335238414337,2
110,mihcosta,Congrats @tatianamaslany &lt;3 this is very well deserved #cloneclub #Emmys,777700336433848320,1
111,KateODonn,Yaaaaas @tatianamaslany !!!!!!!!!!! #Emmys,777700336425439232,1
112,diovanacuper,EU NÃO SEI SE BERRO OU SE CHORO AMÉM RAINHA https://t.co/hbh9cQnkax,777700339659239424,2
113,TvAteMyBrain,Holy Shit! Who saw Tatiana Maslany winner Best Actress in a Drama Series tonight? What a great surprise. #Emmys #EmmysNation,777700340032385025,0
114,BelaCask,DEUS!! TATIANA GANHOU FINALMENTE EXISTE JUSTIÇA SIM #EmmyForMaslany #Emmys,777700340120612864,2
115,GraphZander,"""This is for the Elliots out there. There's a little bit of Elliot in all of us"" 
-Congrats @ItsRamiMalek and @whoismrrobot writers. #Emmys",777700339726192640,1
116,eu_maah_,ai sim parça https://t.co/VG9mlfpfoM,777700339361411072,1
117,Leo_Balmant,tudo q não tem nesse olhar é serenidade.. parece eternamente CHAPADO E PREOCUPADO https://t.co/vFvsJGYKhU,777700339948683264,1
118,ykaro_rbd,"Depois dessa tô até acreditando que GoT pode perder em série dramática
(Tomara que não) #Emmys",777700340183465984,2
119,CamiiM,Best.Line.Ever @ItsRamiMalek #Emmys https://t.co/p5Ys2hLEMh,777700339831169025,1
120,GamesNetwrk,#Emmys: Tatiana Maslany finally wins for her acclaimed work in #OrphanBlack https://t.co/JkncdyGK1G https://t.co/rgaBcA764n,777700340045053952,1
121,the1020d,Porra https://t.co/FCnqsTmwo3,777700340053504000,1
122,thismrevival,MEU BEBE GANHOU PQP #Emmys,777700340166778880,2
123,manrique_fey,Yeah Baby!!!! @tatianamaslany #Emmys  You're truly The best!!! #OrphanBlack @OrphanBlack,777700340124700672,1
124,SarahChristene,@tatianamaslany TATIANA #CloneClub #Emmys @OrphanBlack @JordanGavaris SO HAPPY @kellie_nc @TheBruun https://t.co/klVROQ6755,777700337335595008,1
125,emosswilson,Thank you @hwinkler4real &amp; #Emmys for honoring my friend and mentor #GarryMarshall tonight. #Recess #LifeIsMoreImportantThanShowBusiness,777700340380512256,1
126,almadacoin,MEU DEUS TO CHORANDO QUE A TATIANA LEVOU CACETE ATÉ QUE ENFIM #Emmys,777700340602925061,2
127,DarylsArms_,MY CANADIAN GIRL TATIANA MASLANY WINS IT. THIS IS THE HAPPIEST DAY OF MY LIFEE!! #Emmys  #CanadaCanadaCanada!!,777700340288331777,0
128,andreatamayo294,😍😍😍😍 https://t.co/JwighQeNwa,777700340582023168,1
129,firepixx,"So the male nominees get lines in their clips, but not the females? And on top of that Keifer butchers the winner's whole name? #emmys",777700343853506560,1
130,ellenpatrice,So i'm watching a live stream of the #Emmys to see @tatianamaslany take one home. I don't think i've screamed that loud in a long time. YAY!,777700343173963778,1
131,EliJfalcon,If u ever seen @OrphanBlack u would understand why @tatianamaslany won that Emmy #Emmys,777700344147116032,0
132,Robertavalentim,EU TO GRITANDO AQUI DENTRO DE CASA MINHA MAE VAI ME MATAR BUT IM SO HAPPY FOR YOU @tatianamaslany  #emmys,777700343983509504,1
133,ellassza,"Os donos da atuação Rami Malek e Tatiana Maslany ganharam, agora a gente alcança a paz mundial #Emmys #EmmyNaWarner",777700343585107968,0
134,oropezaus,Véanla https://t.co/eOwIDsMvD0,777700344218259457,1
135,omgkathryn1,Omg Rami and Tatiana won tonight and im so happy #MrRobot #Emmys #EmmyForMaslany,777700344021131264,0
136,bruthamarc,The copper on. The yellow looks too basic for an A list actress at an award show. https://t.co/fF0t4Jd5L0,777700344260235264,1
137,dhuhaghanam1,رامي مالك اجمل ماحصل في الحفل يستاهل يس 😍🇪🇬💪 #Emmys,777700344373604353,1
138,ComentaTV1,aahahahaha #Emmys https://t.co/F52mVLpSb8,777700344281370624,1
139,ChristinaWiech,When are #KeriRussell and @MatthewRhys gonna get some #Emmys love?! #TheAmericans,777700344260329472,1
140,iLalaBautista,Hey @tatianamaslany congrats for ur new #Emmys enjoy it and keep in the road. Congrats @OrphanBlack for u too love the serie.,777700344507801600,1
141,ArianaGalactic,Ariana Grande. BITCH  https://t.co/ZNsfnHkOSY,777700344297984000,1
142,SaishaStar,I am sooo Happy to hear that Rami Malik won for best actor !!!! #MrRobot #Emmys @ABCNetwork,777700344532967425,1
143,maguilaruiz,👏👏👏👏👏 You are the best @ItsRamiMalek 😍 https://t.co/2f93Ja0Zrf,777700344797114368,1
144,spirit_lana,"caralhoooooooooooooooooooooo meu amor ganhou mano
meu deus aeeeeeee https://t.co/dUg2az5yH4",777700344512012293,2
145,LarryHerrmann,So what do shows like #TheExpanse or #DarkMatter have to do to get noms? Swearing and nudity? Move to HBO? #Emmys,777700345174556674,1
146,itsmetaytay12,Can the surprise be Beyoncé do a surprise performance please @TelevisionAcad @jimmykimmel #Emmys https://t.co/uddWkCP6jQ,777700343350226944,1
147,evanpetrsr,EU VO DORMI MUITO FELIZ HOJE EU NAO QUERO PARA DE FALA SARAH E TATIANA GANHARAM EMMY #Emmys,777700345237663744,2
148,Savannah_S2,Rami!! Yes! ❤️❤️❤️ #Emmys #MrRobot,777700348383289344,0
149,EYGeekness,Rami and Tatiana.  New winners and amazing performers.  Nice #Emmys,777700347842269184,0
150,Nouis_paradise,"Viola dona da porra toda n ganhou , mas a Tatiana sim , feliz do msm jeito #EMMYS",777700348496584704,2
151,StrangeTeaParty,@tatianamaslany and #KateMcKinnon won!!!  Stick a fork in me because I'm done!!! #Emmys,777700348660097024,0
152,_dieghor,Tatiana ganhou...uouuuu...demorou mais chegou garota! #Emmys,777700348542586882,2
153,theojjmes,EU TE AMO PORRA VC MERECE TANTO AAAAAAAA VOU GRITAR UM PALAVRAO #Emmys https://t.co/Tk6989slaT,777700347204763648,1
154,2015Bieberyear,Aí meu coração ...essa noite foi d+ ..meus amorzinhos ganhando .... https://t.co/BD1wmNBymM,777700347682906113,2
155,Fede_Caniza,"A John Travalta le tocó la cara Lotocki, sino no se explica #Emmys",777700348672806912,1
156,antipatiaz__,Merece pelos tantos personagens que faz em uma serie só e muito convincentes. Ótima atriz. https://t.co/reAYlhdde9,777700348374941696,1
157,lostgirxl,TATIANAAAAAAAAAAAAAAAAAAAAAA #EMMYS,777700348505026560,1
158,G_Reelz,Tatiana Maslany wins emmy for best actress in a drama series for Orphan Black! #TatianaMaslany #orphanblack #Emmys #Emmys2016,777700348911767552,0
159,targareyin,morrendo de orgulho https://t.co/xFiXv4KoBz,777700348337283072,1
160,hvrrydun,HIS FACE IM CEYING https://t.co/rXYBWvFWOp,777700347947147264,2
161,pachicine,"MEJOR ACTRIZ EN DRAMA: Tatiana Maslany, Orphan Black. #Emmys. La vengo recomendando desde el principio. https://t.co/j1P8KZVrUv",777700348358164480,0
162,lanadelbellas,LITERALLY ME RN https://t.co/kka3HYeRBT,777700348987252736,1
163,Luisavarella,Até que fim 👏👏👏👏#Emmys https://t.co/rfa2Kkt6NX,777700348634992640,2
164,redtubullock,MAIS DO QUE MERECIDO MESMO PARABÉNS AMOR DA MINHA VIDAAAAAAA #Emmys https://t.co/hrUo28Xf4d,777700346542059520,2
165,TheQueen_OfNerd,Will always be remembered. Seeing Anton's face right away made me burst into tears. Still upset that he was so young https://t.co/ROpAEmt6Gq,777700349092036608,0
166,Matt17B,hermosa foto https://t.co/SmK4hw9whB,777700348869869568,1
167,Agnestic,"Mr. Robot and Orphan Black two of the most innovative, addicting shows, congrats! #Emmys",777700352183459840,2
168,Kathleencristy2,"Ai deus,falaram que vem uma surpresa,QUE SEJA A BEY,QUE SEJA A BEY🙏
#Emmys",777700352502169600,2
169,Hamza_K14,Well deserved https://t.co/zDEJ694FC4,777700352065953793,1
170,pettymary14,When Ross met Eleven at the #Emmys. https://t.co/DKBLcR0muY by @ELLEmagazine via @c0nvey,777700352590245889,1
171,Taylorae17,Yay Tatiana! #Emmys,777700352690749441,0
172,MonicaOliveira_,PEG PORRAAAAAAA https://t.co/upVG3N9PJR,777700352346951680,1
173,magwirerules,MAIS QUE MERECIDO PORRA #Emmys https://t.co/Vqe02CIJNg,777700352246292480,2
174,bootyreva,"Anyone else notice they didn't play clips of the best actress drama nominees' performances, only the men's? 👀  #Emmys",777700352938213376,1
175,thetruthisbere,Creo que John Ttavolta y Renee Zellgewer harían una bonita pareja con sus nuevos rostros #Emmys,777700353114419200,1
176,actresssinger7,NO BUT I'M LITERALLY CRYING I'M SO PROUD OF YOU @tatianamaslany! #Emmys,777700352766402560,1
177,NeverOutoStyle,TATIANA GANHOUUUUUU #Emmys,777700353315831808,0
178,TodosNetwork,And the winner for lead actress in a drama series is @tatianamaslany! https://t.co/S4OwD6YaxT #Emmys https://t.co/qJyw3VYHAu,777700352296706048,1
179,amf221,دائما وابدا #Emmys https://t.co/1n1WtcqAw6,777700352988766208,1
180,fffroni,TE AMO GUACHITA https://t.co/XNMqiy9coE,777700356000247808,1
181,ibroski,Hell yes @tatianamaslany!!!!! #Emmys,777700356952297472,1
182,pedrohenrian,"Me contento pela minha prata, muito feliz pela Tatiana #Emmys",777700356956491776,2
183,justinbuyea,Congrats to Rami Malek for his Emmy win as Elliot. Fsociety will be pleased #MrRobot https://t.co/Mw6DCkZ9lW,777700356654596096,1
184,CandisRMcLean,Big #Emmys #Emmys2016 Nominees and Winners Tonight - https://t.co/kwrc92LCvy,777700356914634752,1
185,gabrielchag,AEEEEE FINALMENTE!!!!!! https://t.co/hUttYcRNFv,777700356981653504,1
186,theonlymuppet,"There is such a thing as ""Too white to win an Emmy""! #Emmys",777700356268683264,0
187,emrekacaroglu,Sistemi hackleyip ödülü almıs #Emmys https://t.co/7KDhnl8e36,777700355660509184,1
188,yelyanick,hold up lana banana is dating charlie sheen's mom????? #Emmys,777700357669466113,1
189,dan_man4,Finally!! So happy for Tatiana Maslany!! #Emmys https://t.co/ikU6j9bUjP,777700356629331968,0
190,hollywrich,"Spacey was robbed, no? #Emmys",777700357619146752,1
191,forhirn,QUANDO EU PENSEI QUE O DIA NAO PODIA FICAR MELHOR https://t.co/NooDRoDDhn,777700357199847428,2
192,botheredbyyou2,So proud of you @tatianamaslany @OrphanBlack #Emmys #OrphanBlack #CloneClub #EmmyWinner https://t.co/fwl6Q7Auar,777700356398559233,1
193,infatuations_,"Ya ganó, ya pueden dejar de chillar todos los años. https://t.co/7b9KjWWwX0",777700357321424897,2
194,monalizanerak,TATAINA É RAINHA NÃO É MESMO?  #Emmys,777700357824708609,2
195,marianahsantoos,CARALHOOOOOOOOOOOOO GJKDKFF PORRAAAA #Emmys,777700357900304384,1
196,sybil1037,I was hoping he was kidding. :*( It's granny's bedtime. https://t.co/DUao4aVKJf,777700357967187969,1
197,kennedyshayna,Tatiana Maslany! I just recently watched seasons 1-3 of #OrphanBlack and she is seriously AMAZING! The Best #Emmys,777700360995479552,0
198,IdleTeeth,AT LAAAAAAST https://t.co/ADlnRSEUFm,777700360588759040,1
199,rainhatatiana,Muito merecido ❤️💜❤️💜❤️💜 #Emmys #OrphanBlack #Tatiana https://t.co/ZDmuhprn4J,777700360563658752,2
200,izagiglio,TATIANA MASLANY VOCÊ É A RAINHA DESSE MUNDO ESPLÊNDIDA FANTÁSTICA INCRÍVEL MAIS QUE MERECIDO ESSE #Emmys,777700360911749120,2
201,Thekilage,Tatiana Maslany ganhou!!!!!  #Emmys #EmmyNaWarner https://t.co/99znOgEcSL,777700360391720961,0
202,Coyote_hack,@JimeeCoronel Exelente actor y House of Cards exelente serie #Emmys,777700361083555842,1
203,allyswhistles,IFNALMENTIEKDEVF https://t.co/c2C1CX6GBj,777700361062801412,1
204,PavanJhunior,Bien por Rami Malek que se lo merece. #Emmys,777700361465397248,2
205,awinnersmind_,cutest alien https://t.co/FOWi8SD5A3,777700361469501440,1
206,jovane_sena,"TATIANA MASLANY GANHOU MEU CORAÇÃO SENDO A MELHOR SISTRA
#Emmys",777700361595457540,0
207,thuthus_,Bem merecido 👏 https://t.co/fGRwDdGmPj,777700361192734720,2
208,GirlWonder3,It was kinda like here y'all go now leave us alone. lol https://t.co/J19yd4nvB1,777700361452851200,1
209,shadowdemilovat,TO TÃO FELIZ #Emmys,777700361654112256,2
210,eitawalker,YAAAAS QUEEN https://t.co/ZyCcL7Mrcm,777700361637363712,1
211,ERNESTONODAL,Oh my god! tatianamaslany just won the Emmy for Best Drama Actress https://t.co/rgZtKyVRIi #Emmys https://t.co/I4HISztxK2,777700361687670785,0
212,brucewoyne,eu gritei muito alto aqui em casa e to tremendo de verdade minha bichinha tatiana maslany merecia demais essa porra #emmys,777700365345103873,0
213,jennekressgrove,"SE EU MORRESSE AGORA, MORRERIA FELIZ #EmmyForMaslany #Emmys",777700365315739653,2
214,SrBigodes_,Best quote yet https://t.co/U2sfKo0AW8,777700365378650115,1
215,phrazesforharry,My man! https://t.co/Vg4pPeyRzm,777700365386919937,2
216,batchstreet,GRITEI MUITO https://t.co/pr6McYU874,777700365454180352,2
217,EfixedOnFlix,Congratulations to my girl @tatianamaslany and #OrphanBlack team. #CloneClub in the house. #Emmys,777700365680668672,1
218,Khushkomal,Oh man there is lot of advertisement #Emmys,777700365235990528,2
219,KevinFrazier,#travolta trying to steal my gig ... dude played the hell out Robert Shapiro ... #emmys @etnow… https://t.co/Xpa7X13IRq,777700365357740032,1
220,cjaahy,MY BABIES https://t.co/hA5TC12xhw,777700365869260800,1
