,geo,screen_name,text,tweet_id,cluster_pred
0,,xxmaichard,😂 https://t.co/Nm5bGtoHId,777680967125217280,2
1,,stucksddl,esperando a categoria de drama #Emmys https://t.co/pDrhBpxOEC,777680966227722240,2
2,,Music_maestro,"billboard: Watch the ""Stranger Things"" kids slay ""Uptown Funk"" before the #Emmys https://t.co/KKaLAtbcEV https://t.co/hKScSQpiX6",777680967205023745,2
3,,PaulsonPhotogIG,SHE DID IT!! #SarahPaulson #Emmys,777680967616069632,4
4,,TO2Uruguay,#Emmys | Mejor Actriz en TV Movie o Serie Limitada: Sarah Paulson en #ThePeoplevOJSimpson https://t.co/CA7IR7djX3,777680967456653314,1
5,,AndreapaolaMili,Quanta varietà in questi premi ... #PeoplevsOJSimpson #Emmys,777680967515377664,2
6,,ShoeFashionForU,thecoveteur: Pretty sure this Gaby Hoffmann GIF says it all. #Emmys https://t.co/zvizOqSE32,777680967658049536,2
7,,Elvira0428,Yaaas kween!! 👏🏽👏🏽👏🏽 https://t.co/JLUsTE3630,777680967653740545,2
8,,Calculo_TV,#Emmys | Mejor Actriz en TV Movie o Serie Limitada: Sarah Paulson en #ThePeoplevOJSimpson https://t.co/JYjP7Vk0V4,777680967477723136,1
9,,Romain_Ch,Fargo :( :( :( #Emmys,777680967829975040,4
10,,TheScream666,USATODAY: RT usatodaylife: And the winner for lead actress in a limited series/TV movie is Sarah Paulson! #Emmys … https://t.co/Le0guUlblY,777680968404598784,0
11,,IamnotnotBatman,"Everyone is basically saying ""fuck your sendoff music, I have something important to say,"" and I'm loving every minute of it! #Emmys",777680968484356096,2
12,,tvrecapsreviews,Fantastic speech by Sarah Paulson too. She really is so great. #Emmys,777680968563863552,1
13,,jackie_reads,WHY WASN'T THIS AIRED?! #StrangerThings #Emmys2016 https://t.co/5Sk1ncM3xp,777680970812125184,2
14,,screamdasqueens,Sarah super mereceu #Emmys,777680970447196160,1
15,,camilacabellcs,Winter is coming! Game of Thrones is my choice for best drama series in @CoxComm's #Emmys poll! https://t.co/gPqnsmmatK,777680970916827137,0
16,,wtfnod,AI CARALHO https://t.co/z95ti5VYfy,777680971449729024,2
17,,vivishar,Oigan como que tengo que ver #AmericanCrime se rumora que es la serie del momento 🤔🤔 #Emmys,777680971889913856,2
18,,rmecheeya,"Guess I gotta watch The People Vs OJ Simpson. If it keeps beating Fargo, which was EXCELLENT,  then it must be good. #Emmys",777680971617402880,0
19,,TheScream666,"USATODAY: RT usatodaylife: ""It was because you thought I could that I even cared."" Sarah Paulson to Ryan Murphy #Emmys",777680971642667009,1
20,,CJancelewicz,Love this love #Emmys https://t.co/nXb6fjFgtB,777680971781070849,4
21,,MicahJesse,"""...and Holland Taylor, I love you!"" - #SarahPaulson #Emmys https://t.co/AxE6CZLcBt",777680970250088448,4
22,,LloydZiel,Sterling K. Brown wins Outstanding Supporting Actor in a Limited Series or Movie for 'People v. OJ Simpson' https://t.co/iDXVJ35yrJ  #Emmys,777680971864956928,0
23,,aruocco1,I think the #NutrishDog was dressed to impress at the #Emmys https://t.co/dNCKPRWbeq,777680971617411072,2
24,,klwusmikaelson,QUE DEUSA https://t.co/siLepUQx7m,777680971638407168,2
25,,impalergeneral,"Just got home, so my #Emmys remarks will be late. Already, Kimmel blames TV for Trump. Mean, but true.",777680972493971456,2
26,,trump2021,#Emmys https://t.co/NHdvHKQr5c,777680971726483458,2
27,,sietecho,"Claire Danes, Bryan Cranston #Emmys https://t.co/7iKIfHBXpo",777680970946347008,2
28,,TVLine,#Emmys 2016: Leslie Jones Laughs Off Her Terrifying Hacking Ordeal Onstage https://t.co/rr7GVurEGE https://t.co/KrJ7ejsAhl,777680971479023616,2
29,,JoemCua,So nice to watch the OJ Simpson prosecution team to finally win #Emmys,777680974792450048,0
30,,_leallaw,NEUDEUS OLHA Q MARAVILHOSAAA https://t.co/jTL70tQIzd,777680974607970304,2
31,,gloriamor80,Mis dramas favoritos actuales #TheAffair y #Mastersofsex y ninguna sta nominada en su categoría... #Emmys No me interesan mucho este año,777680974838726660,5
32,,fangirlishness,tbh i've never watched any of sarah paulson's work and i have no intention of doing so #Emmys https://t.co/HcoCAgFNO4,777680973744005120,1
33,,_supimpa,QUERO FOTO DA SARAH COM A TATIANA SEGURANDO OS EMMYS #Emmys #EmmyForMaslany,777680975006425088,4
34,,thisus_,até que fim lana ganhou um emmy https://t.co/kYgijhr1Sx,777680974670856197,2
35,,lmtvnte,Preciso ver American Crime Story #Emmys,777680975052541952,2
36,,_MissRobin,YASSS!!! Loved him in PPl vs OJ https://t.co/aJX6UbfYSo,777680974347927553,2
37,,kaaxavier_,Virou obrigação assistir American crime  #Emmys,777680975396470784,2
38,,almond_eyes121,I defiantly need more Rami in my life #Emmys,777680975513784321,4
39,,outroren,Af chega logo o de melhor serie #Emmys #EmmyNaWarner,777680975589470208,2
40,,trumpetnista,"But, still even our Kerry doesn't win, she WON the red carpet! She SLAYED. And she's so gorgeous pregnant. MY BABY'S HAVING A BABY! #Emmys",777680975870332928,2
41,,TrumpysTaxes,"Trump routinely forces reporters into pen, then uses dangerous lies to incite his thugs https://t.co/lArRE56CZT  #Emmys",777680975492808706,2
42,,vroldemort,"Bryan Cranston entregando o EMMY pra Sarah Paulson eu to chorando 
#Emmys #EmmyNaWarner",777680975744598016,1
43,,citizenjaney,i watch A LOT of tv. and i can honestly say that #PeoplevsOJSimpson was the best thing i watched last season. hands down. #Emmys,777680976453533696,4
44,,hermesonheavenl,AMÉM SARAH PAULSON #Emmys #Emmys2016 https://t.co/afsjAp23i2,777680975769833472,1
45,,NicoleChenoweth,Congrats to what was truly the performance of the year... @MsSarahPaulson you're a legend &amp; deserve all the #Emmys in the world.,777680975987826688,2
46,,ReinaaRoyale,https://t.co/SKpDV6dWIh,777680975941799936,2
47,,leodefranca,Acumula o tempo que teria pra falar em todos os prêmios que mereceu durante esses anos e a sarah paulson pode falar por duas horas #Emmys,777680976784785410,4
48,,Shupette,I've waited so long for @MsSarahPaulson to finally be recognized for her immense talent that I am sobbing!! #Emmys,777680977107623937,2
49,,lahederahelix,Oooooo she gave a shoutout to her boo boo Holland Taylor. Looove! #Emmys,777680979104178176,2
50,,toma05,My favorite @ArmyWives star!!! Amazing performance in #ThePeoplevOJSimpson and a WELL DESERVED #Emmys https://t.co/iD03hd9MA8,777680978206613505,2
51,,Aelyn_12,Forza inquadrate ancora Pedro Pascal e nessuno si farà del male.. o plomo #Emmys #Rai4,777680979058126850,2
52,,belleswift17,Y'all are soooo extra https://t.co/GJys99WrcO,777680978714226688,2
53,,JessWeiner,@MsSarahPaulson What a speech. What a way to offer dimension to Marcia Clark's real life.  #Emmys,777680978999250944,4
54,,kjoro,@SarahPaulsun yaahhhssss!!! All hail the queen!! #Emmys #ThePeoplevOJSimpson,777680978991079424,2
55,,dilpreet_kainth,#GameOfThrones is a surefire winner for ‘Outstanding Drama Series’ at the 2016 #Emmys. Place your vote with @OSN. https://t.co/g4iNLVZcai,777680979175567360,0
56,,GuslightAngthem,Paulson and Brown win for The OJ show. Good I can go to sleep now #Emmys,777680979313979392,1
57,,_raphaelaleite,próxima categoria é a do benedict no momento fazendo uma rodinha de oração pra ele ganhar #emmys,777680979683119106,2
58,,giaface,I CAN'T STOP CRYING SARAH WON HER SPEECH WAS SO AMAZING I LOVE HER I LOVE MARCIA CLARK I'M SO OVERWHELMED AND EXCITED!!!!!!!!!!!! #EMMYS,777680979083264000,4
59,,mslizangel,The best acctres forever sarah paulson #Emmys,777680979481731072,1
60,,unicornialauren,ESSE É O PRIMEIRO MAS SE FOSSE CONTAR OS Q ELA DEVERIA TER GANHADO DAVA UNS 15 #Emmys https://t.co/emfvyXzbBQ,777680978911297536,2
61,,AppleInc_AAPL,"iTunesTV: Thank you for your powerful performances in AmericanCrimeTV and congratulations, ReginaKing!
#Emmys https://t.co/7uChaqt0xT",777680980001914880,2
62,,sabrinafrascona,THATS MY GIRL @MsSarahPaulson #Emmys,777680979972456448,2
63,,TrishTak,The People vs OJ Simpson is cleaning house at the #Emmys,777680980618334208,0
64,,Central_mx,#Emmys De las escenas más memorables hasta este momento. Nuestros personajes favoritos de #StrangerThings 😍😂 https://t.co/ic6VQQx3QT,777680979540389888,2
65,,Gracynhabl,Como eu te odeio...um dia eu consigo separar o ator do personagem https://t.co/Ae1ZUIVPrQ,777680978781274112,2
66,"[35.8188, -78.6446]",_WallysWorld,"What am I doing tonight? Oh, just watching the #emmys with my girls! #nbd #tvnews #producer #tv… https://t.co/PKvsIZ5B6n",777680980857327616,4
67,,moskaezul,Sterling K Brown won an award and within 45 sec he got from 8800 to 9200 twitter followers #Emmys,777680980907692032,2
68,,rayniicks,"Estoy llorando por el discurso de Sarah, al agradecerle a Ryan, eres grandiosa 👸🏼 #Emmys",777680983361409025,2
69,,marisavelli,Sentimento assistindo #Emmys https://t.co/Lx2oNBOgfG,777680983357132801,2
70,,batvengers,Ta difícil conviver com esse monte de comercial  #Emmys,777680983697027073,2
71,,AVTVClub,.@MsSarahPaulson believes in Mercury Retrograde—Mercury goes direct this weekend. #Emmys #AVCTV https://t.co/TlrBpp46Jp,777680981876699136,2
72,,falloutboythnks,AWW IM https://t.co/o2VerFCaLm,777680983126634500,2
73,,Nomdetuite,"Sarah Paulson! Now Todd Haynes must re-cut ""Carol"" to make her part as big as her talent. #Emmys",777680983327924224,1
74,,prensacom,Sarah Paulson se lleva a casa el premio Emmy a la Mejor Actriz Principal en una Miniserie o Película #Emmys @prensacom,777680984145666048,1
75,,A_Phoenix721,If Lemonade doesn't win #Emmys https://t.co/US9iDsTMXN,777680983206223872,4
76,,TrentBrock,@GMA @ACSFX Well deserved!! #Emmys #ThePeoplevOJSimpson,777680984133304321,2
77,,ThreeColumnsArt,Poor Claire Danes got Charlize Theron'd right before the #Emmys. https://t.co/3yJXIjdmb3,777680984321822720,2
78,,heykim,#Emmys https://t.co/Xv0Zn3hEXz,777680984460304385,2
79,,HannahMichelleJ,My girl won an Emmy! 😭 love you @MsSarahPaulson! Congrats!! #Emmys,777680984401666048,2
80,,rissadee,Me too! She brought Marcia Clark to the #Emmys I hear... https://t.co/krHu76jCYd,777680984422555649,4
81,,SeriesGD,Aquí esperando que nominen series que me importan #Emmys https://t.co/wiU7dXOylC,777680984154247169,2
82,,qualitykicks63,"Shop till you drop! Take a look at what's on sale now at Mercari!
https://t.co/2lAWu0F3OR #Emmys #osu #nikeplus https://t.co/9NVTDbq6kV",777680978730975237,2
83,,AfroRoseBlossom,"You're not alone girl, me too! https://t.co/MtxwPhakAw",777680983764205568,2
84,,rkuuleiq,'Simply Soft &amp; Supple Kinda Life' https://t.co/qcj0e1Dmtj,777680984565100544,2
85,,leni_artemides,"When you're mumbling ""Give it to Press, give it to Press."" at 3:30am. Better choice watching @ChristenPress kill it than the #Emmys #USAvNED",777680987450908672,4
86,,GreciaDackles,Sarah Paulson.. grandiosa 👏🏽#emmys,777680987325169664,1
87,,jesuischerry,👏🏿👏🏿👏🏿👏🏿👏🏿👏🏿👏🏿👏🏿👏🏿 https://t.co/6SvUa16AnO,777680987027230721,2
88,,brittyjb,@MsSarahPaulson is the real deal #Emmys,777680987878625280,2
89,,londapatter1,8NEWS: RT Whitney8News: I'm behind! Clearly I gotta watch The People v. O. J. Simpson! #Emmys,777680986972819456,0
90,,CCRK1,"Sarah Paulsen serving 1980s Nancy Reagan/Princess Di realness.
#Emmys",777680988105170944,4
91,,LeVanDHawkins1,this gave me tears. https://t.co/zZs4FhuYOU,777680987492872192,2
92,,briarclift,a pinta o ryan murphy como um monstro mas o cara é um genio na moral #Emmys,777680988088467460,2
93,,hollebrew,The #Emmys:  The one show where I want her to win.  And her.  Oh but she was so good too.  Give everyone an award!,777680988340117504,4
94,,Favstar_Bot,"@goldengateblond Congrats on your 250❤️ tweet! https://t.co/E3uNJObH6y

https://t.co/Jo9WDui7Jo",777680986830102528,2
95,,Mrfurious32821,Sarah Paulson is just the best. Nothing she can't do. #Emmys #PeoplevsOJSimpson #AmericanHorrorStory,777680988147224576,1
96,,2015Eilert,"Watching the Emmys! #Emmys
#Emmys2016 #JimmyKimmel",777680987996164096,4
97,,nbizol,rainha né mores https://t.co/D7grjEplIo,777680987337658369,2
98,,WIRED,Outstanding Actress in a Limited Series or TV Movie goes to Sarah Paulson for 'The People v. OJ Simpson' #Emmys https://t.co/P2aeXBm9HB,777680987069243393,0
99,,Kas_Bradley,Well I guess I'm watching #Transparent and #ThePeoplevOJSimpson  #Emmys,777680988730122241,4
100,,pampeela,That's awesome! https://t.co/z9X3qIs3Jo,777680991565393922,2
101,,ACSFX,All rise for @MsSarahPaulson! #ThePeoplevOJSimpson #Emmys https://t.co/8WKrlRt3Ee,777680989199798272,2
102,,18to49podcast,I'm getting more anxious and he limited series award draws closer. #toomanychoices #Emmys,777680992119033856,0
103,,jerrysharell,Alotta papers being pulled out tonite for speeches.  Yawn. #Emmys,777680992001597440,4
104,,alexywilson,She looks amazing. https://t.co/YQfsvYRxca,777680991649488896,2
105,"[41.82530676, -87.85988606]",freethinkr226,I'm watching the #Emmys and loving it. Jimmy is doing a funny ass job as host. (@ Beach Ave. Apt.) https://t.co/57KJMSY0ZD,777680991926231040,4
106,,ClothesHearted,"Sarah Paulson should also win for best acceptance speech and best cleavage 👏🏼
#Emmys",777680992618287104,1
107,,gramfurn,The real Marcia Clark and her portrayer Sarah Paulson! #Emmys,777680992895012864,1
108,,IGoByAlice,You're mother is trash for not swallowing your cunt ass https://t.co/ZJ4cDir6JA,777680992114880512,2
109,,RARAU,Keri Washington is prego...where have I been #Emmys,777680993037586432,2
110,,TrueMusicIsLife,That was a TOUGH category… #Emmys,777680992689618944,2
111,,Alta_LMSW,And the #Emmys goes to... John Travolta's eyebrows. 👀,777680993029324801,2
112,,londapatter1,8NEWS: RT GMA: #Emmys Lead Actress in a Limited Series or Movie - Sarah Paulson for #ThePeoplevOJSimpson: ACSFX https://t.co/ja51kVA8Xt,777680992135938048,0
113,,ShoeFashionForU,FIDM: Brilliant. 😂🍊 https://t.co/Kcwdbc4hmu,777680992790253568,2
114,,ImBearlyThere,Comeback of the year: Marcia Clark #Emmys,777680993251577856,4
115,,tequiladojamie,SARAH AGRADECENDO O RYAN #Emmys https://t.co/TG9diIl6Nt,777680992840642561,2
116,,R96RK,This looks like a ball dance from a disney movie #Emmys https://t.co/WfPx2i7B70,777680993469734912,2
117,,TrueBlueAce,She deserves it! https://t.co/ueA1FztuR3,777680993385902081,2
118,,LaurieSeidman,So many 'Woo hoo!' Moments watching #Emmys tonight! #I❤️TV,777680993993969665,4
119,,bignliddle,Ryan Murphy must be like 🤑🤑🤑🤑🤑🤑🤑🤑🤑🤑 tonight #Emmys,777680995554320384,2
120,,AdrianaMarinSh,Me dio antojo de comer PB&amp;J despues de ver esos snacks que dieron en los #Emmys y me fui a preparar uno. #ilovepbj,777680995927678978,2
121,,scrmariia,AI MEU DEUS MINHA RAINHA https://t.co/lcJ9dtPJBr,777680995835346944,2
122,,brnxxa,nem um pouco surpresa que sarah paulson ganhou #Emmys,777680996313554948,1
123,,londapatter1,8NEWS: RT TelevisionAcad: What an #Emmys Moment! Congratulations to ReginaKing  of AmericanCrimeTV for her win as … https://t.co/Ga3oTWuBZn,777680996284133376,2
124,,TheSandMan88,#Emmys ..... https://t.co/l0MrU2zsEi,777680996061761536,2
125,,CulturaColectiv,"Sarah Paulson llegó acompañada de Marcia Clark, personaje que interpreta en The People v.O.J. Simpson #Emmys https://t.co/OQMpgaUspx",777680994778357761,1
126,,JackalopeKisses,Look at this gorgeous goddess slaying that red carpet #Emmys https://t.co/9paXeCGNxu,777680996011483136,2
127,,hrrorstranger,EU TÔ TÃO FELIZ MMNSJSJHFOAJDOSJDSLJDOSJDISJDKSJDI SARAH MERECE MAIS QUE QUALQUER UM #Emmys,777680996565127168,4
128,,Quiwizee,St. Louis represent 🙌🏾 https://t.co/88zPswIi0M,777680996896387072,2
129,,Maycon_myn,TE AMO SARAH #Emmys,777680995961233408,1
130,,brenlavega,AMÉM SARAH!!! DONA DA PORRA TODA RAINHA DA TELEVISÃO AMERICANA TE AMO MÃE #Emmys,777680997106212864,2
131,,radicalxrad,AHHH YAS SARAH PAULSON!! #Emmys,777681000209977344,1
132,,fangirl_es,Diversidad en serio en los #Emmys ganando y nominados actores de todos tipos https://t.co/gugtmJRSfg,777680999480107008,5
133,,Looklive,Awesome #Emmys speech! 🙏,777681000344064000,2
134,,ce_roma,Finally Sarah Paulson took it. What else did she have to do?! #Emmys,777681000725962752,1
135,,sHy_119,This the guy from Army Wives!!! Yo!! That's great! #Emmys,777681000864198656,2
136,,UpbeatFriday,Sarah Paulson's first role was playing the daughter of a murder victim on 'Law &amp; Order.'  #Emmys https://t.co/mFuQ487Tj4,777681000734294016,1
137,,hartfordcourant,"Sarah Paulson, Julia Louis-Dreyfus &amp; Jeffrey Tambor are among the winners at the #Emmys https://t.co/Nd2ioT0lOr https://t.co/yuBFu2F91E",777680992299614208,2
138,,lessentielest,18 nominations per Fargo.. 18! #Emmys,777681000704925696,2
139,,peonyrose321,Guess I need to watch People v OJ Simpson. #emmys,777681000843313152,0
140,,RoundAboutChat,Also making me nervous: John Travolta's face. #Emmys #EmmysPRP,777681000801374208,2
141,,SussuDeMoura,Ai Jesus multiplica essa mulher!!! https://t.co/8l656f77mE,777680999752794112,2
142,,SchenkelTown,Do you think the real OJ Simpson is celebrating all these wins in his cell by making shivs in the shape of #Emmys?,777681001308889088,0
143,,BraindamagedFr,Tu as raté le début de la Cérémonie #Emmys  Le recap des récompense et du palmares so far est ici &gt;&gt;&gt; https://t.co/cSvBfP9FUk,777681000956567552,2
144,,AlphaDelta33,Awww loved Sarah Paulson's speech!  #Emmys,777681001640177665,1
145,,FIDM,"Yay! Congratulations @MsSarahPaulson for playing Marcia Clark in ""People v. O.J. Simpson."" #Emmys https://t.co/tEI6GoIEFB",777681000805478400,0
146,,BarefootLympho,"@MsSarahPaulson BRILLIANT! What a beautiful , classy, speech! Celebrating women. Truth. LOVE!!!!! #Emmys #ilovehollandtaylortoo",777681001279393792,2
147,,Anx_ty,YAYYY Sarah Paulson que bella #Emmys,777681001610870784,1
148,,fuckingalzc,AAAAAAAAAHHHHHHH 💜💜💜💜 https://t.co/BeWf6W4ruC,777681001451491328,2
149,,disla_rafael,FINALLY! https://t.co/6tSBw8s7k7,777681003821359104,2
150,,dovblerainbow,RAINHA DO CARALHOOOOOOOO AMEI https://t.co/47t0mK0dB6,777681003930324992,2
151,,os_geeks,"Com 22 indicações, ""The People v. O.J. Simpson: American Crime Story"" já levou sete prêmios até agora...
#Emmys",777681004563685376,0
152,,circumambiennt,sarah paulson a coisa mais linda deixa eu te bja #Emmys,777681004832100352,1
153,,beabuzati,eita discurso bom o da Sarah #Emmys,777681005004091396,2
154,,kphbritt,Claire Danes looks radioactive #Emmys,777681005301817344,2
155,,sincerelySharia,😍 https://t.co/cSRd77ly5Q,777681004966256640,2
156,,A_Janowiak,TV SERIES' GOD and GODDESS! #Emmys2016 #Emmys https://t.co/qmCqfDp3Og,777681004383330304,0
157,,Queen_Daenerys_,Emilia Clarke is adorable 😍 #Emmys https://t.co/dZ12oscjFx,777681004282675200,2
158,,ailmadoshade,Eu to muito feliz com todos os prêmios de #AmericanCrimeStory. Que série. Que elenco. Que história. #Emmys,777681005448687616,4
159,,_k4t,"Omg I am so happy @MsSarahPaulson won her Emmy!! So so deserved, she was the main reason I watched OJ #Emmys",777681005461331968,2
160,,revistawatt,Ovación al Emmy a mejor actor de miniserie que ha sido para Sterling K. Brown por #AmericanCrimeStory #Emmys https://t.co/iltQiG4cZK,777681005440368640,2
161,,modakoaj,"Amamos el vestido sparkling green de Sarah Paulson en los #Emmys ✨✨✨ Sencillamente, espectacular https://t.co/7Hg9fsvXaX",777681004224020480,2
162,,gagawhiskeykiss,To chorando! https://t.co/q8ELUBAHGW,777681005591212032,2
163,,SAQuinn1978,So many emotional thank you speeches at the #Emmys,777681008351023104,2
164,,ReneeL324,Sarah!  She deserves that Emmy!  She was fantastic as Marcia Clark. #Emmys,777681008598458368,1
165,,JRSweeTooth,WHERE IS WILL?? https://t.co/Pgxf4Tr4nT,777681008573370368,2
166,,ryansmithtv,#Emmys are great tonight!  #PeopleVSOJ - wow - not only a phenomenal show but killin it with Emmy speeches!,777681008602804224,2
167,,kirgrave,MINHA FILHA NAO FOI BOICOTADA OBRIGADO JESUS #Emmys https://t.co/4BQzeUGhIr,777681006153302017,2
168,,ranapamela,I love you Sarah Paulson #Emmys,777681008959291392,1
169,,gaytoltzmann,@MsSarahPaulson CONGRATS!! #Emmys,777681008854441986,2
170,,geewhizzle,"I'm tearing up. Beautiful speech! We're all so proud, @MsSarahPaulson! #Emmys",777681009076740096,2
171,,asyIuum,#emmys https://t.co/UIGNfm6DUf,777681008808296452,2
172,,brettrosto,#Emmys   WHAT A WASTE OF TV!!!!!! https://t.co/KiX0QTlK8H,777681008535609346,2
173,,AmazingAleksct,"Non c'erano dubbi, ma vedere Sarah Paulson con un Emmy in mano mi fa sempre felice. #Emmys",777681010054103040,1
174,,feastforthrones,eu vendo vocês alucinados por atores de séries que eu não vi #Emmys https://t.co/fMZU4aUrFN,777681009437532160,2
175,,Ewerton_Gomes_,Por mim Seinfeld estaria recebendo prêmio até hoje #Emmys,777681013199638528,2
176,,TVGuideArabia,6 ترشيحات سابقة لسارة وهذا اول فوز لها، تستحق كل تقدير سارة بولسن عن اداءها الرائع في امريكان كرايم ستوري #Emmys https://t.co/bdIQM967zL,777681011350142976,2
177,,DalulOmar,#SarahPaulson muy bien merecido #Emmys,777681012809760768,4
178,,_Mvalverde,Ugh I love her !! 😍 https://t.co/yWDJnRp9dN,777681012025389056,2
179,,audreycnn,Congrats to @MsSarahPaulson whose speech has me crying. She brought a humanity to her portrayal of #MarciaClark on @ACSFX! Bravo! #Emmys,777681012327407616,2
180,,Spectricide,With the @HollandTaylor shout out. #Emmys,777681013170286593,2
181,,BadGirlVeneno,"SARAH JÁ FOI 
AGORA VEM TATI #Emmys",777681014109900800,2
182,,lawrenconha,Effie aprovou #Emmys,777681014080544768,2
183,,KellenDotCom,"Come thru, Regina King! #Emmys #AmericanCrime",777681013443092480,2
184,,nigelbarto,Congrats Regina King on your #Emmys win https://t.co/bSyXS7ogAa,777681013598253056,2
185,,allisonnadams,"""Holland Taylor I love you"" I'm dead #Emmys",777681014252601344,4
186,,holavzla,#Emmys Sarah Paulson gana el premio a la mejor actriz de una miniserie o película 💚👏🏼📽 https://t.co/JtUTjuaMWC,777681013363339264,1
187,,dragmeswen,SARAH MERECEU MUITO EU TO EMOCIONADISSIMA #Emmys,777681014516772864,4
188,,mascusharmony,amem paulson https://t.co/1KEfM55TmU,777681016622354432,1
189,,Kendall_JW,"This category was by far the toughest of the night, to me. Each woman could've EASILY won #Emmys",777681017477804033,2
190,,IronGirlMarvel,No sé si Warner no dijo «Game Of Thrones» por las casas productoras o qué #Emmys,777681017276538880,2
191,,Lucas_Shaw,The winners at this year's #Emmys are diverse. The executives praised in acceptance speeches? Not so much.,777681017075150848,2
192,,MissPopStar,The People VS OJ Simpson is kicking ass and I love it! #Emmys,777681017641500673,0
193,,SmkeCollective,"Preview of Trump's next rally #Emmys https://t.co/plPu113kcD

— Esquire (esquire) September 19, 2016 https://t.co/aoeWsQHAw1",777681016748122113,2
194,,confidellie,A SARAH PAULSON GANHOU UM EMMY #Emmys  https://t.co/GtjCtkSTuZ,777681017758965761,1
195,,ChristyKarach,Congrats Sarah Paulson!!  Incredible performance in the People vs OJ Simpson #Emmys #Emmys2016 #ThePeoplevOJSimpson,777681017750650880,0
196,,acker_ed,"Sterling K. Brown thanks MsSarahPaulson: ""Where you lead I just try to support"" https://t.co/uXWjhoTsLH #Emmys … https://t.co/mnmboItqZi",777681017528283144,2
197,,MayorKingz,...Had 22 Nominations afterall!!! The People v Oj Simpson cast n crea givin dem here! #Emmys,777681018119659520,0
198,,animaniac704,Sarah Paulson and Sterling Brown with deserved wins for #PeoplevsOJSimpson on the #Emmys,777681018366988289,1
199,,msamysteele,HUGE congrats to @sterlingkb1 awesome!  #Emmys,777681018191015936,2
200,,fatsophieturner,i love sarah paulson with my entire soul  #Emmys,777681017717096449,1
201,,klaustrofobica_,Minha serizinha #Emmys,777681018723700736,2
202,,asongforthesick,"Só vim aqui pra dizer que estou de pompom na torcida a Tati Maslany, vamos todos começar a corrente de oração. #Emmys",777681018862071808,2
203,,Lipeeking,"Sarah ganhou um #Emmys caralho, ela merece a atuação dela em ACS foi ótima.",777681020841852928,4
204,,AmyAhnBryant,#ThePeoplevsOJSimpson was amazing. I'll be shocked if it doesn't get the nod but who knows  #Emmys,777681021261213696,4
205,,whatrosasaid,I'm never eating again! #Emmys,777681021567324160,4
206,,MarcosLamas8,Ahora están dando los #Emmys después van a dar los Marcoss y así con todos los nombres,777681021479321600,5
207,,katrinalofaro,But really... where the F is Beyonce.  😴 #Emmys,777681020925669376,2
208,,WolfytheBlack,Well the real Marcia Clark &amp; Chris Darden may have lost their case but at least their actors won! #Emmys,777681021479170048,4
209,,strangerslives,ainda to indignada q o christian slater n foi indicado por mr robot ele ta mt foda mas enfim #Emmys,777681021450027009,2
210,,DanYanofsky,The most deserving winner in some time. Paulson was the glue that held #PeoplevsOJSimpson together. #Emmys https://t.co/1C8iSGFmvV,777681021261193216,2
211,,Crutnacker,"If John Travolta's eyebrows don't win something, this whole  #Emmys is fixed.",777681021948923904,2
212,,nicoguerrero25,Bien merecido Sarah Paulson 👏🏻 la gente te ama ❤️#Emmys,777681021928103936,1
213,,drunklouisgirl,sarah paulson eu escolhi te amar #Emmys,777681021705805824,1
214,,Ci_so_lowkey,OJ lil series racking up the #Emmys,777681022330601474,0
215,,arihalbkram,Haha. Chicken Parm. Great reference. https://t.co/EzrrSyjLaN,777681021756145664,2
216,,DivagadasShow,"#Emmys2016 #Emmys 
Sarah Paulson gana 'Mejor actriz en Miniserie' por #AmericanCrimeStory https://t.co/ML1lc6Lohq https://t.co/HTjj5OnQYl",777681017721139205,1
217,,YoUnGgOoDfElLa7,I swear @ABCNetwork should change to the @jimmykimmel Network #Emmys he's everywhere on that channel,777681022221561856,2
218,,MyMissus,Yeeessssssssssss https://t.co/gLwLCQ6tqO,777681022494314496,2
219,,oihobbit,SOCORRO OLHA SPN #Emmys,777681025510039553,2
220,,mdsidarous,Kirsten Dunst was robbed #Emmys,777681025455448064,2
221,,JSlamboni,"The 68th annual @TheEmmys 's. 
Congratulations to all of this years nominees and especially this seasons winners. #Emmys #Emmy",777681025883189248,2
