,geo,screen_name,text,tweet_id,cluster_pred
0,,fedezingman,"#BattleOfBastards es el mejor capítulo de la historia de TODAS las series.
Obviamente tenía que llevarse algunos #Emmys #Emmys2016",777698553728733184,0
1,,bambinafantasma,"""Interpreta la mamma in una serie di cui non ricordo il nome"" MA SEI SERIO #Emmys #Rai4",777698553498112000,0
2,,IJhosting,Que si no? soy el primero! #Memes #Emmys #Venezuela #Youtube #youtubers https://t.co/47kLwjshj3,777698553028349952,0
3,,gabrielm_,VAMOS LÁ RAMI VOCÊ CONSEGUE #Emmys,777698553758187521,1
4,,lulidesm,Vamos Rami !! #Emmys,777698553678495744,1
5,,httpsdeadrose,VAI LINDO#Emmys,777698553992994816,1
6,,GodIgetitnow,I’m rooting for #Homeland to win ‘Outstanding Drama Series’ at the 2016 #Emmys. Place your vote with @OSN. https://t.co/h2tLW6Dbvw,777698554055909377,0
7,,ziamsuper,VAI RAMI CARAI #Emmys,777698554273992704,1
8,,Casheets,Got to see the cast of Game Of Thrones at the Emmys ✨#Emmys https://t.co/GWZfcXlnjv,777698550994001920,0
9,,johnbonazzo,Drama actor is the category that gets clips this year. #Emmys,777698554320187392,0
10,,workoutwindy,She has the most amazing voice #Torikelly https://t.co/LQG6pnVszf,777698555427291136,0
11,,sharkygirl74,"So if #Tatiana  doesn't win tonight, they're just gonna cancel the #Emmys permanently, right? Cus if she doesn't win then WTH is the point?",777698555804938244,0
12,,rrosenthal,Any notable omissions in the In Memoriam this year? #Emmys,777698555993657344,0
13,,myra2geek,See our updated 2016 #Emmys winners list: https://t.co/TiQkt4XFXC https://t.co/gdgK6wL7qf,777698557377777664,0
14,,maksimvolkov192,"939
#اطردو_عقيل_من_الاهلي
#السعاده_عندي
#Emmys https://t.co/x1rYkyeFck",777698557172314113,0
15,,glaney5,they got Beyoncé bent https://t.co/OfQB2hqRmm,777698558132621314,0
16,,sfiorata82,#Emmys #Rai4 quanto mi sta simpatica #AllisonJanney 😁,777698558208270337,0
17,,beritk,Allison Janney is gorgeous and graceful #Emmys,777698558556246016,0
18,,EugeniaMunoz,No entiendo!! Ningún actor de GOT ganó  #Emmys https://t.co/BuP2lNooU4,777698556778020864,0
19,,hollyjean331,Allison Janney is stunning!!!! #Emmys,777698557117632512,0
20,,MatiasAdducci,Vamossssssssssss Rami @ItsRamiMalek locooooooooooo #emmys,777698559126827008,1
21,,MrsHarryOfWales,#Emmys https://t.co/mdKwbDkFhd,777698558560591873,0
22,,Wilde_One,Totally. @torikelly did a beautiful job of Hallelulagh....❤️ https://t.co/T9OcDi8VgO,777698559248338944,0
23,,_Kokoa,RAMI PLEASE! #Emmys,777698559764402176,1
24,,theblinglady13,"Sure hope so! Terrific stories, acting, writing, directing! #ChesapeakeShores @hallmarkchannel #Emmys deserving! ❤️ https://t.co/LEutXoQJk2",777698559952945152,0
25,,raesanni,Bob Odenkirk is incredibly super sexy #Emmys,777698561970540544,0
26,,ranniery,Embora eu tbm ame Frank Underwood #Emmys,777698561735753731,0
27,,BlackGirlNerds,If Mr. Robot doesn't take this damn Emmy...#Emmys,777698562142457856,0
28,,gabygavica,"A propósito del ""In memoriam"" de Los #Emmys #EmmysPorWarner  AQUI mi Foto con #HughObrian https://t.co/xwrVxtef35",777698561211248641,0
29,,SerenadasPen,Stunning &amp; sexy my sag sis ✨ @AllisonBJanney @TheEmmys #Emmys,777698562050170880,0
30,,C0RALGRIMES,BOB OR KEVIN PLEASE #Emmys,777698561299451905,0
31,,DressUpFash,ManRepeller: They know nothing. #Emmys https://t.co/IBZFQQ59Jd,777698562641649664,0
32,,myra2geek,"Work it, allisonbjanney!!!! 👏👏👏 #Emmys https://t.co/oO8ebjJ4yL",777698562612289536,0
33,,_pianishimo,RAMIII GO GO #Emmys,777698562805272576,0
34,,bookshield,Não me surpreende se Mr Robot levar melhor ator... Esse homem é absurdamente incrível! #Emmys,777698562327142400,0
35,,Starlysh,.@AllisonBJanney 👑❤️❤️ #Emmys,777698562863927296,1
36,,JustineLavaworm,Can't believe you left out 1492! https://t.co/CVt55UStr7,777698562649919489,0
37,,LuuanRamos,Melhor ator de drama é do Rami Malek né irmãos #Emmys https://t.co/ABBxw0ZtSK,777698562230587392,1
38,,_dylansherman,I want Rami to win so bad. #Emmys,777698563744796672,1
39,,WithinOurGaze,*fingers crossed for Rami* #Emmys #MrRobot,777698563979640832,1
40,,rachiewashere,Seeing Prince in the In Memoriam just reminds me I'm not over his death. #Emmys,777698563962703872,0
41,,TVGuide,.@torikelly just paid a beautiful tribute to all the actors and actresses that we miss dearly. #Emmys https://t.co/ZloPwhfag5,777698562285113344,0
42,,medeirosv,Que mulher da pora https://t.co/t3OswPel93,777698565191790592,0
43,,heeyDaniele,Rami tem que ganhar! #Emmys,777698565778997248,1
44,,MlkM10,كس ام الايمي بالله هذا وجه واحد يفوز فيها  https://t.co/pu4ZljuO4B,777698565728694273,0
45,,thefuturistt,RAMI VAMOS RAMI #Emmys,777698565955194881,1
46,,freffymodinha,SE RAMI NÃO GANHAR ELE HACKEIA TODO MUNDO #Emmys,777698565841903616,1
47,,cesar_livio,"Winter is coming! Game of Thrones is my choice for best drama series in @CoxComm's #Emmys poll!
https://t.co/t0ac6QzT7O",777698565845946368,0
48,,brujavolto,POR FAVOR POR FAVOR POR FAVOR POR FAVOR POR FAVOR QUE SEJA RAMI RAMI RAMI RAMI RAMI #Emmys,777698566265507840,1
49,,BGuidobaldi,Rami Malik es la momia en Una noche en el museo? #Emmys,777698566747852800,1
50,,Calculo_TV,#Emmys | Mejor Actor en Drama. Nominados &gt; https://t.co/j8FhPk2dp7,777698566873681920,0
51,,DressUpFash,FIDM: Key &amp; Peele 👏🏽👏🏽👏🏽👏🏽 #Emmys https://t.co/3pOGm2ZA9f,777698566831763464,0
52,,TO2Uruguay,#Emmys | Mejor Actor en Drama. Nominados &gt; https://t.co/ZEPihzLzsi,777698566848544768,0
53,,eI995,POR RAVRO RAMI WLFBWKSN #Emmys,777698567087648768,1
54,,Filmcricket,"Matthew Rhys, PLEASE. #Emmys",777698567330947074,1
55,,lisalovesbacon,YES PROFESSOR MCGONAGALL https://t.co/HbA8eqy2BS,777698567586623489,0
56,,positively4st,"Queen Allison Janney has arrived. Give her all the awards, so you guys can go home. #emmys",777698567725002752,0
57,,_swch_,IT'S ALMOST TIME!!! PLEASE PLEASE LET @tatianamaslany  WIN!!!!  #EmmyForMaslany #Emmys,777698567154573312,1
58,,scholaurship,rami or bust #Emmys,777698567649648640,1
59,,DressUpFash,FIDM: Best Drama Series Writing goes to Game Of Thrones! #Emmys https://t.co/b3od6Ax1Vq,777698568174002177,0
60,,Kashyyyk13,"I love Spacey, and always will, but I reeeeaaaallly want Rami Malek to win this one 🙏🏼 #Emmys",777698568949927937,1
61,,CeejayeMedia,C'mon @ItsRamiMalek Win this!!! @TheEmmys #Emmys2016 #Emmys,777698570409357312,1
62,,hollaundroden,cade manooooooooo  #Emmys,777698570317230080,0
63,,_maryinthesky,VAI RAMIIIIIIIII #Emmys,777698570321399808,1
64,,ebromorrison,TA QUASE #EmmyForMaslany #Emmys,777698569708974080,0
65,,Justnayelii,@JoshuaSanera  https://t.co/cRRiWgiOYH,777698570338127872,0
66,,DressUpFash,FIDM: Hats off to Dame Maggie Smith on winning an Emmy for her role on DowntonAbbey! #Emmys https://t.co/tFrSSpd6Pm,777698570447314945,0
67,,Paulinamstv,la escena que le ponen a rami ???? ???? ????? #Emmys,777698570648649728,1
68,,megsandcowie,Does everyone at the #Emmys have an addiction to eye drops?,777698570803609600,0
69,,littleHeavyfoot,So many sculpted boobs at the #Emmys,777698571177095168,0
70,,EvDayaLilSeth,"Just to reiterate, I totally picked Matthew Rhys, Keri Russell &amp; @TheAmericansFX for the next 3 awards. #Emmys2016 #Emmys #EmmyAwards",777698570950541312,0
71,,qveencerseis,"Fate vincere Bob Odenkirk, grazie. #Emmys",777698571449688064,0
72,,httpsdeadrose,GANHE PDVR#Emmys,777698571416137728,1
73,,Drew_H_Shaw,So the Lead Actor in a Drama category gets clips shown but no other category does? WTF? #emmysfail #Emmys,777698571860582400,0
74,,wweirrdo,nao sabia q olivia pope tavagravida finalmente ela vai te o tao esperado filho com o presidente do usa https://t.co/XXvRvUTfGG,777698571374166016,0
75,,pjlove10,Wow that's some tough competition. #Emmys,777698572091346944,0
76,,whyfsmoak,rami tem que ganhar pq meu amorzinho merece #Emmys,777698571973959680,1
77,,lizcalvario,Win or Lose Rami is my winner!! #Emmys,777698571713785856,1
78,,viewzfromty,C'mon Rami!!!! #Emmys,777698571995021313,1
79,,mel_latapi,¬¬ :'( https://t.co/wI01vbRnBg,777698571223232512,0
80,,htownhoopsgrl,"Pleeeease win, Rami.... #Emmys",777698572452057092,1
81,,Kordeicmfome,vem Rami Malik amém #Emmys,777698572401770496,1
82,,londapatter1,"8NEWS: RT GMA: Rest in peace, David Bowie. 

#Emmys https://t.co/6AIbhsEBih",777698572619882496,0
83,,THEOFFICIALJASJ,Finally got home to watch the last part of the #Emmys,777698573349744641,0
84,,gabrielle_8888,Rami Malek ganha isso por favorrrrr #Emmys,777698572288557056,1
85,,mora555555,#MrRobot #Emmys #EmmysPorWarner,777698574087888896,0
86,,say_lih,"VAIIIIII RAMIIIIIIII, tô na torcida aqui de PomPom #MrRobot #Emmys #EmmyNaWarner",777698574083784708,0
87,,CookieQuebrado,Bxbbzbznzbfsb #Emmys,777698574180179969,0
88,,allyvelvet,PODE ENTRAR EMMY PARA RAMI MALEK #Emmys,777698574360543232,1
89,,fernandoandross,Bora Rami Malek! #Emmys,777698573861486596,1
90,,jannek12,Allison Janney for Queen Ruler of the Universe 2016. #Emmys,777698574461235200,0
91,,iinolga,Gemessss https://t.co/8aBrDPlJWK,777698574524002305,0
92,,JPReed92,So while on the road I found out #LEMONADE🍋 was robbed at the #Emmys and now I know it's time to https://t.co/aJZqmRLa05,777698573710274561,0
93,,rainequeim,TEAM RAMI #Emmys https://t.co/4Yr1I4fPMz,777698574427680772,1
94,,DylanYadav,Jimmy Kimmel is honestly an awful host... #Emmys,777698574582833152,0
95,,DressUpFash,InStyle: See the hottest looks from the 2016 #emmys red carpet: https://t.co/9T2IDuUNDr https://t.co/HXjMqYhQWT,777698574893248512,0
96,,worgensztern,BORA #Emmys,777698575048466432,0
97,,bonfimer,acho que dá Rami #Emmys,777698574708645888,1
98,,targaryennx,todo mundo torcendo pro rami vou torcer tb ljkkkkk #Emmys,777698575342010368,1
99,,LoBoogie,This show has been so long I forgot we already did Comedy. #Emmys,777698575643844608,0
100,,Iliketrains8008,Yes pls https://t.co/cAHA1SnkQk,777698574998052864,0
101,,ming_birdtail,Sarah Paulson muestra su amor a Holland Taylor en los #Emmys 2016 al ganar su premio,777698574804979712,0
102,,handcoversrouge,Praying for rami 🙏 #Emmys,777698575883104256,1
103,,BernardJPhilips,Listen to Rock by PrinceInTheCity #np on #SoundCloud PrinceInTheCity #Emmys2016 #Emmys #controlla #luv # https://t.co/1HhqbWp5zp,777698574901522434,0
104,,itsJessNYC,I wanted her to win ❤❤❤😍😍😍👏👏👏 #ladyinred love her https://t.co/ljtGbwf6W2,777698575883046913,0
105,,ColorOfChange,Congratulations to @KeyAndPeele on winning Outstanding Variety Sketch series! #Emmys https://t.co/dSN6IqsnKT,777698576063270913,0
106,,sasinshort,plzzzzz Ramiiiiiiiiiii #Emmys,777698575987961856,0
107,,BayShoreIsHome,BOOM! Miami police union calls for cop BOYCOTT of Dolphins games until ‘protests’ END! – The Right Scoop #Emmys @CNN https://t.co/Q6R5m3UMlJ,777698576516472832,0
108,,milenebf,Queria tanto que o Kevin Spacey ganhasse #emmys,777698576835153920,0
109,,BeckyZBlake1,É AQUI A RAMI MALEK TOUR? #MrRobot #Emmys,777698578177327104,1
110,,ParanaensedaCL,Estou aqui por Tatiana Maslany #Emmys,777698578672316416,0
111,,1armyruiz,"Todas son Stark, locas!!! #Emmys",777698578705907712,0
112,,outroren,E agr #Emmys #EmmyNaWarner,777698578848419840,0
113,,londapatter1,"8NEWS: RT GMA: Rest in peace, Prince.

#Emmys https://t.co/jMg5614wSm",777698576818376704,0
114,,ridikkullus,VAMO MR ROBOT #Emmys,777698578814885890,0
115,,MonarcaGrim,"Vamos para la 7ma temporada y ustedes usan una imagen de la primera, vamos avanzando #Emmys https://t.co/GzlrxwdIm7",777698578349293568,0
116,,raquelbritop,VAI PELO AMOR https://t.co/kpqLMTH9g9,777698578705809408,1
117,,30secondstospn,vejo o Liev e só me lembro dele em Wolverine UAHAUAHAUA #Emmys,777698579242704897,0
118,,butwevegotheart,Odenkirk is big competition. #Emmys,777698578760364032,0
119,,m1rn1c,Well deserved for this scene alone 🙌🏻🏆 https://t.co/dI6WYzIfx2,777698578651291648,0
120,,_sidequest,Vamos ao melhor ator de Drama #emmys,777698579297304576,0
121,,Fashionation10,"InStyle: Aww yeah, TherealTaraji pullin' a Beyonce with a mid-show costume change. #Emmys",777698579259490304,0
122,,alxndralam,Omg. That Alan Rickman clip in the 'In Memoriam' section hit me right in the FEELS 😭 I was not ready. #emmys ⚡️,777698579250946048,0
123,,BrenBlur,#Emmys,777698579397869570,1
124,,alx9vb,tomara que o rami ganhe eu to falando serio #Emmys,777698579855048705,1
125,,BrianChimino,Even the clips for Ray Donovan bore me. #Emmys,777698579540566017,0
126,,il2ill,ياربببب راممميييي #Emmys 😭😭😭,777698579842494464,0
127,,bibarral,😂😂 Nadamas no te retractes después como esta señora que es bipolar 🙈 #masterChefMx https://t.co/3lS9beV8pz,777698579959853056,0
128,,matineeidyll,"I'm in an airport so not watching the #Emmys, but I want to hear that the rest of the show was about Sarah Paulson never getting offstage",777698580123389952,0
129,,portalsagas2,"Tori Kelly nesse momento estava cantando ""Hallelujah"" em homenagem à todos os artistas que morreram em 2016. #Emmys https://t.co/7OUHdfB8Gg",777698579427262464,0
130,,FashStreetStyle,InStyle: See the hottest looks from the 2016 #Emmys red carpet here: https://t.co/htfpHKnddm,777698580542914560,0
131,,RedDevil09,❤ @ItsRamiMalek #emmys,777698580656164864,0
132,,mandareadinger,Toss up between Rami Malek and Kyle Chandler honestly.... #Emmys,777698581084049408,1
133,,_jessiie,AI MEU DEUS. Próxima categoria é a da @tatianamaslany 😬😬😬😬 #Emmys  #EmmyForMaslany,777698581281112064,0
134,,Skyboundfilm,"if Rami Malek wins this, the roof will be lifted #Emmys",777698581851537408,1
135,,theJKreview,"Allison Janney, legs for days #Emmys",777698582644322304,0
136,,DardoPetroli,ir al frente a toda costa! https://t.co/qYdnX9ZnNE,777698582539464704,0
137,,CJancelewicz,"Odenkirk always deserves to win, but he won't #Emmys",777698582522634240,0
138,,pabloM582,"Alan Rickman descansa en paz, siempre seras el profesor snape, que buen homenaje #Emmys #EmmysPorWarner",777698582895923200,0
139,,Fashionation10,FIDM: Thank you #GarryMarshall for bringing so much joy through film. #Emmys #RIP https://t.co/lZNQPNvKlh,777698583030235136,0
140,,vitoria_cf25,Elliot amor da minha vidaaaaaaaaaaaaa #Emmys,777698583114084352,1
141,,lexatinss,"RAMI, TE AMO, HACKEAME QUE ME  GUSTA #Emmys",777698583399305217,1
142,,Highonbarca,عاوزة اتقود واحد كده اجبشي https://t.co/Ez8a3VljAM,777698583688671233,0
143,,toddmal,I've heard of @ToriKelly but really didn't know anything about her. Voice of an angel. I'm now a fan. #emmys,777698583642460160,0
144,,ErikMAdams,"2—aw, c'mon! #Emmys #AVCTV https://t.co/CcBtjvHOqN",777698582812102656,0
145,,fedebareiro_,Que gane Rami Malek y se baje un fernet en el escenario #Emmys,777698584120680448,1
146,,lucianodemery,Meu premio: Bob Odenkirk. #Emmys,777698583512571904,0
147,,vester,Necesito que me pasen fotos de Kate McKinnon y Gwendoline Christie en los #Emmys,777698583961276418,0
148,,AxtO,Cruzando los dedos por Rami Malek. #MrRobot #Emmys,777698584493854720,1
149,,ReinaaRoyale,https://t.co/NxAxatKvYs,777698584695373827,0
150,,SergioRek,El escote no es para cualquiera #Emmys,777698585043472384,0
151,,AlexisUssery,Wow! Allison Janney looks incredible! #Emmys,777698585701867523,0
152,,diego_chaparro_,"No me importa que piense el resto, Game Of Thrones es y será siempre la mejor serie de drama #GameofThrones #Emmys",777698586779848704,0
153,,tomlinsonexist,MIREN QUE LINDOS CHAU https://t.co/G25C7kjm7n,777698587098673153,0
154,,intoyouflop,ENTREGA PRO RAMI LOGO CARALHO #Emmys,777698587593609217,1
155,,evannpeterz,torcendo pro rami por motivos dele ser meu crush  #Emmys,777698588142936064,1
156,,Biteoffharley,Boa noite pra quem acorda cedo amanhã mas está aq acompanhando o Emmy  #Emmys,777698587899813889,0
157,,caitlinmorton,Oh hello @AllisonBJanney looking Hot AF in that amazing dress and generally being one of my favourite humans. Can we be best friends? #Emmys,777698588184891393,0
158,,leohenriqs1,É agora em filhão quebra tudo caraio #RamiMalek #Emmys #EmmyNaWarner,777698588218499073,0
159,,tracy_salyer,BE STILL MY ❤️ #bae https://t.co/0aXAKFn3a3,777698588021391360,0
160,,fabyvaargas,VAMO RAMI MALEK #Emmys #EmmyNaWarner,777698588319215616,1
161,,farahotb1,Oh my goddddd 😢😢😢😢❤❤❤!! https://t.co/jWsTn0mz9s,777698588205916160,0
162,,lovaticstrouxie,minha vida é esse gif https://t.co/s30E34MNnI,777698588172382208,0
163,,himymswft,VEM EMMY PRO RAMI #Emmys,777698588537290752,1
164,,GailKimGroupie,I guess the Emmys still don't think wrestlers are TV Entertainers. #RipChyna #Emmys,777698588705091584,0
165,,RethabsR,🙌👑 https://t.co/1smwGdN3UP,777698589682372608,0
166,,MarvelftTWD,QUE GANE RAMI SE LO MERECE CARAJO #Emmys,777698590647062528,1
167,,LucasTeofilo03,"Vai Rami Malek, pega teu prêmio. #Emmys #EmmyNaWarner",777698590944813056,1
168,,acker_ed,"Henry Winkler remembers Garry Marshall at the #Emmys: ""He was loyal, he had generosity of spirit and knowledge"" … https://t.co/26SQGGxdVB",777698590848344064,0
169,,brunomcdores,OMG! Sorry Meghan but it's true!! https://t.co/B9a65iDt2z,777698591607513088,0
170,,joannaraeb,"Oh well Dad, I guess we need to look forward to nom #5. Over to you @amorteamore @TomSchnauz @petergould! https://t.co/mNotMkoRye",777698591687208961,0
171,,taescardoso,é agr q o rami ganha #emmys,777698592073146369,1
172,,KevinCalderon77,El mae the The Robot y Saul mys favoritos #Emmys,777698592404275204,0
173,,Colin_XTHH,"seriously, am I the only one who noticed Juan Gabriel was not mentioned in Memoriam at the Emmys?? #Emmys #NoJuanGabirel",777698592727248896,0
174,,DontCallMeLex_,Idk who will win this one. Kevin Spacey? Liev Schreiber? Prob that Mr. Robot guy #Emmys,777698592886657024,0
175,,MzZatanna,#Emmys @TheEmmys 🖕🏽🖕🏽🖕🏽🖕🏽🖕🏽🐝🐝🐝,777698593792598017,0
176,,ameliepooulain,vamo lá rami \o/ #Emmys #EmmyNaWarner,777698594006654976,1
177,,DanielaglzI,Amazing and beautiful version of hallelujah @torikelly you're the best 👏 ❤ #Emmys,777698593729830914,0
178,,rcksws,VAI RAMI #Emmys,777698595134967808,1
179,,giorgio_walker,GO RAMIII #Emmys #MrRobot #RamiMalek,777698595873099776,0
180,,Quis44,My boo looking good tonight https://t.co/4EbXvbtpA5,777698595763949569,0
181,,FashionInspire3,"thecoveteur: An outfit AND hair change? We see you, TherealTaraji. #Emmys https://t.co/uD7PzJct4o",777698595847929856,0
182,,AshleyDBurton,Just stomp on my heart why don't you https://t.co/1jzKTJ0Pdx,777698595902455808,0
183,,anthonyJAG_,yo JAJAJAJAJAJAJJAJA  :)))) https://t.co/mUAdYubr0u,777698596024123392,0
184,,bosho0,احمد فرحات ! https://t.co/VtJMjzNkfb,777698596502241280,0
185,,TheTJHelm,Odenkirk deserves this. #Emmys,777698596728766465,0
186,,TVshowTweety,"The guitarist/singer sounded beautiful during the In Memoriam at the #Emmys

#Emmysnation
#Emmys2016",777698597039054848,0
187,,johaleesi,That in memoriam joke was not funny @jimmykimmel #Emmys,777698597403959296,0
188,,carlafowler16,Any time now #Emmys @tatianamaslany @OrphanBlack #EmmyForMaslany https://t.co/fXDjQAIbXw,777698596854521856,0
189,,JversusTW,Je croise tout les doigts de mon corps pour Tatiana Maslany ! #Emmys,777698597022359552,0
190,,CityPretzelDC,As well as #Fleabag. It's a very inappropriate sexual evening of TV and baking sweet buns. More gay than the #Emmys,777698597584404480,0
191,,bruna_pazzini,Jesuis agora vai #Emmys,777698599505453056,1
192,,MarkNewberryMD,Congratulations @JohnOliverMP #Emmys,777698599102738433,0
193,,suzani_morena,Será que o Mr. Robot vai ganhar?!! #Emmys,777698599459258368,1
194,,smoakswan,EM NOME DE JESUS RAMI MALEK VEM #Emmys https://t.co/HQTkCjfzyI,777698599102742528,1
195,,starkingsx,TO TREMENDO O RAMI TEM QUE GANHAR #Emmys,777698599459229696,1
196,,domainer78,Scary or evil? https://t.co/QrbHw0Ayf2,777698600025415681,0
197,,rosanairisff,MATTHEW RHYS EU ACREDITO #Emmys,777698600621146114,1
198,,volKEANU,Well. Undisputed. But Lena Headey :(((( https://t.co/JQGddZttcq,777698601363382273,0
199,,whatsliars,VAI RAMI PORRA #Emmys,777698601686491136,1
200,,ChristineHosana,You're welcome! https://t.co/rWQ91ioevp,777698600952340482,0
201,,ItsNasB,Tori Kelly's voice is beautiful. Her rendition of Hallelujah was soothing. #Emmys,777698603695542272,0
202,,gin313,"Love the song, but I always wonder if ppl have listened to the lyrics before using as tribute music. https://t.co/dEhpsDkRaK",777698603729051648,0
203,,httpsdeadrose,Se o rami ganhar eu vou chorar#Emmys,777698604362395648,1
204,,strangxethings,NENÉNS https://t.co/ByTZ5lVdBq,777698603125137408,0
205,,AnaCNicolau,!!!!!!!!!!!!!!! https://t.co/LieQ5wAV9j,777698604962177024,0
206,,therebeccasun,Will win: Kevin Spacey. Should win: Rami Malek. Don't dare to hope will win: Matthew Rhys #Emmys,777698605238935552,1
207,,feerCamat,LA VIDA NO ES JUSTA 😲😲 https://t.co/a9zYsWubrs,777698604727361537,0
208,,trinidmgirl,KEVIN RAMI SÓ VEM #Emmys,777698605570326528,1
209,,TVandCrumpets,"*please be Rami Malek, please be Rami Malek, please be Rami Malek* #Emmys",777698606035800068,1
210,,PatiLauren,"This is fantastic &amp; well deserved:)
#Emmys @Bloodline @netflix #BenMendelsohn #Florida https://t.co/9AIebzBA9a",777698605478010880,0
211,,omgitsmeli,Really hope @ItsRamiMalek wins for Mr. Robot #Emmys,777698605960269824,0
212,,softmuerte,segundo fontes Tatiana vai se aposentar se nao ganhar esse ano #Emmys,777698606254096392,1
213,,Oursweet_,Mais tiros me atingindo #Emmys https://t.co/or0hNfbhAX,777698606023335936,0
214,,sidneialins,rami malek eu escolhi te amar #Emmys,777698606493171713,1
215,,mdq222,Vamooooooos Bob!!!! #Emmys,777698606757322752,0
216,,CloseToRih,The lady looks snatched and confident rocking that dress. #Emmys,777698607441055744,0
217,,AbrissErik,literally no one has ever watched RAY DONOVAN #Emmys,777698607696785408,0
218,,pablitovegac,"Estando Peter Dinklage, Kit Harington y Michael Kelly... no puedo premiar a ninguno. #Emmys",777698607818477568,0
219,,TheMattWilstein,"""The short answer to that is no and the slightly longer answer is no of course I fucking don't."" #Emmys https://t.co/ODHbsHQpaO",777698607839313920,0
220,,papelpop,"Vai, Rami! #Emmys",777698608158216192,1
221,,An__DreS__,Winter is coming! Game of Thrones is my choice for best drama series in @CoxComm's #Emmys poll! https://t.co/yWCXxrXXMA,777698608250494976,0
222,,hittingrefresh,Yesssss Alison Janney. Love her #Emmys,777698608527257600,0
223,,Kristiturnquist,"Man, I'd love to see Matthew Rhys win. #Emmys",777698608279760896,1
224,,steenfox,She was even more gorgeous &amp; snatched in person.  https://t.co/ZPfY2PS3CP,777698608460075008,0
225,,tylerpseyz,SE O RAMI MALEK NAO GANHAR VO FAZER PANELAÇO #Emmys,777698607566913537,0
226,,shadakies,E A @emiliaclarke !? #Emmys,777698608875466752,0
227,,JakkiMac21,They always give more attention to the drama actors but I personally believe comedy is much harder.  #Emmys,777698609156546565,0
228,,PaitoCp,Team Bob #Emmys,777698609143877632,0
229,,gomescyruz,DONO DO US https://t.co/HcGJw305aM,777698608951025664,0
230,,G105radio,Such an incredible performance by @torikelly on the #Emmys !,777698608770678784,0
231,,jayoncz,expectativa / realidade #emmys https://t.co/RzLBtkL5F8,777698608670015489,0
232,,FashionInspire3,InStyle: See the hottest looks from the 2016 #Emmys red carpet here: https://t.co/uolyPMYchJ,777698610112827392,0
233,,FashionInspire3,"InStyle: Aww yeah, TherealTaraji pullin' a Beyonce with a mid-show costume change. #Emmys",777698611899592704,0
234,,somewhatalady,In memoriam jokes are probably the worst jokes made on any award show. They're always cringeworthy. #Emmys,777698612012658688,0
235,,ornelaspaloma,Até hoje não vi mr robot. #Emmys,777698612335771648,0
236,,Flo_Rocher,OMG ITS HAPPENING IT IS THE TIME #Emmys,777698612532875264,0
237,,RealitySocial,#Emmys https://t.co/KqUUuVDXhG,777698611484295168,0
238,,RazRoadWarrior,KYLE CHANDLER OR RIOT #Emmys,777698612444823553,0
239,,KnitsByChris,I was all good watching the In Memoriam section at the #Emmys until I saw Alan Rickman.  #RIPsnape https://t.co/crgdVR9QWu,777698612172259331,0
240,,mysuunandstars,@jilylionheart omg https://t.co/Ewh6u6qiX1,777698612490997764,0
241,,whatser_revenge,"Ya leí que Bowie bebé salió en #Emmys 
Saquen la imagen, plis. Así lloraré poquito",777698613455486976,0
242,,notperrysboat,ela realizou meus sonhos #Emmys https://t.co/T20Oxb2lgL,777698612151197700,0
243,,adiiborisov1994,"yxr
#من_منطلق_خبرتي_بالحياه
#Emmys
#متصدر_لاني_اتحادي https://t.co/hPBgU0nEpU",777698612679733248,0
244,,annafacci,This is one minute and 28 seconds of Kate McKinnon awkwardly responding to this reporter's veiled sexism 😂😂😂 https://t.co/ivZa3loIGQ,777698613447110656,0
245,,desabilitada,Eu só quero ver a Viola ganhando mais um prêmio e fazendo um discurso lacrador #Emmys,777698613275353088,0
246,,FangirlStreet,PETER TENIA QUE GANAR https://t.co/1eJqYj5CzB,777698612168065024,0
247,,parthona98,ValaAfshar : Legends RIP #Emmys 2016 https://t.co/n39BPs9PR5 (via Twitter https://t.co/7gSVRdhaEC) https://t.co/ld876uxfEt,777698611677294593,0
248,,kh8leesi,me rn because none of my babies got an award... a moment of silence. https://t.co/6dEL2bEA9T,777698612876812289,0
249,,stfukae,Rami #Emmys https://t.co/LUmKbFj7kS,777698612126052352,1
250,,estadoagridulce,RAMI PLS PLS JHASKJDHDHS MORIRÉ #EMMYS.,777698613623398400,0
251,,ADRlANASimancas,Yuppiiiii https://t.co/2Et9OnKnfB,777698613149310976,0
252,,lessentielest,Matthew Rhys devi vincere #Emmys,777698613908611072,1
253,,BobbyofHomewood,Sterling K. Brown as Christopher Darden was absolutely the best part of the OJ Simpson miniseries. Mesmerizing. #Emmys,777698614625890304,0
254,,NerdHeather,A lot. Now you don't have to read the article you're welcome. #Emmys https://t.co/2FpNyZDD1t,777698615171031040,0
255,,Zeluk3,Se o Rami não ganhar eu nem sei o que eu faço #Emmys,777698615636746240,1
